      "[I 2026-07-02 16:30:42,207] Trial 0 finished with value: 0.04084428197125157 and parameters: {'reservoir_size': 75, 'spectral_radius': 1.4507143064099162, 'ar_lags': 10, 'foundation_window': 16, 'regressor_type': 'Ridge', 'reg_alpha': 21.76624112345367, 'aci_step_size': 0.12421185223120967, 'oob_split_ratio': 0.7770181444490114}. Best is trial 0 with value: 0.04084428197125157.\n",
      "[I 2026-07-02 16:30:42,300] Trial 1 finished with value: 0.030863019640679324 and parameters: {'reservoir_size': 5, 'spectral_radius': 1.4699098521619942, 'ar_lags': 11, 'foundation_window': 7, 'regressor_type': 'Lasso', 'reg_alpha': 2.6079656598095835, 'aci_step_size': 0.092069553542002, 'oob_split_ratio': 0.6728072850495105}. Best is trial 1 with value: 0.030863019640679324.\n",
      "[I 2026-07-02 16:30:42,396] Trial 2 finished with value: 0.0184720029954737 and parameters: {'reservoir_size': 123, 'spectral_radius': 0.6394938606520418, 'ar_lags': 5, 'foundation_window': 11, 'regressor_type': 'ElasticNet', 'reg_alpha': 2.442886696734996, 'aci_step_size': 0.12255876808378806, 'oob_split_ratio': 0.6116126031799994}. Best is trial 2 with value: 0.0184720029954737.\n",
      "[I 2026-07-02 16:30:42,520] Trial 3 finished with value: 0.06146493575354508 and parameters: {'reservoir_size': 122, 'spectral_radius': 0.6705241236872915, 'ar_lags': 2, 'foundation_window': 23, 'regressor_type': 'Ridge', 'reg_alpha': 0.18349072049055454, 'aci_step_size': 0.14000427503730983, 'oob_split_ratio': 0.7100381234349002}. Best is trial 2 with value: 0.0184720029954737.\n",
      "[I 2026-07-02 16:30:42,596] Trial 4 finished with value: 0.011055285658054149 and parameters: {'reservoir_size': 25, 'spectral_radius': 0.9951769101112702, 'ar_lags': 2, 'foundation_window': 23, 'regressor_type': 'ElasticNet', 'reg_alpha': 2.533074654001447, 'aci_step_size': 0.11387495307522313, 'oob_split_ratio': 0.6462136138813818}. Best is trial 4 with value: 0.011055285658054149.\n",
      "[I 2026-07-02 16:30:42,818] Trial 5 finished with value: 0.03597470918497814 and parameters: {'reservoir_size': 194, 'spectral_radius': 1.2751328233611146, 'ar_lags': 12, 'foundation_window': 22, 'regressor_type': 'ElasticNet', 'reg_alpha': 0.3380273704712439, 'aci_step_size': 0.018593184893002233, 'oob_split_ratio': 0.6813325826908161}. Best is trial 4 with value: 0.011055285658054149.\n",
      "[I 2026-07-02 16:30:42,897] Trial 6 finished with value: 0.025143478188599067 and parameters: {'reservoir_size': 78, 'spectral_radius': 0.7713490317738959, 'ar_lags': 11, 'foundation_window': 10, 'regressor_type': 'ElasticNet', 'reg_alpha': 14.625327121207683, 'aci_step_size': 0.024164622299156457, 'oob_split_ratio': 0.8467217341501293}. Best is trial 4 with value: 0.011055285658054149.\n",
      "[I 2026-07-02 16:30:43,047] Trial 7 finished with value: 0.030154113884069352 and parameters: {'reservoir_size': 155, 'spectral_radius': 0.6987156815341724, 'ar_lags': 2, 'foundation_window': 20, 'regressor_type': 'Lasso', 'reg_alpha': 0.15843250684388685, 'aci_step_size': 0.0781084884234118, 'oob_split_ratio': 0.6289672648812824}. Best is trial 4 with value: 0.011055285658054149.\n",
      "[I 2026-07-02 16:30:43,175] Trial 8 finished with value: 0.044927796566703225 and parameters: {'reservoir_size': 173, 'spectral_radius': 1.123298126827558, 'ar_lags': 5, 'foundation_window': 4, 'regressor_type': 'Lasso', 'reg_alpha': 5.257127272786866, 'aci_step_size': 0.17857042108950205, 'oob_split_ratio': 0.7180537312904873}. Best is trial 4 with value: 0.011055285658054149.\n",
      "[I 2026-07-02 16:30:43,257] Trial 9 finished with value: 0.03974635229917614 and parameters: {'reservoir_size': 24, 'spectral_radius': 1.213244787222995, 'ar_lags': 10, 'foundation_window': 15, 'regressor_type': 'Ridge', 'reg_alpha': 1.4253462720121493, 'aci_step_size': 0.014829634081378086, 'oob_split_ratio': 0.6269728567483261}. Best is trial 4 with value: 0.011055285658054149.\n",
      "[I 2026-07-02 16:30:43,361] Trial 10 finished with value: 0.015139884087115132 and parameters: {'reservoir_size': 54, 'spectral_radius': 0.9733273214546685, 'ar_lags': 7, 'foundation_window': 17, 'regressor_type': 'ElasticNet', 'reg_alpha': 0.6474637253710466, 'aci_step_size': 0.1923564417296298, 'oob_split_ratio': 0.7910494221217524}. Best is trial 4 with value: 0.011055285658054149.\n",
      "[I 2026-07-02 16:30:43,456] Trial 11 finished with value: 0.015609270430370204 and parameters: {'reservoir_size': 40, 'spectral_radius': 0.9770692857939176, 'ar_lags': 7, 'foundation_window': 18, 'regressor_type': 'ElasticNet', 'reg_alpha': 0.6726259596102329, 'aci_step_size': 0.197271750352024, 'oob_split_ratio': 0.788661652443113}. Best is trial 4 with value: 0.011055285658054149.\n",
      "[I 2026-07-02 16:30:43,546] Trial 12 finished with value: 0.007973087026223648 and parameters: {'reservoir_size': 64, 'spectral_radius': 0.9414849771577115, 'ar_lags': 7, 'foundation_window': 24, 'regressor_type': 'ElasticNet', 'reg_alpha': 0.7386521405676132, 'aci_step_size': 0.15813370564447923, 'oob_split_ratio': 0.7692045145239038}. Best is trial 12 with value: 0.007973087026223648.\n",
      "[I 2026-07-02 16:30:43,641] Trial 13 finished with value: 0.007972076260952856 and parameters: {'reservoir_size': 80, 'spectral_radius': 0.9128640659788477, 'ar_lags': 4, 'foundation_window': 24, 'regressor_type': 'ElasticNet', 'reg_alpha': 6.32231147826009, 'aci_step_size': 0.16198528455732525, 'oob_split_ratio': 0.750718086785229}. Best is trial 13 with value: 0.007972076260952856.\n",
      "[I 2026-07-02 16:30:43,756] Trial 14 finished with value: 0.007971290538447036 and parameters: {'reservoir_size': 100, 'spectral_radius': 0.8390141444705963, 'ar_lags': 5, 'foundation_window': 24, 'regressor_type': 'ElasticNet', 'reg_alpha': 40.310497719087785, 'aci_step_size': 0.16309196092672903, 'oob_split_ratio': 0.7544186094391974}. Best is trial 14 with value: 0.007971290538447036.\n",
      "[I 2026-07-02 16:30:43,898] Trial 15 finished with value: 0.014688858548475995 and parameters: {'reservoir_size': 111, 'spectral_radius': 0.5362376881198971, 'ar_lags': 4, 'foundation_window': 20, 'regressor_type': 'ElasticNet', 'reg_alpha': 42.7434863793072, 'aci_step_size': 0.15945929563629974, 'oob_split_ratio': 0.7428932641117122}. Best is trial 14 with value: 0.007971290538447036.\n",
      "[I 2026-07-02 16:30:44,037] Trial 16 finished with value: 0.014093387791026271 and parameters: {'reservoir_size': 95, 'spectral_radius': 0.8256079873759862, 'ar_lags': 4, 'foundation_window': 20, 'regressor_type': 'ElasticNet', 'reg_alpha': 8.376890219270617, 'aci_step_size': 0.16502319228955054, 'oob_split_ratio': 0.8131701248118853}. Best is trial 14 with value: 0.007971290538447036.\n",
      "[I 2026-07-02 16:30:44,168] Trial 17 finished with value: 0.007971475174250146 and parameters: {'reservoir_size': 137, 'spectral_radius': 0.842199359332126, 'ar_lags': 6, 'foundation_window': 24, 'regressor_type': 'ElasticNet', 'reg_alpha': 42.94842455538129, 'aci_step_size': 0.14258911675137748, 'oob_split_ratio': 0.7475189155897112}. Best is trial 14 with value: 0.007971290538447036.\n",
      "[I 2026-07-02 16:30:44,348] Trial 18 finished with value: 0.014417450238503346 and parameters: {'reservoir_size': 146, 'spectral_radius': 0.5236954115058322, 'ar_lags': 8, 'foundation_window': 21, 'regressor_type': 'Lasso', 'reg_alpha': 40.94001749930953, 'aci_step_size': 0.05877431840419129, 'oob_split_ratio': 0.725113673938366}. Best is trial 14 with value: 0.007971290538447036.\n",
      "[I 2026-07-02 16:30:44,534] Trial 19 finished with value: 0.04925381845186579 and parameters: {'reservoir_size': 146, 'spectral_radius': 0.8324490859335177, 'ar_lags': 6, 'foundation_window': 13, 'regressor_type': 'Ridge', 'reg_alpha': 19.561885869354157, 'aci_step_size': 0.1398850684557224, 'oob_split_ratio': 0.826064117013573}. Best is trial 14 with value: 0.007971290538447036.\n",
      "[I 2026-07-02 16:30:44,718] Trial 20 finished with value: 0.013593917134179323 and parameters: {'reservoir_size': 117, 'spectral_radius': 1.0995362851153523, 'ar_lags': 8, 'foundation_window': 18, 'regressor_type': 'ElasticNet', 'reg_alpha': 46.478592094622805, 'aci_step_size': 0.09480118160550688, 'oob_split_ratio': 0.6820718454289916}. Best is trial 14 with value: 0.007971290538447036.\n",
      "[I 2026-07-02 16:30:44,897] Trial 21 finished with value: 0.007972076260952856 and parameters: {'reservoir_size': 94, 'spectral_radius': 0.8922554958727626, 'ar_lags': 4, 'foundation_window': 24, 'regressor_type': 'ElasticNet', 'reg_alpha': 9.196048413850825, 'aci_step_size': 0.14825119457320246, 'oob_split_ratio': 0.7498683930369459}. Best is trial 14 with value: 0.007971290538447036.\n",
      "[I 2026-07-02 16:30:45,006] Trial 22 finished with value: 0.007971290538447036 and parameters: {'reservoir_size': 97, 'spectral_radius': 0.7534851236496152, 'ar_lags': 5, 'foundation_window': 24, 'regressor_type': 'ElasticNet', 'reg_alpha': 25.25254223581972, 'aci_step_size': 0.17608881176000263, 'oob_split_ratio': 0.7525720700980351}. Best is trial 14 with value: 0.007971290538447036.\n",
      "[I 2026-07-02 16:30:45,161] Trial 23 finished with value: 0.013411272512242669 and parameters: {'reservoir_size': 137, 'spectral_radius': 0.7472786673568734, 'ar_lags': 6, 'foundation_window': 22, 'regressor_type': 'ElasticNet', 'reg_alpha': 22.51045105715679, 'aci_step_size': 0.17875712750027703, 'oob_split_ratio': 0.704273782737364}. Best is trial 14 with value: 0.007971290538447036.\n",
      "[I 2026-07-02 16:30:45,310] Trial 24 finished with value: 0.014662401654753928 and parameters: {'reservoir_size': 100, 'spectral_radius': 0.5958209364737007, 'ar_lags': 5, 'foundation_window': 19, 'regressor_type': 'ElasticNet', 'reg_alpha': 28.47758081762629, 'aci_step_size': 0.17901571969856006, 'oob_split_ratio': 0.762350000849809}. Best is trial 14 with value: 0.007971290538447036.\n",
      "[I 2026-07-02 16:30:45,448] Trial 25 finished with value: 0.013401793899034809 and parameters: {'reservoir_size': 169, 'spectral_radius': 0.8203878144648425, 'ar_lags': 3, 'foundation_window': 22, 'regressor_type': 'ElasticNet', 'reg_alpha': 13.301040636702474, 'aci_step_size': 0.134739661926019, 'oob_split_ratio': 0.7308423506959746}. Best is trial 14 with value: 0.007971290538447036.\n",
      "[I 2026-07-02 16:30:45,608] Trial 26 finished with value: 0.007973194503979394 and parameters: {'reservoir_size': 132, 'spectral_radius': 1.0461359525594478, 'ar_lags': 6, 'foundation_window': 24, 'regressor_type': 'ElasticNet', 'reg_alpha': 30.929438802253927, 'aci_step_size': 0.11013944234130954, 'oob_split_ratio': 0.8022788182567643}. Best is trial 14 with value: 0.007971290538447036.\n",
      "[I 2026-07-02 16:30:45,761] Trial 27 finished with value: 0.014645607058132962 and parameters: {'reservoir_size': 105, 'spectral_radius': 0.7233752952235806, 'ar_lags': 8, 'foundation_window': 21, 'regressor_type': 'ElasticNet', 'reg_alpha': 13.369526609534283, 'aci_step_size': 0.1724451914528157, 'oob_split_ratio': 0.6970021118359471}. Best is trial 14 with value: 0.007971290538447036.\n",
      "[I 2026-07-02 16:30:45,855] Trial 28 finished with value: 0.013407432086320047 and parameters: {'reservoir_size': 86, 'spectral_radius': 0.6104184963575423, 'ar_lags': 3, 'foundation_window': 22, 'regressor_type': 'Lasso', 'reg_alpha': 47.273634111974594, 'aci_step_size': 0.1495964593262574, 'oob_split_ratio': 0.7454668831547583}. Best is trial 14 with value: 0.007971290538447036.\n",
      "[I 2026-07-02 16:30:45,979] Trial 29 finished with value: 0.040116074841550976 and parameters: {'reservoir_size': 65, 'spectral_radius': 0.8697030210903287, 'ar_lags': 9, 'foundation_window': 15, 'regressor_type': 'Ridge', 'reg_alpha': 22.185129848815283, 'aci_step_size': 0.1911711678091193, 'oob_split_ratio': 0.7740710287928131}. Best is trial 14 with value: 0.007971290538447036.\n",
      "[I 2026-07-02 16:30:46,186] Trial 30 finished with value: 0.05995056685765055 and parameters: {'reservoir_size': 167, 'spectral_radius': 1.374998126458956, 'ar_lags': 6, 'foundation_window': 19, 'regressor_type': 'Ridge', 'reg_alpha': 30.827657695944474, 'aci_step_size': 0.1275513636603137, 'oob_split_ratio': 0.7870638585814898}. Best is trial 14 with value: 0.007971290538447036.\n",
      "[I 2026-07-02 16:30:46,284] Trial 31 finished with value: 0.007973298238162285 and parameters: {'reservoir_size': 80, 'spectral_radius': 0.9002477862292751, 'ar_lags': 5, 'foundation_window': 24, 'regressor_type': 'ElasticNet', 'reg_alpha': 5.377562150261681, 'aci_step_size': 0.15273578757567094, 'oob_split_ratio': 0.7605992239526401}. Best is trial 14 with value: 0.007971290538447036.\n",
      "[I 2026-07-02 16:30:46,376] Trial 32 finished with value: 0.007972722045056849 and parameters: {'reservoir_size': 66, 'spectral_radius': 0.8131845937809308, 'ar_lags': 3, 'foundation_window': 24, 'regressor_type': 'ElasticNet', 'reg_alpha': 8.618784754096422, 'aci_step_size': 0.16661994046617096, 'oob_split_ratio': 0.7357259792915358}. Best is trial 14 with value: 0.007971290538447036.\n",
      "[I 2026-07-02 16:30:46,478] Trial 33 finished with value: 0.01106429727104507 and parameters: {'reservoir_size': 90, 'spectral_radius': 1.05159394725858, 'ar_lags': 4, 'foundation_window': 23, 'regressor_type': 'ElasticNet', 'reg_alpha': 5.205357239405075, 'aci_step_size': 0.18318615142972344, 'oob_split_ratio': 0.7575587201695946}. Best is trial 14 with value: 0.007971290538447036.\n",
      "[I 2026-07-02 16:30:46,594] Trial 34 finished with value: 0.014645961465450023 and parameters: {'reservoir_size': 126, 'spectral_radius': 0.9163461283854362, 'ar_lags': 5, 'foundation_window': 21, 'regressor_type': 'ElasticNet', 'reg_alpha': 17.60216982466902, 'aci_step_size': 0.12916632896786778, 'oob_split_ratio': 0.7788227810539102}. Best is trial 14 with value: 0.007971290538447036.\n",
      "[I 2026-07-02 16:30:46,708] Trial 35 finished with value: 0.01106719186001213 and parameters: {'reservoir_size': 111, 'spectral_radius': 0.7745213634536056, 'ar_lags': 4, 'foundation_window': 23, 'regressor_type': 'ElasticNet', 'reg_alpha': 30.658419873111736, 'aci_step_size': 0.1451525774671366, 'oob_split_ratio': 0.7212243323138552}. Best is trial 14 with value: 0.007971290538447036.\n",
      "[I 2026-07-02 16:30:46,797] Trial 36 finished with value: 0.01340256452629747 and parameters: {'reservoir_size': 50, 'spectral_radius': 0.6555706489105266, 'ar_lags': 5, 'foundation_window': 22, 'regressor_type': 'ElasticNet', 'reg_alpha': 3.7794886287453755, 'aci_step_size': 0.10907926990229427, 'oob_split_ratio': 0.6955877430114975}. Best is trial 14 with value: 0.007971290538447036.\n",
      "[I 2026-07-02 16:30:46,942] Trial 37 finished with value: 0.011066446792892233 and parameters: {'reservoir_size': 187, 'spectral_radius': 1.0311134106516995, 'ar_lags': 3, 'foundation_window': 23, 'regressor_type': 'Lasso', 'reg_alpha': 12.238523247748128, 'aci_step_size': 0.12009280783483157, 'oob_split_ratio': 0.6581625540773453}. Best is trial 14 with value: 0.007971290538447036.\n",
      "[I 2026-07-02 16:30:47,030] Trial 38 finished with value: 0.050380273748561466 and parameters: {'reservoir_size': 71, 'spectral_radius': 0.7130802702063178, 'ar_lags': 6, 'foundation_window': 21, 'regressor_type': 'ElasticNet', 'reg_alpha': 0.10167185503295205, 'aci_step_size': 0.16908815493416696, 'oob_split_ratio': 0.7384740902985706}. Best is trial 14 with value: 0.007971290538447036.\n",
      "[I 2026-07-02 16:30:47,130] Trial 39 finished with value: 0.007972075343551802 and parameters: {'reservoir_size': 82, 'spectral_radius': 0.8550974246291171, 'ar_lags': 7, 'foundation_window': 24, 'regressor_type': 'ElasticNet', 'reg_alpha': 1.3598138693705446, 'aci_step_size': 0.15585901949740014, 'oob_split_ratio': 0.7565811811564691}. Best is trial 14 with value: 0.007971290538447036.\n",
      "[I 2026-07-02 16:30:47,221] Trial 40 finished with value: 0.05231151907584903 and parameters: {'reservoir_size': 1, 'spectral_radius': 0.7748251656588236, 'ar_lags': 7, 'foundation_window': 23, 'regressor_type': 'Ridge', 'reg_alpha': 1.0492291066285209, 'aci_step_size': 0.10014788200088423, 'oob_split_ratio': 0.8064997573982277}. Best is trial 14 with value: 0.007971290538447036.\n",
      "[I 2026-07-02 16:30:47,325] Trial 41 finished with value: 0.007971290538447036 and parameters: {'reservoir_size': 80, 'spectral_radius': 0.8653887033022156, 'ar_lags': 5, 'foundation_window': 24, 'regressor_type': 'ElasticNet', 'reg_alpha': 2.1519780533268413, 'aci_step_size': 0.15950324425998436, 'oob_split_ratio': 0.7531651862305402}. Best is trial 14 with value: 0.007971290538447036.\n",
      "[I 2026-07-02 16:30:47,433] Trial 42 finished with value: 0.0283848750521266 and parameters: {'reservoir_size': 104, 'spectral_radius': 0.8659772285820894, 'ar_lags': 6, 'foundation_window': 8, 'regressor_type': 'ElasticNet', 'reg_alpha': 1.6516784813635854, 'aci_step_size': 0.13525686234998285, 'oob_split_ratio': 0.7679655440735025}. Best is trial 14 with value: 0.007971290538447036.\n",
      "[I 2026-07-02 16:30:47,528] Trial 43 finished with value: 0.026000530906200917 and parameters: {'reservoir_size': 54, 'spectral_radius': 0.9574798576679345, 'ar_lags': 7, 'foundation_window': 22, 'regressor_type': 'ElasticNet', 'reg_alpha': 0.40197161213679444, 'aci_step_size': 0.18783738597864355, 'oob_split_ratio': 0.7076350485425833}. Best is trial 14 with value: 0.007971290538447036.\n",
      "[I 2026-07-02 16:30:47,623] Trial 44 finished with value: 0.055584823014273345 and parameters: {'reservoir_size': 36, 'spectral_radius': 0.6858138699180691, 'ar_lags': 5, 'foundation_window': 3, 'regressor_type': 'ElasticNet', 'reg_alpha': 1.9596036926793405, 'aci_step_size': 0.15780058780519918, 'oob_split_ratio': 0.7791873934575038}. Best is trial 14 with value: 0.007971290538447036.\n",
      "[I 2026-07-02 16:30:47,725] Trial 45 finished with value: 0.007971823417619577 and parameters: {'reservoir_size': 86, 'spectral_radius': 0.783150896722056, 'ar_lags': 9, 'foundation_window': 24, 'regressor_type': 'ElasticNet', 'reg_alpha': 3.1959143861339814, 'aci_step_size': 0.1750114974899709, 'oob_split_ratio': 0.7554467872302009}. Best is trial 14 with value: 0.007971290538447036.\n",
      "[I 2026-07-02 16:30:47,903] Trial 46 finished with value: 0.014691663171393643 and parameters: {'reservoir_size': 120, 'spectral_radius': 0.7781494505150575, 'ar_lags': 12, 'foundation_window': 20, 'regressor_type': 'Lasso', 'reg_alpha': 3.252341404506114, 'aci_step_size': 0.173102991490705, 'oob_split_ratio': 0.7149223510865723}. Best is trial 14 with value: 0.007971290538447036.\n",
      "[I 2026-07-02 16:30:47,999] Trial 47 finished with value: 0.011067248480852656 and parameters: {'reservoir_size': 75, 'spectral_radius': 0.6344071902842163, 'ar_lags': 9, 'foundation_window': 23, 'regressor_type': 'ElasticNet', 'reg_alpha': 2.6300358101697343, 'aci_step_size': 0.19860410988237068, 'oob_split_ratio': 0.7302394988285763}. Best is trial 14 with value: 0.007971290538447036.\n",
      "[I 2026-07-02 16:30:48,103] Trial 48 finished with value: 0.02157637427570015 and parameters: {'reservoir_size': 114, 'spectral_radius': 0.9986033003749586, 'ar_lags': 9, 'foundation_window': 23, 'regressor_type': 'ElasticNet', 'reg_alpha': 0.38776672706664306, 'aci_step_size': 0.14414527139458577, 'oob_split_ratio': 0.7962316790273799}. Best is trial 14 with value: 0.007971290538447036.\n",
      "[I 2026-07-02 16:30:48,255] Trial 49 finished with value: 0.014643827575946608 and parameters: {'reservoir_size': 158, 'spectral_radius': 0.584767583357793, 'ar_lags': 11, 'foundation_window': 21, 'regressor_type': 'ElasticNet', 'reg_alpha': 38.231881743939596, 'aci_step_size': 0.17219071820714826, 'oob_split_ratio': 0.7447752524702871}. Best is trial 14 with value: 0.007971290538447036.\n",
      "[I 2026-07-02 16:30:48,357] Trial 50 finished with value: 0.01466246972964904 and parameters: {'reservoir_size': 94, 'spectral_radius': 0.7402372359032179, 'ar_lags': 10, 'foundation_window': 19, 'regressor_type': 'ElasticNet', 'reg_alpha': 1.0835372131988044, 'aci_step_size': 0.06960485849809045, 'oob_split_ratio': 0.7821633332322185}. Best is trial 14 with value: 0.007971290538447036.\n",
      "[I 2026-07-02 16:30:48,450] Trial 51 finished with value: 0.007972075343551802 and parameters: {'reservoir_size': 84, 'spectral_radius': 0.8601017990213268, 'ar_lags': 7, 'foundation_window': 24, 'regressor_type': 'ElasticNet', 'reg_alpha': 1.143726976746511, 'aci_step_size': 0.15910942814815712, 'oob_split_ratio': 0.7565786154935448}. Best is trial 14 with value: 0.007971290538447036.\n",
      "[I 2026-07-02 16:30:48,543] Trial 52 finished with value: 0.007974067507310084 and parameters: {'reservoir_size': 61, 'spectral_radius': 0.7992578937353816, 'ar_lags': 6, 'foundation_window': 24, 'regressor_type': 'ElasticNet', 'reg_alpha': 2.186410951269746, 'aci_step_size': 0.15290602061456765, 'oob_split_ratio': 0.7701678710061742}. Best is trial 14 with value: 0.007971290538447036.\n",
      "[I 2026-07-02 16:30:48,639] Trial 53 finished with value: 0.01574679733977805 and parameters: {'reservoir_size': 73, 'spectral_radius': 0.8581761049399642, 'ar_lags': 8, 'foundation_window': 22, 'regressor_type': 'ElasticNet', 'reg_alpha': 0.526040002874362, 'aci_step_size': 0.03148193755812559, 'oob_split_ratio': 0.753447613823578}. Best is trial 14 with value: 0.007971290538447036.\n",
      "[I 2026-07-02 16:30:48,738] Trial 54 finished with value: 0.0079737108295496 and parameters: {'reservoir_size': 105, 'spectral_radius': 0.9373063225111807, 'ar_lags': 5, 'foundation_window': 24, 'regressor_type': 'ElasticNet', 'reg_alpha': 1.4335374401268184, 'aci_step_size': 0.18415308947399994, 'oob_split_ratio': 0.7354684937415473}. Best is trial 14 with value: 0.007971290538447036.\n",
