      "[I 2026-07-02 14:58:29,973] Trial 275 finished with value: 0.03329622521479674 and parameters: {'reservoir_size': 80, 'spectral_radius': 0.8386729136459273, 'ar_lags': 3, 'foundation_window': 8, 'regressor_type': 'ElasticNet', 'reg_alpha': 0.3173503769547178, 'aci_step_size': 0.14781779669484843, 'oob_split_ratio': 0.7588910632965663}. Best is trial 25 with value: 0.030603792302848206.\n",
      "[I 2026-07-02 14:58:30,108] Trial 276 finished with value: 0.03182364872455495 and parameters: {'reservoir_size': 34, 'spectral_radius': 0.9850092022031531, 'ar_lags': 2, 'foundation_window': 9, 'regressor_type': 'ElasticNet', 'reg_alpha': 0.4227915341908791, 'aci_step_size': 0.14166641925589324, 'oob_split_ratio': 0.6427659725425696}. Best is trial 25 with value: 0.030603792302848206.\n",
      "[I 2026-07-02 14:58:30,221] Trial 277 finished with value: 0.03173162813123632 and parameters: {'reservoir_size': 74, 'spectral_radius': 1.30074826894618, 'ar_lags': 2, 'foundation_window': 8, 'regressor_type': 'ElasticNet', 'reg_alpha': 0.3895491104237536, 'aci_step_size': 0.1598658728994085, 'oob_split_ratio': 0.6448864337012294}. Best is trial 25 with value: 0.030603792302848206.\n",
      "[I 2026-07-02 14:58:30,334] Trial 278 finished with value: 0.03375254389410677 and parameters: {'reservoir_size': 86, 'spectral_radius': 1.1760449278118041, 'ar_lags': 2, 'foundation_window': 8, 'regressor_type': 'ElasticNet', 'reg_alpha': 0.28523210016317363, 'aci_step_size': 0.1506843549015741, 'oob_split_ratio': 0.6291231775842037}. Best is trial 25 with value: 0.030603792302848206.\n",
      "[I 2026-07-02 14:58:30,460] Trial 279 finished with value: 0.03173162813123632 and parameters: {'reservoir_size': 83, 'spectral_radius': 1.2191789970149027, 'ar_lags': 2, 'foundation_window': 8, 'regressor_type': 'ElasticNet', 'reg_alpha': 0.5129594716060686, 'aci_step_size': 0.14632450943916064, 'oob_split_ratio': 0.639363592439004}. Best is trial 25 with value: 0.030603792302848206.\n",
      "[I 2026-07-02 14:58:30,651] Trial 280 finished with value: 0.03173162813123632 and parameters: {'reservoir_size': 166, 'spectral_radius': 0.589285259443852, 'ar_lags': 2, 'foundation_window': 8, 'regressor_type': 'Lasso', 'reg_alpha': 0.37613663991957635, 'aci_step_size': 0.1702973873024293, 'oob_split_ratio': 0.6351222242608183}. Best is trial 25 with value: 0.030603792302848206.\n",
      "[I 2026-07-02 14:58:30,744] Trial 281 finished with value: 0.03095053060843329 and parameters: {'reservoir_size': 31, 'spectral_radius': 0.949647577922143, 'ar_lags': 2, 'foundation_window': 5, 'regressor_type': 'ElasticNet', 'reg_alpha': 0.3178737537889938, 'aci_step_size': 0.19385001907821386, 'oob_split_ratio': 0.6470105152356558}. Best is trial 25 with value: 0.030603792302848206.\n",
      "[I 2026-07-02 14:58:30,820] Trial 282 finished with value: 0.032356981068975846 and parameters: {'reservoir_size': 77, 'spectral_radius': 0.9435464017420019, 'ar_lags': 4, 'foundation_window': 4, 'regressor_type': 'ElasticNet', 'reg_alpha': 0.2868234034630148, 'aci_step_size': 0.19204644567786897, 'oob_split_ratio': 0.6458356659430433}. Best is trial 25 with value: 0.030603792302848206.\n",
      "[I 2026-07-02 14:58:30,915] Trial 283 finished with value: 0.03095053060843329 and parameters: {'reservoir_size': 25, 'spectral_radius': 0.9365607220137941, 'ar_lags': 2, 'foundation_window': 5, 'regressor_type': 'ElasticNet', 'reg_alpha': 0.34613141080257886, 'aci_step_size': 0.1872804409873681, 'oob_split_ratio': 0.6493861105086999}. Best is trial 25 with value: 0.030603792302848206.\n",
      "[I 2026-07-02 14:58:31,056] Trial 284 finished with value: 0.03291645046054551 and parameters: {'reservoir_size': 188, 'spectral_radius': 0.9679497510113754, 'ar_lags': 2, 'foundation_window': 4, 'regressor_type': 'ElasticNet', 'reg_alpha': 0.3156839798654785, 'aci_step_size': 0.1852040357557761, 'oob_split_ratio': 0.6511478885423009}. Best is trial 25 with value: 0.030603792302848206.\n",
      "[I 2026-07-02 14:58:31,151] Trial 285 finished with value: 0.03095053060843329 and parameters: {'reservoir_size': 24, 'spectral_radius': 0.8933354840985477, 'ar_lags': 2, 'foundation_window': 5, 'regressor_type': 'ElasticNet', 'reg_alpha': 0.35001797732151313, 'aci_step_size': 0.1848272258023532, 'oob_split_ratio': 0.6567662712790335}. Best is trial 25 with value: 0.030603792302848206.\n",
      "[I 2026-07-02 14:58:31,232] Trial 286 finished with value: 0.031301207061624446 and parameters: {'reservoir_size': 18, 'spectral_radius': 1.0399896990486355, 'ar_lags': 2, 'foundation_window': 5, 'regressor_type': 'ElasticNet', 'reg_alpha': 0.34030553249283374, 'aci_step_size': 0.18329646179347533, 'oob_split_ratio': 0.6608029310134317}. Best is trial 25 with value: 0.030603792302848206.\n",
      "[I 2026-07-02 14:58:31,356] Trial 287 finished with value: 0.031301207061624446 and parameters: {'reservoir_size': 103, 'spectral_radius': 0.9230214940254864, 'ar_lags': 2, 'foundation_window': 5, 'regressor_type': 'ElasticNet', 'reg_alpha': 0.3271504396833655, 'aci_step_size': 0.18346187167616235, 'oob_split_ratio': 0.663644001880711}. Best is trial 25 with value: 0.030603792302848206.\n",
      "[I 2026-07-02 14:58:31,530] Trial 288 finished with value: 0.031301207061624446 and parameters: {'reservoir_size': 106, 'spectral_radius': 0.9095751087340631, 'ar_lags': 2, 'foundation_window': 5, 'regressor_type': 'ElasticNet', 'reg_alpha': 0.3163979974793193, 'aci_step_size': 0.1835245840102239, 'oob_split_ratio': 0.6680060130223999}. Best is trial 25 with value: 0.030603792302848206.\n",
      "[I 2026-07-02 14:58:31,656] Trial 289 finished with value: 0.031301207061624446 and parameters: {'reservoir_size': 99, 'spectral_radius': 0.903113877765463, 'ar_lags': 2, 'foundation_window': 5, 'regressor_type': 'ElasticNet', 'reg_alpha': 0.3397130379780179, 'aci_step_size': 0.18126136330220594, 'oob_split_ratio': 0.6690339469633698}. Best is trial 25 with value: 0.030603792302848206.\n",
      "[I 2026-07-02 14:58:31,858] Trial 290 finished with value: 0.031301207061624446 and parameters: {'reservoir_size': 104, 'spectral_radius': 0.912381197415062, 'ar_lags': 2, 'foundation_window': 5, 'regressor_type': 'ElasticNet', 'reg_alpha': 0.3258008103840993, 'aci_step_size': 0.18279629637019698, 'oob_split_ratio': 0.681243639324917}. Best is trial 25 with value: 0.030603792302848206.\n",
      "[I 2026-07-02 14:58:32,017] Trial 291 finished with value: 0.03283987691512635 and parameters: {'reservoir_size': 92, 'spectral_radius': 0.9036328276130247, 'ar_lags': 2, 'foundation_window': 5, 'regressor_type': 'Ridge', 'reg_alpha': 0.3201631828527502, 'aci_step_size': 0.18376484205025378, 'oob_split_ratio': 0.6770412242687988}. Best is trial 25 with value: 0.030603792302848206.\n",
      "[I 2026-07-02 14:58:32,176] Trial 292 finished with value: 0.031301207061624446 and parameters: {'reservoir_size': 103, 'spectral_radius': 0.9236811405581044, 'ar_lags': 2, 'foundation_window': 5, 'regressor_type': 'ElasticNet', 'reg_alpha': 0.2649956495923824, 'aci_step_size': 0.18041262043034248, 'oob_split_ratio': 0.6782652996482113}. Best is trial 25 with value: 0.030603792302848206.\n",
      "[I 2026-07-02 14:58:32,297] Trial 293 finished with value: 0.031301207061624446 and parameters: {'reservoir_size': 103, 'spectral_radius': 0.9333309750302794, 'ar_lags': 2, 'foundation_window': 5, 'regressor_type': 'ElasticNet', 'reg_alpha': 0.26867418281846484, 'aci_step_size': 0.1823767491829987, 'oob_split_ratio': 0.6871409403752938}. Best is trial 25 with value: 0.030603792302848206.\n",
      "[I 2026-07-02 14:58:32,442] Trial 294 finished with value: 0.031301207061624446 and parameters: {'reservoir_size': 105, 'spectral_radius': 0.9229786207845821, 'ar_lags': 2, 'foundation_window': 5, 'regressor_type': 'ElasticNet', 'reg_alpha': 0.25516218272491115, 'aci_step_size': 0.17969486764451667, 'oob_split_ratio': 0.695712790410761}. Best is trial 25 with value: 0.030603792302848206.\n",
      "[I 2026-07-02 14:58:32,593] Trial 295 finished with value: 0.031301207061624446 and parameters: {'reservoir_size': 103, 'spectral_radius': 0.939745060809464, 'ar_lags': 2, 'foundation_window': 5, 'regressor_type': 'ElasticNet', 'reg_alpha': 0.25455439169926625, 'aci_step_size': 0.18029502567331587, 'oob_split_ratio': 0.6854736723279287}. Best is trial 25 with value: 0.030603792302848206.\n",
      "[I 2026-07-02 14:58:32,715] Trial 296 finished with value: 0.031244290086040696 and parameters: {'reservoir_size': 102, 'spectral_radius': 0.9251943757521881, 'ar_lags': 2, 'foundation_window': 5, 'regressor_type': 'ElasticNet', 'reg_alpha': 0.24817832535642279, 'aci_step_size': 0.18026878291190762, 'oob_split_ratio': 0.6949678947391428}. Best is trial 25 with value: 0.030603792302848206.\n",
      "[I 2026-07-02 14:58:32,905] Trial 297 finished with value: 0.031301207061624446 and parameters: {'reservoir_size': 105, 'spectral_radius': 0.9304605326227843, 'ar_lags': 2, 'foundation_window': 5, 'regressor_type': 'ElasticNet', 'reg_alpha': 0.2469150049478387, 'aci_step_size': 0.17860101546289514, 'oob_split_ratio': 0.7008039763638061}. Best is trial 25 with value: 0.030603792302848206.\n",
      "[I 2026-07-02 14:58:33,056] Trial 298 finished with value: 0.0312896458871137 and parameters: {'reservoir_size': 104, 'spectral_radius': 0.9247901304708644, 'ar_lags': 2, 'foundation_window': 5, 'regressor_type': 'ElasticNet', 'reg_alpha': 0.24145562768258205, 'aci_step_size': 0.17954703211311684, 'oob_split_ratio': 0.7062704146804558}. Best is trial 25 with value: 0.030603792302848206.\n",
      "[I 2026-07-02 14:58:33,223] Trial 299 finished with value: 0.03128702213208786 and parameters: {'reservoir_size': 104, 'spectral_radius': 0.9295485720778085, 'ar_lags': 2, 'foundation_window': 5, 'regressor_type': 'ElasticNet', 'reg_alpha': 0.24162436772441342, 'aci_step_size': 0.1795934196511245, 'oob_split_ratio': 0.7007275170300021}. Best is trial 25 with value: 0.030603792302848206.\n",
      "[I 2026-07-02 14:58:33,233] A new study created in memory with name: no-name-f4c399ee-28f8-4fb3-a8d9-5ea8fdf1ae13\n",
      "[I 2026-07-02 14:58:33,294] Trial 0 finished with value: 15.342331479602343 and parameters: {'target_miscoverage': 0.08116262258099886, 'aci_step_size': 0.1667521176194013, 'interval_scale': 3.805209189203926}. Best is trial 0 with value: 15.342331479602343.\n",
      "[I 2026-07-02 14:58:33,356] Trial 1 finished with value: 3.098826126415316 and parameters: {'target_miscoverage': 0.12374511199743694, 'aci_step_size': 0.00889039845957559, 'interval_scale': 0.7705594012729585}. Best is trial 1 with value: 3.098826126415316.\n",
      "[I 2026-07-02 14:58:33,416] Trial 2 finished with value: 10.712144242564925 and parameters: {'target_miscoverage': 0.021035886311957897, 'aci_step_size': 0.12207764786954153, 'interval_scale': 2.6471868808879733}. Best is trial 1 with value: 3.098826126415316.\n",
      "[I 2026-07-02 14:58:33,474] Trial 3 finished with value: 29.55971476892907 and parameters: {'target_miscoverage': 0.14453378978124864, 'aci_step_size': 0.005394455304087533, 'interval_scale': 7.3596614801167854}. Best is trial 1 with value: 3.098826126415316.\n",
      "[I 2026-07-02 14:58:33,542] Trial 4 finished with value: 3.319914908103082 and parameters: {'target_miscoverage': 0.16816410175208013, 'aci_step_size': 0.010943342660062645, 'interval_scale': 0.8277688526305597}. Best is trial 1 with value: 3.098826126415316.\n",
      "[I 2026-07-02 14:58:33,604] Trial 5 finished with value: 8.655793908001007 and parameters: {'target_miscoverage': 0.044846856872152424, 'aci_step_size': 0.015359756451337138, 'interval_scale': 2.142099844547283}. Best is trial 1 with value: 3.098826126415316.\n",
      "[I 2026-07-02 14:58:33,663] Trial 6 finished with value: 10.988542282047879 and parameters: {'target_miscoverage': 0.092069553542002, 'aci_step_size': 0.014639847680621753, 'interval_scale': 2.727183127344505}. Best is trial 1 with value: 3.098826126415316.\n",
      "[I 2026-07-02 14:58:33,720] Trial 7 finished with value: 5.582127809695067 and parameters: {'target_miscoverage': 0.036503833523887946, 'aci_step_size': 0.014689372953975089, 'interval_scale': 1.3807454499059875}. Best is trial 1 with value: 3.098826126415316.\n",
      "[I 2026-07-02 14:58:33,779] Trial 8 finished with value: 3.5035336146547604 and parameters: {'target_miscoverage': 0.09665329700123683, 'aci_step_size': 0.09054594344647797, 'interval_scale': 0.869763534223623}. Best is trial 1 with value: 3.098826126415316.\n",
      "[I 2026-07-02 14:58:33,838] Trial 9 finished with value: 2.289369289075676 and parameters: {'target_miscoverage': 0.1077045432985862, 'aci_step_size': 0.04446862319918233, 'interval_scale': 0.5687244174086067}. Best is trial 9 with value: 2.289369289075676.\n",
      "[I 2026-07-02 14:58:33,906] Trial 10 finished with value: 2.044828401265282 and parameters: {'target_miscoverage': 0.19154740460445246, 'aci_step_size': 0.03929005796689084, 'interval_scale': 0.5105730441126768}. Best is trial 10 with value: 2.044828401265282.\n",
      "[I 2026-07-02 14:58:33,978] Trial 11 finished with value: 2.2013013844185836 and parameters: {'target_miscoverage': 0.18713516496323956, 'aci_step_size': 0.04164679387089521, 'interval_scale': 0.5494949104745805}. Best is trial 10 with value: 2.044828401265282.\n",
      "[I 2026-07-02 14:58:34,047] Trial 12 finished with value: 2.1069864855545326 and parameters: {'target_miscoverage': 0.19722181661010438, 'aci_step_size': 0.03655064031002041, 'interval_scale': 0.5262754138561289}. Best is trial 10 with value: 2.044828401265282.\n",
      "[I 2026-07-02 14:58:34,112] Trial 13 finished with value: 2.027576485919365 and parameters: {'target_miscoverage': 0.1995610392805547, 'aci_step_size': 0.033442781834192976, 'interval_scale': 0.5065129572359066}. Best is trial 13 with value: 2.027576485919365.\n",
      "[I 2026-07-02 14:58:34,183] Trial 14 finished with value: 5.184955560073518 and parameters: {'target_miscoverage': 0.1633687433016793, 'aci_step_size': 0.024821887863753774, 'interval_scale': 1.292410140075646}. Best is trial 13 with value: 2.027576485919365.\n",
      "[I 2026-07-02 14:58:34,251] Trial 15 finished with value: 4.4787911040410595 and parameters: {'target_miscoverage': 0.17429270875510758, 'aci_step_size': 0.0637112095197321, 'interval_scale': 1.1171334490149}. Best is trial 13 with value: 2.027576485919365.\n",
      "[I 2026-07-02 14:58:34,322] Trial 16 finished with value: 2.7901808459076642 and parameters: {'target_miscoverage': 0.14434025459521416, 'aci_step_size': 0.02249181048276558, 'interval_scale': 0.6946800731988959}. Best is trial 13 with value: 2.027576485919365.\n",
      "[I 2026-07-02 14:58:34,394] Trial 17 finished with value: 4.200172084032186 and parameters: {'target_miscoverage': 0.19985745661237553, 'aci_step_size': 0.027635949623882185, 'interval_scale': 1.0492724076424627}. Best is trial 13 with value: 2.027576485919365.\n",
      "[I 2026-07-02 14:58:34,467] Trial 18 finished with value: 2.025351084526063 and parameters: {'target_miscoverage': 0.1465578732355906, 'aci_step_size': 0.06324739923042118, 'interval_scale': 0.5043260205949032}. Best is trial 18 with value: 2.025351084526063.\n",
      "[I 2026-07-02 14:58:34,536] Trial 19 finished with value: 7.12075079226078 and parameters: {'target_miscoverage': 0.1452757824205482, 'aci_step_size': 0.10049275820640989, 'interval_scale': 1.772976515373303}. Best is trial 18 with value: 2.025351084526063.\n",
      "[I 2026-07-02 14:58:34,603] Trial 20 finished with value: 2.772854613698338 and parameters: {'target_miscoverage': 0.12557866245633992, 'aci_step_size': 0.06086620436311455, 'interval_scale': 0.6895795595545208}. Best is trial 18 with value: 2.025351084526063.\n",
      "[I 2026-07-02 14:58:34,675] Trial 21 finished with value: 2.0874836755180386 and parameters: {'target_miscoverage': 0.1808242527763391, 'aci_step_size': 0.06332205057347083, 'interval_scale': 0.5208829988011358}. Best is trial 18 with value: 2.025351084526063.\n",
      "[I 2026-07-02 14:58:34,747] Trial 22 finished with value: 2.8275442691626824 and parameters: {'target_miscoverage': 0.1631525722396782, 'aci_step_size': 0.03342840888521296, 'interval_scale': 0.7047888355499912}. Best is trial 18 with value: 2.025351084526063.\n",
      "[I 2026-07-02 14:58:34,812] Trial 23 finished with value: 2.055396081205466 and parameters: {'target_miscoverage': 0.15169277059537092, 'aci_step_size': 0.052107369196267156, 'interval_scale': 0.5119673137470161}. Best is trial 18 with value: 2.025351084526063.\n",
      "[I 2026-07-02 14:58:34,892] Trial 24 finished with value: 3.640415532342556 and parameters: {'target_miscoverage': 0.18740232876384627, 'aci_step_size': 0.07535500659857076, 'interval_scale': 0.9087453475378822}. Best is trial 18 with value: 2.025351084526063.\n",
      "[I 2026-07-02 14:58:34,999] Trial 25 finished with value: 2.56879703708255 and parameters: {'target_miscoverage': 0.1320583587676628, 'aci_step_size': 0.019930224010235552, 'interval_scale': 0.6390841377106145}. Best is trial 18 with value: 2.025351084526063.\n",
      "[I 2026-07-02 14:58:35,077] Trial 26 finished with value: 2.572453759290023 and parameters: {'target_miscoverage': 0.18455491465931273, 'aci_step_size': 0.03082064846327151, 'interval_scale': 0.6420419839586556}. Best is trial 18 with value: 2.025351084526063.\n",
      "[I 2026-07-02 14:58:35,145] Trial 27 finished with value: 4.139111640516112 and parameters: {'target_miscoverage': 0.15836431318866978, 'aci_step_size': 0.19170227408309054, 'interval_scale': 1.0314072020843656}. Best is trial 18 with value: 2.025351084526063.\n",
      "[I 2026-07-02 14:58:35,211] Trial 28 finished with value: 2.0191550927113227 and parameters: {'target_miscoverage': 0.07077578898340864, 'aci_step_size': 0.048242526502759495, 'interval_scale': 0.5004764830771539}. Best is trial 28 with value: 2.0191550927113227.\n",
      "[I 2026-07-02 14:58:35,280] Trial 29 finished with value: 23.64650655913154 and parameters: {'target_miscoverage': 0.06986292184397966, 'aci_step_size': 0.11106085445515095, 'interval_scale': 5.860801126037487}. Best is trial 28 with value: 2.0191550927113227.\n",
      "[I 2026-07-02 14:58:35,347] Trial 30 finished with value: 2.5113767140034327 and parameters: {'target_miscoverage': 0.06884314814617609, 'aci_step_size': 0.1356175102294461, 'interval_scale': 0.6224078323653578}. Best is trial 28 with value: 2.0191550927113227.\n",
      "[I 2026-07-02 14:58:35,420] Trial 31 finished with value: 2.037726647241852 and parameters: {'target_miscoverage': 0.11375213233397005, 'aci_step_size': 0.04806668093381906, 'interval_scale': 0.50639724765175}. Best is trial 28 with value: 2.0191550927113227.\n",
      "[I 2026-07-02 14:58:35,495] Trial 32 finished with value: 3.1123549078027803 and parameters: {'target_miscoverage': 0.11328024409035417, 'aci_step_size': 0.0504227824192865, 'interval_scale': 0.7734319120329263}. Best is trial 28 with value: 2.0191550927113227.\n",
      "[I 2026-07-02 14:58:35,565] Trial 33 finished with value: 2.4800732538427805 and parameters: {'target_miscoverage': 0.07604205977926826, 'aci_step_size': 0.08064212352060005, 'interval_scale': 0.6149176930833128}. Best is trial 28 with value: 2.0191550927113227.\n",
      "[I 2026-07-02 14:58:35,634] Trial 34 finished with value: 3.156682982664716 and parameters: {'target_miscoverage': 0.04887247310579231, 'aci_step_size': 0.048438373914665565, 'interval_scale': 0.7813928996567203}. Best is trial 28 with value: 2.0191550927113227.\n",
      "[I 2026-07-02 14:58:35,709] Trial 35 finished with value: 3.757757139161839 and parameters: {'target_miscoverage': 0.08797228826461517, 'aci_step_size': 0.07493433377474319, 'interval_scale': 0.9323845629007365}. Best is trial 28 with value: 2.0191550927113227.\n",
      "[I 2026-07-02 14:58:35,778] Trial 36 finished with value: 2.5137234769013834 and parameters: {'target_miscoverage': 0.01278308828268724, 'aci_step_size': 0.14168115280984386, 'interval_scale': 0.6208824900622039}. Best is trial 28 with value: 2.0191550927113227.\n",
      "[I 2026-07-02 14:58:35,849] Trial 37 finished with value: 3.1038439367285418 and parameters: {'target_miscoverage': 0.05953219814767232, 'aci_step_size': 0.020271626194509645, 'interval_scale': 0.7688088160644074}. Best is trial 28 with value: 2.0191550927113227.\n",
      "[I 2026-07-02 14:58:35,919] Trial 38 finished with value: 2.0271205234194563 and parameters: {'target_miscoverage': 0.11517484725860755, 'aci_step_size': 0.006573099047403326, 'interval_scale': 0.5038050169931739}. Best is trial 28 with value: 2.0191550927113227.\n",
      "[I 2026-07-02 14:58:35,986] Trial 39 finished with value: 2.9431191831696126 and parameters: {'target_miscoverage': 0.13504535098376275, 'aci_step_size': 0.0057512978984612445, 'interval_scale': 0.7323436670902481}. Best is trial 28 with value: 2.0191550927113227.\n",
      "[I 2026-07-02 14:58:36,056] Trial 40 finished with value: 2.3116761546701756 and parameters: {'target_miscoverage': 0.0262232201043692, 'aci_step_size': 0.0067631423215485835, 'interval_scale': 0.5714407161156493}. Best is trial 28 with value: 2.0191550927113227.\n",
      "[I 2026-07-02 14:58:36,122] Trial 41 finished with value: 2.309700207846375 and parameters: {'target_miscoverage': 0.11729877648091473, 'aci_step_size': 0.055944399881353274, 'interval_scale': 0.5741092280786144}. Best is trial 28 with value: 2.0191550927113227.\n",
      "[I 2026-07-02 14:58:36,192] Trial 42 finished with value: 2.050359790449095 and parameters: {'target_miscoverage': 0.09417965043264542, 'aci_step_size': 0.009799235755177858, 'interval_scale': 0.5089321049130731}. Best is trial 28 with value: 2.0191550927113227.\n",
