      "[I 2026-07-02 16:30:55,330] Trial 110 finished with value: 0.014690890334124782 and parameters: {'reservoir_size': 124, 'spectral_radius': 0.9834033631177745, 'ar_lags': 6, 'foundation_window': 20, 'regressor_type': 'ElasticNet', 'reg_alpha': 1.6133498179240935, 'aci_step_size': 0.14426785002508608, 'oob_split_ratio': 0.7635971830045126}. Best is trial 14 with value: 0.007971290538447036.\n",
      "[I 2026-07-02 16:30:55,436] Trial 111 finished with value: 0.007972075343551802 and parameters: {'reservoir_size': 83, 'spectral_radius': 0.8966304636836258, 'ar_lags': 7, 'foundation_window': 24, 'regressor_type': 'ElasticNet', 'reg_alpha': 1.182793592437882, 'aci_step_size': 0.16339746752068182, 'oob_split_ratio': 0.7612718356305502}. Best is trial 14 with value: 0.007971290538447036.\n",
      "[I 2026-07-02 16:30:55,548] Trial 112 finished with value: 0.01106439149059847 and parameters: {'reservoir_size': 91, 'spectral_radius': 0.8806765710049278, 'ar_lags': 7, 'foundation_window': 23, 'regressor_type': 'ElasticNet', 'reg_alpha': 1.3837928388984437, 'aci_step_size': 0.16150317089522928, 'oob_split_ratio': 0.7524518769305857}. Best is trial 14 with value: 0.007971290538447036.\n",
      "[I 2026-07-02 16:30:55,649] Trial 113 finished with value: 0.007974534039733605 and parameters: {'reservoir_size': 84, 'spectral_radius': 0.9368242504004062, 'ar_lags': 7, 'foundation_window': 24, 'regressor_type': 'ElasticNet', 'reg_alpha': 0.8372093109793025, 'aci_step_size': 0.1709486431931625, 'oob_split_ratio': 0.7433247111008989}. Best is trial 14 with value: 0.007971290538447036.\n",
      "[I 2026-07-02 16:30:55,730] Trial 114 finished with value: 0.011064653072942764 and parameters: {'reservoir_size': 79, 'spectral_radius': 0.855061012455654, 'ar_lags': 8, 'foundation_window': 23, 'regressor_type': 'ElasticNet', 'reg_alpha': 2.2062066522081287, 'aci_step_size': 0.15619764693531032, 'oob_split_ratio': 0.7580947102611301}. Best is trial 14 with value: 0.007971290538447036.\n",
      "[I 2026-07-02 16:30:55,825] Trial 115 finished with value: 0.007974753649405761 and parameters: {'reservoir_size': 75, 'spectral_radius': 0.880784353334541, 'ar_lags': 6, 'foundation_window': 24, 'regressor_type': 'ElasticNet', 'reg_alpha': 1.2790293040210183, 'aci_step_size': 0.16659579149160764, 'oob_split_ratio': 0.7821852969267475}. Best is trial 14 with value: 0.007971290538447036.\n",
      "[I 2026-07-02 16:30:55,906] Trial 116 finished with value: 0.011064785952975463 and parameters: {'reservoir_size': 89, 'spectral_radius': 0.7694630952670575, 'ar_lags': 7, 'foundation_window': 23, 'regressor_type': 'ElasticNet', 'reg_alpha': 0.9445705378293736, 'aci_step_size': 0.13813237420735036, 'oob_split_ratio': 0.7680021391107854}. Best is trial 14 with value: 0.007971290538447036.\n",
      "[I 2026-07-02 16:30:56,002] Trial 117 finished with value: 0.02876253558730496 and parameters: {'reservoir_size': 67, 'spectral_radius': 0.8226500108871813, 'ar_lags': 8, 'foundation_window': 9, 'regressor_type': 'ElasticNet', 'reg_alpha': 16.27002976724691, 'aci_step_size': 0.04914759223272588, 'oob_split_ratio': 0.7731323084014974}. Best is trial 14 with value: 0.007971290538447036.\n",
      "[I 2026-07-02 16:30:56,198] Trial 118 finished with value: 0.009685464202209783 and parameters: {'reservoir_size': 99, 'spectral_radius': 0.9075027046054837, 'ar_lags': 9, 'foundation_window': 15, 'regressor_type': 'ElasticNet', 'reg_alpha': 1.0274195509633854, 'aci_step_size': 0.17473799464420517, 'oob_split_ratio': 0.7492790555572005}. Best is trial 14 with value: 0.007971290538447036.\n",
      "[I 2026-07-02 16:30:56,359] Trial 119 finished with value: 0.06767008623018261 and parameters: {'reservoir_size': 83, 'spectral_radius': 0.7895117084000757, 'ar_lags': 5, 'foundation_window': 22, 'regressor_type': 'Ridge', 'reg_alpha': 0.18075029041577262, 'aci_step_size': 0.14755181319817176, 'oob_split_ratio': 0.7413223299637792}. Best is trial 14 with value: 0.007971290538447036.\n",
      "[I 2026-07-02 16:30:56,537] Trial 120 finished with value: 0.007972803490069428 and parameters: {'reservoir_size': 108, 'spectral_radius': 0.848526897420682, 'ar_lags': 6, 'foundation_window': 24, 'regressor_type': 'ElasticNet', 'reg_alpha': 0.739234210561105, 'aci_step_size': 0.15960470444734223, 'oob_split_ratio': 0.7572378905809458}. Best is trial 14 with value: 0.007971290538447036.\n",
      "[I 2026-07-02 16:30:56,640] Trial 121 finished with value: 0.007972075343551802 and parameters: {'reservoir_size': 80, 'spectral_radius': 0.8442887775189545, 'ar_lags': 7, 'foundation_window': 24, 'regressor_type': 'ElasticNet', 'reg_alpha': 1.3658396579566277, 'aci_step_size': 0.14888397481219467, 'oob_split_ratio': 0.7586580727190293}. Best is trial 14 with value: 0.007971290538447036.\n",
      "[I 2026-07-02 16:30:56,755] Trial 122 finished with value: 0.007970484732693198 and parameters: {'reservoir_size': 86, 'spectral_radius': 0.8684937845529885, 'ar_lags': 7, 'foundation_window': 24, 'regressor_type': 'ElasticNet', 'reg_alpha': 1.7794490304153778, 'aci_step_size': 0.15416230947388998, 'oob_split_ratio': 0.7531269471644122}. Best is trial 122 with value: 0.007970484732693198.\n",
      "[I 2026-07-02 16:30:56,874] Trial 123 finished with value: 0.011064785952975463 and parameters: {'reservoir_size': 94, 'spectral_radius': 0.9598055188133147, 'ar_lags': 7, 'foundation_window': 23, 'regressor_type': 'ElasticNet', 'reg_alpha': 1.725339120531274, 'aci_step_size': 0.15407347767638627, 'oob_split_ratio': 0.7656512623923705}. Best is trial 122 with value: 0.007970484732693198.\n",
      "[I 2026-07-02 16:30:56,978] Trial 124 finished with value: 0.00797334343471393 and parameters: {'reservoir_size': 88, 'spectral_radius': 0.8165041825320041, 'ar_lags': 8, 'foundation_window': 24, 'regressor_type': 'ElasticNet', 'reg_alpha': 1.5151968471225536, 'aci_step_size': 0.16799246615690128, 'oob_split_ratio': 0.7372436830464351}. Best is trial 122 with value: 0.007970484732693198.\n",
      "[I 2026-07-02 16:30:57,056] Trial 125 finished with value: 0.007970484732693198 and parameters: {'reservoir_size': 72, 'spectral_radius': 0.8836870480471631, 'ar_lags': 7, 'foundation_window': 24, 'regressor_type': 'ElasticNet', 'reg_alpha': 38.1413098035401, 'aci_step_size': 0.16293843963972013, 'oob_split_ratio': 0.751582726381902}. Best is trial 122 with value: 0.007970484732693198.\n",
      "[I 2026-07-02 16:30:57,160] Trial 126 finished with value: 0.01106332769299176 and parameters: {'reservoir_size': 70, 'spectral_radius': 0.9232972909228405, 'ar_lags': 5, 'foundation_window': 23, 'regressor_type': 'ElasticNet', 'reg_alpha': 38.73151787357702, 'aci_step_size': 0.1644611311871637, 'oob_split_ratio': 0.7468067296777915}. Best is trial 122 with value: 0.007970484732693198.\n",
      "[I 2026-07-02 16:30:57,261] Trial 127 finished with value: 0.007970484732693198 and parameters: {'reservoir_size': 59, 'spectral_radius': 0.8730869614003477, 'ar_lags': 7, 'foundation_window': 24, 'regressor_type': 'ElasticNet', 'reg_alpha': 2.5343487906392896, 'aci_step_size': 0.15257666672459338, 'oob_split_ratio': 0.7530559281118218}. Best is trial 122 with value: 0.007970484732693198.\n",
      "[I 2026-07-02 16:30:57,363] Trial 128 finished with value: 0.011064912803273937 and parameters: {'reservoir_size': 58, 'spectral_radius': 0.9014752151838603, 'ar_lags': 6, 'foundation_window': 23, 'regressor_type': 'Lasso', 'reg_alpha': 48.980766302011425, 'aci_step_size': 0.14081752755272206, 'oob_split_ratio': 0.7523395378226517}. Best is trial 122 with value: 0.007970484732693198.\n",
      "[I 2026-07-02 16:30:57,456] Trial 129 finished with value: 0.013409906170402592 and parameters: {'reservoir_size': 44, 'spectral_radius': 0.8640370030617212, 'ar_lags': 8, 'foundation_window': 22, 'regressor_type': 'ElasticNet', 'reg_alpha': 29.02998804353431, 'aci_step_size': 0.15371855910473778, 'oob_split_ratio': 0.7287944974199242}. Best is trial 122 with value: 0.007970484732693198.\n",
      "[I 2026-07-02 16:30:57,527] Trial 130 finished with value: 0.007974534039733605 and parameters: {'reservoir_size': 64, 'spectral_radius': 0.942966964577449, 'ar_lags': 7, 'foundation_window': 24, 'regressor_type': 'ElasticNet', 'reg_alpha': 2.4859260424488667, 'aci_step_size': 0.15710844170904373, 'oob_split_ratio': 0.7417536976258773}. Best is trial 122 with value: 0.007970484732693198.\n",
      "[I 2026-07-02 16:30:57,606] Trial 131 finished with value: 0.007970484732693198 and parameters: {'reservoir_size': 75, 'spectral_radius': 0.8806101910175587, 'ar_lags': 7, 'foundation_window': 24, 'regressor_type': 'ElasticNet', 'reg_alpha': 1.9790213274748132, 'aci_step_size': 0.17130183051266162, 'oob_split_ratio': 0.7527832478743893}. Best is trial 122 with value: 0.007970484732693198.\n",
      "[I 2026-07-02 16:30:57,717] Trial 132 finished with value: 0.007970484732693198 and parameters: {'reservoir_size': 77, 'spectral_radius': 0.8785537987163998, 'ar_lags': 7, 'foundation_window': 24, 'regressor_type': 'ElasticNet', 'reg_alpha': 2.870691031115941, 'aci_step_size': 0.17173068545832232, 'oob_split_ratio': 0.7521612415842998}. Best is trial 122 with value: 0.007970484732693198.\n",
      "[I 2026-07-02 16:30:57,818] Trial 133 finished with value: 0.007970484732693198 and parameters: {'reservoir_size': 75, 'spectral_radius': 0.8863738177744829, 'ar_lags': 7, 'foundation_window': 24, 'regressor_type': 'ElasticNet', 'reg_alpha': 3.692320236044773, 'aci_step_size': 0.1704302708590304, 'oob_split_ratio': 0.7484346399416708}. Best is trial 122 with value: 0.007970484732693198.\n",
      "[I 2026-07-02 16:30:57,913] Trial 134 finished with value: 0.01106439149059847 and parameters: {'reservoir_size': 52, 'spectral_radius': 0.886556459790838, 'ar_lags': 7, 'foundation_window': 23, 'regressor_type': 'ElasticNet', 'reg_alpha': 4.471441457161359, 'aci_step_size': 0.1861052234412222, 'oob_split_ratio': 0.7484477942922525}. Best is trial 122 with value: 0.007970484732693198.\n",
      "[I 2026-07-02 16:30:58,021] Trial 135 finished with value: 0.00790160815872853 and parameters: {'reservoir_size': 74, 'spectral_radius': 0.9129532514988722, 'ar_lags': 6, 'foundation_window': 24, 'regressor_type': 'ElasticNet', 'reg_alpha': 2.5580046242889884, 'aci_step_size': 0.17254805173853682, 'oob_split_ratio': 0.7331735858059313}. Best is trial 135 with value: 0.00790160815872853.\n",
      "[I 2026-07-02 16:30:58,131] Trial 136 finished with value: 0.009578553352176332 and parameters: {'reservoir_size': 74, 'spectral_radius': 1.0083463726489155, 'ar_lags': 5, 'foundation_window': 24, 'regressor_type': 'ElasticNet', 'reg_alpha': 3.000563676737211, 'aci_step_size': 0.182683559097023, 'oob_split_ratio': 0.7161434181079654}. Best is trial 135 with value: 0.00790160815872853.\n",
      "[I 2026-07-02 16:30:58,233] Trial 137 finished with value: 0.011063761900980537 and parameters: {'reservoir_size': 61, 'spectral_radius': 0.9168449490053914, 'ar_lags': 6, 'foundation_window': 23, 'regressor_type': 'ElasticNet', 'reg_alpha': 3.6721951844787877, 'aci_step_size': 0.17643321830710967, 'oob_split_ratio': 0.7336582000132842}. Best is trial 135 with value: 0.00790160815872853.\n",
      "[I 2026-07-02 16:30:58,342] Trial 138 finished with value: 0.009578553352176332 and parameters: {'reservoir_size': 69, 'spectral_radius': 0.9337556650448958, 'ar_lags': 5, 'foundation_window': 24, 'regressor_type': 'ElasticNet', 'reg_alpha': 2.726335431969205, 'aci_step_size': 0.1695150613857703, 'oob_split_ratio': 0.7195184259507258}. Best is trial 135 with value: 0.00790160815872853.\n",
      "[I 2026-07-02 16:30:58,444] Trial 139 finished with value: 0.011063603283384233 and parameters: {'reservoir_size': 77, 'spectral_radius': 0.8308055620574479, 'ar_lags': 4, 'foundation_window': 23, 'regressor_type': 'ElasticNet', 'reg_alpha': 5.567688353779197, 'aci_step_size': 0.1728179017749639, 'oob_split_ratio': 0.7399419064767819}. Best is trial 135 with value: 0.00790160815872853.\n",
      "[I 2026-07-02 16:30:58,544] Trial 140 finished with value: 0.007972192624251896 and parameters: {'reservoir_size': 64, 'spectral_radius': 0.8989188387693758, 'ar_lags': 6, 'foundation_window': 24, 'regressor_type': 'ElasticNet', 'reg_alpha': 3.3470929216532377, 'aci_step_size': 0.17907742929435855, 'oob_split_ratio': 0.751338606079398}. Best is trial 135 with value: 0.00790160815872853.\n",
      "[I 2026-07-02 16:30:58,642] Trial 141 finished with value: 0.007974534039733605 and parameters: {'reservoir_size': 72, 'spectral_radius': 0.8595754649487171, 'ar_lags': 7, 'foundation_window': 24, 'regressor_type': 'ElasticNet', 'reg_alpha': 2.2338550470671223, 'aci_step_size': 0.1715077178382365, 'oob_split_ratio': 0.7450201753929792}. Best is trial 135 with value: 0.00790160815872853.\n",
      "[I 2026-07-02 16:30:58,721] Trial 142 finished with value: 0.007973931253934077 and parameters: {'reservoir_size': 78, 'spectral_radius': 0.8043317319378637, 'ar_lags': 7, 'foundation_window': 24, 'regressor_type': 'ElasticNet', 'reg_alpha': 2.7307402519209822, 'aci_step_size': 0.16867790197052004, 'oob_split_ratio': 0.847748329310489}. Best is trial 135 with value: 0.00790160815872853.\n",
      "[I 2026-07-02 16:30:58,823] Trial 143 finished with value: 0.011062779750000662 and parameters: {'reservoir_size': 72, 'spectral_radius': 0.8868850850510425, 'ar_lags': 8, 'foundation_window': 23, 'regressor_type': 'ElasticNet', 'reg_alpha': 2.018258785718172, 'aci_step_size': 0.16613163007707912, 'oob_split_ratio': 0.7266895090981379}. Best is trial 135 with value: 0.00790160815872853.\n",
      "[I 2026-07-02 16:30:58,924] Trial 144 finished with value: 0.007948784014064283 and parameters: {'reservoir_size': 66, 'spectral_radius': 0.9516395500282302, 'ar_lags': 7, 'foundation_window': 24, 'regressor_type': 'ElasticNet', 'reg_alpha': 2.301865553656706, 'aci_step_size': 0.17611565159633963, 'oob_split_ratio': 0.7340526600372036}. Best is trial 135 with value: 0.00790160815872853.\n",
      "[I 2026-07-02 16:30:59,030] Trial 145 finished with value: 0.01106480466136537 and parameters: {'reservoir_size': 67, 'spectral_radius': 0.9567258424551731, 'ar_lags': 2, 'foundation_window': 23, 'regressor_type': 'ElasticNet', 'reg_alpha': 2.417704012064492, 'aci_step_size': 0.17566067074472158, 'oob_split_ratio': 0.7367676012234152}. Best is trial 135 with value: 0.00790160815872853.\n",
      "[I 2026-07-02 16:30:59,137] Trial 146 finished with value: 0.00790160815872853 and parameters: {'reservoir_size': 47, 'spectral_radius': 0.9191441794669561, 'ar_lags': 6, 'foundation_window': 24, 'regressor_type': 'ElasticNet', 'reg_alpha': 3.3671546118270608, 'aci_step_size': 0.19031665103742715, 'oob_split_ratio': 0.7317645948673279}. Best is trial 135 with value: 0.00790160815872853.\n",
      "[I 2026-07-02 16:30:59,251] Trial 147 finished with value: 0.008017036539923866 and parameters: {'reservoir_size': 28, 'spectral_radius': 0.9253977065628147, 'ar_lags': 6, 'foundation_window': 24, 'regressor_type': 'ElasticNet', 'reg_alpha': 4.730097568007689, 'aci_step_size': 0.19945435486178711, 'oob_split_ratio': 0.700586604945407}. Best is trial 135 with value: 0.00790160815872853.\n",
      "[I 2026-07-02 16:30:59,353] Trial 148 finished with value: 0.06505766739185911 and parameters: {'reservoir_size': 47, 'spectral_radius': 1.051579720370797, 'ar_lags': 6, 'foundation_window': 22, 'regressor_type': 'Ridge', 'reg_alpha': 3.2041190017453496, 'aci_step_size': 0.1947149451602956, 'oob_split_ratio': 0.7235797171777377}. Best is trial 135 with value: 0.00790160815872853.\n",
      "[I 2026-07-02 16:30:59,457] Trial 149 finished with value: 0.007974071750083935 and parameters: {'reservoir_size': 62, 'spectral_radius': 0.9759182521142475, 'ar_lags': 10, 'foundation_window': 24, 'regressor_type': 'ElasticNet', 'reg_alpha': 3.6706003749749225, 'aci_step_size': 0.1869877940056687, 'oob_split_ratio': 0.734198209238437}. Best is trial 135 with value: 0.00790160815872853.\n",
      "[I 2026-07-02 16:30:59,620] Trial 150 finished with value: 0.01138038540163897 and parameters: {'reservoir_size': 162, 'spectral_radius': 1.025373372464895, 'ar_lags': 6, 'foundation_window': 23, 'regressor_type': 'ElasticNet', 'reg_alpha': 6.992256417658931, 'aci_step_size': 0.1898936518976678, 'oob_split_ratio': 0.7102039352358553}. Best is trial 135 with value: 0.00790160815872853.\n",
      "[I 2026-07-02 16:30:59,718] Trial 151 finished with value: 0.007974534039733605 and parameters: {'reservoir_size': 39, 'spectral_radius': 0.9061285449116303, 'ar_lags': 7, 'foundation_window': 24, 'regressor_type': 'ElasticNet', 'reg_alpha': 2.4377125850053347, 'aci_step_size': 0.18166837715599787, 'oob_split_ratio': 0.7441319230562549}. Best is trial 135 with value: 0.00790160815872853.\n",
      "[I 2026-07-02 16:30:59,797] Trial 152 finished with value: 0.007948784014064283 and parameters: {'reservoir_size': 59, 'spectral_radius': 0.8780291287856117, 'ar_lags': 7, 'foundation_window': 24, 'regressor_type': 'ElasticNet', 'reg_alpha': 1.9256198416268542, 'aci_step_size': 0.17881230396736933, 'oob_split_ratio': 0.7321815376684954}. Best is trial 135 with value: 0.00790160815872853.\n",
      "[I 2026-07-02 16:30:59,900] Trial 153 finished with value: 0.007948784014064283 and parameters: {'reservoir_size': 57, 'spectral_radius': 1.2969037478599934, 'ar_lags': 7, 'foundation_window': 24, 'regressor_type': 'ElasticNet', 'reg_alpha': 2.979782739285172, 'aci_step_size': 0.17865662049506537, 'oob_split_ratio': 0.7323015037172318}. Best is trial 135 with value: 0.00790160815872853.\n",
      "[I 2026-07-02 16:31:00,022] Trial 154 finished with value: 0.011061937474388335 and parameters: {'reservoir_size': 58, 'spectral_radius': 1.2836938660254722, 'ar_lags': 7, 'foundation_window': 23, 'regressor_type': 'ElasticNet', 'reg_alpha': 3.9715383858126936, 'aci_step_size': 0.17984557387259517, 'oob_split_ratio': 0.731700477416656}. Best is trial 135 with value: 0.00790160815872853.\n",
      "[I 2026-07-02 16:31:00,132] Trial 155 finished with value: 0.007908904730549629 and parameters: {'reservoir_size': 49, 'spectral_radius': 1.2499202983468636, 'ar_lags': 7, 'foundation_window': 24, 'regressor_type': 'ElasticNet', 'reg_alpha': 1.8449042126532462, 'aci_step_size': 0.18497196416679013, 'oob_split_ratio': 0.7244822397381087}. Best is trial 135 with value: 0.00790160815872853.\n",
      "[I 2026-07-02 16:31:00,278] Trial 156 finished with value: 0.007964157178278114 and parameters: {'reservoir_size': 54, 'spectral_radius': 1.3228114477439705, 'ar_lags': 7, 'foundation_window': 24, 'regressor_type': 'ElasticNet', 'reg_alpha': 2.0064648198404655, 'aci_step_size': 0.1844489625739309, 'oob_split_ratio': 0.7211346744481789}. Best is trial 135 with value: 0.00790160815872853.\n",
      "[I 2026-07-02 16:31:00,387] Trial 157 finished with value: 0.007964157178278114 and parameters: {'reservoir_size': 54, 'spectral_radius': 1.3104015761899517, 'ar_lags': 7, 'foundation_window': 24, 'regressor_type': 'ElasticNet', 'reg_alpha': 1.902196172303264, 'aci_step_size': 0.19445016010613958, 'oob_split_ratio': 0.7203615339441627}. Best is trial 135 with value: 0.00790160815872853.\n",
      "[I 2026-07-02 16:31:00,486] Trial 158 finished with value: 0.007974994265035172 and parameters: {'reservoir_size': 49, 'spectral_radius': 1.3157730819874287, 'ar_lags': 7, 'foundation_window': 24, 'regressor_type': 'ElasticNet', 'reg_alpha': 1.8883314990443891, 'aci_step_size': 0.19367153457701577, 'oob_split_ratio': 0.7076663284279378}. Best is trial 135 with value: 0.00790160815872853.\n",
      "[I 2026-07-02 16:31:00,568] Trial 159 finished with value: 0.011055864483720965 and parameters: {'reservoir_size': 54, 'spectral_radius': 1.3635800224067, 'ar_lags': 7, 'foundation_window': 23, 'regressor_type': 'ElasticNet', 'reg_alpha': 2.478189345862469, 'aci_step_size': 0.18516355181049668, 'oob_split_ratio': 0.7142098259527617}. Best is trial 135 with value: 0.00790160815872853.\n",
      "[I 2026-07-02 16:31:00,651] Trial 160 finished with value: 0.007964157178278114 and parameters: {'reservoir_size': 32, 'spectral_radius': 1.1641896711094348, 'ar_lags': 7, 'foundation_window': 24, 'regressor_type': 'ElasticNet', 'reg_alpha': 2.036911696025868, 'aci_step_size': 0.19089012354231125, 'oob_split_ratio': 0.7198867285030146}. Best is trial 135 with value: 0.00790160815872853.\n",
      "[I 2026-07-02 16:31:00,763] Trial 161 finished with value: 0.007964157178278114 and parameters: {'reservoir_size': 36, 'spectral_radius': 1.1460723014761103, 'ar_lags': 7, 'foundation_window': 24, 'regressor_type': 'ElasticNet', 'reg_alpha': 2.0995137376863617, 'aci_step_size': 0.19053414384836403, 'oob_split_ratio': 0.7204012316843786}. Best is trial 135 with value: 0.00790160815872853.\n",
      "[I 2026-07-02 16:31:00,871] Trial 162 finished with value: 0.007908904730549629 and parameters: {'reservoir_size': 33, 'spectral_radius': 1.1827204481939873, 'ar_lags': 7, 'foundation_window': 24, 'regressor_type': 'ElasticNet', 'reg_alpha': 2.0057176007729187, 'aci_step_size': 0.19085301367484314, 'oob_split_ratio': 0.7244881860902245}. Best is trial 135 with value: 0.00790160815872853.\n",
      "[I 2026-07-02 16:31:00,974] Trial 163 finished with value: 0.007964157178278114 and parameters: {'reservoir_size': 32, 'spectral_radius': 1.1906051582146602, 'ar_lags': 7, 'foundation_window': 24, 'regressor_type': 'ElasticNet', 'reg_alpha': 1.7882730368461885, 'aci_step_size': 0.19612619011530702, 'oob_split_ratio': 0.7194463035312983}. Best is trial 135 with value: 0.00790160815872853.\n",
