      "[I 2026-07-02 14:58:24,412] Trial 220 finished with value: 0.03182364872455495 and parameters: {'reservoir_size': 45, 'spectral_radius': 1.2693617561801973, 'ar_lags': 2, 'foundation_window': 9, 'regressor_type': 'ElasticNet', 'reg_alpha': 0.4093571503752539, 'aci_step_size': 0.18780163635306624, 'oob_split_ratio': 0.6408362820976705}. Best is trial 25 with value: 0.030603792302848206.\n",
      "[I 2026-07-02 14:58:24,536] Trial 221 finished with value: 0.03173162813123632 and parameters: {'reservoir_size': 38, 'spectral_radius': 1.30861151848774, 'ar_lags': 2, 'foundation_window': 8, 'regressor_type': 'ElasticNet', 'reg_alpha': 0.610963945052805, 'aci_step_size': 0.19948591234775592, 'oob_split_ratio': 0.6348839555270885}. Best is trial 25 with value: 0.030603792302848206.\n",
      "[I 2026-07-02 14:58:24,668] Trial 222 finished with value: 0.03173162813123632 and parameters: {'reservoir_size': 42, 'spectral_radius': 1.316069419028995, 'ar_lags': 2, 'foundation_window': 8, 'regressor_type': 'ElasticNet', 'reg_alpha': 0.5442904316068373, 'aci_step_size': 0.19954133535012258, 'oob_split_ratio': 0.6380782063681698}. Best is trial 25 with value: 0.030603792302848206.\n",
      "[I 2026-07-02 14:58:24,765] Trial 223 finished with value: 0.03468157031752848 and parameters: {'reservoir_size': 35, 'spectral_radius': 1.3455546985201297, 'ar_lags': 2, 'foundation_window': 8, 'regressor_type': 'ElasticNet', 'reg_alpha': 0.7876670600308886, 'aci_step_size': 0.1955189675117967, 'oob_split_ratio': 0.6281640298143866}. Best is trial 25 with value: 0.030603792302848206.\n",
      "[I 2026-07-02 14:58:24,869] Trial 224 finished with value: 0.03173162813123632 and parameters: {'reservoir_size': 54, 'spectral_radius': 1.2804942036974092, 'ar_lags': 2, 'foundation_window': 8, 'regressor_type': 'ElasticNet', 'reg_alpha': 0.6848024337668244, 'aci_step_size': 0.19071472468042253, 'oob_split_ratio': 0.6443365874294611}. Best is trial 25 with value: 0.030603792302848206.\n",
      "[I 2026-07-02 14:58:24,998] Trial 225 finished with value: 0.03173162813123632 and parameters: {'reservoir_size': 30, 'spectral_radius': 1.242804584371019, 'ar_lags': 2, 'foundation_window': 8, 'regressor_type': 'Lasso', 'reg_alpha': 0.46345228650495085, 'aci_step_size': 0.19413620570891188, 'oob_split_ratio': 0.6508461851955756}. Best is trial 25 with value: 0.030603792302848206.\n",
      "[I 2026-07-02 14:58:25,086] Trial 226 finished with value: 0.03349691431061665 and parameters: {'reservoir_size': 20, 'spectral_radius': 1.3873173812671822, 'ar_lags': 2, 'foundation_window': 8, 'regressor_type': 'ElasticNet', 'reg_alpha': 0.3522647089949985, 'aci_step_size': 0.14998249160168475, 'oob_split_ratio': 0.6591795229981531}. Best is trial 25 with value: 0.030603792302848206.\n",
      "[I 2026-07-02 14:58:25,177] Trial 227 finished with value: 0.03329907409663288 and parameters: {'reservoir_size': 72, 'spectral_radius': 1.3268840488471236, 'ar_lags': 4, 'foundation_window': 8, 'regressor_type': 'ElasticNet', 'reg_alpha': 0.5781288098428905, 'aci_step_size': 0.14119266046508466, 'oob_split_ratio': 0.6370243534582588}. Best is trial 25 with value: 0.030603792302848206.\n",
      "[I 2026-07-02 14:58:25,246] Trial 228 finished with value: 0.03362018279788542 and parameters: {'reservoir_size': 45, 'spectral_radius': 0.7468344203229791, 'ar_lags': 2, 'foundation_window': 8, 'regressor_type': 'ElasticNet', 'reg_alpha': 0.4880445367681212, 'aci_step_size': 0.1164487952603994, 'oob_split_ratio': 0.6684101424707359}. Best is trial 25 with value: 0.030603792302848206.\n",
      "[I 2026-07-02 14:58:25,327] Trial 229 finished with value: 0.04823031452970389 and parameters: {'reservoir_size': 50, 'spectral_radius': 1.3606333295081918, 'ar_lags': 2, 'foundation_window': 7, 'regressor_type': 'Ridge', 'reg_alpha': 0.2073981404811699, 'aci_step_size': 0.16340367360324204, 'oob_split_ratio': 0.6475990953029717}. Best is trial 25 with value: 0.030603792302848206.\n",
      "[I 2026-07-02 14:58:25,440] Trial 230 finished with value: 0.03203567441820049 and parameters: {'reservoir_size': 38, 'spectral_radius': 1.4186799169176079, 'ar_lags': 2, 'foundation_window': 9, 'regressor_type': 'ElasticNet', 'reg_alpha': 0.2661977947057761, 'aci_step_size': 0.1737814740784555, 'oob_split_ratio': 0.6320534631366501}. Best is trial 25 with value: 0.030603792302848206.\n",
      "[I 2026-07-02 14:58:25,530] Trial 231 finished with value: 0.03173162813123632 and parameters: {'reservoir_size': 59, 'spectral_radius': 1.3571151250023425, 'ar_lags': 2, 'foundation_window': 8, 'regressor_type': 'ElasticNet', 'reg_alpha': 2.1948735940838806, 'aci_step_size': 0.13210803276717334, 'oob_split_ratio': 0.6553104123960694}. Best is trial 25 with value: 0.030603792302848206.\n",
      "[I 2026-07-02 14:58:25,638] Trial 232 finished with value: 0.03173162813123632 and parameters: {'reservoir_size': 64, 'spectral_radius': 1.4969552583984895, 'ar_lags': 2, 'foundation_window': 8, 'regressor_type': 'ElasticNet', 'reg_alpha': 1.6847760764676813, 'aci_step_size': 0.1377269989946351, 'oob_split_ratio': 0.6538682543292186}. Best is trial 25 with value: 0.030603792302848206.\n",
      "[I 2026-07-02 14:58:25,747] Trial 233 finished with value: 0.03173162813123632 and parameters: {'reservoir_size': 57, 'spectral_radius': 0.8147123244192429, 'ar_lags': 2, 'foundation_window': 8, 'regressor_type': 'ElasticNet', 'reg_alpha': 2.170035242923637, 'aci_step_size': 0.13284483377049647, 'oob_split_ratio': 0.6415932313886117}. Best is trial 25 with value: 0.030603792302848206.\n",
      "[I 2026-07-02 14:58:25,855] Trial 234 finished with value: 0.03173162813123632 and parameters: {'reservoir_size': 55, 'spectral_radius': 1.29327043295454, 'ar_lags': 2, 'foundation_window': 8, 'regressor_type': 'ElasticNet', 'reg_alpha': 1.9404079357442465, 'aci_step_size': 0.1350485443572328, 'oob_split_ratio': 0.6503943076156422}. Best is trial 25 with value: 0.030603792302848206.\n",
      "[I 2026-07-02 14:58:25,945] Trial 235 finished with value: 0.03362018279788542 and parameters: {'reservoir_size': 49, 'spectral_radius': 1.3715349658703615, 'ar_lags': 2, 'foundation_window': 8, 'regressor_type': 'ElasticNet', 'reg_alpha': 0.3932374860425693, 'aci_step_size': 0.13000989608036298, 'oob_split_ratio': 0.6585412311777814}. Best is trial 25 with value: 0.030603792302848206.\n",
      "[I 2026-07-02 14:58:26,034] Trial 236 finished with value: 0.03173162813123632 and parameters: {'reservoir_size': 23, 'spectral_radius': 0.7733481223701845, 'ar_lags': 2, 'foundation_window': 8, 'regressor_type': 'ElasticNet', 'reg_alpha': 3.683645937744167, 'aci_step_size': 0.12735253987223769, 'oob_split_ratio': 0.6448080512764465}. Best is trial 25 with value: 0.030603792302848206.\n",
      "[I 2026-07-02 14:58:26,140] Trial 237 finished with value: 0.03173162813123632 and parameters: {'reservoir_size': 31, 'spectral_radius': 1.458010595529967, 'ar_lags': 2, 'foundation_window': 8, 'regressor_type': 'ElasticNet', 'reg_alpha': 0.49887175465041667, 'aci_step_size': 0.15812418912668647, 'oob_split_ratio': 0.6534768676983086}. Best is trial 25 with value: 0.030603792302848206.\n",
      "[I 2026-07-02 14:58:26,265] Trial 238 finished with value: 0.03362018279788542 and parameters: {'reservoir_size': 133, 'spectral_radius': 1.33911990583601, 'ar_lags': 2, 'foundation_window': 8, 'regressor_type': 'ElasticNet', 'reg_alpha': 3.1084631048327167, 'aci_step_size': 0.14477627005710642, 'oob_split_ratio': 0.6628142643699659}. Best is trial 25 with value: 0.030603792302848206.\n",
      "[I 2026-07-02 14:58:26,351] Trial 239 finished with value: 0.03468157031752848 and parameters: {'reservoir_size': 59, 'spectral_radius': 0.9188430474676592, 'ar_lags': 2, 'foundation_window': 8, 'regressor_type': 'ElasticNet', 'reg_alpha': 0.6226747167685432, 'aci_step_size': 0.14750078235059969, 'oob_split_ratio': 0.6225331053404414}. Best is trial 25 with value: 0.030603792302848206.\n",
      "[I 2026-07-02 14:58:26,435] Trial 240 finished with value: 0.03234599605480474 and parameters: {'reservoir_size': 40, 'spectral_radius': 1.2178111804256566, 'ar_lags': 2, 'foundation_window': 9, 'regressor_type': 'ElasticNet', 'reg_alpha': 0.3157915706663023, 'aci_step_size': 0.15208391846797478, 'oob_split_ratio': 0.6408068546919555}. Best is trial 25 with value: 0.030603792302848206.\n",
      "[I 2026-07-02 14:58:26,539] Trial 241 finished with value: 0.03173162813123632 and parameters: {'reservoir_size': 47, 'spectral_radius': 1.4360205098269578, 'ar_lags': 2, 'foundation_window': 8, 'regressor_type': 'ElasticNet', 'reg_alpha': 0.6944469341563355, 'aci_step_size': 0.13915099120799715, 'oob_split_ratio': 0.6472823944517936}. Best is trial 25 with value: 0.030603792302848206.\n",
      "[I 2026-07-02 14:58:26,644] Trial 242 finished with value: 0.03173162813123632 and parameters: {'reservoir_size': 53, 'spectral_radius': 1.4636425053064965, 'ar_lags': 2, 'foundation_window': 8, 'regressor_type': 'ElasticNet', 'reg_alpha': 0.7536686632463311, 'aci_step_size': 0.13514308265769506, 'oob_split_ratio': 0.6467493647845532}. Best is trial 25 with value: 0.030603792302848206.\n",
      "[I 2026-07-02 14:58:26,752] Trial 243 finished with value: 0.03173162813123632 and parameters: {'reservoir_size': 44, 'spectral_radius': 1.447734319952365, 'ar_lags': 2, 'foundation_window': 8, 'regressor_type': 'ElasticNet', 'reg_alpha': 2.5447585017059735, 'aci_step_size': 0.1412363512095309, 'oob_split_ratio': 0.6366996275792863}. Best is trial 25 with value: 0.030603792302848206.\n",
      "[I 2026-07-02 14:58:26,863] Trial 244 finished with value: 0.03173162813123632 and parameters: {'reservoir_size': 48, 'spectral_radius': 1.4764530587084088, 'ar_lags': 2, 'foundation_window': 8, 'regressor_type': 'ElasticNet', 'reg_alpha': 0.815248354236699, 'aci_step_size': 0.13619738776916787, 'oob_split_ratio': 0.6516778741820629}. Best is trial 25 with value: 0.030603792302848206.\n",
      "[I 2026-07-02 14:58:26,970] Trial 245 finished with value: 0.03173162813123632 and parameters: {'reservoir_size': 35, 'spectral_radius': 1.409305256000747, 'ar_lags': 2, 'foundation_window': 8, 'regressor_type': 'ElasticNet', 'reg_alpha': 0.4239886445383762, 'aci_step_size': 0.19690393807301468, 'oob_split_ratio': 0.643605979075884}. Best is trial 25 with value: 0.030603792302848206.\n",
      "[I 2026-07-02 14:58:27,078] Trial 246 finished with value: 0.03173162813123632 and parameters: {'reservoir_size': 66, 'spectral_radius': 1.1136806353587057, 'ar_lags': 2, 'foundation_window': 8, 'regressor_type': 'ElasticNet', 'reg_alpha': 2.347759785616952, 'aci_step_size': 0.1461419806003629, 'oob_split_ratio': 0.648239800592281}. Best is trial 25 with value: 0.030603792302848206.\n",
      "[I 2026-07-02 14:58:27,188] Trial 247 finished with value: 0.03173162813123632 and parameters: {'reservoir_size': 27, 'spectral_radius': 1.2566956022601876, 'ar_lags': 2, 'foundation_window': 8, 'regressor_type': 'ElasticNet', 'reg_alpha': 0.6371326340043943, 'aci_step_size': 0.18656008524596893, 'oob_split_ratio': 0.6568285542280874}. Best is trial 25 with value: 0.030603792302848206.\n",
      "[I 2026-07-02 14:58:27,297] Trial 248 finished with value: 0.03173162813123632 and parameters: {'reservoir_size': 41, 'spectral_radius': 1.3943098118502248, 'ar_lags': 2, 'foundation_window': 8, 'regressor_type': 'ElasticNet', 'reg_alpha': 0.5213788698800829, 'aci_step_size': 0.1396076268545125, 'oob_split_ratio': 0.6404791562422392}. Best is trial 25 with value: 0.030603792302848206.\n",
      "[I 2026-07-02 14:58:27,429] Trial 249 finished with value: 0.03182364872455495 and parameters: {'reservoir_size': 51, 'spectral_radius': 1.4291941976221665, 'ar_lags': 2, 'foundation_window': 9, 'regressor_type': 'ElasticNet', 'reg_alpha': 0.5722125767302534, 'aci_step_size': 0.19173300763403042, 'oob_split_ratio': 0.6323592872399604}. Best is trial 25 with value: 0.030603792302848206.\n",
      "[I 2026-07-02 14:58:27,519] Trial 250 finished with value: 0.0355645873544304 and parameters: {'reservoir_size': 60, 'spectral_radius': 1.3245317729480768, 'ar_lags': 2, 'foundation_window': 3, 'regressor_type': 'ElasticNet', 'reg_alpha': 0.34409795240381313, 'aci_step_size': 0.13120486319219268, 'oob_split_ratio': 0.6535665196049454}. Best is trial 25 with value: 0.030603792302848206.\n",
      "[I 2026-07-02 14:58:27,611] Trial 251 finished with value: 0.03176898323917366 and parameters: {'reservoir_size': 46, 'spectral_radius': 1.455239720993412, 'ar_lags': 2, 'foundation_window': 8, 'regressor_type': 'Ridge', 'reg_alpha': 0.28348047156145567, 'aci_step_size': 0.1242373192165566, 'oob_split_ratio': 0.6450629594517213}. Best is trial 25 with value: 0.030603792302848206.\n",
      "[I 2026-07-02 14:58:27,681] Trial 252 finished with value: 0.03446327945304043 and parameters: {'reservoir_size': 54, 'spectral_radius': 1.360164689645122, 'ar_lags': 2, 'foundation_window': 8, 'regressor_type': 'ElasticNet', 'reg_alpha': 0.22453397616497936, 'aci_step_size': 0.1685333733060802, 'oob_split_ratio': 0.6369765137605721}. Best is trial 25 with value: 0.030603792302848206.\n",
      "[I 2026-07-02 14:58:27,754] Trial 253 finished with value: 0.033651824383875685 and parameters: {'reservoir_size': 34, 'spectral_radius': 1.2353242578280008, 'ar_lags': 2, 'foundation_window': 8, 'regressor_type': 'ElasticNet', 'reg_alpha': 0.15195291122404023, 'aci_step_size': 0.15063281535866388, 'oob_split_ratio': 0.6624176489799506}. Best is trial 25 with value: 0.030603792302848206.\n",
      "[I 2026-07-02 14:58:27,877] Trial 254 finished with value: 0.03182364872455495 and parameters: {'reservoir_size': 29, 'spectral_radius': 1.403162868010177, 'ar_lags': 2, 'foundation_window': 9, 'regressor_type': 'ElasticNet', 'reg_alpha': 0.3843650305620359, 'aci_step_size': 0.15655118335667975, 'oob_split_ratio': 0.6508213796022783}. Best is trial 25 with value: 0.030603792302848206.\n",
      "[I 2026-07-02 14:58:27,986] Trial 255 finished with value: 0.03173162813123632 and parameters: {'reservoir_size': 43, 'spectral_radius': 1.4804893137703268, 'ar_lags': 2, 'foundation_window': 8, 'regressor_type': 'ElasticNet', 'reg_alpha': 0.8887782671157806, 'aci_step_size': 0.14303544073971783, 'oob_split_ratio': 0.643043592065256}. Best is trial 25 with value: 0.030603792302848206.\n",
      "[I 2026-07-02 14:58:28,081] Trial 256 finished with value: 0.03362018279788542 and parameters: {'reservoir_size': 22, 'spectral_radius': 1.1801531751270273, 'ar_lags': 2, 'foundation_window': 8, 'regressor_type': 'ElasticNet', 'reg_alpha': 1.5303458640129792, 'aci_step_size': 0.1999268938701139, 'oob_split_ratio': 0.6579854001891352}. Best is trial 25 with value: 0.030603792302848206.\n",
      "[I 2026-07-02 14:58:28,168] Trial 257 finished with value: 0.03173162813123632 and parameters: {'reservoir_size': 72, 'spectral_radius': 1.2903535639914459, 'ar_lags': 2, 'foundation_window': 8, 'regressor_type': 'ElasticNet', 'reg_alpha': 1.8361583932543086, 'aci_step_size': 0.15423713536642075, 'oob_split_ratio': 0.6486409214027201}. Best is trial 25 with value: 0.030603792302848206.\n",
      "[I 2026-07-02 14:58:28,297] Trial 258 finished with value: 0.03182364872455495 and parameters: {'reservoir_size': 37, 'spectral_radius': 1.380597772789981, 'ar_lags': 2, 'foundation_window': 9, 'regressor_type': 'ElasticNet', 'reg_alpha': 0.7079465681950687, 'aci_step_size': 0.18216909809161075, 'oob_split_ratio': 0.6364474926593534}. Best is trial 25 with value: 0.030603792302848206.\n",
      "[I 2026-07-02 14:58:28,407] Trial 259 finished with value: 0.035876027360082795 and parameters: {'reservoir_size': 63, 'spectral_radius': 1.4367457777819603, 'ar_lags': 5, 'foundation_window': 8, 'regressor_type': 'Lasso', 'reg_alpha': 0.46905480255208276, 'aci_step_size': 0.1202650739093589, 'oob_split_ratio': 0.6304237446440911}. Best is trial 25 with value: 0.030603792302848206.\n",
      "[I 2026-07-02 14:58:28,488] Trial 260 finished with value: 0.03175639850720163 and parameters: {'reservoir_size': 50, 'spectral_radius': 1.3452678193797476, 'ar_lags': 3, 'foundation_window': 8, 'regressor_type': 'ElasticNet', 'reg_alpha': 0.5563096227919329, 'aci_step_size': 0.17813087208090028, 'oob_split_ratio': 0.6426611491185179}. Best is trial 25 with value: 0.030603792302848206.\n",
      "[I 2026-07-02 14:58:28,554] Trial 261 finished with value: 0.0334963619192261 and parameters: {'reservoir_size': 13, 'spectral_radius': 1.2718983096109482, 'ar_lags': 2, 'foundation_window': 8, 'regressor_type': 'ElasticNet', 'reg_alpha': 0.2378819228553816, 'aci_step_size': 0.13339812748554247, 'oob_split_ratio': 0.6545358433732373}. Best is trial 25 with value: 0.030603792302848206.\n",
      "[I 2026-07-02 14:58:28,660] Trial 262 finished with value: 0.03426641346973274 and parameters: {'reservoir_size': 58, 'spectral_radius': 1.31708850085125, 'ar_lags': 2, 'foundation_window': 9, 'regressor_type': 'Ridge', 'reg_alpha': 0.42092144812962046, 'aci_step_size': 0.11260376108203957, 'oob_split_ratio': 0.6653467293276994}. Best is trial 25 with value: 0.030603792302848206.\n",
      "[I 2026-07-02 14:58:28,796] Trial 263 finished with value: 0.032755380142868565 and parameters: {'reservoir_size': 26, 'spectral_radius': 1.0770177102267577, 'ar_lags': 2, 'foundation_window': 6, 'regressor_type': 'ElasticNet', 'reg_alpha': 0.18872973366837878, 'aci_step_size': 0.16152133997487314, 'oob_split_ratio': 0.6480868337567943}. Best is trial 25 with value: 0.030603792302848206.\n",
      "[I 2026-07-02 14:58:28,896] Trial 264 finished with value: 0.03362018279788542 and parameters: {'reservoir_size': 40, 'spectral_radius': 0.8693153948541635, 'ar_lags': 2, 'foundation_window': 8, 'regressor_type': 'ElasticNet', 'reg_alpha': 0.35406091824517405, 'aci_step_size': 0.14708994379089785, 'oob_split_ratio': 0.8405503697744146}. Best is trial 25 with value: 0.030603792302848206.\n",
      "[I 2026-07-02 14:58:28,973] Trial 265 finished with value: 0.03158618521836383 and parameters: {'reservoir_size': 32, 'spectral_radius': 1.2044449245789355, 'ar_lags': 2, 'foundation_window': 8, 'regressor_type': 'ElasticNet', 'reg_alpha': 0.28758606592546493, 'aci_step_size': 0.13736147319510675, 'oob_split_ratio': 0.6405024665096074}. Best is trial 25 with value: 0.030603792302848206.\n",
      "[I 2026-07-02 14:58:29,059] Trial 266 finished with value: 0.03173162813123632 and parameters: {'reservoir_size': 31, 'spectral_radius': 1.2021903094284514, 'ar_lags': 2, 'foundation_window': 8, 'regressor_type': 'ElasticNet', 'reg_alpha': 0.29967454919229247, 'aci_step_size': 0.12925547278401153, 'oob_split_ratio': 0.6381220190283454}. Best is trial 25 with value: 0.030603792302848206.\n",
      "[I 2026-07-02 14:58:29,162] Trial 267 finished with value: 0.03402824617939137 and parameters: {'reservoir_size': 34, 'spectral_radius': 1.2138843106288926, 'ar_lags': 2, 'foundation_window': 7, 'regressor_type': 'ElasticNet', 'reg_alpha': 0.2622380422890697, 'aci_step_size': 0.18945680963506475, 'oob_split_ratio': 0.6255341509094537}. Best is trial 25 with value: 0.030603792302848206.\n",
      "[I 2026-07-02 14:58:29,231] Trial 268 finished with value: 0.03370015535437848 and parameters: {'reservoir_size': 6, 'spectral_radius': 1.1866626847591404, 'ar_lags': 2, 'foundation_window': 9, 'regressor_type': 'ElasticNet', 'reg_alpha': 0.3248897860739873, 'aci_step_size': 0.1370626257228918, 'oob_split_ratio': 0.6770069703404905}. Best is trial 25 with value: 0.030603792302848206.\n",
      "[I 2026-07-02 14:58:29,344] Trial 269 finished with value: 0.03373106292575986 and parameters: {'reservoir_size': 19, 'spectral_radius': 1.143279845132789, 'ar_lags': 2, 'foundation_window': 8, 'regressor_type': 'ElasticNet', 'reg_alpha': 0.24234443057170996, 'aci_step_size': 0.19578446926359988, 'oob_split_ratio': 0.6314523234405733}. Best is trial 25 with value: 0.030603792302848206.\n",
      "[I 2026-07-02 14:58:29,420] Trial 270 finished with value: 0.034589010924541974 and parameters: {'reservoir_size': 24, 'spectral_radius': 1.2516476821770641, 'ar_lags': 6, 'foundation_window': 8, 'regressor_type': 'ElasticNet', 'reg_alpha': 0.2769066284592675, 'aci_step_size': 0.10506225362804605, 'oob_split_ratio': 0.6399440846024023}. Best is trial 25 with value: 0.030603792302848206.\n",
      "[I 2026-07-02 14:58:29,524] Trial 271 finished with value: 0.03388786183258468 and parameters: {'reservoir_size': 29, 'spectral_radius': 1.230286748781162, 'ar_lags': 2, 'foundation_window': 8, 'regressor_type': 'ElasticNet', 'reg_alpha': 0.20872020879566053, 'aci_step_size': 0.1664564808795503, 'oob_split_ratio': 0.6521971054786511}. Best is trial 25 with value: 0.030603792302848206.\n",
      "[I 2026-07-02 14:58:29,630] Trial 272 finished with value: 0.03370015535437848 and parameters: {'reservoir_size': 68, 'spectral_radius': 0.71571259497152, 'ar_lags': 2, 'foundation_window': 9, 'regressor_type': 'ElasticNet', 'reg_alpha': 0.44443734541519014, 'aci_step_size': 0.15270212701230168, 'oob_split_ratio': 0.6596621715993605}. Best is trial 25 with value: 0.030603792302848206.\n",
      "[I 2026-07-02 14:58:29,753] Trial 273 finished with value: 0.03166994542594465 and parameters: {'reservoir_size': 78, 'spectral_radius': 1.3695444009050601, 'ar_lags': 2, 'foundation_window': 8, 'regressor_type': 'ElasticNet', 'reg_alpha': 0.3717945667550613, 'aci_step_size': 0.14267540583284738, 'oob_split_ratio': 0.6433887437292387}. Best is trial 25 with value: 0.030603792302848206.\n",
      "[I 2026-07-02 14:58:29,857] Trial 274 finished with value: 0.035230741036795084 and parameters: {'reservoir_size': 37, 'spectral_radius': 1.3763875988763359, 'ar_lags': 2, 'foundation_window': 8, 'regressor_type': 'Ridge', 'reg_alpha': 0.3578342415461123, 'aci_step_size': 0.14390418883315068, 'oob_split_ratio': 0.635601769919414}. Best is trial 25 with value: 0.030603792302848206.\n",
