      "[I 2026-07-02 16:32:44,019] Trial 240 finished with value: inf and parameters: {'reservoir_size': 174, 'spectral_radius': 0.9075149881027615, 'ar_lags': 4, 'foundation_window': 4, 'regressor_type': 'Lasso', 'reg_alpha': 21.67415418237751, 'aci_step_size': 0.07158902141405685, 'oob_split_ratio': 0.7174639720933106}. Best is trial 0 with value: inf.\n",
      "[I 2026-07-02 16:32:44,077] Trial 241 finished with value: inf and parameters: {'reservoir_size': 118, 'spectral_radius': 1.2775893650861223, 'ar_lags': 3, 'foundation_window': 3, 'regressor_type': 'ElasticNet', 'reg_alpha': 0.790071475678227, 'aci_step_size': 0.18473901802502526, 'oob_split_ratio': 0.693208347576045}. Best is trial 0 with value: inf.\n",
      "[I 2026-07-02 16:32:44,137] Trial 242 finished with value: inf and parameters: {'reservoir_size': 127, 'spectral_radius': 1.4992444047510765, 'ar_lags': 3, 'foundation_window': 3, 'regressor_type': 'ElasticNet', 'reg_alpha': 0.9863472248968593, 'aci_step_size': 0.1400155252774568, 'oob_split_ratio': 0.7035279080508785}. Best is trial 0 with value: inf.\n",
      "[I 2026-07-02 16:32:44,195] Trial 243 finished with value: inf and parameters: {'reservoir_size': 111, 'spectral_radius': 1.0713480587497488, 'ar_lags': 3, 'foundation_window': 3, 'regressor_type': 'ElasticNet', 'reg_alpha': 1.29157113609507, 'aci_step_size': 0.103754554948871, 'oob_split_ratio': 0.7223349668939769}. Best is trial 0 with value: inf.\n",
      "[I 2026-07-02 16:32:44,256] Trial 244 finished with value: inf and parameters: {'reservoir_size': 121, 'spectral_radius': 1.3292987514149366, 'ar_lags': 3, 'foundation_window': 3, 'regressor_type': 'ElasticNet', 'reg_alpha': 29.362251397546075, 'aci_step_size': 0.13368669834421693, 'oob_split_ratio': 0.6803083987662949}. Best is trial 0 with value: inf.\n",
      "[I 2026-07-02 16:32:44,315] Trial 245 finished with value: inf and parameters: {'reservoir_size': 132, 'spectral_radius': 1.3654344018541928, 'ar_lags': 3, 'foundation_window': 3, 'regressor_type': 'Ridge', 'reg_alpha': 0.4943932701974922, 'aci_step_size': 0.1422991372608337, 'oob_split_ratio': 0.6955214629185319}. Best is trial 0 with value: inf.\n",
      "[I 2026-07-02 16:32:44,400] Trial 246 finished with value: inf and parameters: {'reservoir_size': 196, 'spectral_radius': 1.3031670959487425, 'ar_lags': 2, 'foundation_window': 3, 'regressor_type': 'ElasticNet', 'reg_alpha': 10.165804793976486, 'aci_step_size': 0.13591526294430378, 'oob_split_ratio': 0.6775614166158624}. Best is trial 0 with value: inf.\n",
      "[I 2026-07-02 16:32:44,453] Trial 247 finished with value: inf and parameters: {'reservoir_size': 90, 'spectral_radius': 1.3422413341855228, 'ar_lags': 3, 'foundation_window': 6, 'regressor_type': 'Lasso', 'reg_alpha': 0.40624591375050234, 'aci_step_size': 0.022322633515268895, 'oob_split_ratio': 0.7747250379165846}. Best is trial 0 with value: inf.\n",
      "[I 2026-07-02 16:32:44,508] Trial 248 finished with value: inf and parameters: {'reservoir_size': 117, 'spectral_radius': 1.3159036933927464, 'ar_lags': 4, 'foundation_window': 5, 'regressor_type': 'Ridge', 'reg_alpha': 0.22727098417526653, 'aci_step_size': 0.09853814664223497, 'oob_split_ratio': 0.7132318384795446}. Best is trial 0 with value: inf.\n",
      "[I 2026-07-02 16:32:44,568] Trial 249 finished with value: inf and parameters: {'reservoir_size': 123, 'spectral_radius': 1.240122216890358, 'ar_lags': 4, 'foundation_window': 4, 'regressor_type': 'ElasticNet', 'reg_alpha': 49.78308510533655, 'aci_step_size': 0.06138652462033037, 'oob_split_ratio': 0.7935149986180732}. Best is trial 0 with value: inf.\n",
      "[I 2026-07-02 16:32:44,651] Trial 250 finished with value: inf and parameters: {'reservoir_size': 190, 'spectral_radius': 1.2677614559845953, 'ar_lags': 3, 'foundation_window': 3, 'regressor_type': 'Lasso', 'reg_alpha': 0.5729834611489049, 'aci_step_size': 0.1094357285001578, 'oob_split_ratio': 0.6663461500817713}. Best is trial 0 with value: inf.\n",
      "[I 2026-07-02 16:32:44,698] Trial 251 finished with value: inf and parameters: {'reservoir_size': 54, 'spectral_radius': 0.9771986029238492, 'ar_lags': 2, 'foundation_window': 5, 'regressor_type': 'Ridge', 'reg_alpha': 0.12373486304575332, 'aci_step_size': 0.03953721896314162, 'oob_split_ratio': 0.6834636181627773}. Best is trial 0 with value: inf.\n",
      "[I 2026-07-02 16:32:44,741] Trial 252 finished with value: inf and parameters: {'reservoir_size': 10, 'spectral_radius': 0.6269694162309962, 'ar_lags': 4, 'foundation_window': 4, 'regressor_type': 'Lasso', 'reg_alpha': 2.7818830134590646, 'aci_step_size': 0.15442365430878774, 'oob_split_ratio': 0.707936708363581}. Best is trial 0 with value: inf.\n",
      "[I 2026-07-02 16:32:44,775] Trial 253 finished with value: inf and parameters: {'reservoir_size': 78, 'spectral_radius': 0.810958838751517, 'ar_lags': 3, 'foundation_window': 3, 'regressor_type': 'ElasticNet', 'reg_alpha': 42.15800537479905, 'aci_step_size': 0.11707510246655034, 'oob_split_ratio': 0.6989567179002167}. Best is trial 0 with value: inf.\n",
      "[I 2026-07-02 16:32:44,809] Trial 254 finished with value: inf and parameters: {'reservoir_size': 83, 'spectral_radius': 0.694669278523005, 'ar_lags': 4, 'foundation_window': 6, 'regressor_type': 'Ridge', 'reg_alpha': 2.337979821490729, 'aci_step_size': 0.07643800284602156, 'oob_split_ratio': 0.7806828367761026}. Best is trial 0 with value: inf.\n",
      "[I 2026-07-02 16:32:44,853] Trial 255 finished with value: inf and parameters: {'reservoir_size': 114, 'spectral_radius': 0.7137696862469108, 'ar_lags': 2, 'foundation_window': 4, 'regressor_type': 'Lasso', 'reg_alpha': 25.45337962849924, 'aci_step_size': 0.08326333074325623, 'oob_split_ratio': 0.810815962369636}. Best is trial 0 with value: inf.\n",
      "[I 2026-07-02 16:32:44,903] Trial 256 finished with value: inf and parameters: {'reservoir_size': 30, 'spectral_radius': 1.4034065591355467, 'ar_lags': 3, 'foundation_window': 4, 'regressor_type': 'ElasticNet', 'reg_alpha': 4.679339575014764, 'aci_step_size': 0.09133482570847817, 'oob_split_ratio': 0.611591395564688}. Best is trial 0 with value: inf.\n",
      "[I 2026-07-02 16:32:44,962] Trial 257 finished with value: inf and parameters: {'reservoir_size': 108, 'spectral_radius': 1.1235258119404137, 'ar_lags': 4, 'foundation_window': 5, 'regressor_type': 'Ridge', 'reg_alpha': 34.84869359775337, 'aci_step_size': 0.12258463329831071, 'oob_split_ratio': 0.8258699797060063}. Best is trial 0 with value: inf.\n",
      "[I 2026-07-02 16:32:45,017] Trial 258 finished with value: inf and parameters: {'reservoir_size': 99, 'spectral_radius': 1.455491446479658, 'ar_lags': 3, 'foundation_window': 3, 'regressor_type': 'Lasso', 'reg_alpha': 1.7599209428263938, 'aci_step_size': 0.1460239651707877, 'oob_split_ratio': 0.6719839078391568}. Best is trial 0 with value: inf.\n",
      "[I 2026-07-02 16:32:45,061] Trial 259 finished with value: inf and parameters: {'reservoir_size': 23, 'spectral_radius': 1.2896634130329605, 'ar_lags': 4, 'foundation_window': 6, 'regressor_type': 'ElasticNet', 'reg_alpha': 1.4797379345599706, 'aci_step_size': 0.13051770081813605, 'oob_split_ratio': 0.8400998558607912}. Best is trial 0 with value: inf.\n",
      "[I 2026-07-02 16:32:45,107] Trial 260 finished with value: inf and parameters: {'reservoir_size': 42, 'spectral_radius': 1.1839151892751052, 'ar_lags': 2, 'foundation_window': 4, 'regressor_type': 'Ridge', 'reg_alpha': 18.58985300303052, 'aci_step_size': 0.012496604984974288, 'oob_split_ratio': 0.6885335640236492}. Best is trial 0 with value: inf.\n",
      "[I 2026-07-02 16:32:45,162] Trial 261 finished with value: inf and parameters: {'reservoir_size': 130, 'spectral_radius': 0.553909011267871, 'ar_lags': 4, 'foundation_window': 3, 'regressor_type': 'Lasso', 'reg_alpha': 14.668656282539464, 'aci_step_size': 0.025591594376684876, 'oob_split_ratio': 0.7641513897466942}. Best is trial 0 with value: inf.\n",
      "[I 2026-07-02 16:32:45,235] Trial 262 finished with value: inf and parameters: {'reservoir_size': 167, 'spectral_radius': 0.8387797894094858, 'ar_lags': 3, 'foundation_window': 5, 'regressor_type': 'ElasticNet', 'reg_alpha': 0.16599967665527554, 'aci_step_size': 0.16839915380448273, 'oob_split_ratio': 0.7545229319131244}. Best is trial 0 with value: inf.\n",
      "[I 2026-07-02 16:32:45,311] Trial 263 finished with value: inf and parameters: {'reservoir_size': 161, 'spectral_radius': 1.3820031047411219, 'ar_lags': 2, 'foundation_window': 4, 'regressor_type': 'Ridge', 'reg_alpha': 6.0571267839135166, 'aci_step_size': 0.06818783391250362, 'oob_split_ratio': 0.737288624904634}. Best is trial 0 with value: inf.\n",
      "[I 2026-07-02 16:32:45,356] Trial 264 finished with value: inf and parameters: {'reservoir_size': 1, 'spectral_radius': 0.5867266453998232, 'ar_lags': 4, 'foundation_window': 6, 'regressor_type': 'Lasso', 'reg_alpha': 1.1179645151811441, 'aci_step_size': 0.1125970447969533, 'oob_split_ratio': 0.607298691608068}. Best is trial 0 with value: inf.\n",
      "[I 2026-07-02 16:32:45,418] Trial 265 finished with value: inf and parameters: {'reservoir_size': 141, 'spectral_radius': 1.4658868670525098, 'ar_lags': 4, 'foundation_window': 3, 'regressor_type': 'ElasticNet', 'reg_alpha': 2.0351406667964875, 'aci_step_size': 0.18113079774323512, 'oob_split_ratio': 0.6197203693618123}. Best is trial 0 with value: inf.\n",
      "[I 2026-07-02 16:32:45,464] Trial 266 finished with value: inf and parameters: {'reservoir_size': 17, 'spectral_radius': 1.3393408406978868, 'ar_lags': 3, 'foundation_window': 5, 'regressor_type': 'Ridge', 'reg_alpha': 3.95733670347602, 'aci_step_size': 0.07939769986468848, 'oob_split_ratio': 0.8020734072598136}. Best is trial 0 with value: inf.\n",
      "[I 2026-07-02 16:32:45,511] Trial 267 finished with value: inf and parameters: {'reservoir_size': 68, 'spectral_radius': 1.4383754434545182, 'ar_lags': 2, 'foundation_window': 4, 'regressor_type': 'Lasso', 'reg_alpha': 8.619302130190938, 'aci_step_size': 0.12541717970357347, 'oob_split_ratio': 0.7197532634212614}. Best is trial 0 with value: inf.\n",
      "[I 2026-07-02 16:32:45,545] Trial 268 finished with value: inf and parameters: {'reservoir_size': 5, 'spectral_radius': 1.0003345163130988, 'ar_lags': 4, 'foundation_window': 3, 'regressor_type': 'ElasticNet', 'reg_alpha': 16.794827121812094, 'aci_step_size': 0.08590590718511136, 'oob_split_ratio': 0.6475133823107969}. Best is trial 0 with value: inf.\n",
      "[I 2026-07-02 16:32:45,579] Trial 269 finished with value: inf and parameters: {'reservoir_size': 60, 'spectral_radius': 1.2576326374821598, 'ar_lags': 3, 'foundation_window': 4, 'regressor_type': 'Ridge', 'reg_alpha': 3.2850899175367987, 'aci_step_size': 0.05452844912077855, 'oob_split_ratio': 0.7496009324001112}. Best is trial 0 with value: inf.\n",
      "[I 2026-07-02 16:32:45,627] Trial 270 finished with value: inf and parameters: {'reservoir_size': 126, 'spectral_radius': 1.4844067442289888, 'ar_lags': 4, 'foundation_window': 5, 'regressor_type': 'Lasso', 'reg_alpha': 2.563068543548745, 'aci_step_size': 0.16087446294363938, 'oob_split_ratio': 0.6007770386991839}. Best is trial 0 with value: inf.\n",
      "[I 2026-07-02 16:32:45,709] Trial 271 finished with value: inf and parameters: {'reservoir_size': 184, 'spectral_radius': 0.6713300235146684, 'ar_lags': 2, 'foundation_window': 6, 'regressor_type': 'Lasso', 'reg_alpha': 0.7101993629849577, 'aci_step_size': 0.09600593974271503, 'oob_split_ratio': 0.7680265838169873}. Best is trial 0 with value: inf.\n",
      "[I 2026-07-02 16:32:45,789] Trial 272 finished with value: inf and parameters: {'reservoir_size': 178, 'spectral_radius': 0.5002790996102519, 'ar_lags': 4, 'foundation_window': 4, 'regressor_type': 'ElasticNet', 'reg_alpha': 0.30490951482413126, 'aci_step_size': 0.13734758134469346, 'oob_split_ratio': 0.6369844499239237}. Best is trial 0 with value: inf.\n",
      "[I 2026-07-02 16:32:45,834] Trial 273 finished with value: inf and parameters: {'reservoir_size': 36, 'spectral_radius': 1.2061110319203283, 'ar_lags': 3, 'foundation_window': 3, 'regressor_type': 'Ridge', 'reg_alpha': 6.848945698005708, 'aci_step_size': 0.15027611451885484, 'oob_split_ratio': 0.625934482231123}. Best is trial 0 with value: inf.\n",
      "[I 2026-07-02 16:32:45,881] Trial 274 finished with value: inf and parameters: {'reservoir_size': 74, 'spectral_radius': 1.3629984180420545, 'ar_lags': 4, 'foundation_window': 6, 'regressor_type': 'Lasso', 'reg_alpha': 20.524981477193297, 'aci_step_size': 0.029482872104815847, 'oob_split_ratio': 0.6608546739518573}. Best is trial 0 with value: inf.\n",
      "[I 2026-07-02 16:32:45,917] Trial 275 finished with value: inf and parameters: {'reservoir_size': 87, 'spectral_radius': 0.9076708633106372, 'ar_lags': 2, 'foundation_window': 3, 'regressor_type': 'ElasticNet', 'reg_alpha': 28.918038384891975, 'aci_step_size': 0.016252978657746144, 'oob_split_ratio': 0.7588910632965663}. Best is trial 0 with value: inf.\n",
      "[I 2026-07-02 16:32:45,949] Trial 276 finished with value: inf and parameters: {'reservoir_size': 50, 'spectral_radius': 0.964925895888002, 'ar_lags': 3, 'foundation_window': 5, 'regressor_type': 'Ridge', 'reg_alpha': 0.19762268807686567, 'aci_step_size': 0.17239289838298755, 'oob_split_ratio': 0.6807149973603547}. Best is trial 0 with value: inf.\n",
      "[I 2026-07-02 16:32:45,981] Trial 277 finished with value: inf and parameters: {'reservoir_size': 13, 'spectral_radius': 0.7709003363473268, 'ar_lags': 4, 'foundation_window': 4, 'regressor_type': 'Lasso', 'reg_alpha': 2.9461843043586313, 'aci_step_size': 0.14372137233138035, 'oob_split_ratio': 0.6749393407667845}. Best is trial 0 with value: inf.\n",
      "[I 2026-07-02 16:32:46,025] Trial 278 finished with value: inf and parameters: {'reservoir_size': 102, 'spectral_radius': 1.3162502152462199, 'ar_lags': 2, 'foundation_window': 5, 'regressor_type': 'ElasticNet', 'reg_alpha': 2.25075784016348, 'aci_step_size': 0.10527684805917326, 'oob_split_ratio': 0.7250606482537818}. Best is trial 0 with value: inf.\n",
      "[I 2026-07-02 16:32:46,098] Trial 279 finished with value: inf and parameters: {'reservoir_size': 156, 'spectral_radius': 1.422633503067292, 'ar_lags': 4, 'foundation_window': 3, 'regressor_type': 'Ridge', 'reg_alpha': 12.152782007361175, 'aci_step_size': 0.02002313520330834, 'oob_split_ratio': 0.6668082372728198}. Best is trial 0 with value: inf.\n",
      "[I 2026-07-02 16:32:46,163] Trial 280 finished with value: inf and parameters: {'reservoir_size': 145, 'spectral_radius': 1.2281112502727916, 'ar_lags': 3, 'foundation_window': 4, 'regressor_type': 'Lasso', 'reg_alpha': 23.790895025759983, 'aci_step_size': 0.12036956706860054, 'oob_split_ratio': 0.8057914696023752}. Best is trial 0 with value: inf.\n",
      "[I 2026-07-02 16:32:46,227] Trial 281 finished with value: inf and parameters: {'reservoir_size': 135, 'spectral_radius': 1.0637113836312009, 'ar_lags': 4, 'foundation_window': 6, 'regressor_type': 'ElasticNet', 'reg_alpha': 0.8710138547179259, 'aci_step_size': 0.1273892421380558, 'oob_split_ratio': 0.7041530871921501}. Best is trial 0 with value: inf.\n",
      "[I 2026-07-02 16:32:46,280] Trial 282 finished with value: inf and parameters: {'reservoir_size': 44, 'spectral_radius': 0.6046832068362024, 'ar_lags': 3, 'foundation_window': 5, 'regressor_type': 'Ridge', 'reg_alpha': 0.35095073005934885, 'aci_step_size': 0.11516361056347835, 'oob_split_ratio': 0.7899264272226766}. Best is trial 0 with value: inf.\n",
      "[I 2026-07-02 16:32:46,340] Trial 283 finished with value: inf and parameters: {'reservoir_size': 120, 'spectral_radius': 1.0872187788652063, 'ar_lags': 4, 'foundation_window': 3, 'regressor_type': 'Lasso', 'reg_alpha': 1.3079395249788082, 'aci_step_size': 0.1023833032997823, 'oob_split_ratio': 0.6196696193761152}. Best is trial 0 with value: inf.\n",
      "[I 2026-07-02 16:32:46,398] Trial 284 finished with value: inf and parameters: {'reservoir_size': 111, 'spectral_radius': 1.4833259138631107, 'ar_lags': 3, 'foundation_window': 4, 'regressor_type': 'ElasticNet', 'reg_alpha': 0.44615222288734996, 'aci_step_size': 0.0473274977005428, 'oob_split_ratio': 0.6148329685381244}. Best is trial 0 with value: inf.\n",
      "[I 2026-07-02 16:32:46,444] Trial 285 finished with value: inf and parameters: {'reservoir_size': 7, 'spectral_radius': 0.7461550860465413, 'ar_lags': 2, 'foundation_window': 5, 'regressor_type': 'Ridge', 'reg_alpha': 0.6335048124177767, 'aci_step_size': 0.18701052256203687, 'oob_split_ratio': 0.6433573179104985}. Best is trial 0 with value: inf.\n",
      "[I 2026-07-02 16:32:46,498] Trial 286 finished with value: inf and parameters: {'reservoir_size': 93, 'spectral_radius': 0.6456031470036447, 'ar_lags': 4, 'foundation_window': 4, 'regressor_type': 'Lasso', 'reg_alpha': 1.0462897553820971, 'aci_step_size': 0.13277441836743584, 'oob_split_ratio': 0.6545884670366704}. Best is trial 0 with value: inf.\n",
      "[I 2026-07-02 16:32:46,544] Trial 287 finished with value: inf and parameters: {'reservoir_size': 56, 'spectral_radius': 1.017958044862562, 'ar_lags': 3, 'foundation_window': 3, 'regressor_type': 'ElasticNet', 'reg_alpha': 5.28340923264874, 'aci_step_size': 0.09856877882664034, 'oob_split_ratio': 0.6079202051778785}. Best is trial 0 with value: inf.\n",
      "[I 2026-07-02 16:32:46,596] Trial 288 finished with value: inf and parameters: {'reservoir_size': 81, 'spectral_radius': 1.2773660277977257, 'ar_lags': 4, 'foundation_window': 6, 'regressor_type': 'Ridge', 'reg_alpha': 4.381541980964199, 'aci_step_size': 0.197712719579374, 'oob_split_ratio': 0.8364793998630764}. Best is trial 0 with value: inf.\n",
      "[I 2026-07-02 16:32:46,634] Trial 289 finished with value: inf and parameters: {'reservoir_size': 63, 'spectral_radius': 1.39699661487176, 'ar_lags': 2, 'foundation_window': 4, 'regressor_type': 'Lasso', 'reg_alpha': 0.5547900482990196, 'aci_step_size': 0.0730366965004346, 'oob_split_ratio': 0.671866649203904}. Best is trial 0 with value: inf.\n",
      "[I 2026-07-02 16:32:46,689] Trial 290 finished with value: inf and parameters: {'reservoir_size': 152, 'spectral_radius': 1.4992624022970646, 'ar_lags': 4, 'foundation_window': 3, 'regressor_type': 'ElasticNet', 'reg_alpha': 1.6733079014202417, 'aci_step_size': 0.1586948126483026, 'oob_split_ratio': 0.7134102449675255}. Best is trial 0 with value: inf.\n",
      "[I 2026-07-02 16:32:46,737] Trial 291 finished with value: inf and parameters: {'reservoir_size': 32, 'spectral_radius': 1.150611603089551, 'ar_lags': 3, 'foundation_window': 5, 'regressor_type': 'Ridge', 'reg_alpha': 1.9211931237491078, 'aci_step_size': 0.15359434393229673, 'oob_split_ratio': 0.7301488986164967}. Best is trial 0 with value: inf.\n",
      "[I 2026-07-02 16:32:46,801] Trial 292 finished with value: inf and parameters: {'reservoir_size': 124, 'spectral_radius': 1.4458579073142959, 'ar_lags': 2, 'foundation_window': 4, 'regressor_type': 'Lasso', 'reg_alpha': 7.682267451813867, 'aci_step_size': 0.09440518295673621, 'oob_split_ratio': 0.7413368343118923}. Best is trial 0 with value: inf.\n",
      "[I 2026-07-02 16:32:46,854] Trial 293 finished with value: inf and parameters: {'reservoir_size': 77, 'spectral_radius': 1.042778523474834, 'ar_lags': 4, 'foundation_window': 3, 'regressor_type': 'ElasticNet', 'reg_alpha': 2.662951939276104, 'aci_step_size': 0.08785295679419344, 'oob_split_ratio': 0.8439944750560163}. Best is trial 0 with value: inf.\n",
      "[I 2026-07-02 16:32:46,914] Trial 294 finished with value: inf and parameters: {'reservoir_size': 117, 'spectral_radius': 0.8712600880886234, 'ar_lags': 3, 'foundation_window': 6, 'regressor_type': 'Ridge', 'reg_alpha': 0.13794755957840799, 'aci_step_size': 0.042383692429075664, 'oob_split_ratio': 0.7786758198856197}. Best is trial 0 with value: inf.\n",
      "[I 2026-07-02 16:32:46,973] Trial 295 finished with value: inf and parameters: {'reservoir_size': 106, 'spectral_radius': 0.5354064807763255, 'ar_lags': 4, 'foundation_window': 4, 'regressor_type': 'Lasso', 'reg_alpha': 3.816867606116785, 'aci_step_size': 0.07832402358754566, 'oob_split_ratio': 0.6899256508533278}. Best is trial 0 with value: inf.\n",
      "[I 2026-07-02 16:32:47,025] Trial 296 finished with value: inf and parameters: {'reservoir_size': 67, 'spectral_radius': 1.4652100476285144, 'ar_lags': 2, 'foundation_window': 5, 'regressor_type': 'ElasticNet', 'reg_alpha': 37.361653285975805, 'aci_step_size': 0.1376684118896732, 'oob_split_ratio': 0.7963015409995379}. Best is trial 0 with value: inf.\n",
      "[I 2026-07-02 16:32:47,073] Trial 297 finished with value: inf and parameters: {'reservoir_size': 10, 'spectral_radius': 1.3698241840615453, 'ar_lags': 4, 'foundation_window': 5, 'regressor_type': 'Ridge', 'reg_alpha': 3.0277557772856767, 'aci_step_size': 0.10865823191939177, 'oob_split_ratio': 0.7713074999344878}. Best is trial 0 with value: inf.\n",
      "[I 2026-07-02 16:32:47,118] Trial 298 finished with value: inf and parameters: {'reservoir_size': 95, 'spectral_radius': 0.5686276983136492, 'ar_lags': 3, 'foundation_window': 4, 'regressor_type': 'Lasso', 'reg_alpha': 3.4684219531972382, 'aci_step_size': 0.059032584956158256, 'oob_split_ratio': 0.6303228178272963}. Best is trial 0 with value: inf.\n",
      "[I 2026-07-02 16:32:47,169] Trial 299 finished with value: inf and parameters: {'reservoir_size': 71, 'spectral_radius': 1.1073829305720686, 'ar_lags': 4, 'foundation_window': 3, 'regressor_type': 'Lasso', 'reg_alpha': 43.41691470211565, 'aci_step_size': 0.11947685679724525, 'oob_split_ratio': 0.623520519745161}. Best is trial 0 with value: inf.\n",
      "[I 2026-07-02 16:32:47,175] A new study created in memory with name: no-name-9ab54273-d983-47ac-a707-a61da2624d07\n",
