      "[I 2026-07-02 16:33:56,418] Trial 199 finished with value: 1.2135066938903738 and parameters: {'aci_target': 0.16496733995768612, 'aci_step_size': 0.005337894642252818, 'interval_scale': 0.8285749804390804, 'interval_power': 0.027205469313644967, 'min_width_factor': 0.5453374219179333}. Best is trial 65 with value: 1.204287235687569.\n"
     ]
    },
    {
     "name": "stdout",
     "output_type": "stream",
     "text": [
      "S3-FastSketch best point parameters:\n",
      "{'foundation_window': 10, 'ar_lags': 6, 'ema_spans': (2, 4, 8), 'conv_scales': (2, 3), 'use_calendar': True, 'ridge_alpha': 0.001002648092466808, 'shrinkage_max': 2.252268350510997, 'oob_split_ratio': 0.7846960072911812}\n",
      "S3-FastSketch best UQ parameters:\n",
      "{'aci_target': 0.19119208586404593, 'aci_step_size': 0.012219636763077095, 'interval_scale': 1.0896329623652932, 'interval_power': 0.09013382455236531, 'min_width_factor': 0.5176790473095154}\n",
      "S3-FastSketch test metrics on modelling scale:\n"
     ]
    },
    {
     "data": {
      "text/html": [
       "<div>\n",
       "<style scoped>\n",
       "    .dataframe tbody tr th:only-of-type {\n",
       "        vertical-align: middle;\n",
       "    }\n",
       "\n",
       "    .dataframe tbody tr th {\n",
       "        vertical-align: top;\n",
       "    }\n",
       "\n",
       "    .dataframe thead th {\n",
       "        text-align: right;\n",
       "    }\n",
       "</style>\n",
       "<table border=\"1\" class=\"dataframe\">\n",
       "  <thead>\n",
       "    <tr style=\"text-align: right;\">\n",
       "      <th></th>\n",
       "      <th>mae</th>\n",
       "      <th>mse</th>\n",
       "      <th>rmse</th>\n",
       "      <th>r2</th>\n",
       "      <th>mape_percent</th>\n",
       "      <th>mape</th>\n",
       "      <th>smape_percent</th>\n",
       "      <th>smape</th>\n",
       "      <th>ecp</th>\n",
       "      <th>coverage_error</th>\n",
       "      <th>iw</th>\n",
       "      <th>mean_width</th>\n",
       "      <th>mis</th>\n",
       "      <th>interval_score</th>\n",
       "      <th>msis</th>\n",
       "      <th>scale</th>\n",
       "      <th>elapsed_seconds</th>\n",
       "      <th>trainable_params</th>\n",
       "    </tr>\n",
       "  </thead>\n",
       "  <tbody>\n",
       "    <tr>\n",
       "      <th>0</th>\n",
       "      <td>0.212775</td>\n",
       "      <td>0.07254</td>\n",
       "      <td>0.269333</td>\n",
       "      <td>-4.219402</td>\n",
       "      <td>1.105552</td>\n",
       "      <td>0.011056</td>\n",
       "      <td>1.09934</td>\n",
       "      <td>0.010993</td>\n",
       "      <td>0.6</td>\n",
       "      <td>0.3</td>\n",
       "      <td>0.407676</td>\n",
       "      <td>0.407676</td>\n",
       "      <td>1.966862</td>\n",
       "      <td>1.966862</td>\n",
       "      <td>4.995165</td>\n",
       "      <td>0.393753</td>\n",
       "      <td>0.106696</td>\n",
       "      <td>29</td>\n",
       "    </tr>\n",
       "  </tbody>\n",
       "</table>\n",
       "</div>"
      ],
      "text/plain": [
       "        mae      mse      rmse        r2  mape_percent      mape  \\\n",
       "0  0.212775  0.07254  0.269333 -4.219402      1.105552  0.011056   \n",
       "\n",
       "   smape_percent     smape  ecp  coverage_error        iw  mean_width  \\\n",
       "0        1.09934  0.010993  0.6             0.3  0.407676    0.407676   \n",
       "\n",
       "        mis  interval_score      msis     scale  elapsed_seconds  \\\n",
       "0  1.966862        1.966862  4.995165  0.393753         0.106696   \n",
       "\n",
       "   trainable_params  \n",
       "0                29  "
      ]
     },
     "metadata": {},
     "output_type": "display_data"
    }
   ],
   "source": [
    "fastsketch_result = run_fastsketch_experiment(\n",
    "    train_series,\n",
    "    test_series,\n",
    "    point_trials=FASTSKETCH_POINT_TRIALS,\n",
    "    uq_trials=FASTSKETCH_UQ_TRIALS,\n",
    "    val_size=VAL_SIZE,\n",
    "    seed=SEED,\n",
    ")\n",
    "\n",
    "print(\"S3-FastSketch best point parameters:\")\n",
    "print(fastsketch_result[\"best_point_params\"])\n",
    "print(\"S3-FastSketch best UQ parameters:\")\n",
    "print(fastsketch_result[\"best_uq_params\"])\n",
    "print(\"S3-FastSketch test metrics on modelling scale:\")\n",
    "display(pd.DataFrame([fastsketch_result[\"metrics\"]]))"
   ]
  },
  {
   "cell_type": "markdown",
   "id": "f08597d8",
   "metadata": {
    "papermill": {
     "duration": 0.056094,
     "end_time": "2026-07-02T16:33:56.658869+00:00",
     "exception": false,
     "start_time": "2026-07-02T16:33:56.602775+00:00",
     "status": "completed"
    },
    "tags": []
   },
   "source": [
    "## 8. Baselines with fixed parameters and a common ACI wrapper\n",
    "\n",
    "Each baseline is fitted twice:\n",
    "\n",
    "1. on a chronological training core to obtain calibration residuals;\n",
    "2. on the complete training series to produce the final test forecast.\n",
    "\n",
    "The interval for test step `t` is formed before observing `y_t`. After scoring that step, the ACI state is updated for the next one. Thus, the procedure is sequential and does not use future test observations."
   ]
  },
  {
   "cell_type": "code",
   "execution_count": 10,
   "id": "755a3ffa",
   "metadata": {
    "execution": {
     "iopub.execute_input": "2026-07-02T16:33:56.770069Z",
     "iopub.status.busy": "2026-07-02T16:33:56.769666Z",
     "iopub.status.idle": "2026-07-02T16:33:56.785494Z",
     "shell.execute_reply": "2026-07-02T16:33:56.784483Z"
    },
    "papermill": {
     "duration": 0.074173,
     "end_time": "2026-07-02T16:33:56.787577+00:00",
     "exception": false,
     "start_time": "2026-07-02T16:33:56.713404+00:00",
     "status": "completed"
    },
    "tags": []
   },
   "outputs": [],
   "source": [
    "def finite_sample_conformal_quantile(scores, alpha):\n",
    "    scores = np.asarray(scores, dtype=float).reshape(-1)\n",
    "    scores = scores[np.isfinite(scores)]\n",
    "    if len(scores) == 0:\n",
    "        raise ValueError(\"No finite calibration scores were produced.\")\n",
    "    level = min(1.0, math.ceil((len(scores) + 1) * (1.0 - alpha)) / len(scores))\n",
    "    try:\n",
    "        return float(np.quantile(scores, level, method=\"higher\"))\n",
    "    except TypeError:\n",
    "        return float(np.quantile(scores, level, interpolation=\"higher\"))\n",
    "\n",
    "\n",
    "def adaptive_conformal_path(y_true, y_pred, calibration_scores, alpha=0.10, step_size=0.05):\n",
    "    y_true = np.asarray(y_true, dtype=float).reshape(-1)\n",
    "    y_pred = np.asarray(y_pred, dtype=float).reshape(-1)\n",
    "    buffer = list(np.asarray(calibration_scores, dtype=float).reshape(-1))\n",
    "    alpha_t = float(alpha)\n",
    "    lower, upper, alpha_path = [], [], []\n",
    "\n",
    "    for observed, predicted in zip(y_true, y_pred):\n",
    "        q = finite_sample_conformal_quantile(buffer, alpha_t)\n",
    "        lo = float(predicted - q)\n",
    "        up = float(predicted + q)\n",
    "        lower.append(lo)\n",
    "        upper.append(up)\n",
    "        alpha_path.append(alpha_t)\n",
    "\n",
    "        miss = float(observed < lo or observed > up)\n",
    "        alpha_t = float(np.clip(alpha_t + step_size * (alpha - miss), 0.01, 0.50))\n",
    "        buffer.append(abs(float(observed - predicted)))\n",
    "\n",
    "    return np.asarray(lower), np.asarray(upper), np.asarray(alpha_path)\n",
    "\n",
    "\n",
    "def evaluate_fixed_baseline_with_aci(\n",
    "    model_name,\n",
    "    params,\n",
    "    train,\n",
    "    test,\n",
    "    *,\n",
    "    calibration_ratio=0.20,\n",
    "    alpha=0.10,\n",
    "    aci_step_size=0.05,\n",
    "    seasonal_period=12,\n",
    "):\n",
    "    train = ensure_series(train, name=\"train\")\n",
    "    test = ensure_series(test, name=\"test\")\n",
    "\n",
    "    split = int(np.floor((1.0 - calibration_ratio) * len(train)))\n",
    "    split = max(split, seasonal_period + 5)\n",
    "    split = min(split, len(train) - 2)\n",
    "    train_core = train.iloc[:split]\n",
    "    calibration = train.iloc[split:]\n",
    "\n",
    "    _, calibration_forecast = fit_predict_baseline(\n",
    "        model_name,\n",
    "        train_core,\n",
    "        len(calibration),\n",
    "        params,\n",
    "    )\n",
    "    calibration_output = parse_forecast_output(calibration_forecast)\n",
    "    if len(calibration_output.pred) != len(calibration):\n",
    "        raise ValueError(\n",
    "            f\"{model_name} returned {len(calibration_output.pred)} calibration values; \"\n",
    "            f\"expected {len(calibration)}.\"\n",
    "        )\n",
    "    calibration_scores = np.abs(calibration.to_numpy() - calibration_output.pred)\n",
    "\n",
    "    start = time.perf_counter()\n",
    "    model, test_forecast = fit_predict_baseline(model_name, train, len(test), params)\n",
    "    elapsed = time.perf_counter() - start\n",
    "    test_output = parse_forecast_output(test_forecast)\n",
    "\n",
    "    if test_output.has_interval:\n",
    "        lower, upper = test_output.lower, test_output.upper\n",
    "        interval_source = \"native\"\n",
    "        alpha_path = np.full(len(test), alpha)\n",
    "    else:\n",
    "        lower, upper, alpha_path = adaptive_conformal_path(\n",
    "            test,\n",
    "            test_output.pred,\n",
    "            calibration_scores,\n",
    "            alpha=alpha,\n",
    "            step_size=aci_step_size,\n",
    "        )\n",
    "        interval_source = \"external_aci\"\n",
    "\n",
    "    forecast = pd.DataFrame(\n",
    "        {\n",
    "            \"pred\": test_output.pred,\n",
    "            \"lower\": lower,\n",
    "            \"upper\": upper,\n",
    "            \"aci_alpha\": alpha_path,\n",
    "        },\n",
    "        index=test.index,\n",
    "    )\n",
    "\n",
    "    metrics = evaluate_forecast(\n",
    "        test,\n",
    "        forecast[\"pred\"],\n",
    "        y_train=train,\n",
    "        lower=forecast[\"lower\"],\n",
    "        upper=forecast[\"upper\"],\n",
    "        alpha=alpha,\n",
    "        seasonal_period=seasonal_period,\n",
    "        elapsed_seconds=elapsed,\n",
    "        trainable_params=count_trainable_parameters(model),\n",
    "    )\n",
    "\n",
    "    return {\n",
    "        \"model\": model,\n",
    "        \"forecast\": forecast,\n",
    "        \"metrics\": metrics,\n",
    "        \"interval_source\": interval_source,\n",
    "        \"calibration_size\": len(calibration),\n",
    "    }"
   ]
  },
  {
   "cell_type": "code",
   "execution_count": 11,
   "id": "c2d41942",
   "metadata": {
    "execution": {
     "iopub.execute_input": "2026-07-02T16:33:56.900413Z",
     "iopub.status.busy": "2026-07-02T16:33:56.900062Z",
     "iopub.status.idle": "2026-07-02T16:34:31.566294Z",
     "shell.execute_reply": "2026-07-02T16:34:31.565379Z"
    },
    "papermill": {
     "duration": 34.725263,
     "end_time": "2026-07-02T16:34:31.568671+00:00",
     "exception": false,
     "start_time": "2026-07-02T16:33:56.843408+00:00",
     "status": "completed"
    },
    "tags": []
   },
   "outputs": [
    {
     "name": "stdout",
     "output_type": "stream",
     "text": [
      "\n",
      "Evaluating CNN with fixed original parameters...\n",
      "{'mae': 0.2179574169179336, 'mse': 0.060335934198578335, 'rmse': 0.24563373994339283, 'r2': -3.3412943593845146, 'mape_percent': 1.125013126252684, 'mape': 0.011250131262526839, 'smape_percent': 1.132621598540193, 'smape': 0.01132621598540193, 'ecp': 1.0, 'coverage_error': 0.09999999999999998, 'iw': 0.840701928417694, 'mean_width': 0.840701928417694, 'mis': 0.840701928417694, 'interval_score': 0.840701928417694, 'msis': 2.1350989823306548, 'scale': 0.39375313995981176, 'elapsed_seconds': 3.7206000759999824, 'trainable_params': 23194}\n",
      "\n",
      "Evaluating LSTM with fixed original parameters...\n",
      "{'mae': 0.2240612496642239, 'mse': 0.0651180319275812, 'rmse': 0.25518235034496645, 'r2': -3.685376110544917, 'mape_percent': 1.157273701905024, 'mape': 0.01157273701905024, 'smape_percent': 1.1645412189013071, 'smape': 0.011645412189013072, 'ecp': 1.0, 'coverage_error': 0.09999999999999998, 'iw': 0.8214682248044127, 'mean_width': 0.8214682248044127, 'mis': 0.8214682248044127, 'interval_score': 0.8214682248044127, 'msis': 2.086251870621922, 'scale': 0.39375313995981176, 'elapsed_seconds': 9.520778376000067, 'trainable_params': 284228}\n",
      "\n",
      "Evaluating Gaussian Process with fixed original parameters...\n",
      "{'mae': 0.2290653358402121, 'mse': 0.06335812796883253, 'rmse': 0.2517104049673603, 'r2': -3.558747406926467, 'mape_percent': 1.1824260470117167, 'mape': 0.011824260470117167, 'smape_percent': 1.1905591066001748, 'smape': 0.011905591066001748, 'ecp': 0.9, 'coverage_error': 0.0, 'iw': 0.7567300394975518, 'mean_width': 0.7567300394975518, 'mis': 0.9156810147252628, 'interval_score': 0.9156810147252628, 'msis': 2.3255205401504133, 'scale': 0.39375313995981176, 'elapsed_seconds': 0.5232748079999965, 'trainable_params': 270}\n",
      "\n",
      "Evaluating Kernel Ridge with fixed original parameters...\n",
      "{'mae': 0.23529811243580384, 'mse': 0.07024269379220527, 'rmse': 0.26503338241098096, 'r2': -4.054106054684401, 'mape_percent': 1.2151626787961658, 'mape': 0.012151626787961658, 'smape_percent': 1.2245926892948715, 'smape': 0.012245926892948716, 'ecp': 1.0, 'coverage_error': 0.09999999999999998, 'iw': 0.9649522021221912, 'mean_width': 0.9649522021221912, 'mis': 0.9649522021221912, 'interval_score': 0.9649522021221912, 'msis': 2.450652716625139, 'scale': 0.39375313995981176, 'elapsed_seconds': 0.00512137399994117, 'trainable_params': 270}\n",
      "\n",
      "Evaluating AR with fixed original parameters...\n",
      "{'mae': 0.25820726818064943, 'mse': 0.09893647844171465, 'rmse': 0.3145416958714928, 'r2': -6.118682780029016, 'mape_percent': 1.340770519049568, 'mape': 0.01340770519049568, 'smape_percent': 1.3300435611000079, 'smape': 0.013300435611000078, 'ecp': 1.0, 'coverage_error': 0.09999999999999998, 'iw': 1.2365048096512012, 'mean_width': 1.2365048096512012, 'mis': 1.2365048096512012, 'interval_score': 1.2365048096512012, 'msis': 3.1403046329418594, 'scale': 0.39375313995981176, 'elapsed_seconds': 0.007927792000032241, 'trainable_params': 15}\n",
      "\n",
      "Evaluating ARIMA with fixed original parameters...\n",
      "{'mae': 19.33035317537506, 'mse': 373.67645202874303, 'rmse': 19.330712662205265, 'r2': -26885.788030629752, 'mape_percent': 100.0, 'mape': 1.0, 'smape_percent': 200.0, 'smape': 2.0, 'ecp': 0.9, 'coverage_error': 0.0, 'iw': 38.91339454311553, 'mean_width': 38.91339454311553, 'mis': 39.0067394974845, 'interval_score': 39.0067394974845, 'msis': 99.06394524616542, 'scale': 0.39375313995981176, 'elapsed_seconds': 0.015148645999943255, 'trainable_params': 1}\n",
      "\n",
      "Evaluating ARKAN with fixed original parameters...\n",
      "{'mae': 0.13206417532662762, 'mse': 0.022328580516681414, 'rmse': 0.14942750923669113, 'r2': -0.6065872176785823, 'mape_percent': 0.6819657001021756, 'mape': 0.006819657001021756, 'smape_percent': 0.6845003713173309, 'smape': 0.006845003713173309, 'ecp': 1.0, 'coverage_error': 0.09999999999999998, 'iw': 0.6424757405944064, 'mean_width': 0.6424757405944064, 'mis': 0.6424757405944064, 'interval_score': 0.6424757405944064, 'msis': 1.6316714087917632, 'scale': 0.39375313995981176, 'elapsed_seconds': 1.1617573049999237, 'trainable_params': 18840}\n",
      "\n",
      "Evaluating EasyTSF (NLinear) with fixed original parameters...\n",
      "{'mae': 0.1536677506096499, 'mse': 0.04394469641681698, 'rmse': 0.2096299034413196, 'r2': -2.161911143221971, 'mape_percent': 0.7993483961043948, 'mape': 0.007993483961043948, 'smape_percent': 0.7934646543767682, 'smape': 0.007934646543767682, 'ecp': 0.8, 'coverage_error': 0.09999999999999998, 'iw': 0.5617839017730148, 'mean_width': 0.5617839017730148, 'mis': 1.0109447161617766, 'interval_score': 1.0109447161617766, 'msis': 2.5674581700223604, 'scale': 0.39375313995981176, 'elapsed_seconds': 0.17061216000001878, 'trainable_params': 5}\n",
      "\n",
      "Evaluating ETS with fixed original parameters...\n",
      "{'mae': 0.16993670726661847, 'mse': 0.04756748672090878, 'rmse': 0.21809971737925013, 'r2': -2.4225783446383575, 'mape_percent': 0.8824638329409964, 'mape': 0.008824638329409964, 'smape_percent': 0.8815521176706032, 'smape': 0.008815521176706032, 'ecp': 1.0, 'coverage_error': 0.09999999999999998, 'iw': 0.963551954497035, 'mean_width': 0.963551954497035, 'mis': 0.963551954497035, 'interval_score': 0.963551954497035, 'msis': 2.4470965605388684, 'scale': 0.39375313995981176, 'elapsed_seconds': 0.11168851399997948, 'trainable_params': 18}\n"
     ]
    }
   ],
   "source": [
    "baseline_results = {}\n",
    "baseline_failures = []\n",
    "\n",
    "for baseline_name in BASELINE_ORDER:\n",
    "    display_name = BASELINE_DISPLAY_NAMES.get(baseline_name, baseline_name)\n",
    "    print(f\"\\nEvaluating {display_name} with fixed original parameters...\")\n",
    "    try:\n",
    "        result = evaluate_fixed_baseline_with_aci(\n",
    "            baseline_name,\n",
    "            BASELINE_PARAMS[baseline_name],\n",
    "            train_series,\n",
    "            test_series,\n",
    "            calibration_ratio=BASELINE_CALIBRATION_RATIO,\n",
    "            alpha=ALPHA,\n",
    "            aci_step_size=BASELINE_ACI_STEP_SIZE,\n",
    "            seasonal_period=SEASONAL_PERIOD,\n",
    "        )\n",
    "        baseline_results[display_name] = result\n",
    "        print(result[\"metrics\"])\n",
    "    except Exception as exc:\n",
    "        baseline_failures.append(\n",
    "            {\n",
    "                \"model\": display_name,\n",
    "                \"exception_type\": type(exc).__name__,\n",
    "                \"error\": str(exc),\n",
    "            }\n",
    "        )\n",
    "        print(f\"FAILED: {type(exc).__name__}: {exc}\")\n",
    "\n",
    "if baseline_failures:\n",
    "    print(\"\\nBaseline failures were retained for audit:\")\n",
    "    display(pd.DataFrame(baseline_failures))"
   ]
  },
  {
   "cell_type": "markdown",
   "id": "cc1da6ed",
   "metadata": {
    "papermill": {
     "duration": 0.05769,
     "end_time": "2026-07-02T16:34:31.712729+00:00",
     "exception": false,
     "start_time": "2026-07-02T16:34:31.655039+00:00",
     "status": "completed"
    },
    "tags": []
   },
   "source": [
    "## 9. Consolidated results on modelling and original scales"
   ]
  },
  {
   "cell_type": "code",
   "execution_count": 12,
   "id": "2302809a",
   "metadata": {
    "execution": {
     "iopub.execute_input": "2026-07-02T16:34:31.825770Z",
     "iopub.status.busy": "2026-07-02T16:34:31.825133Z",
     "iopub.status.idle": "2026-07-02T16:34:31.912635Z",
     "shell.execute_reply": "2026-07-02T16:34:31.911249Z"
    },
    "papermill": {
     "duration": 0.146157,
     "end_time": "2026-07-02T16:34:31.915045+00:00",
     "exception": false,
     "start_time": "2026-07-02T16:34:31.768888+00:00",
     "status": "completed"
    },
    "tags": []
   },
   "outputs": [
    {
     "name": "stdout",
     "output_type": "stream",
     "text": [
      "Results on modelling scale:\n"
     ]
    },
    {
     "data": {
      "text/html": [
       "<div>\n",
       "<style scoped>\n",
       "    .dataframe tbody tr th:only-of-type {\n",
       "        vertical-align: middle;\n",
       "    }\n",
       "\n",
       "    .dataframe tbody tr th {\n",
       "        vertical-align: top;\n",
       "    }\n",
       "\n",
       "    .dataframe thead th {\n",
       "        text-align: right;\n",
       "    }\n",
       "</style>\n",
       "<table border=\"1\" class=\"dataframe\">\n",
       "  <thead>\n",
       "    <tr style=\"text-align: right;\">\n",
       "      <th></th>\n",
       "      <th>Model</th>\n",
       "      <th>MAE</th>\n",
       "      <th>MSE</th>\n",
       "      <th>RMSE</th>\n",
       "      <th>R^2</th>\n",
       "      <th>MAPE (%)</th>\n",
       "      <th>sMAPE (%)</th>\n",
       "      <th>Time (s)</th>\n",
       "      <th>trainable_params</th>\n",
       "      <th>ECP</th>\n",
       "      <th>IW</th>\n",
       "      <th>MIS</th>\n",
       "      <th>MSIS</th>\n",
       "    </tr>\n",
       "  </thead>\n",
       "  <tbody>\n",
       "    <tr>\n",
       "      <th>0</th>\n",
       "      <td>S3-Forecaster</td>\n",
       "      <td>0.120510</td>\n",
       "      <td>0.019680</td>\n",
       "      <td>0.140287</td>\n",
       "      <td>-0.416047</td>\n",
       "      <td>0.624614</td>\n",
       "      <td>0.623471</td>\n",
       "      <td>0.087352</td>\n",
       "      <td>802</td>\n",
       "      <td>1.0</td>\n",
       "      <td>2.493414</td>\n",
       "      <td>2.493414</td>\n",
       "      <td>6.332429</td>\n",
       "    </tr>\n",
       "    <tr>\n",
       "      <th>1</th>\n",
       "      <td>ARKAN</td>\n",
       "      <td>0.132064</td>\n",
       "      <td>0.022329</td>\n",
       "      <td>0.149428</td>\n",
       "      <td>-0.606587</td>\n",
       "      <td>0.681966</td>\n",
       "      <td>0.684500</td>\n",
       "      <td>1.161757</td>\n",
       "      <td>18840</td>\n",
       "      <td>1.0</td>\n",
       "      <td>0.642476</td>\n",
       "      <td>0.642476</td>\n",
       "      <td>1.631671</td>\n",
       "    </tr>\n",
       "    <tr>\n",
       "      <th>2</th>\n",
       "      <td>EasyTSF (NLinear)</td>\n",
       "      <td>0.153668</td>\n",
       "      <td>0.043945</td>\n",
       "      <td>0.209630</td>\n",
       "      <t