      "[I 2026-07-02 16:32:40,934] Trial 180 finished with value: inf and parameters: {'reservoir_size': 4, 'spectral_radius': 1.4697367277360676, 'ar_lags': 4, 'foundation_window': 4, 'regressor_type': 'Ridge', 'reg_alpha': 21.409955341468923, 'aci_step_size': 0.05387302075682336, 'oob_split_ratio': 0.6691764395639487}. Best is trial 0 with value: inf.\n",
      "[I 2026-07-02 16:32:40,989] Trial 181 finished with value: inf and parameters: {'reservoir_size': 124, 'spectral_radius': 1.29446025633461, 'ar_lags': 3, 'foundation_window': 4, 'regressor_type': 'Lasso', 'reg_alpha': 0.1662582139363036, 'aci_step_size': 0.1254642666925615, 'oob_split_ratio': 0.7957679373035451}. Best is trial 0 with value: inf.\n",
      "[I 2026-07-02 16:32:41,045] Trial 182 finished with value: inf and parameters: {'reservoir_size': 119, 'spectral_radius': 1.2570923432682, 'ar_lags': 3, 'foundation_window': 4, 'regressor_type': 'Lasso', 'reg_alpha': 36.798244993433805, 'aci_step_size': 0.12071920955416215, 'oob_split_ratio': 0.767566751390674}. Best is trial 0 with value: inf.\n",
      "[I 2026-07-02 16:32:41,089] Trial 183 finished with value: inf and parameters: {'reservoir_size': 11, 'spectral_radius': 1.320820292171758, 'ar_lags': 3, 'foundation_window': 4, 'regressor_type': 'Lasso', 'reg_alpha': 4.760705359416813, 'aci_step_size': 0.11737483659101992, 'oob_split_ratio': 0.78297235277519}. Best is trial 0 with value: inf.\n",
      "[I 2026-07-02 16:32:41,147] Trial 184 finished with value: inf and parameters: {'reservoir_size': 128, 'spectral_radius': 1.2238068433663283, 'ar_lags': 3, 'foundation_window': 4, 'regressor_type': 'Lasso', 'reg_alpha': 26.63645609986676, 'aci_step_size': 0.01866776918907989, 'oob_split_ratio': 0.639472708889988}. Best is trial 0 with value: inf.\n",
      "[I 2026-07-02 16:32:41,215] Trial 185 finished with value: inf and parameters: {'reservoir_size': 155, 'spectral_radius': 1.4505131332268584, 'ar_lags': 3, 'foundation_window': 4, 'regressor_type': 'ElasticNet', 'reg_alpha': 46.42602790725421, 'aci_step_size': 0.13147100535724401, 'oob_split_ratio': 0.6544616431665083}. Best is trial 0 with value: inf.\n",
      "[I 2026-07-02 16:32:41,262] Trial 186 finished with value: inf and parameters: {'reservoir_size': 54, 'spectral_radius': 0.6491573076193818, 'ar_lags': 2, 'foundation_window': 5, 'regressor_type': 'Lasso', 'reg_alpha': 34.58001681894481, 'aci_step_size': 0.10974679297719685, 'oob_split_ratio': 0.7617040526216194}. Best is trial 0 with value: inf.\n",
      "[I 2026-07-02 16:32:41,303] Trial 187 finished with value: inf and parameters: {'reservoir_size': 44, 'spectral_radius': 1.2042821496629643, 'ar_lags': 4, 'foundation_window': 3, 'regressor_type': 'Ridge', 'reg_alpha': 37.48206397331729, 'aci_step_size': 0.13583783431853824, 'oob_split_ratio': 0.8444760063343112}. Best is trial 0 with value: inf.\n",
      "[I 2026-07-02 16:32:41,347] Trial 188 finished with value: inf and parameters: {'reservoir_size': 115, 'spectral_radius': 1.2741481009602487, 'ar_lags': 4, 'foundation_window': 6, 'regressor_type': 'ElasticNet', 'reg_alpha': 48.75005688261067, 'aci_step_size': 0.03318364406281961, 'oob_split_ratio': 0.7280384493527297}. Best is trial 0 with value: inf.\n",
      "[I 2026-07-02 16:32:41,394] Trial 189 finished with value: inf and parameters: {'reservoir_size': 77, 'spectral_radius': 1.4984614899923756, 'ar_lags': 2, 'foundation_window': 5, 'regressor_type': 'Lasso', 'reg_alpha': 30.683187945035577, 'aci_step_size': 0.09093258838047921, 'oob_split_ratio': 0.6819222268489803}. Best is trial 0 with value: inf.\n",
      "[I 2026-07-02 16:32:41,434] Trial 190 finished with value: inf and parameters: {'reservoir_size': 8, 'spectral_radius': 0.7120686357763684, 'ar_lags': 4, 'foundation_window': 3, 'regressor_type': 'Ridge', 'reg_alpha': 6.9565472281883975, 'aci_step_size': 0.1435649795505449, 'oob_split_ratio': 0.7512275660735109}. Best is trial 0 with value: inf.\n",
      "[I 2026-07-02 16:32:41,501] Trial 191 finished with value: inf and parameters: {'reservoir_size': 170, 'spectral_radius': 0.936491480295204, 'ar_lags': 4, 'foundation_window': 5, 'regressor_type': 'Ridge', 'reg_alpha': 5.547663686174383, 'aci_step_size': 0.13036777466826438, 'oob_split_ratio': 0.7396022996712059}. Best is trial 0 with value: inf.\n",
      "[I 2026-07-02 16:32:41,545] Trial 192 finished with value: inf and parameters: {'reservoir_size': 59, 'spectral_radius': 1.1603436503179705, 'ar_lags': 4, 'foundation_window': 5, 'regressor_type': 'Ridge', 'reg_alpha': 7.011101008867291, 'aci_step_size': 0.12382880934916511, 'oob_split_ratio': 0.716118570113205}. Best is trial 0 with value: inf.\n",
      "[I 2026-07-02 16:32:41,588] Trial 193 finished with value: inf and parameters: {'reservoir_size': 66, 'spectral_radius': 0.6712265487132093, 'ar_lags': 4, 'foundation_window': 5, 'regressor_type': 'Ridge', 'reg_alpha': 9.07128903483959, 'aci_step_size': 0.1404847211570808, 'oob_split_ratio': 0.7720041340978985}. Best is trial 0 with value: inf.\n",
      "[I 2026-07-02 16:32:41,621] Trial 194 finished with value: inf and parameters: {'reservoir_size': 71, 'spectral_radius': 1.191087368781601, 'ar_lags': 4, 'foundation_window': 5, 'regressor_type': 'Ridge', 'reg_alpha': 5.858052372337783, 'aci_step_size': 0.11510593743566143, 'oob_split_ratio': 0.7309664541962905}. Best is trial 0 with value: inf.\n",
      "[I 2026-07-02 16:32:41,651] Trial 195 finished with value: inf and parameters: {'reservoir_size': 38, 'spectral_radius': 1.2373248102180785, 'ar_lags': 4, 'foundation_window': 5, 'regressor_type': 'Lasso', 'reg_alpha': 8.359901424191724, 'aci_step_size': 0.1277663961600347, 'oob_split_ratio': 0.7778239555800854}. Best is trial 0 with value: inf.\n",
      "[I 2026-07-02 16:32:41,714] Trial 196 finished with value: inf and parameters: {'reservoir_size': 182, 'spectral_radius': 1.1489697695145211, 'ar_lags': 3, 'foundation_window': 6, 'regressor_type': 'ElasticNet', 'reg_alpha': 0.983735888078526, 'aci_step_size': 0.08482162672434354, 'oob_split_ratio': 0.8215593114353702}. Best is trial 0 with value: inf.\n",
      "[I 2026-07-02 16:32:41,757] Trial 197 finished with value: inf and parameters: {'reservoir_size': 52, 'spectral_radius': 0.6097925457311528, 'ar_lags': 2, 'foundation_window': 4, 'regressor_type': 'Ridge', 'reg_alpha': 0.2464559026509335, 'aci_step_size': 0.04514162260127637, 'oob_split_ratio': 0.7563546815529841}. Best is trial 0 with value: inf.\n",
      "[I 2026-07-02 16:32:41,800] Trial 198 finished with value: inf and parameters: {'reservoir_size': 63, 'spectral_radius': 1.117805613921117, 'ar_lags': 4, 'foundation_window': 5, 'regressor_type': 'Lasso', 'reg_alpha': 1.80521785961289, 'aci_step_size': 0.09851933695028799, 'oob_split_ratio': 0.6346852677099032}. Best is trial 0 with value: inf.\n",
      "[I 2026-07-02 16:32:41,860] Trial 199 finished with value: inf and parameters: {'reservoir_size': 163, 'spectral_radius': 1.1733143226933422, 'ar_lags': 3, 'foundation_window': 3, 'regressor_type': 'Ridge', 'reg_alpha': 24.695500764441253, 'aci_step_size': 0.19505984057429587, 'oob_split_ratio': 0.7911767591202219}. Best is trial 0 with value: inf.\n",
      "[I 2026-07-02 16:32:41,903] Trial 200 finished with value: inf and parameters: {'reservoir_size': 33, 'spectral_radius': 0.5720641922168532, 'ar_lags': 4, 'foundation_window': 4, 'regressor_type': 'ElasticNet', 'reg_alpha': 0.430988454115494, 'aci_step_size': 0.06371350199042099, 'oob_split_ratio': 0.664237041707139}. Best is trial 0 with value: inf.\n",
      "[I 2026-07-02 16:32:41,956] Trial 201 finished with value: inf and parameters: {'reservoir_size': 103, 'spectral_radius': 1.0050395477777994, 'ar_lags': 3, 'foundation_window': 3, 'regressor_type': 'Lasso', 'reg_alpha': 1.448526496491724, 'aci_step_size': 0.10436491488958999, 'oob_split_ratio': 0.8013637860087846}. Best is trial 0 with value: inf.\n",
      "[I 2026-07-02 16:32:42,011] Trial 202 finished with value: inf and parameters: {'reservoir_size': 107, 'spectral_radius': 0.8249062522797133, 'ar_lags': 3, 'foundation_window': 3, 'regressor_type': 'Lasso', 'reg_alpha': 1.0872045624954758, 'aci_step_size': 0.09519836737194012, 'oob_split_ratio': 0.604242075391182}. Best is trial 0 with value: inf.\n",
      "[I 2026-07-02 16:32:42,060] Trial 203 finished with value: inf and parameters: {'reservoir_size': 89, 'spectral_radius': 0.8561346401754841, 'ar_lags': 3, 'foundation_window': 3, 'regressor_type': 'Lasso', 'reg_alpha': 0.3367652706905684, 'aci_step_size': 0.09967671392647881, 'oob_split_ratio': 0.8070685946416246}. Best is trial 0 with value: inf.\n",
      "[I 2026-07-02 16:32:42,113] Trial 204 finished with value: inf and parameters: {'reservoir_size': 84, 'spectral_radius': 0.7863498236146276, 'ar_lags': 3, 'foundation_window': 3, 'regressor_type': 'Lasso', 'reg_alpha': 1.1669957105082571, 'aci_step_size': 0.013446009753133429, 'oob_split_ratio': 0.7972289393570001}. Best is trial 0 with value: inf.\n",
      "[I 2026-07-02 16:32:42,158] Trial 205 finished with value: inf and parameters: {'reservoir_size': 118, 'spectral_radius': 0.9260838478395237, 'ar_lags': 3, 'foundation_window': 3, 'regressor_type': 'Lasso', 'reg_alpha': 2.7950621936830236, 'aci_step_size': 0.07779686194136153, 'oob_split_ratio': 0.6771668396533762}. Best is trial 0 with value: inf.\n",
      "[I 2026-07-02 16:32:42,216] Trial 206 finished with value: inf and parameters: {'reservoir_size': 132, 'spectral_radius': 1.0785672484433075, 'ar_lags': 2, 'foundation_window': 6, 'regressor_type': 'Ridge', 'reg_alpha': 0.60833790053418, 'aci_step_size': 0.14878290433172423, 'oob_split_ratio': 0.8121969703051882}. Best is trial 0 with value: inf.\n",
      "[I 2026-07-02 16:32:42,259] Trial 207 finished with value: inf and parameters: {'reservoir_size': 3, 'spectral_radius': 0.8932011945380743, 'ar_lags': 4, 'foundation_window': 5, 'regressor_type': 'Lasso', 'reg_alpha': 1.3225616438083105, 'aci_step_size': 0.10670786174143031, 'oob_split_ratio': 0.6260437917538082}. Best is trial 0 with value: inf.\n",
      "[I 2026-07-02 16:32:42,300] Trial 208 finished with value: inf and parameters: {'reservoir_size': 21, 'spectral_radius': 1.4693119525343525, 'ar_lags': 3, 'foundation_window': 3, 'regressor_type': 'ElasticNet', 'reg_alpha': 13.5471086462984, 'aci_step_size': 0.11933991398021786, 'oob_split_ratio': 0.8340730763339553}. Best is trial 0 with value: inf.\n",
      "[I 2026-07-02 16:32:42,346] Trial 209 finished with value: inf and parameters: {'reservoir_size': 97, 'spectral_radius': 1.4344563795124543, 'ar_lags': 4, 'foundation_window': 4, 'regressor_type': 'Ridge', 'reg_alpha': 11.356823950135865, 'aci_step_size': 0.08177357898744123, 'oob_split_ratio': 0.7267116615600846}. Best is trial 0 with value: inf.\n",
      "[I 2026-07-02 16:32:42,401] Trial 210 finished with value: inf and parameters: {'reservoir_size': 112, 'spectral_radius': 0.6848597275868654, 'ar_lags': 2, 'foundation_window': 5, 'regressor_type': 'Lasso', 'reg_alpha': 40.75609183202294, 'aci_step_size': 0.07383631278035395, 'oob_split_ratio': 0.6453976008064022}. Best is trial 0 with value: inf.\n",
      "[I 2026-07-02 16:32:42,465] Trial 211 finished with value: inf and parameters: {'reservoir_size': 147, 'spectral_radius': 0.5118983988709023, 'ar_lags': 3, 'foundation_window': 4, 'regressor_type': 'ElasticNet', 'reg_alpha': 2.3011614769534368, 'aci_step_size': 0.13466455369399288, 'oob_split_ratio': 0.6514529044512788}. Best is trial 0 with value: inf.\n",
      "[I 2026-07-02 16:32:42,522] Trial 212 finished with value: inf and parameters: {'reservoir_size': 121, 'spectral_radius': 1.4795533673872443, 'ar_lags': 3, 'foundation_window': 4, 'regressor_type': 'ElasticNet', 'reg_alpha': 0.18841019435456532, 'aci_step_size': 0.11502398573256231, 'oob_split_ratio': 0.669174341922388}. Best is trial 0 with value: inf.\n",
      "[I 2026-07-02 16:32:42,581] Trial 213 finished with value: inf and parameters: {'reservoir_size': 134, 'spectral_radius': 1.251212554815176, 'ar_lags': 3, 'foundation_window': 4, 'regressor_type': 'ElasticNet', 'reg_alpha': 3.3027481376844543, 'aci_step_size': 0.17140994587659933, 'oob_split_ratio': 0.7861233440289404}. Best is trial 0 with value: inf.\n",
      "[I 2026-07-02 16:32:42,628] Trial 214 finished with value: inf and parameters: {'reservoir_size': 72, 'spectral_radius': 0.5464355735997511, 'ar_lags': 3, 'foundation_window': 4, 'regressor_type': 'ElasticNet', 'reg_alpha': 0.8913418254223405, 'aci_step_size': 0.1270470919612297, 'oob_split_ratio': 0.6555125858201925}. Best is trial 0 with value: inf.\n",
      "[I 2026-07-02 16:32:42,670] Trial 215 finished with value: inf and parameters: {'reservoir_size': 14, 'spectral_radius': 0.5201297728279763, 'ar_lags': 4, 'foundation_window': 6, 'regressor_type': 'ElasticNet', 'reg_alpha': 3.8823201761139714, 'aci_step_size': 0.12423806752443378, 'oob_split_ratio': 0.6596160175408204}. Best is trial 0 with value: inf.\n",
      "[I 2026-07-02 16:32:42,724] Trial 216 finished with value: inf and parameters: {'reservoir_size': 128, 'spectral_radius': 0.7309216144293547, 'ar_lags': 2, 'foundation_window': 4, 'regressor_type': 'Ridge', 'reg_alpha': 2.6471139682612193, 'aci_step_size': 0.08807314984404581, 'oob_split_ratio': 0.6638774613245453}. Best is trial 0 with value: inf.\n",
      "[I 2026-07-02 16:32:42,781] Trial 217 finished with value: inf and parameters: {'reservoir_size': 124, 'spectral_radius': 0.521605537696193, 'ar_lags': 3, 'foundation_window': 3, 'regressor_type': 'Lasso', 'reg_alpha': 16.004912310838616, 'aci_step_size': 0.16530331198191495, 'oob_split_ratio': 0.6749071584868159}. Best is trial 0 with value: inf.\n",
      "[I 2026-07-02 16:32:42,843] Trial 218 finished with value: inf and parameters: {'reservoir_size': 139, 'spectral_radius': 0.5318670226946575, 'ar_lags': 4, 'foundation_window': 6, 'regressor_type': 'Ridge', 'reg_alpha': 2.025693458661441, 'aci_step_size': 0.1121070374841357, 'oob_split_ratio': 0.7104458469864854}. Best is trial 0 with value: inf.\n",
      "[I 2026-07-02 16:32:42,889] Trial 219 finished with value: inf and parameters: {'reservoir_size': 57, 'spectral_radius': 1.0438605292741296, 'ar_lags': 3, 'foundation_window': 5, 'regressor_type': 'Lasso', 'reg_alpha': 19.15708271852811, 'aci_step_size': 0.11892539593447948, 'oob_split_ratio': 0.7443486128031622}. Best is trial 0 with value: inf.\n",
      "[I 2026-07-02 16:32:42,937] Trial 220 finished with value: inf and parameters: {'reservoir_size': 79, 'spectral_radius': 1.4163869016046973, 'ar_lags': 4, 'foundation_window': 3, 'regressor_type': 'ElasticNet', 'reg_alpha': 0.683051654122879, 'aci_step_size': 0.018674007514840968, 'oob_split_ratio': 0.7696139136651214}. Best is trial 0 with value: inf.\n",
      "[I 2026-07-02 16:32:42,990] Trial 221 finished with value: inf and parameters: {'reservoir_size': 142, 'spectral_radius': 0.8590910998928678, 'ar_lags': 2, 'foundation_window': 4, 'regressor_type': 'ElasticNet', 'reg_alpha': 4.830167392855659, 'aci_step_size': 0.15658814671524662, 'oob_split_ratio': 0.6065786525385485}. Best is trial 0 with value: inf.\n",
      "[I 2026-07-02 16:32:43,061] Trial 222 finished with value: inf and parameters: {'reservoir_size': 157, 'spectral_radius': 0.7982492959389498, 'ar_lags': 2, 'foundation_window': 4, 'regressor_type': 'ElasticNet', 'reg_alpha': 4.247251534326355, 'aci_step_size': 0.15124237263214757, 'oob_split_ratio': 0.6038019026164771}. Best is trial 0 with value: inf.\n",
      "[I 2026-07-02 16:32:43,129] Trial 223 finished with value: inf and parameters: {'reservoir_size': 152, 'spectral_radius': 0.9869989457032494, 'ar_lags': 2, 'foundation_window': 4, 'regressor_type': 'ElasticNet', 'reg_alpha': 3.4872045368928166, 'aci_step_size': 0.09333036756502562, 'oob_split_ratio': 0.6007184232881683}. Best is trial 0 with value: inf.\n",
      "[I 2026-07-02 16:32:43,194] Trial 224 finished with value: inf and parameters: {'reservoir_size': 146, 'spectral_radius': 1.351731271852488, 'ar_lags': 2, 'foundation_window': 4, 'regressor_type': 'ElasticNet', 'reg_alpha': 2.884411869153606, 'aci_step_size': 0.1584892828436222, 'oob_split_ratio': 0.6143597556342264}. Best is trial 0 with value: inf.\n",
      "[I 2026-07-02 16:32:43,264] Trial 225 finished with value: inf and parameters: {'reservoir_size': 150, 'spectral_radius': 1.2177174666164858, 'ar_lags': 2, 'foundation_window': 4, 'regressor_type': 'Ridge', 'reg_alpha': 6.328403659613073, 'aci_step_size': 0.1633595658245757, 'oob_split_ratio': 0.6098335526413801}. Best is trial 0 with value: inf.\n",
      "[I 2026-07-02 16:32:43,311] Trial 226 finished with value: inf and parameters: {'reservoir_size': 67, 'spectral_radius': 0.6534508800200156, 'ar_lags': 2, 'foundation_window': 5, 'regressor_type': 'Lasso', 'reg_alpha': 0.1461066892030848, 'aci_step_size': 0.10163343526555442, 'oob_split_ratio': 0.6405006964153996}. Best is trial 0 with value: inf.\n",
      "[I 2026-07-02 16:32:43,357] Trial 227 finished with value: inf and parameters: {'reservoir_size': 39, 'spectral_radius': 0.5027004120164936, 'ar_lags': 4, 'foundation_window': 4, 'regressor_type': 'ElasticNet', 'reg_alpha': 2.398875928860423, 'aci_step_size': 0.13232997359138268, 'oob_split_ratio': 0.6196329942344799}. Best is trial 0 with value: inf.\n",
      "[I 2026-07-02 16:32:43,399] Trial 228 finished with value: inf and parameters: {'reservoir_size': 93, 'spectral_radius': 0.9493979981761561, 'ar_lags': 3, 'foundation_window': 6, 'regressor_type': 'Ridge', 'reg_alpha': 1.6675890359976617, 'aci_step_size': 0.1470767362014056, 'oob_split_ratio': 0.8459406718951179}. Best is trial 0 with value: inf.\n",
      "[I 2026-07-02 16:32:43,443] Trial 229 finished with value: inf and parameters: {'reservoir_size': 7, 'spectral_radius': 1.388970766215816, 'ar_lags': 4, 'foundation_window': 3, 'regressor_type': 'Lasso', 'reg_alpha': 3.2089208247915573, 'aci_step_size': 0.19056367764959467, 'oob_split_ratio': 0.7341293016276534}. Best is trial 0 with value: inf.\n",
      "[I 2026-07-02 16:32:43,505] Trial 230 finished with value: inf and parameters: {'reservoir_size': 137, 'spectral_radius': 0.8759348139280465, 'ar_lags': 2, 'foundation_window': 5, 'regressor_type': 'Ridge', 'reg_alpha': 5.3196930459557805, 'aci_step_size': 0.17562513755514528, 'oob_split_ratio': 0.7612239391290957}. Best is trial 0 with value: inf.\n",
      "[I 2026-07-02 16:32:43,560] Trial 231 finished with value: inf and parameters: {'reservoir_size': 106, 'spectral_radius': 1.052025886838858, 'ar_lags': 4, 'foundation_window': 4, 'regressor_type': 'ElasticNet', 'reg_alpha': 2.166453813979136, 'aci_step_size': 0.10180829749016894, 'oob_split_ratio': 0.6118326501130141}. Best is trial 0 with value: inf.\n",
      "[I 2026-07-02 16:32:43,614] Trial 232 finished with value: inf and parameters: {'reservoir_size': 93, 'spectral_radius': 1.0996160638251409, 'ar_lags': 4, 'foundation_window': 4, 'regressor_type': 'ElasticNet', 'reg_alpha': 1.5534882253772029, 'aci_step_size': 0.09733907819091064, 'oob_split_ratio': 0.6162955271370532}. Best is trial 0 with value: inf.\n",
      "[I 2026-07-02 16:32:43,665] Trial 233 finished with value: inf and parameters: {'reservoir_size': 87, 'spectral_radius': 1.0311988299358794, 'ar_lags': 4, 'foundation_window': 4, 'regressor_type': 'ElasticNet', 'reg_alpha': 1.2098215099953291, 'aci_step_size': 0.1078034090212211, 'oob_split_ratio': 0.6323744375423176}. Best is trial 0 with value: inf.\n",
      "[I 2026-07-02 16:32:43,720] Trial 234 finished with value: inf and parameters: {'reservoir_size': 101, 'spectral_radius': 1.1399308901370104, 'ar_lags': 4, 'foundation_window': 4, 'regressor_type': 'ElasticNet', 'reg_alpha': 2.518429195752696, 'aci_step_size': 0.09345795533837545, 'oob_split_ratio': 0.6282613334680631}. Best is trial 0 with value: inf.\n",
      "[I 2026-07-02 16:32:43,769] Trial 235 finished with value: inf and parameters: {'reservoir_size': 62, 'spectral_radius': 1.4831538326783125, 'ar_lags': 4, 'foundation_window': 4, 'regressor_type': 'ElasticNet', 'reg_alpha': 0.2781886783059466, 'aci_step_size': 0.08855766176228486, 'oob_split_ratio': 0.8013703309703408}. Best is trial 0 with value: inf.\n",
      "[I 2026-07-02 16:32:43,813] Trial 236 finished with value: inf and parameters: {'reservoir_size': 2, 'spectral_radius': 1.0099856650486008, 'ar_lags': 4, 'foundation_window': 3, 'regressor_type': 'Lasso', 'reg_alpha': 1.8503643898230102, 'aci_step_size': 0.12233456074034998, 'oob_split_ratio': 0.6227973072790546}. Best is trial 0 with value: inf.\n",
      "[I 2026-07-02 16:32:43,850] Trial 237 finished with value: inf and parameters: {'reservoir_size': 27, 'spectral_radius': 1.4525719627409466, 'ar_lags': 3, 'foundation_window': 4, 'regressor_type': 'Lasso', 'reg_alpha': 2.9925692609627945, 'aci_step_size': 0.015679698694755738, 'oob_split_ratio': 0.6867512769510141}. Best is trial 0 with value: inf.\n",
      "[I 2026-07-02 16:32:43,892] Trial 238 finished with value: inf and parameters: {'reservoir_size': 97, 'spectral_radius': 0.7556257518890821, 'ar_lags': 2, 'foundation_window': 6, 'regressor_type': 'Ridge', 'reg_alpha': 7.468136218866786, 'aci_step_size': 0.13952899485878933, 'oob_split_ratio': 0.8167943903486736}. Best is trial 0 with value: inf.\n",
      "[I 2026-07-02 16:32:43,937] Trial 239 finished with value: inf and parameters: {'reservoir_size': 48, 'spectral_radius': 1.0247512553679698, 'ar_lags': 4, 'foundation_window': 5, 'regressor_type': 'ElasticNet', 'reg_alpha': 3.6899694022073906, 'aci_step_size': 0.1285829110711795, 'oob_split_ratio': 0.8497660659491257}. Best is trial 0 with value: inf.\n",
