      "[I 2026-07-02 16:32:07,546] Trial 158 finished with value: 0.011044219854680572 and parameters: {'foundation_window': 4, 'ar_lags': 4, 'ema_spans': (2, 4, 8), 'conv_scales': (3, 6), 'use_calendar': True, 'ridge_alpha': 1.235887388496548, 'shrinkage_max': 0.30874601029443594, 'oob_split_ratio': 0.665149569128597}. Best is trial 144 with value: 0.009471602415253667.\n",
      "[I 2026-07-02 16:32:07,792] Trial 159 finished with value: 0.012951984274608355 and parameters: {'foundation_window': 3, 'ar_lags': 4, 'ema_spans': (2, 4, 8), 'conv_scales': (3, 6), 'use_calendar': True, 'ridge_alpha': 0.7716771694287177, 'shrinkage_max': 0.3710238592624259, 'oob_split_ratio': 0.6592739296246455}. Best is trial 144 with value: 0.009471602415253667.\n",
      "[I 2026-07-02 16:32:08,037] Trial 160 finished with value: 0.020427847065599896 and parameters: {'foundation_window': 5, 'ar_lags': 4, 'ema_spans': (2, 4, 8), 'conv_scales': (3, 6), 'use_calendar': True, 'ridge_alpha': 1.4786458691203814, 'shrinkage_max': 0.48912388101664805, 'oob_split_ratio': 0.6750225528198707}. Best is trial 144 with value: 0.009471602415253667.\n",
      "[I 2026-07-02 16:32:08,284] Trial 161 finished with value: 0.01080700897025894 and parameters: {'foundation_window': 4, 'ar_lags': 4, 'ema_spans': (2, 4, 8), 'conv_scales': (3, 6), 'use_calendar': True, 'ridge_alpha': 0.9160651124772509, 'shrinkage_max': 0.30983484987144994, 'oob_split_ratio': 0.6543393156778488}. Best is trial 144 with value: 0.009471602415253667.\n",
      "[I 2026-07-02 16:32:08,532] Trial 162 finished with value: 0.012349880085265802 and parameters: {'foundation_window': 4, 'ar_lags': 4, 'ema_spans': (2, 4, 8), 'conv_scales': (3, 6), 'use_calendar': True, 'ridge_alpha': 0.9124013976768935, 'shrinkage_max': 0.3054115767764296, 'oob_split_ratio': 0.6406992099664175}. Best is trial 144 with value: 0.009471602415253667.\n",
      "[I 2026-07-02 16:32:08,781] Trial 163 finished with value: 0.010526106309787057 and parameters: {'foundation_window': 4, 'ar_lags': 4, 'ema_spans': (2, 4, 8), 'conv_scales': (3, 6), 'use_calendar': True, 'ridge_alpha': 0.48551152234700407, 'shrinkage_max': 0.25214110834888515, 'oob_split_ratio': 0.6523530707120467}. Best is trial 144 with value: 0.009471602415253667.\n",
      "[I 2026-07-02 16:32:09,033] Trial 164 finished with value: 0.01055006488468771 and parameters: {'foundation_window': 4, 'ar_lags': 4, 'ema_spans': (2, 4, 8), 'conv_scales': (3, 6), 'use_calendar': True, 'ridge_alpha': 0.5376641598118075, 'shrinkage_max': 0.2561487512243894, 'oob_split_ratio': 0.6519878504375334}. Best is trial 144 with value: 0.009471602415253667.\n",
      "[I 2026-07-02 16:32:09,346] Trial 165 finished with value: 0.010223580909989174 and parameters: {'foundation_window': 4, 'ar_lags': 4, 'ema_spans': (2, 4, 8), 'conv_scales': (2, 4, 8), 'use_calendar': True, 'ridge_alpha': 0.40606250938952254, 'shrinkage_max': 0.2501764053983009, 'oob_split_ratio': 0.652013034605605}. Best is trial 144 with value: 0.009471602415253667.\n",
      "[I 2026-07-02 16:32:09,591] Trial 166 finished with value: 0.011426567032622752 and parameters: {'foundation_window': 4, 'ar_lags': 4, 'ema_spans': (2, 4, 8), 'conv_scales': (3, 6), 'use_calendar': True, 'ridge_alpha': 0.41215651251603513, 'shrinkage_max': 0.40808342136655557, 'oob_split_ratio': 0.6513969707973409}. Best is trial 144 with value: 0.009471602415253667.\n",
      "[I 2026-07-02 16:32:09,840] Trial 167 finished with value: 0.010533654570204625 and parameters: {'foundation_window': 4, 'ar_lags': 4, 'ema_spans': (2, 4, 8), 'conv_scales': (3, 6), 'use_calendar': True, 'ridge_alpha': 0.4837616032494687, 'shrinkage_max': 0.2508825424282277, 'oob_split_ratio': 0.65367494619958}. Best is trial 144 with value: 0.009471602415253667.\n",
      "[I 2026-07-02 16:32:10,170] Trial 168 finished with value: 0.01350334796313356 and parameters: {'foundation_window': 5, 'ar_lags': 4, 'ema_spans': (2, 4, 8), 'conv_scales': (2, 4, 8), 'use_calendar': True, 'ridge_alpha': 0.3194688436093245, 'shrinkage_max': 0.2622567844878796, 'oob_split_ratio': 0.6468073487284826}. Best is trial 144 with value: 0.009471602415253667.\n",
      "[I 2026-07-02 16:32:10,494] Trial 169 finished with value: 0.022194702757370014 and parameters: {'foundation_window': 8, 'ar_lags': 4, 'ema_spans': (2, 4, 8), 'conv_scales': (2, 4, 8), 'use_calendar': True, 'ridge_alpha': 0.46532669741103533, 'shrinkage_max': 0.35945796625507154, 'oob_split_ratio': 0.637126916084354}. Best is trial 144 with value: 0.009471602415253667.\n",
      "[I 2026-07-02 16:32:10,813] Trial 170 finished with value: 0.010382300578976433 and parameters: {'foundation_window': 4, 'ar_lags': 4, 'ema_spans': (2, 4, 8), 'conv_scales': (2, 4, 8), 'use_calendar': True, 'ridge_alpha': 0.6551773789250377, 'shrinkage_max': 0.2514856237825555, 'oob_split_ratio': 0.6670147167549342}. Best is trial 144 with value: 0.009471602415253667.\n",
      "[I 2026-07-02 16:32:11,121] Trial 171 finished with value: 0.010315444360913808 and parameters: {'foundation_window': 4, 'ar_lags': 4, 'ema_spans': (2, 4, 8), 'conv_scales': (2, 4, 8), 'use_calendar': True, 'ridge_alpha': 0.6088564254759026, 'shrinkage_max': 0.26209922923870776, 'oob_split_ratio': 0.6514101083843491}. Best is trial 144 with value: 0.009471602415253667.\n",
      "[I 2026-07-02 16:32:11,430] Trial 172 finished with value: 0.012021696987504172 and parameters: {'foundation_window': 4, 'ar_lags': 4, 'ema_spans': (2, 4, 8), 'conv_scales': (2, 4, 8), 'use_calendar': True, 'ridge_alpha': 0.6083795191504886, 'shrinkage_max': 0.33900847560558184, 'oob_split_ratio': 0.6666993923142586}. Best is trial 144 with value: 0.009471602415253667.\n",
      "[I 2026-07-02 16:32:11,745] Trial 173 finished with value: 0.012727302078320837 and parameters: {'foundation_window': 4, 'ar_lags': 4, 'ema_spans': (2, 4, 8), 'conv_scales': (2, 4, 8), 'use_calendar': True, 'ridge_alpha': 0.08681330041674096, 'shrinkage_max': 0.4038326791672713, 'oob_split_ratio': 0.6522871628597507}. Best is trial 144 with value: 0.009471602415253667.\n",
      "[I 2026-07-02 16:32:12,055] Trial 174 finished with value: 0.010526970759402407 and parameters: {'foundation_window': 4, 'ar_lags': 4, 'ema_spans': (2, 4, 8), 'conv_scales': (2, 4, 8), 'use_calendar': True, 'ridge_alpha': 0.7015225128475345, 'shrinkage_max': 0.25086165830338847, 'oob_split_ratio': 0.6580302168589799}. Best is trial 144 with value: 0.009471602415253667.\n",
      "[I 2026-07-02 16:32:12,362] Trial 175 finished with value: 0.010923342011141706 and parameters: {'foundation_window': 4, 'ar_lags': 4, 'ema_spans': (3, 6), 'conv_scales': (2, 4, 8), 'use_calendar': True, 'ridge_alpha': 0.4436140338386239, 'shrinkage_max': 0.25331328631729166, 'oob_split_ratio': 0.6589110802425051}. Best is trial 144 with value: 0.009471602415253667.\n",
      "[I 2026-07-02 16:32:12,675] Trial 176 finished with value: 0.013518228015135548 and parameters: {'foundation_window': 3, 'ar_lags': 4, 'ema_spans': (2, 4, 8), 'conv_scales': (2, 4, 8), 'use_calendar': True, 'ridge_alpha': 0.5521843760503239, 'shrinkage_max': 0.2983601933802156, 'oob_split_ratio': 0.7053776858683375}. Best is trial 144 with value: 0.009471602415253667.\n",
      "[I 2026-07-02 16:32:12,995] Trial 177 finished with value: 0.01164809649923255 and parameters: {'foundation_window': 4, 'ar_lags': 4, 'ema_spans': (2, 4, 8), 'conv_scales': (2, 4, 8), 'use_calendar': True, 'ridge_alpha': 0.346350663910189, 'shrinkage_max': 0.3806987191398016, 'oob_split_ratio': 0.6532710059111427}. Best is trial 144 with value: 0.009471602415253667.\n",
      "[I 2026-07-02 16:32:13,309] Trial 178 finished with value: 0.011941429073262346 and parameters: {'foundation_window': 4, 'ar_lags': 4, 'ema_spans': (2, 4, 8), 'conv_scales': (2, 4, 8), 'use_calendar': False, 'ridge_alpha': 0.2252446105497949, 'shrinkage_max': 0.250692804734945, 'oob_split_ratio': 0.6581124529352362}. Best is trial 144 with value: 0.009471602415253667.\n",
      "[I 2026-07-02 16:32:13,624] Trial 179 finished with value: 0.012910327866145148 and parameters: {'foundation_window': 4, 'ar_lags': 4, 'ema_spans': (2, 4, 8), 'conv_scales': (2, 4, 8), 'use_calendar': True, 'ridge_alpha': 0.7015449085224268, 'shrinkage_max': 0.445200587110385, 'oob_split_ratio': 0.6503062733161007}. Best is trial 144 with value: 0.009471602415253667.\n",
      "[I 2026-07-02 16:32:13,941] Trial 180 finished with value: 0.014236971417660048 and parameters: {'foundation_window': 5, 'ar_lags': 4, 'ema_spans': (2, 4, 8), 'conv_scales': (2, 4, 8), 'use_calendar': True, 'ridge_alpha': 0.05669862687848353, 'shrinkage_max': 0.349779548590254, 'oob_split_ratio': 0.6430008996517315}. Best is trial 144 with value: 0.009471602415253667.\n",
      "[I 2026-07-02 16:32:14,261] Trial 181 finished with value: 0.01106697287024469 and parameters: {'foundation_window': 4, 'ar_lags': 4, 'ema_spans': (2, 4, 8), 'conv_scales': (2, 4, 8), 'use_calendar': True, 'ridge_alpha': 0.7107631890733777, 'shrinkage_max': 0.307655619864724, 'oob_split_ratio': 0.6682044270009214}. Best is trial 144 with value: 0.009471602415253667.\n",
      "[I 2026-07-02 16:32:14,579] Trial 182 finished with value: 0.028137410502246333 and parameters: {'foundation_window': 4, 'ar_lags': 4, 'ema_spans': (2, 4, 8), 'conv_scales': (2, 4, 8), 'use_calendar': True, 'ridge_alpha': 0.4970026988279952, 'shrinkage_max': 2.687666566390342, 'oob_split_ratio': 0.6620657851952765}. Best is trial 144 with value: 0.009471602415253667.\n",
      "[I 2026-07-02 16:32:14,898] Trial 183 finished with value: 0.010254526847263025 and parameters: {'foundation_window': 4, 'ar_lags': 4, 'ema_spans': (2, 4, 8), 'conv_scales': (2, 4, 8), 'use_calendar': True, 'ridge_alpha': 0.382932342749647, 'shrinkage_max': 0.3043452119613762, 'oob_split_ratio': 0.6554752374847295}. Best is trial 144 with value: 0.009471602415253667.\n",
      "[I 2026-07-02 16:32:15,216] Trial 184 finished with value: 0.010039367075990296 and parameters: {'foundation_window': 4, 'ar_lags': 4, 'ema_spans': (2, 4, 8), 'conv_scales': (2, 4, 8), 'use_calendar': True, 'ridge_alpha': 0.2733828677231962, 'shrinkage_max': 0.25044568968743786, 'oob_split_ratio': 0.648494661497019}. Best is trial 144 with value: 0.009471602415253667.\n",
      "[I 2026-07-02 16:32:15,530] Trial 185 finished with value: 0.010119800386748585 and parameters: {'foundation_window': 4, 'ar_lags': 4, 'ema_spans': (2, 4, 8), 'conv_scales': (2, 4, 8), 'use_calendar': True, 'ridge_alpha': 0.2734445736744617, 'shrinkage_max': 0.2928551542780562, 'oob_split_ratio': 0.648287774711875}. Best is trial 144 with value: 0.009471602415253667.\n",
      "[I 2026-07-02 16:32:15,849] Trial 186 finished with value: 0.010059649796283487 and parameters: {'foundation_window': 4, 'ar_lags': 4, 'ema_spans': (2, 4, 8), 'conv_scales': (2, 4, 8), 'use_calendar': True, 'ridge_alpha': 0.2795993281916406, 'shrinkage_max': 0.25024260019387223, 'oob_split_ratio': 0.6540229629822332}. Best is trial 144 with value: 0.009471602415253667.\n",
      "[I 2026-07-02 16:32:16,168] Trial 187 finished with value: 0.022465979413071047 and parameters: {'foundation_window': 11, 'ar_lags': 4, 'ema_spans': (2, 4, 8), 'conv_scales': (2, 4, 8), 'use_calendar': True, 'ridge_alpha': 0.2748269627175997, 'shrinkage_max': 0.2506085203747986, 'oob_split_ratio': 0.6552234264108757}. Best is trial 144 with value: 0.009471602415253667.\n",
      "[I 2026-07-02 16:32:16,485] Trial 188 finished with value: 0.013278930380407514 and parameters: {'foundation_window': 4, 'ar_lags': 4, 'ema_spans': (2, 4, 8), 'conv_scales': (2, 4, 8), 'use_calendar': True, 'ridge_alpha': 0.17882624587453014, 'shrinkage_max': 0.25087042619854805, 'oob_split_ratio': 0.6346891073975036}. Best is trial 144 with value: 0.009471602415253667.\n",
      "[I 2026-07-02 16:32:16,805] Trial 189 finished with value: 0.015754680729665255 and parameters: {'foundation_window': 3, 'ar_lags': 4, 'ema_spans': (2, 4, 8), 'conv_scales': (2, 4, 8), 'use_calendar': True, 'ridge_alpha': 0.23580364665374515, 'shrinkage_max': 0.37441730125274014, 'oob_split_ratio': 0.6499292239637988}. Best is trial 144 with value: 0.009471602415253667.\n",
      "[I 2026-07-02 16:32:17,129] Trial 190 finished with value: 0.012748214821135964 and parameters: {'foundation_window': 4, 'ar_lags': 4, 'ema_spans': (2, 4, 8), 'conv_scales': (2, 4, 8), 'use_calendar': True, 'ridge_alpha': 0.3531672690564957, 'shrinkage_max': 0.30700243072191946, 'oob_split_ratio': 0.642246770054888}. Best is trial 144 with value: 0.009471602415253667.\n",
      "[I 2026-07-02 16:32:17,441] Trial 191 finished with value: 0.010073726730219775 and parameters: {'foundation_window': 4, 'ar_lags': 4, 'ema_spans': (2, 4, 8), 'conv_scales': (2, 4, 8), 'use_calendar': True, 'ridge_alpha': 0.2881281104326756, 'shrinkage_max': 0.29331034009504825, 'oob_split_ratio': 0.6541522645772917}. Best is trial 144 with value: 0.009471602415253667.\n",
      "[I 2026-07-02 16:32:17,754] Trial 192 finished with value: 0.010117437843476709 and parameters: {'foundation_window': 4, 'ar_lags': 4, 'ema_spans': (2, 4, 8), 'conv_scales': (2, 4, 8), 'use_calendar': True, 'ridge_alpha': 0.267068715927553, 'shrinkage_max': 0.2502883329281542, 'oob_split_ratio': 0.6575146052205549}. Best is trial 144 with value: 0.009471602415253667.\n",
      "[I 2026-07-02 16:32:18,069] Trial 193 finished with value: 0.01242556892269542 and parameters: {'foundation_window': 4, 'ar_lags': 4, 'ema_spans': (2, 4, 8), 'conv_scales': (2, 4, 8), 'use_calendar': True, 'ridge_alpha': 0.2578403330747836, 'shrinkage_max': 0.36065703575931257, 'oob_split_ratio': 0.6567851028716037}. Best is trial 144 with value: 0.009471602415253667.\n",
      "[I 2026-07-02 16:32:18,380] Trial 194 finished with value: 0.01009779755818233 and parameters: {'foundation_window': 4, 'ar_lags': 4, 'ema_spans': (2, 4, 8), 'conv_scales': (2, 4, 8), 'use_calendar': True, 'ridge_alpha': 0.30214388731641695, 'shrinkage_max': 0.2953926114407242, 'oob_split_ratio': 0.6539649592735317}. Best is trial 144 with value: 0.009471602415253667.\n",
      "[I 2026-07-02 16:32:18,693] Trial 195 finished with value: 0.010057567338627867 and parameters: {'foundation_window': 4, 'ar_lags': 4, 'ema_spans': (2, 4, 8), 'conv_scales': (2, 4, 8), 'use_calendar': True, 'ridge_alpha': 0.3108785090445179, 'shrinkage_max': 0.2545958710068267, 'oob_split_ratio': 0.6456822465390297}. Best is trial 144 with value: 0.009471602415253667.\n",
      "[I 2026-07-02 16:32:19,009] Trial 196 finished with value: 0.01014198378228459 and parameters: {'foundation_window': 4, 'ar_lags': 4, 'ema_spans': (2, 4, 8), 'conv_scales': (2, 4, 8), 'use_calendar': True, 'ridge_alpha': 0.30160914095089153, 'shrinkage_max': 0.29616014262050644, 'oob_split_ratio': 0.6474117794204542}. Best is trial 144 with value: 0.009471602415253667.\n",
      "[I 2026-07-02 16:32:19,328] Trial 197 finished with value: 0.015740408462475167 and parameters: {'foundation_window': 4, 'ar_lags': 4, 'ema_spans': (2, 4, 8), 'conv_scales': (2, 4, 8), 'use_calendar': True, 'ridge_alpha': 0.2894591914102957, 'shrinkage_max': 0.415580414218247, 'oob_split_ratio': 0.6399547096141753}. Best is trial 144 with value: 0.009471602415253667.\n",
      "[I 2026-07-02 16:32:19,641] Trial 198 finished with value: 0.011813497927036764 and parameters: {'foundation_window': 4, 'ar_lags': 4, 'ema_spans': (2, 4, 8), 'conv_scales': (2, 4, 8), 'use_calendar': True, 'ridge_alpha': 0.20140274296498087, 'shrinkage_max': 0.301174910322914, 'oob_split_ratio': 0.6996840778080287}. Best is trial 144 with value: 0.009471602415253667.\n",
      "[I 2026-07-02 16:32:19,961] Trial 199 finished with value: 0.011714365350380942 and parameters: {'foundation_window': 4, 'ar_lags': 4, 'ema_spans': (2, 4, 8), 'conv_scales': (2, 4, 8), 'use_calendar': True, 'ridge_alpha': 0.162502234699332, 'shrinkage_max': 0.36696859406250293, 'oob_split_ratio': 0.6430190676479419}. Best is trial 144 with value: 0.009471602415253667.\n",
      "[I 2026-07-02 16:32:20,298] Trial 200 finished with value: 0.013979697480082052 and parameters: {'foundation_window': 5, 'ar_lags': 4, 'ema_spans': (2, 4, 8), 'conv_scales': (2, 4, 8), 'use_calendar': True, 'ridge_alpha': 0.3226453071697919, 'shrinkage_max': 0.3046646473062923, 'oob_split_ratio': 0.6467194640345322}. Best is trial 144 with value: 0.009471602415253667.\n",
      "[I 2026-07-02 16:32:20,608] Trial 201 finished with value: 0.010217335572645534 and parameters: {'foundation_window': 4, 'ar_lags': 4, 'ema_spans': (2, 4, 8), 'conv_scales': (2, 4, 8), 'use_calendar': True, 'ridge_alpha': 0.41596526306731757, 'shrinkage_max': 0.2527527350266403, 'oob_split_ratio': 0.654847363911317}. Best is trial 144 with value: 0.009471602415253667.\n",
      "[I 2026-07-02 16:32:20,923] Trial 202 finished with value: 0.010177920500969004 and parameters: {'foundation_window': 4, 'ar_lags': 4, 'ema_spans': (2, 4, 8), 'conv_scales': (2, 4, 8), 'use_calendar': True, 'ridge_alpha': 0.4057315076632182, 'shrinkage_max': 0.25082400973888863, 'oob_split_ratio': 0.647616322504113}. Best is trial 144 with value: 0.009471602415253667.\n",
      "[I 2026-07-02 16:32:21,237] Trial 203 finished with value: 0.010218595664255533 and parameters: {'foundation_window': 4, 'ar_lags': 4, 'ema_spans': (2, 4, 8), 'conv_scales': (2, 4, 8), 'use_calendar': True, 'ridge_alpha': 0.39994620674122316, 'shrinkage_max': 0.3020684724074677, 'oob_split_ratio': 0.6465416867338226}. Best is trial 144 with value: 0.009471602415253667.\n",
      "[I 2026-07-02 16:32:21,553] Trial 204 finished with value: 0.010735267107072522 and parameters: {'foundation_window': 4, 'ar_lags': 4, 'ema_spans': (2, 4, 8), 'conv_scales': (2, 4, 8), 'use_calendar': True, 'ridge_alpha': 0.38013167150816407, 'shrinkage_max': 0.3414470001247181, 'oob_split_ratio': 0.6448482173020337}. Best is trial 144 with value: 0.009471602415253667.\n",
      "[I 2026-07-02 16:32:21,866] Trial 205 finished with value: 0.01791561432474349 and parameters: {'foundation_window': 4, 'ar_lags': 4, 'ema_spans': (2, 4, 8), 'conv_scales': (2, 4, 8), 'use_calendar': True, 'ridge_alpha': 0.2505061970570956, 'shrinkage_max': 0.41105213192205575, 'oob_split_ratio': 0.6330890197656678}. Best is trial 144 with value: 0.009471602415253667.\n",
      "[I 2026-07-02 16:32:22,177] Trial 206 finished with value: 0.010226137766324217 and parameters: {'foundation_window': 4, 'ar_lags': 4, 'ema_spans': (2, 4, 8), 'conv_scales': (2, 4, 8), 'use_calendar': True, 'ridge_alpha': 0.31090632457959827, 'shrinkage_max': 0.3040844137252315, 'oob_split_ratio': 0.6474333776624298}. Best is trial 144 with value: 0.009471602415253667.\n",
      "[I 2026-07-02 16:32:22,489] Trial 207 finished with value: 0.010330838523259557 and parameters: {'foundation_window': 4, 'ar_lags': 4, 'ema_spans': (2, 4, 8), 'conv_scales': (2, 4, 8), 'use_calendar': True, 'ridge_alpha': 0.31969471023561585, 'shrinkage_max': 0.3117948436878549, 'oob_split_ratio': 0.6471294687531701}. Best is trial 144 with value: 0.009471602415253667.\n",
      "[I 2026-07-02 16:32:22,799] Trial 208 finished with value: 0.012734193699582038 and parameters: {'foundation_window': 4, 'ar_lags': 4, 'ema_spans': (2, 4, 8), 'conv_scales': (2, 4, 8), 'use_calendar': False, 'ridge_alpha': 0.296804628701994, 'shrinkage_max': 0.3453615264429776, 'oob_split_ratio': 0.6373818356291091}. Best is trial 144 with value: 0.009471602415253667.\n",
      "[I 2026-07-02 16:32:23,111] Trial 209 finished with value: 0.012521100600833055 and parameters: {'foundation_window': 3, 'ar_lags': 4, 'ema_spans': (2, 4, 8), 'conv_scales': (2, 4, 8), 'use_calendar': True, 'ridge_alpha': 0.21247281285255673, 'shrinkage_max': 0.3091045683280285, 'oob_split_ratio': 0.5992644192178533}. Best is trial 144 with value: 0.009471602415253667.\n",
      "[I 2026-07-02 16:32:23,424] Trial 210 finished with value: 0.012096986681098945 and parameters: {'foundation_window': 4, 'ar_lags': 4, 'ema_spans': (2, 4, 8), 'conv_scales': (2, 4, 8), 'use_calendar': True, 'ridge_alpha': 0.3778771461587338, 'shrinkage_max': 0.4019163965903779, 'oob_split_ratio': 0.6475500335474411}. Best is trial 144 with value: 0.009471602415253667.\n",
      "[I 2026-07-02 16:32:23,736] Trial 211 finished with value: 0.01017859977566388 and parameters: {'foundation_window': 4, 'ar_lags': 4, 'ema_spans': (2, 4, 8), 'conv_scales': (2, 4, 8), 'use_calendar': True, 'ridge_alpha': 0.3948249226936377, 'shrinkage_max': 0.29926177123321274, 'oob_split_ratio': 0.643358727971028}. Best is trial 144 with value: 0.009471602415253667.\n",
      "[I 2026-07-02 16:32:24,051] Trial 212 finished with value: 0.010248308270060286 and parameters: {'foundation_window': 4, 'ar_lags': 4, 'ema_spans': (2, 4, 8), 'conv_scales': (2, 4, 8), 'use_calendar': True, 'ridge_alpha': 0.3102224672402803, 'shrinkage_max': 0.30571818251890276, 'oob_split_ratio': 0.6441047094154366}. Best is trial 144 with value: 0.009471602415253667.\n",
      "[I 2026-07-02 16:32:24,360] Trial 213 finished with value: 0.013073074471251318 and parameters: {'foundation_window': 4, 'ar_lags': 4, 'ema_spans': (2, 4, 8), 'conv_scales': (2, 4, 8), 'use_calendar': True, 'ridge_alpha': 0.32031691173683463, 'shrinkage_max': 0.31421039462723677, 'oob_split_ratio': 0.6403660029337447}. Best is trial 144 with value: 0.009471602415253667.\n",
      "[I 2026-07-02 16:32:24,676] Trial 214 finished with value: 0.011272966075534288 and parameters: {'foundation_window': 4, 'ar_lags': 4, 'ema_spans': (2, 4, 8), 'conv_scales': (2, 4, 8), 'use_calendar': True, 'ridge_alpha': 0.37735103219223154, 'shrinkage_max': 0.36614518338103175, 'oob_split_ratio': 0.644393495858799}. Best is trial 144 with value: 0.009471602415253667.\n",
