      "[I 2026-07-02 16:32:33,087] Trial 0 finished with value: inf and parameters: {'reservoir_size': 75, 'spectral_radius': 1.4507143064099162, 'ar_lags': 4, 'foundation_window': 5, 'regressor_type': 'Ridge', 'reg_alpha': 21.76624112345367, 'aci_step_size': 0.12421185223120967, 'oob_split_ratio': 0.7770181444490114}. Best is trial 0 with value: inf.\n",
      "[I 2026-07-02 16:32:33,096] Trial 1 finished with value: inf and parameters: {'reservoir_size': 5, 'spectral_radius': 1.4699098521619942, 'ar_lags': 4, 'foundation_window': 3, 'regressor_type': 'Lasso', 'reg_alpha': 2.6079656598095835, 'aci_step_size': 0.092069553542002, 'oob_split_ratio': 0.6728072850495105}. Best is trial 0 with value: inf.\n",
      "[I 2026-07-02 16:32:33,123] Trial 2 finished with value: inf and parameters: {'reservoir_size': 123, 'spectral_radius': 0.6394938606520418, 'ar_lags': 2, 'foundation_window': 4, 'regressor_type': 'ElasticNet', 'reg_alpha': 2.442886696734996, 'aci_step_size': 0.12255876808378806, 'oob_split_ratio': 0.6116126031799994}. Best is trial 0 with value: inf.\n",
      "[I 2026-07-02 16:32:33,148] Trial 3 finished with value: inf and parameters: {'reservoir_size': 122, 'spectral_radius': 0.6705241236872915, 'ar_lags': 2, 'foundation_window': 6, 'regressor_type': 'Ridge', 'reg_alpha': 0.18349072049055454, 'aci_step_size': 0.14000427503730983, 'oob_split_ratio': 0.7100381234349002}. Best is trial 0 with value: inf.\n",
      "[I 2026-07-02 16:32:33,161] Trial 4 finished with value: inf and parameters: {'reservoir_size': 25, 'spectral_radius': 0.9951769101112702, 'ar_lags': 2, 'foundation_window': 6, 'regressor_type': 'ElasticNet', 'reg_alpha': 2.533074654001447, 'aci_step_size': 0.11387495307522313, 'oob_split_ratio': 0.6462136138813818}. Best is trial 0 with value: inf.\n",
      "[I 2026-07-02 16:32:33,212] Trial 5 finished with value: inf and parameters: {'reservoir_size': 194, 'spectral_radius': 1.2751328233611146, 'ar_lags': 4, 'foundation_window': 6, 'regressor_type': 'ElasticNet', 'reg_alpha': 0.3380273704712439, 'aci_step_size': 0.018593184893002233, 'oob_split_ratio': 0.6813325826908161}. Best is trial 0 with value: inf.\n",
      "[I 2026-07-02 16:32:33,228] Trial 6 finished with value: inf and parameters: {'reservoir_size': 78, 'spectral_radius': 0.7713490317738959, 'ar_lags': 4, 'foundation_window': 4, 'regressor_type': 'ElasticNet', 'reg_alpha': 14.625327121207683, 'aci_step_size': 0.024164622299156457, 'oob_split_ratio': 0.8467217341501293}. Best is trial 0 with value: inf.\n",
      "[I 2026-07-02 16:32:33,264] Trial 7 finished with value: inf and parameters: {'reservoir_size': 155, 'spectral_radius': 0.6987156815341724, 'ar_lags': 2, 'foundation_window': 6, 'regressor_type': 'Lasso', 'reg_alpha': 0.15843250684388685, 'aci_step_size': 0.0781084884234118, 'oob_split_ratio': 0.6289672648812824}. Best is trial 0 with value: inf.\n",
      "[I 2026-07-02 16:32:33,309] Trial 8 finished with value: inf and parameters: {'reservoir_size': 173, 'spectral_radius': 1.123298126827558, 'ar_lags': 2, 'foundation_window': 3, 'regressor_type': 'Lasso', 'reg_alpha': 5.257127272786866, 'aci_step_size': 0.17857042108950205, 'oob_split_ratio': 0.7180537312904873}. Best is trial 0 with value: inf.\n",
      "[I 2026-07-02 16:32:33,319] Trial 9 finished with value: inf and parameters: {'reservoir_size': 24, 'spectral_radius': 1.213244787222995, 'ar_lags': 4, 'foundation_window': 5, 'regressor_type': 'Ridge', 'reg_alpha': 1.4253462720121493, 'aci_step_size': 0.014829634081378086, 'oob_split_ratio': 0.6269728567483261}. Best is trial 0 with value: inf.\n",
      "[I 2026-07-02 16:32:33,351] Trial 10 finished with value: inf and parameters: {'reservoir_size': 63, 'spectral_radius': 0.5059971829558172, 'ar_lags': 3, 'foundation_window': 5, 'regressor_type': 'Ridge', 'reg_alpha': 28.168262317655376, 'aci_step_size': 0.1923564417296298, 'oob_split_ratio': 0.8068576019838358}. Best is trial 0 with value: inf.\n",
      "[I 2026-07-02 16:32:33,381] Trial 11 finished with value: inf and parameters: {'reservoir_size': 63, 'spectral_radius': 1.497568547286547, 'ar_lags': 3, 'foundation_window': 3, 'regressor_type': 'Lasso', 'reg_alpha': 47.567600259748254, 'aci_step_size': 0.07507803881017378, 'oob_split_ratio': 0.7642593285172914}. Best is trial 0 with value: inf.\n",
      "[I 2026-07-02 16:32:33,406] Trial 12 finished with value: inf and parameters: {'reservoir_size': 5, 'spectral_radius': 1.4989193654044652, 'ar_lags': 4, 'foundation_window': 4, 'regressor_type': 'Lasso', 'reg_alpha': 9.864137118479032, 'aci_step_size': 0.08122160802157065, 'oob_split_ratio': 0.7631703000562452}. Best is trial 0 with value: inf.\n",
      "[I 2026-07-02 16:32:33,441] Trial 13 finished with value: inf and parameters: {'reservoir_size': 102, 'spectral_radius': 1.362482207050583, 'ar_lags': 3, 'foundation_window': 5, 'regressor_type': 'Ridge', 'reg_alpha': 0.5627125676227819, 'aci_step_size': 0.15490049554597815, 'oob_split_ratio': 0.7662322474177541}. Best is trial 0 with value: inf.\n",
      "[I 2026-07-02 16:32:33,469] Trial 14 finished with value: inf and parameters: {'reservoir_size': 38, 'spectral_radius': 1.373311672929574, 'ar_lags': 4, 'foundation_window': 3, 'regressor_type': 'Lasso', 'reg_alpha': 0.9385104680868002, 'aci_step_size': 0.09780180409621433, 'oob_split_ratio': 0.6784455195306917}. Best is trial 0 with value: inf.\n",
      "[I 2026-07-02 16:32:33,503] Trial 15 finished with value: inf and parameters: {'reservoir_size': 87, 'spectral_radius': 1.0311240303514604, 'ar_lags': 3, 'foundation_window': 4, 'regressor_type': 'Ridge', 'reg_alpha': 6.219908101922182, 'aci_step_size': 0.053289290803144845, 'oob_split_ratio': 0.8423174630121795}. Best is trial 0 with value: inf.\n",
      "[I 2026-07-02 16:32:33,530] Trial 16 finished with value: inf and parameters: {'reservoir_size': 3, 'spectral_radius': 1.3665886977297501, 'ar_lags': 4, 'foundation_window': 5, 'regressor_type': 'Lasso', 'reg_alpha': 18.300046103507174, 'aci_step_size': 0.15311523346402428, 'oob_split_ratio': 0.7295819250642022}. Best is trial 0 with value: inf.\n",
      "[I 2026-07-02 16:32:33,559] Trial 17 finished with value: inf and parameters: {'reservoir_size': 44, 'spectral_radius': 1.4247013286085002, 'ar_lags': 4, 'foundation_window': 3, 'regressor_type': 'Ridge', 'reg_alpha': 3.2388177403202714, 'aci_step_size': 0.054852577277823944, 'oob_split_ratio': 0.6687132372488157}. Best is trial 0 with value: inf.\n",
      "[I 2026-07-02 16:32:33,595] Trial 18 finished with value: inf and parameters: {'reservoir_size': 124, 'spectral_radius': 1.2517529975359836, 'ar_lags': 3, 'foundation_window': 4, 'regressor_type': 'Lasso', 'reg_alpha': 35.82629263110081, 'aci_step_size': 0.11337954979557742, 'oob_split_ratio': 0.7992798304626239}. Best is trial 0 with value: inf.\n",
      "[I 2026-07-02 16:32:33,627] Trial 19 finished with value: inf and parameters: {'reservoir_size': 57, 'spectral_radius': 1.1591551403330023, 'ar_lags': 4, 'foundation_window': 5, 'regressor_type': 'Ridge', 'reg_alpha': 8.18493239470719, 'aci_step_size': 0.13404808716811856, 'oob_split_ratio': 0.7366805790367822}. Best is trial 0 with value: inf.\n",
      "[I 2026-07-02 16:32:33,666] Trial 20 finished with value: inf and parameters: {'reservoir_size': 105, 'spectral_radius': 0.9040717866809063, 'ar_lags': 3, 'foundation_window': 3, 'regressor_type': 'Lasso', 'reg_alpha': 1.17785604528186, 'aci_step_size': 0.09844431499264575, 'oob_split_ratio': 0.8030540066082322}. Best is trial 0 with value: inf.\n",
      "[I 2026-07-02 16:32:33,713] Trial 21 finished with value: inf and parameters: {'reservoir_size': 138, 'spectral_radius': 0.5433570959233585, 'ar_lags': 3, 'foundation_window': 4, 'regressor_type': 'ElasticNet', 'reg_alpha': 2.6333786173315197, 'aci_step_size': 0.12404517712988634, 'oob_split_ratio': 0.6555718036648921}. Best is trial 0 with value: inf.\n",
      "[I 2026-07-02 16:32:33,765] Trial 22 finished with value: inf and parameters: {'reservoir_size': 147, 'spectral_radius': 0.8624938995780423, 'ar_lags': 2, 'foundation_window': 4, 'regressor_type': 'ElasticNet', 'reg_alpha': 4.087009706815388, 'aci_step_size': 0.16274130044246868, 'oob_split_ratio': 0.6002241361833968}. Best is trial 0 with value: inf.\n",
      "[I 2026-07-02 16:32:33,803] Trial 23 finished with value: inf and parameters: {'reservoir_size': 93, 'spectral_radius': 1.0535935829554344, 'ar_lags': 4, 'foundation_window': 4, 'regressor_type': 'ElasticNet', 'reg_alpha': 1.863025257262321, 'aci_step_size': 0.09976553643582217, 'oob_split_ratio': 0.6151114628626878}. Best is trial 0 with value: inf.\n",
      "[I 2026-07-02 16:32:33,847] Trial 24 finished with value: inf and parameters: {'reservoir_size': 119, 'spectral_radius': 1.3169421018089291, 'ar_lags': 3, 'foundation_window': 3, 'regressor_type': 'ElasticNet', 'reg_alpha': 0.6140300692996771, 'aci_step_size': 0.13802464658290747, 'oob_split_ratio': 0.69601770107271}. Best is trial 0 with value: inf.\n",
      "[I 2026-07-02 16:32:33,910] Trial 25 finished with value: inf and parameters: {'reservoir_size': 181, 'spectral_radius': 0.599417503631667, 'ar_lags': 4, 'foundation_window': 5, 'regressor_type': 'ElasticNet', 'reg_alpha': 12.004005993782908, 'aci_step_size': 0.060504038126944056, 'oob_split_ratio': 0.6424787696695}. Best is trial 0 with value: inf.\n",
      "[I 2026-07-02 16:32:33,945] Trial 26 finished with value: inf and parameters: {'reservoir_size': 74, 'spectral_radius': 0.8944497642389666, 'ar_lags': 2, 'foundation_window': 4, 'regressor_type': 'Ridge', 'reg_alpha': 0.3247633016093811, 'aci_step_size': 0.11275366363973513, 'oob_split_ratio': 0.6057897209768587}. Best is trial 0 with value: inf.\n",
      "[I 2026-07-02 16:32:33,975] Trial 27 finished with value: inf and parameters: {'reservoir_size': 18, 'spectral_radius': 1.423272292075874, 'ar_lags': 3, 'foundation_window': 3, 'regressor_type': 'ElasticNet', 'reg_alpha': 19.969316549516133, 'aci_step_size': 0.08971628316099395, 'oob_split_ratio': 0.6970021118359471}. Best is trial 0 with value: inf.\n",
      "[I 2026-07-02 16:32:34,005] Trial 28 finished with value: inf and parameters: {'reservoir_size': 49, 'spectral_radius': 0.799606277126764, 'ar_lags': 4, 'foundation_window': 5, 'regressor_type': 'Lasso', 'reg_alpha': 1.7934833547082942, 'aci_step_size': 0.12070339878132413, 'oob_split_ratio': 0.6616442504911428}. Best is trial 0 with value: inf.\n",
      "[I 2026-07-02 16:32:34,038] Trial 29 finished with value: inf and parameters: {'reservoir_size': 115, 'spectral_radius': 0.6636530988791834, 'ar_lags': 2, 'foundation_window': 4, 'regressor_type': 'Ridge', 'reg_alpha': 0.10579627569497728, 'aci_step_size': 0.1464754702207901, 'oob_split_ratio': 0.7441436254166575}. Best is trial 0 with value: inf.\n",
      "[I 2026-07-02 16:32:34,097] Trial 30 finished with value: inf and parameters: {'reservoir_size': 167, 'spectral_radius': 1.154911794125009, 'ar_lags': 2, 'foundation_window': 6, 'regressor_type': 'Ridge', 'reg_alpha': 0.8615431910972803, 'aci_step_size': 0.16910654642534675, 'oob_split_ratio': 0.8215793975791105}. Best is trial 0 with value: inf.\n",
      "[I 2026-07-02 16:32:34,142] Trial 31 finished with value: inf and parameters: {'reservoir_size': 130, 'spectral_radius': 0.6582514387541704, 'ar_lags': 2, 'foundation_window': 6, 'regressor_type': 'Ridge', 'reg_alpha': 0.32096447206651374, 'aci_step_size': 0.13072139627463947, 'oob_split_ratio': 0.7092405600321585}. Best is trial 0 with value: inf.\n",
      "[I 2026-07-02 16:32:34,191] Trial 32 finished with value: inf and parameters: {'reservoir_size': 143, 'spectral_radius': 0.9542216849011832, 'ar_lags': 2, 'foundation_window': 6, 'regressor_type': 'Ridge', 'reg_alpha': 0.19453703853137974, 'aci_step_size': 0.11419060165429576, 'oob_split_ratio': 0.7850198469421314}. Best is trial 0 with value: inf.\n",
      "[I 2026-07-02 16:32:34,235] Trial 33 finished with value: inf and parameters: {'reservoir_size': 107, 'spectral_radius': 0.7278130601862609, 'ar_lags': 2, 'foundation_window': 6, 'regressor_type': 'ElasticNet', 'reg_alpha': 0.5879300731325313, 'aci_step_size': 0.14529844852457638, 'oob_split_ratio': 0.7015381861217347}. Best is trial 0 with value: inf.\n",
      "[I 2026-07-02 16:32:34,273] Trial 34 finished with value: inf and parameters: {'reservoir_size': 78, 'spectral_radius': 0.8061888555099719, 'ar_lags': 2, 'foundation_window': 5, 'regressor_type': 'Ridge', 'reg_alpha': 0.19302481247778286, 'aci_step_size': 0.03323993117219727, 'oob_split_ratio': 0.6459203282640398}. Best is trial 0 with value: inf.\n",
      "[I 2026-07-02 16:32:34,304] Trial 35 finished with value: inf and parameters: {'reservoir_size': 34, 'spectral_radius': 0.6244389237033309, 'ar_lags': 2, 'foundation_window': 6, 'regressor_type': 'ElasticNet', 'reg_alpha': 6.285456098240835, 'aci_step_size': 0.12639982794614563, 'oob_split_ratio': 0.6825622086345876}. Best is trial 0 with value: inf.\n",
      "[I 2026-07-02 16:32:34,375] Trial 36 finished with value: inf and parameters: {'reservoir_size': 194, 'spectral_radius': 0.7114807338625978, 'ar_lags': 4, 'foundation_window': 5, 'regressor_type': 'Ridge', 'reg_alpha': 3.7794886287453755, 'aci_step_size': 0.10566325198328921, 'oob_split_ratio': 0.6341157776499052}. Best is trial 0 with value: inf.\n",
      "[I 2026-07-02 16:32:34,431] Trial 37 finished with value: inf and parameters: {'reservoir_size': 156, 'spectral_radius': 1.4348384747108927, 'ar_lags': 2, 'foundation_window': 6, 'regressor_type': 'Lasso', 'reg_alpha': 24.92638295128417, 'aci_step_size': 0.17645018612003238, 'oob_split_ratio': 0.7207824098819628}. Best is trial 0 with value: inf.\n",
      "[I 2026-07-02 16:32:34,470] Trial 38 finished with value: inf and parameters: {'reservoir_size': 91, 'spectral_radius': 0.5540953959674181, 'ar_lags': 3, 'foundation_window': 5, 'regressor_type': 'Ridge', 'reg_alpha': 0.10167185503295205, 'aci_step_size': 0.07063015524643937, 'oob_split_ratio': 0.7541999372179294}. Best is trial 0 with value: inf.\n",
      "[I 2026-07-02 16:32:34,519] Trial 39 finished with value: inf and parameters: {'reservoir_size': 129, 'spectral_radius': 1.2830857099044022, 'ar_lags': 4, 'foundation_window': 3, 'regressor_type': 'ElasticNet', 'reg_alpha': 0.41664457839342595, 'aci_step_size': 0.09107133352087952, 'oob_split_ratio': 0.78311894113669}. Best is trial 0 with value: inf.\n",
      "[I 2026-07-02 16:32:34,552] Trial 40 finished with value: inf and parameters: {'reservoir_size': 12, 'spectral_radius': 1.095699232856798, 'ar_lags': 2, 'foundation_window': 4, 'regressor_type': 'Lasso', 'reg_alpha': 48.539195576209416, 'aci_step_size': 0.1963062868205758, 'oob_split_ratio': 0.6173951253777124}. Best is trial 0 with value: inf.\n",
      "[I 2026-07-02 16:32:34,585] Trial 41 finished with value: inf and parameters: {'reservoir_size': 28, 'spectral_radius': 0.9908850898003994, 'ar_lags': 2, 'foundation_window': 6, 'regressor_type': 'ElasticNet', 'reg_alpha': 2.463029624090056, 'aci_step_size': 0.13773527863088103, 'oob_split_ratio': 0.6785419021089327}. Best is trial 0 with value: inf.\n",
      "[I 2026-07-02 16:32:34,619] Trial 42 finished with value: inf and parameters: {'reservoir_size': 10, 'spectral_radius': 1.2151962951884203, 'ar_lags': 2, 'foundation_window': 6, 'regressor_type': 'ElasticNet', 'reg_alpha': 4.657210343014261, 'aci_step_size': 0.08470071788787686, 'oob_split_ratio': 0.6285271520764454}. Best is trial 0 with value: inf.\n",
      "[I 2026-07-02 16:32:34,648] Trial 43 finished with value: inf and parameters: {'reservoir_size': 21, 'spectral_radius': 1.4657270275919136, 'ar_lags': 2, 'foundation_window': 6, 'regressor_type': 'ElasticNet', 'reg_alpha': 1.5591218023790245, 'aci_step_size': 0.10475530232622139, 'oob_split_ratio': 0.6462246993888277}. Best is trial 0 with value: inf.\n",
      "[I 2026-07-02 16:32:34,671] Trial 44 finished with value: inf and parameters: {'reservoir_size': 1, 'spectral_radius': 0.5020493456956732, 'ar_lags': 4, 'foundation_window': 5, 'regressor_type': 'Lasso', 'reg_alpha': 8.2622904053895, 'aci_step_size': 0.12088812236891794, 'oob_split_ratio': 0.6187055837137168}. Best is trial 0 with value: inf.\n",
      "[I 2026-07-02 16:32:34,697] Trial 45 finished with value: inf and parameters: {'reservoir_size': 64, 'spectral_radius': 0.7594255629557546, 'ar_lags': 2, 'foundation_window': 6, 'regressor_type': 'Ridge', 'reg_alpha': 2.3670139106076293, 'aci_step_size': 0.14579180589571605, 'oob_split_ratio': 0.6653818964405092}. Best is trial 0 with value: inf.\n",
      "[I 2026-07-02 16:32:34,723] Trial 46 finished with value: inf and parameters: {'reservoir_size': 50, 'spectral_radius': 1.3304916325089118, 'ar_lags': 3, 'foundation_window': 5, 'regressor_type': 'ElasticNet', 'reg_alpha': 0.9145982602862854, 'aci_step_size': 0.11181445253662341, 'oob_split_ratio': 0.6873282335346854}. Best is trial 0 with value: inf.\n",
      "[I 2026-07-02 16:32:34,746] Trial 47 finished with value: inf and parameters: {'reservoir_size': 38, 'spectral_radius': 1.3918651332645304, 'ar_lags': 4, 'foundation_window': 3, 'regressor_type': 'Lasso', 'reg_alpha': 16.386552651359576, 'aci_step_size': 0.1555719058001887, 'oob_split_ratio': 0.6361482166920434}. Best is trial 0 with value: inf.\n",
      "[I 2026-07-02 16:32:34,773] Trial 48 finished with value: inf and parameters: {'reservoir_size': 75, 'spectral_radius': 0.584056520213381, 'ar_lags': 3, 'foundation_window': 6, 'regressor_type': 'Ridge', 'reg_alpha': 11.702460839445823, 'aci_step_size': 0.07251071915327088, 'oob_split_ratio': 0.6567707872760925}. Best is trial 0 with value: inf.\n",
      "[I 2026-07-02 16:32:34,807] Trial 49 finished with value: inf and parameters: {'reservoir_size': 99, 'spectral_radius': 0.8452742284055914, 'ar_lags': 2, 'foundation_window': 5, 'regressor_type': 'ElasticNet', 'reg_alpha': 1.1874224614883488, 'aci_step_size': 0.13114666461573246, 'oob_split_ratio': 0.6712243775813236}. Best is trial 0 with value: inf.\n",
      "[I 2026-07-02 16:32:34,855] Trial 50 finished with value: inf and parameters: {'reservoir_size': 111, 'spectral_radius': 1.4876998569362427, 'ar_lags': 4, 'foundation_window': 4, 'regressor_type': 'Lasso', 'reg_alpha': 5.715672544606627, 'aci_step_size': 0.09398641223276391, 'oob_split_ratio': 0.7261631315962004}. Best is trial 0 with value: inf.\n",
      "[I 2026-07-02 16:32:34,939] Trial 51 finished with value: inf and parameters: {'reservoir_size': 200, 'spectral_radius': 1.2490245829407687, 'ar_lags': 4, 'foundation_window': 6, 'regressor_type': 'ElasticNet', 'reg_alpha': 0.1570023616045323, 'aci_step_size': 0.016960173030563692, 'oob_split_ratio': 0.8495039328687155}. Best is trial 0 with value: inf.\n",
      "[I 2026-07-02 16:32:34,999] Trial 52 finished with value: inf and parameters: {'reservoir_size': 160, 'spectral_radius': 1.3148757090870904, 'ar_lags': 4, 'foundation_window': 6, 'regressor_type': 'ElasticNet', 'reg_alpha': 0.27581930239981106, 'aci_step_size': 0.02562181029628172, 'oob_split_ratio': 0.7107341559135671}. Best is trial 0 with value: inf.\n",
      "[I 2026-07-02 16:32:35,066] Trial 53 finished with value: inf and parameters: {'reservoir_size': 177, 'spectral_radius': 1.3983593776995764, 'ar_lags': 4, 'foundation_window': 6, 'regressor_type': 'ElasticNet', 'reg_alpha': 31.526007638244913, 'aci_step_size': 0.03148193755812559, 'oob_split_ratio': 0.6903182161389626}. Best is trial 0 with value: inf.\n",
      "[I 2026-07-02 16:32:35,099] Trial 54 finished with value: inf and parameters: {'reservoir_size': 12, 'spectral_radius': 1.4518934854291694, 'ar_lags': 4, 'foundation_window': 3, 'regressor_type': 'ElasticNet', 'reg_alpha': 3.218834596790535, 'aci_step_size': 0.04881051073794672, 'oob_split_ratio': 0.8276499506218905}. Best is trial 0 with value: inf.\n",
      "[I 2026-07-02 16:32:35,132] Trial 55 finished with value: inf and parameters: {'reservoir_size': 28, 'spectral_radius': 1.3489438675678715, 'ar_lags': 4, 'foundation_window': 6, 'regressor_type': 'Ridge', 'reg_alpha': 0.47325403461102106, 'aci_step_size': 0.11785173884709908, 'oob_split_ratio': 0.6546113745898078}. Best is trial 0 with value: inf.\n",
      "[I 2026-07-02 16:32:35,165] Trial 56 finished with value: inf and parameters: {'reservoir_size': 66, 'spectral_radius': 1.1731032305673865, 'ar_lags': 4, 'foundation_window': 5, 'regressor_type': 'ElasticNet', 'reg_alpha': 0.7010414465803724, 'aci_step_size': 0.10680313857388887, 'oob_split_ratio': 0.6708845467207992}. Best is trial 0 with value: inf.\n",
      "[I 2026-07-02 16:32:35,226] Trial 57 finished with value: inf and parameters: {'reservoir_size': 186, 'spectral_radius': 1.079541394423983, 'ar_lags': 3, 'foundation_window': 4, 'regressor_type': 'Lasso', 'reg_alpha': 0.25376103395010086, 'aci_step_size': 0.18555146530838942, 'oob_split_ratio': 0.7724454054028115}. Best is trial 0 with value: inf.\n",
      "[I 2026-07-02 16:32:35,292] Trial 58 finished with value: inf and parameters: {'reservoir_size': 168, 'spectral_radius': 0.9416967163759413, 'ar_lags': 2, 'foundation_window': 3, 'regressor_type': 'Ridge', 'reg_alpha': 0.15499241202743663, 'aci_step_size': 0.010810473233398926, 'oob_split_ratio': 0.7391854294534393}. Best is trial 0 with value: inf.\n",
      "[I 2026-07-02 16:32:35,333] Trial 59 finished with value: inf and parameters: {'reservoir_size': 86, 'spectral_radius': 0.6507309910903308, 'ar_lags': 4, 'foundation_window': 6, 'regressor_type': 'ElasticNet', 'reg_alpha': 1.1350515254891549, 'aci_step_size': 0.12777032941115668, 'oob_split_ratio': 0.6095347826842266}. Best is trial 0 with value: inf.\n",
