      "[I 2026-07-02 16:32:47,189] Trial 0 finished with value: inf and parameters: {'target_miscoverage': 0.08116262258099886, 'aci_step_size': 0.1667521176194013, 'interval_scale': 3.805209189203926}. Best is trial 0 with value: inf.\n",
      "[I 2026-07-02 16:32:47,205] Trial 1 finished with value: inf and parameters: {'target_miscoverage': 0.12374511199743694, 'aci_step_size': 0.00889039845957559, 'interval_scale': 0.7705594012729585}. Best is trial 0 with value: inf.\n",
      "[I 2026-07-02 16:32:47,220] Trial 2 finished with value: inf and parameters: {'target_miscoverage': 0.021035886311957897, 'aci_step_size': 0.12207764786954153, 'interval_scale': 2.6471868808879733}. Best is trial 0 with value: inf.\n",
      "[I 2026-07-02 16:32:47,233] Trial 3 finished with value: inf and parameters: {'target_miscoverage': 0.14453378978124864, 'aci_step_size': 0.005394455304087533, 'interval_scale': 7.3596614801167854}. Best is trial 0 with value: inf.\n",
      "[I 2026-07-02 16:32:47,243] Trial 4 finished with value: inf and parameters: {'target_miscoverage': 0.16816410175208013, 'aci_step_size': 0.010943342660062645, 'interval_scale': 0.8277688526305597}. Best is trial 0 with value: inf.\n",
      "[I 2026-07-02 16:32:47,254] Trial 5 finished with value: inf and parameters: {'target_miscoverage': 0.044846856872152424, 'aci_step_size': 0.015359756451337138, 'interval_scale': 2.142099844547283}. Best is trial 0 with value: inf.\n",
      "[I 2026-07-02 16:32:47,265] Trial 6 finished with value: inf and parameters: {'target_miscoverage': 0.092069553542002, 'aci_step_size': 0.014639847680621753, 'interval_scale': 2.727183127344505}. Best is trial 0 with value: inf.\n",
      "[I 2026-07-02 16:32:47,276] Trial 7 finished with value: inf and parameters: {'target_miscoverage': 0.036503833523887946, 'aci_step_size': 0.014689372953975089, 'interval_scale': 1.3807454499059875}. Best is trial 0 with value: inf.\n",
      "[I 2026-07-02 16:32:47,285] Trial 8 finished with value: inf and parameters: {'target_miscoverage': 0.09665329700123683, 'aci_step_size': 0.09054594344647797, 'interval_scale': 0.869763534223623}. Best is trial 0 with value: inf.\n",
      "[I 2026-07-02 16:32:47,295] Trial 9 finished with value: inf and parameters: {'target_miscoverage': 0.1077045432985862, 'aci_step_size': 0.04446862319918233, 'interval_scale': 0.5687244174086067}. Best is trial 0 with value: inf.\n",
      "[I 2026-07-02 16:32:47,308] Trial 10 finished with value: inf and parameters: {'target_miscoverage': 0.19079117564742293, 'aci_step_size': 0.03929005796689084, 'interval_scale': 7.352059504020752}. Best is trial 0 with value: inf.\n",
      "[I 2026-07-02 16:32:47,323] Trial 11 finished with value: inf and parameters: {'target_miscoverage': 0.12717779591506623, 'aci_step_size': 0.1844018019456635, 'interval_scale': 4.473451998023682}. Best is trial 0 with value: inf.\n",
      "[I 2026-07-02 16:32:47,337] Trial 12 finished with value: inf and parameters: {'target_miscoverage': 0.05980432478449883, 'aci_step_size': 0.04841019269556785, 'interval_scale': 1.5448173641158458}. Best is trial 0 with value: inf.\n",
      "[I 2026-07-02 16:32:47,351] Trial 13 finished with value: inf and parameters: {'target_miscoverage': 0.08132807007881476, 'aci_step_size': 0.005445949254060178, 'interval_scale': 4.295641170548535}. Best is trial 0 with value: inf.\n",
      "[I 2026-07-02 16:32:47,365] Trial 14 finished with value: inf and parameters: {'target_miscoverage': 0.13618861053956144, 'aci_step_size': 0.025101774321532128, 'interval_scale': 0.5604815546232131}. Best is trial 0 with value: inf.\n",
      "[I 2026-07-02 16:32:47,381] Trial 15 finished with value: inf and parameters: {'target_miscoverage': 0.07047438752371354, 'aci_step_size': 0.08241101309667724, 'interval_scale': 1.1105406294840925}. Best is trial 0 with value: inf.\n",
      "[I 2026-07-02 16:32:47,395] Trial 16 finished with value: inf and parameters: {'target_miscoverage': 0.11119998348022134, 'aci_step_size': 0.008507713558426836, 'interval_scale': 4.343584737387724}. Best is trial 0 with value: inf.\n",
      "[I 2026-07-02 16:32:47,410] Trial 17 finished with value: inf and parameters: {'target_miscoverage': 0.16025880166204298, 'aci_step_size': 0.028174997309276275, 'interval_scale': 1.868123972201869}. Best is trial 0 with value: inf.\n",
      "[I 2026-07-02 16:32:47,425] Trial 18 finished with value: inf and parameters: {'target_miscoverage': 0.11252782029253157, 'aci_step_size': 0.1830911261990277, 'interval_scale': 3.2246713626147905}. Best is trial 0 with value: inf.\n",
      "[I 2026-07-02 16:32:47,441] Trial 19 finished with value: inf and parameters: {'target_miscoverage': 0.1992431410320128, 'aci_step_size': 0.0689461149060578, 'interval_scale': 0.7746372461631871}. Best is trial 0 with value: inf.\n",
      "[I 2026-07-02 16:32:47,455] Trial 20 finished with value: inf and parameters: {'target_miscoverage': 0.0732934281697311, 'aci_step_size': 0.02405620295624521, 'interval_scale': 1.1669460467632216}. Best is trial 0 with value: inf.\n",
      "[I 2026-07-02 16:32:47,469] Trial 21 finished with value: inf and parameters: {'target_miscoverage': 0.023762787418276712, 'aci_step_size': 0.12433658758124852, 'interval_scale': 2.9869948310163084}. Best is trial 0 with value: inf.\n",
      "[I 2026-07-02 16:32:47,483] Trial 22 finished with value: inf and parameters: {'target_miscoverage': 0.012496659986383565, 'aci_step_size': 0.12986765463602845, 'interval_scale': 5.698069060002988}. Best is trial 0 with value: inf.\n",
      "[I 2026-07-02 16:32:47,497] Trial 23 finished with value: inf and parameters: {'target_miscoverage': 0.04998159134634815, 'aci_step_size': 0.1233973280585078, 'interval_scale': 2.180253852457396}. Best is trial 0 with value: inf.\n",
      "[I 2026-07-02 16:32:47,511] Trial 24 finished with value: inf and parameters: {'target_miscoverage': 0.02419571101396626, 'aci_step_size': 0.0635387952729786, 'interval_scale': 3.5300982332084754}. Best is trial 0 with value: inf.\n",
      "[I 2026-07-02 16:32:47,526] Trial 25 finished with value: inf and parameters: {'target_miscoverage': 0.154062487232484, 'aci_step_size': 0.19896451807450138, 'interval_scale': 2.3657180520865806}. Best is trial 0 with value: inf.\n",
      "[I 2026-07-02 16:32:47,539] Trial 26 finished with value: inf and parameters: {'target_miscoverage': 0.12210414049479829, 'aci_step_size': 0.10092348965932081, 'interval_scale': 5.552703728463805}. Best is trial 0 with value: inf.\n",
      "[I 2026-07-02 16:32:47,554] Trial 27 finished with value: inf and parameters: {'target_miscoverage': 0.17395619115211802, 'aci_step_size': 0.1493848433924282, 'interval_scale': 1.6464588965937554}. Best is trial 0 with value: inf.\n",
      "[I 2026-07-02 16:32:47,568] Trial 28 finished with value: inf and parameters: {'target_miscoverage': 0.08747667687758734, 'aci_step_size': 0.007727627502789286, 'interval_scale': 5.561074639168819}. Best is trial 0 with value: inf.\n",
      "[I 2026-07-02 16:32:47,582] Trial 29 finished with value: inf and parameters: {'target_miscoverage': 0.13792164024528542, 'aci_step_size': 0.005144652168570911, 'interval_scale': 6.9029819200590365}. Best is trial 0 with value: inf.\n",
      "[I 2026-07-02 16:32:47,597] Trial 30 finished with value: inf and parameters: {'target_miscoverage': 0.0626676183528776, 'aci_step_size': 0.018917251694863482, 'interval_scale': 3.8023206080092833}. Best is trial 0 with value: inf.\n",
      "[I 2026-07-02 16:32:47,612] Trial 31 finished with value: inf and parameters: {'target_miscoverage': 0.14523201585274012, 'aci_step_size': 0.007189296618025054, 'interval_scale': 6.378622891335354}. Best is trial 0 with value: inf.\n",
      "[I 2026-07-02 16:32:47,627] Trial 32 finished with value: inf and parameters: {'target_miscoverage': 0.17407150027123627, 'aci_step_size': 0.009777282703621869, 'interval_scale': 7.924924411633056}. Best is trial 0 with value: inf.\n",
      "[I 2026-07-02 16:32:47,641] Trial 33 finished with value: inf and parameters: {'target_miscoverage': 0.09870309825439415, 'aci_step_size': 0.006150945178381917, 'interval_scale': 2.563562017228516}. Best is trial 0 with value: inf.\n",
      "[I 2026-07-02 16:32:47,657] Trial 34 finished with value: inf and parameters: {'target_miscoverage': 0.12473973281530525, 'aci_step_size': 0.011442885986661407, 'interval_scale': 4.923081038795345}. Best is trial 0 with value: inf.\n",
      "[I 2026-07-02 16:32:47,672] Trial 35 finished with value: inf and parameters: {'target_miscoverage': 0.048989540172820444, 'aci_step_size': 0.011957503742689167, 'interval_scale': 0.7152345096277843}. Best is trial 0 with value: inf.\n",
      "[I 2026-07-02 16:32:47,686] Trial 36 finished with value: inf and parameters: {'target_miscoverage': 0.03998988936953729, 'aci_step_size': 0.006973234125244636, 'interval_scale': 0.9417818612663774}. Best is trial 0 with value: inf.\n",
      "[I 2026-07-02 16:32:47,700] Trial 37 finished with value: inf and parameters: {'target_miscoverage': 0.1534477041184571, 'aci_step_size': 0.05544348497042766, 'interval_scale': 1.9268472413030684}. Best is trial 0 with value: inf.\n",
      "[I 2026-07-02 16:32:47,715] Trial 38 finished with value: inf and parameters: {'target_miscoverage': 0.10204532223645356, 'aci_step_size': 0.01930386979361519, 'interval_scale': 0.6613642277105257}. Best is trial 0 with value: inf.\n",
      "[I 2026-07-02 16:32:47,730] Trial 39 finished with value: inf and parameters: {'target_miscoverage': 0.18605093731638817, 'aci_step_size': 0.10342674826250556, 'interval_scale': 1.2519221349404333}. Best is trial 0 with value: inf.\n",
      "[I 2026-07-02 16:32:47,744] Trial 40 finished with value: inf and parameters: {'target_miscoverage': 0.029618592929364262, 'aci_step_size': 0.03377104689900273, 'interval_scale': 0.9465749055141379}. Best is trial 0 with value: inf.\n",
      "[I 2026-07-02 16:32:47,759] Trial 41 finished with value: inf and parameters: {'target_miscoverage': 0.16031730503400105, 'aci_step_size': 0.01373826092514082, 'interval_scale': 0.6372915307661183}. Best is trial 0 with value: inf.\n",
      "[I 2026-07-02 16:32:47,773] Trial 42 finished with value: inf and parameters: {'target_miscoverage': 0.17225397573781742, 'aci_step_size': 0.00988788475996148, 'interval_scale': 0.8342039585606286}. Best is trial 0 with value: inf.\n",
      "[I 2026-07-02 16:32:47,788] Trial 43 finished with value: inf and parameters: {'target_miscoverage': 0.14167913292631468, 'aci_step_size': 0.005689209384972981, 'interval_scale': 0.519086425653888}. Best is trial 0 with value: inf.\n",
      "[I 2026-07-02 16:32:47,803] Trial 44 finished with value: inf and parameters: {'target_miscoverage': 0.12906630086995852, 'aci_step_size': 0.15452847469510628, 'interval_scale': 1.3960290366567405}. Best is trial 0 with value: inf.\n",
      "[I 2026-07-02 16:32:47,818] Trial 45 finished with value: inf and parameters: {'target_miscoverage': 0.16513924097647104, 'aci_step_size': 0.016548348341361274, 'interval_scale': 2.9315544717512534}. Best is trial 0 with value: inf.\n",
      "[I 2026-07-02 16:32:47,832] Trial 46 finished with value: inf and parameters: {'target_miscoverage': 0.1494143032251274, 'aci_step_size': 0.00921294552162117, 'interval_scale': 3.8361754334708666}. Best is trial 0 with value: inf.\n",
      "[I 2026-07-02 16:32:47,847] Trial 47 finished with value: inf and parameters: {'target_miscoverage': 0.11830792181599549, 'aci_step_size': 0.006350746532009415, 'interval_scale': 1.0094345769966693}. Best is trial 0 with value: inf.\n",
      "[I 2026-07-02 16:32:47,862] Trial 48 finished with value: inf and parameters: {'target_miscoverage': 0.08447215988804536, 'aci_step_size': 0.0812245431847179, 'interval_scale': 4.7689439618369684}. Best is trial 0 with value: inf.\n",
      "[I 2026-07-02 16:32:47,877] Trial 49 finished with value: inf and parameters: {'target_miscoverage': 0.1858285278432173, 'aci_step_size': 0.03989979957506505, 'interval_scale': 1.7683677397922082}. Best is trial 0 with value: inf.\n",
      "[I 2026-07-02 16:32:47,892] Trial 50 finished with value: inf and parameters: {'target_miscoverage': 0.13298252149997025, 'aci_step_size': 0.011480095045267123, 'interval_scale': 1.4301874788876703}. Best is trial 0 with value: inf.\n",
      "[I 2026-07-02 16:32:47,907] Trial 51 finished with value: inf and parameters: {'target_miscoverage': 0.03970899490829845, 'aci_step_size': 0.008407633755705253, 'interval_scale': 2.17412954151083}. Best is trial 0 with value: inf.\n",
      "[I 2026-07-02 16:32:47,923] Trial 52 finished with value: inf and parameters: {'target_miscoverage': 0.012456834267480309, 'aci_step_size': 0.013134811141545927, 'interval_scale': 2.5809401757657744}. Best is trial 0 with value: inf.\n",
      "[I 2026-07-02 16:32:47,939] Trial 53 finished with value: inf and parameters: {'target_miscoverage': 0.07010048777669733, 'aci_step_size': 0.016161810606439238, 'interval_scale': 3.257886082122617}. Best is trial 0 with value: inf.\n",
      "[I 2026-07-02 16:32:47,954] Trial 54 finished with value: inf and parameters: {'target_miscoverage': 0.051934013835213726, 'aci_step_size': 0.16945312028008022, 'interval_scale': 2.155763308041213}. Best is trial 0 with value: inf.\n",
      "[I 2026-07-02 16:32:47,970] Trial 55 finished with value: inf and parameters: {'target_miscoverage': 0.020669328288897004, 'aci_step_size': 0.005020848772341602, 'interval_scale': 0.6127209678895318}. Best is trial 0 with value: inf.\n",
      "[I 2026-07-02 16:32:47,986] Trial 56 finished with value: inf and parameters: {'target_miscoverage': 0.07674293784185968, 'aci_step_size': 0.020559356288890048, 'interval_scale': 0.7758935607043403}. Best is trial 0 with value: inf.\n",
      "[I 2026-07-02 16:32:48,002] Trial 57 finished with value: inf and parameters: {'target_miscoverage': 0.03210241182124346, 'aci_step_size': 0.0080920190869101, 'interval_scale': 1.2297147588829385}. Best is trial 0 with value: inf.\n",
      "[I 2026-07-02 16:32:48,018] Trial 58 finished with value: inf and parameters: {'target_miscoverage': 0.10911912178561878, 'aci_step_size': 0.010597892907357074, 'interval_scale': 2.9203323658230937}. Best is trial 0 with value: inf.\n",
      "[I 2026-07-02 16:32:48,034] Trial 59 finished with value: inf and parameters: {'target_miscoverage': 0.09273010324452653, 'aci_step_size': 0.1377385225133161, 'interval_scale': 3.977991710842825}. Best is trial 0 with value: inf.\n",
      "[I 2026-07-02 16:32:48,049] Trial 60 finished with value: inf and parameters: {'target_miscoverage': 0.05601631171582339, 'aci_step_size': 0.11033427192497594, 'interval_scale': 6.187805896207372}. Best is trial 0 with value: inf.\n",
      "[I 2026-07-02 16:32:48,064] Trial 61 finished with value: inf and parameters: {'target_miscoverage': 0.11615847213360787, 'aci_step_size': 0.027455748618032988, 'interval_scale': 2.6395132839814894}. Best is trial 0 with value: inf.\n",
      "[I 2026-07-02 16:32:48,079] Trial 62 finished with value: inf and parameters: {'target_miscoverage': 0.10503609781488, 'aci_step_size': 0.014702291223397604, 'interval_scale': 3.220140481479807}. Best is trial 0 with value: inf.\n",
      "[I 2026-07-02 16:32:48,095] Trial 63 finished with value: inf and parameters: {'target_miscoverage': 0.09524286547341343, 'aci_step_size': 0.02206199960101729, 'interval_scale': 2.330937286935537}. Best is trial 0 with value: inf.\n",
      "[I 2026-07-02 16:32:48,109] Trial 64 finished with value: inf and parameters: {'target_miscoverage': 0.019415659027187098, 'aci_step_size': 0.016752768010399405, 'interval_scale': 1.9498324077062978}. Best is trial 0 with value: inf.\n",
      "[I 2026-07-02 16:32:48,125] Trial 65 finished with value: inf and parameters: {'target_miscoverage': 0.06538058900767597, 'aci_step_size': 0.006920567727857101, 'interval_scale': 3.4640846388436777}. Best is trial 0 with value: inf.\n",
      "[I 2026-07-02 16:32:48,140] Trial 66 finished with value: inf and parameters: {'target_miscoverage': 0.047311511808900954, 'aci_step_size': 0.03354809592322284, 'interval_scale': 5.072129119886655}. Best is trial 0 with value: inf.\n",
      "[I 2026-07-02 16:32:48,154] Trial 67 finished with value: inf and parameters: {'target_miscoverage': 0.07866086745642867, 'aci_step_size': 0.01287801436146903, 'interval_scale': 1.0516777538507192}. Best is trial 0 with value: inf.\n",
      "[I 2026-07-02 16:32:48,170] Trial 68 finished with value: inf and parameters: {'target_miscoverage': 0.13414440947914807, 'aci_step_size': 0.0840551206032073, 'interval_scale': 4.190124464107096}. Best is trial 0 with value: inf.\n",
      "[I 2026-07-02 16:32:48,186] Trial 69 finished with value: inf and parameters: {'target_miscoverage': 0.09167267148075209, 'aci_step_size': 0.00923599688463332, 'interval_scale': 1.5703986735802313}. Best is trial 0 with value: inf.\n",
      "[I 2026-07-02 16:32:48,202] Trial 70 finished with value: inf and parameters: {'target_miscoverage': 0.16468137875181812, 'aci_step_size': 0.19007985469806077, 'interval_scale': 6.690214537109514}. Best is trial 0 with value: inf.\n",
      "[I 2026-07-02 16:32:48,218] Trial 71 finished with value: inf and parameters: {'target_miscoverage': 0.02773763685687809, 'aci_step_size': 0.015622746501866576, 'interval_scale': 0.8244651973256073}. Best is trial 0 with value: inf.\n",
      "[I 2026-07-02 16:32:48,233] Trial 72 finished with value: inf and parameters: {'target_miscoverage': 0.040859107693973454, 'aci_step_size': 0.01184913497701199, 'interval_scale': 1.7272842425458996}. Best is trial 0 with value: inf.\n",
      "[I 2026-07-02 16:32:48,248] Trial 73 finished with value: inf and parameters: {'target_miscoverage': 0.018207568535416836, 'aci_step_size': 0.010167305568012113, 'interval_scale': 2.3905816220223133}. Best is trial 0 with value: inf.\n",
      "[I 2026-07-02 16:32:48,263] Trial 74 finished with value: inf and parameters: {'target_miscoverage': 0.05749346838583358, 'aci_step_size': 0.017703885362663617, 'interval_scale': 0.7113192052702758}. Best is trial 0 with value: inf.\n",
      "[I 2026-07-02 16:32:48,279] Trial 75 finished with value: inf and parameters: {'target_miscoverage': 0.03309138085631779, 'aci_step_size': 0.006179811735446939, 'interval_scale': 2.7541949668749965}. Best is trial 0 with value: inf.\n",
      "[I 2026-07-02 16:32:48,294] Trial 76 finished with value: inf and parameters: {'target_miscoverage': 0.0358851898175379, 'aci_step_size': 0.013928335230035869, 'interval_scale': 2.0055824887683626}. Best is trial 0 with value: inf.\n",
      "[I 2026-07-02 16:32:48,309] Trial 77 finished with value: inf and parameters: {'target_miscoverage': 0.04404248763723482, 'aci_step_size': 0.022817513405648478, 'interval_scale': 0.9179053805175577}. Best is trial 0 with value: inf.\n",
      "[I 2026-07-02 16:32:48,324] Trial 78 finished with value: inf and parameters: {'target_miscoverage': 0.199410358667607, 'aci_step_size': 0.007318291983346031, 'interval_scale': 7.668462218422593}. Best is trial 0 with value: inf.\n",
      "[I 2026-07-02 16:32:48,340] Trial 79 finished with value: inf and parameters: {'target_miscoverage': 0.14339343872461863, 'aci_step_size': 0.06204107452856479, 'interval_scale': 1.3124349583241628}. Best is trial 0 with value: inf.\n",
      "[I 2026-07-02 16:32:48,357] Trial 80 finished with value: inf and parameters: {'target_miscoverage': 0.06583349907384645, 'aci_step_size': 0.01072020558280346, 'interval_scale': 1.1287871882846476}. Best is trial 0 with value: inf.\n",
      "[I 2026-07-02 16:32:48,372] Trial 81 finished with value: inf and parameters: {'target_miscoverage': 0.08294260364348806, 'aci_step_size': 0.11890318612984602, 'interval_scale': 0.8754516854505112}. Best is trial 0 with value: inf.\n",
      "[I 2026-07-02 16:32:48,387] Trial 82 finished with value: inf and parameters: {'target_miscoverage': 0.09855761916102132, 'aci_step_size': 0.16222427073115878, 'interval_scale': 0.5557960307605077}. Best is trial 0 with value: inf.\n",
      "[I 2026-07-02 16:32:48,403] Trial 83 finished with value: inf and parameters: {'target_miscoverage': 0.0881157381784593, 'aci_step_size': 0.0900975953824862, 'interval_scale': 0.7550742383981199}. Best is trial 0 with value: inf.\n",
      "[I 2026-07-02 16:32:48,418] Trial 84 finished with value: inf and parameters: {'target_miscoverage': 0.12216403911567521, 'aci_step_size': 0.13576106428843482, 'interval_scale': 1.0460563387915902}. Best is trial 0 with value: inf.\n",
      "[I 2026-07-02 16:32:48,433] Trial 85 finished with value: inf and parameters: {'target_miscoverage': 0.12876884951168008, 'aci_step_size': 0.1782024273495775, 'interval_scale': 0.6827939690077379}. Best is trial 0 with value: inf.\n",
      "[I 2026-07-02 16:32:48,449] Trial 86 finished with value: inf and parameters: {'target_miscoverage': 0.1537205399095585, 'aci_step_size': 0.04646805033470909, 'interval_scale': 1.4444041558669414}. Best is trial 0 with value: inf.\n",
      "[I 2026-07-02 16:32:48,464] Trial 87 finished with value: inf and parameters: {'target_miscoverage': 0.17966417678921623, 'aci_step_size': 0.14561718030772758, 'interval_scale': 4.551216780711499}. Best is trial 0 with value: inf.\n",
      "[I 2026-07-02 16:32:48,479] Trial 88 finished with value: inf and parameters: {'target_miscoverage': 0.11272229915751003, 'aci_step_size': 0.005671457853143323, 'interval_scale': 0.6022819465070173}. Best is trial 0 with value: inf.\n",
      "[I 2026-07-02 16:32:48,494] Trial 89 finished with value: inf and parameters: {'target_miscoverage': 0.024761457193326356, 'aci_step_size': 0.008683081489993293, 'interval_scale': 3.6064649392992756}. Best is trial 0 with value: inf.\n",
