      "[I 2026-07-02 14:59:04,383] Trial 100 finished with value: 0.027579617438498922 and parameters: {'foundation_window': 3, 'ar_lags': 2, 'ema_spans': (2, 3, 5, 8), 'conv_scales': (3, 6), 'use_calendar': False, 'ridge_alpha': 98.71930975544927, 'shrinkage_max': 0.4709640351350881, 'oob_split_ratio': 0.653374056134364}. Best is trial 93 with value: 0.026475715389762903.\n",
      "[I 2026-07-02 14:59:04,554] Trial 101 finished with value: 0.026282946700479374 and parameters: {'foundation_window': 3, 'ar_lags': 2, 'ema_spans': (2, 3, 5, 8), 'conv_scales': (2, 4, 8), 'use_calendar': False, 'ridge_alpha': 19.54104032687676, 'shrinkage_max': 0.3995380837093176, 'oob_split_ratio': 0.6313168272232906}. Best is trial 101 with value: 0.026282946700479374.\n",
      "[I 2026-07-02 14:59:04,728] Trial 102 finished with value: 0.02662490559294389 and parameters: {'foundation_window': 3, 'ar_lags': 2, 'ema_spans': (2, 3, 5, 8), 'conv_scales': (2, 4, 8), 'use_calendar': False, 'ridge_alpha': 17.88150795447214, 'shrinkage_max': 0.25224921225692654, 'oob_split_ratio': 0.6112513724412771}. Best is trial 101 with value: 0.026282946700479374.\n",
      "[I 2026-07-02 14:59:04,936] Trial 103 finished with value: 0.026597757208544393 and parameters: {'foundation_window': 3, 'ar_lags': 2, 'ema_spans': (2, 3, 5, 8), 'conv_scales': (2, 4, 8), 'use_calendar': False, 'ridge_alpha': 17.08796566154571, 'shrinkage_max': 0.2506725857520873, 'oob_split_ratio': 0.6161971086993602}. Best is trial 101 with value: 0.026282946700479374.\n",
      "[I 2026-07-02 14:59:05,110] Trial 104 finished with value: 0.02645951215036486 and parameters: {'foundation_window': 3, 'ar_lags': 2, 'ema_spans': (2, 3, 5, 8), 'conv_scales': (2, 4, 8), 'use_calendar': False, 'ridge_alpha': 17.284412702806392, 'shrinkage_max': 0.2650284703207874, 'oob_split_ratio': 0.6180954638402714}. Best is trial 101 with value: 0.026282946700479374.\n",
      "[I 2026-07-02 14:59:05,279] Trial 105 finished with value: 0.039106341190180464 and parameters: {'foundation_window': 4, 'ar_lags': 2, 'ema_spans': (2, 3, 5, 8), 'conv_scales': (2, 4, 8), 'use_calendar': False, 'ridge_alpha': 18.15228449001079, 'shrinkage_max': 0.3845777991650524, 'oob_split_ratio': 0.6149078202685996}. Best is trial 101 with value: 0.026282946700479374.\n",
      "[I 2026-07-02 14:59:05,438] Trial 106 finished with value: 0.02700202111223919 and parameters: {'foundation_window': 3, 'ar_lags': 2, 'ema_spans': (3, 6), 'conv_scales': (2, 4, 8), 'use_calendar': False, 'ridge_alpha': 16.621374869605695, 'shrinkage_max': 0.26007202817133035, 'oob_split_ratio': 0.6226490196754084}. Best is trial 101 with value: 0.026282946700479374.\n",
      "[I 2026-07-02 14:59:05,608] Trial 107 finished with value: 0.028360210680890913 and parameters: {'foundation_window': 8, 'ar_lags': 2, 'ema_spans': (2, 3, 5, 8), 'conv_scales': (3, 6, 12), 'use_calendar': False, 'ridge_alpha': 30.221494676948357, 'shrinkage_max': 0.34793659996235266, 'oob_split_ratio': 0.602825324652401}. Best is trial 101 with value: 0.026282946700479374.\n",
      "[I 2026-07-02 14:59:05,776] Trial 108 finished with value: 0.03928385724222158 and parameters: {'foundation_window': 4, 'ar_lags': 2, 'ema_spans': (2, 3, 5, 8), 'conv_scales': (2, 4, 8), 'use_calendar': False, 'ridge_alpha': 24.021209351149654, 'shrinkage_max': 0.4247146441629337, 'oob_split_ratio': 0.6293888854080791}. Best is trial 101 with value: 0.026282946700479374.\n",
      "[I 2026-07-02 14:59:05,946] Trial 109 finished with value: 0.026405224481011375 and parameters: {'foundation_window': 3, 'ar_lags': 2, 'ema_spans': (2, 3, 5, 8), 'conv_scales': (2, 4, 8), 'use_calendar': False, 'ridge_alpha': 39.250170070783874, 'shrinkage_max': 0.40716257773094044, 'oob_split_ratio': 0.6034236556416437}. Best is trial 101 with value: 0.026282946700479374.\n",
      "[I 2026-07-02 14:59:06,109] Trial 110 finished with value: 0.026503999582718204 and parameters: {'foundation_window': 3, 'ar_lags': 2, 'ema_spans': (3, 6, 12), 'conv_scales': (2, 4, 8), 'use_calendar': False, 'ridge_alpha': 34.59673576168538, 'shrinkage_max': 0.5070642010973158, 'oob_split_ratio': 0.6038782430885337}. Best is trial 101 with value: 0.026282946700479374.\n",
      "[I 2026-07-02 14:59:06,272] Trial 111 finished with value: 0.0264989630607821 and parameters: {'foundation_window': 3, 'ar_lags': 2, 'ema_spans': (3, 6, 12), 'conv_scales': (2, 4, 8), 'use_calendar': False, 'ridge_alpha': 37.41488040393844, 'shrinkage_max': 0.5151962305760927, 'oob_split_ratio': 0.5841348345487557}. Best is trial 101 with value: 0.026282946700479374.\n",
      "[I 2026-07-02 14:59:06,435] Trial 112 finished with value: 0.026502140356329876 and parameters: {'foundation_window': 3, 'ar_lags': 2, 'ema_spans': (3, 6, 12), 'conv_scales': (2, 4, 8), 'use_calendar': False, 'ridge_alpha': 38.83059206955133, 'shrinkage_max': 0.5370241566301726, 'oob_split_ratio': 0.5813368554156492}. Best is trial 101 with value: 0.026282946700479374.\n",
      "[I 2026-07-02 14:59:06,597] Trial 113 finished with value: 0.02651366278526643 and parameters: {'foundation_window': 3, 'ar_lags': 2, 'ema_spans': (3, 6, 12), 'conv_scales': (2, 4, 8), 'use_calendar': False, 'ridge_alpha': 34.86093631747227, 'shrinkage_max': 0.5397460315378282, 'oob_split_ratio': 0.5799262507959501}. Best is trial 101 with value: 0.026282946700479374.\n",
      "[I 2026-07-02 14:59:06,764] Trial 114 finished with value: 0.026498741591561643 and parameters: {'foundation_window': 3, 'ar_lags': 2, 'ema_spans': (3, 6, 12), 'conv_scales': (2, 4, 8), 'use_calendar': False, 'ridge_alpha': 36.131120691857674, 'shrinkage_max': 0.5033467642988989, 'oob_split_ratio': 0.5819860499940602}. Best is trial 101 with value: 0.026282946700479374.\n",
      "[I 2026-07-02 14:59:06,935] Trial 115 finished with value: 0.028232534678593754 and parameters: {'foundation_window': 4, 'ar_lags': 2, 'ema_spans': (3, 6, 12), 'conv_scales': (2, 4, 8), 'use_calendar': False, 'ridge_alpha': 38.825414907429135, 'shrinkage_max': 0.528307973673704, 'oob_split_ratio': 0.5804197537167975}. Best is trial 101 with value: 0.026282946700479374.\n",
      "[I 2026-07-02 14:59:07,100] Trial 116 finished with value: 0.025941453119991475 and parameters: {'foundation_window': 3, 'ar_lags': 2, 'ema_spans': (3, 6, 12), 'conv_scales': (2, 4, 8), 'use_calendar': False, 'ridge_alpha': 60.39016555921165, 'shrinkage_max': 0.4912448415028582, 'oob_split_ratio': 0.5783815073557219}. Best is trial 116 with value: 0.025941453119991475.\n",
      "[I 2026-07-02 14:59:07,249] Trial 117 finished with value: 0.02883220120401125 and parameters: {'foundation_window': 3, 'ar_lags': 2, 'ema_spans': (3, 6, 12), 'conv_scales': (2, 3), 'use_calendar': False, 'ridge_alpha': 57.1797627431352, 'shrinkage_max': 0.5920897463947031, 'oob_split_ratio': 0.5692139401186199}. Best is trial 116 with value: 0.025941453119991475.\n",
      "[I 2026-07-02 14:59:07,411] Trial 118 finished with value: 0.03202695064564821 and parameters: {'foundation_window': 2, 'ar_lags': 2, 'ema_spans': (3, 6, 12), 'conv_scales': (2, 4, 8), 'use_calendar': False, 'ridge_alpha': 61.25819290226233, 'shrinkage_max': 0.50735139320252, 'oob_split_ratio': 0.5929183125965775}. Best is trial 116 with value: 0.025941453119991475.\n",
      "[I 2026-07-02 14:59:07,579] Trial 119 finished with value: 0.02917916371255014 and parameters: {'foundation_window': 4, 'ar_lags': 2, 'ema_spans': (3, 6, 12), 'conv_scales': (2, 4, 8), 'use_calendar': False, 'ridge_alpha': 99.6699336126177, 'shrinkage_max': 0.481133306856039, 'oob_split_ratio': 0.6023910968011265}. Best is trial 116 with value: 0.025941453119991475.\n",
      "[I 2026-07-02 14:59:07,738] Trial 120 finished with value: 0.026167291226867093 and parameters: {'foundation_window': 3, 'ar_lags': 2, 'ema_spans': (3, 6, 12), 'conv_scales': (2, 4, 8), 'use_calendar': False, 'ridge_alpha': 79.0924468749935, 'shrinkage_max': 0.45805449639093976, 'oob_split_ratio': 0.5729370288202305}. Best is trial 116 with value: 0.025941453119991475.\n",
      "[I 2026-07-02 14:59:07,899] Trial 121 finished with value: 0.02688193318865185 and parameters: {'foundation_window': 3, 'ar_lags': 2, 'ema_spans': (3, 6, 12), 'conv_scales': (2, 4, 8), 'use_calendar': False, 'ridge_alpha': 69.70153221947034, 'shrinkage_max': 0.4602224199554523, 'oob_split_ratio': 0.585463001969662}. Best is trial 116 with value: 0.025941453119991475.\n",
      "[I 2026-07-02 14:59:08,064] Trial 122 finished with value: 0.026554931768680946 and parameters: {'foundation_window': 3, 'ar_lags': 2, 'ema_spans': (3, 6, 12), 'conv_scales': (2, 4, 8), 'use_calendar': False, 'ridge_alpha': 38.99801831202941, 'shrinkage_max': 0.33081678761426553, 'oob_split_ratio': 0.5677295965957133}. Best is trial 116 with value: 0.025941453119991475.\n",
      "[I 2026-07-02 14:59:08,230] Trial 123 finished with value: 0.02660501432155467 and parameters: {'foundation_window': 3, 'ar_lags': 2, 'ema_spans': (3, 6, 12), 'conv_scales': (2, 4, 8), 'use_calendar': False, 'ridge_alpha': 13.067538882541834, 'shrinkage_max': 0.6073238108669787, 'oob_split_ratio': 0.5691324943691173}. Best is trial 116 with value: 0.025941453119991475.\n",
      "[I 2026-07-02 14:59:08,398] Trial 124 finished with value: 0.025894525407696684 and parameters: {'foundation_window': 3, 'ar_lags': 2, 'ema_spans': (3, 6, 12), 'conv_scales': (2, 4, 8), 'use_calendar': False, 'ridge_alpha': 58.04037800063022, 'shrinkage_max': 0.5546009675810644, 'oob_split_ratio': 0.5763248012126426}. Best is trial 124 with value: 0.025894525407696684.\n",
      "[I 2026-07-02 14:59:08,561] Trial 125 finished with value: 0.029594689250338018 and parameters: {'foundation_window': 2, 'ar_lags': 2, 'ema_spans': (3, 6, 12), 'conv_scales': (2, 4, 8), 'use_calendar': False, 'ridge_alpha': 74.52023749482255, 'shrinkage_max': 0.5773278954560306, 'oob_split_ratio': 0.578640128427043}. Best is trial 124 with value: 0.025894525407696684.\n",
      "[I 2026-07-02 14:59:08,720] Trial 126 finished with value: 0.028545233555004865 and parameters: {'foundation_window': 4, 'ar_lags': 2, 'ema_spans': (3, 6, 12), 'conv_scales': (2, 4, 8), 'use_calendar': False, 'ridge_alpha': 49.75656312103759, 'shrinkage_max': 0.4469559321748228, 'oob_split_ratio': 0.5640495462982913}. Best is trial 124 with value: 0.025894525407696684.\n",
      "[I 2026-07-02 14:59:08,887] Trial 127 finished with value: 0.030039591500111738 and parameters: {'foundation_window': 3, 'ar_lags': 2, 'ema_spans': (3, 6, 12), 'conv_scales': (2, 3, 4), 'use_calendar': False, 'ridge_alpha': 56.91268271247656, 'shrinkage_max': 0.3496629874560465, 'oob_split_ratio': 0.5920907118821096}. Best is trial 124 with value: 0.025894525407696684.\n",
      "[I 2026-07-02 14:59:09,049] Trial 128 finished with value: 0.030146237297752548 and parameters: {'foundation_window': 3, 'ar_lags': 1, 'ema_spans': (3, 6, 12), 'conv_scales': (2, 4, 8), 'use_calendar': False, 'ridge_alpha': 82.05463435749041, 'shrinkage_max': 0.4235542357215924, 'oob_split_ratio': 0.5745832490144634}. Best is trial 124 with value: 0.025894525407696684.\n",
      "[I 2026-07-02 14:59:09,192] Trial 129 finished with value: 0.02820046665483136 and parameters: {'foundation_window': 2, 'ar_lags': 2, 'ema_spans': (3, 6, 12), 'conv_scales': (3, 6), 'use_calendar': False, 'ridge_alpha': 42.008099991714275, 'shrinkage_max': 0.5405812437641166, 'oob_split_ratio': 0.5505797227422458}. Best is trial 124 with value: 0.025894525407696684.\n",
      "[I 2026-07-02 14:59:09,358] Trial 130 finished with value: 0.030532397012783135 and parameters: {'foundation_window': 4, 'ar_lags': 2, 'ema_spans': (3, 6, 12), 'conv_scales': (2, 4, 8), 'use_calendar': False, 'ridge_alpha': 21.05102133582502, 'shrinkage_max': 0.6320695918944669, 'oob_split_ratio': 0.5851656952960772}. Best is trial 124 with value: 0.025894525407696684.\n",
      "[I 2026-07-02 14:59:09,525] Trial 131 finished with value: 0.026507694870258572 and parameters: {'foundation_window': 3, 'ar_lags': 2, 'ema_spans': (3, 6, 12), 'conv_scales': (2, 4, 8), 'use_calendar': False, 'ridge_alpha': 29.990315824733052, 'shrinkage_max': 0.4803108120386037, 'oob_split_ratio': 0.6041128160456412}. Best is trial 124 with value: 0.025894525407696684.\n",
      "[I 2026-07-02 14:59:09,690] Trial 132 finished with value: 0.0259316880523313 and parameters: {'foundation_window': 3, 'ar_lags': 2, 'ema_spans': (3, 6, 12), 'conv_scales': (2, 4, 8), 'use_calendar': False, 'ridge_alpha': 61.57318603934428, 'shrinkage_max': 0.5095640308034607, 'oob_split_ratio': 0.5611426006485598}. Best is trial 124 with value: 0.025894525407696684.\n",
      "[I 2026-07-02 14:59:09,850] Trial 133 finished with value: 0.025833090728208056 and parameters: {'foundation_window': 3, 'ar_lags': 2, 'ema_spans': (3, 6, 12), 'conv_scales': (2, 4, 8), 'use_calendar': False, 'ridge_alpha': 61.305791595637295, 'shrinkage_max': 0.7032113151547424, 'oob_split_ratio': 0.5609603835261574}. Best is trial 133 with value: 0.025833090728208056.\n",
      "[I 2026-07-02 14:59:10,015] Trial 134 finished with value: 0.025832898640131302 and parameters: {'foundation_window': 3, 'ar_lags': 2, 'ema_spans': (3, 6, 12), 'conv_scales': (2, 4, 8), 'use_calendar': False, 'ridge_alpha': 59.50426692448178, 'shrinkage_max': 0.6991711450270505, 'oob_split_ratio': 0.559474289001785}. Best is trial 134 with value: 0.025832898640131302.\n",
      "[I 2026-07-02 14:59:10,180] Trial 135 finished with value: 0.025810539785211056 and parameters: {'foundation_window': 3, 'ar_lags': 2, 'ema_spans': (3, 6, 12), 'conv_scales': (2, 4, 8), 'use_calendar': False, 'ridge_alpha': 85.0343154118194, 'shrinkage_max': 2.6584315818873527, 'oob_split_ratio': 0.5582455832848577}. Best is trial 135 with value: 0.025810539785211056.\n",
      "[I 2026-07-02 14:59:10,347] Trial 136 finished with value: 0.026753343797831088 and parameters: {'foundation_window': 3, 'ar_lags': 2, 'ema_spans': (3, 6, 12), 'conv_scales': (3, 6, 12), 'use_calendar': False, 'ridge_alpha': 84.96773039586294, 'shrinkage_max': 2.454603964275316, 'oob_split_ratio': 0.5599378265254549}. Best is trial 135 with value: 0.025810539785211056.\n",
      "[I 2026-07-02 14:59:10,514] Trial 137 finished with value: 0.028922611149253697 and parameters: {'foundation_window': 2, 'ar_lags': 2, 'ema_spans': (3, 6, 12), 'conv_scales': (2, 4, 8), 'use_calendar': False, 'ridge_alpha': 59.0585515204263, 'shrinkage_max': 2.622209523351329, 'oob_split_ratio': 0.5584111333127049}. Best is trial 135 with value: 0.025810539785211056.\n",
      "[I 2026-07-02 14:59:10,683] Trial 138 finished with value: 0.04412413095151648 and parameters: {'foundation_window': 4, 'ar_lags': 2, 'ema_spans': (3, 6, 12), 'conv_scales': (2, 4, 8), 'use_calendar': False, 'ridge_alpha': 62.32553911729712, 'shrinkage_max': 1.8289945763152202, 'oob_split_ratio': 0.5750426235583256}. Best is trial 135 with value: 0.025810539785211056.\n",
      "[I 2026-07-02 14:59:10,853] Trial 139 finished with value: 0.02836251518185381 and parameters: {'foundation_window': 3, 'ar_lags': 2, 'ema_spans': (2, 4), 'conv_scales': (2, 4, 8), 'use_calendar': False, 'ridge_alpha': 88.11612079642151, 'shrinkage_max': 2.1692259532888905, 'oob_split_ratio': 0.5545929547093138}. Best is trial 135 with value: 0.025810539785211056.\n",
      "[I 2026-07-02 14:59:11,018] Trial 140 finished with value: 0.029857320534311237 and parameters: {'foundation_window': 3, 'ar_lags': 2, 'ema_spans': (3, 6, 12), 'conv_scales': (2, 4, 8), 'use_calendar': False, 'ridge_alpha': 50.56741996294396, 'shrinkage_max': 0.6968633625591897, 'oob_split_ratio': 0.67634246042935}. Best is trial 135 with value: 0.025810539785211056.\n",
      "[I 2026-07-02 14:59:11,185] Trial 141 finished with value: 0.026770514431961528 and parameters: {'foundation_window': 3, 'ar_lags': 2, 'ema_spans': (3, 6, 12), 'conv_scales': (2, 4, 8), 'use_calendar': False, 'ridge_alpha': 68.75875706528602, 'shrinkage_max': 0.35091401497640584, 'oob_split_ratio': 0.5634454435868307}. Best is trial 135 with value: 0.025810539785211056.\n",
      "[I 2026-07-02 14:59:11,360] Trial 142 finished with value: 0.025837553851728385 and parameters: {'foundation_window': 3, 'ar_lags': 2, 'ema_spans': (3, 6, 12), 'conv_scales': (2, 4, 8), 'use_calendar': False, 'ridge_alpha': 47.24246090778557, 'shrinkage_max': 2.703591014886005, 'oob_split_ratio': 0.5747291349480711}. Best is trial 135 with value: 0.025810539785211056.\n",
      "[I 2026-07-02 14:59:11,541] Trial 143 finished with value: 0.025977243504224867 and parameters: {'foundation_window': 3, 'ar_lags': 2, 'ema_spans': (3, 6, 12), 'conv_scales': (2, 4, 8), 'use_calendar': False, 'ridge_alpha': 48.582799640661676, 'shrinkage_max': 2.7636340559159747, 'oob_split_ratio': 0.5503614905910411}. Best is trial 135 with value: 0.025810539785211056.\n",
      "[I 2026-07-02 14:59:11,706] Trial 144 finished with value: 0.03405155522406897 and parameters: {'foundation_window': 11, 'ar_lags': 2, 'ema_spans': (3, 6, 12), 'conv_scales': (2, 4, 8), 'use_calendar': False, 'ridge_alpha': 52.82571157682933, 'shrinkage_max': 2.7805247002852864, 'oob_split_ratio': 0.5744052325553425}. Best is trial 135 with value: 0.025810539785211056.\n",
      "[I 2026-07-02 14:59:11,882] Trial 145 finished with value: 0.026374888284150286 and parameters: {'foundation_window': 3, 'ar_lags': 2, 'ema_spans': (3, 6, 12), 'conv_scales': (2, 4, 8), 'use_calendar': False, 'ridge_alpha': 14.2866208548595, 'shrinkage_max': 2.7418397815055107, 'oob_split_ratio': 0.5614069550085864}. Best is trial 135 with value: 0.025810539785211056.\n",
      "[I 2026-07-02 14:59:12,048] Trial 146 finished with value: 0.027195028415094993 and parameters: {'foundation_window': 3, 'ar_lags': 2, 'ema_spans': (3, 6, 12), 'conv_scales': (2, 4, 8), 'use_calendar': False, 'ridge_alpha': 8.566744427060389, 'shrinkage_max': 2.7238119726069785, 'oob_split_ratio': 0.5623942151036595}. Best is trial 135 with value: 0.025810539785211056.\n",
      "[I 2026-07-02 14:59:12,195] Trial 147 finished with value: 0.026972112157125434 and parameters: {'foundation_window': 2, 'ar_lags': 2, 'ema_spans': (3, 6, 12), 'conv_scales': (2, 3), 'use_calendar': False, 'ridge_alpha': 14.270111566141338, 'shrinkage_max': 2.995669734128471, 'oob_split_ratio': 0.551251292688616}. Best is trial 135 with value: 0.025810539785211056.\n",
      "[I 2026-07-02 14:59:12,362] Trial 148 finished with value: 0.026174155436533373 and parameters: {'foundation_window': 3, 'ar_lags': 2, 'ema_spans': (3, 6, 12), 'conv_scales': (2, 4, 8), 'use_calendar': False, 'ridge_alpha': 24.515449751057226, 'shrinkage_max': 2.6002896289459483, 'oob_split_ratio': 0.5571535226389831}. Best is trial 135 with value: 0.025810539785211056.\n",
      "[I 2026-07-02 14:59:12,533] Trial 149 finished with value: 0.029029736739690143 and parameters: {'foundation_window': 4, 'ar_lags': 2, 'ema_spans': (3, 6, 12), 'conv_scales': (2, 4, 8), 'use_calendar': False, 'ridge_alpha': 9.792400814558182, 'shrinkage_max': 2.885508860575468, 'oob_split_ratio': 0.5666630727262691}. Best is trial 135 with value: 0.025810539785211056.\n",
      "[I 2026-07-02 14:59:12,701] Trial 150 finished with value: 0.028456288229624108 and parameters: {'foundation_window': 2, 'ar_lags': 2, 'ema_spans': (3, 6, 12), 'conv_scales': (2, 4, 8), 'use_calendar': False, 'ridge_alpha': 20.953948490150985, 'shrinkage_max': 2.6597226213185423, 'oob_split_ratio': 0.5552204745489877}. Best is trial 135 with value: 0.025810539785211056.\n",
      "[I 2026-07-02 14:59:12,868] Trial 151 finished with value: 0.02581723972609647 and parameters: {'foundation_window': 3, 'ar_lags': 2, 'ema_spans': (3, 6, 12), 'conv_scales': (2, 4, 8), 'use_calendar': False, 'ridge_alpha': 77.48046974532895, 'shrinkage_max': 2.538308960656433, 'oob_split_ratio': 0.57205385887556}. Best is trial 135 with value: 0.025810539785211056.\n",
      "[I 2026-07-02 14:59:13,030] Trial 152 finished with value: 0.02580923671282211 and parameters: {'foundation_window': 3, 'ar_lags': 2, 'ema_spans': (3, 6, 12), 'conv_scales': (2, 4, 8), 'use_calendar': False, 'ridge_alpha': 99.03480595252496, 'shrinkage_max': 2.609564910652937, 'oob_split_ratio': 0.5709783898184129}. Best is trial 152 with value: 0.02580923671282211.\n",
      "[I 2026-07-02 14:59:13,200] Trial 153 finished with value: 0.025820472734771727 and parameters: {'foundation_window': 3, 'ar_lags': 2, 'ema_spans': (3, 6, 12), 'conv_scales': (2, 4, 8), 'use_calendar': False, 'ridge_alpha': 76.18359302102864, 'shrinkage_max': 2.509637564133633, 'oob_split_ratio': 0.5714417932500652}. Best is trial 152 with value: 0.02580923671282211.\n",
      "[I 2026-07-02 14:59:13,368] Trial 154 finished with value: 0.028156104784391737 and parameters: {'foundation_window': 3, 'ar_lags': 5, 'ema_spans': (3, 6, 12), 'conv_scales': (2, 4, 8), 'use_calendar': False, 'ridge_alpha': 96.89744250751586, 'shrinkage_max': 2.5858706363147412, 'oob_split_ratio': 0.5716687560542466}. Best is trial 152 with value: 0.02580923671282211.\n",
      "[I 2026-07-02 14:59:13,544] Trial 155 finished with value: 0.025821730128561232 and parameters: {'foundation_window': 3, 'ar_lags': 2, 'ema_spans': (3, 6, 12), 'conv_scales': (2, 4, 8), 'use_calendar': False, 'ridge_alpha': 77.54702691625234, 'shrinkage_max': 2.5193777073617545, 'oob_split_ratio': 0.5617395217664692}. Best is trial 152 with value: 0.02580923671282211.\n",
      "[I 2026-07-02 14:59:13,717] Trial 156 finished with value: 0.02580772552258814 and parameters: {'foundation_window': 3, 'ar_lags': 2, 'ema_spans': (3, 6, 12), 'conv_scales': (2, 4, 8), 'use_calendar': False, 'ridge_alpha': 70.63496718850553, 'shrinkage_max': 2.5006208687254468, 'oob_split_ratio': 0.5646686270515161}. Best is trial 156 with value: 0.02580772552258814.\n",
