      "[I 2026-07-02 16:33:02,894] Trial 88 finished with value: 0.0060023850032357206 and parameters: {'foundation_window': 10, 'ar_lags': 6, 'ema_spans': (2, 4, 8), 'conv_scales': (2, 3), 'use_calendar': True, 'ridge_alpha': 0.007617707515782559, 'shrinkage_max': 2.1302336152818953, 'oob_split_ratio': 0.7872861399325779}. Best is trial 88 with value: 0.0060023850032357206.\n",
      "[I 2026-07-02 16:33:03,022] Trial 89 finished with value: 0.008118599379247924 and parameters: {'foundation_window': 11, 'ar_lags': 6, 'ema_spans': (2, 4, 8), 'conv_scales': (2, 3), 'use_calendar': True, 'ridge_alpha': 0.007864652814701311, 'shrinkage_max': 2.1044231534699467, 'oob_split_ratio': 0.7539403165979544}. Best is trial 88 with value: 0.0060023850032357206.\n",
      "[I 2026-07-02 16:33:03,143] Trial 90 finished with value: 0.007735116950943293 and parameters: {'foundation_window': 12, 'ar_lags': 5, 'ema_spans': (2, 4), 'conv_scales': (2, 3), 'use_calendar': True, 'ridge_alpha': 0.030262736246800943, 'shrinkage_max': 2.2333562266707854, 'oob_split_ratio': 0.7738933165770997}. Best is trial 88 with value: 0.0060023850032357206.\n",
      "[I 2026-07-02 16:33:03,278] Trial 91 finished with value: 0.0061121996710575485 and parameters: {'foundation_window': 10, 'ar_lags': 6, 'ema_spans': (2, 4, 8), 'conv_scales': (2, 3), 'use_calendar': True, 'ridge_alpha': 0.006847706654885, 'shrinkage_max': 1.8363325991076673, 'oob_split_ratio': 0.7868735139426148}. Best is trial 88 with value: 0.0060023850032357206.\n",
      "[I 2026-07-02 16:33:03,410] Trial 92 finished with value: 0.006207329865594076 and parameters: {'foundation_window': 10, 'ar_lags': 6, 'ema_spans': (2, 4, 8), 'conv_scales': (2, 3), 'use_calendar': True, 'ridge_alpha': 0.014237875905679046, 'shrinkage_max': 2.0070966762792612, 'oob_split_ratio': 0.7844401275869075}. Best is trial 88 with value: 0.0060023850032357206.\n",
      "[I 2026-07-02 16:33:03,542] Trial 93 finished with value: 0.006128870200673352 and parameters: {'foundation_window': 10, 'ar_lags': 6, 'ema_spans': (2, 4, 8), 'conv_scales': (2, 3), 'use_calendar': True, 'ridge_alpha': 0.015677778712714995, 'shrinkage_max': 2.329901009891199, 'oob_split_ratio': 0.7859097915100897}. Best is trial 88 with value: 0.0060023850032357206.\n",
      "[I 2026-07-02 16:33:03,671] Trial 94 finished with value: 0.006114133819024356 and parameters: {'foundation_window': 10, 'ar_lags': 6, 'ema_spans': (2, 4, 8), 'conv_scales': (2, 3), 'use_calendar': True, 'ridge_alpha': 0.01457194634971337, 'shrinkage_max': 2.300991791640694, 'oob_split_ratio': 0.784761706805384}. Best is trial 88 with value: 0.0060023850032357206.\n",
      "[I 2026-07-02 16:33:03,800] Trial 95 finished with value: 0.00844906383540106 and parameters: {'foundation_window': 11, 'ar_lags': 6, 'ema_spans': (2, 4, 8), 'conv_scales': (2, 3), 'use_calendar': True, 'ridge_alpha': 0.014591374030869134, 'shrinkage_max': 2.301966228688622, 'oob_split_ratio': 0.7861913935485864}. Best is trial 88 with value: 0.0060023850032357206.\n",
      "[I 2026-07-02 16:33:03,935] Trial 96 finished with value: 0.006531626626735529 and parameters: {'foundation_window': 10, 'ar_lags': 6, 'ema_spans': (2, 4, 8), 'conv_scales': (2, 3), 'use_calendar': True, 'ridge_alpha': 0.04790807720925217, 'shrinkage_max': 2.3358021190817198, 'oob_split_ratio': 0.7800326868088054}. Best is trial 88 with value: 0.0060023850032357206.\n",
      "[I 2026-07-02 16:33:04,066] Trial 97 finished with value: 0.007665512703147483 and parameters: {'foundation_window': 9, 'ar_lags': 5, 'ema_spans': (2, 4, 8), 'conv_scales': (2, 3), 'use_calendar': True, 'ridge_alpha': 0.010468223556928953, 'shrinkage_max': 2.523879059244007, 'oob_split_ratio': 0.7864478792185953}. Best is trial 88 with value: 0.0060023850032357206.\n",
      "[I 2026-07-02 16:33:04,195] Trial 98 finished with value: 0.006287288392327398 and parameters: {'foundation_window': 10, 'ar_lags': 6, 'ema_spans': (2, 4, 8), 'conv_scales': (2, 3), 'use_calendar': True, 'ridge_alpha': 0.02605136057812834, 'shrinkage_max': 2.440511960842477, 'oob_split_ratio': 0.7954116130891459}. Best is trial 88 with value: 0.0060023850032357206.\n",
      "[I 2026-07-02 16:33:04,327] Trial 99 finished with value: 0.007185083620940801 and parameters: {'foundation_window': 11, 'ar_lags': 6, 'ema_spans': (2, 4, 8), 'conv_scales': (2, 3), 'use_calendar': False, 'ridge_alpha': 0.008210954714279567, 'shrinkage_max': 2.427994553385949, 'oob_split_ratio': 0.7640247729231024}. Best is trial 88 with value: 0.0060023850032357206.\n",
      "[I 2026-07-02 16:33:04,462] Trial 100 finished with value: 0.006236745380275394 and parameters: {'foundation_window': 10, 'ar_lags': 6, 'ema_spans': (2, 4, 8), 'conv_scales': (2, 3), 'use_calendar': True, 'ridge_alpha': 0.026358978252991914, 'shrinkage_max': 2.5907323045481214, 'oob_split_ratio': 0.7951884944831872}. Best is trial 88 with value: 0.0060023850032357206.\n",
      "[I 2026-07-02 16:33:04,590] Trial 101 finished with value: 0.006232834532312342 and parameters: {'foundation_window': 10, 'ar_lags': 6, 'ema_spans': (2, 4, 8), 'conv_scales': (2, 3), 'use_calendar': True, 'ridge_alpha': 0.027132072866918287, 'shrinkage_max': 2.7871276258601636, 'oob_split_ratio': 0.7805930637985509}. Best is trial 88 with value: 0.0060023850032357206.\n",
      "[I 2026-07-02 16:33:04,725] Trial 102 finished with value: 0.006245102367283566 and parameters: {'foundation_window': 10, 'ar_lags': 6, 'ema_spans': (2, 4, 8), 'conv_scales': (2, 3), 'use_calendar': True, 'ridge_alpha': 0.027800562270438322, 'shrinkage_max': 2.8186653179982, 'oob_split_ratio': 0.7784686215202494}. Best is trial 88 with value: 0.0060023850032357206.\n",
      "[I 2026-07-02 16:33:04,857] Trial 103 finished with value: 0.01436590451400619 and parameters: {'foundation_window': 9, 'ar_lags': 6, 'ema_spans': (2, 4, 8), 'conv_scales': (2, 3), 'use_calendar': True, 'ridge_alpha': 0.02678049414002271, 'shrinkage_max': 2.79453399027509, 'oob_split_ratio': 0.780176057036138}. Best is trial 88 with value: 0.0060023850032357206.\n",
      "[I 2026-07-02 16:33:04,984] Trial 104 finished with value: 0.006399229128383162 and parameters: {'foundation_window': 10, 'ar_lags': 6, 'ema_spans': (2, 4, 8), 'conv_scales': (2, 3), 'use_calendar': True, 'ridge_alpha': 0.04019314078456097, 'shrinkage_max': 2.7081848094959873, 'oob_split_ratio': 0.7769397363629749}. Best is trial 88 with value: 0.0060023850032357206.\n",
      "[I 2026-07-02 16:33:05,114] Trial 105 finished with value: 0.01494460641499961 and parameters: {'foundation_window': 9, 'ar_lags': 6, 'ema_spans': (2, 4, 8), 'conv_scales': (2, 3), 'use_calendar': True, 'ridge_alpha': 0.02850589504134101, 'shrinkage_max': 2.9349973553400166, 'oob_split_ratio': 0.7955757662543488}. Best is trial 88 with value: 0.0060023850032357206.\n",
      "[I 2026-07-02 16:33:05,247] Trial 106 finished with value: 0.007486335985506177 and parameters: {'foundation_window': 10, 'ar_lags': 6, 'ema_spans': (2, 4, 8), 'conv_scales': (2, 3), 'use_calendar': True, 'ridge_alpha': 0.06000786240621649, 'shrinkage_max': 2.7272806337087516, 'oob_split_ratio': 0.765101441216674}. Best is trial 88 with value: 0.0060023850032357206.\n",
      "[I 2026-07-02 16:33:05,378] Trial 107 finished with value: 0.008680080900607689 and parameters: {'foundation_window': 11, 'ar_lags': 5, 'ema_spans': (2, 4, 8), 'conv_scales': (2, 3), 'use_calendar': True, 'ridge_alpha': 0.01337463922000845, 'shrinkage_max': 2.596418016005585, 'oob_split_ratio': 0.7848435158929605}. Best is trial 88 with value: 0.0060023850032357206.\n",
      "[I 2026-07-02 16:33:05,504] Trial 108 finished with value: 0.006162686316860406 and parameters: {'foundation_window': 10, 'ar_lags': 6, 'ema_spans': (2, 4, 8), 'conv_scales': (2, 3), 'use_calendar': True, 'ridge_alpha': 0.020553876448964, 'shrinkage_max': 2.5068551046984355, 'oob_split_ratio': 0.774196060327703}. Best is trial 88 with value: 0.0060023850032357206.\n",
      "[I 2026-07-02 16:33:05,632] Trial 109 finished with value: 0.014434601229737436 and parameters: {'foundation_window': 9, 'ar_lags': 6, 'ema_spans': (2, 4, 8), 'conv_scales': (2, 3), 'use_calendar': True, 'ridge_alpha': 0.020484971778905944, 'shrinkage_max': 2.5920501829791, 'oob_split_ratio': 0.7547397452966889}. Best is trial 88 with value: 0.0060023850032357206.\n",
      "[I 2026-07-02 16:33:05,760] Trial 110 finished with value: 0.007983846807589958 and parameters: {'foundation_window': 11, 'ar_lags': 6, 'ema_spans': (2, 4, 8), 'conv_scales': (2, 3), 'use_calendar': True, 'ridge_alpha': 0.03409350467338843, 'shrinkage_max': 2.5110497036874193, 'oob_split_ratio': 0.7723615418725069}. Best is trial 88 with value: 0.0060023850032357206.\n",
      "[I 2026-07-02 16:33:05,893] Trial 111 finished with value: 0.006263034386525365 and parameters: {'foundation_window': 10, 'ar_lags': 6, 'ema_spans': (2, 4, 8), 'conv_scales': (2, 3), 'use_calendar': True, 'ridge_alpha': 0.024789858232265354, 'shrinkage_max': 2.4500675194444868, 'oob_split_ratio': 0.782267513854221}. Best is trial 88 with value: 0.0060023850032357206.\n",
      "[I 2026-07-02 16:33:06,022] Trial 112 finished with value: 0.006273512976923714 and parameters: {'foundation_window': 10, 'ar_lags': 6, 'ema_spans': (2, 4, 8), 'conv_scales': (2, 3), 'use_calendar': True, 'ridge_alpha': 0.025489850374329787, 'shrinkage_max': 2.4531677609604303, 'oob_split_ratio': 0.7823590798736367}. Best is trial 88 with value: 0.0060023850032357206.\n",
      "[I 2026-07-02 16:33:06,151] Trial 113 finished with value: 0.006263912971170813 and parameters: {'foundation_window': 10, 'ar_lags': 6, 'ema_spans': (2, 4, 8), 'conv_scales': (2, 3), 'use_calendar': True, 'ridge_alpha': 0.015579888679969947, 'shrinkage_max': 2.8553252131827325, 'oob_split_ratio': 0.7812065410219086}. Best is trial 88 with value: 0.0060023850032357206.\n",
      "[I 2026-07-02 16:33:06,281] Trial 114 finished with value: 0.006261301877674025 and parameters: {'foundation_window': 10, 'ar_lags': 6, 'ema_spans': (2, 4, 8), 'conv_scales': (2, 3), 'use_calendar': True, 'ridge_alpha': 0.01599449984187475, 'shrinkage_max': 2.9036315967386845, 'oob_split_ratio': 0.7755666162152804}. Best is trial 88 with value: 0.0060023850032357206.\n",
      "[I 2026-07-02 16:33:06,417] Trial 115 finished with value: 0.014511914333375073 and parameters: {'foundation_window': 9, 'ar_lags': 6, 'ema_spans': (2, 4, 8), 'conv_scales': (2, 3), 'use_calendar': True, 'ridge_alpha': 0.04640886469244952, 'shrinkage_max': 2.896938220259065, 'oob_split_ratio': 0.7622279289817598}. Best is trial 88 with value: 0.0060023850032357206.\n",
      "[I 2026-07-02 16:33:06,543] Trial 116 finished with value: 0.0060404146586358134 and parameters: {'foundation_window': 10, 'ar_lags': 6, 'ema_spans': (2, 4, 8), 'conv_scales': (2, 3), 'use_calendar': True, 'ridge_alpha': 0.017236726900467857, 'shrinkage_max': 2.809513129545312, 'oob_split_ratio': 0.7771453890174859}. Best is trial 88 with value: 0.0060023850032357206.\n",
      "[I 2026-07-02 16:33:06,678] Trial 117 finished with value: 0.008274675013032503 and parameters: {'foundation_window': 11, 'ar_lags': 6, 'ema_spans': (2, 4, 8), 'conv_scales': (2, 3), 'use_calendar': True, 'ridge_alpha': 0.010172279780122865, 'shrinkage_max': 2.814031996627009, 'oob_split_ratio': 0.7760187866864763}. Best is trial 88 with value: 0.0060023850032357206.\n",
      "[I 2026-07-02 16:33:06,808] Trial 118 finished with value: 0.010804054197358666 and parameters: {'foundation_window': 10, 'ar_lags': 6, 'ema_spans': (3, 6, 12), 'conv_scales': (2, 3), 'use_calendar': True, 'ridge_alpha': 0.019234635240068736, 'shrinkage_max': 2.656491139565172, 'oob_split_ratio': 0.7678686286677828}. Best is trial 88 with value: 0.0060023850032357206.\n",
      "[I 2026-07-02 16:33:06,936] Trial 119 finished with value: 0.008666461262076396 and parameters: {'foundation_window': 9, 'ar_lags': 5, 'ema_spans': (3, 6), 'conv_scales': (2, 3), 'use_calendar': False, 'ridge_alpha': 0.015398774063475479, 'shrinkage_max': 2.994474811913036, 'oob_split_ratio': 0.7715331326111439}. Best is trial 88 with value: 0.0060023850032357206.\n",
      "[I 2026-07-02 16:33:07,065] Trial 120 finished with value: 0.0063486853399781435 and parameters: {'foundation_window': 10, 'ar_lags': 6, 'ema_spans': (2, 4, 8), 'conv_scales': (2, 3), 'use_calendar': True, 'ridge_alpha': 0.0361918757445114, 'shrinkage_max': 2.7367491259360035, 'oob_split_ratio': 0.7865790669692538}. Best is trial 88 with value: 0.0060023850032357206.\n",
      "[I 2026-07-02 16:33:07,196] Trial 121 finished with value: 0.005949597839086942 and parameters: {'foundation_window': 10, 'ar_lags': 6, 'ema_spans': (2, 4, 8), 'conv_scales': (2, 3), 'use_calendar': True, 'ridge_alpha': 0.012634494557401474, 'shrinkage_max': 2.5781115683201383, 'oob_split_ratio': 0.7771929091417519}. Best is trial 121 with value: 0.005949597839086942.\n",
      "[I 2026-07-02 16:33:07,321] Trial 122 finished with value: 0.0062267882494197934 and parameters: {'foundation_window': 10, 'ar_lags': 6, 'ema_spans': (2, 4, 8), 'conv_scales': (2, 3), 'use_calendar': True, 'ridge_alpha': 0.01255851215558961, 'shrinkage_max': 2.776397036849325, 'oob_split_ratio': 0.7770916618214405}. Best is trial 121 with value: 0.005949597839086942.\n",
      "[I 2026-07-02 16:33:07,455] Trial 123 finished with value: 0.00710212645127609 and parameters: {'foundation_window': 10, 'ar_lags': 6, 'ema_spans': (2, 4, 8), 'conv_scales': (2, 3), 'use_calendar': True, 'ridge_alpha': 0.01140806052879908, 'shrinkage_max': 2.567290440513398, 'oob_split_ratio': 0.756667715339443}. Best is trial 121 with value: 0.005949597839086942.\n",
      "[I 2026-07-02 16:33:07,582] Trial 124 finished with value: 0.012784572644195677 and parameters: {'foundation_window': 3, 'ar_lags': 6, 'ema_spans': (2, 4, 8), 'conv_scales': (2, 3), 'use_calendar': True, 'ridge_alpha': 0.009664314984233289, 'shrinkage_max': 2.760510344199608, 'oob_split_ratio': 0.7651508286323928}. Best is trial 121 with value: 0.005949597839086942.\n",
      "[I 2026-07-02 16:33:07,712] Trial 125 finished with value: 0.008498497359203732 and parameters: {'foundation_window': 11, 'ar_lags': 6, 'ema_spans': (2, 4, 8), 'conv_scales': (2, 3), 'use_calendar': True, 'ridge_alpha': 0.013089994995028232, 'shrinkage_max': 2.2656660131592665, 'oob_split_ratio': 0.7779552721992927}. Best is trial 121 with value: 0.005949597839086942.\n",
      "[I 2026-07-02 16:33:07,840] Trial 126 finished with value: 0.006071565740825312 and parameters: {'foundation_window': 10, 'ar_lags': 6, 'ema_spans': (2, 4, 8), 'conv_scales': (2, 3), 'use_calendar': True, 'ridge_alpha': 0.018252130394124357, 'shrinkage_max': 2.6512097148533895, 'oob_split_ratio': 0.7883428090922443}. Best is trial 121 with value: 0.005949597839086942.\n",
      "[I 2026-07-02 16:33:07,972] Trial 127 finished with value: 0.013719763742731067 and parameters: {'foundation_window': 9, 'ar_lags': 6, 'ema_spans': (2, 4, 8), 'conv_scales': (2, 3), 'use_calendar': True, 'ridge_alpha': 8.562258146503154, 'shrinkage_max': 2.374770337895204, 'oob_split_ratio': 0.7866447057325703}. Best is trial 121 with value: 0.005949597839086942.\n",
      "[I 2026-07-02 16:33:08,108] Trial 128 finished with value: 0.006120121412564292 and parameters: {'foundation_window': 10, 'ar_lags': 6, 'ema_spans': (2, 4, 8), 'conv_scales': (2, 3), 'use_calendar': True, 'ridge_alpha': 0.006067533331013876, 'shrinkage_max': 2.646924990703782, 'oob_split_ratio': 0.7953332990301835}. Best is trial 121 with value: 0.005949597839086942.\n",
      "[I 2026-07-02 16:33:08,237] Trial 129 finished with value: 0.006079567604715941 and parameters: {'foundation_window': 10, 'ar_lags': 6, 'ema_spans': (2, 4, 8), 'conv_scales': (2, 3), 'use_calendar': True, 'ridge_alpha': 0.004715594609531122, 'shrinkage_max': 2.67309626350876, 'oob_split_ratio': 0.7712484263683758}. Best is trial 121 with value: 0.005949597839086942.\n",
      "[I 2026-07-02 16:33:08,365] Trial 130 finished with value: 0.008913278092791826 and parameters: {'foundation_window': 11, 'ar_lags': 6, 'ema_spans': (2, 4, 8), 'conv_scales': (2, 3), 'use_calendar': True, 'ridge_alpha': 0.0049479363316515135, 'shrinkage_max': 2.6667716248994067, 'oob_split_ratio': 0.7709124602476614}. Best is trial 121 with value: 0.005949597839086942.\n",
      "[I 2026-07-02 16:33:08,493] Trial 131 finished with value: 0.005896550906162577 and parameters: {'foundation_window': 10, 'ar_lags': 6, 'ema_spans': (2, 4, 8), 'conv_scales': (2, 3), 'use_calendar': True, 'ridge_alpha': 0.004835422308781108, 'shrinkage_max': 2.167392278239508, 'oob_split_ratio': 0.7879156258276233}. Best is trial 131 with value: 0.005896550906162577.\n",
      "[I 2026-07-02 16:33:08,623] Trial 132 finished with value: 0.006002786274108385 and parameters: {'foundation_window': 10, 'ar_lags': 6, 'ema_spans': (2, 4, 8), 'conv_scales': (2, 3), 'use_calendar': True, 'ridge_alpha': 0.006412518145071202, 'shrinkage_max': 2.0501965392112713, 'oob_split_ratio': 0.7869613317566442}. Best is trial 131 with value: 0.005896550906162577.\n",
      "[I 2026-07-02 16:33:08,752] Trial 133 finished with value: 0.005961544519441121 and parameters: {'foundation_window': 10, 'ar_lags': 6, 'ema_spans': (2, 4, 8), 'conv_scales': (2, 3), 'use_calendar': True, 'ridge_alpha': 0.00681006561695308, 'shrinkage_max': 2.165947233783037, 'oob_split_ratio': 0.7878681008177479}. Best is trial 131 with value: 0.005896550906162577.\n",
      "[I 2026-07-02 16:33:08,881] Trial 134 finished with value: 0.005938388589102224 and parameters: {'foundation_window': 10, 'ar_lags': 6, 'ema_spans': (2, 4, 8), 'conv_scales': (2, 3), 'use_calendar': True, 'ridge_alpha': 0.006192999122326951, 'shrinkage_max': 2.173945471723901, 'oob_split_ratio': 0.799784999012181}. Best is trial 131 with value: 0.005896550906162577.\n",
      "[I 2026-07-02 16:33:09,029] Trial 135 finished with value: 0.010531683953870634 and parameters: {'foundation_window': 9, 'ar_lags': 6, 'ema_spans': (2, 4, 8), 'conv_scales': (3, 6, 12), 'use_calendar': True, 'ridge_alpha': 0.004981831503279595, 'shrinkage_max': 2.172993758292191, 'oob_split_ratio': 0.7995924030806503}. Best is trial 131 with value: 0.005896550906162577.\n",
      "[I 2026-07-02 16:33:09,157] Trial 136 finished with value: 0.012080060108606317 and parameters: {'foundation_window': 10, 'ar_lags': 6, 'ema_spans': (3, 6, 12), 'conv_scales': (2, 3), 'use_calendar': True, 'ridge_alpha': 0.006506703830973926, 'shrinkage_max': 2.0937847114826766, 'oob_split_ratio': 0.7879235706080935}. Best is trial 131 with value: 0.005896550906162577.\n",
      "[I 2026-07-02 16:33:09,284] Trial 137 finished with value: 0.014402045470474282 and parameters: {'foundation_window': 10, 'ar_lags': 6, 'ema_spans': (2, 4), 'conv_scales': (2, 3), 'use_calendar': True, 'ridge_alpha': 0.0064495386809820575, 'shrinkage_max': 2.283154503467647, 'oob_split_ratio': 0.7950917546699892}. Best is trial 131 with value: 0.005896550906162577.\n",
      "[I 2026-07-02 16:33:09,426] Trial 138 finished with value: 0.008449030258610914 and parameters: {'foundation_window': 11, 'ar_lags': 6, 'ema_spans': (2, 4, 8), 'conv_scales': (2, 3), 'use_calendar': True, 'ridge_alpha': 0.004848410125212277, 'shrinkage_max': 2.169876967358527, 'oob_split_ratio': 0.7875947936896469}. Best is trial 131 with value: 0.005896550906162577.\n",
      "[I 2026-07-02 16:33:09,552] Trial 139 finished with value: 0.008776420180773944 and parameters: {'foundation_window': 10, 'ar_lags': 6, 'ema_spans': (3, 6), 'conv_scales': (2, 3), 'use_calendar': True, 'ridge_alpha': 0.0086443463931118, 'shrinkage_max': 2.0768600412260394, 'oob_split_ratio': 0.7963754441935763}. Best is trial 131 with value: 0.005896550906162577.\n",
      "[I 2026-07-02 16:33:09,689] Trial 140 finished with value: 0.010303660115331632 and parameters: {'foundation_window': 9, 'ar_lags': 6, 'ema_spans': (2, 4, 8), 'conv_scales': (2, 3), 'use_calendar': True, 'ridge_alpha': 0.0024144875985141617, 'shrinkage_max': 2.2086433720698597, 'oob_split_ratio': 0.7889062309427434}. Best is trial 131 with value: 0.005896550906162577.\n",
      "[I 2026-07-02 16:33:09,822] Trial 141 finished with value: 0.006139677244809494 and parameters: {'foundation_window': 10, 'ar_lags': 6, 'ema_spans': (2, 4, 8), 'conv_scales': (2, 3), 'use_calendar': True, 'ridge_alpha': 0.003397883819841775, 'shrinkage_max': 2.3488821022255286, 'oob_split_ratio': 0.7911442033766763}. Best is trial 131 with value: 0.005896550906162577.\n",
      "[I 2026-07-02 16:33:09,958] Trial 142 finished with value: 0.006119525763211217 and parameters: {'foundation_window': 10, 'ar_lags': 6, 'ema_spans': (2, 4, 8), 'conv_scales': (2, 3), 'use_calendar': True, 'ridge_alpha': 0.003150847891042494, 'shrinkage_max': 2.3698802442452656, 'oob_split_ratio': 0.7994352029870067}. Best is trial 131 with value: 0.005896550906162577.\n",
      "[I 2026-07-02 16:33:10,092] Trial 143 finished with value: 0.005840059159515812 and parameters: {'foundation_window': 10, 'ar_lags': 6, 'ema_spans': (2, 4, 8), 'conv_scales': (2, 3), 'use_calendar': True, 'ridge_alpha': 0.0043290535673064226, 'shrinkage_max': 2.240942012210799, 'oob_split_ratio': 0.7980160967006225}. Best is trial 143 with value: 0.005840059159515812.\n",
      "[I 2026-07-02 16:33:10,246] Trial 144 finished with value: 0.0058326207528533874 and parameters: {'foundation_window': 10, 'ar_lags': 6, 'ema_spans': (2, 4, 8), 'conv_scales': (2, 3), 'use_calendar': True, 'ridge_alpha': 0.004071805574678015, 'shrinkage_max': 2.2371499262476084, 'oob_split_ratio': 0.7991739900592179}. Best is trial 144 with value: 0.0058326207528533874.\n",
