      "[I 2026-07-02 14:58:00,992] Trial 0 finished with value: 0.03434424212861683 and parameters: {'reservoir_size': 75, 'spectral_radius': 1.4507143064099162, 'ar_lags': 5, 'foundation_window': 7, 'regressor_type': 'Ridge', 'reg_alpha': 21.76624112345367, 'aci_step_size': 0.12421185223120967, 'oob_split_ratio': 0.7770181444490114}. Best is trial 0 with value: 0.03434424212861683.\n",
      "[I 2026-07-02 14:58:01,058] Trial 1 finished with value: 0.03472727193110866 and parameters: {'reservoir_size': 5, 'spectral_radius': 1.4699098521619942, 'ar_lags': 6, 'foundation_window': 4, 'regressor_type': 'Lasso', 'reg_alpha': 2.6079656598095835, 'aci_step_size': 0.092069553542002, 'oob_split_ratio': 0.6728072850495105}. Best is trial 0 with value: 0.03434424212861683.\n",
      "[I 2026-07-02 14:58:01,200] Trial 2 finished with value: 0.031776394728885334 and parameters: {'reservoir_size': 123, 'spectral_radius': 0.6394938606520418, 'ar_lags': 3, 'foundation_window': 5, 'regressor_type': 'ElasticNet', 'reg_alpha': 2.442886696734996, 'aci_step_size': 0.12255876808378806, 'oob_split_ratio': 0.6116126031799994}. Best is trial 2 with value: 0.031776394728885334.\n",
      "[I 2026-07-02 14:58:01,341] Trial 3 finished with value: 0.034156878444493964 and parameters: {'reservoir_size': 122, 'spectral_radius': 0.6705241236872915, 'ar_lags': 2, 'foundation_window': 9, 'regressor_type': 'Ridge', 'reg_alpha': 0.18349072049055454, 'aci_step_size': 0.14000427503730983, 'oob_split_ratio': 0.7100381234349002}. Best is trial 2 with value: 0.031776394728885334.\n",
      "[I 2026-07-02 14:58:01,426] Trial 4 finished with value: 0.03182364872455495 and parameters: {'reservoir_size': 25, 'spectral_radius': 0.9951769101112702, 'ar_lags': 2, 'foundation_window': 9, 'regressor_type': 'ElasticNet', 'reg_alpha': 2.533074654001447, 'aci_step_size': 0.11387495307522313, 'oob_split_ratio': 0.6462136138813818}. Best is trial 2 with value: 0.031776394728885334.\n",
      "[I 2026-07-02 14:58:01,651] Trial 5 finished with value: 0.034977933569571906 and parameters: {'reservoir_size': 194, 'spectral_radius': 1.2751328233611146, 'ar_lags': 6, 'foundation_window': 9, 'regressor_type': 'ElasticNet', 'reg_alpha': 0.3380273704712439, 'aci_step_size': 0.018593184893002233, 'oob_split_ratio': 0.6813325826908161}. Best is trial 2 with value: 0.031776394728885334.\n",
      "[I 2026-07-02 14:58:01,708] Trial 6 finished with value: 0.03281130301387746 and parameters: {'reservoir_size': 78, 'spectral_radius': 0.7713490317738959, 'ar_lags': 6, 'foundation_window': 5, 'regressor_type': 'ElasticNet', 'reg_alpha': 14.625327121207683, 'aci_step_size': 0.024164622299156457, 'oob_split_ratio': 0.8467217341501293}. Best is trial 2 with value: 0.031776394728885334.\n",
      "[I 2026-07-02 14:58:01,808] Trial 7 finished with value: 0.03468157031752848 and parameters: {'reservoir_size': 155, 'spectral_radius': 0.6987156815341724, 'ar_lags': 2, 'foundation_window': 8, 'regressor_type': 'Lasso', 'reg_alpha': 0.15843250684388685, 'aci_step_size': 0.0781084884234118, 'oob_split_ratio': 0.6289672648812824}. Best is trial 2 with value: 0.031776394728885334.\n",
      "[I 2026-07-02 14:58:02,033] Trial 8 finished with value: 0.0374472778419652 and parameters: {'reservoir_size': 173, 'spectral_radius': 1.123298126827558, 'ar_lags': 3, 'foundation_window': 3, 'regressor_type': 'Lasso', 'reg_alpha': 5.257127272786866, 'aci_step_size': 0.17857042108950205, 'oob_split_ratio': 0.7180537312904873}. Best is trial 2 with value: 0.031776394728885334.\n",
      "[I 2026-07-02 14:58:02,137] Trial 9 finished with value: 0.03394237727387101 and parameters: {'reservoir_size': 24, 'spectral_radius': 1.213244787222995, 'ar_lags': 5, 'foundation_window': 6, 'regressor_type': 'Ridge', 'reg_alpha': 1.4253462720121493, 'aci_step_size': 0.014829634081378086, 'oob_split_ratio': 0.6269728567483261}. Best is trial 2 with value: 0.031776394728885334.\n",
      "[I 2026-07-02 14:58:02,295] Trial 10 finished with value: 0.03711564980275584 and parameters: {'reservoir_size': 110, 'spectral_radius': 0.5059971829558172, 'ar_lags': 4, 'foundation_window': 3, 'regressor_type': 'ElasticNet', 'reg_alpha': 0.6474637253710466, 'aci_step_size': 0.1923564417296298, 'oob_split_ratio': 0.7912257183108367}. Best is trial 2 with value: 0.031776394728885334.\n",
      "[I 2026-07-02 14:58:02,398] Trial 11 finished with value: 0.03347408255606667 and parameters: {'reservoir_size': 41, 'spectral_radius': 1.014283428333446, 'ar_lags': 3, 'foundation_window': 6, 'regressor_type': 'ElasticNet', 'reg_alpha': 6.362904080795172, 'aci_step_size': 0.12188672410043964, 'oob_split_ratio': 0.6051595407306786}. Best is trial 2 with value: 0.031776394728885334.\n",
      "[I 2026-07-02 14:58:02,489] Trial 12 finished with value: 0.03205595389356406 and parameters: {'reservoir_size': 72, 'spectral_radius': 0.9524981873730661, 'ar_lags': 3, 'foundation_window': 7, 'regressor_type': 'ElasticNet', 'reg_alpha': 1.4111897299624192, 'aci_step_size': 0.07981169185790943, 'oob_split_ratio': 0.6539299942443548}. Best is trial 2 with value: 0.031776394728885334.\n",
      "[I 2026-07-02 14:58:02,607] Trial 13 finished with value: 0.03336326253790409 and parameters: {'reservoir_size': 126, 'spectral_radius': 0.8807714201317424, 'ar_lags': 2, 'foundation_window': 5, 'regressor_type': 'ElasticNet', 'reg_alpha': 5.329928236267225, 'aci_step_size': 0.15588154006655702, 'oob_split_ratio': 0.6011901993134666}. Best is trial 2 with value: 0.031776394728885334.\n",
      "[I 2026-07-02 14:58:02,687] Trial 14 finished with value: 0.03175639850720163 and parameters: {'reservoir_size': 49, 'spectral_radius': 0.5366525666765464, 'ar_lags': 3, 'foundation_window': 8, 'regressor_type': 'ElasticNet', 'reg_alpha': 40.310497719087785, 'aci_step_size': 0.09780180409621433, 'oob_split_ratio': 0.6489822471379613}. Best is trial 14 with value: 0.03175639850720163.\n",
      "[I 2026-07-02 14:58:02,832] Trial 15 finished with value: 0.033716183479157426 and parameters: {'reservoir_size': 96, 'spectral_radius': 0.5220395158819031, 'ar_lags': 4, 'foundation_window': 7, 'regressor_type': 'ElasticNet', 'reg_alpha': 40.73155979996687, 'aci_step_size': 0.05199481788890904, 'oob_split_ratio': 0.680806509851513}. Best is trial 14 with value: 0.03175639850720163.\n",
      "[I 2026-07-02 14:58:02,971] Trial 16 finished with value: 0.03242192348758728 and parameters: {'reservoir_size': 152, 'spectral_radius': 0.6082503625879405, 'ar_lags': 4, 'foundation_window': 5, 'regressor_type': 'ElasticNet', 'reg_alpha': 43.412308131906705, 'aci_step_size': 0.15462242781690436, 'oob_split_ratio': 0.7072193845602911}. Best is trial 14 with value: 0.03175639850720163.\n",
      "[I 2026-07-02 14:58:03,074] Trial 17 finished with value: 0.03315878473982749 and parameters: {'reservoir_size': 51, 'spectral_radius': 0.7461457021358388, 'ar_lags': 3, 'foundation_window': 8, 'regressor_type': 'ElasticNet', 'reg_alpha': 12.309787403989178, 'aci_step_size': 0.09450551226349478, 'oob_split_ratio': 0.749910211104906}. Best is trial 14 with value: 0.03175639850720163.\n",
      "[I 2026-07-02 14:58:03,182] Trial 18 finished with value: 0.036139351161596826 and parameters: {'reservoir_size': 148, 'spectral_radius': 0.6031876858045438, 'ar_lags': 4, 'foundation_window': 4, 'regressor_type': 'Lasso', 'reg_alpha': 0.5639286188737227, 'aci_step_size': 0.05771937848532959, 'oob_split_ratio': 0.6311040612196379}. Best is trial 14 with value: 0.03175639850720163.\n",
      "[I 2026-07-02 14:58:03,388] Trial 19 finished with value: 0.033566138813567827 and parameters: {'reservoir_size': 198, 'spectral_radius': 0.8324490859335177, 'ar_lags': 3, 'foundation_window': 6, 'regressor_type': 'Ridge', 'reg_alpha': 20.639626921396722, 'aci_step_size': 0.10756740253277168, 'oob_split_ratio': 0.6572888965639909}. Best is trial 14 with value: 0.03175639850720163.\n",
      "[I 2026-07-02 14:58:03,496] Trial 20 finished with value: 0.035876027360082795 and parameters: {'reservoir_size': 98, 'spectral_radius': 0.6060662551450784, 'ar_lags': 5, 'foundation_window': 8, 'regressor_type': 'ElasticNet', 'reg_alpha': 7.452815099119615, 'aci_step_size': 0.0585259963253669, 'oob_split_ratio': 0.6164182398122595}. Best is trial 14 with value: 0.03175639850720163.\n",
      "[I 2026-07-02 14:58:03,602] Trial 21 finished with value: 0.03182364872455495 and parameters: {'reservoir_size': 6, 'spectral_radius': 1.0602899685817422, 'ar_lags': 2, 'foundation_window': 9, 'regressor_type': 'ElasticNet', 'reg_alpha': 2.5426610119970277, 'aci_step_size': 0.11474229304828606, 'oob_split_ratio': 0.6476715001312439}. Best is trial 14 with value: 0.03175639850720163.\n",
      "[I 2026-07-02 14:58:03,695] Trial 22 finished with value: 0.03173162813123632 and parameters: {'reservoir_size': 38, 'spectral_radius': 0.8624938995780423, 'ar_lags': 2, 'foundation_window': 8, 'regressor_type': 'ElasticNet', 'reg_alpha': 1.8589594718597129, 'aci_step_size': 0.13717405267428986, 'oob_split_ratio': 0.6538254247705292}. Best is trial 22 with value: 0.03173162813123632.\n",
      "[I 2026-07-02 14:58:03,807] Trial 23 finished with value: 0.03315878473982749 and parameters: {'reservoir_size': 54, 'spectral_radius': 0.8389368347757582, 'ar_lags': 3, 'foundation_window': 8, 'regressor_type': 'ElasticNet', 'reg_alpha': 1.0043260452849196, 'aci_step_size': 0.143498287818703, 'oob_split_ratio': 0.6707226506716246}. Best is trial 22 with value: 0.03173162813123632.\n",
      "[I 2026-07-02 14:58:03,915] Trial 24 finished with value: 0.03312002779063366 and parameters: {'reservoir_size': 31, 'spectral_radius': 0.669092241213992, 'ar_lags': 2, 'foundation_window': 7, 'regressor_type': 'ElasticNet', 'reg_alpha': 3.4526915668916165, 'aci_step_size': 0.13653069983418564, 'oob_split_ratio': 0.6875052915633625}. Best is trial 22 with value: 0.03173162813123632.\n",
      "[I 2026-07-02 14:58:03,991] Trial 25 finished with value: 0.030603792302848206 and parameters: {'reservoir_size': 56, 'spectral_radius': 0.9103969867133103, 'ar_lags': 3, 'foundation_window': 4, 'regressor_type': 'ElasticNet', 'reg_alpha': 0.3524623952177369, 'aci_step_size': 0.16542330106077288, 'oob_split_ratio': 0.641884812422273}. Best is trial 25 with value: 0.030603792302848206.\n",
      "[I 2026-07-02 14:58:04,071] Trial 26 finished with value: 0.03362018279788542 and parameters: {'reservoir_size': 60, 'spectral_radius': 0.9183823701178684, 'ar_lags': 2, 'foundation_window': 8, 'regressor_type': 'ElasticNet', 'reg_alpha': 0.2779382372948731, 'aci_step_size': 0.16737283858521257, 'oob_split_ratio': 0.6983502295801766}. Best is trial 25 with value: 0.030603792302848206.\n",
      "[I 2026-07-02 14:58:04,150] Trial 27 finished with value: 0.033551088203823624 and parameters: {'reservoir_size': 37, 'spectral_radius': 1.0857484260251067, 'ar_lags': 3, 'foundation_window': 4, 'regressor_type': 'ElasticNet', 'reg_alpha': 0.1090207317402878, 'aci_step_size': 0.1903507039989838, 'oob_split_ratio': 0.6584113778392306}. Best is trial 25 with value: 0.030603792302848206.\n",
      "[I 2026-07-02 14:58:04,228] Trial 28 finished with value: 0.032906302412949895 and parameters: {'reservoir_size': 20, 'spectral_radius': 0.7785243282814959, 'ar_lags': 4, 'foundation_window': 6, 'regressor_type': 'Lasso', 'reg_alpha': 0.42457651715089845, 'aci_step_size': 0.1706305500654296, 'oob_split_ratio': 0.6364105323193155}. Best is trial 25 with value: 0.030603792302848206.\n",
      "[I 2026-07-02 14:58:04,320] Trial 29 finished with value: 0.03701470957206078 and parameters: {'reservoir_size': 72, 'spectral_radius': 1.3134505212780516, 'ar_lags': 3, 'foundation_window': 7, 'regressor_type': 'Ridge', 'reg_alpha': 1.0102666204430335, 'aci_step_size': 0.15262571516391296, 'oob_split_ratio': 0.765826916124096}. Best is trial 25 with value: 0.030603792302848206.\n",
      "[I 2026-07-02 14:58:04,419] Trial 30 finished with value: 0.036887180414620475 and parameters: {'reservoir_size': 86, 'spectral_radius': 1.374998126458956, 'ar_lags': 2, 'foundation_window': 3, 'regressor_type': 'Ridge', 'reg_alpha': 24.84177817493489, 'aci_step_size': 0.1300008612562434, 'oob_split_ratio': 0.7346627024386827}. Best is trial 25 with value: 0.030603792302848206.\n",
      "[I 2026-07-02 14:58:04,488] Trial 31 finished with value: 0.0334840804046268 and parameters: {'reservoir_size': 59, 'spectral_radius': 0.5711388146717774, 'ar_lags': 3, 'foundation_window': 4, 'regressor_type': 'ElasticNet', 'reg_alpha': 1.4927237497169827, 'aci_step_size': 0.0990685291120607, 'oob_split_ratio': 0.6188223675836332}. Best is trial 25 with value: 0.030603792302848206.\n",
      "[I 2026-07-02 14:58:04,604] Trial 32 finished with value: 0.03193105191073176 and parameters: {'reservoir_size': 1, 'spectral_radius': 0.7285127984148876, 'ar_lags': 3, 'foundation_window': 5, 'regressor_type': 'ElasticNet', 'reg_alpha': 8.618784754096422, 'aci_step_size': 0.12672192897015536, 'oob_split_ratio': 0.666399669144842}. Best is trial 25 with value: 0.030603792302848206.\n",
      "[I 2026-07-02 14:58:04,692] Trial 33 finished with value: 0.03239268010781815 and parameters: {'reservoir_size': 44, 'spectral_radius': 0.6665071899168331, 'ar_lags': 4, 'foundation_window': 4, 'regressor_type': 'ElasticNet', 'reg_alpha': 0.7345221995029101, 'aci_step_size': 0.14802533452831976, 'oob_split_ratio': 0.6381806903136332}. Best is trial 25 with value: 0.030603792302848206.\n",
      "[I 2026-07-02 14:58:04,883] Trial 34 finished with value: 0.0377396783694686 and parameters: {'reservoir_size': 126, 'spectral_radius': 0.8296009898902275, 'ar_lags': 2, 'foundation_window': 3, 'regressor_type': 'ElasticNet', 'reg_alpha': 3.6686117354519494, 'aci_step_size': 0.07760929613634224, 'oob_split_ratio': 0.6174958751718445}. Best is trial 25 with value: 0.030603792302848206.\n",
      "[I 2026-07-02 14:58:05,041] Trial 35 finished with value: 0.03294576326513239 and parameters: {'reservoir_size': 17, 'spectral_radius': 0.9334469295455159, 'ar_lags': 3, 'foundation_window': 9, 'regressor_type': 'ElasticNet', 'reg_alpha': 0.2095395067396937, 'aci_step_size': 0.10640986533708462, 'oob_split_ratio': 0.6106068944007488}. Best is trial 25 with value: 0.030603792302848206.\n",
      "[I 2026-07-02 14:58:05,128] Trial 36 finished with value: 0.03291645046054551 and parameters: {'reservoir_size': 65, 'spectral_radius': 0.6555706489105266, 'ar_lags': 2, 'foundation_window': 4, 'regressor_type': 'ElasticNet', 'reg_alpha': 1.9306614887263, 'aci_step_size': 0.16442826272058206, 'oob_split_ratio': 0.6444297590225551}. Best is trial 25 with value: 0.030603792302848206.\n",
      "[I 2026-07-02 14:58:05,286] Trial 37 finished with value: 0.033827672245941465 and parameters: {'reservoir_size': 93, 'spectral_radius': 0.9957494708447409, 'ar_lags': 4, 'foundation_window': 8, 'regressor_type': 'Lasso', 'reg_alpha': 0.44898137515601877, 'aci_step_size': 0.1343681104721679, 'oob_split_ratio': 0.6693047770249748}. Best is trial 25 with value: 0.030603792302848206.\n",
      "[I 2026-07-02 14:58:05,421] Trial 38 finished with value: 0.032409765726096315 and parameters: {'reservoir_size': 110, 'spectral_radius': 0.5564869755792393, 'ar_lags': 3, 'foundation_window': 5, 'regressor_type': 'ElasticNet', 'reg_alpha': 0.10167185503295205, 'aci_step_size': 0.18081216915235424, 'oob_split_ratio': 0.6943527206755153}. Best is trial 25 with value: 0.030603792302848206.\n",
      "[I 2026-07-02 14:58:05,680] Trial 39 finished with value: 0.035172759845250964 and parameters: {'reservoir_size': 179, 'spectral_radius': 1.173774045075067, 'ar_lags': 5, 'foundation_window': 9, 'regressor_type': 'Ridge', 'reg_alpha': 0.2666447556960336, 'aci_step_size': 0.1205600895928195, 'oob_split_ratio': 0.6247772603776703}. Best is trial 25 with value: 0.030603792302848206.\n",
      "[I 2026-07-02 14:58:05,790] Trial 40 finished with value: 0.033954698557714 and parameters: {'reservoir_size': 84, 'spectral_radius': 0.7882034242364138, 'ar_lags': 2, 'foundation_window': 6, 'regressor_type': 'ElasticNet', 'reg_alpha': 10.756928660774502, 'aci_step_size': 0.14116685350232086, 'oob_split_ratio': 0.6000230019762941}. Best is trial 25 with value: 0.030603792302848206.\n",
      "[I 2026-07-02 14:58:05,915] Trial 41 finished with value: 0.03182364872455495 and parameters: {'reservoir_size': 28, 'spectral_radius': 1.0172365811742112, 'ar_lags': 2, 'foundation_window': 9, 'regressor_type': 'ElasticNet', 'reg_alpha': 3.9033498830227837, 'aci_step_size': 0.08576631000498114, 'oob_split_ratio': 0.6474729812267496}. Best is trial 25 with value: 0.030603792302848206.\n",
      "[I 2026-07-02 14:58:06,030] Trial 42 finished with value: 0.03182364872455495 and parameters: {'reservoir_size': 14, 'spectral_radius': 0.8909502126825148, 'ar_lags': 2, 'foundation_window': 9, 'regressor_type': 'ElasticNet', 'reg_alpha': 2.1677138499483513, 'aci_step_size': 0.11274932623276654, 'oob_split_ratio': 0.6353193354904857}. Best is trial 25 with value: 0.030603792302848206.\n",
      "[I 2026-07-02 14:58:06,156] Trial 43 finished with value: 0.03315878473982749 and parameters: {'reservoir_size': 47, 'spectral_radius': 1.1461149531923693, 'ar_lags': 3, 'foundation_window': 8, 'regressor_type': 'ElasticNet', 'reg_alpha': 1.025040475491011, 'aci_step_size': 0.120047307525912, 'oob_split_ratio': 0.8079968966324726}. Best is trial 25 with value: 0.030603792302848206.\n",
      "[I 2026-07-02 14:58:06,249] Trial 44 finished with value: 0.03370015535437848 and parameters: {'reservoir_size': 35, 'spectral_radius': 0.9634162062523568, 'ar_lags': 2, 'foundation_window': 9, 'regressor_type': 'Lasso', 'reg_alpha': 19.835648637374913, 'aci_step_size': 0.1052097864616673, 'oob_split_ratio': 0.6782313054429908}. Best is trial 25 with value: 0.030603792302848206.\n",
      "[I 2026-07-02 14:58:06,384] Trial 45 finished with value: 0.03318348632959418 and parameters: {'reservoir_size': 143, 'spectral_radius': 1.0632533896809062, 'ar_lags': 3, 'foundation_window': 7, 'regressor_type': 'ElasticNet', 'reg_alpha': 3.1959143861339814, 'aci_step_size': 0.09010887978846663, 'oob_split_ratio': 0.6579941940377814}. Best is trial 25 with value: 0.030603792302848206.\n",
      "[I 2026-07-02 14:58:06,459] Trial 46 finished with value: 0.03468157031752848 and parameters: {'reservoir_size': 11, 'spectral_radius': 0.7103198880345438, 'ar_lags': 2, 'foundation_window': 8, 'regressor_type': 'ElasticNet', 'reg_alpha': 4.331757980231353, 'aci_step_size': 0.12977338773922162, 'oob_split_ratio': 0.6248418684677484}. Best is trial 25 with value: 0.030603792302848206.\n",
      "[I 2026-07-02 14:58:06,675] Trial 47 finished with value: 0.03193105191073176 and parameters: {'reservoir_size': 164, 'spectral_radius': 0.5009963083377683, 'ar_lags': 3, 'foundation_window': 5, 'regressor_type': 'ElasticNet', 'reg_alpha': 1.6686816632709696, 'aci_step_size': 0.16124655033811844, 'oob_split_ratio': 0.8485754816753542}. Best is trial 25 with value: 0.030603792302848206.\n",
      "[I 2026-07-02 14:58:06,767] Trial 48 finished with value: 0.03175639850720163 and parameters: {'reservoir_size': 26, 'spectral_radius': 0.8593964172768455, 'ar_lags': 3, 'foundation_window': 8, 'regressor_type': 'ElasticNet', 'reg_alpha': 28.40916151333366, 'aci_step_size': 0.06575285067945763, 'oob_split_ratio': 0.6433377764700677}. Best is trial 25 with value: 0.030603792302848206.\n",
      "[I 2026-07-02 14:58:06,852] Trial 49 finished with value: 0.03323930523877119 and parameters: {'reservoir_size': 27, 'spectral_radius': 0.8040641970102242, 'ar_lags': 4, 'foundation_window': 7, 'regressor_type': 'ElasticNet', 'reg_alpha': 30.88315022901987, 'aci_step_size': 0.044192224451284, 'oob_split_ratio': 0.6436919133762719}. Best is trial 25 with value: 0.030603792302848206.\n",
      "[I 2026-07-02 14:58:06,968] Trial 50 finished with value: 0.033904076685948685 and parameters: {'reservoir_size': 138, 'spectral_radius': 0.8685765518750516, 'ar_lags': 4, 'foundation_window': 7, 'regressor_type': 'Ridge', 'reg_alpha': 33.36152275599401, 'aci_step_size': 0.06897261954478327, 'oob_split_ratio': 0.6625031428810718}. Best is trial 25 with value: 0.030603792302848206.\n",
      "[I 2026-07-02 14:58:07,115] Trial 51 finished with value: 0.03268651700670846 and parameters: {'reservoir_size': 41, 'spectral_radius': 0.8865030309335343, 'ar_lags': 3, 'foundation_window': 8, 'regressor_type': 'ElasticNet', 'reg_alpha': 47.81177640956457, 'aci_step_size': 0.03434058906212511, 'oob_split_ratio': 0.6276144116656506}. Best is trial 25 with value: 0.030603792302848206.\n",
      "[I 2026-07-02 14:58:07,199] Trial 52 finished with value: 0.03458901028892119 and parameters: {'reservoir_size': 21, 'spectral_radius': 0.9820697413922932, 'ar_lags': 6, 'foundation_window': 8, 'regressor_type': 'ElasticNet', 'reg_alpha': 6.068832899328028, 'aci_step_size': 0.10085948916593668, 'oob_split_ratio': 0.6510093510608823}. Best is trial 25 with value: 0.030603792302848206.\n",
      "[I 2026-07-02 14:58:07,311] Trial 53 finished with value: 0.03241805427034408 and parameters: {'reservoir_size': 50, 'spectral_radius': 0.6357031663033528, 'ar_lags': 3, 'foundation_window': 9, 'regressor_type': 'ElasticNet', 'reg_alpha': 14.318113045963273, 'aci_step_size': 0.07311507990213759, 'oob_split_ratio': 0.6124615661093874}. Best is trial 25 with value: 0.030603792302848206.\n",
      "[I 2026-07-02 14:58:07,439] Trial 54 finished with value: 0.03315878473982749 and parameters: {'reservoir_size': 66, 'spectral_radius': 0.7576137426857303, 'ar_lags': 3, 'foundation_window': 8, 'regressor_type': 'ElasticNet', 'reg_alpha': 27.533509567190478, 'aci_step_size': 0.08600947029462683, 'oob_split_ratio': 0.6782787317386048}. Best is trial 25 with value: 0.030603792302848206.\n",
