      "[I 2026-07-02 16:33:33,584] Trial 18 finished with value: 2.9362165925238366 and parameters: {'aci_target': 0.18231812886869425, 'aci_step_size': 0.0980790931554325, 'interval_scale': 2.004036334177742, 'interval_power': 0.367802000553624, 'min_width_factor': 0.8532936764271685}. Best is trial 11 with value: 1.655145302433952.\n",
      "[I 2026-07-02 16:33:33,707] Trial 19 finished with value: 1.266110858914284 and parameters: {'aci_target': 0.154062487232484, 'aci_step_size': 0.11283546337576224, 'interval_scale': 1.1433386516774782, 'interval_power': 0.10773092119844156, 'min_width_factor': 0.5272824871998176}. Best is trial 19 with value: 1.266110858914284.\n",
      "[I 2026-07-02 16:33:33,831] Trial 20 finished with value: 1.535974864807952 and parameters: {'aci_target': 0.10743611693404971, 'aci_step_size': 0.12062333788977937, 'interval_scale': 1.1625171281997457, 'interval_power': 0.16221710371844267, 'min_width_factor': 0.4798088603953312}. Best is trial 19 with value: 1.266110858914284.\n",
      "[I 2026-07-02 16:33:33,953] Trial 21 finished with value: 1.4810244472984868 and parameters: {'aci_target': 0.09738233682322629, 'aci_step_size': 0.1106527671757424, 'interval_scale': 1.0817384273618904, 'interval_power': 0.17666927035109875, 'min_width_factor': 0.4960908078634423}. Best is trial 19 with value: 1.266110858914284.\n",
      "[I 2026-07-02 16:33:34,076] Trial 22 finished with value: 1.4162729227920712 and parameters: {'aci_target': 0.0808138185229239, 'aci_step_size': 0.12092982360911017, 'interval_scale': 1.037870207172252, 'interval_power': 0.17000978740324507, 'min_width_factor': 0.5793946456147429}. Best is trial 19 with value: 1.266110858914284.\n",
      "[I 2026-07-02 16:33:34,199] Trial 23 finished with value: 2.006059248658454 and parameters: {'aci_target': 0.06837983382560556, 'aci_step_size': 0.132083325029821, 'interval_scale': 1.1148484337522802, 'interval_power': 0.3274805351197555, 'min_width_factor': 0.5699704068902851}. Best is trial 19 with value: 1.266110858914284.\n",
      "[I 2026-07-02 16:33:34,326] Trial 24 finished with value: 2.3597965048979113 and parameters: {'aci_target': 0.07445646510443144, 'aci_step_size': 0.19830943530169423, 'interval_scale': 1.0550158669235274, 'interval_power': 0.45084899625694574, 'min_width_factor': 0.5654939561495673}. Best is trial 19 with value: 1.266110858914284.\n",
      "[I 2026-07-02 16:33:34,455] Trial 25 finished with value: 1.3400893061445058 and parameters: {'aci_target': 0.09739737968615854, 'aci_step_size': 0.09537286540407026, 'interval_scale': 0.8011713920476273, 'interval_power': 0.2725933439682491, 'min_width_factor': 0.13526107942114152}. Best is trial 19 with value: 1.266110858914284.\n",
      "[I 2026-07-02 16:33:34,578] Trial 26 finished with value: 1.3501937403827171 and parameters: {'aci_target': 0.05472674546029111, 'aci_step_size': 0.09475658570284584, 'interval_scale': 0.7720771489866505, 'interval_power': 0.28509217450922675, 'min_width_factor': 0.06480127431147142}. Best is trial 19 with value: 1.266110858914284.\n",
      "[I 2026-07-02 16:33:34,700] Trial 27 finished with value: 2.1847578760732103 and parameters: {'aci_target': 0.06265612441098001, 'aci_step_size': 0.08388521383637465, 'interval_scale': 0.7709708023561801, 'interval_power': 0.5670756696878589, 'min_width_factor': 0.03576090222337064}. Best is trial 19 with value: 1.266110858914284.\n",
      "[I 2026-07-02 16:33:34,822] Trial 28 finished with value: 13.814115630999993 and parameters: {'aci_target': 0.018518922941126087, 'aci_step_size': 0.04319359596811125, 'interval_scale': 7.928838532958431, 'interval_power': 0.30048774869865585, 'min_width_factor': 0.0761586794913687}. Best is trial 19 with value: 1.266110858914284.\n",
      "[I 2026-07-02 16:33:34,945] Trial 29 finished with value: 1.7181362138143825 and parameters: {'aci_target': 0.055614913646010074, 'aci_step_size': 0.14840971410079715, 'interval_scale': 0.7709175734460074, 'interval_power': 0.44298538857272435, 'min_width_factor': 0.16972727166976787}. Best is trial 19 with value: 1.266110858914284.\n",
      "[I 2026-07-02 16:33:35,068] Trial 30 finished with value: 2.304516920011096 and parameters: {'aci_target': 0.09053623204756386, 'aci_step_size': 0.02833908166321285, 'interval_scale': 0.9385486333162106, 'interval_power': 0.554607804368659, 'min_width_factor': 0.16980163116409117}. Best is trial 19 with value: 1.266110858914284.\n",
      "[I 2026-07-02 16:33:35,197] Trial 31 finished with value: 1.6125208021671282 and parameters: {'aci_target': 0.08013918133269601, 'aci_step_size': 0.0833309550300306, 'interval_scale': 1.3096616846032267, 'interval_power': 0.11086708171160901, 'min_width_factor': 0.35304978462055814}. Best is trial 19 with value: 1.266110858914284.\n",
      "[I 2026-07-02 16:33:35,320] Trial 32 finished with value: 1.3446630070001158 and parameters: {'aci_target': 0.11212458631500553, 'aci_step_size': 0.08500014239052832, 'interval_scale': 0.94104032003677, 'interval_power': 0.24350108336532128, 'min_width_factor': 0.1763447162324277}. Best is trial 19 with value: 1.266110858914284.\n",
      "[I 2026-07-02 16:33:35,448] Trial 33 finished with value: 1.3521927720072964 and parameters: {'aci_target': 0.10968712462794011, 'aci_step_size': 0.08091705702238292, 'interval_scale': 0.8927843605576057, 'interval_power': 0.26804553680613113, 'min_width_factor': 0.17581219246179733}. Best is trial 19 with value: 1.266110858914284.\n",
      "[I 2026-07-02 16:33:35,572] Trial 34 finished with value: 1.6349092610757705 and parameters: {'aci_target': 0.14483099465189364, 'aci_step_size': 0.050013058225949224, 'interval_scale': 1.300224371467335, 'interval_power': 0.2545111185010195, 'min_width_factor': 0.008608886134727267}. Best is trial 19 with value: 1.266110858914284.\n",
      "[I 2026-07-02 16:33:35,694] Trial 35 finished with value: 1.4253452448329715 and parameters: {'aci_target': 0.12266222809580232, 'aci_step_size': 0.18269877771575158, 'interval_scale': 0.7543891369539131, 'interval_power': 0.3698084591579774, 'min_width_factor': 0.3066431645475868}. Best is trial 19 with value: 1.266110858914284.\n",
      "[I 2026-07-02 16:33:35,823] Trial 36 finished with value: 1.2552337709013122 and parameters: {'aci_target': 0.05066539314612579, 'aci_step_size': 0.08513115760928315, 'interval_scale': 0.9528869913321997, 'interval_power': 0.10233049550930061, 'min_width_factor': 0.21210858816718414}. Best is trial 36 with value: 1.2552337709013122.\n",
      "[I 2026-07-02 16:33:35,949] Trial 37 finished with value: 1.5234340240084636 and parameters: {'aci_target': 0.03176860259636443, 'aci_step_size': 0.14549230640540145, 'interval_scale': 1.2672747039108205, 'interval_power': 0.0942634046398394, 'min_width_factor': 0.19402167759197347}. Best is trial 36 with value: 1.2552337709013122.\n",
      "[I 2026-07-02 16:33:36,078] Trial 38 finished with value: 5.223025431090193 and parameters: {'aci_target': 0.15214445144616837, 'aci_step_size': 0.005263016435803031, 'interval_scale': 0.9685195114548235, 'interval_power': 1.0550568810454097, 'min_width_factor': 0.397800526606826}. Best is trial 36 with value: 1.2552337709013122.\n",
      "[I 2026-07-02 16:33:36,200] Trial 39 finished with value: 2.4231366579630755 and parameters: {'aci_target': 0.11112043349923437, 'aci_step_size': 0.16257305950825754, 'interval_scale': 1.6833846489186342, 'interval_power': 0.21381615589038433, 'min_width_factor': 0.2460541522369432}. Best is trial 36 with value: 1.2552337709013122.\n",
      "[I 2026-07-02 16:33:36,321] Trial 40 finished with value: 1.6883835680064943 and parameters: {'aci_target': 0.11731235143569807, 'aci_step_size': 0.024691548922182272, 'interval_scale': 0.8725696978463586, 'interval_power': 0.12662354296086292, 'min_width_factor': 0.11307885122260909}. Best is trial 36 with value: 1.2552337709013122.\n",
      "[I 2026-07-02 16:33:36,445] Trial 41 finished with value: 1.5066682179206854 and parameters: {'aci_target': 0.05380059485237673, 'aci_step_size': 0.08851713255981636, 'interval_scale': 0.8627049235081029, 'interval_power': 0.30631125415573013, 'min_width_factor': 0.11813466160687632}. Best is trial 36 with value: 1.2552337709013122.\n",
      "[I 2026-07-02 16:33:36,564] Trial 42 finished with value: 2.028458042114821 and parameters: {'aci_target': 0.03756189530450406, 'aci_step_size': 0.07587221808050348, 'interval_scale': 0.9762234498981975, 'interval_power': 0.3991985189793785, 'min_width_factor': 0.30788634883363886}. Best is trial 36 with value: 1.2552337709013122.\n",
      "[I 2026-07-02 16:33:36,682] Trial 43 finished with value: 1.6940734998687859 and parameters: {'aci_target': 0.022863365432678, 'aci_step_size': 0.10292242770889504, 'interval_scale': 0.825994917897641, 'interval_power': 0.056229145659324214, 'min_width_factor': 0.2533047545699712}. Best is trial 36 with value: 1.2552337709013122.\n",
      "[I 2026-07-02 16:33:36,802] Trial 44 finished with value: 1.9376914360357582 and parameters: {'aci_target': 0.04705790600142783, 'aci_step_size': 0.048633647641153264, 'interval_scale': 1.205705458511505, 'interval_power': 0.2572661122716053, 'min_width_factor': 0.11212378408101546}. Best is trial 36 with value: 1.2552337709013122.\n",
      "[I 2026-07-02 16:33:36,924] Trial 45 finished with value: 1.279104431829716 and parameters: {'aci_target': 0.13308738477242651, 'aci_step_size': 0.13452348295253008, 'interval_scale': 0.9979520374130431, 'interval_power': 0.14627562201557243, 'min_width_factor': 0.007064609802982708}. Best is trial 36 with value: 1.2552337709013122.\n",
      "[I 2026-07-02 16:33:37,046] Trial 46 finished with value: 1.688267732132819 and parameters: {'aci_target': 0.1326957289072747, 'aci_step_size': 0.13285602185366246, 'interval_scale': 0.9958739575836584, 'interval_power': 0.014967206818270268, 'min_width_factor': 0.009379943917129041}. Best is trial 36 with value: 1.2552337709013122.\n",
      "[I 2026-07-02 16:33:37,167] Trial 47 finished with value: 1.4839593099752566 and parameters: {'aci_target': 0.13649395797942018, 'aci_step_size': 0.07200226879288535, 'interval_scale': 1.355817165519807, 'interval_power': 0.14334938285525373, 'min_width_factor': 0.2244876791776773}. Best is trial 36 with value: 1.2552337709013122.\n",
      "[I 2026-07-02 16:33:37,289] Trial 48 finished with value: 1.2968397720321099 and parameters: {'aci_target': 0.15946671726761122, 'aci_step_size': 0.15963264772449837, 'interval_scale': 0.8920828101403355, 'interval_power': 0.21553714403927587, 'min_width_factor': 0.4327323017384493}. Best is trial 36 with value: 1.2552337709013122.\n",
      "[I 2026-07-02 16:33:37,414] Trial 49 finished with value: 4.040382185343625 and parameters: {'aci_target': 0.16922820319349002, 'aci_step_size': 0.1560741854184697, 'interval_scale': 4.207220687019573, 'interval_power': 0.06496862892200489, 'min_width_factor': 0.44336394149172775}. Best is trial 36 with value: 1.2552337709013122.\n",
      "[I 2026-07-02 16:33:37,536] Trial 50 finished with value: 3.588873989760871 and parameters: {'aci_target': 0.1561152739733074, 'aci_step_size': 0.17365420641110269, 'interval_scale': 1.6098597806980603, 'interval_power': 0.4961349205889424, 'min_width_factor': 0.35428543076453456}. Best is trial 36 with value: 1.2552337709013122.\n",
      "[I 2026-07-02 16:33:37,656] Trial 51 finished with value: 1.3494512827991385 and parameters: {'aci_target': 0.1455486356171254, 'aci_step_size': 0.11932099182376202, 'interval_scale': 0.9149315524219426, 'interval_power': 0.20410545273138042, 'min_width_factor': 0.6745583335858969}. Best is trial 36 with value: 1.2552337709013122.\n",
      "[I 2026-07-02 16:33:37,781] Trial 52 finished with value: 1.3898103398037813 and parameters: {'aci_target': 0.1284592702129473, 'aci_step_size': 0.0600334915032742, 'interval_scale': 1.1084125044752473, 'interval_power': 0.2174593635565621, 'min_width_factor': 0.3161473104470738}. Best is trial 36 with value: 1.2552337709013122.\n",
      "[I 2026-07-02 16:33:37,902] Trial 53 finished with value: 1.4932880284776868 and parameters: {'aci_target': 0.16452079686261567, 'aci_step_size': 0.13773943493004626, 'interval_scale': 0.843207077813755, 'interval_power': 0.3297364720471777, 'min_width_factor': 0.7287003686693814}. Best is trial 36 with value: 1.2552337709013122.\n",
      "[I 2026-07-02 16:33:38,024] Trial 54 finished with value: 1.6861261924527837 and parameters: {'aci_target': 0.174939639441767, 'aci_step_size': 0.11091057613109075, 'interval_scale': 1.0217463255104082, 'interval_power': 0.0754199233808504, 'min_width_factor': 0.4843432137805338}. Best is trial 36 with value: 1.2552337709013122.\n",
      "[I 2026-07-02 16:33:38,143] Trial 55 finished with value: 1.8110864679254428 and parameters: {'aci_target': 0.09449272225119595, 'aci_step_size': 0.07110426246343717, 'interval_scale': 1.3813514974432637, 'interval_power': 0.1797313298470024, 'min_width_factor': 0.4102916755570079}. Best is trial 36 with value: 1.2552337709013122.\n",
      "[I 2026-07-02 16:33:38,265] Trial 56 finished with value: 1.3136998424651158 and parameters: {'aci_target': 0.13882415494212114, 'aci_step_size': 0.0971645400587295, 'interval_scale': 1.1831786449821535, 'interval_power': 0.13503493653720627, 'min_width_factor': 0.15354354956382527}. Best is trial 36 with value: 1.2552337709013122.\n",
      "[I 2026-07-02 16:33:38,386] Trial 57 finished with value: 1.2184894955459968 and parameters: {'aci_target': 0.14064987247274005, 'aci_step_size': 0.1006167111942693, 'interval_scale': 1.2401627500172985, 'interval_power': 0.007948097262867326, 'min_width_factor': 0.10017589147599035}. Best is trial 57 with value: 1.2184894955459968.\n",
      "[I 2026-07-02 16:33:38,510] Trial 58 finished with value: 1.9307457322579613 and parameters: {'aci_target': 0.14964940869775947, 'aci_step_size': 0.1185131059014197, 'interval_scale': 2.1128826721515908, 'interval_power': 0.0239672793187329, 'min_width_factor': 0.072112922687689}. Best is trial 57 with value: 1.2184894955459968.\n",
      "[I 2026-07-02 16:33:38,631] Trial 59 finished with value: 2.0988990447868683 and parameters: {'aci_target': 0.13471722171771255, 'aci_step_size': 0.19320676588588764, 'interval_scale': 1.735093582016494, 'interval_power': 0.12410606729709361, 'min_width_factor': 0.6169243658974473}. Best is trial 57 with value: 1.2184894955459968.\n",
      "[I 2026-07-02 16:33:38,753] Trial 60 finished with value: 1.4744896586001837 and parameters: {'aci_target': 0.16050819861256213, 'aci_step_size': 0.10554985557973325, 'interval_scale': 1.1914479938765123, 'interval_power': 0.0479978360338794, 'min_width_factor': 0.7372448293000908}. Best is trial 57 with value: 1.2184894955459968.\n",
      "[I 2026-07-02 16:33:38,877] Trial 61 finished with value: 1.29116899978279 and parameters: {'aci_target': 0.1422640247030212, 'aci_step_size': 0.09343712237493068, 'interval_scale': 1.09350136043486, 'interval_power': 0.15947528870577385, 'min_width_factor': 0.11931270781571099}. Best is trial 57 with value: 1.2184894955459968.\n",
      "[I 2026-07-02 16:33:39,001] Trial 62 finished with value: 1.299971407451729 and parameters: {'aci_target': 0.14304360944089614, 'aci_step_size': 0.13132717670467842, 'interval_scale': 1.4164513525126108, 'interval_power': 0.003610806169800973, 'min_width_factor': 0.23504145069585156}. Best is trial 57 with value: 1.2184894955459968.\n",
      "[I 2026-07-02 16:33:39,124] Trial 63 finished with value: 1.2877441633863747 and parameters: {'aci_target': 0.1571272382597726, 'aci_step_size': 0.13026049786489605, 'interval_scale': 1.463399826699776, 'interval_power': 0.007097892119432621, 'min_width_factor': 0.21943745263217068}. Best is trial 57 with value: 1.2184894955459968.\n",
      "[I 2026-07-02 16:33:39,246] Trial 64 finished with value: 1.2358047860557668 and parameters: {'aci_target': 0.18783738597864355, 'aci_step_size': 0.17324220784643174, 'interval_scale': 1.0952947967443403, 'interval_power': 0.08764599056317485, 'min_width_factor': 0.5151371087486611}. Best is trial 57 with value: 1.2184894955459968.\n",
      "[I 2026-07-02 16:33:39,370] Trial 65 finished with value: 1.204287235687569 and parameters: {'aci_target': 0.19119208586404593, 'aci_step_size': 0.012219636763077095, 'interval_scale': 1.0896329623652932, 'interval_power': 0.09013382455236531, 'min_width_factor': 0.5176790473095154}. Best is trial 65 with value: 1.204287235687569.\n",
      "[I 2026-07-02 16:33:39,503] Trial 66 finished with value: 1.2497152391169413 and parameters: {'aci_target': 0.18863642018695154, 'aci_step_size': 0.013019230602098704, 'interval_scale': 1.5182749974195402, 'interval_power': 0.08839984092597439, 'min_width_factor': 0.6236735750432547}. Best is trial 65 with value: 1.204287235687569.\n",
      "[I 2026-07-02 16:33:39,635] Trial 67 finished with value: 1.3348773889773358 and parameters: {'aci_target': 0.18924210784725604, 'aci_step_size': 0.013533840869198321, 'interval_scale': 1.7310986372018977, 'interval_power': 0.08193446421945806, 'min_width_factor': 0.6126311820405871}. Best is trial 65 with value: 1.204287235687569.\n",
      "[I 2026-07-02 16:33:39,760] Trial 68 finished with value: 1.2059290070380877 and parameters: {'aci_target': 0.19955490376798452, 'aci_step_size': 0.009037260437662323, 'interval_scale': 1.24795497082889, 'interval_power': 0.08324570123429988, 'min_width_factor': 0.522604361361071}. Best is trial 65 with value: 1.204287235687569.\n",
      "[I 2026-07-02 16:33:39,886] Trial 69 finished with value: 1.2065557011832866 and parameters: {'aci_target': 0.19587863312361625, 'aci_step_size': 0.00751224600454284, 'interval_scale': 1.2478898197697537, 'interval_power': 0.09548667565304168, 'min_width_factor': 0.52448444379667}. Best is trial 65 with value: 1.204287235687569.\n",
      "[I 2026-07-02 16:33:40,015] Trial 70 finished with value: 1.233838801669661 and parameters: {'aci_target': 0.19772978107290365, 'aci_step_size': 0.007560033948231583, 'interval_scale': 1.5445600811693807, 'interval_power': 0.05244562665107144, 'min_width_factor': 0.5280421465777052}. Best is trial 65 with value: 1.204287235687569.\n",
      "[I 2026-07-02 16:33:40,154] Trial 71 finished with value: 1.40148218333499 and parameters: {'aci_target': 0.1969756562794817, 'aci_step_size': 0.007658583850221925, 'interval_scale': 1.8732862208282695, 'interval_power': 0.08634608250895091, 'min_width_factor': 0.5296006367944587}. Best is trial 65 with value: 1.204287235687569.\n",
      "[I 2026-07-02 16:33:40,289] Trial 72 finished with value: 1.604088920949198 and parameters: {'aci_target': 0.1855478099094813, 'aci_step_size': 0.010469492062583146, 'interval_scale': 1.2566403101446983, 'interval_power': 0.043033756979805146, 'min_width_factor': 0.8020444604745978}. Best is trial 65 with value: 1.204287235687569.\n",
      "[I 2026-07-02 16:33:40,414] Trial 73 finished with value: 1.2520688601911238 and parameters: {'aci_target': 0.19969820998571164, 'aci_step_size': 0.007627076276249011, 'interval_scale': 1.5714483854470327, 'interval_power': 0.10027817404708893, 'min_width_factor': 0.6154196733774879}. Best is trial 65 with value: 1.204287235687569.\n",
      "[I 2026-07-02 16:33:40,541] Trial 74 finished with value: 1.6797701608081232 and parameters: {'aci_target': 0.19859640477725077, 'aci_step_size': 0.007141179468356806, 'interval_scale': 2.3418315743346096, 'interval_power': 0.06522410272529959, 'min_width_factor': 0.6032784265243447}. Best is trial 65 with value: 1.204287235687569.\n",
      "[I 2026-07-02 16:33:40,664] Trial 75 finished with value: 1.3789759755034106 and parameters: {'aci_target': 0.19169706197804573, 'aci_step_size': 0.010345794906939527, 'interval_scale': 1.5361245624247404, 'interval_power': 0.17736264035930213, 'min_width_factor': 0.5363686892991669}. Best is trial 65 with value: 1.204287235687569.\n",
      "[I 2026-07-02 16:33:40,791] Trial 76 finished with value: 1.2680697485686212 and parameters: {'aci_target': 0.1775873983151873, 'aci_step_size': 0.006203831498574982, 'interval_scale': 1.5698840206823608, 'interval_power': 0.03480858465718675, 'min_width_factor': 0.6340348742843078}. Best is trial 65 with value: 1.204287235687569.\n",
      "[I 2026-07-02 16:33:40,916] Trial 77 finished with value: 1.871500437880881 and parameters: {'aci_target': 0.1857432083159243, 'aci_step_size': 0.012704581201194375, 'interval_scale': 1.7941805488986171, 'interval_power': 0.09774221232978902, 'min_width_factor': 0.935750218940443}. Best is trial 65 with value: 1.204287235687569.\n",
      "[I 2026-07-02 16:33:41,042] Trial 78 finished with value: 1.4256506769029673 and parameters: {'aci_target': 0.17187793986763075, 'aci_step_size': 0.020791532202458694, 'interval_scale': 1.3743358961363097, 'interval_power': 0.11400092409252734, 'min_width_factor': 0.7128253384514868}. Best is trial 65 with value: 1.204287235687569.\n",
      "[I 2026-07-02 16:33:41,166] Trial 79 finished with value: 1.580677958826131 and parameters: {'aci_target': 0.1810271770957188, 'aci_step_size': 0.008525368438274237, 'interval_scale': 1.6110076619153408, 'interval_power': 0.05397696478360913, 'min_width_factor': 0.7903389794130625}. Best is trial 65 with value: 1.204287235687569.\n",
      "[I 2026-07-02 16:33:41,293] Trial 80 finished with value: 5.291651580921027 and parameters: {'aci_target': 0.19375434451227352, 'aci_step_size': 0.00641258265973026, 'interval_scale': 1.2649369127349046, 'interval_power': 0.9925055812669201, 'min_width_factor': 0.45672584789937587}. Best is trial 65 with value: 1.204287235687569.\n",
