      "[I 2026-07-02 14:58:13,245] Trial 110 finished with value: 0.03423581209248522 and parameters: {'reservoir_size': 14, 'spectral_radius': 1.4632024387485576, 'ar_lags': 2, 'foundation_window': 9, 'regressor_type': 'ElasticNet', 'reg_alpha': 0.2108501400723484, 'aci_step_size': 0.19476328514719032, 'oob_split_ratio': 0.6666132171777461}. Best is trial 25 with value: 0.030603792302848206.\n",
      "[I 2026-07-02 14:58:13,353] Trial 111 finished with value: 0.03237189712091148 and parameters: {'reservoir_size': 29, 'spectral_radius': 1.1831798815055203, 'ar_lags': 2, 'foundation_window': 9, 'regressor_type': 'ElasticNet', 'reg_alpha': 0.1893700347195495, 'aci_step_size': 0.19000132145171497, 'oob_split_ratio': 0.6409465078428971}. Best is trial 25 with value: 0.030603792302848206.\n",
      "[I 2026-07-02 14:58:13,466] Trial 112 finished with value: 0.03182364872455495 and parameters: {'reservoir_size': 23, 'spectral_radius': 1.2300593783754337, 'ar_lags': 2, 'foundation_window': 9, 'regressor_type': 'ElasticNet', 'reg_alpha': 0.38471877312029107, 'aci_step_size': 0.17546785452432534, 'oob_split_ratio': 0.6443605044231169}. Best is trial 25 with value: 0.030603792302848206.\n",
      "[I 2026-07-02 14:58:13,596] Trial 113 finished with value: 0.031666747232145416 and parameters: {'reservoir_size': 38, 'spectral_radius': 1.2198864356956183, 'ar_lags': 2, 'foundation_window': 9, 'regressor_type': 'ElasticNet', 'reg_alpha': 0.33510604904176616, 'aci_step_size': 0.16906457414728512, 'oob_split_ratio': 0.6330348025370521}. Best is trial 25 with value: 0.030603792302848206.\n",
      "[I 2026-07-02 14:58:13,712] Trial 114 finished with value: 0.03433564978022054 and parameters: {'reservoir_size': 37, 'spectral_radius': 1.1648066670694468, 'ar_lags': 2, 'foundation_window': 9, 'regressor_type': 'ElasticNet', 'reg_alpha': 0.32473610306857664, 'aci_step_size': 0.18229957250180495, 'oob_split_ratio': 0.6267575012495572}. Best is trial 25 with value: 0.030603792302848206.\n",
      "[I 2026-07-02 14:58:13,809] Trial 115 finished with value: 0.03181094538883001 and parameters: {'reservoir_size': 10, 'spectral_radius': 1.2874154502721, 'ar_lags': 2, 'foundation_window': 9, 'regressor_type': 'ElasticNet', 'reg_alpha': 0.26783493368128924, 'aci_step_size': 0.16851475786287368, 'oob_split_ratio': 0.6339767701467721}. Best is trial 25 with value: 0.030603792302848206.\n",
      "[I 2026-07-02 14:58:13,920] Trial 116 finished with value: 0.033973921222691335 and parameters: {'reservoir_size': 33, 'spectral_radius': 1.2190813860423846, 'ar_lags': 2, 'foundation_window': 9, 'regressor_type': 'ElasticNet', 'reg_alpha': 0.1553823816106697, 'aci_step_size': 0.1940809303265203, 'oob_split_ratio': 0.6231103185468378}. Best is trial 25 with value: 0.030603792302848206.\n",
      "[I 2026-07-02 14:58:14,034] Trial 117 finished with value: 0.03251551033270216 and parameters: {'reservoir_size': 18, 'spectral_radius': 1.1344277150492208, 'ar_lags': 2, 'foundation_window': 9, 'regressor_type': 'Ridge', 'reg_alpha': 0.24867903828278162, 'aci_step_size': 0.1793984448701193, 'oob_split_ratio': 0.6528207233780187}. Best is trial 25 with value: 0.030603792302848206.\n",
      "[I 2026-07-02 14:58:14,140] Trial 118 finished with value: 0.03364766168714838 and parameters: {'reservoir_size': 28, 'spectral_radius': 1.4244039757757863, 'ar_lags': 2, 'foundation_window': 6, 'regressor_type': 'ElasticNet', 'reg_alpha': 0.2881355720650894, 'aci_step_size': 0.1761167289459826, 'oob_split_ratio': 0.6136322875628576}. Best is trial 25 with value: 0.030603792302848206.\n",
      "[I 2026-07-02 14:58:14,222] Trial 119 finished with value: 0.03370015535437848 and parameters: {'reservoir_size': 22, 'spectral_radius': 1.212605164764563, 'ar_lags': 2, 'foundation_window': 9, 'regressor_type': 'ElasticNet', 'reg_alpha': 0.33561906936614205, 'aci_step_size': 0.16894907999928369, 'oob_split_ratio': 0.6622084064598672}. Best is trial 25 with value: 0.030603792302848206.\n",
      "[I 2026-07-02 14:58:14,349] Trial 120 finished with value: 0.03182364872455495 and parameters: {'reservoir_size': 15, 'spectral_radius': 1.2520491878993905, 'ar_lags': 2, 'foundation_window': 9, 'regressor_type': 'ElasticNet', 'reg_alpha': 0.46268852635322033, 'aci_step_size': 0.19596368968527966, 'oob_split_ratio': 0.6365330379510195}. Best is trial 25 with value: 0.030603792302848206.\n",
      "[I 2026-07-02 14:58:14,466] Trial 121 finished with value: 0.03182364872455495 and parameters: {'reservoir_size': 43, 'spectral_radius': 1.2592349975222106, 'ar_lags': 2, 'foundation_window': 9, 'regressor_type': 'ElasticNet', 'reg_alpha': 0.3823301026713963, 'aci_step_size': 0.1194178139817676, 'oob_split_ratio': 0.6405792133117585}. Best is trial 25 with value: 0.030603792302848206.\n",
      "[I 2026-07-02 14:58:14,552] Trial 122 finished with value: 0.03468157031752848 and parameters: {'reservoir_size': 38, 'spectral_radius': 1.2818680763614847, 'ar_lags': 2, 'foundation_window': 8, 'regressor_type': 'ElasticNet', 'reg_alpha': 0.4167646042418787, 'aci_step_size': 0.1316301793273892, 'oob_split_ratio': 0.6313111789529617}. Best is trial 25 with value: 0.030603792302848206.\n",
      "[I 2026-07-02 14:58:14,649] Trial 123 finished with value: 0.03232034639329972 and parameters: {'reservoir_size': 49, 'spectral_radius': 1.2993182807729895, 'ar_lags': 2, 'foundation_window': 9, 'regressor_type': 'ElasticNet', 'reg_alpha': 0.3272733838937259, 'aci_step_size': 0.16451883136801781, 'oob_split_ratio': 0.6463008026201174}. Best is trial 25 with value: 0.030603792302848206.\n",
      "[I 2026-07-02 14:58:14,740] Trial 124 finished with value: 0.034152920903694366 and parameters: {'reservoir_size': 34, 'spectral_radius': 1.3997737039441316, 'ar_lags': 2, 'foundation_window': 8, 'regressor_type': 'ElasticNet', 'reg_alpha': 0.22248663892287696, 'aci_step_size': 0.12706443235404255, 'oob_split_ratio': 0.6536519166081485}. Best is trial 25 with value: 0.030603792302848206.\n",
      "[I 2026-07-02 14:58:14,843] Trial 125 finished with value: 0.033260018417817665 and parameters: {'reservoir_size': 30, 'spectral_radius': 1.1988260928183334, 'ar_lags': 2, 'foundation_window': 8, 'regressor_type': 'ElasticNet', 'reg_alpha': 0.14893270792368027, 'aci_step_size': 0.18984602958911367, 'oob_split_ratio': 0.6413979040291946}. Best is trial 25 with value: 0.030603792302848206.\n",
      "[I 2026-07-02 14:58:14,924] Trial 126 finished with value: 0.03396522163443882 and parameters: {'reservoir_size': 26, 'spectral_radius': 1.2225174842916353, 'ar_lags': 2, 'foundation_window': 9, 'regressor_type': 'ElasticNet', 'reg_alpha': 0.2516686067367791, 'aci_step_size': 0.18526756649283346, 'oob_split_ratio': 0.6821315368708888}. Best is trial 25 with value: 0.030603792302848206.\n",
      "[I 2026-07-02 14:58:15,026] Trial 127 finished with value: 0.03571976356861608 and parameters: {'reservoir_size': 20, 'spectral_radius': 1.3308084404720495, 'ar_lags': 2, 'foundation_window': 6, 'regressor_type': 'Ridge', 'reg_alpha': 0.11640149831733866, 'aci_step_size': 0.11649430304107, 'oob_split_ratio': 0.6484070132259196}. Best is trial 25 with value: 0.030603792302848206.\n",
      "[I 2026-07-02 14:58:15,138] Trial 128 finished with value: 0.032758964921883925 and parameters: {'reservoir_size': 46, 'spectral_radius': 1.385675623372066, 'ar_lags': 2, 'foundation_window': 8, 'regressor_type': 'ElasticNet', 'reg_alpha': 0.19681184577758745, 'aci_step_size': 0.1387909082213307, 'oob_split_ratio': 0.658356641783819}. Best is trial 25 with value: 0.030603792302848206.\n",
      "[I 2026-07-02 14:58:15,229] Trial 129 finished with value: 0.03370015535437848 and parameters: {'reservoir_size': 37, 'spectral_radius': 1.1008510136240262, 'ar_lags': 2, 'foundation_window': 9, 'regressor_type': 'ElasticNet', 'reg_alpha': 0.36460927241993324, 'aci_step_size': 0.10874965400009894, 'oob_split_ratio': 0.7736368476408252}. Best is trial 25 with value: 0.030603792302848206.\n",
      "[I 2026-07-02 14:58:15,351] Trial 130 finished with value: 0.03303256722600552 and parameters: {'reservoir_size': 83, 'spectral_radius': 1.2565420941660952, 'ar_lags': 2, 'foundation_window': 5, 'regressor_type': 'Lasso', 'reg_alpha': 0.49403124612092564, 'aci_step_size': 0.1243248207742149, 'oob_split_ratio': 0.6203317347791134}. Best is trial 25 with value: 0.030603792302848206.\n",
      "[I 2026-07-02 14:58:15,458] Trial 131 finished with value: 0.03173162813123632 and parameters: {'reservoir_size': 43, 'spectral_radius': 1.3488697114447281, 'ar_lags': 2, 'foundation_window': 8, 'regressor_type': 'ElasticNet', 'reg_alpha': 0.4356830602872611, 'aci_step_size': 0.14559040460984973, 'oob_split_ratio': 0.6501309992244965}. Best is trial 25 with value: 0.030603792302848206.\n",
      "[I 2026-07-02 14:58:15,571] Trial 132 finished with value: 0.03173162813123632 and parameters: {'reservoir_size': 73, 'spectral_radius': 1.3709352613065597, 'ar_lags': 2, 'foundation_window': 8, 'regressor_type': 'ElasticNet', 'reg_alpha': 1.623677743342212, 'aci_step_size': 0.15873204496164545, 'oob_split_ratio': 0.6424367808731742}. Best is trial 25 with value: 0.030603792302848206.\n",
      "[I 2026-07-02 14:58:15,678] Trial 133 finished with value: 0.03173162813123632 and parameters: {'reservoir_size': 41, 'spectral_radius': 1.320511801654836, 'ar_lags': 2, 'foundation_window': 8, 'regressor_type': 'ElasticNet', 'reg_alpha': 0.5640654120056056, 'aci_step_size': 0.1995499339091915, 'oob_split_ratio': 0.6360027290229822}. Best is trial 25 with value: 0.030603792302848206.\n",
      "[I 2026-07-02 14:58:15,781] Trial 134 finished with value: 0.03173162813123632 and parameters: {'reservoir_size': 58, 'spectral_radius': 1.3600685103260808, 'ar_lags': 2, 'foundation_window': 8, 'regressor_type': 'ElasticNet', 'reg_alpha': 2.2572888815175904, 'aci_step_size': 0.13292701317220876, 'oob_split_ratio': 0.6540742333653206}. Best is trial 25 with value: 0.030603792302848206.\n",
      "[I 2026-07-02 14:58:15,873] Trial 135 finished with value: 0.03333313075719501 and parameters: {'reservoir_size': 32, 'spectral_radius': 1.4191639075923987, 'ar_lags': 2, 'foundation_window': 8, 'regressor_type': 'ElasticNet', 'reg_alpha': 0.2956960058999075, 'aci_step_size': 0.18234395868028322, 'oob_split_ratio': 0.6304280588791296}. Best is trial 25 with value: 0.030603792302848206.\n",
      "[I 2026-07-02 14:58:15,975] Trial 136 finished with value: 0.03645295979868742 and parameters: {'reservoir_size': 49, 'spectral_radius': 1.1562022199053175, 'ar_lags': 2, 'foundation_window': 8, 'regressor_type': 'ElasticNet', 'reg_alpha': 0.16723384364636287, 'aci_step_size': 0.16231809207720369, 'oob_split_ratio': 0.6493750660781282}. Best is trial 25 with value: 0.030603792302848206.\n",
      "[I 2026-07-02 14:58:16,065] Trial 137 finished with value: 0.03370015535437848 and parameters: {'reservoir_size': 25, 'spectral_radius': 1.2899244725813053, 'ar_lags': 2, 'foundation_window': 9, 'regressor_type': 'ElasticNet', 'reg_alpha': 0.34688200936083796, 'aci_step_size': 0.11375034468248786, 'oob_split_ratio': 0.6743722130611393}. Best is trial 25 with value: 0.030603792302848206.\n",
      "[I 2026-07-02 14:58:16,154] Trial 138 finished with value: 0.03362018279788542 and parameters: {'reservoir_size': 62, 'spectral_radius': 1.1837566623445464, 'ar_lags': 2, 'foundation_window': 8, 'regressor_type': 'ElasticNet', 'reg_alpha': 2.9232998087269317, 'aci_step_size': 0.17289136972520947, 'oob_split_ratio': 0.6677850581389484}. Best is trial 25 with value: 0.030603792302848206.\n",
      "[I 2026-07-02 14:58:16,235] Trial 139 finished with value: 0.034650878181314966 and parameters: {'reservoir_size': 40, 'spectral_radius': 1.2716671830830253, 'ar_lags': 2, 'foundation_window': 7, 'regressor_type': 'Ridge', 'reg_alpha': 0.2670006036065917, 'aci_step_size': 0.14799463319434242, 'oob_split_ratio': 0.6597981619488508}. Best is trial 25 with value: 0.030603792302848206.\n",
      "[I 2026-07-02 14:58:16,321] Trial 140 finished with value: 0.03370015535437848 and parameters: {'reservoir_size': 34, 'spectral_radius': 0.9044520734755821, 'ar_lags': 2, 'foundation_window': 9, 'regressor_type': 'ElasticNet', 'reg_alpha': 1.3371628365619075, 'aci_step_size': 0.10382133298449699, 'oob_split_ratio': 0.7424058400463959}. Best is trial 25 with value: 0.030603792302848206.\n",
      "[I 2026-07-02 14:58:16,442] Trial 141 finished with value: 0.03427096314939237 and parameters: {'reservoir_size': 54, 'spectral_radius': 1.421524906451883, 'ar_lags': 5, 'foundation_window': 8, 'regressor_type': 'ElasticNet', 'reg_alpha': 0.6049887346754141, 'aci_step_size': 0.15119996110667244, 'oob_split_ratio': 0.6561923158023001}. Best is trial 25 with value: 0.030603792302848206.\n",
      "[I 2026-07-02 14:58:16,544] Trial 142 finished with value: 0.03173162813123632 and parameters: {'reservoir_size': 47, 'spectral_radius': 1.4595534922245712, 'ar_lags': 2, 'foundation_window': 8, 'regressor_type': 'ElasticNet', 'reg_alpha': 0.7303192236906126, 'aci_step_size': 0.13814639363934167, 'oob_split_ratio': 0.6464441727307599}. Best is trial 25 with value: 0.030603792302848206.\n",
      "[I 2026-07-02 14:58:16,645] Trial 143 finished with value: 0.03173162813123632 and parameters: {'reservoir_size': 51, 'spectral_radius': 1.442934300781703, 'ar_lags': 2, 'foundation_window': 8, 'regressor_type': 'ElasticNet', 'reg_alpha': 1.881826408995834, 'aci_step_size': 0.15568814425403357, 'oob_split_ratio': 0.6386733348596795}. Best is trial 25 with value: 0.030603792302848206.\n",
      "[I 2026-07-02 14:58:16,734] Trial 144 finished with value: 0.034589011743962325 and parameters: {'reservoir_size': 18, 'spectral_radius': 1.444951454744173, 'ar_lags': 6, 'foundation_window': 8, 'regressor_type': 'ElasticNet', 'reg_alpha': 0.5257105482103227, 'aci_step_size': 0.16619026337022733, 'oob_split_ratio': 0.6649843655214732}. Best is trial 25 with value: 0.030603792302848206.\n",
      "[I 2026-07-02 14:58:16,820] Trial 145 finished with value: 0.03468157031752848 and parameters: {'reservoir_size': 29, 'spectral_radius': 1.482437698879293, 'ar_lags': 2, 'foundation_window': 8, 'regressor_type': 'ElasticNet', 'reg_alpha': 0.9160096093285373, 'aci_step_size': 0.14258298274589806, 'oob_split_ratio': 0.6268224377494649}. Best is trial 25 with value: 0.030603792302848206.\n",
      "[I 2026-07-02 14:58:16,909] Trial 146 finished with value: 0.03173162813123632 and parameters: {'reservoir_size': 67, 'spectral_radius': 1.3383043365424265, 'ar_lags': 2, 'foundation_window': 8, 'regressor_type': 'ElasticNet', 'reg_alpha': 0.4042938013540157, 'aci_step_size': 0.12097564387164561, 'oob_split_ratio': 0.6446378619066702}. Best is trial 25 with value: 0.030603792302848206.\n",
      "[I 2026-07-02 14:58:17,030] Trial 147 finished with value: 0.03182364872455495 and parameters: {'reservoir_size': 42, 'spectral_radius': 1.233405477468275, 'ar_lags': 2, 'foundation_window': 9, 'regressor_type': 'ElasticNet', 'reg_alpha': 0.654803367656223, 'aci_step_size': 0.18905369671914002, 'oob_split_ratio': 0.6554450331417456}. Best is trial 25 with value: 0.030603792302848206.\n",
      "[I 2026-07-02 14:58:17,141] Trial 148 finished with value: 0.03173162813123632 and parameters: {'reservoir_size': 22, 'spectral_radius': 1.3948131335778695, 'ar_lags': 2, 'foundation_window': 8, 'regressor_type': 'ElasticNet', 'reg_alpha': 0.22744885129959697, 'aci_step_size': 0.19307933466660268, 'oob_split_ratio': 0.6361390091989133}. Best is trial 25 with value: 0.030603792302848206.\n",
      "[I 2026-07-02 14:58:17,234] Trial 149 finished with value: 0.0355645873544304 and parameters: {'reservoir_size': 12, 'spectral_radius': 1.2479534535951866, 'ar_lags': 2, 'foundation_window': 3, 'regressor_type': 'ElasticNet', 'reg_alpha': 0.44934687572266097, 'aci_step_size': 0.1353324263598536, 'oob_split_ratio': 0.6511824847323033}. Best is trial 25 with value: 0.030603792302848206.\n",
      "[I 2026-07-02 14:58:17,307] Trial 150 finished with value: 0.03370015535437848 and parameters: {'reservoir_size': 7, 'spectral_radius': 1.313265575844958, 'ar_lags': 2, 'foundation_window': 9, 'regressor_type': 'ElasticNet', 'reg_alpha': 0.7852927618145343, 'aci_step_size': 0.1545964241105833, 'oob_split_ratio': 0.6595465791550342}. Best is trial 25 with value: 0.030603792302848206.\n",
      "[I 2026-07-02 14:58:17,411] Trial 151 finished with value: 0.03173162813123632 and parameters: {'reservoir_size': 52, 'spectral_radius': 1.4508682159738922, 'ar_lags': 2, 'foundation_window': 8, 'regressor_type': 'ElasticNet', 'reg_alpha': 0.46331535485710196, 'aci_step_size': 0.15101250247600903, 'oob_split_ratio': 0.6559569450233503}. Best is trial 25 with value: 0.030603792302848206.\n",
      "[I 2026-07-02 14:58:17,515] Trial 152 finished with value: 0.03161160530801731 and parameters: {'reservoir_size': 56, 'spectral_radius': 1.4419476574851724, 'ar_lags': 2, 'foundation_window': 8, 'regressor_type': 'ElasticNet', 'reg_alpha': 0.3364575698166084, 'aci_step_size': 0.1488923889677296, 'oob_split_ratio': 0.6425242556721162}. Best is trial 25 with value: 0.030603792302848206.\n",
      "[I 2026-07-02 14:58:17,620] Trial 153 finished with value: 0.03215947776131415 and parameters: {'reservoir_size': 56, 'spectral_radius': 1.4300601373243857, 'ar_lags': 2, 'foundation_window': 8, 'regressor_type': 'ElasticNet', 'reg_alpha': 0.3132462842360534, 'aci_step_size': 0.14897059418538683, 'oob_split_ratio': 0.6440217879659406}. Best is trial 25 with value: 0.030603792302848206.\n",
      "[I 2026-07-02 14:58:17,700] Trial 154 finished with value: 0.03203833497252668 and parameters: {'reservoir_size': 64, 'spectral_radius': 1.3799509566621881, 'ar_lags': 2, 'foundation_window': 8, 'regressor_type': 'ElasticNet', 'reg_alpha': 0.35746954374002715, 'aci_step_size': 0.13018981047486639, 'oob_split_ratio': 0.6327092827984293}. Best is trial 25 with value: 0.030603792302848206.\n",
      "[I 2026-07-02 14:58:17,777] Trial 155 finished with value: 0.03381798524943347 and parameters: {'reservoir_size': 36, 'spectral_radius': 1.4019215218986103, 'ar_lags': 2, 'foundation_window': 8, 'regressor_type': 'ElasticNet', 'reg_alpha': 0.1779965976556349, 'aci_step_size': 0.1439055441285565, 'oob_split_ratio': 0.6395537699331585}. Best is trial 25 with value: 0.030603792302848206.\n",
      "[I 2026-07-02 14:58:17,871] Trial 156 finished with value: 0.03589638157668222 and parameters: {'reservoir_size': 70, 'spectral_radius': 1.4722401389817408, 'ar_lags': 2, 'foundation_window': 8, 'regressor_type': 'Ridge', 'reg_alpha': 0.28081650066298297, 'aci_step_size': 0.17820873251505906, 'oob_split_ratio': 0.6489955014475104}. Best is trial 25 with value: 0.030603792302848206.\n",
      "[I 2026-07-02 14:58:17,975] Trial 157 finished with value: 0.03511701997011187 and parameters: {'reservoir_size': 45, 'spectral_radius': 1.499115649378358, 'ar_lags': 2, 'foundation_window': 9, 'regressor_type': 'ElasticNet', 'reg_alpha': 0.2494678047839413, 'aci_step_size': 0.16047559212882528, 'oob_split_ratio': 0.629942386408767}. Best is trial 25 with value: 0.030603792302848206.\n",
      "[I 2026-07-02 14:58:18,075] Trial 158 finished with value: 0.03173162813123632 and parameters: {'reservoir_size': 25, 'spectral_radius': 1.208674374370137, 'ar_lags': 2, 'foundation_window': 8, 'regressor_type': 'ElasticNet', 'reg_alpha': 0.551494134812188, 'aci_step_size': 0.14119305505199353, 'oob_split_ratio': 0.6414861755930696}. Best is trial 25 with value: 0.030603792302848206.\n",
      "[I 2026-07-02 14:58:18,164] Trial 159 finished with value: 0.03370015535437848 and parameters: {'reservoir_size': 60, 'spectral_radius': 0.8592223591312337, 'ar_lags': 2, 'foundation_window': 9, 'regressor_type': 'Lasso', 'reg_alpha': 0.3937555275284244, 'aci_step_size': 0.12641110440221567, 'oob_split_ratio': 0.6639388221009763}. Best is trial 25 with value: 0.030603792302848206.\n",
      "[I 2026-07-02 14:58:18,252] Trial 160 finished with value: 0.03362018279788542 and parameters: {'reservoir_size': 28, 'spectral_radius': 0.8015931812778059, 'ar_lags': 2, 'foundation_window': 8, 'regressor_type': 'ElasticNet', 'reg_alpha': 0.33056515541005543, 'aci_step_size': 0.1854337665495092, 'oob_split_ratio': 0.6697822838583468}. Best is trial 25 with value: 0.030603792302848206.\n",
      "[I 2026-07-02 14:58:18,341] Trial 161 finished with value: 0.03173162813123632 and parameters: {'reservoir_size': 51, 'spectral_radius': 1.4322754896200145, 'ar_lags': 2, 'foundation_window': 8, 'regressor_type': 'ElasticNet', 'reg_alpha': 0.466859382500463, 'aci_step_size': 0.15358190869025948, 'oob_split_ratio': 0.6499490729467825}. Best is trial 25 with value: 0.030603792302848206.\n",
      "[I 2026-07-02 14:58:18,429] Trial 162 finished with value: 0.03362018279788542 and parameters: {'reservoir_size': 39, 'spectral_radius': 1.4073563900677497, 'ar_lags': 2, 'foundation_window': 8, 'regressor_type': 'ElasticNet', 'reg_alpha': 0.4241816172238917, 'aci_step_size': 0.14897756662273307, 'oob_split_ratio': 0.6594981242954169}. Best is trial 25 with value: 0.030603792302848206.\n",
      "[I 2026-07-02 14:58:18,518] Trial 163 finished with value: 0.03173162813123632 and parameters: {'reservoir_size': 55, 'spectral_radius': 1.4508018494453703, 'ar_lags': 2, 'foundation_window': 8, 'regressor_type': 'ElasticNet', 'reg_alpha': 0.6239716015691719, 'aci_step_size': 0.15701157088096224, 'oob_split_ratio': 0.6554374325122657}. Best is trial 25 with value: 0.030603792302848206.\n",
      "[I 2026-07-02 14:58:18,624] Trial 164 finished with value: 0.03173162813123632 and parameters: {'reservoir_size': 48, 'spectral_radius': 0.9636795097273086, 'ar_lags': 2, 'foundation_window': 8, 'regressor_type': 'ElasticNet', 'reg_alpha': 0.30313496489723396, 'aci_step_size': 0.14736718212067565, 'oob_split_ratio': 0.6443361470163362}. Best is trial 25 with value: 0.030603792302848206.\n",
