      "[I 2026-07-02 14:59:43,498] Trial 31 finished with value: 2.3045144128518826 and parameters: {'aci_target': 0.10589571245808833, 'aci_step_size': 0.04097244439249516, 'interval_scale': 1.0348642828023262, 'interval_power': 0.11130715470845214, 'min_width_factor': 0.9260587426682968}. Best is trial 11 with value: 2.225822499377296.\n",
      "[I 2026-07-02 14:59:43,657] Trial 32 finished with value: 2.885149026570572 and parameters: {'aci_target': 0.07493254400651123, 'aci_step_size': 0.0541393486568471, 'interval_scale': 1.288520319491638, 'interval_power': 0.196356287587423, 'min_width_factor': 1.0902567838244088}. Best is trial 11 with value: 2.225822499377296.\n",
      "[I 2026-07-02 14:59:43,811] Trial 33 finished with value: 2.767578659167421 and parameters: {'aci_target': 0.08528837485141495, 'aci_step_size': 0.07885669259374233, 'interval_scale': 1.6964386922760049, 'interval_power': 0.08783486833969568, 'min_width_factor': 0.8746443400599815}. Best is trial 11 with value: 2.225822499377296.\n",
      "[I 2026-07-02 14:59:43,967] Trial 34 finished with value: 2.4281120851808002 and parameters: {'aci_target': 0.12665959195919987, 'aci_step_size': 0.04952293693884757, 'interval_scale': 1.3284922296803192, 'interval_power': 0.2678895364334656, 'min_width_factor': 1.0239431262549912}. Best is trial 11 with value: 2.225822499377296.\n",
      "[I 2026-07-02 14:59:44,128] Trial 35 finished with value: 2.9546760863321557 and parameters: {'aci_target': 0.0976861280640229, 'aci_step_size': 0.1853516088615799, 'interval_scale': 1.0769235935130845, 'interval_power': 0.07907945031271853, 'min_width_factor': 0.6799308759448146}. Best is trial 11 with value: 2.225822499377296.\n",
      "[I 2026-07-02 14:59:44,282] Trial 36 finished with value: 7.415241447868991 and parameters: {'aci_target': 0.053273102637896606, 'aci_step_size': 0.1287359612531305, 'interval_scale': 2.274115710752965, 'interval_power': 0.42844040473817246, 'min_width_factor': 0.45998039267832275}. Best is trial 11 with value: 2.225822499377296.\n",
      "[I 2026-07-02 14:59:44,436] Trial 37 finished with value: 3.366715266508334 and parameters: {'aci_target': 0.11732150480535998, 'aci_step_size': 0.005172965039398948, 'interval_scale': 1.6287044656272565, 'interval_power': 0.2886459258783682, 'min_width_factor': 1.1480871501972263}. Best is trial 11 with value: 2.225822499377296.\n",
      "[I 2026-07-02 14:59:44,594] Trial 38 finished with value: 2.843505079242863 and parameters: {'aci_target': 0.13783858796172221, 'aci_step_size': 0.03897298654867824, 'interval_scale': 0.9125674304016805, 'interval_power': 0.5591934949888563, 'min_width_factor': 0.896576136670185}. Best is trial 11 with value: 2.225822499377296.\n",
      "[I 2026-07-02 14:59:44,756] Trial 39 finished with value: 10.836317550521093 and parameters: {'aci_target': 0.010049801337895445, 'aci_step_size': 0.02696418607141931, 'interval_scale': 2.9273920086862737, 'interval_power': 0.17998577578424552, 'min_width_factor': 0.7520753994024565}. Best is trial 11 with value: 2.225822499377296.\n",
      "[I 2026-07-02 14:59:44,932] Trial 40 finished with value: 11.028841854944616 and parameters: {'aci_target': 0.026649087793717968, 'aci_step_size': 0.07983141672727531, 'interval_scale': 4.2282107768097426, 'interval_power': 0.06821655781487719, 'min_width_factor': 0.6352908487239601}. Best is trial 11 with value: 2.225822499377296.\n",
      "[I 2026-07-02 14:59:45,089] Trial 41 finished with value: 2.306723978300699 and parameters: {'aci_target': 0.09984226255306781, 'aci_step_size': 0.04057931145308285, 'interval_scale': 1.0132256772660193, 'interval_power': 0.1127225043747894, 'min_width_factor': 0.9326874390147466}. Best is trial 11 with value: 2.225822499377296.\n",
      "[I 2026-07-02 14:59:45,248] Trial 42 finished with value: 2.1049857811517576 and parameters: {'aci_target': 0.07877143164437117, 'aci_step_size': 0.01835134737160963, 'interval_scale': 0.8656448965098974, 'interval_power': 0.2336321179972376, 'min_width_factor': 0.7739146071443561}. Best is trial 42 with value: 2.1049857811517576.\n",
      "[I 2026-07-02 14:59:45,403] Trial 43 finished with value: 2.1167198398751665 and parameters: {'aci_target': 0.080982389623563, 'aci_step_size': 0.011643662335209422, 'interval_scale': 0.8087451451144565, 'interval_power': 0.23098895739895542, 'min_width_factor': 0.7800095426667341}. Best is trial 42 with value: 2.1049857811517576.\n",
      "[I 2026-07-02 14:59:45,557] Trial 44 finished with value: 9.03844227309715 and parameters: {'aci_target': 0.07480935297549628, 'aci_step_size': 0.012822214018791843, 'interval_scale': 0.8336990530197308, 'interval_power': 1.0171729319652418, 'min_width_factor': 0.49233619688410935}. Best is trial 42 with value: 2.1049857811517576.\n",
      "[I 2026-07-02 14:59:45,717] Trial 45 finished with value: 3.0957802162140804 and parameters: {'aci_target': 0.047530998353234565, 'aci_step_size': 0.007697878959262796, 'interval_scale': 0.7584262948680501, 'interval_power': 0.37795141756551437, 'min_width_factor': 0.7752287939214162}. Best is trial 42 with value: 2.1049857811517576.\n",
      "[I 2026-07-02 14:59:45,880] Trial 46 finished with value: 2.506910087090278 and parameters: {'aci_target': 0.06101042326775884, 'aci_step_size': 0.0187771341332192, 'interval_scale': 0.908567836215519, 'interval_power': 0.23377144311003484, 'min_width_factor': 0.6975500057704329}. Best is trial 42 with value: 2.1049857811517576.\n",
      "[I 2026-07-02 14:59:46,032] Trial 47 finished with value: 5.610842515161471 and parameters: {'aci_target': 0.0799750525428742, 'aci_step_size': 0.012474561312110553, 'interval_scale': 1.3808558825015451, 'interval_power': 0.5345544837812009, 'min_width_factor': 0.821212431958822}. Best is trial 42 with value: 2.1049857811517576.\n",
      "[I 2026-07-02 14:59:46,184] Trial 48 finished with value: 2.330365627237487 and parameters: {'aci_target': 0.12905152343080065, 'aci_step_size': 0.007207581140734966, 'interval_scale': 0.8739499241911479, 'interval_power': 0.18861831257711256, 'min_width_factor': 1.0036123858251094}. Best is trial 42 with value: 2.1049857811517576.\n",
      "[I 2026-07-02 14:59:46,343] Trial 49 finished with value: 4.948388546209372 and parameters: {'aci_target': 0.18678935365018534, 'aci_step_size': 0.010050161931475602, 'interval_scale': 0.9517081772085287, 'interval_power': 0.0290305385560935, 'min_width_factor': 0.202253576788046}. Best is trial 42 with value: 2.1049857811517576.\n",
      "[I 2026-07-02 14:59:46,497] Trial 50 finished with value: 2.3581049792590276 and parameters: {'aci_target': 0.16068234813606433, 'aci_step_size': 0.01844593529803751, 'interval_scale': 1.2350655582951597, 'interval_power': 0.2797488262127642, 'min_width_factor': 1.0834418607403042}. Best is trial 42 with value: 2.1049857811517576.\n",
      "[I 2026-07-02 14:59:46,649] Trial 51 finished with value: 2.184909753746986 and parameters: {'aci_target': 0.08477967825338761, 'aci_step_size': 0.01337461449646791, 'interval_scale': 1.0990008717660258, 'interval_power': 0.15366503195873144, 'min_width_factor': 0.8450000842384346}. Best is trial 42 with value: 2.1049857811517576.\n",
      "[I 2026-07-02 14:59:46,803] Trial 52 finished with value: 3.5396576426964765 and parameters: {'aci_target': 0.06875989749399725, 'aci_step_size': 0.011846030678675158, 'interval_scale': 1.605508915284561, 'interval_power': 0.1633406629577124, 'min_width_factor': 0.8426400275038383}. Best is trial 42 with value: 2.1049857811517576.\n",
      "[I 2026-07-02 14:59:46,959] Trial 53 finished with value: 4.125682277892691 and parameters: {'aci_target': 0.08750619157630635, 'aci_step_size': 0.014885478660041572, 'interval_scale': 1.9030363435899214, 'interval_power': 0.2197457359328687, 'min_width_factor': 0.7370819255961246}. Best is trial 42 with value: 2.1049857811517576.\n",
      "[I 2026-07-02 14:59:47,112] Trial 54 finished with value: 2.301422200421794 and parameters: {'aci_target': 0.09726382797159461, 'aci_step_size': 0.009552043971257088, 'interval_scale': 1.4304904220098371, 'interval_power': 0.051726698047115875, 'min_width_factor': 0.6238522328227083}. Best is trial 42 with value: 2.1049857811517576.\n",
      "[I 2026-07-02 14:59:47,264] Trial 55 finished with value: 2.2691161402868336 and parameters: {'aci_target': 0.07955164010962579, 'aci_step_size': 0.014193272846662558, 'interval_scale': 1.1461499334786251, 'interval_power': 0.1385694598256889, 'min_width_factor': 0.004001941915921958}. Best is trial 42 with value: 2.1049857811517576.\n",
      "[I 2026-07-02 14:59:47,422] Trial 56 finished with value: 3.6466155456568052 and parameters: {'aci_target': 0.036295492395921, 'aci_step_size': 0.018569469971442685, 'interval_scale': 0.8477533854106957, 'interval_power': 0.3236137492281372, 'min_width_factor': 0.9848016209888796}. Best is trial 42 with value: 2.1049857811517576.\n",
      "[I 2026-07-02 14:59:47,578] Trial 57 finished with value: 2.2063810444916085 and parameters: {'aci_target': 0.1701837317953069, 'aci_step_size': 0.057153042621273284, 'interval_scale': 0.9859338108723203, 'interval_power': 0.41578646226932287, 'min_width_factor': 0.8004987867534796}. Best is trial 42 with value: 2.1049857811517576.\n",
      "[I 2026-07-02 14:59:47,735] Trial 58 finished with value: 2.311953333885148 and parameters: {'aci_target': 0.16692230889581208, 'aci_step_size': 0.05795418511407445, 'interval_scale': 0.9663920328921518, 'interval_power': 0.45049628741270087, 'min_width_factor': 0.7971120546712348}. Best is trial 42 with value: 2.1049857811517576.\n",
      "[I 2026-07-02 14:59:47,890] Trial 59 finished with value: 4.41155889416293 and parameters: {'aci_target': 0.058921995356781616, 'aci_step_size': 0.033215855601317686, 'interval_scale': 0.7501106056731668, 'interval_power': 0.6134762383541942, 'min_width_factor': 0.6884306217369724}. Best is trial 42 with value: 2.1049857811517576.\n",
      "[I 2026-07-02 14:59:48,043] Trial 60 finished with value: 4.941980280539666 and parameters: {'aci_target': 0.18181392173881916, 'aci_step_size': 0.008513301201531381, 'interval_scale': 1.1806490894726567, 'interval_power': 0.7370577846138044, 'min_width_factor': 0.5309492206588523}. Best is trial 42 with value: 2.1049857811517576.\n",
      "[I 2026-07-02 14:59:48,206] Trial 61 finished with value: 3.35458914677228 and parameters: {'aci_target': 0.17135618091910856, 'aci_step_size': 0.011142738038262484, 'interval_scale': 1.5005377623601543, 'interval_power': 0.4036301856960851, 'min_width_factor': 0.8700559927908355}. Best is trial 42 with value: 2.1049857811517576.\n",
      "[I 2026-07-02 14:59:48,364] Trial 62 finished with value: 2.315755502909659 and parameters: {'aci_target': 0.1907728958078901, 'aci_step_size': 0.07053321598310797, 'interval_scale': 0.8145119759693868, 'interval_power': 0.23461904393783256, 'min_width_factor': 0.9597820128416269}. Best is trial 42 with value: 2.1049857811517576.\n",
      "[I 2026-07-02 14:59:48,522] Trial 63 finished with value: 2.7841832249452096 and parameters: {'aci_target': 0.15428214981615584, 'aci_step_size': 0.01690358554709001, 'interval_scale': 1.0206702071610272, 'interval_power': 0.14160088699601114, 'min_width_factor': 0.817725789235258}. Best is trial 42 with value: 2.1049857811517576.\n",
      "[I 2026-07-02 14:59:48,680] Trial 64 finished with value: 2.7908464633741117 and parameters: {'aci_target': 0.09140712005736462, 'aci_step_size': 0.02742426196583358, 'interval_scale': 1.0997544582339112, 'interval_power': 0.3298735750385439, 'min_width_factor': 0.873884465049519}. Best is trial 42 with value: 2.1049857811517576.\n",
      "[I 2026-07-02 14:59:48,832] Trial 65 finished with value: 2.8786254176610213 and parameters: {'aci_target': 0.1163072893932513, 'aci_step_size': 0.0216512506903865, 'interval_scale': 0.9230192724589334, 'interval_power': 0.02381178079830136, 'min_width_factor': 0.7468941446983991}. Best is trial 42 with value: 2.1049857811517576.\n",
      "[I 2026-07-02 14:59:48,984] Trial 66 finished with value: 2.347437965364287 and parameters: {'aci_target': 0.18545819527767843, 'aci_step_size': 0.08965187142687372, 'interval_scale': 1.247002175906835, 'interval_power': 0.27884846262842244, 'min_width_factor': 1.0548266375995246}. Best is trial 42 with value: 2.1049857811517576.\n",
      "[I 2026-07-02 14:59:49,139] Trial 67 finished with value: 3.6924777737066257 and parameters: {'aci_target': 0.06655709207884183, 'aci_step_size': 0.058333512603105236, 'interval_scale': 1.549024291645575, 'interval_power': 0.17712708083199263, 'min_width_factor': 0.3580221358708795}. Best is trial 42 with value: 2.1049857811517576.\n",
      "[I 2026-07-02 14:59:49,294] Trial 68 finished with value: 2.243989987926712 and parameters: {'aci_target': 0.14305316518592326, 'aci_step_size': 0.12211291794390151, 'interval_scale': 1.7702570313109849, 'interval_power': 0.10630708594007678, 'min_width_factor': 0.9498469337855937}. Best is trial 42 with value: 2.1049857811517576.\n",
      "[I 2026-07-02 14:59:49,450] Trial 69 finished with value: 6.873185144301028 and parameters: {'aci_target': 0.07453021457415164, 'aci_step_size': 0.13475869097715745, 'interval_scale': 2.3517944541351725, 'interval_power': 0.4798695268272851, 'min_width_factor': 0.6945539753209997}. Best is trial 42 with value: 2.1049857811517576.\n",
      "[I 2026-07-02 14:59:49,610] Trial 70 finished with value: 11.1082871977368 and parameters: {'aci_target': 0.1402285364625765, 'aci_step_size': 0.11715853928290641, 'interval_scale': 1.9811242040348318, 'interval_power': 0.9079920017711085, 'min_width_factor': 0.7945817212705805}. Best is trial 42 with value: 2.1049857811517576.\n",
      "[I 2026-07-02 14:59:49,768] Trial 71 finished with value: 2.3133306613584277 and parameters: {'aci_target': 0.14878041492952918, 'aci_step_size': 0.15220596389300386, 'interval_scale': 1.727436920713217, 'interval_power': 0.08684143725259036, 'min_width_factor': 0.9513420338119365}. Best is trial 42 with value: 2.1049857811517576.\n",
      "[I 2026-07-02 14:59:49,925] Trial 72 finished with value: 2.741337181337361 and parameters: {'aci_target': 0.15544208532322346, 'aci_step_size': 0.19672743322440797, 'interval_scale': 1.3432576216315564, 'interval_power': 0.11610069021285128, 'min_width_factor': 0.849860321941145}. Best is trial 42 with value: 2.1049857811517576.\n",
      "[I 2026-07-02 14:59:50,090] Trial 73 finished with value: 2.207411575303626 and parameters: {'aci_target': 0.1712750195717017, 'aci_step_size': 0.09633080309016624, 'interval_scale': 1.4156723465408196, 'interval_power': 0.20311579392894222, 'min_width_factor': 0.9087913705424587}. Best is trial 42 with value: 2.1049857811517576.\n",
      "[I 2026-07-02 14:59:50,250] Trial 74 finished with value: 2.7154214465579734 and parameters: {'aci_target': 0.16923526051168183, 'aci_step_size': 0.0471322563966786, 'interval_scale': 1.7982920024373816, 'interval_power': 0.20864618086001135, 'min_width_factor': 0.9033963416515267}. Best is trial 42 with value: 2.1049857811517576.\n",
      "[I 2026-07-02 14:59:50,407] Trial 75 finished with value: 2.2654071658031842 and parameters: {'aci_target': 0.19527350605179894, 'aci_step_size': 0.07051728655562442, 'interval_scale': 1.4038760866851185, 'interval_power': 0.25673196615367905, 'min_width_factor': 1.0279806289350077}. Best is trial 42 with value: 2.1049857811517576.\n",
      "[I 2026-07-02 14:59:50,567] Trial 76 finished with value: 11.926194207787374 and parameters: {'aci_target': 0.1766484922457548, 'aci_step_size': 0.03606224507308378, 'interval_scale': 1.0476944559229502, 'interval_power': 1.2409988234244256, 'min_width_factor': 1.122727296388675}. Best is trial 42 with value: 2.1049857811517576.\n",
      "[I 2026-07-02 14:59:50,723] Trial 77 finished with value: 2.911454592524685 and parameters: {'aci_target': 0.16407591521990178, 'aci_step_size': 0.0303987041950207, 'interval_scale': 1.1581494781926975, 'interval_power': 0.06168944425120593, 'min_width_factor': 0.7233860596452754}. Best is trial 42 with value: 2.1049857811517576.\n",
      "[I 2026-07-02 14:59:50,881] Trial 78 finished with value: 2.1033824896857083 and parameters: {'aci_target': 0.10055558656590287, 'aci_step_size': 0.0931637109572904, 'interval_scale': 0.9937043070201186, 'interval_power': 0.35223167205773226, 'min_width_factor': 0.6307085761327468}. Best is trial 78 with value: 2.1033824896857083.\n",
      "[I 2026-07-02 14:59:51,042] Trial 79 finished with value: 2.0205259132099602 and parameters: {'aci_target': 0.08620371834931612, 'aci_step_size': 0.08732793893779943, 'interval_scale': 0.8013851892636603, 'interval_power': 0.34187536444265254, 'min_width_factor': 0.6407358354746109}. Best is trial 79 with value: 2.0205259132099602.\n",
      "[I 2026-07-02 14:59:51,197] Trial 80 finished with value: 2.0550689994807843 and parameters: {'aci_target': 0.08525234537652748, 'aci_step_size': 0.09268478922038159, 'interval_scale': 0.7950929137719492, 'interval_power': 0.35254465033338644, 'min_width_factor': 0.6294261240042912}. Best is trial 79 with value: 2.0205259132099602.\n",
      "[I 2026-07-02 14:59:51,359] Trial 81 finished with value: 2.196795448748035 and parameters: {'aci_target': 0.08396786772664694, 'aci_step_size': 0.09568120403016697, 'interval_scale': 0.8152559047604132, 'interval_power': 0.369756745196825, 'min_width_factor': 0.6046546020344342}. Best is trial 79 with value: 2.0205259132099602.\n",
      "[I 2026-07-02 14:59:51,522] Trial 82 finished with value: 2.0359882638650597 and parameters: {'aci_target': 0.08472028479560652, 'aci_step_size': 0.10534355236124195, 'interval_scale': 0.7970813893374414, 'interval_power': 0.3630405845703488, 'min_width_factor': 0.596448323972598}. Best is trial 79 with value: 2.0205259132099602.\n",
      "[I 2026-07-02 14:59:51,676] Trial 83 finished with value: 2.260171847332708 and parameters: {'aci_target': 0.08446501165558576, 'aci_step_size': 0.09079976712101308, 'interval_scale': 0.7958284144329085, 'interval_power': 0.3987886386035099, 'min_width_factor': 0.6003448838113525}. Best is trial 79 with value: 2.0205259132099602.\n",
      "[I 2026-07-02 14:59:51,834] Trial 84 finished with value: 2.0144276554179292 and parameters: {'aci_target': 0.09498695829729731, 'aci_step_size': 0.08186369054085597, 'interval_scale': 0.8737788871973025, 'interval_power': 0.35725332531685516, 'min_width_factor': 0.523436062707766}. Best is trial 84 with value: 2.0144276554179292.\n",
      "[I 2026-07-02 14:59:51,990] Trial 85 finished with value: 2.4036682954628614 and parameters: {'aci_target': 0.10256756883126826, 'aci_step_size': 0.11070830922500297, 'interval_scale': 0.8777409936922635, 'interval_power': 0.4974830235378939, 'min_width_factor': 0.529132517352254}. Best is trial 84 with value: 2.0144276554179292.\n",
      "[I 2026-07-02 14:59:52,147] Trial 86 finished with value: 2.056385464403711 and parameters: {'aci_target': 0.08881235708008345, 'aci_step_size': 0.07753254793214623, 'interval_scale': 0.8060659705082467, 'interval_power': 0.3585906162522068, 'min_width_factor': 0.653196807269785}. Best is trial 84 with value: 2.0144276554179292.\n",
      "[I 2026-07-02 14:59:52,304] Trial 87 finished with value: 2.0106447596252064 and parameters: {'aci_target': 0.09518143943811314, 'aci_step_size': 0.07517369179520299, 'interval_scale': 0.8695702991194557, 'interval_power': 0.33036482786464944, 'min_width_factor': 0.6507992041348496}. Best is trial 87 with value: 2.0106447596252064.\n",
      "[I 2026-07-02 14:59:52,463] Trial 88 finished with value: 2.0120806707243517 and parameters: {'aci_target': 0.11093332148739635, 'aci_step_size': 0.08291783980619585, 'interval_scale': 0.8702319101335171, 'interval_power': 0.3482524067801727, 'min_width_factor': 0.6585943869677441}. Best is trial 87 with value: 2.0106447596252064.\n",
      "[I 2026-07-02 14:59:52,618] Trial 89 finished with value: 2.5024751334077275 and parameters: {'aci_target': 0.11094174155967118, 'aci_step_size': 0.08038826481754521, 'interval_scale': 0.8716303857878855, 'interval_power': 0.2994768902597903, 'min_width_factor': 0.42073077963623495}. Best is trial 87 with value: 2.0106447596252064.\n",
      "[I 2026-07-02 14:59:52,776] Trial 90 finished with value: 2.173306989297368 and parameters: {'aci_target': 0.0943971213810997, 'aci_step_size': 0.07307794250933193, 'interval_scale': 0.9148854922712744, 'interval_power': 0.3561897520130913, 'min_width_factor': 0.648676196988308}. Best is trial 87 with value: 2.0106447596252064.\n",
      "[I 2026-07-02 14:59:52,933] Trial 91 finished with value: 2.4637317669935515 and parameters: {'aci_target': 0.10130123242168766, 'aci_step_size': 0.10586669201356018, 'interval_scale': 0.7861345121357084, 'interval_power': 0.35636641979143713, 'min_width_factor': 0.5368339217354942}. Best is trial 87 with value: 2.0106447596252064.\n",
      "[I 2026-07-02 14:59:53,089] Trial 92 finished with value: 2.421689394984458 and parameters: {'aci_target': 0.0903745745175207, 'aci_step_size': 0.08364460436969075, 'interval_scale': 0.8514084380029824, 'interval_power': 0.4384617884805097, 'min_width_factor': 0.49232946118366727}. Best is trial 87 with value: 2.0106447596252064.\n",
      "[I 2026-07-02 14:59:53,245] Trial 93 finished with value: 2.168636808833638 and parameters: {'aci_target': 0.07806016862179399, 'aci_step_size': 0.061981693803996506, 'interval_scale': 0.7842150901612766, 'interval_power': 0.33420562857055375, 'min_width_factor': 0.5751322878649044}. Best is trial 87 with value: 2.0106447596252064.\n",
      "[I 2026-07-02 14:59:53,406] Trial 94 finished with value: 2.058038127555381 and parameters: {'aci_target': 0.0948717923574195, 'aci_step_size': 0.07786819334169859, 'interval_scale': 0.9796025318538805, 'interval_power': 0.2984833222463803, 'min_width_factor': 0.6564861440497439}. Best is trial 87 with value: 2.0106447596252064.\n",
