      "[I 2026-07-02 16:32:48,509] Trial 90 finished with value: inf and parameters: {'target_miscoverage': 0.1485071917661483, 'aci_step_size': 0.012258437609411596, 'interval_scale': 2.331922785176078}. Best is trial 0 with value: inf.\n",
      "[I 2026-07-02 16:32:48,524] Trial 91 finished with value: inf and parameters: {'target_miscoverage': 0.10759947616422802, 'aci_step_size': 0.014795676750012608, 'interval_scale': 0.5505917071014921}. Best is trial 0 with value: inf.\n",
      "[I 2026-07-02 16:32:48,540] Trial 92 finished with value: inf and parameters: {'target_miscoverage': 0.11580122314244205, 'aci_step_size': 0.0966196486506202, 'interval_scale': 0.7469172130948624}. Best is trial 0 with value: inf.\n",
      "[I 2026-07-02 16:32:48,555] Trial 93 finished with value: inf and parameters: {'target_miscoverage': 0.10268977193900383, 'aci_step_size': 0.12380651255372423, 'interval_scale': 0.97789871034247}. Best is trial 0 with value: inf.\n",
      "[I 2026-07-02 16:32:48,572] Trial 94 finished with value: inf and parameters: {'target_miscoverage': 0.09868772437184514, 'aci_step_size': 0.05008265757018938, 'interval_scale': 3.193060657205495}. Best is trial 0 with value: inf.\n",
      "[I 2026-07-02 16:32:48,587] Trial 95 finished with value: inf and parameters: {'target_miscoverage': 0.13956982038478183, 'aci_step_size': 0.01876096814516035, 'interval_scale': 0.8364118130410904}. Best is trial 0 with value: inf.\n",
      "[I 2026-07-02 16:32:48,604] Trial 96 finished with value: inf and parameters: {'target_miscoverage': 0.12030943787236323, 'aci_step_size': 0.11287429798666819, 'interval_scale': 0.5074824536873599}. Best is trial 0 with value: inf.\n",
      "[I 2026-07-02 16:32:48,619] Trial 97 finished with value: inf and parameters: {'target_miscoverage': 0.07204652495344196, 'aci_step_size': 0.026599624795395935, 'interval_scale': 0.6280821350099542}. Best is trial 0 with value: inf.\n",
      "[I 2026-07-02 16:32:48,636] Trial 98 finished with value: inf and parameters: {'target_miscoverage': 0.08641269141781455, 'aci_step_size': 0.0767158413039601, 'interval_scale': 2.0975161673730276}. Best is trial 0 with value: inf.\n",
      "[I 2026-07-02 16:32:48,651] Trial 99 finished with value: inf and parameters: {'target_miscoverage': 0.12517665206615947, 'aci_step_size': 0.010914209164334051, 'interval_scale': 5.281498431508094}. Best is trial 0 with value: inf.\n",
      "[I 2026-07-02 16:32:48,668] Trial 100 finished with value: inf and parameters: {'target_miscoverage': 0.010233589885602731, 'aci_step_size': 0.03448254889794364, 'interval_scale': 6.0421976248986}. Best is trial 0 with value: inf.\n",
      "[I 2026-07-02 16:32:48,683] Trial 101 finished with value: inf and parameters: {'target_miscoverage': 0.18209585670577, 'aci_step_size': 0.03873492643815818, 'interval_scale': 7.504045666104581}. Best is trial 0 with value: inf.\n",
      "[I 2026-07-02 16:32:48,700] Trial 102 finished with value: inf and parameters: {'target_miscoverage': 0.16861717629809478, 'aci_step_size': 0.07257679325456899, 'interval_scale': 7.00661323076563}. Best is trial 0 with value: inf.\n",
      "[I 2026-07-02 16:32:48,716] Trial 103 finished with value: inf and parameters: {'target_miscoverage': 0.1568255785496516, 'aci_step_size': 0.06096124318808268, 'interval_scale': 2.8024365868310976}. Best is trial 0 with value: inf.\n",
      "[I 2026-07-02 16:32:48,731] Trial 104 finished with value: inf and parameters: {'target_miscoverage': 0.015282619876128254, 'aci_step_size': 0.03110618946944201, 'interval_scale': 2.4796839299193856}. Best is trial 0 with value: inf.\n",
      "[I 2026-07-02 16:32:48,747] Trial 105 finished with value: inf and parameters: {'target_miscoverage': 0.18924210784725604, 'aci_step_size': 0.007698036283877827, 'interval_scale': 5.802480229020399}. Best is trial 0 with value: inf.\n",
      "[I 2026-07-02 16:32:48,763] Trial 106 finished with value: inf and parameters: {'target_miscoverage': 0.08975610352527003, 'aci_step_size': 0.013588799808646157, 'interval_scale': 7.247652211596723}. Best is trial 0 with value: inf.\n",
      "[I 2026-07-02 16:32:48,779] Trial 107 finished with value: inf and parameters: {'target_miscoverage': 0.09617475103798973, 'aci_step_size': 0.009339665770937764, 'interval_scale': 1.7677099696413017}. Best is trial 0 with value: inf.\n",
      "[I 2026-07-02 16:32:48,795] Trial 108 finished with value: inf and parameters: {'target_miscoverage': 0.07954870628542289, 'aci_step_size': 0.020752427481950428, 'interval_scale': 6.4223687070314535}. Best is trial 0 with value: inf.\n",
      "[I 2026-07-02 16:32:48,812] Trial 109 finished with value: inf and parameters: {'target_miscoverage': 0.10565899019918236, 'aci_step_size': 0.014799980449075753, 'interval_scale': 0.912405020034702}. Best is trial 0 with value: inf.\n",
      "[I 2026-07-02 16:32:48,829] Trial 110 finished with value: inf and parameters: {'target_miscoverage': 0.1125492893599892, 'aci_step_size': 0.0066754721840215575, 'interval_scale': 0.7870287353992835}. Best is trial 0 with value: inf.\n",
      "[I 2026-07-02 16:32:48,846] Trial 111 finished with value: inf and parameters: {'target_miscoverage': 0.1281278087587827, 'aci_step_size': 0.17210133770222272, 'interval_scale': 4.140918010394385}. Best is trial 0 with value: inf.\n",
      "[I 2026-07-02 16:32:48,863] Trial 112 finished with value: inf and parameters: {'target_miscoverage': 0.13606565595687647, 'aci_step_size': 0.19385080950454203, 'interval_scale': 3.5936896338104494}. Best is trial 0 with value: inf.\n",
      "[I 2026-07-02 16:32:48,880] Trial 113 finished with value: inf and parameters: {'target_miscoverage': 0.19132583390379748, 'aci_step_size': 0.15304487614829765, 'interval_scale': 7.984645627385722}. Best is trial 0 with value: inf.\n",
      "[I 2026-07-02 16:32:48,896] Trial 114 finished with value: inf and parameters: {'target_miscoverage': 0.05289141344310362, 'aci_step_size': 0.1615528260882976, 'interval_scale': 3.1463320473174528}. Best is trial 0 with value: inf.\n",
      "[I 2026-07-02 16:32:48,914] Trial 115 finished with value: inf and parameters: {'target_miscoverage': 0.14761034289997746, 'aci_step_size': 0.012636868936276474, 'interval_scale': 4.476376533680061}. Best is trial 0 with value: inf.\n",
      "[I 2026-07-02 16:32:48,930] Trial 116 finished with value: inf and parameters: {'target_miscoverage': 0.13176190171350766, 'aci_step_size': 0.13961039223434654, 'interval_scale': 5.379822795429417}. Best is trial 0 with value: inf.\n",
      "[I 2026-07-02 16:32:48,946] Trial 117 finished with value: inf and parameters: {'target_miscoverage': 0.17792663230542527, 'aci_step_size': 0.01716344052177723, 'interval_scale': 0.5861522517494614}. Best is trial 0 with value: inf.\n",
      "[I 2026-07-02 16:32:48,963] Trial 118 finished with value: inf and parameters: {'target_miscoverage': 0.07547731993148044, 'aci_step_size': 0.10057755784771749, 'interval_scale': 0.6576725828840922}. Best is trial 0 with value: inf.\n",
      "[I 2026-07-02 16:32:48,980] Trial 119 finished with value: inf and parameters: {'target_miscoverage': 0.10337124429567363, 'aci_step_size': 0.12954567016959243, 'interval_scale': 2.9816877120431404}. Best is trial 0 with value: inf.\n",
      "[I 2026-07-02 16:32:48,996] Trial 120 finished with value: inf and parameters: {'target_miscoverage': 0.02557912149774917, 'aci_step_size': 0.18078021141393916, 'interval_scale': 3.423617800211539}. Best is trial 0 with value: inf.\n",
      "[I 2026-07-02 16:32:49,013] Trial 121 finished with value: inf and parameters: {'target_miscoverage': 0.05961175759417938, 'aci_step_size': 0.04186226722189741, 'interval_scale': 1.5616211381235476}. Best is trial 0 with value: inf.\n",
      "[I 2026-07-02 16:32:49,029] Trial 122 finished with value: inf and parameters: {'target_miscoverage': 0.03872858622717683, 'aci_step_size': 0.058002157556810326, 'interval_scale': 1.8749668222544202}. Best is trial 0 with value: inf.\n",
      "[I 2026-07-02 16:32:49,046] Trial 123 finished with value: inf and parameters: {'target_miscoverage': 0.04497704274508255, 'aci_step_size': 0.052865539030461754, 'interval_scale': 1.285165394928675}. Best is trial 0 with value: inf.\n",
      "[I 2026-07-02 16:32:49,062] Trial 124 finished with value: inf and parameters: {'target_miscoverage': 0.19445002583384144, 'aci_step_size': 0.03001824539533237, 'interval_scale': 2.695088801057637}. Best is trial 0 with value: inf.\n",
      "[I 2026-07-02 16:32:49,079] Trial 125 finished with value: inf and parameters: {'target_miscoverage': 0.1620474285190777, 'aci_step_size': 0.06669289652991144, 'interval_scale': 1.1881675795478641}. Best is trial 0 with value: inf.\n",
      "[I 2026-07-02 16:32:49,097] Trial 126 finished with value: inf and parameters: {'target_miscoverage': 0.10937911793687674, 'aci_step_size': 0.043374059571426385, 'interval_scale': 1.6677307608998293}. Best is trial 0 with value: inf.\n",
      "[I 2026-07-02 16:32:49,113] Trial 127 finished with value: inf and parameters: {'target_miscoverage': 0.09398801428717214, 'aci_step_size': 0.09132579164144278, 'interval_scale': 1.0992233202476722}. Best is trial 0 with value: inf.\n",
      "[I 2026-07-02 16:32:49,130] Trial 128 finished with value: inf and parameters: {'target_miscoverage': 0.030497759591258618, 'aci_step_size': 0.015788616086021272, 'interval_scale': 0.695174460230235}. Best is trial 0 with value: inf.\n",
      "[I 2026-07-02 16:32:49,147] Trial 129 finished with value: inf and parameters: {'target_miscoverage': 0.09944613501032175, 'aci_step_size': 0.005314821896663342, 'interval_scale': 1.3854788957797923}. Best is trial 0 with value: inf.\n",
      "[I 2026-07-02 16:32:49,165] Trial 130 finished with value: inf and parameters: {'target_miscoverage': 0.06590098637503004, 'aci_step_size': 0.03669959072680126, 'interval_scale': 3.8028952346800784}. Best is trial 0 with value: inf.\n",
      "[I 2026-07-02 16:32:49,182] Trial 131 finished with value: inf and parameters: {'target_miscoverage': 0.07954290913563451, 'aci_step_size': 0.00564460164626077, 'interval_scale': 4.682461484947113}. Best is trial 0 with value: inf.\n",
      "[I 2026-07-02 16:32:49,200] Trial 132 finished with value: inf and parameters: {'target_miscoverage': 0.08590221991811146, 'aci_step_size': 0.04625687810322167, 'interval_scale': 2.2808640023692464}. Best is trial 0 with value: inf.\n",
      "[I 2026-07-02 16:32:49,218] Trial 133 finished with value: inf and parameters: {'target_miscoverage': 0.06994949529760072, 'aci_step_size': 0.011558628948239641, 'interval_scale': 4.163717578832393}. Best is trial 0 with value: inf.\n",
      "[I 2026-07-02 16:32:49,235] Trial 134 finished with value: inf and parameters: {'target_miscoverage': 0.09151757613842089, 'aci_step_size': 0.024063355370940023, 'interval_scale': 0.8577702875206958}. Best is trial 0 with value: inf.\n",
      "[I 2026-07-02 16:32:49,252] Trial 135 finished with value: inf and parameters: {'target_miscoverage': 0.03560051721687519, 'aci_step_size': 0.006421295579401716, 'interval_scale': 2.0854874065508437}. Best is trial 0 with value: inf.\n",
      "[I 2026-07-02 16:32:49,269] Trial 136 finished with value: inf and parameters: {'target_miscoverage': 0.17078001130743728, 'aci_step_size': 0.11138335589246856, 'interval_scale': 0.8016208475288855}. Best is trial 0 with value: inf.\n",
      "[I 2026-07-02 16:32:49,288] Trial 137 finished with value: inf and parameters: {'target_miscoverage': 0.048906047037696125, 'aci_step_size': 0.008652676114130967, 'interval_scale': 6.687168152382182}. Best is trial 0 with value: inf.\n",
      "[I 2026-07-02 16:32:49,304] Trial 138 finished with value: inf and parameters: {'target_miscoverage': 0.08114182498853797, 'aci_step_size': 0.007496906451423063, 'interval_scale': 4.942793640395841}. Best is trial 0 with value: inf.\n",
      "[I 2026-07-02 16:32:49,321] Trial 139 finished with value: inf and parameters: {'target_miscoverage': 0.13930635126109106, 'aci_step_size': 0.005504547550751774, 'interval_scale': 3.916484968847154}. Best is trial 0 with value: inf.\n",
      "[I 2026-07-02 16:32:49,338] Trial 140 finished with value: inf and parameters: {'target_miscoverage': 0.02181766296184725, 'aci_step_size': 0.006059960792439972, 'interval_scale': 0.7274954637904363}. Best is trial 0 with value: inf.\n",
      "[I 2026-07-02 16:32:49,355] Trial 141 finished with value: inf and parameters: {'target_miscoverage': 0.12366427925028409, 'aci_step_size': 0.01934077960647632, 'interval_scale': 2.5011384061194253}. Best is trial 0 with value: inf.\n",
      "[I 2026-07-02 16:32:49,374] Trial 142 finished with value: inf and parameters: {'target_miscoverage': 0.11501679489663567, 'aci_step_size': 0.05072945363153967, 'interval_scale': 0.5937682710945739}. Best is trial 0 with value: inf.\n",
      "[I 2026-07-02 16:32:49,392] Trial 143 finished with value: inf and parameters: {'target_miscoverage': 0.144468277279646, 'aci_step_size': 0.19687203043292084, 'interval_scale': 0.56503292854453}. Best is trial 0 with value: inf.\n",
      "[I 2026-07-02 16:32:49,410] Trial 144 finished with value: inf and parameters: {'target_miscoverage': 0.131442388261098, 'aci_step_size': 0.005071645784544182, 'interval_scale': 0.5022439805428779}. Best is trial 0 with value: inf.\n",
      "[I 2026-07-02 16:32:49,429] Trial 145 finished with value: inf and parameters: {'target_miscoverage': 0.11870587155728855, 'aci_step_size': 0.018166563637494852, 'interval_scale': 0.6424206204180002}. Best is trial 0 with value: inf.\n",
      "[I 2026-07-02 16:32:49,446] Trial 146 finished with value: inf and parameters: {'target_miscoverage': 0.053113203678328454, 'aci_step_size': 0.023890076880525895, 'interval_scale': 0.9833991518279732}. Best is trial 0 with value: inf.\n",
      "[I 2026-07-02 16:32:49,463] Trial 147 finished with value: inf and parameters: {'target_miscoverage': 0.14130972212591955, 'aci_step_size': 0.010017436627343716, 'interval_scale': 4.376901975771689}. Best is trial 0 with value: inf.\n",
      "[I 2026-07-02 16:32:49,480] Trial 148 finished with value: inf and parameters: {'target_miscoverage': 0.12579083302645444, 'aci_step_size': 0.014299931874464258, 'interval_scale': 0.5415436063110104}. Best is trial 0 with value: inf.\n",
      "[I 2026-07-02 16:32:49,497] Trial 149 finished with value: inf and parameters: {'target_miscoverage': 0.15142401293458665, 'aci_step_size': 0.025200295027912042, 'interval_scale': 2.835995685184335}. Best is trial 0 with value: inf.\n",
      "[I 2026-07-02 16:32:49,514] Trial 150 finished with value: inf and parameters: {'target_miscoverage': 0.13632588013569016, 'aci_step_size': 0.16294088840992715, 'interval_scale': 2.220882960050711}. Best is trial 0 with value: inf.\n",
      "[I 2026-07-02 16:32:49,532] Trial 151 finished with value: inf and parameters: {'target_miscoverage': 0.08371945301247402, 'aci_step_size': 0.04741996764419594, 'interval_scale': 1.5056746103645455}. Best is trial 0 with value: inf.\n",
      "[I 2026-07-02 16:32:49,549] Trial 152 finished with value: inf and parameters: {'target_miscoverage': 0.15764098194877585, 'aci_step_size': 0.03598551181872013, 'interval_scale': 1.1787993706375453}. Best is trial 0 with value: inf.\n",
      "[I 2026-07-02 16:32:49,568] Trial 153 finished with value: inf and parameters: {'target_miscoverage': 0.09065830872084576, 'aci_step_size': 0.08388831181316904, 'interval_scale': 1.0765825414045216}. Best is trial 0 with value: inf.\n",
      "[I 2026-07-02 16:32:49,585] Trial 154 finished with value: inf and parameters: {'target_miscoverage': 0.06663093073872127, 'aci_step_size': 0.021215860934563093, 'interval_scale': 1.0210264666444266}. Best is trial 0 with value: inf.\n",
      "[I 2026-07-02 16:32:49,602] Trial 155 finished with value: inf and parameters: {'target_miscoverage': 0.06113918274987206, 'aci_step_size': 0.05730541726267497, 'interval_scale': 0.8977472689827755}. Best is trial 0 with value: inf.\n",
      "[I 2026-07-02 16:32:49,621] Trial 156 finished with value: inf and parameters: {'target_miscoverage': 0.07788403062527409, 'aci_step_size': 0.012619960080047394, 'interval_scale': 0.9504686294983915}. Best is trial 0 with value: inf.\n",
      "[I 2026-07-02 16:32:49,638] Trial 157 finished with value: inf and parameters: {'target_miscoverage': 0.04105812797276521, 'aci_step_size': 0.03203517525667274, 'interval_scale': 1.3143425395085389}. Best is trial 0 with value: inf.\n",
      "[I 2026-07-02 16:32:49,656] Trial 158 finished with value: inf and parameters: {'target_miscoverage': 0.07551651750562244, 'aci_step_size': 0.06683257114220789, 'interval_scale': 3.359495189593499}. Best is trial 0 with value: inf.\n",
      "[I 2026-07-02 16:32:49,673] Trial 159 finished with value: inf and parameters: {'target_miscoverage': 0.0687894452221413, 'aci_step_size': 0.11841224093202661, 'interval_scale': 5.665815147005012}. Best is trial 0 with value: inf.\n",
      "[I 2026-07-02 16:32:49,690] Trial 160 finished with value: inf and parameters: {'target_miscoverage': 0.07351894190728174, 'aci_step_size': 0.07204884877510642, 'interval_scale': 1.3601459949435484}. Best is trial 0 with value: inf.\n",
      "[I 2026-07-02 16:32:49,706] Trial 161 finished with value: inf and parameters: {'target_miscoverage': 0.10927214461472906, 'aci_step_size': 0.010925256051991019, 'interval_scale': 3.6881107677814553}. Best is trial 0 with value: inf.\n",
      "[I 2026-07-02 16:32:49,723] Trial 162 finished with value: inf and parameters: {'target_miscoverage': 0.12137790696147993, 'aci_step_size': 0.007001419159079709, 'interval_scale': 4.910603412828082}. Best is trial 0 with value: inf.\n",
      "[I 2026-07-02 16:32:49,740] Trial 163 finished with value: inf and parameters: {'target_miscoverage': 0.10057617899707758, 'aci_step_size': 0.009549484392361737, 'interval_scale': 4.37855043271161}. Best is trial 0 with value: inf.\n",
      "[I 2026-07-02 16:32:49,757] Trial 164 finished with value: inf and parameters: {'target_miscoverage': 0.13005548786136256, 'aci_step_size': 0.008102959878053406, 'interval_scale': 7.176727677460354}. Best is trial 0 with value: inf.\n",
      "[I 2026-07-02 16:32:49,774] Trial 165 finished with value: inf and parameters: {'target_miscoverage': 0.09692882773694403, 'aci_step_size': 0.1486283864420111, 'interval_scale': 3.1070599499027676}. Best is trial 0 with value: inf.\n",
      "[I 2026-07-02 16:32:49,791] Trial 166 finished with value: inf and parameters: {'target_miscoverage': 0.08728885541612941, 'aci_step_size': 0.10368335392026531, 'interval_scale': 5.971511532677381}. Best is trial 0 with value: inf.\n",
      "[I 2026-07-02 16:32:49,807] Trial 167 finished with value: inf and parameters: {'target_miscoverage': 0.05599694583615059, 'aci_step_size': 0.008877323772134247, 'interval_scale': 5.159063222842986}. Best is trial 0 with value: inf.\n",
      "[I 2026-07-02 16:32:49,825] Trial 168 finished with value: inf and parameters: {'target_miscoverage': 0.10530522507544189, 'aci_step_size': 0.013404797997237084, 'interval_scale': 6.437461899374061}. Best is trial 0 with value: inf.\n",
      "[I 2026-07-02 16:32:49,842] Trial 169 finished with value: inf and parameters: {'target_miscoverage': 0.1768199182118746, 'aci_step_size': 0.029138691723527437, 'interval_scale': 1.9922402910657213}. Best is trial 0 with value: inf.\n",
      "[I 2026-07-02 16:32:49,860] Trial 170 finished with value: inf and parameters: {'target_miscoverage': 0.0633265242021224, 'aci_step_size': 0.0059934071275287975, 'interval_scale': 1.2350082442760242}. Best is trial 0 with value: inf.\n",
      "[I 2026-07-02 16:32:49,877] Trial 171 finished with value: inf and parameters: {'target_miscoverage': 0.16522422562920375, 'aci_step_size': 0.03931091076297704, 'interval_scale': 1.8469216103959005}. Best is trial 0 with value: inf.\n",
      "[I 2026-07-02 16:32:49,894] Trial 172 finished with value: inf and parameters: {'target_miscoverage': 0.18345877146072978, 'aci_step_size': 0.04289982240912413, 'interval_scale': 1.4919979052050047}. Best is trial 0 with value: inf.\n",
      "[I 2026-07-02 16:32:49,917] Trial 173 finished with value: inf and parameters: {'target_miscoverage': 0.14568557819427916, 'aci_step_size': 0.077465300216167, 'interval_scale': 1.5998309889895457}. Best is trial 0 with value: inf.\n",
      "[I 2026-07-02 16:32:49,935] Trial 174 finished with value: inf and parameters: {'target_miscoverage': 0.17457945958812987, 'aci_step_size': 0.1317001452465373, 'interval_scale': 1.7153755126734656}. Best is trial 0 with value: inf.\n",
      "[I 2026-07-02 16:32:49,953] Trial 175 finished with value: inf and parameters: {'target_miscoverage': 0.13518072943154513, 'aci_step_size': 0.027143951901124445, 'interval_scale': 4.175658132502559}. Best is trial 0 with value: inf.\n",
      "[I 2026-07-02 16:32:49,970] Trial 176 finished with value: inf and parameters: {'target_miscoverage': 0.1134204152781, 'aci_step_size': 0.09500228387652106, 'interval_scale': 0.7507244021103201}. Best is trial 0 with value: inf.\n",
      "[I 2026-07-02 16:32:49,988] Trial 177 finished with value: inf and parameters: {'target_miscoverage': 0.016724687598280503, 'aci_step_size': 0.1781001900481828, 'interval_scale': 1.820433664113934}. Best is trial 0 with value: inf.\n",
      "[I 2026-07-02 16:32:50,005] Trial 178 finished with value: inf and parameters: {'target_miscoverage': 0.1172492802204355, 'aci_step_size': 0.011729927533652665, 'interval_scale': 2.5864612274160703}. Best is trial 0 with value: inf.\n",
      "[I 2026-07-02 16:32:50,023] Trial 179 finished with value: inf and parameters: {'target_miscoverage': 0.1263758743985179, 'aci_step_size': 0.007708657499040686, 'interval_scale': 0.80620896589787}. Best is trial 0 with value: inf.\n",
