      "[I 2026-07-02 16:33:14,759] Trial 96 finished with value: 8.523274572606345 and parameters: {'aci_target': 0.18668862877655495, 'aci_step_size': 0.006845987489915036, 'interval_scale': 0.7964832790220449, 'interval_power': 0.10492990648895964, 'min_width_factor': 0.8196631998568591}. Best is trial 64 with value: 6.722420918001139.\n",
      "[I 2026-07-02 16:33:15,006] Trial 97 finished with value: 8.513501808501534 and parameters: {'aci_target': 0.17492028308967697, 'aci_step_size': 0.009830333045839267, 'interval_scale': 0.836944433025812, 'interval_power': 0.06662480404494125, 'min_width_factor': 0.8612623437263002}. Best is trial 64 with value: 6.722420918001139.\n",
      "[I 2026-07-02 16:33:15,252] Trial 98 finished with value: 8.784794267837809 and parameters: {'aci_target': 0.1637150520406046, 'aci_step_size': 0.007522891031045157, 'interval_scale': 0.751218331525635, 'interval_power': 0.13803996051008566, 'min_width_factor': 0.6886444022404281}. Best is trial 64 with value: 6.722420918001139.\n",
      "[I 2026-07-02 16:33:15,493] Trial 99 finished with value: 63.547885310907915 and parameters: {'aci_target': 0.16968942207496232, 'aci_step_size': 0.005819067135330128, 'interval_scale': 6.615436392400808, 'interval_power': 0.02774953762461301, 'min_width_factor': 0.951196430118805}. Best is trial 64 with value: 6.722420918001139.\n",
      "[I 2026-07-02 16:33:15,737] Trial 100 finished with value: 8.750995423260637 and parameters: {'aci_target': 0.19660487739862273, 'aci_step_size': 0.006605983037934881, 'interval_scale': 0.9054183686909638, 'interval_power': 0.0520750274458065, 'min_width_factor': 0.7459422575110182}. Best is trial 64 with value: 6.722420918001139.\n",
      "[I 2026-07-02 16:33:15,978] Trial 101 finished with value: 7.581035907540823 and parameters: {'aci_target': 0.18258972458371947, 'aci_step_size': 0.005002283525590917, 'interval_scale': 0.7869626413125127, 'interval_power': 0.040843355981771634, 'min_width_factor': 0.9068091305296045}. Best is trial 64 with value: 6.722420918001139.\n",
      "[I 2026-07-02 16:33:16,220] Trial 102 finished with value: 8.926880556207625 and parameters: {'aci_target': 0.180443210598291, 'aci_step_size': 0.006255818674782732, 'interval_scale': 0.8479923207762999, 'interval_power': 0.08967654556426433, 'min_width_factor': 1.019441381621486}. Best is trial 64 with value: 6.722420918001139.\n",
      "[I 2026-07-02 16:33:16,462] Trial 103 finished with value: 7.307479676731959 and parameters: {'aci_target': 0.18658267707126222, 'aci_step_size': 0.008181135311949592, 'interval_scale': 0.7904068195245528, 'interval_power': 0.016663531488843964, 'min_width_factor': 0.7982812374744526}. Best is trial 64 with value: 6.722420918001139.\n",
      "[I 2026-07-02 16:33:16,708] Trial 104 finished with value: 7.169970201439317 and parameters: {'aci_target': 0.19146135453546495, 'aci_step_size': 0.008050756341236694, 'interval_scale': 0.7959744493381847, 'interval_power': 0.000121091979278908, 'min_width_factor': 0.7981371361119809}. Best is trial 64 with value: 6.722420918001139.\n",
      "[I 2026-07-02 16:33:16,951] Trial 105 finished with value: 8.195121271114095 and parameters: {'aci_target': 0.19266224815204297, 'aci_step_size': 0.008435231505972099, 'interval_scale': 0.8851032838335823, 'interval_power': 0.01743402881374434, 'min_width_factor': 0.8831255116141926}. Best is trial 64 with value: 6.722420918001139.\n",
      "[I 2026-07-02 16:33:17,192] Trial 106 finished with value: 8.503350088321666 and parameters: {'aci_target': 0.18825770470190709, 'aci_step_size': 0.011099684923734716, 'interval_scale': 0.9423506469560542, 'interval_power': 0.000573090547888044, 'min_width_factor': 0.7944754065228092}. Best is trial 64 with value: 6.722420918001139.\n",
      "[I 2026-07-02 16:33:17,430] Trial 107 finished with value: 8.944520932942183 and parameters: {'aci_target': 0.1860800313807102, 'aci_step_size': 0.006948595589855766, 'interval_scale': 0.8305346815058621, 'interval_power': 0.10769918269767728, 'min_width_factor': 0.7652433726862228}. Best is trial 64 with value: 6.722420918001139.\n",
      "[I 2026-07-02 16:33:17,673] Trial 108 finished with value: 10.026997484240743 and parameters: {'aci_target': 0.1996040745780466, 'aci_step_size': 0.007704247706255754, 'interval_scale': 1.0095404245630348, 'interval_power': 0.07012925049066791, 'min_width_factor': 0.9887736695683085}. Best is trial 64 with value: 6.722420918001139.\n",
      "[I 2026-07-02 16:33:17,916] Trial 109 finished with value: 8.617875320123813 and parameters: {'aci_target': 0.1911354845212294, 'aci_step_size': 0.005402029478604348, 'interval_scale': 0.7892947598689753, 'interval_power': 0.1189242575733026, 'min_width_factor': 0.8383356704049261}. Best is trial 64 with value: 6.722420918001139.\n",
      "[I 2026-07-02 16:33:18,159] Trial 110 finished with value: 8.631266559278725 and parameters: {'aci_target': 0.18576333329913278, 'aci_step_size': 0.00904051055821067, 'interval_scale': 0.8629633111682636, 'interval_power': 0.061318323421187954, 'min_width_factor': 0.6210971537253759}. Best is trial 64 with value: 6.722420918001139.\n",
      "[I 2026-07-02 16:33:18,402] Trial 111 finished with value: 7.1545282457107895 and parameters: {'aci_target': 0.17915248120781344, 'aci_step_size': 0.010154764854687257, 'interval_scale': 0.7530885184329801, 'interval_power': 0.023696006252853785, 'min_width_factor': 0.7083916546971567}. Best is trial 64 with value: 6.722420918001139.\n",
      "[I 2026-07-02 16:33:18,647] Trial 112 finished with value: 7.492537318590723 and parameters: {'aci_target': 0.1801103795334504, 'aci_step_size': 0.008224159134722782, 'interval_scale': 0.7968246212901741, 'interval_power': 0.020580390690928096, 'min_width_factor': 0.814059206652222}. Best is trial 64 with value: 6.722420918001139.\n",
      "[I 2026-07-02 16:33:18,888] Trial 113 finished with value: 7.855039637665705 and parameters: {'aci_target': 0.17144441100713376, 'aci_step_size': 0.010058068830751098, 'interval_scale': 0.750246490287282, 'interval_power': 0.08027063818968483, 'min_width_factor': 0.752649537841436}. Best is trial 64 with value: 6.722420918001139.\n",
      "[I 2026-07-02 16:33:19,132] Trial 114 finished with value: 7.61266594025604 and parameters: {'aci_target': 0.17461664502142063, 'aci_step_size': 0.007375554929555573, 'interval_scale': 0.8322108699312644, 'interval_power': 0.00041765280332375226, 'min_width_factor': 0.852918018508}. Best is trial 64 with value: 6.722420918001139.\n",
      "[I 2026-07-02 16:33:19,372] Trial 115 finished with value: 8.750258845810256 and parameters: {'aci_target': 0.19682217584639422, 'aci_step_size': 0.005903053856204347, 'interval_scale': 0.9115045410688398, 'interval_power': 0.04972215024332108, 'min_width_factor': 0.5829816196656618}. Best is trial 64 with value: 6.722420918001139.\n",
      "[I 2026-07-02 16:33:19,618] Trial 116 finished with value: 7.372563476227831 and parameters: {'aci_target': 0.19228213809370104, 'aci_step_size': 0.006571109483503921, 'interval_scale': 0.7934609350622128, 'interval_power': 0.02304025818192197, 'min_width_factor': 0.7292155207075423}. Best is trial 64 with value: 6.722420918001139.\n",
      "[I 2026-07-02 16:33:19,858] Trial 117 finished with value: 7.844239763447998 and parameters: {'aci_target': 0.18004756736900007, 'aci_step_size': 0.008005601275869556, 'interval_scale': 0.8636464793805204, 'interval_power': 2.8699416788593307e-05, 'min_width_factor': 0.940477325315773}. Best is trial 64 with value: 6.722420918001139.\n",
      "[I 2026-07-02 16:33:20,102] Trial 118 finished with value: 8.409407427512011 and parameters: {'aci_target': 0.18843484697676158, 'aci_step_size': 0.00706395128751943, 'interval_scale': 0.8178818344433606, 'interval_power': 0.08359540495211251, 'min_width_factor': 0.6635172451671818}. Best is trial 64 with value: 6.722420918001139.\n",
      "[I 2026-07-02 16:33:20,368] Trial 119 finished with value: 10.730632719531254 and parameters: {'aci_target': 0.18499311391210838, 'aci_step_size': 0.008817765945575326, 'interval_scale': 0.9322584105056675, 'interval_power': 0.1426627450050833, 'min_width_factor': 0.7830300212397237}. Best is trial 64 with value: 6.722420918001139.\n",
      "[I 2026-07-02 16:33:20,611] Trial 120 finished with value: 7.927614843743817 and parameters: {'aci_target': 0.1676252087625377, 'aci_step_size': 0.010763402923361866, 'interval_scale': 0.7822535868663721, 'interval_power': 0.055537835925274746, 'min_width_factor': 0.5274809342075123}. Best is trial 64 with value: 6.722420918001139.\n",
      "[I 2026-07-02 16:33:20,850] Trial 121 finished with value: 7.274964026046346 and parameters: {'aci_target': 0.17572244222654362, 'aci_step_size': 0.009302963199671522, 'interval_scale': 0.7560620638013599, 'interval_power': 0.029187581084740316, 'min_width_factor': 0.7020302834776015}. Best is trial 64 with value: 6.722420918001139.\n",
      "[I 2026-07-02 16:33:21,093] Trial 122 finished with value: 7.803365441453904 and parameters: {'aci_target': 0.1741325828689585, 'aci_step_size': 0.006233396864619607, 'interval_scale': 0.8199707845146889, 'interval_power': 0.025142615183721326, 'min_width_factor': 0.7020188175168186}. Best is trial 64 with value: 6.722420918001139.\n",
      "[I 2026-07-02 16:33:21,338] Trial 123 finished with value: 7.441856530785132 and parameters: {'aci_target': 0.17966301484163447, 'aci_step_size': 0.007479943270314231, 'interval_scale': 0.7500247280068872, 'interval_power': 0.052927494095697795, 'min_width_factor': 0.6470069208975967}. Best is trial 64 with value: 6.722420918001139.\n",
      "[I 2026-07-02 16:33:21,577] Trial 124 finished with value: 9.467487972533478 and parameters: {'aci_target': 0.1933151708375371, 'aci_step_size': 0.009270813400546312, 'interval_scale': 0.8786944629020071, 'interval_power': 0.10592657685586462, 'min_width_factor': 0.8062877319832595}. Best is trial 64 with value: 6.722420918001139.\n",
      "[I 2026-07-02 16:33:21,824] Trial 125 finished with value: 7.553789478882483 and parameters: {'aci_target': 0.1604218914161683, 'aci_step_size': 0.005531315348799282, 'interval_scale': 0.7870261233920341, 'interval_power': 0.020927310576419788, 'min_width_factor': 0.885049300043242}. Best is trial 64 with value: 6.722420918001139.\n",
      "[I 2026-07-02 16:33:22,061] Trial 126 finished with value: 8.835028914789742 and parameters: {'aci_target': 0.18230341954313808, 'aci_step_size': 0.008169197108468928, 'interval_scale': 0.8438585457954786, 'interval_power': 0.08600308601144324, 'min_width_factor': 0.725084242109832}. Best is trial 64 with value: 6.722420918001139.\n",
      "[I 2026-07-02 16:33:22,301] Trial 127 finished with value: 7.611269197789765 and parameters: {'aci_target': 0.1655190063443864, 'aci_step_size': 0.010339180409943529, 'interval_scale': 0.751785329588498, 'interval_power': 0.05126558283576513, 'min_width_factor': 0.5997744684678618}. Best is trial 64 with value: 6.722420918001139.\n",
      "[I 2026-07-02 16:33:22,541] Trial 128 finished with value: 9.036253903104619 and parameters: {'aci_target': 0.18944611683459006, 'aci_step_size': 0.011724398684815533, 'interval_scale': 0.9640270436842525, 'interval_power': 0.024208221396632163, 'min_width_factor': 0.8402138295827619}. Best is trial 64 with value: 6.722420918001139.\n",
      "[I 2026-07-02 16:33:22,781] Trial 129 finished with value: 7.415046845311491 and parameters: {'aci_target': 0.17725093307377168, 'aci_step_size': 0.007301995959647414, 'interval_scale': 0.8117085650287829, 'interval_power': 0.0019103600012960673, 'min_width_factor': 0.7717859463356378}. Best is trial 64 with value: 6.722420918001139.\n",
      "[I 2026-07-02 16:33:23,018] Trial 130 finished with value: 9.39015628854378 and parameters: {'aci_target': 0.17172508737842795, 'aci_step_size': 0.006648063495044291, 'interval_scale': 0.9007020851653037, 'interval_power': 0.0765842760757569, 'min_width_factor': 0.6726126890450627}. Best is trial 64 with value: 6.722420918001139.\n",
      "[I 2026-07-02 16:33:23,257] Trial 131 finished with value: 7.688121370863726 and parameters: {'aci_target': 0.17673529234195354, 'aci_step_size': 0.009386351984303033, 'interval_scale': 0.7814903301972479, 'interval_power': 0.043144451749788613, 'min_width_factor': 0.6975354283620534}. Best is trial 64 with value: 6.722420918001139.\n",
      "[I 2026-07-02 16:33:23,497] Trial 132 finished with value: 7.184749909472755 and parameters: {'aci_target': 0.1838933180267271, 'aci_step_size': 0.008599222326813635, 'interval_scale': 0.7504114290680085, 'interval_power': 0.03424582444422014, 'min_width_factor': 0.6186024205465178}. Best is trial 64 with value: 6.722420918001139.\n",
      "[I 2026-07-02 16:33:23,736] Trial 133 finished with value: 32.400988524322514 and parameters: {'aci_target': 0.18378085778272804, 'aci_step_size': 0.007909849315906808, 'interval_scale': 0.8295556613177939, 'interval_power': 0.7966586621940126, 'min_width_factor': 0.6276428208218562}. Best is trial 64 with value: 6.722420918001139.\n",
      "[I 2026-07-02 16:33:23,971] Trial 134 finished with value: 7.207828673658193 and parameters: {'aci_target': 0.1961739739010832, 'aci_step_size': 0.005973761308439844, 'interval_scale': 0.7859763414697466, 'interval_power': 0.021575860640963403, 'min_width_factor': 0.5477579949954063}. Best is trial 64 with value: 6.722420918001139.\n",
      "[I 2026-07-02 16:33:24,211] Trial 135 finished with value: 9.052167387361697 and parameters: {'aci_target': 0.1969387755976884, 'aci_step_size': 0.005941657796160635, 'interval_scale': 0.8441673940168505, 'interval_power': 0.11461462218239643, 'min_width_factor': 0.5442825984821826}. Best is trial 64 with value: 6.722420918001139.\n",
      "[I 2026-07-02 16:33:24,449] Trial 136 finished with value: 7.510968521539566 and parameters: {'aci_target': 0.19139309560215437, 'aci_step_size': 0.007040400157726837, 'interval_scale': 0.752417333788894, 'interval_power': 0.06332989951392683, 'min_width_factor': 0.598766060336311}. Best is trial 64 with value: 6.722420918001139.\n",
      "[I 2026-07-02 16:33:24,690] Trial 137 finished with value: 33.77714647086614 and parameters: {'aci_target': 0.19547379855963362, 'aci_step_size': 0.006313207415792598, 'interval_scale': 3.568825282828258, 'interval_power': 0.038744900009415065, 'min_width_factor': 0.6520790757219296}. Best is trial 64 with value: 6.722420918001139.\n",
      "[I 2026-07-02 16:33:24,931] Trial 138 finished with value: 9.291064239003536 and parameters: {'aci_target': 0.18874458513578443, 'aci_step_size': 0.005359993758553849, 'interval_scale': 0.883588821801069, 'interval_power': 0.09418674700627376, 'min_width_factor': 0.5192318741412097}. Best is trial 64 with value: 6.722420918001139.\n",
      "[I 2026-07-02 16:33:25,165] Trial 139 finished with value: 7.508758367049282 and parameters: {'aci_target': 0.18416518871663728, 'aci_step_size': 0.0057774700380044085, 'interval_scale': 0.7958616740806482, 'interval_power': 0.029192440656194397, 'min_width_factor': 0.5545510142328306}. Best is trial 64 with value: 6.722420918001139.\n",
      "[I 2026-07-02 16:33:25,404] Trial 140 finished with value: 8.588407946563711 and parameters: {'aci_target': 0.1805930022925097, 'aci_step_size': 0.008744107877377434, 'interval_scale': 0.8604629616649506, 'interval_power': 0.05583664965936551, 'min_width_factor': 0.49083012959284833}. Best is trial 64 with value: 6.722420918001139.\n",
      "[I 2026-07-02 16:33:25,641] Trial 141 finished with value: 6.936969469813104 and parameters: {'aci_target': 0.1993236663797124, 'aci_step_size': 0.0067414111555814775, 'interval_scale': 0.7872293958074905, 'interval_power': 0.0004237911266495183, 'min_width_factor': 0.7975079224626783}. Best is trial 64 with value: 6.722420918001139.\n",
      "[I 2026-07-02 16:33:25,883] Trial 142 finished with value: 7.2078034962422715 and parameters: {'aci_target': 0.1989623497598072, 'aci_step_size': 0.006714152225468675, 'interval_scale': 0.7823188331061086, 'interval_power': 0.026623909586889975, 'min_width_factor': 0.7506322773060268}. Best is trial 64 with value: 6.722420918001139.\n",
      "[I 2026-07-02 16:33:26,120] Trial 143 finished with value: 7.2394055783249245 and parameters: {'aci_target': 0.19801684728130306, 'aci_step_size': 0.006657004491554479, 'interval_scale': 0.8139480825765504, 'interval_power': 0.004389666526250106, 'min_width_factor': 0.7384413255727729}. Best is trial 64 with value: 6.722420918001139.\n",
      "[I 2026-07-02 16:33:26,362] Trial 144 finished with value: 54.602549348597016 and parameters: {'aci_target': 0.1988029780576232, 'aci_step_size': 0.006853899841021808, 'interval_scale': 0.816398172030688, 'interval_power': 1.0756699844880486, 'min_width_factor': 0.7411429174755702}. Best is trial 64 with value: 6.722420918001139.\n",
      "[I 2026-07-02 16:33:26,605] Trial 145 finished with value: 6.92408408578926 and parameters: {'aci_target': 0.19958583548466105, 'aci_step_size': 0.0075371142269173, 'interval_scale': 0.7838672342873786, 'interval_power': 0.0007679694206308811, 'min_width_factor': 0.6283478807817968}. Best is trial 64 with value: 6.722420918001139.\n",
      "[I 2026-07-02 16:33:26,862] Trial 146 finished with value: 8.172152514560173 and parameters: {'aci_target': 0.19860260777451824, 'aci_step_size': 0.006481106026048689, 'interval_scale': 0.9183226813248404, 'interval_power': 0.005837591609847436, 'min_width_factor': 0.6342217353714935}. Best is trial 64 with value: 6.722420918001139.\n",
      "[I 2026-07-02 16:33:27,101] Trial 147 finished with value: 8.546783208977237 and parameters: {'aci_target': 0.1937578067453198, 'aci_step_size': 0.007256908020362268, 'interval_scale': 0.849380039409854, 'interval_power': 0.0707088960912492, 'min_width_factor': 0.5683082002738195}. Best is trial 64 with value: 6.722420918001139.\n",
      "[I 2026-07-02 16:33:27,343] Trial 148 finished with value: 7.0311249511589 and parameters: {'aci_target': 0.1952144677981803, 'aci_step_size': 0.005021744632412124, 'interval_scale': 0.7947540427301325, 'interval_power': 0.0007784498633615988, 'min_width_factor': 0.6714856873741228}. Best is trial 64 with value: 6.722420918001139.\n",
      "[I 2026-07-02 16:33:27,580] Trial 149 finished with value: 6.944084372493372 and parameters: {'aci_target': 0.19958946649808212, 'aci_step_size': 0.005219720977677867, 'interval_scale': 0.7896153845316438, 'interval_power': 0.0023962144361490464, 'min_width_factor': 0.6230947991594648}. Best is trial 64 with value: 6.722420918001139.\n",
      "[I 2026-07-02 16:33:27,822] Trial 150 finished with value: 7.9234740140843956 and parameters: {'aci_target': 0.19396935149885436, 'aci_step_size': 0.005144833089235912, 'interval_scale': 0.8874905514822017, 'interval_power': 0.004412988471043613, 'min_width_factor': 0.600277587271277}. Best is trial 64 with value: 6.722420918001139.\n",
      "[I 2026-07-02 16:33:28,065] Trial 151 finished with value: 7.591152974545523 and parameters: {'aci_target': 0.19121875148795392, 'aci_step_size': 0.005680169782602993, 'interval_scale': 0.784609218955668, 'interval_power': 0.04762941025247156, 'min_width_factor': 0.6728346351159815}. Best is trial 64 with value: 6.722420918001139.\n",
      "[I 2026-07-02 16:33:28,305] Trial 152 finished with value: 6.918712607239214 and parameters: {'aci_target': 0.1996583294022339, 'aci_step_size': 0.005905545911457766, 'interval_scale': 0.7861156887192001, 'interval_power': 0.0016874258230878477, 'min_width_factor': 0.623128161422647}. Best is trial 64 with value: 6.722420918001139.\n",
      "[I 2026-07-02 16:33:28,545] Trial 153 finished with value: 7.260015628492009 and parameters: {'aci_target': 0.19587270759820358, 'aci_step_size': 0.00599396365937185, 'interval_scale': 0.7945330936320512, 'interval_power': 0.01898581731443392, 'min_width_factor': 0.6258382707056381}. Best is trial 64 with value: 6.722420918001139.\n",
      "[I 2026-07-02 16:33:28,793] Trial 154 finished with value: 7.378530517587652 and parameters: {'aci_target': 0.19942198434163277, 'aci_step_size': 0.005092893651157416, 'interval_scale': 0.8415488872053734, 'interval_power': 0.0006079579627383586, 'min_width_factor': 0.5728110523482084}. Best is trial 64 with value: 6.722420918001139.\n",
      "[I 2026-07-02 16:33:29,047] Trial 155 finished with value: 7.735702940348968 and parameters: {'aci_target': 0.1999230207992915, 'aci_step_size': 0.005419848982833973, 'interval_scale': 0.7881055106882886, 'interval_power': 0.06771414865176016, 'min_width_factor': 0.6601320110967256}. Best is trial 64 with value: 6.722420918001139.\n",
      "[I 2026-07-02 16:33:29,296] Trial 156 finished with value: 7.920763355975481 and parameters: {'aci_target': 0.19079148050663333, 'aci_step_size': 0.006128175944993726, 'interval_scale': 0.82358351780376, 'interval_power': 0.04255038279956597, 'min_width_factor': 0.6103867055849518}. Best is trial 64 with value: 6.722420918001139.\n",
      "[I 2026-07-02 16:33:29,541] Trial 157 finished with value: 8.89735161471634 and parameters: {'aci_target': 0.19462285372812946, 'aci_step_size': 0.006973108959329741, 'interval_scale': 0.8657024242075434, 'interval_power': 0.08485150981466155, 'min_width_factor': 0.5046397187916942}. Best is trial 64 with value: 6.722420918001139.\n",
      "[I 2026-07-02 16:33:29,795] Trial 158 finished with value: 8.454576171943506 and parameters: {'aci_target': 0.1876312223097779, 'aci_step_size': 0.007490357932317376, 'interval_scale': 0.9411307002425302, 'interval_power': 0.0019184722177860332, 'min_width_factor': 0.6383218671953068}. Best is trial 64 with value: 6.722420918001139.\n",
