      "[I 2026-07-02 16:33:17,931] Trial 202 finished with value: 0.005742084336770756 and parameters: {'foundation_window': 10, 'ar_lags': 6, 'ema_spans': (2, 4, 8), 'conv_scales': (2, 3), 'use_calendar': True, 'ridge_alpha': 0.0010221249751615994, 'shrinkage_max': 2.1840822924482715, 'oob_split_ratio': 0.7793096702699571}. Best is trial 186 with value: 0.005716181652103645.\n",
      "[I 2026-07-02 16:33:18,066] Trial 203 finished with value: 0.005737976405589321 and parameters: {'foundation_window': 10, 'ar_lags': 6, 'ema_spans': (2, 4, 8), 'conv_scales': (2, 3), 'use_calendar': True, 'ridge_alpha': 0.0010300824175916911, 'shrinkage_max': 2.1915229932916707, 'oob_split_ratio': 0.7788983096811268}. Best is trial 186 with value: 0.005716181652103645.\n",
      "[I 2026-07-02 16:33:18,204] Trial 204 finished with value: 0.005743482267544527 and parameters: {'foundation_window': 10, 'ar_lags': 6, 'ema_spans': (2, 4, 8), 'conv_scales': (2, 3), 'use_calendar': True, 'ridge_alpha': 0.0010054530724005976, 'shrinkage_max': 2.1805919965656093, 'oob_split_ratio': 0.7784675839152108}. Best is trial 186 with value: 0.005716181652103645.\n",
      "[I 2026-07-02 16:33:18,338] Trial 205 finished with value: 0.006102156830231388 and parameters: {'foundation_window': 10, 'ar_lags': 6, 'ema_spans': (2, 4, 8), 'conv_scales': (2, 3), 'use_calendar': True, 'ridge_alpha': 0.0010019975294307082, 'shrinkage_max': 2.286373304636164, 'oob_split_ratio': 0.7742880189148047}. Best is trial 186 with value: 0.005716181652103645.\n",
      "[I 2026-07-02 16:33:18,469] Trial 206 finished with value: 0.014186183828078966 and parameters: {'foundation_window': 10, 'ar_lags': 6, 'ema_spans': (2, 4), 'conv_scales': (2, 3), 'use_calendar': True, 'ridge_alpha': 0.0014323038112869222, 'shrinkage_max': 2.1823206595132856, 'oob_split_ratio': 0.7792319763295683}. Best is trial 186 with value: 0.005716181652103645.\n",
      "[I 2026-07-02 16:33:18,604] Trial 207 finished with value: 0.005753682172030751 and parameters: {'foundation_window': 10, 'ar_lags': 6, 'ema_spans': (2, 4, 8), 'conv_scales': (2, 3), 'use_calendar': True, 'ridge_alpha': 0.001310261385888959, 'shrinkage_max': 2.1849314936761393, 'oob_split_ratio': 0.7784478638107989}. Best is trial 186 with value: 0.005716181652103645.\n",
      "[I 2026-07-02 16:33:18,737] Trial 208 finished with value: 0.007107018204313213 and parameters: {'foundation_window': 10, 'ar_lags': 6, 'ema_spans': (2, 4, 8), 'conv_scales': (2, 3), 'use_calendar': False, 'ridge_alpha': 0.001023262399978842, 'shrinkage_max': 2.3235656354314385, 'oob_split_ratio': 0.7783345562874897}. Best is trial 186 with value: 0.005716181652103645.\n",
      "[I 2026-07-02 16:33:18,878] Trial 209 finished with value: 0.0070534566977092225 and parameters: {'foundation_window': 10, 'ar_lags': 6, 'ema_spans': (2, 4, 8), 'conv_scales': (2, 3), 'use_calendar': True, 'ridge_alpha': 0.0014324183632645838, 'shrinkage_max': 2.192458884454365, 'oob_split_ratio': 0.7678907189340798}. Best is trial 186 with value: 0.005716181652103645.\n",
      "[I 2026-07-02 16:33:19,017] Trial 210 finished with value: 0.013935475283525733 and parameters: {'foundation_window': 10, 'ar_lags': 6, 'ema_spans': (3, 6, 12), 'conv_scales': (2, 3), 'use_calendar': True, 'ridge_alpha': 0.0014612645300446558, 'shrinkage_max': 2.2472793851415, 'oob_split_ratio': 0.7745247817316205}. Best is trial 186 with value: 0.005716181652103645.\n",
      "[I 2026-07-02 16:33:19,161] Trial 211 finished with value: 0.005771423026123591 and parameters: {'foundation_window': 10, 'ar_lags': 6, 'ema_spans': (2, 4, 8), 'conv_scales': (2, 3), 'use_calendar': True, 'ridge_alpha': 0.0012378393679083742, 'shrinkage_max': 2.149971865433343, 'oob_split_ratio': 0.7821591231087159}. Best is trial 186 with value: 0.005716181652103645.\n",
      "[I 2026-07-02 16:33:19,299] Trial 212 finished with value: 0.0057390547498216175 and parameters: {'foundation_window': 10, 'ar_lags': 6, 'ema_spans': (2, 4, 8), 'conv_scales': (2, 3), 'use_calendar': True, 'ridge_alpha': 0.0010199825219374234, 'shrinkage_max': 2.1889768432051597, 'oob_split_ratio': 0.7811017784778643}. Best is trial 186 with value: 0.005716181652103645.\n",
      "[I 2026-07-02 16:33:19,448] Trial 213 finished with value: 0.005730790469991883 and parameters: {'foundation_window': 10, 'ar_lags': 6, 'ema_spans': (2, 4, 8), 'conv_scales': (2, 3), 'use_calendar': True, 'ridge_alpha': 0.0010047766912324313, 'shrinkage_max': 2.201747037616339, 'oob_split_ratio': 0.7791970729277956}. Best is trial 186 with value: 0.005716181652103645.\n",
      "[I 2026-07-02 16:33:19,595] Trial 214 finished with value: 0.006054705246112096 and parameters: {'foundation_window': 10, 'ar_lags': 6, 'ema_spans': (2, 4, 8), 'conv_scales': (2, 3), 'use_calendar': True, 'ridge_alpha': 0.0010027798132593681, 'shrinkage_max': 2.390299166476504, 'oob_split_ratio': 0.7738435789934577}. Best is trial 186 with value: 0.005716181652103645.\n",
      "[I 2026-07-02 16:33:19,732] Trial 215 finished with value: 0.005720146859197772 and parameters: {'foundation_window': 10, 'ar_lags': 6, 'ema_spans': (2, 4, 8), 'conv_scales': (2, 3), 'use_calendar': True, 'ridge_alpha': 0.0016099191548293796, 'shrinkage_max': 2.26590085053871, 'oob_split_ratio': 0.7789878031782149}. Best is trial 186 with value: 0.005716181652103645.\n",
      "[I 2026-07-02 16:33:19,882] Trial 216 finished with value: 0.00742674382314161 and parameters: {'foundation_window': 10, 'ar_lags': 6, 'ema_spans': (2, 4, 8), 'conv_scales': (2, 3, 4), 'use_calendar': True, 'ridge_alpha': 0.0014265658100301897, 'shrinkage_max': 2.2594389509858894, 'oob_split_ratio': 0.7795737624667912}. Best is trial 186 with value: 0.005716181652103645.\n",
      "[I 2026-07-02 16:33:20,024] Trial 217 finished with value: 0.006088988841950916 and parameters: {'foundation_window': 10, 'ar_lags': 6, 'ema_spans': (2, 4, 8), 'conv_scales': (2, 3), 'use_calendar': True, 'ridge_alpha': 0.001567958344307207, 'shrinkage_max': 2.3371714047597005, 'oob_split_ratio': 0.7778756788859414}. Best is trial 186 with value: 0.005716181652103645.\n",
      "[I 2026-07-02 16:33:20,172] Trial 218 finished with value: 0.010031245874992342 and parameters: {'foundation_window': 11, 'ar_lags': 6, 'ema_spans': (3, 6), 'conv_scales': (2, 3), 'use_calendar': True, 'ridge_alpha': 0.0013232371955914245, 'shrinkage_max': 2.207934310508482, 'oob_split_ratio': 0.7715171471895957}. Best is trial 186 with value: 0.005716181652103645.\n",
      "[I 2026-07-02 16:33:20,317] Trial 219 finished with value: 0.0061037760787215475 and parameters: {'foundation_window': 10, 'ar_lags': 6, 'ema_spans': (2, 4, 8), 'conv_scales': (2, 3), 'use_calendar': True, 'ridge_alpha': 0.0010073735419910885, 'shrinkage_max': 2.2840890756172127, 'oob_split_ratio': 0.7809477388758979}. Best is trial 186 with value: 0.005716181652103645.\n",
      "[I 2026-07-02 16:33:20,454] Trial 220 finished with value: 0.00715739060145319 and parameters: {'foundation_window': 10, 'ar_lags': 6, 'ema_spans': (2, 4, 8), 'conv_scales': (3, 6), 'use_calendar': True, 'ridge_alpha': 0.0016406657171612678, 'shrinkage_max': 2.206259677249153, 'oob_split_ratio': 0.7686141940942293}. Best is trial 186 with value: 0.005716181652103645.\n",
      "[I 2026-07-02 16:33:20,593] Trial 221 finished with value: 0.007741440931521757 and parameters: {'foundation_window': 10, 'ar_lags': 6, 'ema_spans': (2, 4, 8), 'conv_scales': (2, 3), 'use_calendar': True, 'ridge_alpha': 0.001248482695203759, 'shrinkage_max': 2.179211238098848, 'oob_split_ratio': 0.5565786525385487}. Best is trial 186 with value: 0.005716181652103645.\n",
      "[I 2026-07-02 16:33:20,727] Trial 222 finished with value: 0.005710420526904431 and parameters: {'foundation_window': 10, 'ar_lags': 6, 'ema_spans': (2, 4, 8), 'conv_scales': (2, 3), 'use_calendar': True, 'ridge_alpha': 0.001015051049381293, 'shrinkage_max': 2.238091718092443, 'oob_split_ratio': 0.7843740883780654}. Best is trial 222 with value: 0.005710420526904431.\n",
      "[I 2026-07-02 16:33:20,865] Trial 223 finished with value: 0.0057214829128561335 and parameters: {'foundation_window': 10, 'ar_lags': 6, 'ema_spans': (2, 4, 8), 'conv_scales': (2, 3), 'use_calendar': True, 'ridge_alpha': 0.0015125794245815576, 'shrinkage_max': 2.256217367219182, 'oob_split_ratio': 0.7844078404692566}. Best is trial 222 with value: 0.005710420526904431.\n",
      "[I 2026-07-02 16:33:21,002] Trial 224 finished with value: 0.005701662740632905 and parameters: {'foundation_window': 10, 'ar_lags': 6, 'ema_spans': (2, 4, 8), 'conv_scales': (2, 3), 'use_calendar': True, 'ridge_alpha': 0.001002648092466808, 'shrinkage_max': 2.252268350510997, 'oob_split_ratio': 0.7846960072911812}. Best is trial 224 with value: 0.005701662740632905.\n",
      "[I 2026-07-02 16:33:21,137] Trial 225 finished with value: 0.005727475221608408 and parameters: {'foundation_window': 10, 'ar_lags': 6, 'ema_spans': (2, 4, 8), 'conv_scales': (2, 3), 'use_calendar': True, 'ridge_alpha': 0.0016058747505136662, 'shrinkage_max': 2.2526386587090066, 'oob_split_ratio': 0.7840032514168102}. Best is trial 224 with value: 0.005701662740632905.\n",
      "[I 2026-07-02 16:33:21,273] Trial 226 finished with value: 0.03009581975873669 and parameters: {'foundation_window': 4, 'ar_lags': 6, 'ema_spans': (2, 4, 8), 'conv_scales': (2, 3), 'use_calendar': True, 'ridge_alpha': 0.0016017324792492581, 'shrinkage_max': 2.3559410350510825, 'oob_split_ratio': 0.784561730493202}. Best is trial 224 with value: 0.005701662740632905.\n",
      "[I 2026-07-02 16:33:21,411] Trial 227 finished with value: 0.0061240359965321735 and parameters: {'foundation_window': 10, 'ar_lags': 6, 'ema_spans': (2, 4, 8), 'conv_scales': (2, 3), 'use_calendar': True, 'ridge_alpha': 0.0015517195127317254, 'shrinkage_max': 2.280079143776421, 'oob_split_ratio': 0.78470044781221}. Best is trial 224 with value: 0.005701662740632905.\n",
      "[I 2026-07-02 16:33:21,546] Trial 228 finished with value: 0.005704479040391335 and parameters: {'foundation_window': 10, 'ar_lags': 6, 'ema_spans': (2, 4, 8), 'conv_scales': (2, 3), 'use_calendar': True, 'ridge_alpha': 0.0010028123390711328, 'shrinkage_max': 2.247452117502371, 'oob_split_ratio': 0.7758197855826682}. Best is trial 224 with value: 0.005701662740632905.\n",
      "[I 2026-07-02 16:33:21,678] Trial 229 finished with value: 0.008090233829495181 and parameters: {'foundation_window': 9, 'ar_lags': 6, 'ema_spans': (2, 4, 8), 'conv_scales': (2, 3), 'use_calendar': True, 'ridge_alpha': 0.001002294146904428, 'shrinkage_max': 2.304963492570505, 'oob_split_ratio': 0.7762817537457778}. Best is trial 224 with value: 0.005701662740632905.\n",
      "[I 2026-07-02 16:33:21,815] Trial 230 finished with value: 0.006062522810414452 and parameters: {'foundation_window': 10, 'ar_lags': 6, 'ema_spans': (2, 4, 8), 'conv_scales': (2, 3), 'use_calendar': True, 'ridge_alpha': 0.0012917345308997164, 'shrinkage_max': 2.3909755191037636, 'oob_split_ratio': 0.7724342369663144}. Best is trial 224 with value: 0.005701662740632905.\n",
      "[I 2026-07-02 16:33:21,958] Trial 231 finished with value: 0.005727965470102024 and parameters: {'foundation_window': 10, 'ar_lags': 6, 'ema_spans': (2, 4, 8), 'conv_scales': (2, 3), 'use_calendar': True, 'ridge_alpha': 0.0015252886006878533, 'shrinkage_max': 2.245720315895304, 'oob_split_ratio': 0.7846058532636649}. Best is trial 224 with value: 0.005701662740632905.\n",
      "[I 2026-07-02 16:33:22,103] Trial 232 finished with value: 0.005718847412410845 and parameters: {'foundation_window': 10, 'ar_lags': 6, 'ema_spans': (2, 4, 8), 'conv_scales': (2, 3), 'use_calendar': True, 'ridge_alpha': 0.0012876344659674742, 'shrinkage_max': 2.2439256176869935, 'oob_split_ratio': 0.7840370097619984}. Best is trial 224 with value: 0.005701662740632905.\n",
      "[I 2026-07-02 16:33:22,241] Trial 233 finished with value: 0.00571918683678353 and parameters: {'foundation_window': 10, 'ar_lags': 6, 'ema_spans': (2, 4, 8), 'conv_scales': (2, 3), 'use_calendar': True, 'ridge_alpha': 0.0013038253345230677, 'shrinkage_max': 2.244548606914251, 'oob_split_ratio': 0.7835168471314241}. Best is trial 224 with value: 0.005701662740632905.\n",
      "[I 2026-07-02 16:33:22,375] Trial 234 finished with value: 0.005718985865276933 and parameters: {'foundation_window': 10, 'ar_lags': 6, 'ema_spans': (2, 4, 8), 'conv_scales': (2, 3), 'use_calendar': True, 'ridge_alpha': 0.0014165030874341883, 'shrinkage_max': 2.2533815073715044, 'oob_split_ratio': 0.7842365030098315}. Best is trial 224 with value: 0.005701662740632905.\n",
      "[I 2026-07-02 16:33:22,508] Trial 235 finished with value: 0.005726647979214076 and parameters: {'foundation_window': 10, 'ar_lags': 6, 'ema_spans': (2, 4, 8), 'conv_scales': (2, 3), 'use_calendar': True, 'ridge_alpha': 0.0015355458122786225, 'shrinkage_max': 2.2488242718898785, 'oob_split_ratio': 0.7847210048965507}. Best is trial 224 with value: 0.005701662740632905.\n",
      "[I 2026-07-02 16:33:22,638] Trial 236 finished with value: 0.005753996804885032 and parameters: {'foundation_window': 10, 'ar_lags': 6, 'ema_spans': (2, 4, 8), 'conv_scales': (2, 3), 'use_calendar': True, 'ridge_alpha': 0.002273621567138689, 'shrinkage_max': 2.254266982084512, 'oob_split_ratio': 0.7845924187054613}. Best is trial 224 with value: 0.005701662740632905.\n",
      "[I 2026-07-02 16:33:22,778] Trial 237 finished with value: 0.006105090179793045 and parameters: {'foundation_window': 10, 'ar_lags': 6, 'ema_spans': (2, 4, 8), 'conv_scales': (2, 3), 'use_calendar': True, 'ridge_alpha': 0.0016827105360507607, 'shrinkage_max': 2.317347384772335, 'oob_split_ratio': 0.7849905350284709}. Best is trial 224 with value: 0.005701662740632905.\n",
      "[I 2026-07-02 16:33:22,914] Trial 238 finished with value: 0.005724239765983619 and parameters: {'foundation_window': 10, 'ar_lags': 6, 'ema_spans': (2, 4, 8), 'conv_scales': (2, 3), 'use_calendar': True, 'ridge_alpha': 0.0014861576012187934, 'shrinkage_max': 2.249366824835734, 'oob_split_ratio': 0.7861840816465024}. Best is trial 224 with value: 0.005701662740632905.\n",
      "[I 2026-07-02 16:33:23,061] Trial 239 finished with value: 0.008002571486762079 and parameters: {'foundation_window': 10, 'ar_lags': 6, 'ema_spans': (2, 4, 8), 'conv_scales': (3, 6, 12), 'use_calendar': True, 'ridge_alpha': 0.0014592322202355412, 'shrinkage_max': 2.257945674765536, 'oob_split_ratio': 0.7867094925959434}. Best is trial 224 with value: 0.005701662740632905.\n",
      "[I 2026-07-02 16:33:23,198] Trial 240 finished with value: 0.006090239602870951 and parameters: {'foundation_window': 10, 'ar_lags': 6, 'ema_spans': (2, 4, 8), 'conv_scales': (2, 3), 'use_calendar': True, 'ridge_alpha': 0.0019288419612869835, 'shrinkage_max': 2.3564192141712836, 'oob_split_ratio': 0.7739726398830928}. Best is trial 224 with value: 0.005701662740632905.\n",
      "[I 2026-07-02 16:33:23,334] Trial 241 finished with value: 0.0057187646618527465 and parameters: {'foundation_window': 10, 'ar_lags': 6, 'ema_spans': (2, 4, 8), 'conv_scales': (2, 3), 'use_calendar': True, 'ridge_alpha': 0.0013699985666908053, 'shrinkage_max': 2.2502692958911954, 'oob_split_ratio': 0.7835754157299599}. Best is trial 224 with value: 0.005701662740632905.\n",
      "[I 2026-07-02 16:33:23,472] Trial 242 finished with value: 0.0057122379597218 and parameters: {'foundation_window': 10, 'ar_lags': 6, 'ema_spans': (2, 4, 8), 'conv_scales': (2, 3), 'use_calendar': True, 'ridge_alpha': 0.0013510094977438733, 'shrinkage_max': 2.2602683206033167, 'oob_split_ratio': 0.7826990587717008}. Best is trial 224 with value: 0.005701662740632905.\n",
      "[I 2026-07-02 16:33:23,605] Trial 243 finished with value: 0.005709375300635239 and parameters: {'foundation_window': 10, 'ar_lags': 6, 'ema_spans': (2, 4, 8), 'conv_scales': (2, 3), 'use_calendar': True, 'ridge_alpha': 0.0013736149472406314, 'shrinkage_max': 2.266972533074345, 'oob_split_ratio': 0.7870499999697826}. Best is trial 224 with value: 0.005701662740632905.\n",
      "[I 2026-07-02 16:33:23,742] Trial 244 finished with value: 0.005712080403688883 and parameters: {'foundation_window': 10, 'ar_lags': 6, 'ema_spans': (2, 4, 8), 'conv_scales': (2, 3), 'use_calendar': True, 'ridge_alpha': 0.0015540068451468565, 'shrinkage_max': 2.275868746460717, 'oob_split_ratio': 0.7875591526603994}. Best is trial 224 with value: 0.005701662740632905.\n",
      "[I 2026-07-02 16:33:23,881] Trial 245 finished with value: 0.005739331084658245 and parameters: {'foundation_window': 10, 'ar_lags': 6, 'ema_spans': (2, 4, 8), 'conv_scales': (2, 3), 'use_calendar': True, 'ridge_alpha': 0.0024649390318973786, 'shrinkage_max': 2.295810358082125, 'oob_split_ratio': 0.7870349638337897}. Best is trial 224 with value: 0.005701662740632905.\n",
      "[I 2026-07-02 16:33:24,019] Trial 246 finished with value: 0.005723882799973409 and parameters: {'foundation_window': 10, 'ar_lags': 6, 'ema_spans': (2, 4, 8), 'conv_scales': (2, 3), 'use_calendar': True, 'ridge_alpha': 0.0016504974254018194, 'shrinkage_max': 2.2623532970596036, 'oob_split_ratio': 0.7886721190104521}. Best is trial 224 with value: 0.005701662740632905.\n",
      "[I 2026-07-02 16:33:24,155] Trial 247 finished with value: 0.0060680974431251 and parameters: {'foundation_window': 10, 'ar_lags': 6, 'ema_spans': (2, 4, 8), 'conv_scales': (2, 3), 'use_calendar': True, 'ridge_alpha': 0.001860054434131474, 'shrinkage_max': 2.427445364210362, 'oob_split_ratio': 0.7877798504965833}. Best is trial 224 with value: 0.005701662740632905.\n",
      "[I 2026-07-02 16:33:24,287] Trial 248 finished with value: 0.0060824984041964745 and parameters: {'foundation_window': 10, 'ar_lags': 6, 'ema_spans': (2, 4, 8), 'conv_scales': (2, 3), 'use_calendar': True, 'ridge_alpha': 0.0015215893653376252, 'shrinkage_max': 2.3451677912369147, 'oob_split_ratio': 0.7839708889716832}. Best is trial 224 with value: 0.005701662740632905.\n",
      "[I 2026-07-02 16:33:24,421] Trial 249 finished with value: 0.00574291574749724 and parameters: {'foundation_window': 10, 'ar_lags': 6, 'ema_spans': (2, 4, 8), 'conv_scales': (2, 3), 'use_calendar': True, 'ridge_alpha': 0.0021380377019273133, 'shrinkage_max': 2.264682484843037, 'oob_split_ratio': 0.7878263050677918}. Best is trial 224 with value: 0.005701662740632905.\n",
      "[I 2026-07-02 16:33:24,552] Trial 250 finished with value: 0.007081673361568359 and parameters: {'foundation_window': 10, 'ar_lags': 6, 'ema_spans': (2, 4, 8), 'conv_scales': (2, 3), 'use_calendar': False, 'ridge_alpha': 0.0016438141030018436, 'shrinkage_max': 2.3143808746183283, 'oob_split_ratio': 0.7746778525439516}. Best is trial 224 with value: 0.005701662740632905.\n",
      "[I 2026-07-02 16:33:24,689] Trial 251 finished with value: 0.009552645826423484 and parameters: {'foundation_window': 11, 'ar_lags': 6, 'ema_spans': (2, 4, 8), 'conv_scales': (2, 3), 'use_calendar': True, 'ridge_alpha': 0.0014370624148762614, 'shrinkage_max': 2.2536492102003316, 'oob_split_ratio': 0.7835313434982661}. Best is trial 224 with value: 0.005701662740632905.\n",
      "[I 2026-07-02 16:33:24,820] Trial 252 finished with value: 0.014719942919704888 and parameters: {'foundation_window': 10, 'ar_lags': 6, 'ema_spans': (2, 4), 'conv_scales': (2, 3), 'use_calendar': True, 'ridge_alpha': 0.0019324868516399853, 'shrinkage_max': 2.274228003216156, 'oob_split_ratio': 0.7884534195459013}. Best is trial 224 with value: 0.005701662740632905.\n",
      "[I 2026-07-02 16:33:24,952] Trial 253 finished with value: 0.010765045912985716 and parameters: {'foundation_window': 9, 'ar_lags': 6, 'ema_spans': (2, 4, 8), 'conv_scales': (2, 3), 'use_calendar': True, 'ridge_alpha': 0.002771053111968765, 'shrinkage_max': 2.3726652540492683, 'oob_split_ratio': 0.7749593269662974}. Best is trial 224 with value: 0.005701662740632905.\n",
      "[I 2026-07-02 16:33:25,086] Trial 254 finished with value: 0.006093202853716009 and parameters: {'foundation_window': 10, 'ar_lags': 6, 'ema_spans': (2, 4, 8), 'conv_scales': (2, 3), 'use_calendar': True, 'ridge_alpha': 0.0013606904744095606, 'shrinkage_max': 2.3194896391956914, 'oob_split_ratio': 0.7823025267277186}. Best is trial 224 with value: 0.005701662740632905.\n",
      "[I 2026-07-02 16:33:25,235] Trial 255 finished with value: 0.013734873047524293 and parameters: {'foundation_window': 10, 'ar_lags': 6, 'ema_spans': (3, 6, 12), 'conv_scales': (2, 3, 4), 'use_calendar': True, 'ridge_alpha': 0.0016240122697777127, 'shrinkage_max': 2.248875727696876, 'oob_split_ratio': 0.7878298010594716}. Best is trial 224 with value: 0.005701662740632905.\n",
      "[I 2026-07-02 16:33:25,365] Trial 256 finished with value: 0.009667772212329416 and parameters: {'foundation_window': 10, 'ar_lags': 6, 'ema_spans': (3, 6), 'conv_scales': (2, 3), 'use_calendar': True, 'ridge_alpha': 0.0022549800388020538, 'shrinkage_max': 2.251937284685661, 'oob_split_ratio': 0.7822160495195796}. Best is trial 224 with value: 0.005701662740632905.\n",
      "[I 2026-07-02 16:33:25,499] Trial 257 finished with value: 0.009072453397690272 and parameters: {'foundation_window': 11, 'ar_lags': 6, 'ema_spans': (2, 4, 8), 'conv_scales': (2, 3), 'use_calendar': True, 'ridge_alpha': 0.0013104868998036064, 'shrinkage_max': 2.329856603645521, 'oob_split_ratio': 0.7674831038698569}. Best is trial 224 with value: 0.005701662740632905.\n",
      "[I 2026-07-02 16:33:25,633] Trial 258 finished with value: 0.005739720379211846 and parameters: {'foundation_window': 10, 'ar_lags': 6, 'ema_spans': (2, 4, 8), 'conv_scales': (2, 3), 'use_calendar': True, 'ridge_alpha': 0.0018526847942583015, 'shrinkage_max': 2.249161942199447, 'oob_split_ratio': 0.7758669228925079}. Best is trial 224 with value: 0.005701662740632905.\n",
