      "[I 2026-07-02 16:33:49,334] Trial 144 finished with value: 1.2330920112772643 and parameters: {'aci_target': 0.17060459734120176, 'aci_step_size': 0.009777336184677165, 'interval_scale': 1.174451641267729, 'interval_power': 0.14139187633251632, 'min_width_factor': 0.6040933740786013}. Best is trial 65 with value: 1.204287235687569.\n",
      "[I 2026-07-02 16:33:49,467] Trial 145 finished with value: 1.6753543548593048 and parameters: {'aci_target': 0.18595868159151366, 'aci_step_size': 0.009217005259883018, 'interval_scale': 1.2220787576947356, 'interval_power': 0.0851996586780023, 'min_width_factor': 0.38447051796268017}. Best is trial 65 with value: 1.204287235687569.\n",
      "[I 2026-07-02 16:33:49,601] Trial 146 finished with value: 1.6737022908714188 and parameters: {'aci_target': 0.179121586925575, 'aci_step_size': 0.007302403410438804, 'interval_scale': 1.1393965129111168, 'interval_power': 0.053652982752931615, 'min_width_factor': 0.49726669230948906}. Best is trial 65 with value: 1.204287235687569.\n",
      "[I 2026-07-02 16:33:49,729] Trial 147 finished with value: 1.2453876126010126 and parameters: {'aci_target': 0.18384943816909652, 'aci_step_size': 0.010562325320384572, 'interval_scale': 1.2959135729974243, 'interval_power': 0.1180221791461529, 'min_width_factor': 0.45582053165295977}. Best is trial 65 with value: 1.204287235687569.\n",
      "[I 2026-07-02 16:33:49,858] Trial 148 finished with value: 1.2080299931129286 and parameters: {'aci_target': 0.17368326506856133, 'aci_step_size': 0.00630269049516563, 'interval_scale': 1.0085620967357882, 'interval_power': 0.0015578994815915945, 'min_width_factor': 0.5289073195855991}. Best is trial 65 with value: 1.204287235687569.\n",
      "[I 2026-07-02 16:33:49,993] Trial 149 finished with value: 2.191415212756362 and parameters: {'aci_target': 0.17334230219419833, 'aci_step_size': 0.005538638016778874, 'interval_scale': 1.0132548692593983, 'interval_power': 0.06919306652816515, 'min_width_factor': 1.0957076063781832}. Best is trial 65 with value: 1.204287235687569.\n",
      "[I 2026-07-02 16:33:50,137] Trial 150 finished with value: 1.2526710999529387 and parameters: {'aci_target': 0.1632658978759846, 'aci_step_size': 0.007548788383212952, 'interval_scale': 1.08931784583762, 'interval_power': 0.16380423383116646, 'min_width_factor': 0.41592338865825745}. Best is trial 65 with value: 1.204287235687569.\n",
      "[I 2026-07-02 16:33:50,280] Trial 151 finished with value: 1.2081256565369651 and parameters: {'aci_target': 0.18794354067159494, 'aci_step_size': 0.006248270149121285, 'interval_scale': 1.2032453055956127, 'interval_power': 0.003107274959345547, 'min_width_factor': 0.5291943098577054}. Best is trial 65 with value: 1.204287235687569.\n",
      "[I 2026-07-02 16:33:50,413] Trial 152 finished with value: 1.2056043048374157 and parameters: {'aci_target': 0.17604762670038682, 'aci_step_size': 0.006050795861096959, 'interval_scale': 1.2270590760505358, 'interval_power': 0.003655488233251958, 'min_width_factor': 0.5216302547590588}. Best is trial 65 with value: 1.204287235687569.\n",
      "[I 2026-07-02 16:33:50,543] Trial 153 finished with value: 1.2281475200867793 and parameters: {'aci_target': 0.1705255234237942, 'aci_step_size': 0.006103881221777209, 'interval_scale': 1.2093268504390917, 'interval_power': 0.04621062768143298, 'min_width_factor': 0.5892599005071469}. Best is trial 65 with value: 1.204287235687569.\n",
      "[I 2026-07-02 16:33:50,671] Trial 154 finished with value: 1.6497949466512998 and parameters: {'aci_target': 0.17569528214928418, 'aci_step_size': 0.0053987588498102985, 'interval_scale': 1.0409053757978002, 'interval_power': 0.0006130082959261147, 'min_width_factor': 0.515197200474578}. Best is trial 65 with value: 1.204287235687569.\n",
      "[I 2026-07-02 16:33:50,794] Trial 155 finished with value: 1.2095441139986585 and parameters: {'aci_target': 0.18195627224231936, 'aci_step_size': 0.006902386018129553, 'interval_scale': 1.120437173710362, 'interval_power': 0.04376976643189526, 'min_width_factor': 0.5334496822427856}. Best is trial 65 with value: 1.204287235687569.\n",
      "[I 2026-07-02 16:33:50,921] Trial 156 finished with value: 1.2632813272420695 and parameters: {'aci_target': 0.16686926905515168, 'aci_step_size': 0.0060832668397042015, 'interval_scale': 0.9120360866122406, 'interval_power': 0.04557898306861974, 'min_width_factor': 0.6316406636210347}. Best is trial 65 with value: 1.204287235687569.\n",
      "[I 2026-07-02 16:33:51,049] Trial 157 finished with value: 1.2091859006893637 and parameters: {'aci_target': 0.18009825833991508, 'aci_step_size': 0.006983867936658386, 'interval_scale': 1.112017487216445, 'interval_power': 0.10253530366357987, 'min_width_factor': 0.5323750423149043}. Best is trial 65 with value: 1.204287235687569.\n",
      "[I 2026-07-02 16:33:51,180] Trial 158 finished with value: 1.685646924328131 and parameters: {'aci_target': 0.17998213552152284, 'aci_step_size': 0.007145267141459022, 'interval_scale': 1.0972906118147274, 'interval_power': 0.0014855309590531096, 'min_width_factor': 0.4883082172169526}. Best is trial 65 with value: 1.204287235687569.\n",
      "[I 2026-07-02 16:33:51,307] Trial 159 finished with value: 1.2086343842531095 and parameters: {'aci_target': 0.17303579537214236, 'aci_step_size': 0.006384146782768538, 'interval_scale': 0.9760162613741095, 'interval_power': 0.10930288679580591, 'min_width_factor': 0.5307204930061404}. Best is trial 65 with value: 1.204287235687569.\n",
      "[I 2026-07-02 16:33:51,433] Trial 160 finished with value: 1.229145491788038 and parameters: {'aci_target': 0.17300590826837242, 'aci_step_size': 0.0064212733705056695, 'interval_scale': 0.955378012012346, 'interval_power': 0.12794539882986514, 'min_width_factor': 0.5922538156109267}. Best is trial 65 with value: 1.204287235687569.\n",
      "[I 2026-07-02 16:33:51,565] Trial 161 finished with value: 1.2050754359753943 and parameters: {'aci_target': 0.1609617034220707, 'aci_step_size': 0.0058184733096789, 'interval_scale': 1.0245062195767816, 'interval_power': 0.09143924451695395, 'min_width_factor': 0.5200436481729958}. Best is trial 65 with value: 1.204287235687569.\n",
      "[I 2026-07-02 16:33:51,691] Trial 162 finished with value: 1.7039520164036792 and parameters: {'aci_target': 0.1617523896445404, 'aci_step_size': 0.006780843196322861, 'interval_scale': 1.0033115245417485, 'interval_power': 0.08421962406487947, 'min_width_factor': 0.4745793981602914}. Best is trial 65 with value: 1.204287235687569.\n",
      "[I 2026-07-02 16:33:51,822] Trial 163 finished with value: 1.21127910126983 and parameters: {'aci_target': 0.1549405939418316, 'aci_step_size': 0.005317925304209109, 'interval_scale': 0.8600129278424207, 'interval_power': 0.04949811062037723, 'min_width_factor': 0.5386546440563006}. Best is trial 65 with value: 1.204287235687569.\n",
      "[I 2026-07-02 16:33:51,960] Trial 164 finished with value: 1.6704269795277058 and parameters: {'aci_target': 0.16833636208456948, 'aci_step_size': 0.006372973009014541, 'interval_scale': 1.0416815819857141, 'interval_power': 0.09690712618783583, 'min_width_factor': 0.4997231758172722}. Best is trial 65 with value: 1.204287235687569.\n",
      "[I 2026-07-02 16:33:52,093] Trial 165 finished with value: 1.734425039418617 and parameters: {'aci_target': 0.18356379428006317, 'aci_step_size': 0.007025679340467094, 'interval_scale': 1.125772944238922, 'interval_power': 0.0004225661792237545, 'min_width_factor': 0.4517246308990883}. Best is trial 65 with value: 1.204287235687569.\n",
      "[I 2026-07-02 16:33:52,223] Trial 166 finished with value: 1.2222127384832198 and parameters: {'aci_target': 0.1596174227390025, 'aci_step_size': 0.007737228720697629, 'interval_scale': 0.9800737048381569, 'interval_power': 0.14126444996464516, 'min_width_factor': 0.5714555556964727}. Best is trial 65 with value: 1.204287235687569.\n",
      "[I 2026-07-02 16:33:52,350] Trial 167 finished with value: 1.2086402300813328 and parameters: {'aci_target': 0.15122810670799006, 'aci_step_size': 0.005835349121513123, 'interval_scale': 0.9133851680502906, 'interval_power': 0.07821794203548349, 'min_width_factor': 0.5307380304908083}. Best is trial 65 with value: 1.204287235687569.\n",
      "[I 2026-07-02 16:33:52,478] Trial 168 finished with value: 1.2399770302039355 and parameters: {'aci_target': 0.1478194663410924, 'aci_step_size': 0.005468007381031517, 'interval_scale': 0.8028422581603831, 'interval_power': 0.07837830854716377, 'min_width_factor': 0.6199885151019665}. Best is trial 65 with value: 1.204287235687569.\n",
      "[I 2026-07-02 16:33:52,604] Trial 169 finished with value: 1.2244568863836902 and parameters: {'aci_target': 0.15405538962544923, 'aci_step_size': 0.0058606837186200005, 'interval_scale': 0.9134629148618714, 'interval_power': 0.10954124149519405, 'min_width_factor': 0.5781879993978798}. Best is trial 65 with value: 1.204287235687569.\n",
      "[I 2026-07-02 16:33:52,731] Trial 170 finished with value: 1.6583494580668698 and parameters: {'aci_target': 0.15046273567590895, 'aci_step_size': 0.0070032478693166905, 'interval_scale': 0.936316122944939, 'interval_power': 0.12185156567238616, 'min_width_factor': 0.508781316912902}. Best is trial 65 with value: 1.204287235687569.\n",
      "[I 2026-07-02 16:33:52,860] Trial 171 finished with value: 1.2096867506342361 and parameters: {'aci_target': 0.17657319277789726, 'aci_step_size': 0.006231550322125582, 'interval_scale': 1.0762934664887793, 'interval_power': 0.04678589971585032, 'min_width_factor': 0.5338775921495166}. Best is trial 65 with value: 1.204287235687569.\n",
      "[I 2026-07-02 16:33:52,985] Trial 172 finished with value: 1.2083671073354938 and parameters: {'aci_target': 0.17458795728014284, 'aci_step_size': 0.0050182326149559335, 'interval_scale': 1.0658139054248974, 'interval_power': 0.07010236638433767, 'min_width_factor': 0.5299186622532936}. Best is trial 65 with value: 1.204287235687569.\n",
      "[I 2026-07-02 16:33:53,110] Trial 173 finished with value: 1.675773977553581 and parameters: {'aci_target': 0.1746958376471252, 'aci_step_size': 0.005072299105561139, 'interval_scale': 1.0673719495114762, 'interval_power': 0.05632358840037528, 'min_width_factor': 0.49571292729786953}. Best is trial 65 with value: 1.204287235687569.\n",
      "[I 2026-07-02 16:33:53,233] Trial 174 finished with value: 1.722571720247052 and parameters: {'aci_target': 0.16619005247834204, 'aci_step_size': 0.005953356832861175, 'interval_scale': 0.9968242681309414, 'interval_power': 0.033726450574648806, 'min_width_factor': 0.46061462027776273}. Best is trial 65 with value: 1.204287235687569.\n",
      "[I 2026-07-02 16:33:53,359] Trial 175 finished with value: 1.2083687050997727 and parameters: {'aci_target': 0.1717807296325624, 'aci_step_size': 0.005630358035304441, 'interval_scale': 0.8760148497497114, 'interval_power': 0.09491420755947716, 'min_width_factor': 0.5299234555461321}. Best is trial 65 with value: 1.204287235687569.\n",
      "[I 2026-07-02 16:33:53,491] Trial 176 finished with value: 1.224915878783318 and parameters: {'aci_target': 0.17015370281580625, 'aci_step_size': 0.005545373141030994, 'interval_scale': 0.904154466247322, 'interval_power': 0.15442639408256428, 'min_width_factor': 0.5795649765967618}. Best is trial 65 with value: 1.204287235687569.\n",
      "[I 2026-07-02 16:33:53,616] Trial 177 finished with value: 1.6942590287564263 and parameters: {'aci_target': 0.16221948864976615, 'aci_step_size': 0.00509165032147581, 'interval_scale': 0.8595577211053845, 'interval_power': 0.08518956545885484, 'min_width_factor': 0.4818491388957364}. Best is trial 65 with value: 1.204287235687569.\n",
      "[I 2026-07-02 16:33:53,750] Trial 178 finished with value: 1.204616767797521 and parameters: {'aci_target': 0.17685990136346066, 'aci_step_size': 0.006172235129729957, 'interval_scale': 0.9741559635112331, 'interval_power': 0.10465440373508281, 'min_width_factor': 0.5186676436393722}. Best is trial 65 with value: 1.204287235687569.\n",
      "[I 2026-07-02 16:33:53,877] Trial 179 finished with value: 1.65110017983836 and parameters: {'aci_target': 0.1761015806093497, 'aci_step_size': 0.006344196332278042, 'interval_scale': 0.9604203981662303, 'interval_power': 0.12414724326174771, 'min_width_factor': 0.5142182755842856}. Best is trial 65 with value: 1.204287235687569.\n",
      "[I 2026-07-02 16:33:54,006] Trial 180 finished with value: 1.2317339384513155 and parameters: {'aci_target': 0.1717181408707028, 'aci_step_size': 0.006262685560216932, 'interval_scale': 1.0300546843933902, 'interval_power': 0.18668607908698226, 'min_width_factor': 0.6000191556007602}. Best is trial 65 with value: 1.204287235687569.\n",
      "[I 2026-07-02 16:33:54,130] Trial 181 finished with value: 1.2097388731234857 and parameters: {'aci_target': 0.16544598423056814, 'aci_step_size': 0.0057633871236674504, 'interval_scale': 1.1032886827333042, 'interval_power': 0.10062132514659325, 'min_width_factor': 0.5340339596172703}. Best is trial 65 with value: 1.204287235687569.\n",
      "[I 2026-07-02 16:33:54,255] Trial 182 finished with value: 1.2211722600939448 and parameters: {'aci_target': 0.1648056865309842, 'aci_step_size': 0.00561457366249582, 'interval_scale': 1.1070095332449876, 'interval_power': 0.10273821971519162, 'min_width_factor': 0.5683341205286452}. Best is trial 65 with value: 1.204287235687569.\n",
      "[I 2026-07-02 16:33:54,380] Trial 183 finished with value: 1.2056576975281705 and parameters: {'aci_target': 0.15777564743937933, 'aci_step_size': 0.006124708005088407, 'interval_scale': 0.8349262811087947, 'interval_power': 0.0631716946754561, 'min_width_factor': 0.5217904328313244}. Best is trial 65 with value: 1.204287235687569.\n",
      "[I 2026-07-02 16:33:54,505] Trial 184 finished with value: 1.737532009456633 and parameters: {'aci_target': 0.1676617011496227, 'aci_step_size': 0.005823702381379633, 'interval_scale': 0.8382650149698729, 'interval_power': 0.048466864689501246, 'min_width_factor': 0.4493944033705759}. Best is trial 65 with value: 1.204287235687569.\n",
      "[I 2026-07-02 16:33:54,629] Trial 185 finished with value: 1.6793921047274079 and parameters: {'aci_target': 0.1620635521172694, 'aci_step_size': 0.006373455271796668, 'interval_scale': 0.7975971893542159, 'interval_power': 0.06933454743458392, 'min_width_factor': 0.49299933191749906}. Best is trial 65 with value: 1.204287235687569.\n",
      "[I 2026-07-02 16:33:54,754] Trial 186 finished with value: 1.2177970417285646 and parameters: {'aci_target': 0.15438961198032508, 'aci_step_size': 0.00533217948090496, 'interval_scale': 0.8783629275776235, 'interval_power': 0.13834475788350248, 'min_width_factor': 0.558208465432506}. Best is trial 65 with value: 1.204287235687569.\n",
      "[I 2026-07-02 16:33:54,882] Trial 187 finished with value: 1.237381681960766 and parameters: {'aci_target': 0.1717836618062206, 'aci_step_size': 0.006682383540604967, 'interval_scale': 0.9826790545624708, 'interval_power': 0.10922107971107613, 'min_width_factor': 0.61696238612911}. Best is trial 65 with value: 1.204287235687569.\n",
      "[I 2026-07-02 16:33:55,007] Trial 188 finished with value: 1.7037310436855646 and parameters: {'aci_target': 0.15901349888321986, 'aci_step_size': 0.006059453041737953, 'interval_scale': 0.9271045831966102, 'interval_power': 0.05802927571368536, 'min_width_factor': 0.47474512769888244}. Best is trial 65 with value: 1.204287235687569.\n",
      "[I 2026-07-02 16:33:55,136] Trial 189 finished with value: 1.2049662302078106 and parameters: {'aci_target': 0.15661801444012144, 'aci_step_size': 0.005033313377791849, 'interval_scale': 1.0548977515370073, 'interval_power': 0.027320993726415548, 'min_width_factor': 0.5197160308702438}. Best is trial 65 with value: 1.204287235687569.\n",
      "[I 2026-07-02 16:33:55,262] Trial 190 finished with value: 1.6500602768559167 and parameters: {'aci_target': 0.1509494336168354, 'aci_step_size': 0.005124692350266633, 'interval_scale': 1.0371338552285359, 'interval_power': 0.024236422163435904, 'min_width_factor': 0.5149982028211184}. Best is trial 65 with value: 1.204287235687569.\n",
      "[I 2026-07-02 16:33:55,387] Trial 191 finished with value: 1.2122696064106597 and parameters: {'aci_target': 0.15888157651144783, 'aci_step_size': 0.00500706057974886, 'interval_scale': 1.0751260374310643, 'interval_power': 0.04094013697505259, 'min_width_factor': 0.5416261594787917}. Best is trial 65 with value: 1.204287235687569.\n",
      "[I 2026-07-02 16:33:55,513] Trial 192 finished with value: 1.2205839101769247 and parameters: {'aci_target': 0.1577166681924712, 'aci_step_size': 0.005603323724928467, 'interval_scale': 1.0143222622452166, 'interval_power': 0.07008653748110012, 'min_width_factor': 0.5665690707775868}. Best is trial 65 with value: 1.204287235687569.\n",
      "[I 2026-07-02 16:33:55,637] Trial 193 finished with value: 1.2055371082873116 and parameters: {'aci_target': 0.16554625454262833, 'aci_step_size': 0.00612331996468112, 'interval_scale': 1.138954060810579, 'interval_power': 0.10102441028887021, 'min_width_factor': 0.5086366903635163}. Best is trial 65 with value: 1.204287235687569.\n",
      "[I 2026-07-02 16:33:55,762] Trial 194 finished with value: 1.2109322194303516 and parameters: {'aci_target': 0.16395270492561528, 'aci_step_size': 0.006086856956341275, 'interval_scale': 1.121892343821765, 'interval_power': 0.10619449272381093, 'min_width_factor': 0.4959878236911581}. Best is trial 65 with value: 1.204287235687569.\n",
      "[I 2026-07-02 16:33:55,886] Trial 195 finished with value: 1.6512663214269523 and parameters: {'aci_target': 0.16842192640151504, 'aci_step_size': 0.005524219725495883, 'interval_scale': 0.8798869183093688, 'interval_power': 0.1429345234563088, 'min_width_factor': 0.5140936693928405}. Best is trial 65 with value: 1.204287235687569.\n",
      "[I 2026-07-02 16:33:56,020] Trial 196 finished with value: 1.256178473550471 and parameters: {'aci_target': 0.14654538372264378, 'aci_step_size': 0.006364268890291273, 'interval_scale': 0.9653372894645497, 'interval_power': 0.168681968840529, 'min_width_factor': 0.44344991747165924}. Best is trial 65 with value: 1.204287235687569.\n",
      "[I 2026-07-02 16:33:56,161] Trial 197 finished with value: 3.7319255443654376 and parameters: {'aci_target': 0.1735577801556608, 'aci_step_size': 0.005797032614169911, 'interval_scale': 4.5951549954992394, 'interval_power': 0.09188591113746086, 'min_width_factor': 0.5845376269602713}. Best is trial 65 with value: 1.204287235687569.\n",
      "[I 2026-07-02 16:33:56,289] Trial 198 finished with value: 1.6902681080945656 and parameters: {'aci_target': 0.17692472027140593, 'aci_step_size': 0.007438910431324481, 'interval_scale': 1.0735874125556144, 'interval_power': 0.11720363432276487, 'min_width_factor': 0.46560801601185015}. Best is trial 65 with value: 1.204287235687569.\n",
