      "[I 2026-07-02 14:58:36,256] Trial 43 finished with value: 2.039218074106645 and parameters: {'target_miscoverage': 0.10316576683884661, 'aci_step_size': 0.007047651577949431, 'interval_scale': 0.5064424583183039}. Best is trial 28 with value: 2.0191550927113227.\n",
      "[I 2026-07-02 14:58:36,326] Trial 44 finished with value: 14.769183891244547 and parameters: {'target_miscoverage': 0.10300270266700966, 'aci_step_size': 0.01708243649969889, 'interval_scale': 3.667909728989157}. Best is trial 28 with value: 2.0191550927113227.\n",
      "[I 2026-07-02 14:58:36,399] Trial 45 finished with value: 3.4313889689834682 and parameters: {'target_miscoverage': 0.08025208007598579, 'aci_step_size': 0.04404323086407123, 'interval_scale': 0.8510070763740972}. Best is trial 28 with value: 2.0191550927113227.\n",
      "[I 2026-07-02 14:58:36,473] Trial 46 finished with value: 2.3235117643189387 and parameters: {'target_miscoverage': 0.12171942924346385, 'aci_step_size': 0.011913552809314281, 'interval_scale': 0.5776973330070596}. Best is trial 28 with value: 2.0191550927113227.\n",
      "[I 2026-07-02 14:58:36,543] Trial 47 finished with value: 2.6957813867930573 and parameters: {'target_miscoverage': 0.17294208389695187, 'aci_step_size': 0.03706007439081239, 'interval_scale': 0.6723465576034648}. Best is trial 28 with value: 2.0191550927113227.\n",
      "[I 2026-07-02 14:58:36,609] Trial 48 finished with value: 2.308065222630031 and parameters: {'target_miscoverage': 0.13551233068823826, 'aci_step_size': 0.03131028186652224, 'interval_scale': 0.5743379109628403}. Best is trial 28 with value: 2.0191550927113227.\n",
      "[I 2026-07-02 14:58:36,675] Trial 49 finished with value: 5.118753475924669 and parameters: {'target_miscoverage': 0.05465866991342616, 'aci_step_size': 0.027593074278988394, 'interval_scale': 1.2675195383235098}. Best is trial 28 with value: 2.0191550927113227.\n",
      "[I 2026-07-02 14:58:36,744] Trial 50 finished with value: 3.3748048655578833 and parameters: {'target_miscoverage': 0.03892239024479581, 'aci_step_size': 0.08510648830228419, 'interval_scale': 0.8348836834218467}. Best is trial 28 with value: 2.0191550927113227.\n",
      "[I 2026-07-02 14:58:36,813] Trial 51 finished with value: 2.0955828433135983 and parameters: {'target_miscoverage': 0.10439053005940524, 'aci_step_size': 0.008295185737458891, 'interval_scale': 0.5204793899066934}. Best is trial 28 with value: 2.0191550927113227.\n",
      "[I 2026-07-02 14:58:36,880] Trial 52 finished with value: 2.0320619587140647 and parameters: {'target_miscoverage': 0.11060218110852245, 'aci_step_size': 0.007512060424242625, 'interval_scale': 0.5048929775804307}. Best is trial 28 with value: 2.0191550927113227.\n",
      "[I 2026-07-02 14:58:36,947] Trial 53 finished with value: 2.3698079278626767 and parameters: {'target_miscoverage': 0.08733578331379002, 'aci_step_size': 0.013035001685634179, 'interval_scale': 0.5879802813148562}. Best is trial 28 with value: 2.0191550927113227.\n",
      "[I 2026-07-02 14:58:37,012] Trial 54 finished with value: 2.793327194460881 and parameters: {'target_miscoverage': 0.11553863316471794, 'aci_step_size': 0.009002164259820249, 'interval_scale': 0.6942474886386593}. Best is trial 28 with value: 2.0191550927113227.\n",
      "[I 2026-07-02 14:58:37,081] Trial 55 finished with value: 2.0411217132144905 and parameters: {'target_miscoverage': 0.1427656467613069, 'aci_step_size': 0.005098719434913324, 'interval_scale': 0.5081358167598576}. Best is trial 28 with value: 2.0191550927113227.\n",
      "[I 2026-07-02 14:58:37,159] Trial 56 finished with value: 2.2843507290050646 and parameters: {'target_miscoverage': 0.12912062782821437, 'aci_step_size': 0.007466244989449602, 'interval_scale': 0.5682160684918927}. Best is trial 28 with value: 2.0191550927113227.\n",
      "[I 2026-07-02 14:58:37,229] Trial 57 finished with value: 2.55021012840112 and parameters: {'target_miscoverage': 0.15555931829752687, 'aci_step_size': 0.06892886967464767, 'interval_scale': 0.63536728488155}. Best is trial 28 with value: 2.0191550927113227.\n",
      "[I 2026-07-02 14:58:37,299] Trial 58 finished with value: 2.775933638339987 and parameters: {'target_miscoverage': 0.11087090398178467, 'aci_step_size': 0.006040766728204941, 'interval_scale': 0.689729095510443}. Best is trial 28 with value: 2.0191550927113227.\n",
      "[I 2026-07-02 14:58:37,376] Trial 59 finished with value: 31.428917759480328 and parameters: {'target_miscoverage': 0.09671703208727424, 'aci_step_size': 0.09277033808337966, 'interval_scale': 7.802360483840711}. Best is trial 28 with value: 2.0191550927113227.\n",
      "[I 2026-07-02 14:58:37,456] Trial 60 finished with value: 2.214671517190601 and parameters: {'target_miscoverage': 0.12209376990040569, 'aci_step_size': 0.040053897892100246, 'interval_scale': 0.5506487781672574}. Best is trial 28 with value: 2.0191550927113227.\n",
      "[I 2026-07-02 14:58:37,529] Trial 61 finished with value: 2.0235849100582364 and parameters: {'target_miscoverage': 0.10183777122530065, 'aci_step_size': 0.006554855994437653, 'interval_scale': 0.5025194613269781}. Best is trial 28 with value: 2.0191550927113227.\n",
      "[I 2026-07-02 14:58:37,595] Trial 62 finished with value: 2.2212978649662625 and parameters: {'target_miscoverage': 0.09871330314902338, 'aci_step_size': 0.00626806255226175, 'interval_scale': 0.5515132571979481}. Best is trial 28 with value: 2.0191550927113227.\n",
      "[I 2026-07-02 14:58:37,664] Trial 63 finished with value: 2.0358809649478835 and parameters: {'target_miscoverage': 0.08711214787021276, 'aci_step_size': 0.010638361839367338, 'interval_scale': 0.5051217972268287}. Best is trial 28 with value: 2.0191550927113227.\n",
      "[I 2026-07-02 14:58:37,731] Trial 64 finished with value: 2.585446969355721 and parameters: {'target_miscoverage': 0.08359331454491818, 'aci_step_size': 0.010999007828778037, 'interval_scale': 0.6413376891724618}. Best is trial 28 with value: 2.0191550927113227.\n",
      "[I 2026-07-02 14:58:37,799] Trial 65 finished with value: 3.000229466795931 and parameters: {'target_miscoverage': 0.0636226160229201, 'aci_step_size': 0.007884796859724982, 'interval_scale': 0.7433279048471195}. Best is trial 28 with value: 2.0191550927113227.\n",
      "[I 2026-07-02 14:58:37,869] Trial 66 finished with value: 2.4000786328341728 and parameters: {'target_miscoverage': 0.07260145346647287, 'aci_step_size': 0.0051051437589021255, 'interval_scale': 0.5949595917526627}. Best is trial 28 with value: 2.0191550927113227.\n",
      "[I 2026-07-02 14:58:37,937] Trial 67 finished with value: 2.16461469742928 and parameters: {'target_miscoverage': 0.08966262840139587, 'aci_step_size': 0.009329055004239407, 'interval_scale': 0.5371449044260692}. Best is trial 28 with value: 2.0191550927113227.\n",
      "[I 2026-07-02 14:58:38,006] Trial 68 finished with value: 2.0043499711944675 and parameters: {'target_miscoverage': 0.1956483425721223, 'aci_step_size': 0.006459506729987509, 'interval_scale': 0.5005911856939078}. Best is trial 68 with value: 2.0043499711944675.\n",
      "[I 2026-07-02 14:58:38,075] Trial 69 finished with value: 2.6687643566355668 and parameters: {'target_miscoverage': 0.19756423652950117, 'aci_step_size': 0.0066400413365014475, 'interval_scale': 0.6666081708009078}. Best is trial 68 with value: 2.0043499711944675.\n",
      "[I 2026-07-02 14:58:38,141] Trial 70 finished with value: 2.5077839372479804 and parameters: {'target_miscoverage': 0.178605505946499, 'aci_step_size': 0.00581905658902787, 'interval_scale': 0.6256745472555153}. Best is trial 68 with value: 2.0043499711944675.\n",
      "[I 2026-07-02 14:58:38,210] Trial 71 finished with value: 2.029480741028442 and parameters: {'target_miscoverage': 0.19281093664255136, 'aci_step_size': 0.008280657483337754, 'interval_scale': 0.5067799393144302}. Best is trial 68 with value: 2.0043499711944675.\n",
      "[I 2026-07-02 14:58:38,281] Trial 72 finished with value: 2.175564815017769 and parameters: {'target_miscoverage': 0.19578497422471122, 'aci_step_size': 0.00801079866415336, 'interval_scale': 0.5433570300019237}. Best is trial 68 with value: 2.0043499711944675.\n",
      "[I 2026-07-02 14:58:38,364] Trial 73 finished with value: 2.4011547077969504 and parameters: {'target_miscoverage': 0.1909933535830307, 'aci_step_size': 0.007291134895402488, 'interval_scale': 0.5995238743092014}. Best is trial 68 with value: 2.0043499711944675.\n",
      "[I 2026-07-02 14:58:38,446] Trial 74 finished with value: 2.1561725915143053 and parameters: {'target_miscoverage': 0.18018980278583271, 'aci_step_size': 0.008574520187499471, 'interval_scale': 0.5380019171144624}. Best is trial 68 with value: 2.0043499711944675.\n",
      "[I 2026-07-02 14:58:38,523] Trial 75 finished with value: 2.008998553420794 and parameters: {'target_miscoverage': 0.1704699008620789, 'aci_step_size': 0.00565676568412428, 'interval_scale': 0.5009827133154761}. Best is trial 68 with value: 2.0043499711944675.\n",
      "[I 2026-07-02 14:58:38,596] Trial 76 finished with value: 8.044493997824192 and parameters: {'target_miscoverage': 0.1666391188847675, 'aci_step_size': 0.005575954478812274, 'interval_scale': 2.0055824887683626}. Best is trial 68 with value: 2.0043499711944675.\n",
      "[I 2026-07-02 14:58:38,671] Trial 77 finished with value: 2.855673652753255 and parameters: {'target_miscoverage': 0.18695859931455552, 'aci_step_size': 0.0577038145207815, 'interval_scale': 0.7128334434595016}. Best is trial 68 with value: 2.0043499711944675.\n",
      "[I 2026-07-02 14:58:38,742] Trial 78 finished with value: 3.1468970180681586 and parameters: {'target_miscoverage': 0.19295737175317149, 'aci_step_size': 0.00661226513066697, 'interval_scale': 0.7858160420163627}. Best is trial 68 with value: 2.0043499711944675.\n",
      "[I 2026-07-02 14:58:38,810] Trial 79 finished with value: 2.43313903084595 and parameters: {'target_miscoverage': 0.17363640701959343, 'aci_step_size': 0.005032262960588627, 'interval_scale': 0.6068674021529027}. Best is trial 68 with value: 2.0043499711944675.\n",
      "[I 2026-07-02 14:58:38,881] Trial 80 finished with value: 3.755781458344646 and parameters: {'target_miscoverage': 0.16182689532573238, 'aci_step_size': 0.06643579890250172, 'interval_scale': 0.9360840961109743}. Best is trial 68 with value: 2.0043499711944675.\n",
      "[I 2026-07-02 14:58:38,951] Trial 81 finished with value: 2.009104369313684 and parameters: {'target_miscoverage': 0.1487664693373698, 'aci_step_size': 0.00598819867758798, 'interval_scale': 0.5003476884884237}. Best is trial 68 with value: 2.0043499711944675.\n",
      "[I 2026-07-02 14:58:39,025] Trial 82 finished with value: 2.211936860116116 and parameters: {'target_miscoverage': 0.14980126410831385, 'aci_step_size': 0.0065123565894196584, 'interval_scale': 0.5508958013793881}. Best is trial 68 with value: 2.0043499711944675.\n",
      "[I 2026-07-02 14:58:39,096] Trial 83 finished with value: 2.184882109281084 and parameters: {'target_miscoverage': 0.16836166944634662, 'aci_step_size': 0.006036714339081736, 'interval_scale': 0.5447727328276806}. Best is trial 68 with value: 2.0043499711944675.\n",
      "[I 2026-07-02 14:58:39,162] Trial 84 finished with value: 2.009277968992182 and parameters: {'target_miscoverage': 0.1818023377859348, 'aci_step_size': 0.010014654141407476, 'interval_scale': 0.5013984722988278}. Best is trial 68 with value: 2.0043499711944675.\n",
      "[I 2026-07-02 14:58:39,232] Trial 85 finished with value: 2.64976964828642 and parameters: {'target_miscoverage': 0.14099118088232437, 'aci_step_size': 0.005445536745957294, 'interval_scale': 0.6595871255380633}. Best is trial 68 with value: 2.0043499711944675.\n",
      "[I 2026-07-02 14:58:39,307] Trial 86 finished with value: 2.3902377668018704 and parameters: {'target_miscoverage': 0.1849819233838011, 'aci_step_size': 0.014106813414754182, 'interval_scale': 0.5965794100595875}. Best is trial 68 with value: 2.0043499711944675.\n",
      "[I 2026-07-02 14:58:39,377] Trial 87 finished with value: 24.964396629111317 and parameters: {'target_miscoverage': 0.17709646271508095, 'aci_step_size': 0.009659291975747705, 'interval_scale': 6.227869600338049}. Best is trial 68 with value: 2.0043499711944675.\n",
      "[I 2026-07-02 14:58:39,445] Trial 88 finished with value: 2.3107448443514964 and parameters: {'target_miscoverage': 0.16963138952713794, 'aci_step_size': 0.053743465398805264, 'interval_scale': 0.5761995697231931}. Best is trial 68 with value: 2.0043499711944675.\n",
      "[I 2026-07-02 14:58:39,516] Trial 89 finished with value: 2.1908721107099156 and parameters: {'target_miscoverage': 0.15020449870382133, 'aci_step_size': 0.04457756403116252, 'interval_scale': 0.5456628871081759}. Best is trial 68 with value: 2.0043499711944675.\n",
      "[I 2026-07-02 14:58:39,591] Trial 90 finished with value: 2.014268439006903 and parameters: {'target_miscoverage': 0.18335213916695683, 'aci_step_size': 0.015755979154250917, 'interval_scale': 0.5026912864483456}. Best is trial 68 with value: 2.0043499711944675.\n",
      "[I 2026-07-02 14:58:39,661] Trial 91 finished with value: 2.0069803653005236 and parameters: {'target_miscoverage': 0.18284063290708363, 'aci_step_size': 0.01657502471451103, 'interval_scale': 0.5008568206784305}. Best is trial 68 with value: 2.0043499711944675.\n",
      "[I 2026-07-02 14:58:39,729] Trial 92 finished with value: 2.155050307146993 and parameters: {'target_miscoverage': 0.1565176843287252, 'aci_step_size': 0.01692735380969655, 'interval_scale': 0.5369472518540526}. Best is trial 68 with value: 2.0043499711944675.\n",
      "[I 2026-07-02 14:58:39,794] Trial 93 finished with value: 2.0177225399742644 and parameters: {'target_miscoverage': 0.18312730808191424, 'aci_step_size': 0.01603421390501533, 'interval_scale': 0.5035464088688569}. Best is trial 68 with value: 2.0043499711944675.\n",
      "[I 2026-07-02 14:58:39,865] Trial 94 finished with value: 2.4564270045054664 and parameters: {'target_miscoverage': 0.1833219746160614, 'aci_step_size': 0.01724094391304474, 'interval_scale': 0.6130375458344587}. Best is trial 68 with value: 2.0043499711944675.\n",
      "[I 2026-07-02 14:58:39,942] Trial 95 finished with value: 2.623508586836748 and parameters: {'target_miscoverage': 0.18926915506303799, 'aci_step_size': 0.02368833488498747, 'interval_scale': 0.654972651861483}. Best is trial 68 with value: 2.0043499711944675.\n",
      "[I 2026-07-02 14:58:40,016] Trial 96 finished with value: 2.0042671724417205 and parameters: {'target_miscoverage': 0.18277020495482796, 'aci_step_size': 0.012729554366448625, 'interval_scale': 0.5001775761174362}. Best is trial 96 with value: 2.0042671724417205.\n",
      "[I 2026-07-02 14:58:40,082] Trial 97 finished with value: 2.2986296911063904 and parameters: {'target_miscoverage': 0.1749658109797229, 'aci_step_size': 0.019203214825796757, 'interval_scale': 0.5733648565913837}. Best is trial 96 with value: 2.0042671724417205.\n",
      "[I 2026-07-02 14:58:40,152] Trial 98 finished with value: 2.006471473811818 and parameters: {'target_miscoverage': 0.17099651636569213, 'aci_step_size': 0.01566720923117422, 'interval_scale': 0.5003685863308555}. Best is trial 96 with value: 2.0042671724417205.\n",
      "[I 2026-07-02 14:58:40,222] Trial 99 finished with value: 2.167002391064714 and parameters: {'target_miscoverage': 0.18364491395703214, 'aci_step_size': 0.013300089720913177, 'interval_scale': 0.5408180158309074}. Best is trial 96 with value: 2.0042671724417205.\n",
      "[I 2026-07-02 14:58:40,287] Trial 100 finished with value: 2.3312552225658494 and parameters: {'target_miscoverage': 0.16393745351522296, 'aci_step_size': 0.014997050149840539, 'interval_scale': 0.5811124467480663}. Best is trial 96 with value: 2.0042671724417205.\n",
      "[I 2026-07-02 14:58:40,355] Trial 101 finished with value: 2.017033795204657 and parameters: {'target_miscoverage': 0.18124372417980386, 'aci_step_size': 0.012444963539117292, 'interval_scale': 0.5033167371127034}. Best is trial 96 with value: 2.0042671724417205.\n",
      "[I 2026-07-02 14:58:40,433] Trial 102 finished with value: 2.1073416667976974 and parameters: {'target_miscoverage': 0.18114355124631598, 'aci_step_size': 0.016148724192404155, 'interval_scale': 0.5258483316550123}. Best is trial 96 with value: 2.0042671724417205.\n",
      "[I 2026-07-02 14:58:40,503] Trial 103 finished with value: 2.544365413858527 and parameters: {'target_miscoverage': 0.17112900426279049, 'aci_step_size': 0.011947433604677824, 'interval_scale': 0.6345122847494836}. Best is trial 96 with value: 2.0042671724417205.\n",
      "[I 2026-07-02 14:58:40,570] Trial 104 finished with value: 2.2777952277717586 and parameters: {'target_miscoverage': 0.17701933652487162, 'aci_step_size': 0.018748259415743092, 'interval_scale': 0.5682390485972957}. Best is trial 96 with value: 2.0042671724417205.\n",
      "[I 2026-07-02 14:58:40,641] Trial 105 finished with value: 2.006497724865842 and parameters: {'target_miscoverage': 0.19939830172242876, 'aci_step_size': 0.022008429087814668, 'interval_scale': 0.5012422524575393}. Best is trial 96 with value: 2.0042671724417205.\n",
      "[I 2026-07-02 14:58:40,720] Trial 106 finished with value: 2.1357783738443885 and parameters: {'target_miscoverage': 0.1996470114348804, 'aci_step_size': 0.020991966781436763, 'interval_scale': 0.5335458871350265}. Best is trial 96 with value: 2.0042671724417205.\n",
      "[I 2026-07-02 14:58:40,791] Trial 107 finished with value: 2.4011207109430712 and parameters: {'target_miscoverage': 0.1948695058976868, 'aci_step_size': 0.013358144451938966, 'interval_scale': 0.5996571345559566}. Best is trial 96 with value: 2.0042671724417205.\n",
      "[I 2026-07-02 14:58:40,862] Trial 108 finished with value: 2.1004739431250643 and parameters: {'target_miscoverage': 0.1885115842163889, 'aci_step_size': 0.012042373378557942, 'interval_scale': 0.5243700920082731}. Best is trial 96 with value: 2.0042671724417205.\n",
      "[I 2026-07-02 14:58:40,929] Trial 109 finished with value: 2.719352725230244 and parameters: {'target_miscoverage': 0.16004841160796546, 'aci_step_size': 0.026030862180118214, 'interval_scale': 0.6776931244429714}. Best is trial 96 with value: 2.0042671724417205.\n",
      "[I 2026-07-02 14:58:40,999] Trial 110 finished with value: 2.241436076639099 and parameters: {'target_miscoverage': 0.18234770457128857, 'aci_step_size': 0.021459503569679007, 'interval_scale': 0.5593501745271836}. Best is trial 96 with value: 2.0042671724417205.\n",
      "[I 2026-07-02 14:58:41,074] Trial 111 finished with value: 2.013787124323017 and parameters: {'target_miscoverage': 0.1899469114142029, 'aci_step_size': 0.010437729472498552, 'interval_scale': 0.5027732756105064}. Best is trial 96 with value: 2.0042671724417205.\n",
      "[I 2026-07-02 14:58:41,141] Trial 112 finished with value: 2.003704646213716 and parameters: {'target_miscoverage': 0.18693903755388486, 'aci_step_size': 0.010796267260429575, 'interval_scale': 0.500164287952824}. Best is trial 112 with value: 2.003704646213716.\n",
      "[I 2026-07-02 14:58:41,211] Trial 113 finished with value: 2.111157513562944 and parameters: {'target_miscoverage': 0.18852372068823464, 'aci_step_size': 0.01158012517097229, 'interval_scale': 0.5270375681043206}. Best is trial 112 with value: 2.003704646213716.\n",
      "[I 2026-07-02 14:58:41,284] Trial 114 finished with value: 12.600656475593611 and parameters: {'target_miscoverage': 0.19193886484023212, 'aci_step_size': 0.010029646246907033, 'interval_scale': 3.1463320473174528}. Best is trial 112 with value: 2.003704646213716.\n",
      "[I 2026-07-02 14:58:41,359] Trial 115 finished with value: 2.4324745461626036 and parameters: {'target_miscoverage': 0.1999878791888751, 'aci_step_size': 0.01056892434264523, 'interval_scale': 0.6076771818028606}. Best is trial 112 with value: 2.003704646213716.\n",
      "[I 2026-07-02 14:58:41,434] Trial 116 finished with value: 2.273329073776773 and parameters: {'target_miscoverage': 0.16620796979087274, 'aci_step_size': 0.01837517635630206, 'interval_scale': 0.566751530191447}. Best is trial 112 with value: 2.003704646213716.\n",
      "[I 2026-07-02 14:58:41,500] Trial 117 finished with value: 2.0157187348347994 and parameters: {'target_miscoverage': 0.17460330330800342, 'aci_step_size': 0.014152427959578025, 'interval_scale': 0.5027850998244214}. Best is trial 112 with value: 2.003704646213716.\n",
      "[I 2026-07-02 14:58:41,566] Trial 118 finished with value: 2.0062471021759594 and parameters: {'target_miscoverage': 0.17576227781863324, 'aci_step_size': 0.01415014896798117, 'interval_scale': 0.500457906353353}. Best is trial 112 with value: 2.003704646213716.\n",
      "[I 2026-07-02 14:58:41,632] Trial 119 finished with value: 2.572501158501264 and parameters: {'target_miscoverage': 0.19561368867958026, 'aci_step_size': 0.015277331405332979, 'interval_scale': 0.642486941596484}. Best is trial 112 with value: 2.003704646213716.\n",
      "[I 2026-07-02 14:58:41,704] Trial 120 finished with value: 2.2136291350686923 and parameters: {'target_miscoverage': 0.17720757691249356, 'aci_step_size': 0.008871587088500542, 'interval_scale': 0.5522379387220836}. Best is trial 112 with value: 2.003704646213716.\n",
      "[I 2026-07-02 14:58:41,774] Trial 121 finished with value: 2.1166055902968104 and parameters: {'target_miscoverage': 0.1715140849145599, 'aci_step_size': 0.014068569733174436, 'interval_scale': 0.5278501834635334}. Best is trial 112 with value: 2.003704646213716.\n",
      "[I 2026-07-02 14:58:41,850] Trial 122 finished with value: 2.0124942476746757 and parameters: {'target_miscoverage': 0.18681537305818138, 'aci_step_size': 0.010913203537743669, 'interval_scale': 0.502354558635275}. Best is trial 112 with value: 2.003704646213716.\n",
