      "[I 2026-07-02 16:31:17,124] Trial 41 finished with value: 11.28825270732133 and parameters: {'target_miscoverage': 0.059889033751509974, 'aci_step_size': 0.07832555878346202, 'interval_scale': 0.5628947992632503}. Best is trial 18 with value: 9.906926478244753.\n",
      "[I 2026-07-02 16:31:17,177] Trial 42 finished with value: 10.30292135308682 and parameters: {'target_miscoverage': 0.03636628849181378, 'aci_step_size': 0.03966915123368004, 'interval_scale': 0.5090691453206904}. Best is trial 18 with value: 9.906926478244753.\n",
      "[I 2026-07-02 16:31:17,229] Trial 43 finished with value: 91.20412854566909 and parameters: {'target_miscoverage': 0.010110571962505893, 'aci_step_size': 0.049534999421859814, 'interval_scale': 4.50641193670295}. Best is trial 18 with value: 9.906926478244753.\n",
      "[I 2026-07-02 16:31:17,281] Trial 44 finished with value: 11.480313600353547 and parameters: {'target_miscoverage': 0.09108540801489994, 'aci_step_size': 0.0884637176666623, 'interval_scale': 0.5844215040793259}. Best is trial 18 with value: 9.906926478244753.\n",
      "[I 2026-07-02 16:31:17,333] Trial 45 finished with value: 16.757855635735684 and parameters: {'target_miscoverage': 0.10066977084022422, 'aci_step_size': 0.12411657001834059, 'interval_scale': 0.8530822011283704}. Best is trial 18 with value: 9.906926478244753.\n",
      "[I 2026-07-02 16:31:17,385] Trial 46 finished with value: 13.566577966492869 and parameters: {'target_miscoverage': 0.07900357290573717, 'aci_step_size': 0.011913552809314281, 'interval_scale': 0.6703269891757322}. Best is trial 18 with value: 9.906926478244753.\n",
      "[I 2026-07-02 16:31:17,436] Trial 47 finished with value: 11.107627964522985 and parameters: {'target_miscoverage': 0.1781907938160411, 'aci_step_size': 0.04237212411354221, 'interval_scale': 0.5654494178299533}. Best is trial 18 with value: 9.906926478244753.\n",
      "[I 2026-07-02 16:31:17,486] Trial 48 finished with value: 10.026358296385416 and parameters: {'target_miscoverage': 0.19189711007118046, 'aci_step_size': 0.033665682386874486, 'interval_scale': 0.5104058652072601}. Best is trial 18 with value: 9.906926478244753.\n",
      "[I 2026-07-02 16:31:17,540] Trial 49 finished with value: 25.0404479929759 and parameters: {'target_miscoverage': 0.19373584994420479, 'aci_step_size': 0.023530140214274776, 'interval_scale': 1.2747192096240056}. Best is trial 18 with value: 9.906926478244753.\n",
      "[I 2026-07-02 16:31:17,592] Trial 50 finished with value: 55.808392452242124 and parameters: {'target_miscoverage': 0.16575540363005722, 'aci_step_size': 0.0351813052847789, 'interval_scale': 2.8410046791915793}. Best is trial 18 with value: 9.906926478244753.\n",
      "[I 2026-07-02 16:31:17,644] Trial 51 finished with value: 10.91618066087262 and parameters: {'target_miscoverage': 0.1900973113590351, 'aci_step_size': 0.06806986267874773, 'interval_scale': 0.5557035239352535}. Best is trial 18 with value: 9.906926478244753.\n",
      "[I 2026-07-02 16:31:17,701] Trial 52 finished with value: 10.219393665557035 and parameters: {'target_miscoverage': 0.05045661781293371, 'aci_step_size': 0.05410755095097336, 'interval_scale': 0.5049420276766589}. Best is trial 18 with value: 9.906926478244753.\n",
      "[I 2026-07-02 16:31:17,754] Trial 53 finished with value: 13.349618260150832 and parameters: {'target_miscoverage': 0.16865748175930895, 'aci_step_size': 0.02654186195525213, 'interval_scale': 0.6795810858548292}. Best is trial 18 with value: 9.906926478244753.\n",
      "[I 2026-07-02 16:31:17,809] Trial 54 finished with value: 11.093309392791614 and parameters: {'target_miscoverage': 0.1934151305896149, 'aci_step_size': 0.04376367764418838, 'interval_scale': 0.5647205108090732}. Best is trial 18 with value: 9.906926478244753.\n",
      "[I 2026-07-02 16:31:17,861] Trial 55 finished with value: 13.829649405442034 and parameters: {'target_miscoverage': 0.19991850000876432, 'aci_step_size': 0.032625765814956825, 'interval_scale': 0.704017746190768}. Best is trial 18 with value: 9.906926478244753.\n",
      "[I 2026-07-02 16:31:17,915] Trial 56 finished with value: 9.828232116448884 and parameters: {'target_miscoverage': 0.14999639547114935, 'aci_step_size': 0.09508297575496624, 'interval_scale': 0.5003199735264902}. Best is trial 56 with value: 9.828232116448884.\n",
      "[I 2026-07-02 16:31:17,967] Trial 57 finished with value: 12.413911650313718 and parameters: {'target_miscoverage': 0.14813323062120232, 'aci_step_size': 0.05742701773932645, 'interval_scale': 0.6319476253652084}. Best is trial 56 with value: 9.828232116448884.\n",
      "[I 2026-07-02 16:31:18,019] Trial 58 finished with value: 15.918155469968648 and parameters: {'target_miscoverage': 0.16168774722014048, 'aci_step_size': 0.018886858778046658, 'interval_scale': 0.8103360836450605}. Best is trial 56 with value: 9.828232116448884.\n",
      "[I 2026-07-02 16:31:18,073] Trial 59 finished with value: 10.916472089695164 and parameters: {'target_miscoverage': 0.13952833772056766, 'aci_step_size': 0.09082815781870157, 'interval_scale': 0.5557183592783083}. Best is trial 56 with value: 9.828232116448884.\n",
      "[I 2026-07-02 16:31:18,127] Trial 60 finished with value: 18.963590270488183 and parameters: {'target_miscoverage': 0.18080151361138064, 'aci_step_size': 0.030172490131225846, 'interval_scale': 0.9653682237639737}. Best is trial 56 with value: 9.828232116448884.\n",
      "[I 2026-07-02 16:31:18,179] Trial 61 finished with value: 9.871445936799962 and parameters: {'target_miscoverage': 0.12148554591854746, 'aci_step_size': 0.06924877932103367, 'interval_scale': 0.5025198337478156}. Best is trial 56 with value: 9.828232116448884.\n",
      "[I 2026-07-02 16:31:18,232] Trial 62 finished with value: 10.668128753247762 and parameters: {'target_miscoverage': 0.12182314290117756, 'aci_step_size': 0.06597013676071947, 'interval_scale': 0.5430760925810433}. Best is trial 56 with value: 9.828232116448884.\n",
      "[I 2026-07-02 16:31:18,285] Trial 63 finished with value: 12.17294525220048 and parameters: {'target_miscoverage': 0.15837917728431836, 'aci_step_size': 0.10352622300938086, 'interval_scale': 0.6196808926805071}. Best is trial 56 with value: 9.828232116448884.\n",
      "[I 2026-07-02 16:31:18,339] Trial 64 finished with value: 9.831159045163652 and parameters: {'target_miscoverage': 0.10685686319101026, 'aci_step_size': 0.045567591456469526, 'interval_scale': 0.500468972889439}. Best is trial 56 with value: 9.828232116448884.\n",
      "[I 2026-07-02 16:31:18,391] Trial 65 finished with value: 13.037344414965839 and parameters: {'target_miscoverage': 0.11231763347594773, 'aci_step_size': 0.04538107240391293, 'interval_scale': 0.6636843467376955}. Best is trial 56 with value: 9.828232116448884.\n",
      "[I 2026-07-02 16:31:18,444] Trial 66 finished with value: 11.536481589586899 and parameters: {'target_miscoverage': 0.10371008346021288, 'aci_step_size': 0.06734354359922816, 'interval_scale': 0.5872808145382188}. Best is trial 56 with value: 9.828232116448884.\n",
      "[I 2026-07-02 16:31:18,496] Trial 67 finished with value: 14.495303549558107 and parameters: {'target_miscoverage': 0.1282330750892816, 'aci_step_size': 0.03802050366662074, 'interval_scale': 0.7379038062390785}. Best is trial 56 with value: 9.828232116448884.\n",
      "[I 2026-07-02 16:31:18,549] Trial 68 finished with value: 9.853120375863307 and parameters: {'target_miscoverage': 0.09314076745699454, 'aci_step_size': 0.05359627863108633, 'interval_scale': 0.5005911868350535}. Best is trial 56 with value: 9.828232116448884.\n",
      "[I 2026-07-02 16:31:18,604] Trial 69 finished with value: 10.857263601115628 and parameters: {'target_miscoverage': 0.08369131875595785, 'aci_step_size': 0.055039011094702384, 'interval_scale': 0.5461624010536652}. Best is trial 56 with value: 9.828232116448884.\n",
      "[I 2026-07-02 16:31:18,656] Trial 70 finished with value: 12.501741103706152 and parameters: {'target_miscoverage': 0.09601714181157826, 'aci_step_size': 0.09011352338174283, 'interval_scale': 0.6364187071695749}. Best is trial 56 with value: 9.828232116448884.\n",
      "[I 2026-07-02 16:31:18,709] Trial 71 finished with value: 9.955131275231327 and parameters: {'target_miscoverage': 0.11174420101153827, 'aci_step_size': 0.04721925732718554, 'interval_scale': 0.5067799535544608}. Best is trial 56 with value: 9.828232116448884.\n",
      "[I 2026-07-02 16:31:18,762] Trial 72 finished with value: 10.62342528697086 and parameters: {'target_miscoverage': 0.11616112652822233, 'aci_step_size': 0.04659523476944666, 'interval_scale': 0.5408003997812959}. Best is trial 56 with value: 9.828232116448884.\n",
      "[I 2026-07-02 16:31:18,815] Trial 73 finished with value: 11.61233102734932 and parameters: {'target_miscoverage': 0.10768727460100821, 'aci_step_size': 0.07290966282108478, 'interval_scale': 0.5911420368047727}. Best is trial 56 with value: 9.828232116448884.\n",
      "[I 2026-07-02 16:31:18,867] Trial 74 finished with value: 10.028034117555611 and parameters: {'target_miscoverage': 0.1370300238527255, 'aci_step_size': 0.058803074097540445, 'interval_scale': 0.5104911752377461}. Best is trial 56 with value: 9.828232116448884.\n",
      "[I 2026-07-02 16:31:18,919] Trial 75 finished with value: 9.949914095627085 and parameters: {'target_miscoverage': 0.08613125730113799, 'aci_step_size': 0.05196955448496039, 'interval_scale': 0.500982713321913}. Best is trial 56 with value: 9.828232116448884.\n",
      "[I 2026-07-02 16:31:18,971] Trial 76 finished with value: 13.829453766545699 and parameters: {'target_miscoverage': 0.08561166541122227, 'aci_step_size': 0.07229869799192948, 'interval_scale': 0.7040077869119544}. Best is trial 56 with value: 9.828232116448884.\n",
      "[I 2026-07-02 16:31:19,024] Trial 77 finished with value: 11.718774381553063 and parameters: {'target_miscoverage': 0.1510045544873905, 'aci_step_size': 0.12358350325668083, 'interval_scale': 0.59656068599322}. Best is trial 56 with value: 9.828232116448884.\n",
      "[I 2026-07-02 16:31:19,076] Trial 78 finished with value: 10.74942209009722 and parameters: {'target_miscoverage': 0.08878556425082293, 'aci_step_size': 0.05139342765391474, 'interval_scale': 0.5426407794142071}. Best is trial 56 with value: 9.828232116448884.\n",
      "[I 2026-07-02 16:31:19,128] Trial 79 finished with value: 13.13226565980481 and parameters: {'target_miscoverage': 0.0761965524125972, 'aci_step_size': 0.040998592237268844, 'interval_scale': 0.6518419436529267}. Best is trial 56 with value: 9.828232116448884.\n",
      "[I 2026-07-02 16:31:19,181] Trial 80 finished with value: 11.958819751700794 and parameters: {'target_miscoverage': 0.09470351846817567, 'aci_step_size': 0.08141687330450637, 'interval_scale': 0.6087805324488083}. Best is trial 56 with value: 9.828232116448884.\n",
      "[I 2026-07-02 16:31:19,234] Trial 81 finished with value: 9.828776547345262 and parameters: {'target_miscoverage': 0.10261129876225455, 'aci_step_size': 0.055716844547613206, 'interval_scale': 0.5003476884884237}. Best is trial 56 with value: 9.828232116448884.\n",
      "[I 2026-07-02 16:31:19,285] Trial 82 finished with value: 9.849985960462954 and parameters: {'target_miscoverage': 0.09962882866657446, 'aci_step_size': 0.06195726639667475, 'interval_scale': 0.5014273834816421}. Best is trial 56 with value: 9.828232116448884.\n",
      "[I 2026-07-02 16:31:19,338] Trial 83 finished with value: 153.68524370534976 and parameters: {'target_miscoverage': 0.1029271322916748, 'aci_step_size': 0.06484325695990917, 'interval_scale': 7.823563397981761}. Best is trial 56 with value: 9.828232116448884.\n",
      "[I 2026-07-02 16:31:19,391] Trial 84 finished with value: 10.539723334189114 and parameters: {'target_miscoverage': 0.1075970448398902, 'aci_step_size': 0.10104045617049708, 'interval_scale': 0.5365394341980025}. Best is trial 56 with value: 9.828232116448884.\n",
      "[I 2026-07-02 16:31:19,442] Trial 85 finished with value: 11.39673985919913 and parameters: {'target_miscoverage': 0.11787576260293209, 'aci_step_size': 0.05829815741819259, 'interval_scale': 0.5801670652889535}. Best is trial 56 with value: 9.828232116448884.\n",
      "[I 2026-07-02 16:31:19,496] Trial 86 finished with value: 10.735457065370724 and parameters: {'target_miscoverage': 0.10035909822128135, 'aci_step_size': 0.08480378670255262, 'interval_scale': 0.5465035349670051}. Best is trial 56 with value: 9.828232116448884.\n",
      "[I 2026-07-02 16:31:19,550] Trial 87 finished with value: 33.95680820096849 and parameters: {'target_miscoverage': 0.07447076621192734, 'aci_step_size': 0.07202581900653734, 'interval_scale': 1.7053442383383026}. Best is trial 56 with value: 9.828232116448884.\n",
      "[I 2026-07-02 16:31:19,605] Trial 88 finished with value: 13.106858348204682 and parameters: {'target_miscoverage': 0.08894699958850741, 'aci_step_size': 0.053743465398805264, 'interval_scale': 0.6627799864115441}. Best is trial 56 with value: 9.828232116448884.\n",
      "[I 2026-07-02 16:31:19,660] Trial 89 finished with value: 14.597047078557802 and parameters: {'target_miscoverage': 0.09599601808236558, 'aci_step_size': 0.1095031482546457, 'interval_scale': 0.7430832036247573}. Best is trial 56 with value: 9.828232116448884.\n",
      "[I 2026-07-02 16:31:19,713] Trial 90 finished with value: 9.874813935335224 and parameters: {'target_miscoverage': 0.13035431025714989, 'aci_step_size': 0.06021007152057668, 'interval_scale': 0.5026912864483456}. Best is trial 56 with value: 9.828232116448884.\n",
      "[I 2026-07-02 16:31:19,770] Trial 91 finished with value: 9.838777885701989 and parameters: {'target_miscoverage': 0.12773585720277186, 'aci_step_size': 0.0613721263058161, 'interval_scale': 0.5008568206784305}. Best is trial 56 with value: 9.828232116448884.\n",
      "[I 2026-07-02 16:31:19,826] Trial 92 finished with value: 11.35064117931038 and parameters: {'target_miscoverage': 0.1274218764871825, 'aci_step_size': 0.06308759077481833, 'interval_scale': 0.5778203471787643}. Best is trial 56 with value: 9.828232116448884.\n",
      "[I 2026-07-02 16:31:19,880] Trial 93 finished with value: 10.449860396660974 and parameters: {'target_miscoverage': 0.13014261473309668, 'aci_step_size': 0.05912280911628663, 'interval_scale': 0.531964835023982}. Best is trial 56 with value: 9.828232116448884.\n",
      "[I 2026-07-02 16:31:19,937] Trial 94 finished with value: 12.013861320079236 and parameters: {'target_miscoverage': 0.1402628806932014, 'aci_step_size': 0.06980429705483372, 'interval_scale': 0.611582500873721}. Best is trial 56 with value: 9.828232116448884.\n",
      "[I 2026-07-02 16:31:19,990] Trial 95 finished with value: 11.093205840433846 and parameters: {'target_miscoverage': 0.12352996125196737, 'aci_step_size': 0.04218436158526394, 'interval_scale': 0.5647152393231012}. Best is trial 56 with value: 9.828232116448884.\n",
      "[I 2026-07-02 16:31:20,043] Trial 96 finished with value: 9.825404463120309 and parameters: {'target_miscoverage': 0.13446975482569895, 'aci_step_size': 0.03632636372309279, 'interval_scale': 0.5001760278001164}. Best is trial 96 with value: 9.825404463120309.\n",
      "[I 2026-07-02 16:31:20,096] Trial 97 finished with value: 9.844338376730631 and parameters: {'target_miscoverage': 0.14631855280956463, 'aci_step_size': 0.0746697220383231, 'interval_scale': 0.5011398852982937}. Best is trial 96 with value: 9.825404463120309.\n",
      "[I 2026-07-02 16:31:20,163] Trial 98 finished with value: 10.541691266086865 and parameters: {'target_miscoverage': 0.13434823362881804, 'aci_step_size': 0.09183029806619358, 'interval_scale': 0.5366396145449435}. Best is trial 96 with value: 9.825404463120309.\n",
      "[I 2026-07-02 16:31:20,233] Trial 99 finished with value: 12.523425923741161 and parameters: {'target_miscoverage': 0.11807536297494767, 'aci_step_size': 0.1371226171208836, 'interval_scale': 0.6375226034430523}. Best is trial 96 with value: 9.825404463120309.\n",
      "[I 2026-07-02 16:31:20,287] Trial 100 finished with value: 9.833666619618905 and parameters: {'target_miscoverage': 0.1436247476771079, 'aci_step_size': 0.09613522655755122, 'interval_scale': 0.5005966244996422}. Best is trial 96 with value: 9.825404463120309.\n",
      "[I 2026-07-02 16:31:20,343] Trial 101 finished with value: 10.470787925662295 and parameters: {'target_miscoverage': 0.1439654812733529, 'aci_step_size': 0.09652296203427557, 'interval_scale': 0.5330301803175606}. Best is trial 96 with value: 9.825404463120309.\n",
      "[I 2026-07-02 16:31:20,397] Trial 102 finished with value: 9.868667031027234 and parameters: {'target_miscoverage': 0.1365842340580609, 'aci_step_size': 0.08212691230916087, 'interval_scale': 0.5023783696489144}. Best is trial 96 with value: 9.825404463120309.\n",
      "[I 2026-07-02 16:31:20,450] Trial 103 finished with value: 11.541976770011066 and parameters: {'target_miscoverage': 0.1496905409018095, 'aci_step_size': 0.078801482097173, 'interval_scale': 0.5875605544316124}. Best is trial 96 with value: 9.825404463120309.\n",
      "[I 2026-07-02 16:31:20,503] Trial 104 finished with value: 11.170007406681608 and parameters: {'target_miscoverage': 0.1382447495203236, 'aci_step_size': 0.08357174214905895, 'interval_scale': 0.5686249310362038}. Best is trial 96 with value: 9.825404463120309.\n",
      "[I 2026-07-02 16:31:20,558] Trial 105 finished with value: 10.298209978081202 and parameters: {'target_miscoverage': 0.12452258658879362, 'aci_step_size': 0.09619692183426183, 'interval_scale': 0.5242448572654885}. Best is trial 96 with value: 9.825404463120309.\n",
      "[I 2026-07-02 16:31:20,610] Trial 106 finished with value: 11.973576152456499 and parameters: {'target_miscoverage': 0.1577207016463688, 'aci_step_size': 0.10702060996507581, 'interval_scale': 0.6095317283815535}. Best is trial 96 with value: 9.825404463120309.\n",
      "[I 2026-07-02 16:31:20,664] Trial 107 finished with value: 10.512795006833452 and parameters: {'target_miscoverage': 0.11181753409760112, 'aci_step_size': 0.17202097112824172, 'interval_scale': 0.5351686103672142}. Best is trial 96 with value: 9.825404463120309.\n",
      "[I 2026-07-02 16:31:20,721] Trial 108 finished with value: 13.414155469756087 and parameters: {'target_miscoverage': 0.13488462026942932, 'aci_step_size': 0.11653859644317209, 'interval_scale': 0.6828664433395738}. Best is trial 96 with value: 9.825404463120309.\n",
      "[I 2026-07-02 16:31:20,775] Trial 109 finished with value: 11.37746294012804 and parameters: {'target_miscoverage': 0.15443359511936725, 'aci_step_size': 0.07438484972024119, 'interval_scale': 0.5791857466301741}. Best is trial 96 with value: 9.825404463120309.\n",
      "[I 2026-07-02 16:31:20,829] Trial 110 finished with value: 10.397506147412058 and parameters: {'target_miscoverage': 0.1429664654804918, 'aci_step_size': 0.04911307759097678, 'interval_scale': 0.5292996683607607}. Best is trial 96 with value: 9.825404463120309.\n",
      "[I 2026-07-02 16:31:20,882] Trial 111 finished with value: 9.876423851591307 and parameters: {'target_miscoverage': 0.13124155062149068, 'aci_step_size': 0.06179316677433239, 'interval_scale': 0.5027732414987929}. Best is trial 96 with value: 9.825404463120309.\n",
      "[I 2026-07-02 16:31:20,934] Trial 112 finished with value: 9.825177002860368 and parameters: {'target_miscoverage': 0.12167874322004707, 'aci_step_size': 0.0555712801945636, 'interval_scale': 0.5001644486157969}. Best is trial 112 with value: 9.825177002860368.\n",
      "[I 2026-07-02 16:31:20,986] Trial 113 finished with value: 11.015252596010395 and parameters: {'target_miscoverage': 0.12091264565630849, 'aci_step_size': 0.04493144143258979, 'interval_scale': 0.560746919820713}. Best is trial 112 with value: 9.825177002860368.\n",
      "[I 2026-07-02 16:31:21,039] Trial 114 finished with value: 9.84271459190673 and parameters: {'target_miscoverage': 0.1048462871994717, 'aci_step_size': 0.05541225078122296, 'interval_scale': 0.5010572242424198}. Best is trial 112 with value: 9.825177002860368.\n",
      "[I 2026-07-02 16:31:21,100] Trial 115 finished with value: 12.488987664415474 and parameters: {'target_miscoverage': 0.1004777164835631, 'aci_step_size': 0.036226494079613994, 'interval_scale': 0.6310239071056586}. Best is trial 112 with value: 9.825177002860368.\n",
      "[I 2026-07-02 16:31:21,159] Trial 116 finished with value: 10.987739675922548 and parameters: {'target_miscoverage': 0.1084112489608907, 'aci_step_size': 0.05319572886130979, 'interval_scale': 0.5593463359430334}. Best is trial 112 with value: 9.825177002860368.\n",
      "[I 2026-07-02 16:31:21,213] Trial 117 finished with value: 10.470263173459786 and parameters: {'target_miscoverage': 0.09204466675848663, 'aci_step_size': 0.0553605250834072, 'interval_scale': 0.5319299098822532}. Best is trial 112 with value: 9.825177002860368.\n",
      "[I 2026-07-02 16:31:21,274] Trial 118 finished with value: 9.837894681043986 and parameters: {'target_miscoverage': 0.10549249960224481, 'aci_step_size': 0.03871338289200247, 'interval_scale': 0.5004540462896923}. Best is trial 112 with value: 9.825177002860368.\n",
      "[I 2026-07-02 16:31:21,328] Trial 119 finished with value: 11.506139752227517 and parameters: {'target_miscoverage': 0.10708914303482855, 'aci_step_size': 0.03823759473364269, 'interval_scale': 0.5857362206496367}. Best is trial 112 with value: 9.825177002860368.\n",
      "[I 2026-07-02 16:31:21,383] Trial 120 finished with value: 67.25318236894681 and parameters: {'target_miscoverage': 0.11498475079039859, 'aci_step_size': 0.040488101822031976, 'interval_scale': 3.423617800211539}. Best is trial 112 with value: 9.825177002860368.\n",
