      "[I 2026-07-02 14:58:54,976] Trial 43 finished with value: 0.0406208585716912 and parameters: {'foundation_window': 3, 'ar_lags': 2, 'ema_spans': (2, 3, 5, 8), 'conv_scales': (2, 4, 8), 'use_calendar': False, 'ridge_alpha': 0.0038964937241523596, 'shrinkage_max': 0.642569175347873, 'oob_split_ratio': 0.6859414714094417}. Best is trial 27 with value: 0.02725654208451324.\n",
      "[I 2026-07-02 14:58:55,150] Trial 44 finished with value: 0.03192314512135804 and parameters: {'foundation_window': 2, 'ar_lags': 4, 'ema_spans': (2, 3, 5, 8), 'conv_scales': (2, 4, 8), 'use_calendar': True, 'ridge_alpha': 0.0013273879211509237, 'shrinkage_max': 1.0391027034878766, 'oob_split_ratio': 0.740265159819984}. Best is trial 27 with value: 0.02725654208451324.\n",
      "[I 2026-07-02 14:58:55,295] Trial 45 finished with value: 0.029264106842362612 and parameters: {'foundation_window': 4, 'ar_lags': 1, 'ema_spans': (2, 3, 5, 8), 'conv_scales': (2, 3), 'use_calendar': False, 'ridge_alpha': 0.007162640262188216, 'shrinkage_max': 0.33368353331908907, 'oob_split_ratio': 0.6649845761165245}. Best is trial 27 with value: 0.02725654208451324.\n",
      "[I 2026-07-02 14:58:55,459] Trial 46 finished with value: 0.03104758118438482 and parameters: {'foundation_window': 5, 'ar_lags': 3, 'ema_spans': (2, 3, 5, 8), 'conv_scales': (2, 4, 8), 'use_calendar': False, 'ridge_alpha': 72.91983199921091, 'shrinkage_max': 0.8047331214290392, 'oob_split_ratio': 0.7217133187921885}. Best is trial 27 with value: 0.02725654208451324.\n",
      "[I 2026-07-02 14:58:55,624] Trial 47 finished with value: 0.03042138067587764 and parameters: {'foundation_window': 2, 'ar_lags': 2, 'ema_spans': (2, 4), 'conv_scales': (3, 6, 12), 'use_calendar': False, 'ridge_alpha': 0.0028128461061213603, 'shrinkage_max': 0.719495921511061, 'oob_split_ratio': 0.7022562754197179}. Best is trial 27 with value: 0.02725654208451324.\n",
      "[I 2026-07-02 14:58:55,786] Trial 48 finished with value: 0.02854364050655918 and parameters: {'foundation_window': 3, 'ar_lags': 1, 'ema_spans': (2, 4, 8), 'conv_scales': (2, 4, 8), 'use_calendar': True, 'ridge_alpha': 0.04002679751016003, 'shrinkage_max': 0.3659709874244341, 'oob_split_ratio': 0.6813284438656871}. Best is trial 27 with value: 0.02725654208451324.\n",
      "[I 2026-07-02 14:58:55,954] Trial 49 finished with value: 0.028754648159915533 and parameters: {'foundation_window': 6, 'ar_lags': 2, 'ema_spans': (2, 3, 5, 8), 'conv_scales': (2, 3, 4), 'use_calendar': False, 'ridge_alpha': 0.08120174071972418, 'shrinkage_max': 0.5078532961451168, 'oob_split_ratio': 0.6401212281209152}. Best is trial 27 with value: 0.02725654208451324.\n",
      "[I 2026-07-02 14:58:56,103] Trial 50 finished with value: 0.029317673133319084 and parameters: {'foundation_window': 4, 'ar_lags': 4, 'ema_spans': (2, 3, 5, 8), 'conv_scales': (3, 6), 'use_calendar': False, 'ridge_alpha': 0.011632146523095226, 'shrinkage_max': 0.8956387863087838, 'oob_split_ratio': 0.6908759497634062}. Best is trial 27 with value: 0.02725654208451324.\n",
      "[I 2026-07-02 14:58:56,276] Trial 51 finished with value: 0.027958273126749107 and parameters: {'foundation_window': 2, 'ar_lags': 3, 'ema_spans': (2, 3, 5, 8), 'conv_scales': (2, 4, 8), 'use_calendar': True, 'ridge_alpha': 0.0036773902805550098, 'shrinkage_max': 1.2383630883836159, 'oob_split_ratio': 0.7079312732026992}. Best is trial 27 with value: 0.02725654208451324.\n",
      "[I 2026-07-02 14:58:56,445] Trial 52 finished with value: 0.027475245011249955 and parameters: {'foundation_window': 2, 'ar_lags': 3, 'ema_spans': (2, 3, 5, 8), 'conv_scales': (2, 4, 8), 'use_calendar': True, 'ridge_alpha': 0.0057425221458118555, 'shrinkage_max': 1.1381013546109495, 'oob_split_ratio': 0.7052953437868811}. Best is trial 27 with value: 0.02725654208451324.\n",
      "[I 2026-07-02 14:58:56,610] Trial 53 finished with value: 0.031117994181797993 and parameters: {'foundation_window': 3, 'ar_lags': 3, 'ema_spans': (2, 3, 5, 8), 'conv_scales': (2, 4, 8), 'use_calendar': True, 'ridge_alpha': 0.001520754496624883, 'shrinkage_max': 1.3658759866879633, 'oob_split_ratio': 0.7153660893647424}. Best is trial 27 with value: 0.02725654208451324.\n",
      "[I 2026-07-02 14:58:56,769] Trial 54 finished with value: 0.036254843970243235 and parameters: {'foundation_window': 2, 'ar_lags': 2, 'ema_spans': (3, 6), 'conv_scales': (2, 4, 8), 'use_calendar': True, 'ridge_alpha': 0.029329781446354244, 'shrinkage_max': 1.12225233093799, 'oob_split_ratio': 0.7005867598656197}. Best is trial 27 with value: 0.02725654208451324.\n",
      "[I 2026-07-02 14:58:56,915] Trial 55 finished with value: 0.027999087756308185 and parameters: {'foundation_window': 3, 'ar_lags': 4, 'ema_spans': (2, 3, 5, 8), 'conv_scales': (2, 3), 'use_calendar': True, 'ridge_alpha': 0.006419448260962344, 'shrinkage_max': 2.379898555307166, 'oob_split_ratio': 0.6663406939827433}. Best is trial 27 with value: 0.02725654208451324.\n",
      "[I 2026-07-02 14:58:57,078] Trial 56 finished with value: 0.033304201983945354 and parameters: {'foundation_window': 2, 'ar_lags': 3, 'ema_spans': (2, 3, 5, 8), 'conv_scales': (2, 4, 8), 'use_calendar': False, 'ridge_alpha': 0.013914351931833576, 'shrinkage_max': 0.9994794424397081, 'oob_split_ratio': 0.735094041079366}. Best is trial 27 with value: 0.02725654208451324.\n",
      "[I 2026-07-02 14:58:57,241] Trial 57 finished with value: 0.03574522573683749 and parameters: {'foundation_window': 11, 'ar_lags': 2, 'ema_spans': (3, 6, 12), 'conv_scales': (2, 3, 4), 'use_calendar': True, 'ridge_alpha': 0.00252281896181745, 'shrinkage_max': 0.8550928775297717, 'oob_split_ratio': 0.7208939229506421}. Best is trial 27 with value: 0.02725654208451324.\n",
      "[I 2026-07-02 14:58:57,407] Trial 58 finished with value: 0.031549210880383774 and parameters: {'foundation_window': 3, 'ar_lags': 2, 'ema_spans': (2, 3, 5, 8), 'conv_scales': (3, 6, 12), 'use_calendar': False, 'ridge_alpha': 0.030748030832990117, 'shrinkage_max': 0.5271690603590471, 'oob_split_ratio': 0.6149749065089257}. Best is trial 27 with value: 0.02725654208451324.\n",
      "[I 2026-07-02 14:58:57,556] Trial 59 finished with value: 0.03170721025501757 and parameters: {'foundation_window': 5, 'ar_lags': 1, 'ema_spans': (2, 3, 5, 8), 'conv_scales': (3, 6), 'use_calendar': False, 'ridge_alpha': 12.748531291724634, 'shrinkage_max': 0.3926896104913681, 'oob_split_ratio': 0.751313673010682}. Best is trial 27 with value: 0.02725654208451324.\n",
      "[I 2026-07-02 14:58:57,710] Trial 60 finished with value: 0.03593352033951158 and parameters: {'foundation_window': 4, 'ar_lags': 3, 'ema_spans': (3, 6), 'conv_scales': (2, 4, 8), 'use_calendar': False, 'ridge_alpha': 0.005215822685842484, 'shrinkage_max': 1.674455710071788, 'oob_split_ratio': 0.6786641447974018}. Best is trial 27 with value: 0.02725654208451324.\n",
      "[I 2026-07-02 14:58:57,876] Trial 61 finished with value: 0.0281496941804673 and parameters: {'foundation_window': 2, 'ar_lags': 3, 'ema_spans': (2, 3, 5, 8), 'conv_scales': (2, 4, 8), 'use_calendar': True, 'ridge_alpha': 0.0035698402810779716, 'shrinkage_max': 1.1111805892459259, 'oob_split_ratio': 0.705967855244621}. Best is trial 27 with value: 0.02725654208451324.\n",
      "[I 2026-07-02 14:58:58,038] Trial 62 finished with value: 0.03192314512135804 and parameters: {'foundation_window': 2, 'ar_lags': 3, 'ema_spans': (2, 3, 5, 8), 'conv_scales': (2, 4, 8), 'use_calendar': True, 'ridge_alpha': 0.014500237420321362, 'shrinkage_max': 1.2603772140363303, 'oob_split_ratio': 0.6945995804017638}. Best is trial 27 with value: 0.02725654208451324.\n",
      "[I 2026-07-02 14:58:58,204] Trial 63 finished with value: 0.041206531611184066 and parameters: {'foundation_window': 3, 'ar_lags': 4, 'ema_spans': (2, 3, 5, 8), 'conv_scales': (2, 4, 8), 'use_calendar': True, 'ridge_alpha': 0.002212562179559793, 'shrinkage_max': 0.6081205186142629, 'oob_split_ratio': 0.7089765086338733}. Best is trial 27 with value: 0.02725654208451324.\n",
      "[I 2026-07-02 14:58:58,371] Trial 64 finished with value: 0.03192314512135804 and parameters: {'foundation_window': 2, 'ar_lags': 2, 'ema_spans': (2, 3, 5, 8), 'conv_scales': (2, 4, 8), 'use_calendar': True, 'ridge_alpha': 0.0076843034027540185, 'shrinkage_max': 1.429830581091966, 'oob_split_ratio': 0.7336216401062429}. Best is trial 27 with value: 0.02725654208451324.\n",
      "[I 2026-07-02 14:58:58,542] Trial 65 finished with value: 0.030979279821402302 and parameters: {'foundation_window': 3, 'ar_lags': 3, 'ema_spans': (2, 3, 5, 8), 'conv_scales': (2, 4, 8), 'use_calendar': True, 'ridge_alpha': 0.0010391305609073805, 'shrinkage_max': 1.2392634491179426, 'oob_split_ratio': 0.7179611079693425}. Best is trial 27 with value: 0.02725654208451324.\n",
      "[I 2026-07-02 14:58:58,710] Trial 66 finished with value: 0.048410477440690096 and parameters: {'foundation_window': 2, 'ar_lags': 2, 'ema_spans': (3, 6, 12), 'conv_scales': (2, 4, 8), 'use_calendar': True, 'ridge_alpha': 0.0042942734672628755, 'shrinkage_max': 0.7110459173591801, 'oob_split_ratio': 0.6966269888945844}. Best is trial 27 with value: 0.02725654208451324.\n",
      "[I 2026-07-02 14:58:58,863] Trial 67 finished with value: 0.03051184600386611 and parameters: {'foundation_window': 4, 'ar_lags': 3, 'ema_spans': (2, 3, 5, 8), 'conv_scales': (2, 3), 'use_calendar': False, 'ridge_alpha': 0.0014961140733247317, 'shrinkage_max': 2.0433022156348875, 'oob_split_ratio': 0.7084412325136743}. Best is trial 27 with value: 0.02725654208451324.\n",
      "[I 2026-07-02 14:58:59,028] Trial 68 finished with value: 0.03504019274582244 and parameters: {'foundation_window': 3, 'ar_lags': 2, 'ema_spans': (2, 4), 'conv_scales': (2, 4, 8), 'use_calendar': False, 'ridge_alpha': 0.002784445454247105, 'shrinkage_max': 1.3333266237218575, 'oob_split_ratio': 0.5554107135820998}. Best is trial 27 with value: 0.02725654208451324.\n",
      "[I 2026-07-02 14:58:59,195] Trial 69 finished with value: 0.03192314512135804 and parameters: {'foundation_window': 2, 'ar_lags': 4, 'ema_spans': (2, 4, 8), 'conv_scales': (2, 4, 8), 'use_calendar': True, 'ridge_alpha': 0.01816482891690068, 'shrinkage_max': 1.0653338568706396, 'oob_split_ratio': 0.6888479787484284}. Best is trial 27 with value: 0.02725654208451324.\n",
      "[I 2026-07-02 14:58:59,368] Trial 70 finished with value: 0.0278049594019123 and parameters: {'foundation_window': 3, 'ar_lags': 3, 'ema_spans': (2, 3, 5, 8), 'conv_scales': (2, 4, 8), 'use_calendar': False, 'ridge_alpha': 0.008311162008607627, 'shrinkage_max': 0.9844293987803949, 'oob_split_ratio': 0.725193354356502}. Best is trial 27 with value: 0.02725654208451324.\n",
      "[I 2026-07-02 14:58:59,545] Trial 71 finished with value: 0.027873301723082652 and parameters: {'foundation_window': 3, 'ar_lags': 3, 'ema_spans': (2, 3, 5, 8), 'conv_scales': (2, 4, 8), 'use_calendar': False, 'ridge_alpha': 0.008517215300729644, 'shrinkage_max': 0.9475390336398147, 'oob_split_ratio': 0.725461185572647}. Best is trial 27 with value: 0.02725654208451324.\n",
      "[I 2026-07-02 14:58:59,722] Trial 72 finished with value: 0.027897260956857545 and parameters: {'foundation_window': 3, 'ar_lags': 3, 'ema_spans': (2, 3, 5, 8), 'conv_scales': (2, 4, 8), 'use_calendar': False, 'ridge_alpha': 0.009424758708645658, 'shrinkage_max': 0.9599315516160831, 'oob_split_ratio': 0.7265381705913722}. Best is trial 27 with value: 0.02725654208451324.\n",
      "[I 2026-07-02 14:58:59,888] Trial 73 finished with value: 0.04838798533865362 and parameters: {'foundation_window': 4, 'ar_lags': 3, 'ema_spans': (2, 3, 5, 8), 'conv_scales': (2, 4, 8), 'use_calendar': False, 'ridge_alpha': 0.0066860402370772926, 'shrinkage_max': 0.8179189688155719, 'oob_split_ratio': 0.73389526107855}. Best is trial 27 with value: 0.02725654208451324.\n",
      "[I 2026-07-02 14:59:00,065] Trial 74 finished with value: 0.05584158476918686 and parameters: {'foundation_window': 3, 'ar_lags': 2, 'ema_spans': (2, 3, 5, 8), 'conv_scales': (2, 4, 8), 'use_calendar': False, 'ridge_alpha': 0.024543410579032986, 'shrinkage_max': 0.6019066467798341, 'oob_split_ratio': 0.7589089057864327}. Best is trial 27 with value: 0.02725654208451324.\n",
      "[I 2026-07-02 14:59:00,229] Trial 75 finished with value: 0.052029981651713846 and parameters: {'foundation_window': 3, 'ar_lags': 3, 'ema_spans': (2, 3, 5, 8), 'conv_scales': (2, 4, 8), 'use_calendar': False, 'ridge_alpha': 0.014347630020455287, 'shrinkage_max': 1.1624252685683572, 'oob_split_ratio': 0.7444524526002158}. Best is trial 27 with value: 0.02725654208451324.\n",
      "[I 2026-07-02 14:59:00,400] Trial 76 finished with value: 0.0293828848494252 and parameters: {'foundation_window': 4, 'ar_lags': 2, 'ema_spans': (2, 3, 5, 8), 'conv_scales': (2, 3, 4), 'use_calendar': False, 'ridge_alpha': 0.0102124311118249, 'shrinkage_max': 0.6877523922631738, 'oob_split_ratio': 0.717342726988486}. Best is trial 27 with value: 0.02725654208451324.\n",
      "[I 2026-07-02 14:59:00,570] Trial 77 finished with value: 0.02785362731290778 and parameters: {'foundation_window': 3, 'ar_lags': 2, 'ema_spans': (2, 3, 5, 8), 'conv_scales': (2, 4, 8), 'use_calendar': False, 'ridge_alpha': 1.8763472229480707, 'shrinkage_max': 0.9100647496381223, 'oob_split_ratio': 0.7250209677878654}. Best is trial 27 with value: 0.02725654208451324.\n",
      "[I 2026-07-02 14:59:00,744] Trial 78 finished with value: 0.029144129838344177 and parameters: {'foundation_window': 4, 'ar_lags': 1, 'ema_spans': (2, 3, 5, 8), 'conv_scales': (3, 6, 12), 'use_calendar': False, 'ridge_alpha': 0.854276774350859, 'shrinkage_max': 0.5563689885618315, 'oob_split_ratio': 0.7138689865664171}. Best is trial 27 with value: 0.02725654208451324.\n",
      "[I 2026-07-02 14:59:00,902] Trial 79 finished with value: 0.03294194521025176 and parameters: {'foundation_window': 3, 'ar_lags': 2, 'ema_spans': (3, 6), 'conv_scales': (2, 4, 8), 'use_calendar': False, 'ridge_alpha': 3.2440722928745522, 'shrinkage_max': 0.461934706434793, 'oob_split_ratio': 0.6700660439719515}. Best is trial 27 with value: 0.02725654208451324.\n",
      "[I 2026-07-02 14:59:01,048] Trial 80 finished with value: 0.02950072240389334 and parameters: {'foundation_window': 2, 'ar_lags': 2, 'ema_spans': (2, 3, 5, 8), 'conv_scales': (3, 6), 'use_calendar': False, 'ridge_alpha': 0.32196988971608503, 'shrinkage_max': 0.3119125202994565, 'oob_split_ratio': 0.7001630459803967}. Best is trial 27 with value: 0.02725654208451324.\n",
      "[I 2026-07-02 14:59:01,216] Trial 81 finished with value: 0.02702165561917835 and parameters: {'foundation_window': 3, 'ar_lags': 3, 'ema_spans': (2, 3, 5, 8), 'conv_scales': (2, 4, 8), 'use_calendar': False, 'ridge_alpha': 5.650748061483233, 'shrinkage_max': 0.9189172983993164, 'oob_split_ratio': 0.726989940920757}. Best is trial 81 with value: 0.02702165561917835.\n",
      "[I 2026-07-02 14:59:01,396] Trial 82 finished with value: 0.02764487967613873 and parameters: {'foundation_window': 3, 'ar_lags': 2, 'ema_spans': (2, 3, 5, 8), 'conv_scales': (2, 4, 8), 'use_calendar': False, 'ridge_alpha': 6.570124196750381, 'shrinkage_max': 0.7894801060159087, 'oob_split_ratio': 0.7297819877524404}. Best is trial 81 with value: 0.02702165561917835.\n",
      "[I 2026-07-02 14:59:01,575] Trial 83 finished with value: 0.027926375147578175 and parameters: {'foundation_window': 3, 'ar_lags': 3, 'ema_spans': (2, 3, 5, 8), 'conv_scales': (2, 4, 8), 'use_calendar': False, 'ridge_alpha': 7.594294585651511, 'shrinkage_max': 0.8493215984733302, 'oob_split_ratio': 0.7471992491264373}. Best is trial 81 with value: 0.02702165561917835.\n",
      "[I 2026-07-02 14:59:01,741] Trial 84 finished with value: 0.030502345677806558 and parameters: {'foundation_window': 2, 'ar_lags': 2, 'ema_spans': (2, 3, 5, 8), 'conv_scales': (2, 4, 8), 'use_calendar': False, 'ridge_alpha': 6.523185012772175, 'shrinkage_max': 0.7680912232134203, 'oob_split_ratio': 0.7362599427150569}. Best is trial 81 with value: 0.02702165561917835.\n",
      "[I 2026-07-02 14:59:01,896] Trial 85 finished with value: 0.03478038348748682 and parameters: {'foundation_window': 4, 'ar_lags': 2, 'ema_spans': (2, 4), 'conv_scales': (2, 4, 8), 'use_calendar': False, 'ridge_alpha': 4.175244298691842, 'shrinkage_max': 1.0235551929386633, 'oob_split_ratio': 0.6822651041105093}. Best is trial 81 with value: 0.02702165561917835.\n",
      "[I 2026-07-02 14:59:02,062] Trial 86 finished with value: 0.02652547335814577 and parameters: {'foundation_window': 3, 'ar_lags': 3, 'ema_spans': (2, 3, 5, 8), 'conv_scales': (2, 4, 8), 'use_calendar': False, 'ridge_alpha': 24.50930358826774, 'shrinkage_max': 0.6584280311334203, 'oob_split_ratio': 0.69254508172811}. Best is trial 86 with value: 0.02652547335814577.\n",
      "[I 2026-07-02 14:59:02,231] Trial 87 finished with value: 0.03029041708343484 and parameters: {'foundation_window': 2, 'ar_lags': 4, 'ema_spans': (3, 6, 12), 'conv_scales': (2, 4, 8), 'use_calendar': False, 'ridge_alpha': 11.05966303955027, 'shrinkage_max': 0.7609539594338368, 'oob_split_ratio': 0.6929538450659388}. Best is trial 86 with value: 0.02652547335814577.\n",
      "[I 2026-07-02 14:59:02,376] Trial 88 finished with value: 0.04178504398495545 and parameters: {'foundation_window': 4, 'ar_lags': 1, 'ema_spans': (2, 4, 8), 'conv_scales': (2, 3), 'use_calendar': False, 'ridge_alpha': 21.68287062628921, 'shrinkage_max': 0.647248923538006, 'oob_split_ratio': 0.7020541578040446}. Best is trial 86 with value: 0.02652547335814577.\n",
      "[I 2026-07-02 14:59:02,544] Trial 89 finished with value: 0.026480387136648312 and parameters: {'foundation_window': 3, 'ar_lags': 2, 'ema_spans': (2, 3, 5, 8), 'conv_scales': (2, 4, 8), 'use_calendar': False, 'ridge_alpha': 44.9737556535496, 'shrinkage_max': 0.45432751392848053, 'oob_split_ratio': 0.6762868895077622}. Best is trial 89 with value: 0.026480387136648312.\n",
      "[I 2026-07-02 14:59:02,711] Trial 90 finished with value: 0.029088022413990545 and parameters: {'foundation_window': 2, 'ar_lags': 2, 'ema_spans': (2, 3, 5, 8), 'conv_scales': (2, 4, 8), 'use_calendar': False, 'ridge_alpha': 73.10809333232055, 'shrinkage_max': 0.43653450109588876, 'oob_split_ratio': 0.6561442252757027}. Best is trial 89 with value: 0.026480387136648312.\n",
      "[I 2026-07-02 14:59:02,888] Trial 91 finished with value: 0.02648203359348632 and parameters: {'foundation_window': 3, 'ar_lags': 2, 'ema_spans': (2, 3, 5, 8), 'conv_scales': (2, 4, 8), 'use_calendar': False, 'ridge_alpha': 44.21829780140027, 'shrinkage_max': 0.5064186576194197, 'oob_split_ratio': 0.677316817162011}. Best is trial 89 with value: 0.026480387136648312.\n",
      "[I 2026-07-02 14:59:03,058] Trial 92 finished with value: 0.026482710788385128 and parameters: {'foundation_window': 3, 'ar_lags': 2, 'ema_spans': (2, 3, 5, 8), 'conv_scales': (2, 4, 8), 'use_calendar': False, 'ridge_alpha': 44.663479329913244, 'shrinkage_max': 0.5501497198203884, 'oob_split_ratio': 0.6764597624164035}. Best is trial 89 with value: 0.026480387136648312.\n",
      "[I 2026-07-02 14:59:03,225] Trial 93 finished with value: 0.026475715389762903 and parameters: {'foundation_window': 3, 'ar_lags': 2, 'ema_spans': (2, 3, 5, 8), 'conv_scales': (2, 4, 8), 'use_calendar': False, 'ridge_alpha': 39.678664613473586, 'shrinkage_max': 0.32465898173583496, 'oob_split_ratio': 0.6763201414235042}. Best is trial 93 with value: 0.026475715389762903.\n",
      "[I 2026-07-02 14:59:03,391] Trial 94 finished with value: 0.026779350118930633 and parameters: {'foundation_window': 3, 'ar_lags': 2, 'ema_spans': (2, 3, 5, 8), 'conv_scales': (2, 4, 8), 'use_calendar': False, 'ridge_alpha': 49.597611719510496, 'shrinkage_max': 0.29983230865089294, 'oob_split_ratio': 0.659898008662741}. Best is trial 93 with value: 0.026475715389762903.\n",
      "[I 2026-07-02 14:59:03,561] Trial 95 finished with value: 0.029339703098148876 and parameters: {'foundation_window': 4, 'ar_lags': 2, 'ema_spans': (2, 3, 5, 8), 'conv_scales': (2, 4, 8), 'use_calendar': False, 'ridge_alpha': 47.17054649462943, 'shrinkage_max': 0.2667487907625059, 'oob_split_ratio': 0.6607765448987062}. Best is trial 93 with value: 0.026475715389762903.\n",
      "[I 2026-07-02 14:59:03,729] Trial 96 finished with value: 0.026734130278107796 and parameters: {'foundation_window': 3, 'ar_lags': 2, 'ema_spans': (2, 3, 5, 8), 'conv_scales': (2, 4, 8), 'use_calendar': False, 'ridge_alpha': 25.854848368745788, 'shrinkage_max': 0.39448752119676095, 'oob_split_ratio': 0.6498733357683223}. Best is trial 93 with value: 0.026475715389762903.\n",
      "[I 2026-07-02 14:59:03,895] Trial 97 finished with value: 0.026518372013246586 and parameters: {'foundation_window': 3, 'ar_lags': 2, 'ema_spans': (2, 3, 5, 8), 'conv_scales': (2, 4, 8), 'use_calendar': False, 'ridge_alpha': 33.34798495999797, 'shrinkage_max': 0.3965851329272802, 'oob_split_ratio': 0.6462083854147916}. Best is trial 93 with value: 0.026475715389762903.\n",
      "[I 2026-07-02 14:59:04,064] Trial 98 finished with value: 0.027600458664798103 and parameters: {'foundation_window': 3, 'ar_lags': 2, 'ema_spans': (2, 3, 5, 8), 'conv_scales': (2, 3, 4), 'use_calendar': False, 'ridge_alpha': 28.431849151826363, 'shrinkage_max': 0.38583749132671663, 'oob_split_ratio': 0.6397295674431219}. Best is trial 93 with value: 0.026475715389762903.\n",
      "[I 2026-07-02 14:59:04,232] Trial 99 finished with value: 0.02929489643769981 and parameters: {'foundation_window': 4, 'ar_lags': 1, 'ema_spans': (2, 3, 5, 8), 'conv_scales': (2, 4, 8), 'use_calendar': False, 'ridge_alpha': 44.83913588144692, 'shrinkage_max': 0.31540980726936185, 'oob_split_ratio': 0.6452849519532995}. Best is trial 93 with value: 0.026475715389762903.\n",
