      "[I 2026-07-02 15:00:03,633] Trial 158 finished with value: 2.40867500792738 and parameters: {'aci_target': 0.11539334357548228, 'aci_step_size': 0.03856731262871339, 'interval_scale': 0.750492910434568, 'interval_power': 0.385798351521647, 'min_width_factor': 0.14939209310066887}. Best is trial 128 with value: 1.8813328122329105.\n",
      "[I 2026-07-02 15:00:03,789] Trial 159 finished with value: 2.0221031953004003 and parameters: {'aci_target': 0.12180388518275075, 'aci_step_size': 0.04925906620923288, 'interval_scale': 0.8773924673869082, 'interval_power': 0.4087300766515765, 'min_width_factor': 0.2521705393751668}. Best is trial 128 with value: 1.8813328122329105.\n",
      "[I 2026-07-02 15:00:03,949] Trial 160 finished with value: 1.9656073574201562 and parameters: {'aci_target': 0.1299604170948758, 'aci_step_size': 0.04335301591213464, 'interval_scale': 0.7976983065449572, 'interval_power': 0.44840640046791663, 'min_width_factor': 0.052257337176858265}. Best is trial 128 with value: 1.8813328122329105.\n",
      "[I 2026-07-02 15:00:04,102] Trial 161 finished with value: 1.9118557473269622 and parameters: {'aci_target': 0.1270430337302408, 'aci_step_size': 0.03335376545520017, 'interval_scale': 0.7542509924000838, 'interval_power': 0.4251214317730512, 'min_width_factor': 0.37142268688817315}. Best is trial 128 with value: 1.8813328122329105.\n",
      "[I 2026-07-02 15:00:04,258] Trial 162 finished with value: 2.117959983004159 and parameters: {'aci_target': 0.11839329019962556, 'aci_step_size': 0.03525900554742523, 'interval_scale': 0.7889071541426693, 'interval_power': 0.4845089013707953, 'min_width_factor': 0.2953716302858044}. Best is trial 128 with value: 1.8813328122329105.\n",
      "[I 2026-07-02 15:00:04,421] Trial 163 finished with value: 2.0046096279520906 and parameters: {'aci_target': 0.12405034903631626, 'aci_step_size': 0.030586658851687123, 'interval_scale': 0.8363134284519742, 'interval_power': 0.4258381836069362, 'min_width_factor': 0.1790348561010579}. Best is trial 128 with value: 1.8813328122329105.\n",
      "[I 2026-07-02 15:00:04,584] Trial 164 finished with value: 2.1653053264648325 and parameters: {'aci_target': 0.1430323238330558, 'aci_step_size': 0.025301383489574763, 'interval_scale': 0.7520220189553508, 'interval_power': 0.5324008494754265, 'min_width_factor': 0.3713740109249152}. Best is trial 128 with value: 1.8813328122329105.\n",
      "[I 2026-07-02 15:00:04,748] Trial 165 finished with value: 2.048641024320754 and parameters: {'aci_target': 0.11215946589395895, 'aci_step_size': 0.04125883446864135, 'interval_scale': 0.7963635017954616, 'interval_power': 0.45937247514851887, 'min_width_factor': 0.22394130237803442}. Best is trial 128 with value: 1.8813328122329105.\n",
      "[I 2026-07-02 15:00:04,930] Trial 166 finished with value: 1.950235709872677 and parameters: {'aci_target': 0.12879413903154888, 'aci_step_size': 0.05572201310151808, 'interval_scale': 0.8508704148473265, 'interval_power': 0.3787600670013291, 'min_width_factor': 0.10329482798042078}. Best is trial 128 with value: 1.8813328122329105.\n",
      "[I 2026-07-02 15:00:05,099] Trial 167 finished with value: 2.0223978523050055 and parameters: {'aci_target': 0.13925608651872984, 'aci_step_size': 0.032890849833315965, 'interval_scale': 0.7507652660230211, 'interval_power': 0.4980007626219627, 'min_width_factor': 0.32940788359890105}. Best is trial 128 with value: 1.8813328122329105.\n",
      "[I 2026-07-02 15:00:05,261] Trial 168 finished with value: 2.091732487434481 and parameters: {'aci_target': 0.1223276285507622, 'aci_step_size': 0.047016415796245443, 'interval_scale': 0.9043662950725861, 'interval_power': 0.41036837766460343, 'min_width_factor': 0.21675029446568514}. Best is trial 128 with value: 1.8813328122329105.\n",
      "[I 2026-07-02 15:00:05,425] Trial 169 finished with value: 2.27811310590993 and parameters: {'aci_target': 0.10382926754118067, 'aci_step_size': 0.03699489632310547, 'interval_scale': 0.7958486961607496, 'interval_power': 0.4692547494383022, 'min_width_factor': 0.38669973905876676}. Best is trial 128 with value: 1.8813328122329105.\n",
      "[I 2026-07-02 15:00:05,591] Trial 170 finished with value: 2.050254572516689 and parameters: {'aci_target': 0.11685493132830678, 'aci_step_size': 0.050694670972854745, 'interval_scale': 0.8265257473097126, 'interval_power': 0.44528714142001286, 'min_width_factor': 0.14103546848241688}. Best is trial 128 with value: 1.8813328122329105.\n",
      "[I 2026-07-02 15:00:05,749] Trial 171 finished with value: 1.904463580058435 and parameters: {'aci_target': 0.12705335104936036, 'aci_step_size': 0.043786384685862954, 'interval_scale': 0.7767194294347812, 'interval_power': 0.4304067740855783, 'min_width_factor': 0.2822326495106173}. Best is trial 128 with value: 1.8813328122329105.\n",
      "[I 2026-07-02 15:00:05,911] Trial 172 finished with value: 1.9435705508473966 and parameters: {'aci_target': 0.13095107780761217, 'aci_step_size': 0.04414411087403694, 'interval_scale': 0.7848809261247806, 'interval_power': 0.3898818979758239, 'min_width_factor': 0.27988306193767765}. Best is trial 128 with value: 1.8813328122329105.\n",
      "[I 2026-07-02 15:00:06,072] Trial 173 finished with value: 1.8977406204600176 and parameters: {'aci_target': 0.1339911599398138, 'aci_step_size': 0.040838034925393805, 'interval_scale': 0.7863831674596631, 'interval_power': 0.43630367286773897, 'min_width_factor': 0.18177876943280577}. Best is trial 128 with value: 1.8813328122329105.\n",
      "[I 2026-07-02 15:00:06,227] Trial 174 finished with value: 1.9145247358700195 and parameters: {'aci_target': 0.13711570705388326, 'aci_step_size': 0.03966485740716854, 'interval_scale': 0.7514848795864054, 'interval_power': 0.4240387338260367, 'min_width_factor': 0.24846152908665226}. Best is trial 128 with value: 1.8813328122329105.\n",
      "[I 2026-07-02 15:00:06,384] Trial 175 finished with value: 2.17459155834902 and parameters: {'aci_target': 0.13477239853031328, 'aci_step_size': 0.05976803821330762, 'interval_scale': 0.8617148026079885, 'interval_power': 0.4703758235868801, 'min_width_factor': 0.06300878918299657}. Best is trial 128 with value: 1.8813328122329105.\n",
      "[I 2026-07-02 15:00:06,538] Trial 176 finished with value: 1.9236803365361324 and parameters: {'aci_target': 0.14697840803458873, 'aci_step_size': 0.03619249477300268, 'interval_scale': 0.8162403433791433, 'interval_power': 0.40900743225914526, 'min_width_factor': 0.31823520116037385}. Best is trial 128 with value: 1.8813328122329105.\n",
      "[I 2026-07-02 15:00:06,693] Trial 177 finished with value: 2.192092458577002 and parameters: {'aci_target': 0.13088408630134793, 'aci_step_size': 0.05376978932082055, 'interval_scale': 0.7992304404533038, 'interval_power': 0.5096619896613283, 'min_width_factor': 0.27831316463143047}. Best is trial 128 with value: 1.8813328122329105.\n",
      "[I 2026-07-02 15:00:06,851] Trial 178 finished with value: 1.953315287378857 and parameters: {'aci_target': 0.10922445847119934, 'aci_step_size': 0.04249743536400878, 'interval_scale': 0.8354536554667993, 'interval_power': 0.37446134022737404, 'min_width_factor': 0.20428025876386152}. Best is trial 128 with value: 1.8813328122329105.\n",
      "[I 2026-07-02 15:00:07,005] Trial 179 finished with value: 1.8985448591912009 and parameters: {'aci_target': 0.12741207818856706, 'aci_step_size': 0.04920711669104243, 'interval_scale': 0.7522785194634243, 'interval_power': 0.43941246528988626, 'min_width_factor': 0.16654176605158783}. Best is trial 128 with value: 1.8813328122329105.\n",
      "[I 2026-07-02 15:00:07,164] Trial 180 finished with value: 2.0001516774842614 and parameters: {'aci_target': 0.12205176740152679, 'aci_step_size': 0.03359731799102771, 'interval_scale': 0.7532393027501285, 'interval_power': 0.4803899675063432, 'min_width_factor': 0.1108106768596713}. Best is trial 128 with value: 1.8813328122329105.\n",
      "[I 2026-07-02 15:00:07,332] Trial 181 finished with value: 1.910204002625686 and parameters: {'aci_target': 0.12872538733630676, 'aci_step_size': 0.04950888157884305, 'interval_scale': 0.7823972333970577, 'interval_power': 0.4246679222039822, 'min_width_factor': 0.15375567485324837}. Best is trial 128 with value: 1.8813328122329105.\n",
      "[I 2026-07-02 15:00:07,504] Trial 182 finished with value: 1.8984677711367444 and parameters: {'aci_target': 0.12705392602057944, 'aci_step_size': 0.05081100134067887, 'interval_scale': 0.7809659571051363, 'interval_power': 0.44160216308373434, 'min_width_factor': 0.15652756212038152}. Best is trial 128 with value: 1.8813328122329105.\n",
      "[I 2026-07-02 15:00:07,666] Trial 183 finished with value: 1.8957805337024471 and parameters: {'aci_target': 0.1419515763513402, 'aci_step_size': 0.05359886793060717, 'interval_scale': 0.7849022509611079, 'interval_power': 0.4401684727588584, 'min_width_factor': 0.14005086254314728}. Best is trial 128 with value: 1.8813328122329105.\n",
      "[I 2026-07-02 15:00:07,825] Trial 184 finished with value: 2.134444853109929 and parameters: {'aci_target': 0.14138987824881624, 'aci_step_size': 0.055091928655970346, 'interval_scale': 0.8783940263529653, 'interval_power': 0.45332820378125294, 'min_width_factor': 0.14219632934821985}. Best is trial 128 with value: 1.8813328122329105.\n",
      "[I 2026-07-02 15:00:07,981] Trial 185 finished with value: 2.084600904950899 and parameters: {'aci_target': 0.1371481298935984, 'aci_step_size': 0.061009584843499706, 'interval_scale': 0.7953505051366953, 'interval_power': 0.4928414024319297, 'min_width_factor': 0.08963883850651629}. Best is trial 128 with value: 1.8813328122329105.\n",
      "[I 2026-07-02 15:00:08,140] Trial 186 finished with value: 2.0291753689905914 and parameters: {'aci_target': 0.13331823726633937, 'aci_step_size': 0.0517893735652722, 'interval_scale': 0.8377572431567912, 'interval_power': 0.4444439736573147, 'min_width_factor': 0.16870008979362627}. Best is trial 128 with value: 1.8813328122329105.\n",
      "[I 2026-07-02 15:00:08,302] Trial 187 finished with value: 6.904070156251968 and parameters: {'aci_target': 0.1524027098363877, 'aci_step_size': 0.04856204227560831, 'interval_scale': 0.7873514632070524, 'interval_power': 1.1099535409554484, 'min_width_factor': 0.022974347385956967}. Best is trial 128 with value: 1.8813328122329105.\n",
      "[I 2026-07-02 15:00:08,467] Trial 188 finished with value: 2.0736520842244173 and parameters: {'aci_target': 0.127177082464733, 'aci_step_size': 0.05078919020961956, 'interval_scale': 0.8232814882346714, 'interval_power': 0.46070165138395963, 'min_width_factor': 0.13263024895234177}. Best is trial 128 with value: 1.8813328122329105.\n",
      "[I 2026-07-02 15:00:08,624] Trial 189 finished with value: 2.057549904718547 and parameters: {'aci_target': 0.13407255434668933, 'aci_step_size': 0.04077219798583037, 'interval_scale': 0.924941515179438, 'interval_power': 0.39507143019711055, 'min_width_factor': 0.0844120010885561}. Best is trial 128 with value: 1.8813328122329105.\n",
      "[I 2026-07-02 15:00:08,785] Trial 190 finished with value: 2.1550535483875177 and parameters: {'aci_target': 0.14339211535743931, 'aci_step_size': 0.05736998553728258, 'interval_scale': 0.7836715878146198, 'interval_power': 0.5215950646364487, 'min_width_factor': 0.17081311957697679}. Best is trial 128 with value: 1.8813328122329105.\n",
      "[I 2026-07-02 15:00:08,947] Trial 191 finished with value: 1.9058649800175242 and parameters: {'aci_target': 0.12729671483481367, 'aci_step_size': 0.044915571917957, 'interval_scale': 0.7516763342105904, 'interval_power': 0.43203235515982913, 'min_width_factor': 0.21680696062369859}. Best is trial 128 with value: 1.8813328122329105.\n",
      "[I 2026-07-02 15:00:09,106] Trial 192 finished with value: 1.894742217726819 and parameters: {'aci_target': 0.12866791415193685, 'aci_step_size': 0.0454445096382534, 'interval_scale': 0.7777412107457424, 'interval_power': 0.43982724578628396, 'min_width_factor': 0.19841424075703493}. Best is trial 128 with value: 1.8813328122329105.\n",
      "[I 2026-07-02 15:00:09,266] Trial 193 finished with value: 10.555092004470167 and parameters: {'aci_target': 0.12750087869327795, 'aci_step_size': 0.04573438847504806, 'interval_scale': 4.063778468290436, 'interval_power': 0.4757138056267008, 'min_width_factor': 0.19636652453218106}. Best is trial 128 with value: 1.8813328122329105.\n",
      "[I 2026-07-02 15:00:09,432] Trial 194 finished with value: 1.9156852696454243 and parameters: {'aci_target': 0.13118322186336245, 'aci_step_size': 0.05354466870479278, 'interval_scale': 0.7848271909237037, 'interval_power': 0.447661496362217, 'min_width_factor': 0.24434534910594463}. Best is trial 128 with value: 1.8813328122329105.\n",
      "[I 2026-07-02 15:00:09,596] Trial 195 finished with value: 1.928011104399034 and parameters: {'aci_target': 0.13906244133853332, 'aci_step_size': 0.04871736625751349, 'interval_scale': 0.8512453876074061, 'interval_power': 0.40179249488956165, 'min_width_factor': 0.20701733282350437}. Best is trial 128 with value: 1.8813328122329105.\n",
      "[I 2026-07-02 15:00:09,756] Trial 196 finished with value: 2.192514799623272 and parameters: {'aci_target': 0.12478119565387609, 'aci_step_size': 0.0401228516921669, 'interval_scale': 0.8178628174048483, 'interval_power': 0.48903731384334975, 'min_width_factor': 0.29830022025461966}. Best is trial 128 with value: 1.8813328122329105.\n",
      "[I 2026-07-02 15:00:09,915] Trial 197 finished with value: 1.8929369048866782 and parameters: {'aci_target': 0.13438313720829906, 'aci_step_size': 0.04456142876337855, 'interval_scale': 0.782339972038919, 'interval_power': 0.4415865656270735, 'min_width_factor': 0.13140045610494305}. Best is trial 128 with value: 1.8813328122329105.\n",
      "[I 2026-07-02 15:00:10,088] Trial 198 finished with value: 2.2097986233280347 and parameters: {'aci_target': 0.136621932999659, 'aci_step_size': 0.0500207679999231, 'interval_scale': 0.8800914930350903, 'interval_power': 0.46539959639087836, 'min_width_factor': 0.12483992257464732}. Best is trial 128 with value: 1.8813328122329105.\n",
