      "[I 2026-07-02 16:32:43,008] Trial 272 finished with value: 0.014558717991908568 and parameters: {'foundation_window': 5, 'ar_lags': 4, 'ema_spans': (2, 4, 8), 'conv_scales': (2, 4, 8), 'use_calendar': True, 'ridge_alpha': 0.2699331220560577, 'shrinkage_max': 0.3393353906799447, 'oob_split_ratio': 0.6570020242682665}. Best is trial 144 with value: 0.009471602415253667.\n",
      "[I 2026-07-02 16:32:43,326] Trial 273 finished with value: 0.01014824875634632 and parameters: {'foundation_window': 4, 'ar_lags': 4, 'ema_spans': (2, 4, 8), 'conv_scales': (2, 4, 8), 'use_calendar': True, 'ridge_alpha': 0.20721885939910514, 'shrinkage_max': 0.30393954580374494, 'oob_split_ratio': 0.6520251448566964}. Best is trial 144 with value: 0.009471602415253667.\n",
      "[I 2026-07-02 16:32:43,645] Trial 274 finished with value: 0.01378199067753172 and parameters: {'foundation_window': 3, 'ar_lags': 4, 'ema_spans': (2, 4, 8), 'conv_scales': (2, 4, 8), 'use_calendar': True, 'ridge_alpha': 0.13048925323808683, 'shrinkage_max': 0.3994790646167045, 'oob_split_ratio': 0.6511180002751024}. Best is trial 144 with value: 0.009471602415253667.\n",
      "[I 2026-07-02 16:32:43,955] Trial 275 finished with value: 0.009918188643538111 and parameters: {'foundation_window': 4, 'ar_lags': 4, 'ema_spans': (2, 4, 8), 'conv_scales': (2, 4, 8), 'use_calendar': True, 'ridge_alpha': 0.20048241436789663, 'shrinkage_max': 0.2523846845520465, 'oob_split_ratio': 0.6424996138986119}. Best is trial 144 with value: 0.009471602415253667.\n",
      "[I 2026-07-02 16:32:44,268] Trial 276 finished with value: 0.012053809608383162 and parameters: {'foundation_window': 4, 'ar_lags': 4, 'ema_spans': (2, 4, 8), 'conv_scales': (2, 4, 8), 'use_calendar': True, 'ridge_alpha': 0.18414749070074746, 'shrinkage_max': 0.25024921808679124, 'oob_split_ratio': 0.6414409749175553}. Best is trial 144 with value: 0.009471602415253667.\n",
      "[I 2026-07-02 16:32:44,583] Trial 277 finished with value: 0.015105391094039819 and parameters: {'foundation_window': 4, 'ar_lags': 4, 'ema_spans': (2, 3, 5, 8), 'conv_scales': (2, 4, 8), 'use_calendar': True, 'ridge_alpha': 0.20094631119779569, 'shrinkage_max': 0.3414538828531169, 'oob_split_ratio': 0.6339972178078489}. Best is trial 144 with value: 0.009471602415253667.\n",
      "[I 2026-07-02 16:32:44,911] Trial 278 finished with value: 0.011008363362948833 and parameters: {'foundation_window': 4, 'ar_lags': 4, 'ema_spans': (2, 4, 8), 'conv_scales': (2, 4, 8), 'use_calendar': True, 'ridge_alpha': 0.08073315801305124, 'shrinkage_max': 0.25083913434398225, 'oob_split_ratio': 0.6890661354877592}. Best is trial 144 with value: 0.009471602415253667.\n",
      "[I 2026-07-02 16:32:45,226] Trial 279 finished with value: 0.014308175021341407 and parameters: {'foundation_window': 4, 'ar_lags': 4, 'ema_spans': (2, 4, 8), 'conv_scales': (2, 4, 8), 'use_calendar': True, 'ridge_alpha': 0.09092348314543333, 'shrinkage_max': 0.4453499672539333, 'oob_split_ratio': 0.6437221102148646}. Best is trial 144 with value: 0.009471602415253667.\n",
      "[I 2026-07-02 16:32:45,541] Trial 280 finished with value: 0.013176110429474265 and parameters: {'foundation_window': 4, 'ar_lags': 4, 'ema_spans': (2, 4, 8), 'conv_scales': (2, 4, 8), 'use_calendar': True, 'ridge_alpha': 0.21901758230446294, 'shrinkage_max': 0.29900490933694157, 'oob_split_ratio': 0.639089417995926}. Best is trial 144 with value: 0.009471602415253667.\n",
      "[I 2026-07-02 16:32:45,856] Trial 281 finished with value: 0.014894073902906676 and parameters: {'foundation_window': 3, 'ar_lags': 4, 'ema_spans': (2, 4, 8), 'conv_scales': (2, 4, 8), 'use_calendar': True, 'ridge_alpha': 0.14997286690727452, 'shrinkage_max': 0.36000400189649967, 'oob_split_ratio': 0.6503218286481086}. Best is trial 144 with value: 0.009471602415253667.\n",
      "[I 2026-07-02 16:32:46,163] Trial 282 finished with value: 0.011487024955312987 and parameters: {'foundation_window': 4, 'ar_lags': 4, 'ema_spans': (3, 6), 'conv_scales': (2, 4, 8), 'use_calendar': True, 'ridge_alpha': 0.30529519291729396, 'shrinkage_max': 0.30524495871174895, 'oob_split_ratio': 0.6460085708594197}. Best is trial 144 with value: 0.009471602415253667.\n",
      "[I 2026-07-02 16:32:46,479] Trial 283 finished with value: 0.01759739033568296 and parameters: {'foundation_window': 5, 'ar_lags': 4, 'ema_spans': (2, 4, 8), 'conv_scales': (2, 4, 8), 'use_calendar': True, 'ridge_alpha': 0.12425845433603437, 'shrinkage_max': 0.25174024568621134, 'oob_split_ratio': 0.6216392304849631}. Best is trial 144 with value: 0.009471602415253667.\n",
      "[I 2026-07-02 16:32:46,798] Trial 284 finished with value: 0.014494427723058312 and parameters: {'foundation_window': 4, 'ar_lags': 4, 'ema_spans': (2, 4, 8), 'conv_scales': (2, 4, 8), 'use_calendar': True, 'ridge_alpha': 0.17823983574558463, 'shrinkage_max': 0.3933492513295528, 'oob_split_ratio': 0.6655595998367936}. Best is trial 144 with value: 0.009471602415253667.\n",
      "[I 2026-07-02 16:32:47,117] Trial 285 finished with value: 0.010651041409065766 and parameters: {'foundation_window': 4, 'ar_lags': 4, 'ema_spans': (2, 4, 8), 'conv_scales': (2, 4, 8), 'use_calendar': True, 'ridge_alpha': 0.29881202242519067, 'shrinkage_max': 0.3375302174169963, 'oob_split_ratio': 0.6498887933238163}. Best is trial 144 with value: 0.009471602415253667.\n",
      "[I 2026-07-02 16:32:47,444] Trial 286 finished with value: 0.010487828325560887 and parameters: {'foundation_window': 4, 'ar_lags': 4, 'ema_spans': (2, 3, 5, 8), 'conv_scales': (2, 4, 8), 'use_calendar': True, 'ridge_alpha': 0.2497668718789347, 'shrinkage_max': 0.2976968680456539, 'oob_split_ratio': 0.6601020803228225}. Best is trial 144 with value: 0.009471602415253667.\n",
      "[I 2026-07-02 16:32:47,767] Trial 287 finished with value: 0.02370363103744419 and parameters: {'foundation_window': 3, 'ar_lags': 4, 'ema_spans': (2, 4, 8), 'conv_scales': (2, 4, 8), 'use_calendar': False, 'ridge_alpha': 0.21377950535706836, 'shrinkage_max': 0.3610031838123623, 'oob_split_ratio': 0.6516819779497578}. Best is trial 144 with value: 0.009471602415253667.\n",
      "[I 2026-07-02 16:32:48,026] Trial 288 finished with value: 0.010994673817157574 and parameters: {'foundation_window': 4, 'ar_lags': 4, 'ema_spans': (2, 4, 8), 'conv_scales': (2, 3), 'use_calendar': True, 'ridge_alpha': 0.16405177817816577, 'shrinkage_max': 0.30991731451520227, 'oob_split_ratio': 0.6447922032989377}. Best is trial 144 with value: 0.009471602415253667.\n",
      "[I 2026-07-02 16:32:48,341] Trial 289 finished with value: 0.02531750594534178 and parameters: {'foundation_window': 4, 'ar_lags': 4, 'ema_spans': (2, 4), 'conv_scales': (2, 4, 8), 'use_calendar': True, 'ridge_alpha': 0.11242618199690263, 'shrinkage_max': 0.43605624593520853, 'oob_split_ratio': 0.6382847729673825}. Best is trial 144 with value: 0.009471602415253667.\n",
      "[I 2026-07-02 16:32:48,656] Trial 290 finished with value: 0.010163413615469814 and parameters: {'foundation_window': 4, 'ar_lags': 4, 'ema_spans': (2, 4, 8), 'conv_scales': (2, 4, 8), 'use_calendar': True, 'ridge_alpha': 0.3068410876349488, 'shrinkage_max': 0.2522331191735561, 'oob_split_ratio': 0.6576522413814073}. Best is trial 144 with value: 0.009471602415253667.\n",
      "[I 2026-07-02 16:32:48,976] Trial 291 finished with value: 0.010938181719384656 and parameters: {'foundation_window': 4, 'ar_lags': 4, 'ema_spans': (2, 4, 8), 'conv_scales': (2, 3, 4), 'use_calendar': True, 'ridge_alpha': 0.22350774589967567, 'shrinkage_max': 0.2504591500011825, 'oob_split_ratio': 0.6684903882002754}. Best is trial 144 with value: 0.009471602415253667.\n",
      "[I 2026-07-02 16:32:49,298] Trial 292 finished with value: 0.02685871807414318 and parameters: {'foundation_window': 9, 'ar_lags': 4, 'ema_spans': (2, 4, 8), 'conv_scales': (2, 4, 8), 'use_calendar': True, 'ridge_alpha': 0.2816875262769376, 'shrinkage_max': 0.3803258715011138, 'oob_split_ratio': 0.6433173666391506}. Best is trial 144 with value: 0.009471602415253667.\n",
      "[I 2026-07-02 16:32:49,610] Trial 293 finished with value: 0.010443259310792652 and parameters: {'foundation_window': 4, 'ar_lags': 4, 'ema_spans': (2, 4, 8), 'conv_scales': (2, 4, 8), 'use_calendar': True, 'ridge_alpha': 0.14760913962363434, 'shrinkage_max': 0.31168499206360933, 'oob_split_ratio': 0.64881856133252}. Best is trial 144 with value: 0.009471602415253667.\n",
      "[I 2026-07-02 16:32:49,935] Trial 294 finished with value: 0.036967165580231214 and parameters: {'foundation_window': 5, 'ar_lags': 4, 'ema_spans': (2, 4, 8), 'conv_scales': (3, 6, 12), 'use_calendar': True, 'ridge_alpha': 0.19319803384205803, 'shrinkage_max': 2.446567722432603, 'oob_split_ratio': 0.6947365295747256}. Best is trial 144 with value: 0.009471602415253667.\n",
      "[I 2026-07-02 16:32:50,277] Trial 295 finished with value: 0.01149050949981778 and parameters: {'foundation_window': 4, 'ar_lags': 4, 'ema_spans': (2, 3, 5, 8), 'conv_scales': (2, 4, 8), 'use_calendar': True, 'ridge_alpha': 0.31836515689582556, 'shrinkage_max': 0.3428796705449412, 'oob_split_ratio': 0.6619886953376037}. Best is trial 144 with value: 0.009471602415253667.\n",
      "[I 2026-07-02 16:32:50,534] Trial 296 finished with value: 0.010532237269679182 and parameters: {'foundation_window': 4, 'ar_lags': 4, 'ema_spans': (2, 4, 8), 'conv_scales': (2, 3), 'use_calendar': True, 'ridge_alpha': 0.059187064899926554, 'shrinkage_max': 0.2943134917682932, 'oob_split_ratio': 0.653417394498015}. Best is trial 144 with value: 0.009471602415253667.\n",
      "[I 2026-07-02 16:32:50,856] Trial 297 finished with value: 0.013376549493735282 and parameters: {'foundation_window': 4, 'ar_lags': 4, 'ema_spans': (2, 4, 8), 'conv_scales': (2, 4, 8), 'use_calendar': True, 'ridge_alpha': 0.23611542848253528, 'shrinkage_max': 0.39628149153718784, 'oob_split_ratio': 0.657344542728039}. Best is trial 144 with value: 0.009471602415253667.\n",
      "[I 2026-07-02 16:32:51,176] Trial 298 finished with value: 0.016967576720052942 and parameters: {'foundation_window': 5, 'ar_lags': 4, 'ema_spans': (2, 4, 8), 'conv_scales': (2, 4, 8), 'use_calendar': True, 'ridge_alpha': 0.1757948334195214, 'shrinkage_max': 0.2520157818310057, 'oob_split_ratio': 0.6322298846744814}. Best is trial 144 with value: 0.009471602415253667.\n",
      "[I 2026-07-02 16:32:51,493] Trial 299 finished with value: 0.02608616830126426 and parameters: {'foundation_window': 12, 'ar_lags': 4, 'ema_spans': (2, 4, 8), 'conv_scales': (2, 4, 8), 'use_calendar': True, 'ridge_alpha': 0.10573232479872817, 'shrinkage_max': 0.3434414121336269, 'oob_split_ratio': 0.6743608316409392}. Best is trial 144 with value: 0.009471602415253667.\n",
      "[I 2026-07-02 16:32:51,497] A new study created in memory with name: no-name-460e9279-f1d0-4c25-9581-72ef1b32b4de\n",
      "[I 2026-07-02 16:32:51,732] Trial 0 finished with value: 169.10424115994368 and parameters: {'aci_target': 0.08116262258099886, 'aci_step_size': 0.1667521176194013, 'interval_scale': 4.242013644282549, 'interval_power': 0.7483231052462957, 'min_width_factor': 0.23402796066365478}. Best is trial 0 with value: 169.10424115994368.\n",
      "[I 2026-07-02 16:32:51,963] Trial 1 finished with value: 291.28041445549337 and parameters: {'aci_target': 0.039638958863878505, 'aci_step_size': 0.006194745024628934, 'interval_scale': 5.827941999313553, 'interval_power': 0.751393764679011, 'min_width_factor': 1.0621088666940683}. Best is trial 0 with value: 169.10424115994368.\n",
      "[I 2026-07-02 16:32:52,195] Trial 2 finished with value: 105.35369583679324 and parameters: {'aci_target': 0.013911053916202464, 'aci_step_size': 0.17898794163735265, 'interval_scale': 5.380668161216503, 'interval_power': 0.2654238883478452, 'min_width_factor': 0.2727374508106509}. Best is trial 2 with value: 105.35369583679324.\n",
      "[I 2026-07-02 16:32:52,422] Trial 3 finished with value: 86.19196121026225 and parameters: {'aci_target': 0.044846856872152424, 'aci_step_size': 0.015359756451337138, 'interval_scale': 2.5973229202817874, 'interval_power': 0.5399312733026447, 'min_width_factor': 0.43684371029706287}. Best is trial 3 with value: 86.19196121026225.\n",
      "[I 2026-07-02 16:32:52,652] Trial 4 finished with value: 36.416982722078394 and parameters: {'aci_target': 0.1262520499972521, 'aci_step_size': 0.008364645453054504, 'interval_scale': 1.497594903821026, 'interval_power': 0.45795230411711463, 'min_width_factor': 0.6841049763255539}. Best is trial 4 with value: 36.416982722078394.\n",
      "[I 2026-07-02 16:32:52,886] Trial 5 finished with value: 93.26968828810648 and parameters: {'aci_target': 0.1591834326646726, 'aci_step_size': 0.010443820094525779, 'interval_scale': 2.533430745147415, 'interval_power': 0.7405182110775531, 'min_width_factor': 0.06967561907999659}. Best is trial 4 with value: 36.416982722078394.\n",
      "[I 2026-07-02 16:32:53,113] Trial 6 finished with value: 91.59806406059316 and parameters: {'aci_target': 0.1254335218612733, 'aci_step_size': 0.009379072229909205, 'interval_scale': 0.8748551837921115, 'interval_power': 1.1861069215666666, 'min_width_factor': 1.448448049611839}. Best is trial 4 with value: 36.416982722078394.\n",
      "[I 2026-07-02 16:32:53,339] Trial 7 finished with value: 43.804083779251854 and parameters: {'aci_target': 0.16359549614212762, 'aci_step_size': 0.015380821666156693, 'interval_scale': 0.9450852868317626, 'interval_power': 0.8552912831401961, 'min_width_factor': 0.660228740609402}. Best is trial 4 with value: 36.416982722078394.\n",
      "[I 2026-07-02 16:32:53,567] Trial 8 finished with value: 87.98199797157233 and parameters: {'aci_target': 0.03318726462050798, 'aci_step_size': 0.031065126086242026, 'interval_scale': 0.813605078655861, 'interval_power': 1.1366505025984777, 'min_width_factor': 0.3881699724000254}. Best is trial 4 with value: 36.416982722078394.\n",
      "[I 2026-07-02 16:32:53,798] Trial 9 finished with value: 96.8072694875601 and parameters: {'aci_target': 0.13587923402725657, 'aci_step_size': 0.015788826347222458, 'interval_scale': 2.56865706988151, 'interval_power': 0.6833878491790996, 'min_width_factor': 0.27728168328829056}. Best is trial 4 with value: 36.416982722078394.\n",
      "[I 2026-07-02 16:32:54,035] Trial 10 finished with value: 13.750409871040192 and parameters: {'aci_target': 0.19304533013217717, 'aci_step_size': 0.06610156725777806, 'interval_scale': 1.4936103712207425, 'interval_power': 0.022452344518524514, 'min_width_factor': 0.8484196360221048}. Best is trial 10 with value: 13.750409871040192.\n",
      "[I 2026-07-02 16:32:54,272] Trial 11 finished with value: 16.682218078499883 and parameters: {'aci_target': 0.1827625076874392, 'aci_step_size': 0.05707013708764262, 'interval_scale': 1.546408828028792, 'interval_power': 0.08106665007792413, 'min_width_factor': 0.8275726512169777}. Best is trial 10 with value: 13.750409871040192.\n",
      "[I 2026-07-02 16:32:54,512] Trial 12 finished with value: 13.389642895080277 and parameters: {'aci_target': 0.19896598297512252, 'aci_step_size': 0.06544185131336373, 'interval_scale': 1.47546089367298, 'interval_power': 0.04180216636043358, 'min_width_factor': 0.9832662306816944}. Best is trial 12 with value: 13.389642895080277.\n",
      "[I 2026-07-02 16:32:54,750] Trial 13 finished with value: 12.85411352118769 and parameters: {'aci_target': 0.194328303699887, 'aci_step_size': 0.07167156742591459, 'interval_scale': 1.4611864202550429, 'interval_power': 0.005394413552805646, 'min_width_factor': 1.0885636075794554}. Best is trial 13 with value: 12.85411352118769.\n",
      "[I 2026-07-02 16:32:54,991] Trial 14 finished with value: 22.54650357566175 and parameters: {'aci_target': 0.19698560826105685, 'aci_step_size': 0.07455884446865184, 'interval_scale': 1.8574737526190015, 'interval_power': 0.2103865579407833, 'min_width_factor': 1.2309839900009365}. Best is trial 13 with value: 12.85411352118769.\n",
      "[I 2026-07-02 16:32:55,227] Trial 15 finished with value: 19.63911792532842 and parameters: {'aci_target': 0.15937293707912542, 'aci_step_size': 0.039431781061088196, 'interval_scale': 1.1592001902163027, 'interval_power': 0.23441578929170898, 'min_width_factor': 1.12442796077842}. Best is trial 13 with value: 12.85411352118769.\n",
      "[I 2026-07-02 16:32:55,464] Trial 16 finished with value: 23.924355042800126 and parameters: {'aci_target': 0.17410898274785402, 'aci_step_size': 0.11523049692244666, 'interval_scale': 2.0251452020253753, 'interval_power': 0.02617721248917543, 'min_width_factor': 1.4094230797443883}. Best is trial 13 with value: 12.85411352118769.\n",
      "[I 2026-07-02 16:32:55,701] Trial 17 finished with value: 20.373797484662983 and parameters: {'aci_target': 0.1997832041282476, 'aci_step_size': 0.03413686224705092, 'interval_scale': 1.1885394703209513, 'interval_power': 0.3661085908042725, 'min_width_factor': 0.9331647602655707}. Best is trial 13 with value: 12.85411352118769.\n",
      "[I 2026-07-02 16:32:55,941] Trial 18 finished with value: 55.67076106645055 and parameters: {'aci_target': 0.13871317816795686, 'aci_step_size': 0.09749432857624298, 'interval_scale': 3.8861711606938143, 'interval_power': 0.13891640170468522, 'min_width_factor': 1.281292950234091}. Best is trial 13 with value: 12.85411352118769.\n",
      "[I 2026-07-02 16:32:56,184] Trial 19 finished with value: 24.757725056682716 and parameters: {'aci_target': 0.09959881238844914, 'aci_step_size': 0.0440090683730095, 'interval_scale': 1.1645748399749274, 'interval_power': 0.3175957127622252, 'min_width_factor': 1.0637027003173947}. Best is trial 13 with value: 12.85411352118769.\n",
      "[I 2026-07-02 16:32:56,428] Trial 20 finished with value: 38.87222332263367 and parameters: {'aci_target': 0.17345150035482088, 'aci_step_size': 0.023688587618201168, 'interval_scale': 3.172473466693102, 'interval_power': 0.15777115841269507, 'min_width_factor': 0.6049916509492846}. Best is trial 13 with value: 12.85411352118769.\n",
      "[I 2026-07-02 16:32:56,675] Trial 21 finished with value: 14.148464115803801 and parameters: {'aci_target': 0.18578496168179168, 'aci_step_size': 0.058889702505946176, 'interval_scale': 1.5327091659655097, 'interval_power': 0.003249799946626178, 'min_width_factor': 0.8654237608345168}. Best is trial 13 with value: 12.85411352118769.\n",
      "[I 2026-07-02 16:32:56,923] Trial 22 finished with value: 16.808772286139142 and parameters: {'aci_target': 0.19926308841614693, 'aci_step_size': 0.1040493093738354, 'interval_scale': 1.9157147825009655, 'interval_power': 0.0050896170272364885, 'min_width_factor': 0.8735701405673414}. Best is trial 13 with value: 12.85411352118769.\n",
      "[I 2026-07-02 16:32:57,164] Trial 23 finished with value: 19.29667138996026 and parameters: {'aci_target': 0.15237136595028214, 'aci_step_size': 0.07273966137517698, 'interval_scale': 1.3708686508169705, 'interval_power': 0.1289650001629555, 'min_width_factor': 0.9941835543630181}. Best is trial 13 with value: 12.85411352118769.\n",
      "[I 2026-07-02 16:32:57,413] Trial 24 finished with value: 18.85974729672874 and parameters: {'aci_target': 0.18201779349353048, 'aci_step_size': 0.05314235819674111, 'interval_scale': 1.0152424645598241, 'interval_power': 0.3867832683877269, 'min_width_factor': 1.238652330543632}. Best is trial 13 with value: 12.85411352118769.\n",
      "[I 2026-07-02 16:32:57,651] Trial 25 finished with value: 23.099440145992325 and parameters: {'aci_target': 0.18718138756119146, 'aci_step_size': 0.07428897713974669, 'interval_scale': 2.111454127633885, 'interval_power': 0.11731810970979845, 'min_width_factor': 0.7570193506344316}. Best is trial 13 with value: 12.85411352118769.\n",
      "[I 2026-07-02 16:32:57,889] Trial 26 finished with value: 25.379569422580207 and parameters: {'aci_target': 0.1684629966544719, 'aci_step_size': 0.026764313675321793, 'interval_scale': 1.722193235517005, 'interval_power': 0.24002092448382203, 'min_width_factor': 1.1410827467755407}. Best is trial 13 with value: 12.85411352118769.\n",
      "[I 2026-07-02 16:32:58,125] Trial 27 finished with value: 13.736955063435607 and parameters: {'aci_target': 0.14377506175124619, 'aci_step_size': 0.12819720679817947, 'interval_scale': 1.2574818960808283, 'interval_power': 0.05187530199565783, 'min_width_factor': 0.5569923784079154}. Best is trial 13 with value: 12.85411352118769.\n",
      "[I 2026-07-02 16:32:58,363] Trial 28 finished with value: 93.86791310522392 and parameters: {'aci_target': 0.09438660367506801, 'aci_step_size': 0.1245359793453717, 'interval_scale': 7.928838532958431, 'interval_power': 0.09593999931555441, 'min_width_factor': 0.6062531313542439}. Best is trial 13 with value: 12.85411352118769.\n",
      "[I 2026-07-02 16:32:58,601] Trial 29 finished with value: 20.1940307249989 and parameters: {'aci_target': 0.07056109323926979, 'aci_step_size': 0.1596838421671658, 'interval_scale': 0.7709175734460078, 'interval_power': 0.48540610042356264, 'min_width_factor': 0.5043692961673818}. Best is trial 13 with value: 12.85411352118769.\n",
      "[I 2026-07-02 16:32:58,845] Trial 30 finished with value: 19.694717713637193 and parameters: {'aci_target': 0.14599819431982156, 'aci_step_size': 0.09115458715581015, 'interval_scale': 1.2866577805986124, 'interval_power': 0.17897123407768328, 'min_width_factor': 1.372532869957159}. Best is trial 13 with value: 12.85411352118769.\n",
      "[I 2026-07-02 16:32:59,083] Trial 31 finished with value: 14.517736188526145 and parameters: {'aci_target': 0.10828475450216447, 'aci_step_size': 0.14300598059508726, 'interval_scale': 1.0284710558956165, 'interval_power': 0.06654383106901704, 'min_width_factor': 0.9757556914671477}. Best is trial 13 with value: 12.85411352118769.\n",
