      "[I 2026-07-02 16:33:10,380] Trial 145 finished with value: 0.005862396767618263 and parameters: {'foundation_window': 10, 'ar_lags': 6, 'ema_spans': (2, 4, 8), 'conv_scales': (2, 3), 'use_calendar': True, 'ridge_alpha': 0.00438609069119675, 'shrinkage_max': 2.202569311497898, 'oob_split_ratio': 0.7995245253712853}. Best is trial 144 with value: 0.0058326207528533874.\n",
      "[I 2026-07-02 16:33:10,508] Trial 146 finished with value: 0.012062559441444477 and parameters: {'foundation_window': 11, 'ar_lags': 6, 'ema_spans': (2, 4, 8), 'conv_scales': (2, 3), 'use_calendar': False, 'ridge_alpha': 0.004367822697185121, 'shrinkage_max': 2.1381496414503482, 'oob_split_ratio': 0.7993228846576624}. Best is trial 144 with value: 0.0058326207528533874.\n",
      "[I 2026-07-02 16:33:10,636] Trial 147 finished with value: 0.005788911183044132 and parameters: {'foundation_window': 10, 'ar_lags': 6, 'ema_spans': (2, 4, 8), 'conv_scales': (2, 3), 'use_calendar': True, 'ridge_alpha': 0.0025781314394113164, 'shrinkage_max': 2.2132636781769643, 'oob_split_ratio': 0.7945047114542122}. Best is trial 147 with value: 0.005788911183044132.\n",
      "[I 2026-07-02 16:33:10,778] Trial 148 finished with value: 0.009690152016654323 and parameters: {'foundation_window': 9, 'ar_lags': 6, 'ema_spans': (2, 4, 8), 'conv_scales': (2, 3, 4), 'use_calendar': True, 'ridge_alpha': 0.0025384879862623334, 'shrinkage_max': 2.227193760020773, 'oob_split_ratio': 0.7905905215569325}. Best is trial 147 with value: 0.005788911183044132.\n",
      "[I 2026-07-02 16:33:10,913] Trial 149 finished with value: 0.005912971866343999 and parameters: {'foundation_window': 10, 'ar_lags': 6, 'ema_spans': (2, 4, 8), 'conv_scales': (2, 3), 'use_calendar': True, 'ridge_alpha': 0.004016592708394517, 'shrinkage_max': 2.0799977752995376, 'oob_split_ratio': 0.7937457512482354}. Best is trial 147 with value: 0.005788911183044132.\n",
      "[I 2026-07-02 16:33:11,047] Trial 150 finished with value: 0.005920353277045528 and parameters: {'foundation_window': 10, 'ar_lags': 6, 'ema_spans': (2, 4, 8), 'conv_scales': (2, 3), 'use_calendar': True, 'ridge_alpha': 0.004059785352098525, 'shrinkage_max': 2.0685468350433425, 'oob_split_ratio': 0.7944452458098428}. Best is trial 147 with value: 0.005788911183044132.\n",
      "[I 2026-07-02 16:33:11,181] Trial 151 finished with value: 0.005920652563626674 and parameters: {'foundation_window': 10, 'ar_lags': 6, 'ema_spans': (2, 4, 8), 'conv_scales': (2, 3), 'use_calendar': True, 'ridge_alpha': 0.003948351872859162, 'shrinkage_max': 2.060748179613336, 'oob_split_ratio': 0.7946076871954602}. Best is trial 147 with value: 0.005788911183044132.\n",
      "[I 2026-07-02 16:33:11,313] Trial 152 finished with value: 0.005854962180700058 and parameters: {'foundation_window': 10, 'ar_lags': 6, 'ema_spans': (2, 4, 8), 'conv_scales': (2, 3), 'use_calendar': True, 'ridge_alpha': 0.0020442508984809854, 'shrinkage_max': 2.058216358218575, 'oob_split_ratio': 0.7941454114800385}. Best is trial 147 with value: 0.005788911183044132.\n",
      "[I 2026-07-02 16:33:11,446] Trial 153 finished with value: 0.005890934426220092 and parameters: {'foundation_window': 10, 'ar_lags': 6, 'ema_spans': (2, 4, 8), 'conv_scales': (2, 3), 'use_calendar': True, 'ridge_alpha': 0.0020350358302176864, 'shrinkage_max': 1.9912887232627134, 'oob_split_ratio': 0.794420754957311}. Best is trial 147 with value: 0.005788911183044132.\n",
      "[I 2026-07-02 16:33:11,575] Trial 154 finished with value: 0.006909163951428786 and parameters: {'foundation_window': 10, 'ar_lags': 6, 'ema_spans': (2, 4, 8), 'conv_scales': (3, 6), 'use_calendar': True, 'ridge_alpha': 0.0033402871870127603, 'shrinkage_max': 2.0549217480846997, 'oob_split_ratio': 0.7927177216991521}. Best is trial 147 with value: 0.005788911183044132.\n",
      "[I 2026-07-02 16:33:11,706] Trial 155 finished with value: 0.005927784955649111 and parameters: {'foundation_window': 10, 'ar_lags': 6, 'ema_spans': (2, 4, 8), 'conv_scales': (2, 3), 'use_calendar': True, 'ridge_alpha': 0.002011827654776102, 'shrinkage_max': 1.9262736555206952, 'oob_split_ratio': 0.7994259001838967}. Best is trial 147 with value: 0.005788911183044132.\n",
      "[I 2026-07-02 16:33:11,834] Trial 156 finished with value: 0.008957572107609797 and parameters: {'foundation_window': 11, 'ar_lags': 6, 'ema_spans': (2, 4, 8), 'conv_scales': (2, 3), 'use_calendar': True, 'ridge_alpha': 0.0017682399021450156, 'shrinkage_max': 1.9203673656143716, 'oob_split_ratio': 0.795420692307516}. Best is trial 147 with value: 0.005788911183044132.\n",
      "[I 2026-07-02 16:33:11,968] Trial 157 finished with value: 0.005825442891151159 and parameters: {'foundation_window': 10, 'ar_lags': 6, 'ema_spans': (2, 4, 8), 'conv_scales': (2, 3), 'use_calendar': True, 'ridge_alpha': 0.002094700986845363, 'shrinkage_max': 2.113713440504816, 'oob_split_ratio': 0.7986855757595351}. Best is trial 147 with value: 0.005788911183044132.\n",
      "[I 2026-07-02 16:33:12,099] Trial 158 finished with value: 0.005905626754908228 and parameters: {'foundation_window': 10, 'ar_lags': 6, 'ema_spans': (2, 4, 8), 'conv_scales': (2, 3), 'use_calendar': True, 'ridge_alpha': 0.0023536175121829516, 'shrinkage_max': 1.9855104344022647, 'oob_split_ratio': 0.7994470765777034}. Best is trial 147 with value: 0.005788911183044132.\n",
      "[I 2026-07-02 16:33:12,226] Trial 159 finished with value: 0.009691442493831153 and parameters: {'foundation_window': 9, 'ar_lags': 6, 'ema_spans': (2, 4, 8), 'conv_scales': (2, 3), 'use_calendar': True, 'ridge_alpha': 0.002089007142847283, 'shrinkage_max': 1.9836933140621498, 'oob_split_ratio': 0.7974993692809996}. Best is trial 147 with value: 0.005788911183044132.\n",
      "[I 2026-07-02 16:33:12,368] Trial 160 finished with value: 0.007831336083957618 and parameters: {'foundation_window': 10, 'ar_lags': 6, 'ema_spans': (2, 4, 8), 'conv_scales': (3, 6, 12), 'use_calendar': True, 'ridge_alpha': 0.002677769946521774, 'shrinkage_max': 1.917057993502565, 'oob_split_ratio': 0.7945140695189802}. Best is trial 147 with value: 0.005788911183044132.\n",
      "[I 2026-07-02 16:33:12,497] Trial 161 finished with value: 0.0058193545057639955 and parameters: {'foundation_window': 10, 'ar_lags': 6, 'ema_spans': (2, 4, 8), 'conv_scales': (2, 3), 'use_calendar': True, 'ridge_alpha': 0.0020267120950697094, 'shrinkage_max': 2.119889017078541, 'oob_split_ratio': 0.7981510241690697}. Best is trial 147 with value: 0.005788911183044132.\n",
      "[I 2026-07-02 16:33:12,626] Trial 162 finished with value: 0.005751729095631357 and parameters: {'foundation_window': 10, 'ar_lags': 6, 'ema_spans': (2, 4, 8), 'conv_scales': (2, 3), 'use_calendar': True, 'ridge_alpha': 0.0011578038625610478, 'shrinkage_max': 2.177514957777014, 'oob_split_ratio': 0.7991830584737023}. Best is trial 162 with value: 0.005751729095631357.\n",
      "[I 2026-07-02 16:33:12,756] Trial 163 finished with value: 0.00579174831330738 and parameters: {'foundation_window': 10, 'ar_lags': 6, 'ema_spans': (2, 4, 8), 'conv_scales': (2, 3), 'use_calendar': True, 'ridge_alpha': 0.0010496076067589384, 'shrinkage_max': 2.101922349850807, 'oob_split_ratio': 0.7999907044538034}. Best is trial 162 with value: 0.005751729095631357.\n",
      "[I 2026-07-02 16:33:12,887] Trial 164 finished with value: 0.005843589416831462 and parameters: {'foundation_window': 10, 'ar_lags': 6, 'ema_spans': (2, 4, 8), 'conv_scales': (2, 3), 'use_calendar': True, 'ridge_alpha': 0.0011203399176559251, 'shrinkage_max': 2.0166932034274367, 'oob_split_ratio': 0.7997621002349411}. Best is trial 162 with value: 0.005751729095631357.\n",
      "[I 2026-07-02 16:33:13,018] Trial 165 finished with value: 0.005848151021990645 and parameters: {'foundation_window': 10, 'ar_lags': 6, 'ema_spans': (2, 4, 8), 'conv_scales': (2, 3), 'use_calendar': True, 'ridge_alpha': 0.0010372756759869366, 'shrinkage_max': 2.002732858217679, 'oob_split_ratio': 0.7996152903826147}. Best is trial 162 with value: 0.005751729095631357.\n",
      "[I 2026-07-02 16:33:13,150] Trial 166 finished with value: 0.00954527447637615 and parameters: {'foundation_window': 11, 'ar_lags': 6, 'ema_spans': (2, 4, 8), 'conv_scales': (2, 3), 'use_calendar': True, 'ridge_alpha': 0.0010373934886544344, 'shrinkage_max': 2.1107639831872, 'oob_split_ratio': 0.7948600518470368}. Best is trial 162 with value: 0.005751729095631357.\n",
      "[I 2026-07-02 16:33:13,281] Trial 167 finished with value: 0.009118847236564113 and parameters: {'foundation_window': 9, 'ar_lags': 6, 'ema_spans': (2, 4, 8), 'conv_scales': (2, 3), 'use_calendar': True, 'ridge_alpha': 0.001229598181800999, 'shrinkage_max': 2.038709154759006, 'oob_split_ratio': 0.7929445532595495}. Best is trial 162 with value: 0.005751729095631357.\n",
      "[I 2026-07-02 16:33:13,411] Trial 168 finished with value: 0.00586367157408774 and parameters: {'foundation_window': 10, 'ar_lags': 6, 'ema_spans': (2, 4, 8), 'conv_scales': (2, 3), 'use_calendar': True, 'ridge_alpha': 0.0013678176873657836, 'shrinkage_max': 1.9968008586515835, 'oob_split_ratio': 0.793646016866895}. Best is trial 162 with value: 0.005751729095631357.\n",
      "[I 2026-07-02 16:33:13,539] Trial 169 finished with value: 0.01512781862069433 and parameters: {'foundation_window': 10, 'ar_lags': 6, 'ema_spans': (2, 4), 'conv_scales': (2, 3), 'use_calendar': True, 'ridge_alpha': 0.0014233934417423543, 'shrinkage_max': 1.9836791603340633, 'oob_split_ratio': 0.7998689855056352}. Best is trial 162 with value: 0.005751729095631357.\n",
      "[I 2026-07-02 16:33:13,674] Trial 170 finished with value: 0.009772857489894692 and parameters: {'foundation_window': 11, 'ar_lags': 6, 'ema_spans': (2, 4, 8), 'conv_scales': (2, 3), 'use_calendar': True, 'ridge_alpha': 0.0010261327450298307, 'shrinkage_max': 2.255425636807668, 'oob_split_ratio': 0.7998570101608943}. Best is trial 162 with value: 0.005751729095631357.\n",
      "[I 2026-07-02 16:33:13,804] Trial 171 finished with value: 0.005872282305804823 and parameters: {'foundation_window': 10, 'ar_lags': 6, 'ema_spans': (2, 4, 8), 'conv_scales': (2, 3), 'use_calendar': True, 'ridge_alpha': 0.001746538335465892, 'shrinkage_max': 2.006365866351382, 'oob_split_ratio': 0.7921119157756038}. Best is trial 162 with value: 0.005751729095631357.\n",
      "[I 2026-07-02 16:33:13,937] Trial 172 finished with value: 0.005877822495981875 and parameters: {'foundation_window': 10, 'ar_lags': 6, 'ema_spans': (2, 4, 8), 'conv_scales': (2, 3), 'use_calendar': True, 'ridge_alpha': 0.001683727179818617, 'shrinkage_max': 1.9921355264491454, 'oob_split_ratio': 0.7917779681400033}. Best is trial 162 with value: 0.005751729095631357.\n",
      "[I 2026-07-02 16:33:14,070] Trial 173 finished with value: 0.005883864217013809 and parameters: {'foundation_window': 10, 'ar_lags': 6, 'ema_spans': (2, 4, 8), 'conv_scales': (2, 3), 'use_calendar': True, 'ridge_alpha': 0.0016671614497740198, 'shrinkage_max': 1.9804404276279814, 'oob_split_ratio': 0.7922586272103884}. Best is trial 162 with value: 0.005751729095631357.\n",
      "[I 2026-07-02 16:33:14,200] Trial 174 finished with value: 0.005885512342242042 and parameters: {'foundation_window': 10, 'ar_lags': 6, 'ema_spans': (2, 4, 8), 'conv_scales': (2, 3), 'use_calendar': True, 'ridge_alpha': 0.0018401137547059848, 'shrinkage_max': 1.9884337723360226, 'oob_split_ratio': 0.7901176962686429}. Best is trial 162 with value: 0.005751729095631357.\n",
      "[I 2026-07-02 16:33:14,333] Trial 175 finished with value: 0.005749570489277916 and parameters: {'foundation_window': 10, 'ar_lags': 6, 'ema_spans': (2, 4, 8), 'conv_scales': (2, 3), 'use_calendar': True, 'ridge_alpha': 0.001660450235437707, 'shrinkage_max': 2.2166873268723926, 'oob_split_ratio': 0.7913740405882252}. Best is trial 175 with value: 0.005749570489277916.\n",
      "[I 2026-07-02 16:33:14,456] Trial 176 finished with value: 0.007040234705370005 and parameters: {'foundation_window': 10, 'ar_lags': 6, 'ema_spans': (3, 6), 'conv_scales': (2, 3), 'use_calendar': False, 'ridge_alpha': 0.0016616336134632123, 'shrinkage_max': 1.9965828885138446, 'oob_split_ratio': 0.7901913769100758}. Best is trial 175 with value: 0.005749570489277916.\n",
      "[I 2026-07-02 16:33:14,596] Trial 177 finished with value: 0.00752446543640982 and parameters: {'foundation_window': 10, 'ar_lags': 6, 'ema_spans': (2, 4, 8), 'conv_scales': (2, 3, 4), 'use_calendar': True, 'ridge_alpha': 0.0012941772379341221, 'shrinkage_max': 1.8780064199926425, 'oob_split_ratio': 0.7916108534410768}. Best is trial 175 with value: 0.005749570489277916.\n",
      "[I 2026-07-02 16:33:14,726] Trial 178 finished with value: 0.013043207121508414 and parameters: {'foundation_window': 10, 'ar_lags': 6, 'ema_spans': (3, 6, 12), 'conv_scales': (2, 3), 'use_calendar': True, 'ridge_alpha': 0.0017946954487423198, 'shrinkage_max': 2.1187868300589527, 'oob_split_ratio': 0.7830614464789099}. Best is trial 175 with value: 0.005749570489277916.\n",
      "[I 2026-07-02 16:33:14,860] Trial 179 finished with value: 0.00573552874957308 and parameters: {'foundation_window': 10, 'ar_lags': 6, 'ema_spans': (2, 4, 8), 'conv_scales': (2, 3), 'use_calendar': True, 'ridge_alpha': 0.0012767243357894118, 'shrinkage_max': 2.2136277903629358, 'oob_split_ratio': 0.7914835878896185}. Best is trial 179 with value: 0.00573552874957308.\n",
      "[I 2026-07-02 16:33:14,989] Trial 180 finished with value: 0.012462368006822731 and parameters: {'foundation_window': 9, 'ar_lags': 6, 'ema_spans': (2, 4, 8), 'conv_scales': (3, 6), 'use_calendar': True, 'ridge_alpha': 0.0013646263530426583, 'shrinkage_max': 2.224186083651845, 'oob_split_ratio': 0.791215383488009}. Best is trial 179 with value: 0.00573552874957308.\n",
      "[I 2026-07-02 16:33:15,120] Trial 181 finished with value: 0.005874207918346748 and parameters: {'foundation_window': 10, 'ar_lags': 6, 'ema_spans': (2, 4, 8), 'conv_scales': (2, 3), 'use_calendar': True, 'ridge_alpha': 0.001995014783658771, 'shrinkage_max': 2.0194418298354337, 'oob_split_ratio': 0.7954337827422768}. Best is trial 179 with value: 0.00573552874957308.\n",
      "[I 2026-07-02 16:33:15,252] Trial 182 finished with value: 0.0057382286576794115 and parameters: {'foundation_window': 10, 'ar_lags': 6, 'ema_spans': (2, 4, 8), 'conv_scales': (2, 3), 'use_calendar': True, 'ridge_alpha': 0.0012436476993854322, 'shrinkage_max': 2.20635387830748, 'oob_split_ratio': 0.7829506470256911}. Best is trial 179 with value: 0.00573552874957308.\n",
      "[I 2026-07-02 16:33:15,387] Trial 183 finished with value: 0.005720651644656019 and parameters: {'foundation_window': 10, 'ar_lags': 6, 'ema_spans': (2, 4, 8), 'conv_scales': (2, 3), 'use_calendar': True, 'ridge_alpha': 0.0010343382352980997, 'shrinkage_max': 2.221704791434825, 'oob_split_ratio': 0.7840499897362305}. Best is trial 183 with value: 0.005720651644656019.\n",
      "[I 2026-07-02 16:33:15,515] Trial 184 finished with value: 0.005717648498031753 and parameters: {'foundation_window': 10, 'ar_lags': 6, 'ema_spans': (2, 4, 8), 'conv_scales': (2, 3), 'use_calendar': True, 'ridge_alpha': 0.0010266431070636909, 'shrinkage_max': 2.2263735322399194, 'oob_split_ratio': 0.7823302948893853}. Best is trial 184 with value: 0.005717648498031753.\n",
      "[I 2026-07-02 16:33:15,646] Trial 185 finished with value: 0.006112739850451303 and parameters: {'foundation_window': 10, 'ar_lags': 6, 'ema_spans': (2, 4, 8), 'conv_scales': (2, 3), 'use_calendar': True, 'ridge_alpha': 0.0011528065768897896, 'shrinkage_max': 2.277455535205596, 'oob_split_ratio': 0.7829503188634825}. Best is trial 184 with value: 0.005717648498031753.\n",
      "[I 2026-07-02 16:33:15,776] Trial 186 finished with value: 0.005716181652103645 and parameters: {'foundation_window': 10, 'ar_lags': 6, 'ema_spans': (2, 4, 8), 'conv_scales': (2, 3), 'use_calendar': True, 'ridge_alpha': 0.0010377854109874097, 'shrinkage_max': 2.229774678918393, 'oob_split_ratio': 0.7817470117218015}. Best is trial 186 with value: 0.005716181652103645.\n",
      "[I 2026-07-02 16:33:15,913] Trial 187 finished with value: 0.005727807540325545 and parameters: {'foundation_window': 10, 'ar_lags': 6, 'ema_spans': (2, 4, 8), 'conv_scales': (2, 3), 'use_calendar': True, 'ridge_alpha': 0.0010260136941406756, 'shrinkage_max': 2.2085335052638775, 'oob_split_ratio': 0.7824783129808678}. Best is trial 186 with value: 0.005716181652103645.\n",
      "[I 2026-07-02 16:33:16,045] Trial 188 finished with value: 0.009717927621519384 and parameters: {'foundation_window': 11, 'ar_lags': 6, 'ema_spans': (2, 4, 8), 'conv_scales': (2, 3), 'use_calendar': True, 'ridge_alpha': 0.0010204817126530194, 'shrinkage_max': 2.218138552084443, 'oob_split_ratio': 0.782934047914185}. Best is trial 186 with value: 0.005716181652103645.\n",
      "[I 2026-07-02 16:33:16,175] Trial 189 finished with value: 0.006110477746163523 and parameters: {'foundation_window': 10, 'ar_lags': 6, 'ema_spans': (2, 4, 8), 'conv_scales': (2, 3), 'use_calendar': True, 'ridge_alpha': 0.0012949264023489077, 'shrinkage_max': 2.288469400453811, 'oob_split_ratio': 0.7826352882642149}. Best is trial 186 with value: 0.005716181652103645.\n",
      "[I 2026-07-02 16:33:16,312] Trial 190 finished with value: 0.005724553426237649 and parameters: {'foundation_window': 10, 'ar_lags': 6, 'ema_spans': (2, 4, 8), 'conv_scales': (2, 3), 'use_calendar': True, 'ridge_alpha': 0.001004126492113451, 'shrinkage_max': 2.212603419301707, 'oob_split_ratio': 0.7997482551976409}. Best is trial 186 with value: 0.005716181652103645.\n",
      "[I 2026-07-02 16:33:16,448] Trial 191 finished with value: 0.005733013040953475 and parameters: {'foundation_window': 10, 'ar_lags': 6, 'ema_spans': (2, 4, 8), 'conv_scales': (2, 3), 'use_calendar': True, 'ridge_alpha': 0.0010281941273874967, 'shrinkage_max': 2.1997503064449306, 'oob_split_ratio': 0.7998142405639469}. Best is trial 186 with value: 0.005716181652103645.\n",
      "[I 2026-07-02 16:33:16,580] Trial 192 finished with value: 0.00574249138481921 and parameters: {'foundation_window': 10, 'ar_lags': 6, 'ema_spans': (2, 4, 8), 'conv_scales': (2, 3), 'use_calendar': True, 'ridge_alpha': 0.0010176584831915754, 'shrinkage_max': 2.1830933031688176, 'oob_split_ratio': 0.7982435619283369}. Best is trial 186 with value: 0.005716181652103645.\n",
      "[I 2026-07-02 16:33:16,712] Trial 193 finished with value: 0.005766852750254676 and parameters: {'foundation_window': 10, 'ar_lags': 6, 'ema_spans': (2, 4, 8), 'conv_scales': (2, 3), 'use_calendar': True, 'ridge_alpha': 0.001096389833347487, 'shrinkage_max': 2.1477800369301803, 'oob_split_ratio': 0.7999950267381178}. Best is trial 186 with value: 0.005716181652103645.\n",
      "[I 2026-07-02 16:33:16,843] Trial 194 finished with value: 0.005764459578144385 and parameters: {'foundation_window': 10, 'ar_lags': 6, 'ema_spans': (2, 4, 8), 'conv_scales': (2, 3), 'use_calendar': True, 'ridge_alpha': 0.0010490950384689287, 'shrinkage_max': 2.1484952769403205, 'oob_split_ratio': 0.7997494469128904}. Best is trial 186 with value: 0.005716181652103645.\n",
      "[I 2026-07-02 16:33:16,976] Trial 195 finished with value: 0.005772308482155601 and parameters: {'foundation_window': 10, 'ar_lags': 6, 'ema_spans': (2, 4, 8), 'conv_scales': (2, 3), 'use_calendar': True, 'ridge_alpha': 0.0012596156240579465, 'shrinkage_max': 2.149994663339148, 'oob_split_ratio': 0.7870103049959869}. Best is trial 186 with value: 0.005716181652103645.\n",
      "[I 2026-07-02 16:33:17,111] Trial 196 finished with value: 0.00571851863035264 and parameters: {'foundation_window': 10, 'ar_lags': 6, 'ema_spans': (2, 4, 8), 'conv_scales': (2, 3), 'use_calendar': True, 'ridge_alpha': 0.0013907090383646096, 'shrinkage_max': 2.2522603094826934, 'oob_split_ratio': 0.7843274882150242}. Best is trial 186 with value: 0.005716181652103645.\n",
      "[I 2026-07-02 16:33:17,245] Trial 197 finished with value: 0.0060943307283090045 and parameters: {'foundation_window': 10, 'ar_lags': 6, 'ema_spans': (2, 4, 8), 'conv_scales': (2, 3), 'use_calendar': True, 'ridge_alpha': 0.0013623342383230798, 'shrinkage_max': 2.3177760749478393, 'oob_split_ratio': 0.7853975547808315}. Best is trial 186 with value: 0.005716181652103645.\n",
      "[I 2026-07-02 16:33:17,391] Trial 198 finished with value: 0.010422278840991018 and parameters: {'foundation_window': 9, 'ar_lags': 6, 'ema_spans': (2, 4, 8), 'conv_scales': (3, 6, 12), 'use_calendar': True, 'ridge_alpha': 0.0012137909831172072, 'shrinkage_max': 2.1437510203972203, 'oob_split_ratio': 0.7808942963959206}. Best is trial 186 with value: 0.005716181652103645.\n",
      "[I 2026-07-02 16:33:17,524] Trial 199 finished with value: 0.005741406891109971 and parameters: {'foundation_window': 10, 'ar_lags': 6, 'ema_spans': (2, 4, 8), 'conv_scales': (2, 3), 'use_calendar': True, 'ridge_alpha': 0.0010081455863622235, 'shrinkage_max': 2.1842225511774447, 'oob_split_ratio': 0.7852849722085016}. Best is trial 186 with value: 0.005716181652103645.\n",
      "[I 2026-07-02 16:33:17,658] Trial 200 finished with value: 0.005751347718628363 and parameters: {'foundation_window': 10, 'ar_lags': 6, 'ema_spans': (2, 4, 8), 'conv_scales': (2, 3), 'use_calendar': True, 'ridge_alpha': 0.0010348442577874904, 'shrinkage_max': 2.169511426670892, 'oob_split_ratio': 0.7802082962124144}. Best is trial 186 with value: 0.005716181652103645.\n",
      "[I 2026-07-02 16:33:17,799] Trial 201 finished with value: 0.005742245215147356 and parameters: {'foundation_window': 10, 'ar_lags': 6, 'ema_spans': (2, 4, 8), 'conv_scales': (2, 3), 'use_calendar': True, 'ridge_alpha': 0.0010140823291695223, 'shrinkage_max': 2.1832502031951613, 'oob_split_ratio': 0.7791555850748475}. Best is trial 186 with value: 0.005716181652103645.\n",
