      "[I 2026-07-02 16:32:50,041] Trial 180 finished with value: inf and parameters: {'target_miscoverage': 0.19381661190965555, 'aci_step_size': 0.015119332980504106, 'interval_scale': 4.5546465804379865}. Best is trial 0 with value: inf.\n",
      "[I 2026-07-02 16:32:50,059] Trial 181 finished with value: inf and parameters: {'target_miscoverage': 0.11016477134757768, 'aci_step_size': 0.01653587525061057, 'interval_scale': 2.4144139954638937}. Best is trial 0 with value: inf.\n",
      "[I 2026-07-02 16:32:50,077] Trial 182 finished with value: inf and parameters: {'target_miscoverage': 0.0824845209418989, 'aci_step_size': 0.17570012095095502, 'interval_scale': 3.0060760751518547}. Best is trial 0 with value: inf.\n",
      "[I 2026-07-02 16:32:50,095] Trial 183 finished with value: inf and parameters: {'target_miscoverage': 0.11958889450523279, 'aci_step_size': 0.18136933447459194, 'interval_scale': 3.870028398112743}. Best is trial 0 with value: inf.\n",
      "[I 2026-07-02 16:32:50,115] Trial 184 finished with value: inf and parameters: {'target_miscoverage': 0.04451645131479572, 'aci_step_size': 0.1965376103847448, 'interval_scale': 3.56207390622988}. Best is trial 0 with value: inf.\n",
      "[I 2026-07-02 16:32:50,139] Trial 185 finished with value: inf and parameters: {'target_miscoverage': 0.10469053878307516, 'aci_step_size': 0.15798398187081922, 'interval_scale': 0.6880279619222238}. Best is trial 0 with value: inf.\n",
      "[I 2026-07-02 16:32:50,163] Trial 186 finished with value: inf and parameters: {'target_miscoverage': 0.09452730249774739, 'aci_step_size': 0.14422275812056645, 'interval_scale': 4.043963949228876}. Best is trial 0 with value: inf.\n",
      "[I 2026-07-02 16:32:50,185] Trial 187 finished with value: inf and parameters: {'target_miscoverage': 0.034719478124891894, 'aci_step_size': 0.052717664331125236, 'interval_scale': 3.2500280498376535}. Best is trial 0 with value: inf.\n",
      "[I 2026-07-02 16:32:50,204] Trial 188 finished with value: inf and parameters: {'target_miscoverage': 0.15586830333491494, 'aci_step_size': 0.036619909559457875, 'interval_scale': 1.1492443843390083}. Best is trial 0 with value: inf.\n",
      "[I 2026-07-02 16:32:50,223] Trial 189 finished with value: inf and parameters: {'target_miscoverage': 0.1007877238747504, 'aci_step_size': 0.010466461848836872, 'interval_scale': 2.7805661736757856}. Best is trial 0 with value: inf.\n",
      "[I 2026-07-02 16:32:50,240] Trial 190 finished with value: inf and parameters: {'target_miscoverage': 0.028094647748692865, 'aci_step_size': 0.019940658621939594, 'interval_scale': 0.6252871573752162}. Best is trial 0 with value: inf.\n",
      "[I 2026-07-02 16:32:50,257] Trial 191 finished with value: inf and parameters: {'target_miscoverage': 0.19070025416398056, 'aci_step_size': 0.08620731174054488, 'interval_scale': 0.8312307680672457}. Best is trial 0 with value: inf.\n",
      "[I 2026-07-02 16:32:50,274] Trial 192 finished with value: inf and parameters: {'target_miscoverage': 0.1606778105627309, 'aci_step_size': 0.07830240200014649, 'interval_scale': 2.165298149466754}. Best is trial 0 with value: inf.\n",
      "[I 2026-07-02 16:32:50,292] Trial 193 finished with value: inf and parameters: {'target_miscoverage': 0.19975888172962697, 'aci_step_size': 0.0654430740511768, 'interval_scale': 0.8848404006491086}. Best is trial 0 with value: inf.\n",
      "[I 2026-07-02 16:32:50,310] Trial 194 finished with value: inf and parameters: {'target_miscoverage': 0.19631704119368845, 'aci_step_size': 0.0701465572930519, 'interval_scale': 0.7244680930671025}. Best is trial 0 with value: inf.\n",
      "[I 2026-07-02 16:32:50,326] Trial 195 finished with value: inf and parameters: {'target_miscoverage': 0.07230638560867493, 'aci_step_size': 0.045277705891921954, 'interval_scale': 0.5436936497217757}. Best is trial 0 with value: inf.\n",
      "[I 2026-07-02 16:32:50,343] Trial 196 finished with value: inf and parameters: {'target_miscoverage': 0.11316883758370413, 'aci_step_size': 0.005002462495550188, 'interval_scale': 0.7736416081306519}. Best is trial 0 with value: inf.\n",
      "[I 2026-07-02 16:32:50,362] Trial 197 finished with value: inf and parameters: {'target_miscoverage': 0.12241358925844835, 'aci_step_size': 0.10505338247955066, 'interval_scale': 1.9623857609889488}. Best is trial 0 with value: inf.\n",
      "[I 2026-07-02 16:32:50,380] Trial 198 finished with value: inf and parameters: {'target_miscoverage': 0.18667167852159425, 'aci_step_size': 0.04083299580026176, 'interval_scale': 2.6685427763346365}. Best is trial 0 with value: inf.\n",
      "[I 2026-07-02 16:32:50,397] Trial 199 finished with value: inf and parameters: {'target_miscoverage': 0.14162432654190854, 'aci_step_size': 0.006728391012769194, 'interval_scale': 7.425147451482055}. Best is trial 0 with value: inf.\n"
     ]
    },
    {
     "name": "stdout",
     "output_type": "stream",
     "text": [
      "S3-Forecaster best point parameters:\n",
      "{'reservoir_size': 75, 'spectral_radius': 1.4507143064099162, 'ar_lags': 4, 'foundation_window': 5, 'regressor_type': 'Ridge', 'reg_alpha': 21.76624112345367, 'aci_step_size': 0.12421185223120967, 'oob_split_ratio': 0.7770181444490114}\n",
      "S3-Forecaster best UQ parameters:\n",
      "{'target_miscoverage': 0.08116262258099886, 'aci_step_size': 0.1667521176194013, 'interval_scale': 3.805209189203926}\n",
      "S3-Forecaster test metrics on modelling scale:\n"
     ]
    },
    {
     "data": {
      "text/html": [
       "<div>\n",
       "<style scoped>\n",
       "    .dataframe tbody tr th:only-of-type {\n",
       "        vertical-align: middle;\n",
       "    }\n",
       "\n",
       "    .dataframe tbody tr th {\n",
       "        vertical-align: top;\n",
       "    }\n",
       "\n",
       "    .dataframe thead th {\n",
       "        text-align: right;\n",
       "    }\n",
       "</style>\n",
       "<table border=\"1\" class=\"dataframe\">\n",
       "  <thead>\n",
       "    <tr style=\"text-align: right;\">\n",
       "      <th></th>\n",
       "      <th>mae</th>\n",
       "      <th>mse</th>\n",
       "      <th>rmse</th>\n",
       "      <th>r2</th>\n",
       "      <th>mape_percent</th>\n",
       "      <th>mape</th>\n",
       "      <th>smape_percent</th>\n",
       "      <th>smape</th>\n",
       "      <th>ecp</th>\n",
       "      <th>coverage_error</th>\n",
       "      <th>iw</th>\n",
       "      <th>mean_width</th>\n",
       "      <th>mis</th>\n",
       "      <th>interval_score</th>\n",
       "      <th>msis</th>\n",
       "      <th>scale</th>\n",
       "      <th>elapsed_seconds</th>\n",
       "      <th>trainable_params</th>\n",
       "    </tr>\n",
       "  </thead>\n",
       "  <tbody>\n",
       "    <tr>\n",
       "      <th>0</th>\n",
       "      <td>0.12051</td>\n",
       "      <td>0.01968</td>\n",
       "      <td>0.140287</td>\n",
       "      <td>-0.416047</td>\n",
       "      <td>0.624614</td>\n",
       "      <td>0.006246</td>\n",
       "      <td>0.623471</td>\n",
       "      <td>0.006235</td>\n",
       "      <td>1.0</td>\n",
       "      <td>0.1</td>\n",
       "      <td>2.493414</td>\n",
       "      <td>2.493414</td>\n",
       "      <td>2.493414</td>\n",
       "      <td>2.493414</td>\n",
       "      <td>6.332429</td>\n",
       "      <td>0.393753</td>\n",
       "      <td>0.087352</td>\n",
       "      <td>802</td>\n",
       "    </tr>\n",
       "  </tbody>\n",
       "</table>\n",
       "</div>"
      ],
      "text/plain": [
       "       mae      mse      rmse        r2  mape_percent      mape  \\\n",
       "0  0.12051  0.01968  0.140287 -0.416047      0.624614  0.006246   \n",
       "\n",
       "   smape_percent     smape  ecp  coverage_error        iw  mean_width  \\\n",
       "0       0.623471  0.006235  1.0             0.1  2.493414    2.493414   \n",
       "\n",
       "        mis  interval_score      msis     scale  elapsed_seconds  \\\n",
       "0  2.493414        2.493414  6.332429  0.393753         0.087352   \n",
       "\n",
       "   trainable_params  \n",
       "0               802  "
      ]
     },
     "metadata": {},
     "output_type": "display_data"
    }
   ],
   "source": [
    "s3_result = run_s3_experiment(\n",
    "    train_series,\n",
    "    test_series,\n",
    "    point_trials=S3_POINT_TRIALS,\n",
    "    uq_trials=S3_UQ_TRIALS,\n",
    "    val_size=VAL_SIZE,\n",
    "    seed=SEED,\n",
    ")\n",
    "\n",
    "print(\"S3-Forecaster best point parameters:\")\n",
    "print(s3_result[\"best_point_params\"])\n",
    "print(\"S3-Forecaster best UQ parameters:\")\n",
    "print(s3_result[\"best_uq_params\"])\n",
    "print(\"S3-Forecaster test metrics on modelling scale:\")\n",
    "display(pd.DataFrame([s3_result[\"metrics\"]]))"
   ]
  },
  {
   "cell_type": "markdown",
   "id": "d58fcc55",
   "metadata": {
    "papermill": {
     "duration": 0.032,
     "end_time": "2026-07-02T16:32:50.607830+00:00",
     "exception": false,
     "start_time": "2026-07-02T16:32:50.575830+00:00",
     "status": "completed"
    },
    "tags": []
   },
   "source": [
    "## 7. S3-FastSketch optimization and final test"
   ]
  },
  {
   "cell_type": "code",
   "execution_count": 9,
   "id": "85329d45",
   "metadata": {
    "execution": {
     "iopub.execute_input": "2026-07-02T16:32:50.674562Z",
     "iopub.status.busy": "2026-07-02T16:32:50.674208Z",
     "iopub.status.idle": "2026-07-02T16:33:56.545110Z",
     "shell.execute_reply": "2026-07-02T16:33:56.544049Z"
    },
    "papermill": {
     "duration": 65.906396,
     "end_time": "2026-07-02T16:33:56.546957+00:00",
     "exception": false,
     "start_time": "2026-07-02T16:32:50.640561+00:00",
     "status": "completed"
    },
    "tags": []
   },
   "outputs": [
    {
     "name": "stderr",
     "output_type": "stream",
     "text": [
      "[I 2026-07-02 16:32:50,678] A new study created in memory with name: no-name-94cc384d-da41-4cab-9c64-0c7ba5037b5a\n",
      "[I 2026-07-02 16:32:50,812] Trial 0 finished with value: 0.01185620187765842 and parameters: {'foundation_window': 6, 'ar_lags': 6, 'ema_spans': (2, 4), 'conv_scales': (2, 4, 8), 'use_calendar': False, 'ridge_alpha': 0.008111941985431923, 'shrinkage_max': 0.754362402096943, 'oob_split_ratio': 0.6260605607398845}. Best is trial 0 with value: 0.01185620187765842.\n",
      "[I 2026-07-02 16:32:50,942] Trial 1 finished with value: 0.009384070853860454 and parameters: {'foundation_window': 7, 'ar_lags': 3, 'ema_spans': (2, 4, 8), 'conv_scales': (2, 3, 4), 'use_calendar': True, 'ridge_alpha': 0.007122305833333868, 'shrinkage_max': 0.42889188070951867, 'oob_split_ratio': 0.7872213843133333}. Best is trial 1 with value: 0.009384070853860454.\n",
      "[I 2026-07-02 16:32:51,053] Trial 2 finished with value: 0.007608141996761807 and parameters: {'foundation_window': 12, 'ar_lags': 5, 'ema_spans': (3, 6), 'conv_scales': (3, 6), 'use_calendar': True, 'ridge_alpha': 0.5414413211338525, 'shrinkage_max': 0.7583497526951993, 'oob_split_ratio': 0.7923961569411397}. Best is trial 2 with value: 0.007608141996761807.\n",
      "[I 2026-07-02 16:32:51,175] Trial 3 finished with value: 0.010243066189291302 and parameters: {'foundation_window': 10, 'ar_lags': 6, 'ema_spans': (3, 6), 'conv_scales': (2, 4, 8), 'use_calendar': False, 'ridge_alpha': 0.5169879442298543, 'shrinkage_max': 0.6375416186805973, 'oob_split_ratio': 0.75054924518851}. Best is trial 2 with value: 0.007608141996761807.\n",
      "[I 2026-07-02 16:32:51,305] Trial 4 finished with value: 0.01831746875310812 and parameters: {'foundation_window': 2, 'ar_lags': 6, 'ema_spans': (3, 6, 12), 'conv_scales': (2, 3, 4), 'use_calendar': False, 'ridge_alpha': 0.04513257622008944, 'shrinkage_max': 0.42478546328656497, 'oob_split_ratio': 0.6277455804289156}. Best is trial 2 with value: 0.007608141996761807.\n",
      "[I 2026-07-02 16:32:51,419] Trial 5 finished with value: 0.01006989187179228 and parameters: {'foundation_window': 5, 'ar_lags': 5, 'ema_spans': (2, 4, 8), 'conv_scales': (3, 6), 'use_calendar': False, 'ridge_alpha': 0.003463037026119184, 'shrinkage_max': 0.3364302606385192, 'oob_split_ratio': 0.7091026028159452}. Best is trial 2 with value: 0.007608141996761807.\n",
      "[I 2026-07-02 16:32:51,542] Trial 6 finished with value: 0.013457547861278611 and parameters: {'foundation_window': 5, 'ar_lags': 4, 'ema_spans': (2, 4), 'conv_scales': (3, 6, 12), 'use_calendar': True, 'ridge_alpha': 10.431827200054899, 'shrinkage_max': 0.7630676619365986, 'oob_split_ratio': 0.7731397496224945}. Best is trial 2 with value: 0.007608141996761807.\n",
      "[I 2026-07-02 16:32:51,665] Trial 7 finished with value: 0.008940543130869364 and parameters: {'foundation_window': 7, 'ar_lags': 5, 'ema_spans': (2, 4), 'conv_scales': (2, 3, 4), 'use_calendar': False, 'ridge_alpha': 0.0487613652796118, 'shrinkage_max': 2.8430016857594276, 'oob_split_ratio': 0.6308007330051888}. Best is trial 2 with value: 0.007608141996761807.\n",
      "[I 2026-07-02 16:32:51,790] Trial 8 finished with value: 0.014199982210762805 and parameters: {'foundation_window': 7, 'ar_lags': 5, 'ema_spans': (2, 4, 8), 'conv_scales': (3, 6, 12), 'use_calendar': True, 'ridge_alpha': 34.77998816092338, 'shrinkage_max': 0.9087951993341742, 'oob_split_ratio': 0.5862237180228058}. Best is trial 2 with value: 0.007608141996761807.\n",
      "[I 2026-07-02 16:32:51,901] Trial 9 finished with value: 0.010575536667429141 and parameters: {'foundation_window': 7, 'ar_lags': 6, 'ema_spans': (3, 6), 'conv_scales': (3, 6), 'use_calendar': False, 'ridge_alpha': 0.008562341633595545, 'shrinkage_max': 0.36213163927560077, 'oob_split_ratio': 0.6977232357970605}. Best is trial 2 with value: 0.007608141996761807.\n",
      "[I 2026-07-02 16:32:52,033] Trial 10 finished with value: 0.010673287850019296 and parameters: {'foundation_window': 12, 'ar_lags': 1, 'ema_spans': (2, 3, 5, 8), 'conv_scales': (2, 3), 'use_calendar': True, 'ridge_alpha': 1.7302319242821713, 'shrinkage_max': 1.754986535579859, 'oob_split_ratio': 0.5563754303096964}. Best is trial 2 with value: 0.007608141996761807.\n",
      "[I 2026-07-02 16:32:52,168] Trial 11 finished with value: 0.007470996598719266 and parameters: {'foundation_window': 10, 'ar_lags': 4, 'ema_spans': (2, 4), 'conv_scales': (2, 3, 4), 'use_calendar': True, 'ridge_alpha': 0.14851877511086226, 'shrinkage_max': 2.957883802551853, 'oob_split_ratio': 0.6784211638833353}. Best is trial 11 with value: 0.007470996598719266.\n",
      "[I 2026-07-02 16:32:52,286] Trial 12 finished with value: 0.008084555603016103 and parameters: {'foundation_window': 12, 'ar_lags': 3, 'ema_spans': (3, 6), 'conv_scales': (3, 6), 'use_calendar': True, 'ridge_alpha': 0.43540605586345055, 'shrinkage_max': 2.9805945140410968, 'oob_split_ratio': 0.7131703000562453}. Best is trial 11 with value: 0.007470996598719266.\n",
      "[I 2026-07-02 16:32:52,411] Trial 13 finished with value: 0.00756483812825676 and parameters: {'foundation_window': 10, 'ar_lags': 3, 'ema_spans': (3, 6, 12), 'conv_scales': (2, 3), 'use_calendar': True, 'ridge_alpha': 0.119066914650065, 'shrinkage_max': 2.2472196004363894, 'oob_split_ratio': 0.6736102296947081}. Best is trial 11 with value: 0.007470996598719266.\n",
      "[I 2026-07-02 16:32:52,533] Trial 14 finished with value: 0.007611133481154113 and parameters: {'foundation_window': 10, 'ar_lags': 2, 'ema_spans': (3, 6, 12), 'conv_scales': (2, 3), 'use_calendar': True, 'ridge_alpha': 0.07317040790062211, 'shrinkage_max': 2.358184681551302, 'oob_split_ratio': 0.6702523124518565}. Best is trial 11 with value: 0.007470996598719266.\n",
      "[I 2026-07-02 16:32:52,654] Trial 15 finished with value: 0.007580230227141545 and parameters: {'foundation_window': 10, 'ar_lags': 3, 'ema_spans': (3, 6, 12), 'conv_scales': (2, 3), 'use_calendar': True, 'ridge_alpha': 3.083566608480548, 'shrinkage_max': 2.152807412362156, 'oob_split_ratio': 0.6711123381905397}. Best is trial 11 with value: 0.007470996598719266.\n",
      "[I 2026-07-02 16:32:52,794] Trial 16 finished with value: 0.007753325733175061 and parameters: {'foundation_window': 9, 'ar_lags': 4, 'ema_spans': (2, 3, 5, 8), 'conv_scales': (2, 3, 4), 'use_calendar': True, 'ridge_alpha': 0.14054139419223796, 'shrinkage_max': 2.497632394674592, 'oob_split_ratio': 0.6579553672823968}. Best is trial 11 with value: 0.007470996598719266.\n",
      "[I 2026-07-02 16:32:52,915] Trial 17 finished with value: 0.02675868254407576 and parameters: {'foundation_window': 9, 'ar_lags': 2, 'ema_spans': (3, 6, 12), 'conv_scales': (2, 3), 'use_calendar': True, 'ridge_alpha': 0.0013680284586229184, 'shrinkage_max': 1.6780217689693333, 'oob_split_ratio': 0.7174427308957757}. Best is trial 11 with value: 0.007470996598719266.\n",
      "[I 2026-07-02 16:32:53,047] Trial 18 finished with value: 0.01211325219044103 and parameters: {'foundation_window': 11, 'ar_lags': 4, 'ema_spans': (2, 4), 'conv_scales': (2, 3, 4), 'use_calendar': True, 'ridge_alpha': 0.02464261014560123, 'shrinkage_max': 2.667707463730875, 'oob_split_ratio': 0.7491196722355262}. Best is trial 11 with value: 0.007470996598719266.\n",
      "[I 2026-07-02 16:32:53,172] Trial 19 finished with value: 0.008625180419638851 and parameters: {'foundation_window': 8, 'ar_lags': 2, 'ema_spans': (3, 6, 12), 'conv_scales': (2, 3), 'use_calendar': True, 'ridge_alpha': 0.2294102804785353, 'shrinkage_max': 1.9879126827653013, 'oob_split_ratio': 0.6053033934532268}. Best is trial 11 with value: 0.007470996598719266.\n",
      "[I 2026-07-02 16:32:53,306] Trial 20 finished with value: 0.007662045633664923 and parameters: {'foundation_window': 9, 'ar_lags': 1, 'ema_spans': (2, 4), 'conv_scales': (3, 6, 12), 'use_calendar': True, 'ridge_alpha': 1.2702367307355291, 'shrinkage_max': 1.271548477767475, 'oob_split_ratio': 0.686690956880494}. Best is trial 11 with value: 0.007470996598719266.\n",
      "[I 2026-07-02 16:32:53,429] Trial 21 finished with value: 0.007602371178081855 and parameters: {'foundation_window': 10, 'ar_lags': 3, 'ema_spans': (3, 6, 12), 'conv_scales': (2, 3), 'use_calendar': True, 'ridge_alpha': 4.341964950505045, 'shrinkage_max': 2.2163892004462737, 'oob_split_ratio': 0.6549492286914329}. Best is trial 11 with value: 0.007470996598719266.\n",
      "[I 2026-07-02 16:32:53,554] Trial 22 finished with value: 0.0077956883027922 and parameters: {'foundation_window': 11, 'ar_lags': 3, 'ema_spans': (3, 6, 12), 'conv_scales': (2, 3), 'use_calendar': True, 'ridge_alpha': 24.27283564827329, 'shrinkage_max': 2.0383003426265, 'oob_split_ratio': 0.677570775962373}. Best is trial 11 with value: 0.007470996598719266.\n",
      "[I 2026-07-02 16:32:53,679] Trial 23 finished with value: 0.008358944139965957 and parameters: {'foundation_window': 11, 'ar_lags': 4, 'ema_spans': (3, 6, 12), 'conv_scales': (2, 3), 'use_calendar': True, 'ridge_alpha': 70.47325306682897, 'shrinkage_max': 2.6296644604355035, 'oob_split_ratio': 0.6460351444330883}. Best is trial 11 with value: 0.007470996598719266.\n",
      "[I 2026-07-02 16:32:53,808] Trial 24 finished with value: 0.009692604836185214 and parameters: {'foundation_window': 9, 'ar_lags': 3, 'ema_spans': (3, 6, 12), 'conv_scales': (2, 3), 'use_calendar': True, 'ridge_alpha': 3.533491075546531, 'shrinkage_max': 1.5531504568477348, 'oob_split_ratio': 0.7383962854171131}. Best is trial 11 with value: 0.007470996598719266.\n",
      "[I 2026-07-02 16:32:53,951] Trial 25 finished with value: 0.006927674811006591 and parameters: {'foundation_window': 10, 'ar_lags': 2, 'ema_spans': (2, 3, 5, 8), 'conv_scales': (2, 4, 8), 'use_calendar': True, 'ridge_alpha': 0.17636780236043653, 'shrinkage_max': 2.187441871457626, 'oob_split_ratio': 0.6910234138310848}. Best is trial 25 with value: 0.006927674811006591.\n",
      "[I 2026-07-02 16:32:54,088] Trial 26 finished with value: 0.007417538078852887 and parameters: {'foundation_window': 8, 'ar_lags': 2, 'ema_spans': (2, 3, 5, 8), 'conv_scales': (2, 4, 8), 'use_calendar': True, 'ridge_alpha': 0.13399326890138458, 'shrinkage_max': 1.890170460905166, 'oob_split_ratio': 0.7299937560124786}. Best is trial 25 with value: 0.006927674811006591.\n",
      "[I 2026-07-02 16:32:54,230] Trial 27 finished with value: 0.007113447404181916 and parameters: {'foundation_window': 8, 'ar_lags': 2, 'ema_spans': (2, 3, 5, 8), 'conv_scales': (2, 4, 8), 'use_calendar': True, 'ridge_alpha': 0.029078226864470744, 'shrinkage_max': 1.4037883089091228, 'oob_split_ratio': 0.7314563030951619}. Best is trial 25 with value: 0.006927674811006591.\n",
      "[I 2026-07-02 16:32:54,372] Trial 28 finished with value: 0.007125912949822171 and parameters: {'foundation_window': 8, 'ar_lags': 2, 'ema_spans': (2, 3, 5, 8), 'conv_scales': (2, 4, 8), 'use_calendar': True, 'ridge_alpha': 0.022588484720878974, 'shrinkage_max': 1.2490029352603746, 'oob_split_ratio': 0.7312706362125209}. Best is trial 25 with value: 0.006927674811006591.\n",
      "[I 2026-07-02 16:32:54,514] Trial 29 finished with value: 0.012035416184526797 and parameters: {'foundation_window': 5, 'ar_lags': 1, 'ema_spans': (2, 3, 5, 8), 'conv_scales': (2, 4, 8), 'use_calendar': False, 'ridge_alpha': 0.016670619240985347, 'shrinkage_max': 1.2902962537027718, 'oob_split_ratio': 0.7581631665519483}. Best is trial 25 with value: 0.006927674811006591.\n",
      "[I 2026-07-02 16:32:54,657] Trial 30 finished with value: 0.009004170070810318 and parameters: {'foundation_window': 6, 'ar_lags': 2, 'ema_spans': (2, 3, 5, 8), 'conv_scales': (2, 4, 8), 'use_calendar': True, 'ridge_alpha': 0.015562048184375935, 'shrinkage_max': 1.1596129715485448, 'oob_split_ratio': 0.7251316741146226}. Best is trial 25 with value: 0.006927674811006591.\n",
