      "[I 2026-07-02 14:59:23,595] Trial 214 finished with value: 0.025804166151469327 and parameters: {'foundation_window': 3, 'ar_lags': 2, 'ema_spans': (3, 6, 12), 'conv_scales': (2, 4, 8), 'use_calendar': False, 'ridge_alpha': 99.40491112549392, 'shrinkage_max': 2.2592061929516034, 'oob_split_ratio': 0.560416393411727}. Best is trial 175 with value: 0.02578611359440366.\n",
      "[I 2026-07-02 14:59:23,762] Trial 215 finished with value: 0.025831699055163065 and parameters: {'foundation_window': 3, 'ar_lags': 2, 'ema_spans': (3, 6, 12), 'conv_scales': (2, 4, 8), 'use_calendar': False, 'ridge_alpha': 96.2340733471594, 'shrinkage_max': 2.2647586245254385, 'oob_split_ratio': 0.5674418199273679}. Best is trial 175 with value: 0.02578611359440366.\n",
      "[I 2026-07-02 14:59:23,928] Trial 216 finished with value: 0.0418921297116111 and parameters: {'foundation_window': 3, 'ar_lags': 2, 'ema_spans': (3, 6, 12), 'conv_scales': (2, 4, 8), 'use_calendar': False, 'ridge_alpha': 60.38419763776805, 'shrinkage_max': 2.187903075842311, 'oob_split_ratio': 0.5802841812024383}. Best is trial 175 with value: 0.02578611359440366.\n",
      "[I 2026-07-02 14:59:24,094] Trial 217 finished with value: 0.025809436835482716 and parameters: {'foundation_window': 3, 'ar_lags': 2, 'ema_spans': (3, 6, 12), 'conv_scales': (2, 4, 8), 'use_calendar': False, 'ridge_alpha': 99.87198403107604, 'shrinkage_max': 2.244950510879305, 'oob_split_ratio': 0.5607338764020272}. Best is trial 175 with value: 0.02578611359440366.\n",
      "[I 2026-07-02 14:59:24,268] Trial 218 finished with value: 0.029222410399231864 and parameters: {'foundation_window': 2, 'ar_lags': 2, 'ema_spans': (3, 6, 12), 'conv_scales': (2, 4, 8), 'use_calendar': False, 'ridge_alpha': 97.19249708157825, 'shrinkage_max': 2.128989178186294, 'oob_split_ratio': 0.5739057188819583}. Best is trial 175 with value: 0.02578611359440366.\n",
      "[I 2026-07-02 14:59:24,452] Trial 219 finished with value: 0.02581028452888544 and parameters: {'foundation_window': 3, 'ar_lags': 2, 'ema_spans': (3, 6, 12), 'conv_scales': (2, 4, 8), 'use_calendar': False, 'ridge_alpha': 98.9280210867692, 'shrinkage_max': 2.231972470171273, 'oob_split_ratio': 0.5589317644872731}. Best is trial 175 with value: 0.02578611359440366.\n",
      "[I 2026-07-02 14:59:24,631] Trial 220 finished with value: 0.041215363798658484 and parameters: {'foundation_window': 4, 'ar_lags': 2, 'ema_spans': (3, 6, 12), 'conv_scales': (2, 4, 8), 'use_calendar': False, 'ridge_alpha': 98.06648307168108, 'shrinkage_max': 2.172014069240901, 'oob_split_ratio': 0.5559019714040552}. Best is trial 175 with value: 0.02578611359440366.\n",
      "[I 2026-07-02 14:59:24,799] Trial 221 finished with value: 0.02581599869498256 and parameters: {'foundation_window': 3, 'ar_lags': 2, 'ema_spans': (3, 6, 12), 'conv_scales': (2, 4, 8), 'use_calendar': False, 'ridge_alpha': 99.80593036267364, 'shrinkage_max': 2.221180431027286, 'oob_split_ratio': 0.5605279258589658}. Best is trial 175 with value: 0.02578611359440366.\n",
      "[I 2026-07-02 14:59:24,991] Trial 222 finished with value: 0.02580554421531492 and parameters: {'foundation_window': 3, 'ar_lags': 2, 'ema_spans': (3, 6, 12), 'conv_scales': (2, 4, 8), 'use_calendar': False, 'ridge_alpha': 64.96920846500815, 'shrinkage_max': 2.2467137782847195, 'oob_split_ratio': 0.5674129894283599}. Best is trial 175 with value: 0.02578611359440366.\n",
      "[I 2026-07-02 14:59:25,160] Trial 223 finished with value: 0.025830321264534814 and parameters: {'foundation_window': 3, 'ar_lags': 2, 'ema_spans': (3, 6, 12), 'conv_scales': (2, 4, 8), 'use_calendar': False, 'ridge_alpha': 55.38702806498125, 'shrinkage_max': 2.2734110340283773, 'oob_split_ratio': 0.5690780002756411}. Best is trial 175 with value: 0.02578611359440366.\n",
      "[I 2026-07-02 14:59:25,332] Trial 224 finished with value: 0.025864509412294668 and parameters: {'foundation_window': 3, 'ar_lags': 2, 'ema_spans': (3, 6, 12), 'conv_scales': (2, 4, 8), 'use_calendar': False, 'ridge_alpha': 43.97814948247057, 'shrinkage_max': 2.098282888180932, 'oob_split_ratio': 0.5667237063547921}. Best is trial 175 with value: 0.02578611359440366.\n",
      "[I 2026-07-02 14:59:25,510] Trial 225 finished with value: 0.025819764566390086 and parameters: {'foundation_window': 3, 'ar_lags': 2, 'ema_spans': (3, 6, 12), 'conv_scales': (2, 4, 8), 'use_calendar': False, 'ridge_alpha': 65.86852277143875, 'shrinkage_max': 2.202440018454065, 'oob_split_ratio': 0.574851331356143}. Best is trial 175 with value: 0.02578611359440366.\n",
      "[I 2026-07-02 14:59:25,685] Trial 226 finished with value: 0.026670175116890533 and parameters: {'foundation_window': 3, 'ar_lags': 2, 'ema_spans': (3, 6), 'conv_scales': (2, 4, 8), 'use_calendar': False, 'ridge_alpha': 66.61624484301836, 'shrinkage_max': 2.2768536582830405, 'oob_split_ratio': 0.5694340974403045}. Best is trial 175 with value: 0.02578611359440366.\n",
      "[I 2026-07-02 14:59:25,859] Trial 227 finished with value: 0.025900207626837226 and parameters: {'foundation_window': 3, 'ar_lags': 2, 'ema_spans': (3, 6, 12), 'conv_scales': (2, 4, 8), 'use_calendar': False, 'ridge_alpha': 99.38603108731567, 'shrinkage_max': 2.16729242933913, 'oob_split_ratio': 0.5557979489640267}. Best is trial 175 with value: 0.02578611359440366.\n",
      "[I 2026-07-02 14:59:26,041] Trial 228 finished with value: 0.02579606911217308 and parameters: {'foundation_window': 3, 'ar_lags': 2, 'ema_spans': (3, 6, 12), 'conv_scales': (2, 4, 8), 'use_calendar': False, 'ridge_alpha': 77.9216610111365, 'shrinkage_max': 2.2271562371631615, 'oob_split_ratio': 0.5646854135159896}. Best is trial 175 with value: 0.02578611359440366.\n",
      "[I 2026-07-02 14:59:26,225] Trial 229 finished with value: 0.041864459772078755 and parameters: {'foundation_window': 3, 'ar_lags': 2, 'ema_spans': (3, 6, 12), 'conv_scales': (2, 4, 8), 'use_calendar': False, 'ridge_alpha': 52.22600470236163, 'shrinkage_max': 1.9778434370613953, 'oob_split_ratio': 0.5796334475002601}. Best is trial 175 with value: 0.02578611359440366.\n",
      "[I 2026-07-02 14:59:26,398] Trial 230 finished with value: 0.02836283810612014 and parameters: {'foundation_window': 3, 'ar_lags': 2, 'ema_spans': (3, 6, 12), 'conv_scales': (2, 3), 'use_calendar': False, 'ridge_alpha': 66.69272819591829, 'shrinkage_max': 2.214277513666896, 'oob_split_ratio': 0.5641744411745916}. Best is trial 175 with value: 0.02578611359440366.\n",
      "[I 2026-07-02 14:59:26,588] Trial 231 finished with value: 0.02578553895630763 and parameters: {'foundation_window': 3, 'ar_lags': 2, 'ema_spans': (3, 6, 12), 'conv_scales': (2, 4, 8), 'use_calendar': False, 'ridge_alpha': 81.7430281892985, 'shrinkage_max': 2.305569641926761, 'oob_split_ratio': 0.5715581593044932}. Best is trial 231 with value: 0.02578553895630763.\n",
      "[I 2026-07-02 14:59:26,764] Trial 232 finished with value: 0.02582317243374181 and parameters: {'foundation_window': 3, 'ar_lags': 2, 'ema_spans': (3, 6, 12), 'conv_scales': (2, 4, 8), 'use_calendar': False, 'ridge_alpha': 77.43287938857766, 'shrinkage_max': 2.3017035603321077, 'oob_split_ratio': 0.5728060795311563}. Best is trial 231 with value: 0.02578553895630763.\n",
      "[I 2026-07-02 14:59:26,937] Trial 233 finished with value: 0.025805707841593865 and parameters: {'foundation_window': 3, 'ar_lags': 2, 'ema_spans': (3, 6, 12), 'conv_scales': (2, 4, 8), 'use_calendar': False, 'ridge_alpha': 81.1561297241879, 'shrinkage_max': 2.2259845281821558, 'oob_split_ratio': 0.5670721111721332}. Best is trial 231 with value: 0.02578553895630763.\n",
      "[I 2026-07-02 14:59:27,117] Trial 234 finished with value: 0.030036824976720704 and parameters: {'foundation_window': 3, 'ar_lags': 6, 'ema_spans': (3, 6, 12), 'conv_scales': (2, 4, 8), 'use_calendar': False, 'ridge_alpha': 99.30476141520083, 'shrinkage_max': 2.1395045013245912, 'oob_split_ratio': 0.5708600835234405}. Best is trial 231 with value: 0.02578553895630763.\n",
      "[I 2026-07-02 14:59:27,318] Trial 235 finished with value: 0.02582534890195232 and parameters: {'foundation_window': 3, 'ar_lags': 2, 'ema_spans': (3, 6, 12), 'conv_scales': (2, 4, 8), 'use_calendar': False, 'ridge_alpha': 79.01447621936957, 'shrinkage_max': 2.3094041453537395, 'oob_split_ratio': 0.5774498417567254}. Best is trial 231 with value: 0.02578553895630763.\n",
      "[I 2026-07-02 14:59:27,523] Trial 236 finished with value: 0.025844212663489362 and parameters: {'foundation_window': 3, 'ar_lags': 2, 'ema_spans': (3, 6, 12), 'conv_scales': (2, 4, 8), 'use_calendar': False, 'ridge_alpha': 56.29818767497893, 'shrinkage_max': 2.215694978308106, 'oob_split_ratio': 0.5653496503972317}. Best is trial 231 with value: 0.02578553895630763.\n",
      "[I 2026-07-02 14:59:27,700] Trial 237 finished with value: 0.041500308477541166 and parameters: {'foundation_window': 3, 'ar_lags': 2, 'ema_spans': (3, 6, 12), 'conv_scales': (2, 4, 8), 'use_calendar': False, 'ridge_alpha': 82.1542657091944, 'shrinkage_max': 2.402249472584033, 'oob_split_ratio': 0.5835728890741609}. Best is trial 231 with value: 0.02578553895630763.\n",
      "[I 2026-07-02 14:59:27,872] Trial 238 finished with value: 0.02900385125441147 and parameters: {'foundation_window': 9, 'ar_lags': 2, 'ema_spans': (3, 6, 12), 'conv_scales': (2, 4, 8), 'use_calendar': False, 'ridge_alpha': 45.24465391724005, 'shrinkage_max': 2.0705849776209093, 'oob_split_ratio': 0.5720540364528576}. Best is trial 231 with value: 0.02578553895630763.\n",
      "[I 2026-07-02 14:59:28,040] Trial 239 finished with value: 0.025900696005644788 and parameters: {'foundation_window': 3, 'ar_lags': 2, 'ema_spans': (3, 6, 12), 'conv_scales': (2, 4, 8), 'use_calendar': False, 'ridge_alpha': 98.58789108412725, 'shrinkage_max': 2.1626417475781663, 'oob_split_ratio': 0.5672364169865803}. Best is trial 231 with value: 0.02578553895630763.\n",
      "[I 2026-07-02 14:59:28,206] Trial 240 finished with value: 0.032773610767497054 and parameters: {'foundation_window': 8, 'ar_lags': 2, 'ema_spans': (2, 4), 'conv_scales': (2, 4, 8), 'use_calendar': False, 'ridge_alpha': 62.0998726126495, 'shrinkage_max': 2.2535762938580475, 'oob_split_ratio': 0.5632272468296379}. Best is trial 231 with value: 0.02578553895630763.\n",
      "[I 2026-07-02 14:59:28,390] Trial 241 finished with value: 0.025825652392039947 and parameters: {'foundation_window': 3, 'ar_lags': 2, 'ema_spans': (3, 6, 12), 'conv_scales': (2, 4, 8), 'use_calendar': False, 'ridge_alpha': 75.21621092191691, 'shrinkage_max': 2.2675872528578647, 'oob_split_ratio': 0.5613110056234987}. Best is trial 231 with value: 0.02578553895630763.\n",
      "[I 2026-07-02 14:59:28,565] Trial 242 finished with value: 0.025795406446220595 and parameters: {'foundation_window': 3, 'ar_lags': 2, 'ema_spans': (3, 6, 12), 'conv_scales': (2, 4, 8), 'use_calendar': False, 'ridge_alpha': 68.23623591380456, 'shrinkage_max': 2.3148250960546726, 'oob_split_ratio': 0.5748442407517872}. Best is trial 231 with value: 0.02578553895630763.\n",
      "[I 2026-07-02 14:59:28,744] Trial 243 finished with value: 0.025817346857934367 and parameters: {'foundation_window': 3, 'ar_lags': 2, 'ema_spans': (3, 6, 12), 'conv_scales': (2, 4, 8), 'use_calendar': False, 'ridge_alpha': 77.0273288603884, 'shrinkage_max': 2.321529308524562, 'oob_split_ratio': 0.5749610010198778}. Best is trial 231 with value: 0.02578553895630763.\n",
      "[I 2026-07-02 14:59:28,936] Trial 244 finished with value: 0.025809278457098545 and parameters: {'foundation_window': 3, 'ar_lags': 2, 'ema_spans': (3, 6, 12), 'conv_scales': (2, 4, 8), 'use_calendar': False, 'ridge_alpha': 80.16901050028086, 'shrinkage_max': 2.2032251181037763, 'oob_split_ratio': 0.5695585079706784}. Best is trial 231 with value: 0.02578553895630763.\n",
      "[I 2026-07-02 14:59:29,107] Trial 245 finished with value: 0.025929938606177098 and parameters: {'foundation_window': 3, 'ar_lags': 2, 'ema_spans': (3, 6, 12), 'conv_scales': (2, 4, 8), 'use_calendar': False, 'ridge_alpha': 99.91073816072206, 'shrinkage_max': 2.1855848313205453, 'oob_split_ratio': 0.577328012476476}. Best is trial 231 with value: 0.02578553895630763.\n",
      "[I 2026-07-02 14:59:29,284] Trial 246 finished with value: 0.025813698639109203 and parameters: {'foundation_window': 3, 'ar_lags': 2, 'ema_spans': (3, 6, 12), 'conv_scales': (2, 4, 8), 'use_calendar': False, 'ridge_alpha': 81.39552925882624, 'shrinkage_max': 2.383276205947009, 'oob_split_ratio': 0.5709602190318658}. Best is trial 231 with value: 0.02578553895630763.\n",
      "[I 2026-07-02 14:59:29,471] Trial 247 finished with value: 0.025815777476186356 and parameters: {'foundation_window': 3, 'ar_lags': 2, 'ema_spans': (3, 6, 12), 'conv_scales': (2, 4, 8), 'use_calendar': False, 'ridge_alpha': 54.44631858793085, 'shrinkage_max': 2.1317913093793748, 'oob_split_ratio': 0.5676415943597258}. Best is trial 231 with value: 0.02578553895630763.\n",
      "[I 2026-07-02 14:59:29,664] Trial 248 finished with value: 0.02738174844667665 and parameters: {'foundation_window': 3, 'ar_lags': 2, 'ema_spans': (3, 6, 12), 'conv_scales': (2, 3, 4), 'use_calendar': False, 'ridge_alpha': 99.48774252489024, 'shrinkage_max': 2.318558754852865, 'oob_split_ratio': 0.5738576619612435}. Best is trial 231 with value: 0.02578553895630763.\n",
      "[I 2026-07-02 14:59:29,835] Trial 249 finished with value: 0.04119059994465433 and parameters: {'foundation_window': 3, 'ar_lags': 2, 'ema_spans': (3, 6, 12), 'conv_scales': (2, 4, 8), 'use_calendar': False, 'ridge_alpha': 79.94080387039894, 'shrinkage_max': 2.2082419080823867, 'oob_split_ratio': 0.5831286690505685}. Best is trial 231 with value: 0.02578553895630763.\n",
      "[I 2026-07-02 14:59:30,030] Trial 250 finished with value: 0.025805366758720086 and parameters: {'foundation_window': 3, 'ar_lags': 2, 'ema_spans': (3, 6, 12), 'conv_scales': (2, 4, 8), 'use_calendar': False, 'ridge_alpha': 61.81481759675379, 'shrinkage_max': 2.2203676076285714, 'oob_split_ratio': 0.5671740305191362}. Best is trial 231 with value: 0.02578553895630763.\n",
      "[I 2026-07-02 14:59:30,211] Trial 251 finished with value: 0.0258667877140837 and parameters: {'foundation_window': 3, 'ar_lags': 2, 'ema_spans': (3, 6, 12), 'conv_scales': (2, 4, 8), 'use_calendar': False, 'ridge_alpha': 42.39354251506823, 'shrinkage_max': 2.3047239584213535, 'oob_split_ratio': 0.5685686390896914}. Best is trial 231 with value: 0.02578553895630763.\n",
      "[I 2026-07-02 14:59:30,374] Trial 252 finished with value: 0.0260725185976781 and parameters: {'foundation_window': 3, 'ar_lags': 2, 'ema_spans': (2, 4, 8), 'conv_scales': (3, 6), 'use_calendar': False, 'ridge_alpha': 54.920381619119055, 'shrinkage_max': 2.4282876125008688, 'oob_split_ratio': 0.5784998368448503}. Best is trial 231 with value: 0.02578553895630763.\n",
      "[I 2026-07-02 14:59:30,553] Trial 253 finished with value: 0.02897308014974773 and parameters: {'foundation_window': 2, 'ar_lags': 2, 'ema_spans': (3, 6, 12), 'conv_scales': (2, 4, 8), 'use_calendar': False, 'ridge_alpha': 65.34699139426908, 'shrinkage_max': 2.1838755083969352, 'oob_split_ratio': 0.5724562501982324}. Best is trial 231 with value: 0.02578553895630763.\n",
      "[I 2026-07-02 14:59:30,734] Trial 254 finished with value: 0.025840680629982817 and parameters: {'foundation_window': 3, 'ar_lags': 2, 'ema_spans': (3, 6, 12), 'conv_scales': (2, 4, 8), 'use_calendar': False, 'ridge_alpha': 61.09467059217864, 'shrinkage_max': 2.0769442550990576, 'oob_split_ratio': 0.5663338077707707}. Best is trial 231 with value: 0.02578553895630763.\n",
      "[I 2026-07-02 14:59:30,910] Trial 255 finished with value: 0.026804047935754027 and parameters: {'foundation_window': 3, 'ar_lags': 2, 'ema_spans': (3, 6, 12), 'conv_scales': (3, 6, 12), 'use_calendar': False, 'ridge_alpha': 76.49412582794342, 'shrinkage_max': 2.3625108014547918, 'oob_split_ratio': 0.577769705580794}. Best is trial 231 with value: 0.02578553895630763.\n",
      "[I 2026-07-02 14:59:31,087] Trial 256 finished with value: 0.025804956444927873 and parameters: {'foundation_window': 3, 'ar_lags': 2, 'ema_spans': (3, 6, 12), 'conv_scales': (2, 4, 8), 'use_calendar': True, 'ridge_alpha': 49.19298837316545, 'shrinkage_max': 2.130124812382266, 'oob_split_ratio': 0.5700198215615002}. Best is trial 231 with value: 0.02578553895630763.\n",
      "[I 2026-07-02 14:59:31,271] Trial 257 finished with value: 0.025790568474274824 and parameters: {'foundation_window': 3, 'ar_lags': 2, 'ema_spans': (3, 6, 12), 'conv_scales': (2, 4, 8), 'use_calendar': True, 'ridge_alpha': 38.61250090080093, 'shrinkage_max': 1.9755814443080129, 'oob_split_ratio': 0.571192100099084}. Best is trial 231 with value: 0.02578553895630763.\n",
      "[I 2026-07-02 14:59:31,460] Trial 258 finished with value: 0.040856389129711755 and parameters: {'foundation_window': 3, 'ar_lags': 2, 'ema_spans': (3, 6, 12), 'conv_scales': (2, 4, 8), 'use_calendar': False, 'ridge_alpha': 31.89928475198878, 'shrinkage_max': 1.987863177336955, 'oob_split_ratio': 0.586307653693347}. Best is trial 231 with value: 0.02578553895630763.\n",
      "[I 2026-07-02 14:59:31,630] Trial 259 finished with value: 0.03987133914153692 and parameters: {'foundation_window': 4, 'ar_lags': 2, 'ema_spans': (3, 6, 12), 'conv_scales': (2, 4, 8), 'use_calendar': True, 'ridge_alpha': 47.54684986498886, 'shrinkage_max': 1.8542308101799791, 'oob_split_ratio': 0.5742333780517277}. Best is trial 231 with value: 0.02578553895630763.\n",
      "[I 2026-07-02 14:59:31,806] Trial 260 finished with value: 0.025803796448278477 and parameters: {'foundation_window': 3, 'ar_lags': 2, 'ema_spans': (3, 6, 12), 'conv_scales': (2, 4, 8), 'use_calendar': True, 'ridge_alpha': 37.65692083193724, 'shrinkage_max': 2.111637269527679, 'oob_split_ratio': 0.5700586343196289}. Best is trial 231 with value: 0.02578553895630763.\n",
      "[I 2026-07-02 14:59:31,967] Trial 261 finished with value: 0.031006589009562657 and parameters: {'foundation_window': 2, 'ar_lags': 2, 'ema_spans': (3, 6), 'conv_scales': (2, 4, 8), 'use_calendar': True, 'ridge_alpha': 38.16558803409141, 'shrinkage_max': 2.1314233462379084, 'oob_split_ratio': 0.5793557896155491}. Best is trial 231 with value: 0.02578553895630763.\n",
      "[I 2026-07-02 14:59:32,143] Trial 262 finished with value: 0.025814851946670093 and parameters: {'foundation_window': 3, 'ar_lags': 2, 'ema_spans': (3, 6, 12), 'conv_scales': (2, 4, 8), 'use_calendar': True, 'ridge_alpha': 41.87987780581225, 'shrinkage_max': 1.8951009457914731, 'oob_split_ratio': 0.5721222804093241}. Best is trial 231 with value: 0.02578553895630763.\n",
      "[I 2026-07-02 14:59:32,312] Trial 263 finished with value: 0.025881972746813798 and parameters: {'foundation_window': 3, 'ar_lags': 2, 'ema_spans': (3, 6, 12), 'conv_scales': (2, 4, 8), 'use_calendar': False, 'ridge_alpha': 35.988011513098755, 'shrinkage_max': 1.918148407509708, 'oob_split_ratio': 0.565539447887937}. Best is trial 231 with value: 0.02578553895630763.\n",
      "[I 2026-07-02 14:59:32,489] Trial 264 finished with value: 0.04140158419115691 and parameters: {'foundation_window': 3, 'ar_lags': 2, 'ema_spans': (3, 6, 12), 'conv_scales': (2, 4, 8), 'use_calendar': True, 'ridge_alpha': 50.693204949591625, 'shrinkage_max': 2.010978657824748, 'oob_split_ratio': 0.582450072947187}. Best is trial 231 with value: 0.02578553895630763.\n",
      "[I 2026-07-02 14:59:32,665] Trial 265 finished with value: 0.025842673365282922 and parameters: {'foundation_window': 3, 'ar_lags': 2, 'ema_spans': (3, 6, 12), 'conv_scales': (2, 4, 8), 'use_calendar': True, 'ridge_alpha': 28.052389785821426, 'shrinkage_max': 2.0807537148200357, 'oob_split_ratio': 0.5750340504934733}. Best is trial 231 with value: 0.02578553895630763.\n",
      "[I 2026-07-02 14:59:32,820] Trial 266 finished with value: 0.028715045545050246 and parameters: {'foundation_window': 4, 'ar_lags': 2, 'ema_spans': (3, 6, 12), 'conv_scales': (2, 3), 'use_calendar': True, 'ridge_alpha': 55.89665775818688, 'shrinkage_max': 2.1211094518025164, 'oob_split_ratio': 0.5687631437192443}. Best is trial 231 with value: 0.02578553895630763.\n",
      "[I 2026-07-02 14:59:32,992] Trial 267 finished with value: 0.025811660932572728 and parameters: {'foundation_window': 3, 'ar_lags': 2, 'ema_spans': (3, 6, 12), 'conv_scales': (2, 4, 8), 'use_calendar': True, 'ridge_alpha': 34.5589876277565, 'shrinkage_max': 2.309756708988157, 'oob_split_ratio': 0.5705041290723984}. Best is trial 231 with value: 0.02578553895630763.\n",
      "[I 2026-07-02 14:59:33,167] Trial 268 finished with value: 0.03213709311994558 and parameters: {'foundation_window': 12, 'ar_lags': 2, 'ema_spans': (3, 6, 12), 'conv_scales': (2, 4, 8), 'use_calendar': True, 'ridge_alpha': 44.91796119879486, 'shrinkage_max': 2.0534664622667167, 'oob_split_ratio': 0.5777670457063385}. Best is trial 231 with value: 0.02578553895630763.\n",
      "[I 2026-07-02 14:59:33,333] Trial 269 finished with value: 0.027208053911372595 and parameters: {'foundation_window': 3, 'ar_lags': 2, 'ema_spans': (2, 4), 'conv_scales': (2, 4, 8), 'use_calendar': True, 'ridge_alpha': 62.46004320531668, 'shrinkage_max': 2.386971342319976, 'oob_split_ratio': 0.5660037316562789}. Best is trial 231 with value: 0.02578553895630763.\n",
      "[I 2026-07-02 14:59:33,499] Trial 270 finished with value: 0.029288103457997445 and parameters: {'foundation_window': 2, 'ar_lags': 2, 'ema_spans': (3, 6, 12), 'conv_scales': (2, 4, 8), 'use_calendar': True, 'ridge_alpha': 63.921583748880465, 'shrinkage_max': 2.16119986255283, 'oob_split_ratio': 0.5755564388442508}. Best is trial 231 with value: 0.02578553895630763.\n",
