      "[I 2026-07-02 14:58:47,664] Trial 199 finished with value: 2.0070200649362704 and parameters: {'target_miscoverage': 0.1857145585765873, 'aci_step_size': 0.02565282337224758, 'interval_scale': 0.500954483237642}. Best is trial 112 with value: 2.003704646213716.\n"
     ]
    },
    {
     "name": "stdout",
     "output_type": "stream",
     "text": [
      "S3-Forecaster best point parameters:\n",
      "{'reservoir_size': 56, 'spectral_radius': 0.9103969867133103, 'ar_lags': 3, 'foundation_window': 4, 'regressor_type': 'ElasticNet', 'reg_alpha': 0.3524623952177369, 'aci_step_size': 0.16542330106077288, 'oob_split_ratio': 0.641884812422273}\n",
      "S3-Forecaster best UQ parameters:\n",
      "{'target_miscoverage': 0.18693903755388486, 'aci_step_size': 0.010796267260429575, 'interval_scale': 0.500164287952824}\n",
      "S3-Forecaster test metrics on modelling scale:\n"
     ]
    },
    {
     "data": {
      "text/html": [
       "<div>\n",
       "<style scoped>\n",
       "    .dataframe tbody tr th:only-of-type {\n",
       "        vertical-align: middle;\n",
       "    }\n",
       "\n",
       "    .dataframe tbody tr th {\n",
       "        vertical-align: top;\n",
       "    }\n",
       "\n",
       "    .dataframe thead th {\n",
       "        text-align: right;\n",
       "    }\n",
       "</style>\n",
       "<table border=\"1\" class=\"dataframe\">\n",
       "  <thead>\n",
       "    <tr style=\"text-align: right;\">\n",
       "      <th></th>\n",
       "      <th>mae</th>\n",
       "      <th>mse</th>\n",
       "      <th>rmse</th>\n",
       "      <th>r2</th>\n",
       "      <th>mape_percent</th>\n",
       "      <th>mape</th>\n",
       "      <th>smape_percent</th>\n",
       "      <th>smape</th>\n",
       "      <th>ecp</th>\n",
       "      <th>coverage_error</th>\n",
       "      <th>iw</th>\n",
       "      <th>mean_width</th>\n",
       "      <th>mis</th>\n",
       "      <th>interval_score</th>\n",
       "      <th>msis</th>\n",
       "      <th>scale</th>\n",
       "      <th>elapsed_seconds</th>\n",
       "      <th>trainable_params</th>\n",
       "    </tr>\n",
       "  </thead>\n",
       "  <tbody>\n",
       "    <tr>\n",
       "      <th>0</th>\n",
       "      <td>0.299527</td>\n",
       "      <td>0.222326</td>\n",
       "      <td>0.471515</td>\n",
       "      <td>-0.534124</td>\n",
       "      <td>3.704206</td>\n",
       "      <td>0.037042</td>\n",
       "      <td>3.544934</td>\n",
       "      <td>0.035449</td>\n",
       "      <td>0.611111</td>\n",
       "      <td>0.288889</td>\n",
       "      <td>0.567852</td>\n",
       "      <td>0.567852</td>\n",
       "      <td>3.364348</td>\n",
       "      <td>3.364348</td>\n",
       "      <td>5.84208</td>\n",
       "      <td>0.575882</td>\n",
       "      <td>0.071443</td>\n",
       "      <td>1082</td>\n",
       "    </tr>\n",
       "  </tbody>\n",
       "</table>\n",
       "</div>"
      ],
      "text/plain": [
       "        mae       mse      rmse        r2  mape_percent      mape  \\\n",
       "0  0.299527  0.222326  0.471515 -0.534124      3.704206  0.037042   \n",
       "\n",
       "   smape_percent     smape       ecp  coverage_error        iw  mean_width  \\\n",
       "0       3.544934  0.035449  0.611111        0.288889  0.567852    0.567852   \n",
       "\n",
       "        mis  interval_score     msis     scale  elapsed_seconds  \\\n",
       "0  3.364348        3.364348  5.84208  0.575882         0.071443   \n",
       "\n",
       "   trainable_params  \n",
       "0              1082  "
      ]
     },
     "metadata": {},
     "output_type": "display_data"
    }
   ],
   "source": [
    "s3_result = run_s3_experiment(\n",
    "    train_series,\n",
    "    test_series,\n",
    "    point_trials=S3_POINT_TRIALS,\n",
    "    uq_trials=S3_UQ_TRIALS,\n",
    "    val_size=VAL_SIZE,\n",
    "    seed=SEED,\n",
    ")\n",
    "\n",
    "print(\"S3-Forecaster best point parameters:\")\n",
    "print(s3_result[\"best_point_params\"])\n",
    "print(\"S3-Forecaster best UQ parameters:\")\n",
    "print(s3_result[\"best_uq_params\"])\n",
    "print(\"S3-Forecaster test metrics on modelling scale:\")\n",
    "display(pd.DataFrame([s3_result[\"metrics\"]]))"
   ]
  },
  {
   "cell_type": "markdown",
   "id": "1e7a6630",
   "metadata": {
    "papermill": {
     "duration": 0.043484,
     "end_time": "2026-07-02T14:58:47.877953+00:00",
     "exception": false,
     "start_time": "2026-07-02T14:58:47.834469+00:00",
     "status": "completed"
    },
    "tags": []
   },
   "source": [
    "## 7. S3-FastSketch optimization and final test"
   ]
  },
  {
   "cell_type": "code",
   "execution_count": 9,
   "id": "423152e3",
   "metadata": {
    "execution": {
     "iopub.execute_input": "2026-07-02T14:58:47.953003Z",
     "iopub.status.busy": "2026-07-02T14:58:47.952656Z",
     "iopub.status.idle": "2026-07-02T15:00:10.512414Z",
     "shell.execute_reply": "2026-07-02T15:00:10.511403Z"
    },
    "papermill": {
     "duration": 82.600487,
     "end_time": "2026-07-02T15:00:10.514468+00:00",
     "exception": false,
     "start_time": "2026-07-02T14:58:47.913981+00:00",
     "status": "completed"
    },
    "tags": []
   },
   "outputs": [
    {
     "name": "stderr",
     "output_type": "stream",
     "text": [
      "[I 2026-07-02 14:58:47,957] A new study created in memory with name: no-name-75e54141-86bc-474c-879d-7825fb82bd46\n",
      "[I 2026-07-02 14:58:48,111] Trial 0 finished with value: 0.02989889989920019 and parameters: {'foundation_window': 6, 'ar_lags': 6, 'ema_spans': (2, 4), 'conv_scales': (2, 4, 8), 'use_calendar': False, 'ridge_alpha': 0.008111941985431923, 'shrinkage_max': 0.754362402096943, 'oob_split_ratio': 0.6260605607398845}. Best is trial 0 with value: 0.02989889989920019.\n",
      "[I 2026-07-02 14:58:48,270] Trial 1 finished with value: 0.02984519376605067 and parameters: {'foundation_window': 7, 'ar_lags': 3, 'ema_spans': (2, 4, 8), 'conv_scales': (2, 3, 4), 'use_calendar': True, 'ridge_alpha': 0.007122305833333868, 'shrinkage_max': 0.42889188070951867, 'oob_split_ratio': 0.7872213843133333}. Best is trial 1 with value: 0.02984519376605067.\n",
      "[I 2026-07-02 14:58:48,405] Trial 2 finished with value: 0.04534213680886034 and parameters: {'foundation_window': 12, 'ar_lags': 5, 'ema_spans': (3, 6), 'conv_scales': (3, 6), 'use_calendar': True, 'ridge_alpha': 0.5414413211338525, 'shrinkage_max': 0.7583497526951993, 'oob_split_ratio': 0.7923961569411397}. Best is trial 1 with value: 0.02984519376605067.\n",
      "[I 2026-07-02 14:58:48,554] Trial 3 finished with value: 0.03650165383791994 and parameters: {'foundation_window': 10, 'ar_lags': 6, 'ema_spans': (3, 6), 'conv_scales': (2, 4, 8), 'use_calendar': False, 'ridge_alpha': 0.5169879442298543, 'shrinkage_max': 0.6375416186805973, 'oob_split_ratio': 0.75054924518851}. Best is trial 1 with value: 0.02984519376605067.\n",
      "[I 2026-07-02 14:58:48,708] Trial 4 finished with value: 0.02937009971061826 and parameters: {'foundation_window': 2, 'ar_lags': 6, 'ema_spans': (3, 6, 12), 'conv_scales': (2, 3, 4), 'use_calendar': False, 'ridge_alpha': 0.04513257622008944, 'shrinkage_max': 0.42478546328656497, 'oob_split_ratio': 0.6277455804289156}. Best is trial 4 with value: 0.02937009971061826.\n",
      "[I 2026-07-02 14:58:48,844] Trial 5 finished with value: 0.03147772226935668 and parameters: {'foundation_window': 5, 'ar_lags': 5, 'ema_spans': (2, 4, 8), 'conv_scales': (3, 6), 'use_calendar': False, 'ridge_alpha': 0.003463037026119184, 'shrinkage_max': 0.3364302606385192, 'oob_split_ratio': 0.7091026028159452}. Best is trial 4 with value: 0.02937009971061826.\n",
      "[I 2026-07-02 14:58:48,992] Trial 6 finished with value: 0.03246833751747973 and parameters: {'foundation_window': 5, 'ar_lags': 4, 'ema_spans': (2, 4), 'conv_scales': (3, 6, 12), 'use_calendar': True, 'ridge_alpha': 10.431827200054899, 'shrinkage_max': 0.7630676619365986, 'oob_split_ratio': 0.7731397496224945}. Best is trial 4 with value: 0.02937009971061826.\n",
      "[I 2026-07-02 14:58:49,141] Trial 7 finished with value: 0.031687733643406026 and parameters: {'foundation_window': 7, 'ar_lags': 5, 'ema_spans': (2, 4), 'conv_scales': (2, 3, 4), 'use_calendar': False, 'ridge_alpha': 0.0487613652796118, 'shrinkage_max': 2.8430016857594276, 'oob_split_ratio': 0.6308007330051888}. Best is trial 4 with value: 0.02937009971061826.\n",
      "[I 2026-07-02 14:58:49,295] Trial 8 finished with value: 0.04109565358585191 and parameters: {'foundation_window': 7, 'ar_lags': 5, 'ema_spans': (2, 4, 8), 'conv_scales': (3, 6, 12), 'use_calendar': True, 'ridge_alpha': 34.77998816092338, 'shrinkage_max': 0.9087951993341742, 'oob_split_ratio': 0.5862237180228058}. Best is trial 4 with value: 0.02937009971061826.\n",
      "[I 2026-07-02 14:58:49,431] Trial 9 finished with value: 0.0294044808247957 and parameters: {'foundation_window': 7, 'ar_lags': 6, 'ema_spans': (3, 6), 'conv_scales': (3, 6), 'use_calendar': False, 'ridge_alpha': 0.008562341633595545, 'shrinkage_max': 0.36213163927560077, 'oob_split_ratio': 0.6977232357970605}. Best is trial 4 with value: 0.02937009971061826.\n",
      "[I 2026-07-02 14:58:49,581] Trial 10 finished with value: 0.02957709562664965 and parameters: {'foundation_window': 2, 'ar_lags': 1, 'ema_spans': (3, 6, 12), 'conv_scales': (2, 3), 'use_calendar': False, 'ridge_alpha': 1.7825772506071267, 'shrinkage_max': 1.754986535579859, 'oob_split_ratio': 0.5544647693441357}. Best is trial 4 with value: 0.02937009971061826.\n",
      "[I 2026-07-02 14:58:49,752] Trial 11 finished with value: 0.032457108131260515 and parameters: {'foundation_window': 2, 'ar_lags': 6, 'ema_spans': (2, 3, 5, 8), 'conv_scales': (2, 3, 4), 'use_calendar': False, 'ridge_alpha': 0.029950117900312195, 'shrinkage_max': 1.2602561632138216, 'oob_split_ratio': 0.6854541041007722}. Best is trial 4 with value: 0.02937009971061826.\n",
      "[I 2026-07-02 14:58:49,897] Trial 12 finished with value: 0.03076245984495542 and parameters: {'foundation_window': 9, 'ar_lags': 6, 'ema_spans': (3, 6, 12), 'conv_scales': (3, 6), 'use_calendar': False, 'ridge_alpha': 0.0011657764082687399, 'shrinkage_max': 1.3853875612926285, 'oob_split_ratio': 0.673270025507322}. Best is trial 4 with value: 0.02937009971061826.\n",
      "[I 2026-07-02 14:58:50,043] Trial 13 finished with value: 0.030202604549736427 and parameters: {'foundation_window': 4, 'ar_lags': 4, 'ema_spans': (3, 6, 12), 'conv_scales': (2, 3), 'use_calendar': False, 'ridge_alpha': 0.06531243121765708, 'shrinkage_max': 0.2556755091988788, 'oob_split_ratio': 0.6480998325751282}. Best is trial 4 with value: 0.02937009971061826.\n",
      "[I 2026-07-02 14:58:50,177] Trial 14 finished with value: 0.029954112403882075 and parameters: {'foundation_window': 9, 'ar_lags': 4, 'ema_spans': (3, 6), 'conv_scales': (3, 6), 'use_calendar': False, 'ridge_alpha': 0.14469590906492055, 'shrinkage_max': 1.1854317193896444, 'oob_split_ratio': 0.7294694664166046}. Best is trial 4 with value: 0.02937009971061826.\n",
      "[I 2026-07-02 14:58:50,342] Trial 15 finished with value: 0.03231060149935003 and parameters: {'foundation_window': 3, 'ar_lags': 1, 'ema_spans': (2, 3, 5, 8), 'conv_scales': (2, 3, 4), 'use_calendar': False, 'ridge_alpha': 0.014411464076157536, 'shrinkage_max': 1.8713958800758381, 'oob_split_ratio': 0.5932958963031594}. Best is trial 4 with value: 0.02937009971061826.\n",
      "[I 2026-07-02 14:58:50,482] Trial 16 finished with value: 0.03274716627765036 and parameters: {'foundation_window': 12, 'ar_lags': 6, 'ema_spans': (3, 6), 'conv_scales': (3, 6), 'use_calendar': False, 'ridge_alpha': 0.002276399737884204, 'shrinkage_max': 2.321404694874036, 'oob_split_ratio': 0.6731287040338216}. Best is trial 4 with value: 0.02937009971061826.\n",
      "[I 2026-07-02 14:58:50,645] Trial 17 finished with value: 0.0347101503285367 and parameters: {'foundation_window': 4, 'ar_lags': 3, 'ema_spans': (3, 6, 12), 'conv_scales': (2, 3, 4), 'use_calendar': False, 'ridge_alpha': 0.3047348746221521, 'shrinkage_max': 1.0311233431616675, 'oob_split_ratio': 0.7105842094334424}. Best is trial 4 with value: 0.02937009971061826.\n",
      "[I 2026-07-02 14:58:50,807] Trial 18 finished with value: 0.033859208091905124 and parameters: {'foundation_window': 10, 'ar_lags': 5, 'ema_spans': (3, 6), 'conv_scales': (3, 6, 12), 'use_calendar': True, 'ridge_alpha': 2.259107515706847, 'shrinkage_max': 0.44774272322425523, 'oob_split_ratio': 0.5969750423764418}. Best is trial 4 with value: 0.02937009971061826.\n",
      "[I 2026-07-02 14:58:50,955] Trial 19 finished with value: 0.031000799794492998 and parameters: {'foundation_window': 8, 'ar_lags': 6, 'ema_spans': (3, 6, 12), 'conv_scales': (2, 3), 'use_calendar': False, 'ridge_alpha': 0.1094059332112402, 'shrinkage_max': 1.487481665910884, 'oob_split_ratio': 0.6597291289628405}. Best is trial 4 with value: 0.02937009971061826.\n",
      "[I 2026-07-02 14:58:51,116] Trial 20 finished with value: 0.02821940937898028 and parameters: {'foundation_window': 3, 'ar_lags': 2, 'ema_spans': (2, 3, 5, 8), 'conv_scales': (2, 4, 8), 'use_calendar': False, 'ridge_alpha': 0.019690492763717187, 'shrinkage_max': 0.5274178820489557, 'oob_split_ratio': 0.6955552320293847}. Best is trial 20 with value: 0.02821940937898028.\n",
      "[I 2026-07-02 14:58:51,282] Trial 21 finished with value: 0.027738687772507802 and parameters: {'foundation_window': 3, 'ar_lags': 2, 'ema_spans': (2, 3, 5, 8), 'conv_scales': (2, 4, 8), 'use_calendar': False, 'ridge_alpha': 0.019596660091730236, 'shrinkage_max': 0.4970724086510853, 'oob_split_ratio': 0.7057784301256043}. Best is trial 21 with value: 0.027738687772507802.\n",
      "[I 2026-07-02 14:58:51,466] Trial 22 finished with value: 0.02920237977805576 and parameters: {'foundation_window': 3, 'ar_lags': 2, 'ema_spans': (2, 3, 5, 8), 'conv_scales': (2, 4, 8), 'use_calendar': False, 'ridge_alpha': 0.02166886581538469, 'shrinkage_max': 0.5848820485652074, 'oob_split_ratio': 0.7292506921041568}. Best is trial 21 with value: 0.027738687772507802.\n",
      "[I 2026-07-02 14:58:51,633] Trial 23 finished with value: 0.05264807055048543 and parameters: {'foundation_window': 3, 'ar_lags': 2, 'ema_spans': (2, 3, 5, 8), 'conv_scales': (2, 4, 8), 'use_calendar': False, 'ridge_alpha': 0.018224426147000088, 'shrinkage_max': 0.6354539046482661, 'oob_split_ratio': 0.7410673259232871}. Best is trial 21 with value: 0.027738687772507802.\n",
      "[I 2026-07-02 14:58:51,794] Trial 24 finished with value: 0.04731697536033466 and parameters: {'foundation_window': 4, 'ar_lags': 2, 'ema_spans': (2, 3, 5, 8), 'conv_scales': (2, 4, 8), 'use_calendar': False, 'ridge_alpha': 0.0033529115609017613, 'shrinkage_max': 0.9532609815887287, 'oob_split_ratio': 0.7279783168725718}. Best is trial 21 with value: 0.027738687772507802.\n",
      "[I 2026-07-02 14:58:51,956] Trial 25 finished with value: 0.09604576803434202 and parameters: {'foundation_window': 3, 'ar_lags': 2, 'ema_spans': (2, 3, 5, 8), 'conv_scales': (2, 4, 8), 'use_calendar': False, 'ridge_alpha': 0.16081395342138038, 'shrinkage_max': 0.5850612165754604, 'oob_split_ratio': 0.7612465663388824}. Best is trial 21 with value: 0.027738687772507802.\n",
      "[I 2026-07-02 14:58:52,119] Trial 26 finished with value: 0.06439633670055935 and parameters: {'foundation_window': 5, 'ar_lags': 3, 'ema_spans': (2, 3, 5, 8), 'conv_scales': (2, 4, 8), 'use_calendar': True, 'ridge_alpha': 0.021706503272422902, 'shrinkage_max': 1.1091007280409069, 'oob_split_ratio': 0.7238554299576276}. Best is trial 21 with value: 0.027738687772507802.\n",
      "[I 2026-07-02 14:58:52,281] Trial 27 finished with value: 0.02725654208451324 and parameters: {'foundation_window': 3, 'ar_lags': 2, 'ema_spans': (2, 3, 5, 8), 'conv_scales': (2, 4, 8), 'use_calendar': False, 'ridge_alpha': 0.0011735126916485245, 'shrinkage_max': 0.8919740548955994, 'oob_split_ratio': 0.6943697756842179}. Best is trial 27 with value: 0.02725654208451324.\n",
      "[I 2026-07-02 14:58:52,445] Trial 28 finished with value: 0.04535982466420561 and parameters: {'foundation_window': 4, 'ar_lags': 1, 'ema_spans': (2, 3, 5, 8), 'conv_scales': (2, 4, 8), 'use_calendar': False, 'ridge_alpha': 0.0023353660457617617, 'shrinkage_max': 1.5513067250964832, 'oob_split_ratio': 0.6950174405011268}. Best is trial 27 with value: 0.02725654208451324.\n",
      "[I 2026-07-02 14:58:52,609] Trial 29 finished with value: 0.030395446990634067 and parameters: {'foundation_window': 6, 'ar_lags': 2, 'ema_spans': (2, 3, 5, 8), 'conv_scales': (2, 4, 8), 'use_calendar': False, 'ridge_alpha': 0.001004755985652655, 'shrinkage_max': 0.8144746378115592, 'oob_split_ratio': 0.6751129247897815}. Best is trial 27 with value: 0.02725654208451324.\n",
      "[I 2026-07-02 14:58:52,774] Trial 30 finished with value: 0.06829100185321814 and parameters: {'foundation_window': 2, 'ar_lags': 3, 'ema_spans': (2, 3, 5, 8), 'conv_scales': (2, 4, 8), 'use_calendar': False, 'ridge_alpha': 0.008497398210937385, 'shrinkage_max': 0.9475451123228501, 'oob_split_ratio': 0.6506984365888074}. Best is trial 27 with value: 0.02725654208451324.\n",
      "[I 2026-07-02 14:58:52,937] Trial 31 finished with value: 0.02771192443435863 and parameters: {'foundation_window': 3, 'ar_lags': 2, 'ema_spans': (2, 3, 5, 8), 'conv_scales': (2, 4, 8), 'use_calendar': False, 'ridge_alpha': 0.006674981076300101, 'shrinkage_max': 0.5713927111928735, 'oob_split_ratio': 0.7104741904280572}. Best is trial 27 with value: 0.02725654208451324.\n",
      "[I 2026-07-02 14:58:53,104] Trial 32 finished with value: 0.027697295701051585 and parameters: {'foundation_window': 3, 'ar_lags': 2, 'ema_spans': (2, 3, 5, 8), 'conv_scales': (2, 4, 8), 'use_calendar': False, 'ridge_alpha': 0.005778639960801452, 'shrinkage_max': 0.5560309111411145, 'oob_split_ratio': 0.7100581095329866}. Best is trial 27 with value: 0.02725654208451324.\n",
      "[I 2026-07-02 14:58:53,270] Trial 33 finished with value: 0.04520059153176594 and parameters: {'foundation_window': 4, 'ar_lags': 1, 'ema_spans': (2, 3, 5, 8), 'conv_scales': (2, 4, 8), 'use_calendar': False, 'ridge_alpha': 0.005515541394226512, 'shrinkage_max': 0.7526593085725868, 'oob_split_ratio': 0.7124735780967646}. Best is trial 27 with value: 0.02725654208451324.\n",
      "[I 2026-07-02 14:58:53,438] Trial 34 finished with value: 0.046051383822679225 and parameters: {'foundation_window': 3, 'ar_lags': 2, 'ema_spans': (2, 3, 5, 8), 'conv_scales': (2, 4, 8), 'use_calendar': True, 'ridge_alpha': 0.005335440973620905, 'shrinkage_max': 0.7549255982207586, 'oob_split_ratio': 0.7400597358573692}. Best is trial 27 with value: 0.02725654208451324.\n",
      "[I 2026-07-02 14:58:53,590] Trial 35 finished with value: 0.032602182193450395 and parameters: {'foundation_window': 2, 'ar_lags': 3, 'ema_spans': (2, 4), 'conv_scales': (2, 4, 8), 'use_calendar': False, 'ridge_alpha': 0.0019611274217752675, 'shrinkage_max': 0.25291912507978065, 'oob_split_ratio': 0.7703282912664446}. Best is trial 27 with value: 0.02725654208451324.\n",
      "[I 2026-07-02 14:58:53,751] Trial 36 finished with value: 0.03883488154420751 and parameters: {'foundation_window': 5, 'ar_lags': 1, 'ema_spans': (2, 4, 8), 'conv_scales': (2, 4, 8), 'use_calendar': False, 'ridge_alpha': 0.009920278489927051, 'shrinkage_max': 0.4892953427599061, 'oob_split_ratio': 0.7533168379771259}. Best is trial 27 with value: 0.02725654208451324.\n",
      "[I 2026-07-02 14:58:53,921] Trial 37 finished with value: 0.02773479109936755 and parameters: {'foundation_window': 2, 'ar_lags': 3, 'ema_spans': (2, 3, 5, 8), 'conv_scales': (2, 4, 8), 'use_calendar': True, 'ridge_alpha': 0.0037893656834426617, 'shrinkage_max': 0.6905185116737342, 'oob_split_ratio': 0.7078564919528147}. Best is trial 27 with value: 0.02725654208451324.\n",
      "[I 2026-07-02 14:58:54,082] Trial 38 finished with value: 0.027960071503172822 and parameters: {'foundation_window': 2, 'ar_lags': 3, 'ema_spans': (2, 3, 5, 8), 'conv_scales': (2, 4, 8), 'use_calendar': True, 'ridge_alpha': 0.003618387584094306, 'shrinkage_max': 1.2580470516435867, 'oob_split_ratio': 0.686234972902063}. Best is trial 27 with value: 0.02725654208451324.\n",
      "[I 2026-07-02 14:58:54,246] Trial 39 finished with value: 0.03131296389983572 and parameters: {'foundation_window': 6, 'ar_lags': 3, 'ema_spans': (2, 4), 'conv_scales': (3, 6, 12), 'use_calendar': True, 'ridge_alpha': 0.0016941786727601353, 'shrinkage_max': 0.8824159295408817, 'oob_split_ratio': 0.7983669797079546}. Best is trial 27 with value: 0.02725654208451324.\n",
      "[I 2026-07-02 14:58:54,440] Trial 40 finished with value: 0.03192314512135804 and parameters: {'foundation_window': 2, 'ar_lags': 3, 'ema_spans': (2, 4, 8), 'conv_scales': (2, 4, 8), 'use_calendar': True, 'ridge_alpha': 0.0049938474713819925, 'shrinkage_max': 2.9465383618767547, 'oob_split_ratio': 0.782917282984633}. Best is trial 27 with value: 0.02725654208451324.\n",
      "[I 2026-07-02 14:58:54,616] Trial 41 finished with value: 0.028380515159293337 and parameters: {'foundation_window': 3, 'ar_lags': 2, 'ema_spans': (2, 3, 5, 8), 'conv_scales': (2, 4, 8), 'use_calendar': True, 'ridge_alpha': 0.010516204943238072, 'shrinkage_max': 0.669173103122946, 'oob_split_ratio': 0.7155774205118863}. Best is trial 27 with value: 0.02725654208451324.\n",
      "[I 2026-07-02 14:58:54,783] Trial 42 finished with value: 0.04959885468040174 and parameters: {'foundation_window': 4, 'ar_lags': 2, 'ema_spans': (2, 3, 5, 8), 'conv_scales': (2, 4, 8), 'use_calendar': True, 'ridge_alpha': 0.04515946207825407, 'shrinkage_max': 0.43160489232044297, 'oob_split_ratio': 0.7036217168699551}. Best is trial 27 with value: 0.02725654208451324.\n",
