      "[I 2026-07-02 14:58:07,557] Trial 55 finished with value: 0.03217426294663132 and parameters: {'reservoir_size': 35, 'spectral_radius': 0.9223027531397326, 'ar_lags': 2, 'foundation_window': 6, 'regressor_type': 'ElasticNet', 'reg_alpha': 18.21953237739499, 'aci_step_size': 0.06548294002907688, 'oob_split_ratio': 0.6347779346448764}. Best is trial 25 with value: 0.030603792302848206.\n",
      "[I 2026-07-02 14:58:07,659] Trial 56 finished with value: 0.03744729127496008 and parameters: {'reservoir_size': 11, 'spectral_radius': 0.5591743199768943, 'ar_lags': 3, 'foundation_window': 3, 'regressor_type': 'Lasso', 'reg_alpha': 2.65255051837557, 'aci_step_size': 0.11657027415808767, 'oob_split_ratio': 0.6519654290412398}. Best is trial 25 with value: 0.030603792302848206.\n",
      "[I 2026-07-02 14:58:07,910] Trial 57 finished with value: 0.03433564978022054 and parameters: {'reservoir_size': 107, 'spectral_radius': 1.011324647984932, 'ar_lags': 2, 'foundation_window': 9, 'regressor_type': 'ElasticNet', 'reg_alpha': 38.258515131127126, 'aci_step_size': 0.1977415856148391, 'oob_split_ratio': 0.6069678897273144}. Best is trial 25 with value: 0.030603792302848206.\n",
      "[I 2026-07-02 14:58:08,003] Trial 58 finished with value: 0.03313375528070473 and parameters: {'reservoir_size': 79, 'spectral_radius': 0.69663385126437, 'ar_lags': 3, 'foundation_window': 7, 'regressor_type': 'ElasticNet', 'reg_alpha': 0.16023432727573578, 'aci_step_size': 0.010810473233398926, 'oob_split_ratio': 0.6859320253842309}. Best is trial 25 with value: 0.030603792302848206.\n",
      "[I 2026-07-02 14:58:08,093] Trial 59 finished with value: 0.03315878473982749 and parameters: {'reservoir_size': 56, 'spectral_radius': 0.8538381759357819, 'ar_lags': 3, 'foundation_window': 8, 'regressor_type': 'ElasticNet', 'reg_alpha': 0.7321708620979929, 'aci_step_size': 0.17790351327078552, 'oob_split_ratio': 0.7178593643442541}. Best is trial 25 with value: 0.030603792302848206.\n",
      "[I 2026-07-02 14:58:08,363] Trial 60 finished with value: 0.03347969737535224 and parameters: {'reservoir_size': 183, 'spectral_radius': 1.0383334285483223, 'ar_lags': 4, 'foundation_window': 9, 'regressor_type': 'ElasticNet', 'reg_alpha': 9.060024395430512, 'aci_step_size': 0.026175091148275487, 'oob_split_ratio': 0.6433332821445257}. Best is trial 25 with value: 0.030603792302848206.\n",
      "[I 2026-07-02 14:58:08,452] Trial 61 finished with value: 0.03370015535437848 and parameters: {'reservoir_size': 5, 'spectral_radius': 1.0971099794687205, 'ar_lags': 2, 'foundation_window': 9, 'regressor_type': 'ElasticNet', 'reg_alpha': 2.8120327666329747, 'aci_step_size': 0.11058817055623382, 'oob_split_ratio': 0.6636748422383844}. Best is trial 25 with value: 0.030603792302848206.\n",
      "[I 2026-07-02 14:58:08,571] Trial 62 finished with value: 0.03182364872455495 and parameters: {'reservoir_size': 24, 'spectral_radius': 1.2379799710544022, 'ar_lags': 2, 'foundation_window': 9, 'regressor_type': 'ElasticNet', 'reg_alpha': 4.945306946544496, 'aci_step_size': 0.14666330103077874, 'oob_split_ratio': 0.6528663115985975}. Best is trial 25 with value: 0.030603792302848206.\n",
      "[I 2026-07-02 14:58:08,654] Trial 63 finished with value: 0.03468157031752848 and parameters: {'reservoir_size': 5, 'spectral_radius': 0.9413006154633283, 'ar_lags': 2, 'foundation_window': 8, 'regressor_type': 'ElasticNet', 'reg_alpha': 1.2510332884155033, 'aci_step_size': 0.13418531935748443, 'oob_split_ratio': 0.6238139572761289}. Best is trial 25 with value: 0.030603792302848206.\n",
      "[I 2026-07-02 14:58:08,729] Trial 64 finished with value: 0.03370015535437848 and parameters: {'reservoir_size': 40, 'spectral_radius': 1.0720472240644714, 'ar_lags': 2, 'foundation_window': 9, 'regressor_type': 'ElasticNet', 'reg_alpha': 2.181319501799115, 'aci_step_size': 0.12532466325480068, 'oob_split_ratio': 0.6722478166043995}. Best is trial 25 with value: 0.030603792302848206.\n",
      "[I 2026-07-02 14:58:08,827] Trial 65 finished with value: 0.033260638057796374 and parameters: {'reservoir_size': 34, 'spectral_radius': 0.530888596443565, 'ar_lags': 3, 'foundation_window': 4, 'regressor_type': 'Ridge', 'reg_alpha': 1.2634855445381679, 'aci_step_size': 0.09917770418430656, 'oob_split_ratio': 0.6404926784497944}. Best is trial 25 with value: 0.030603792302848206.\n",
      "[I 2026-07-02 14:58:08,933] Trial 66 finished with value: 0.03173162813123632 and parameters: {'reservoir_size': 29, 'spectral_radius': 1.120827260318466, 'ar_lags': 2, 'foundation_window': 8, 'regressor_type': 'ElasticNet', 'reg_alpha': 0.5153967479366371, 'aci_step_size': 0.11597228458929763, 'oob_split_ratio': 0.6327963861761827}. Best is trial 25 with value: 0.030603792302848206.\n",
      "[I 2026-07-02 14:58:09,051] Trial 67 finished with value: 0.03205595389356406 and parameters: {'reservoir_size': 29, 'spectral_radius': 1.1193011308879242, 'ar_lags': 3, 'foundation_window': 7, 'regressor_type': 'ElasticNet', 'reg_alpha': 0.3565493839015595, 'aci_step_size': 0.09410581533337999, 'oob_split_ratio': 0.632899394252589}. Best is trial 25 with value: 0.030603792302848206.\n",
      "[I 2026-07-02 14:58:09,131] Trial 68 finished with value: 0.03468157031752848 and parameters: {'reservoir_size': 52, 'spectral_radius': 1.4866651460047122, 'ar_lags': 2, 'foundation_window': 8, 'regressor_type': 'Lasso', 'reg_alpha': 0.566332307225539, 'aci_step_size': 0.15765967499942896, 'oob_split_ratio': 0.6186955091531118}. Best is trial 25 with value: 0.030603792302848206.\n",
      "[I 2026-07-02 14:58:09,206] Trial 69 finished with value: 0.037447291343008504 and parameters: {'reservoir_size': 45, 'spectral_radius': 0.8196814429855342, 'ar_lags': 3, 'foundation_window': 3, 'regressor_type': 'ElasticNet', 'reg_alpha': 0.8732273292380137, 'aci_step_size': 0.117274795776882, 'oob_split_ratio': 0.6068588911690445}. Best is trial 25 with value: 0.030603792302848206.\n",
      "[I 2026-07-02 14:58:09,314] Trial 70 finished with value: 0.0318907572417577 and parameters: {'reservoir_size': 63, 'spectral_radius': 0.898900501809439, 'ar_lags': 2, 'foundation_window': 8, 'regressor_type': 'ElasticNet', 'reg_alpha': 0.21188458073493616, 'aci_step_size': 0.14097615033701094, 'oob_split_ratio': 0.6316973945529076}. Best is trial 25 with value: 0.030603792302848206.\n",
      "[I 2026-07-02 14:58:09,402] Trial 71 finished with value: 0.03173162813123632 and parameters: {'reservoir_size': 21, 'spectral_radius': 1.1865062691070027, 'ar_lags': 2, 'foundation_window': 8, 'regressor_type': 'ElasticNet', 'reg_alpha': 1.703920475241752, 'aci_step_size': 0.11504519453593778, 'oob_split_ratio': 0.6575952462777308}. Best is trial 25 with value: 0.030603792302848206.\n",
      "[I 2026-07-02 14:58:09,490] Trial 72 finished with value: 0.03362018279788542 and parameters: {'reservoir_size': 18, 'spectral_radius': 1.211714610894624, 'ar_lags': 2, 'foundation_window': 8, 'regressor_type': 'ElasticNet', 'reg_alpha': 1.7466768590841981, 'aci_step_size': 0.10573384436449967, 'oob_split_ratio': 0.6611030931742502}. Best is trial 25 with value: 0.030603792302848206.\n",
      "[I 2026-07-02 14:58:09,582] Trial 73 finished with value: 0.03173162813123632 and parameters: {'reservoir_size': 24, 'spectral_radius': 1.2422315093253664, 'ar_lags': 2, 'foundation_window': 8, 'regressor_type': 'ElasticNet', 'reg_alpha': 0.504935230291747, 'aci_step_size': 0.1255087444337924, 'oob_split_ratio': 0.6485245122934428}. Best is trial 25 with value: 0.030603792302848206.\n",
      "[I 2026-07-02 14:58:09,679] Trial 74 finished with value: 0.03362018279788542 and parameters: {'reservoir_size': 22, 'spectral_radius': 1.3039342133234233, 'ar_lags': 2, 'foundation_window': 8, 'regressor_type': 'ElasticNet', 'reg_alpha': 0.43561574632080513, 'aci_step_size': 0.1258591025622076, 'oob_split_ratio': 0.830481171912169}. Best is trial 25 with value: 0.030603792302848206.\n",
      "[I 2026-07-02 14:58:09,760] Trial 75 finished with value: 0.03172609857959734 and parameters: {'reservoir_size': 31, 'spectral_radius': 1.411732503990291, 'ar_lags': 2, 'foundation_window': 8, 'regressor_type': 'ElasticNet', 'reg_alpha': 0.31440424423725344, 'aci_step_size': 0.15125453148679693, 'oob_split_ratio': 0.6485134950519936}. Best is trial 25 with value: 0.030603792302848206.\n",
      "[I 2026-07-02 14:58:09,837] Trial 76 finished with value: 0.032611678372851165 and parameters: {'reservoir_size': 31, 'spectral_radius': 1.422728006021619, 'ar_lags': 2, 'foundation_window': 7, 'regressor_type': 'ElasticNet', 'reg_alpha': 0.3051173076653039, 'aci_step_size': 0.14763633185125508, 'oob_split_ratio': 0.6536992391812388}. Best is trial 25 with value: 0.030603792302848206.\n",
      "[I 2026-07-02 14:58:09,899] Trial 77 finished with value: 0.03362018279788542 and parameters: {'reservoir_size': 39, 'spectral_radius': 1.387392023454984, 'ar_lags': 2, 'foundation_window': 8, 'regressor_type': 'ElasticNet', 'reg_alpha': 0.5095011318572059, 'aci_step_size': 0.1715373128663011, 'oob_split_ratio': 0.6729306514786677}. Best is trial 25 with value: 0.030603792302848206.\n",
      "[I 2026-07-02 14:58:09,980] Trial 78 finished with value: 0.03173162813123632 and parameters: {'reservoir_size': 46, 'spectral_radius': 1.2571992155764529, 'ar_lags': 2, 'foundation_window': 8, 'regressor_type': 'ElasticNet', 'reg_alpha': 0.37520801376248836, 'aci_step_size': 0.13708288797791573, 'oob_split_ratio': 0.6408004708454949}. Best is trial 25 with value: 0.030603792302848206.\n",
      "[I 2026-07-02 14:58:10,082] Trial 79 finished with value: 0.03314956904322786 and parameters: {'reservoir_size': 47, 'spectral_radius': 1.3354500852450912, 'ar_lags': 2, 'foundation_window': 7, 'regressor_type': 'ElasticNet', 'reg_alpha': 0.12803814451033177, 'aci_step_size': 0.15299757689599833, 'oob_split_ratio': 0.6583651051527922}. Best is trial 25 with value: 0.030603792302848206.\n",
      "[I 2026-07-02 14:58:10,156] Trial 80 finished with value: 0.03129946088304678 and parameters: {'reservoir_size': 67, 'spectral_radius': 1.2517571287676141, 'ar_lags': 2, 'foundation_window': 8, 'regressor_type': 'Ridge', 'reg_alpha': 0.23927369467580295, 'aci_step_size': 0.13714613048647242, 'oob_split_ratio': 0.6672822343530416}. Best is trial 25 with value: 0.030603792302848206.\n",
      "[I 2026-07-02 14:58:10,266] Trial 81 finished with value: 0.035371523784698246 and parameters: {'reservoir_size': 70, 'spectral_radius': 1.2609451910431997, 'ar_lags': 2, 'foundation_window': 8, 'regressor_type': 'Ridge', 'reg_alpha': 0.34641307611779965, 'aci_step_size': 0.13625302214883747, 'oob_split_ratio': 0.6671119609386584}. Best is trial 25 with value: 0.030603792302848206.\n",
      "[I 2026-07-02 14:58:10,371] Trial 82 finished with value: 0.041671649046097235 and parameters: {'reservoir_size': 60, 'spectral_radius': 1.1986110548789972, 'ar_lags': 2, 'foundation_window': 8, 'regressor_type': 'Ridge', 'reg_alpha': 0.2356629249520308, 'aci_step_size': 0.13113234570543292, 'oob_split_ratio': 0.6987137443851638}. Best is trial 25 with value: 0.030603792302848206.\n",
      "[I 2026-07-02 14:58:10,485] Trial 83 finished with value: 0.03434181041605989 and parameters: {'reservoir_size': 56, 'spectral_radius': 1.280662839639947, 'ar_lags': 2, 'foundation_window': 8, 'regressor_type': 'Ridge', 'reg_alpha': 0.38695985259038695, 'aci_step_size': 0.14401383827651518, 'oob_split_ratio': 0.6469576713996303}. Best is trial 25 with value: 0.030603792302848206.\n",
      "[I 2026-07-02 14:58:10,585] Trial 84 finished with value: 0.04992706393726179 and parameters: {'reservoir_size': 77, 'spectral_radius': 1.1607366530768823, 'ar_lags': 2, 'foundation_window': 8, 'regressor_type': 'Ridge', 'reg_alpha': 0.30102315936195523, 'aci_step_size': 0.1221541098071644, 'oob_split_ratio': 0.6858086514545678}. Best is trial 25 with value: 0.030603792302848206.\n",
      "[I 2026-07-02 14:58:10,695] Trial 85 finished with value: 0.03452167086536773 and parameters: {'reservoir_size': 14, 'spectral_radius': 1.2417189150825223, 'ar_lags': 2, 'foundation_window': 7, 'regressor_type': 'Ridge', 'reg_alpha': 0.16927416777323898, 'aci_step_size': 0.15835573001142164, 'oob_split_ratio': 0.6379478644823393}. Best is trial 25 with value: 0.030603792302848206.\n",
      "[I 2026-07-02 14:58:10,784] Trial 86 finished with value: 0.03173162813123632 and parameters: {'reservoir_size': 42, 'spectral_radius': 1.3540238923378503, 'ar_lags': 2, 'foundation_window': 8, 'regressor_type': 'ElasticNet', 'reg_alpha': 0.6266784653073602, 'aci_step_size': 0.15121291961802108, 'oob_split_ratio': 0.6494101493329444}. Best is trial 25 with value: 0.030603792302848206.\n",
      "[I 2026-07-02 14:58:10,880] Trial 87 finished with value: 0.03362018279788542 and parameters: {'reservoir_size': 42, 'spectral_radius': 1.3468303431539015, 'ar_lags': 2, 'foundation_window': 8, 'regressor_type': 'ElasticNet', 'reg_alpha': 0.5128612655401452, 'aci_step_size': 0.1390247785783984, 'oob_split_ratio': 0.6760293269293897}. Best is trial 25 with value: 0.030603792302848206.\n",
      "[I 2026-07-02 14:58:10,963] Trial 88 finished with value: 0.03173162813123632 and parameters: {'reservoir_size': 52, 'spectral_radius': 1.4363675454283997, 'ar_lags': 2, 'foundation_window': 8, 'regressor_type': 'ElasticNet', 'reg_alpha': 0.6466052685796353, 'aci_step_size': 0.15138733636240187, 'oob_split_ratio': 0.6566251066002474}. Best is trial 25 with value: 0.030603792302848206.\n",
      "[I 2026-07-02 14:58:11,059] Trial 89 finished with value: 0.03362018279788542 and parameters: {'reservoir_size': 38, 'spectral_radius': 1.397236976761365, 'ar_lags': 2, 'foundation_window': 8, 'regressor_type': 'Lasso', 'reg_alpha': 0.25041446691482144, 'aci_step_size': 0.16452306795928495, 'oob_split_ratio': 0.6653902334462721}. Best is trial 25 with value: 0.030603792302848206.\n",
      "[I 2026-07-02 14:58:11,155] Trial 90 finished with value: 0.03380650861582784 and parameters: {'reservoir_size': 32, 'spectral_radius': 1.3098791685465514, 'ar_lags': 2, 'foundation_window': 7, 'regressor_type': 'ElasticNet', 'reg_alpha': 0.7951250971125681, 'aci_step_size': 0.1291389376750902, 'oob_split_ratio': 0.6294293334197548}. Best is trial 25 with value: 0.030603792302848206.\n",
      "[I 2026-07-02 14:58:11,260] Trial 91 finished with value: 0.03173162813123632 and parameters: {'reservoir_size': 51, 'spectral_radius': 1.4453303337316563, 'ar_lags': 2, 'foundation_window': 8, 'regressor_type': 'ElasticNet', 'reg_alpha': 0.4516150685296395, 'aci_step_size': 0.1511757338778368, 'oob_split_ratio': 0.6577375059544308}. Best is trial 25 with value: 0.030603792302848206.\n",
      "[I 2026-07-02 14:58:11,369] Trial 92 finished with value: 0.03173162813123632 and parameters: {'reservoir_size': 67, 'spectral_radius': 1.3542102255914972, 'ar_lags': 2, 'foundation_window': 8, 'regressor_type': 'ElasticNet', 'reg_alpha': 0.6686274945493276, 'aci_step_size': 0.15053823320112683, 'oob_split_ratio': 0.648325646303716}. Best is trial 25 with value: 0.030603792302848206.\n",
      "[I 2026-07-02 14:58:11,493] Trial 93 finished with value: 0.03173162813123632 and parameters: {'reservoir_size': 59, 'spectral_radius': 1.4677778271236477, 'ar_lags': 2, 'foundation_window': 8, 'regressor_type': 'ElasticNet', 'reg_alpha': 0.6509484401171232, 'aci_step_size': 0.17356627309606779, 'oob_split_ratio': 0.6399925367111591}. Best is trial 25 with value: 0.030603792302848206.\n",
      "[I 2026-07-02 14:58:11,601] Trial 94 finished with value: 0.03173162813123632 and parameters: {'reservoir_size': 45, 'spectral_radius': 1.1934143703472846, 'ar_lags': 2, 'foundation_window': 8, 'regressor_type': 'ElasticNet', 'reg_alpha': 0.5899043829916615, 'aci_step_size': 0.13549979846484525, 'oob_split_ratio': 0.6526984831711266}. Best is trial 25 with value: 0.030603792302848206.\n",
      "[I 2026-07-02 14:58:11,687] Trial 95 finished with value: 0.03468157031752848 and parameters: {'reservoir_size': 26, 'spectral_radius': 1.237207010196383, 'ar_lags': 2, 'foundation_window': 8, 'regressor_type': 'ElasticNet', 'reg_alpha': 0.8827426868513829, 'aci_step_size': 0.1609288357002901, 'oob_split_ratio': 0.6219951208953914}. Best is trial 25 with value: 0.030603792302848206.\n",
      "[I 2026-07-02 14:58:11,753] Trial 96 finished with value: 0.03362018279788542 and parameters: {'reservoir_size': 54, 'spectral_radius': 1.4087551274159011, 'ar_lags': 2, 'foundation_window': 8, 'regressor_type': 'ElasticNet', 'reg_alpha': 0.5018531291288164, 'aci_step_size': 0.1413152537456042, 'oob_split_ratio': 0.6706094590552389}. Best is trial 25 with value: 0.030603792302848206.\n",
      "[I 2026-07-02 14:58:11,848] Trial 97 finished with value: 0.03312002779063366 and parameters: {'reservoir_size': 35, 'spectral_radius': 1.28151906804287, 'ar_lags': 2, 'foundation_window': 7, 'regressor_type': 'ElasticNet', 'reg_alpha': 0.3057966170164349, 'aci_step_size': 0.1445620277389309, 'oob_split_ratio': 0.6911888764894555}. Best is trial 25 with value: 0.030603792302848206.\n",
      "[I 2026-07-02 14:58:11,946] Trial 98 finished with value: 0.03672185812815425 and parameters: {'reservoir_size': 16, 'spectral_radius': 1.1233972016003682, 'ar_lags': 2, 'foundation_window': 8, 'regressor_type': 'Ridge', 'reg_alpha': 1.1088152524931112, 'aci_step_size': 0.15508197288716788, 'oob_split_ratio': 0.657247711233084}. Best is trial 25 with value: 0.030603792302848206.\n",
      "[I 2026-07-02 14:58:12,069] Trial 99 finished with value: 0.03143828070903589 and parameters: {'reservoir_size': 10, 'spectral_radius': 1.3707598546025601, 'ar_lags': 2, 'foundation_window': 9, 'regressor_type': 'ElasticNet', 'reg_alpha': 0.19202200076872417, 'aci_step_size': 0.18666442621160995, 'oob_split_ratio': 0.6464730192631147}. Best is trial 25 with value: 0.030603792302848206.\n",
      "[I 2026-07-02 14:58:12,182] Trial 100 finished with value: 0.03517806544218625 and parameters: {'reservoir_size': 11, 'spectral_radius': 1.3322375821669656, 'ar_lags': 5, 'foundation_window': 9, 'regressor_type': 'ElasticNet', 'reg_alpha': 0.20766694218540105, 'aci_step_size': 0.11143952862338108, 'oob_split_ratio': 0.637958556522153}. Best is trial 25 with value: 0.030603792302848206.\n",
      "[I 2026-07-02 14:58:12,304] Trial 101 finished with value: 0.031355608441631454 and parameters: {'reservoir_size': 23, 'spectral_radius': 1.4318813921804525, 'ar_lags': 2, 'foundation_window': 9, 'regressor_type': 'ElasticNet', 'reg_alpha': 0.3901697243868186, 'aci_step_size': 0.18956956093424654, 'oob_split_ratio': 0.6457181085792342}. Best is trial 25 with value: 0.030603792302848206.\n",
      "[I 2026-07-02 14:58:12,425] Trial 102 finished with value: 0.03182364872455495 and parameters: {'reservoir_size': 22, 'spectral_radius': 1.374188887501451, 'ar_lags': 2, 'foundation_window': 9, 'regressor_type': 'ElasticNet', 'reg_alpha': 0.3906240178751733, 'aci_step_size': 0.1850047407110914, 'oob_split_ratio': 0.6449345853645642}. Best is trial 25 with value: 0.030603792302848206.\n",
      "[I 2026-07-02 14:58:12,529] Trial 103 finished with value: 0.032924852875635006 and parameters: {'reservoir_size': 2, 'spectral_radius': 1.3673681279432002, 'ar_lags': 2, 'foundation_window': 9, 'regressor_type': 'ElasticNet', 'reg_alpha': 0.13432656284076203, 'aci_step_size': 0.19969377337876637, 'oob_split_ratio': 0.6485745713987209}. Best is trial 25 with value: 0.030603792302848206.\n",
      "[I 2026-07-02 14:58:12,601] Trial 104 finished with value: 0.034354995154774685 and parameters: {'reservoir_size': 8, 'spectral_radius': 1.4949307416105144, 'ar_lags': 2, 'foundation_window': 9, 'regressor_type': 'ElasticNet', 'reg_alpha': 0.1847065471417023, 'aci_step_size': 0.19150912988118438, 'oob_split_ratio': 0.6291413873893672}. Best is trial 25 with value: 0.030603792302848206.\n",
      "[I 2026-07-02 14:58:12,726] Trial 105 finished with value: 0.031510057838643746 and parameters: {'reservoir_size': 29, 'spectral_radius': 1.2944800871827626, 'ar_lags': 2, 'foundation_window': 9, 'regressor_type': 'ElasticNet', 'reg_alpha': 0.23052865166542427, 'aci_step_size': 0.18739495240311357, 'oob_split_ratio': 0.6409500635029091}. Best is trial 25 with value: 0.030603792302848206.\n",
      "[I 2026-07-02 14:58:12,810] Trial 106 finished with value: 0.033863524047772764 and parameters: {'reservoir_size': 26, 'spectral_radius': 1.2645715980948444, 'ar_lags': 2, 'foundation_window': 9, 'regressor_type': 'ElasticNet', 'reg_alpha': 0.27596525952412204, 'aci_step_size': 0.18110509844577102, 'oob_split_ratio': 0.6621183406069271}. Best is trial 25 with value: 0.030603792302848206.\n",
      "[I 2026-07-02 14:58:12,943] Trial 107 finished with value: 0.03169872422704383 and parameters: {'reservoir_size': 29, 'spectral_radius': 1.2970985403862758, 'ar_lags': 2, 'foundation_window': 9, 'regressor_type': 'ElasticNet', 'reg_alpha': 0.2338007102392607, 'aci_step_size': 0.19568810369229425, 'oob_split_ratio': 0.6411690074600289}. Best is trial 25 with value: 0.030603792302848206.\n",
      "[I 2026-07-02 14:58:13,064] Trial 108 finished with value: 0.03182364872455495 and parameters: {'reservoir_size': 19, 'spectral_radius': 1.3206578671888758, 'ar_lags': 2, 'foundation_window': 9, 'regressor_type': 'Lasso', 'reg_alpha': 0.13379950707990595, 'aci_step_size': 0.18668542582687386, 'oob_split_ratio': 0.6343005361102232}. Best is trial 25 with value: 0.030603792302848206.\n",
      "[I 2026-07-02 14:58:13,162] Trial 109 finished with value: 0.03511973828016355 and parameters: {'reservoir_size': 31, 'spectral_radius': 1.3023682346390855, 'ar_lags': 2, 'foundation_window': 9, 'regressor_type': 'ElasticNet', 'reg_alpha': 0.23368865100420447, 'aci_step_size': 0.18725023348122377, 'oob_split_ratio': 0.6158783834589623}. Best is trial 25 with value: 0.030603792302848206.\n",
