      "[I 2026-07-02 16:30:48,833] Trial 55 finished with value: 0.01340826369738967 and parameters: {'reservoir_size': 87, 'spectral_radius': 0.8346672816281505, 'ar_lags': 7, 'foundation_window': 22, 'regressor_type': 'ElasticNet', 'reg_alpha': 3.337530333417894, 'aci_step_size': 0.1635971948782361, 'oob_split_ratio': 0.8271899766943832}. Best is trial 14 with value: 0.007971290538447036.\n",
      "[I 2026-07-02 16:30:49,018] Trial 56 finished with value: 0.059702672202667374 and parameters: {'reservoir_size': 128, 'spectral_radius': 0.6944729533518976, 'ar_lags': 4, 'foundation_window': 23, 'regressor_type': 'Ridge', 'reg_alpha': 0.9227369246092134, 'aci_step_size': 0.17657144718847922, 'oob_split_ratio': 0.764858420079795}. Best is trial 14 with value: 0.007971290538447036.\n",
      "[I 2026-07-02 16:30:49,139] Trial 57 finished with value: 0.007974682932279906 and parameters: {'reservoir_size': 141, 'spectral_radius': 0.7468069827306086, 'ar_lags': 10, 'foundation_window': 24, 'regressor_type': 'ElasticNet', 'reg_alpha': 16.806118245550145, 'aci_step_size': 0.1368002559051072, 'oob_split_ratio': 0.7230877316127325}. Best is trial 14 with value: 0.007971290538447036.\n",
      "[I 2026-07-02 16:30:49,254] Trial 58 finished with value: 0.020095829389718444 and parameters: {'reservoir_size': 98, 'spectral_radius': 0.9271872388581585, 'ar_lags': 6, 'foundation_window': 20, 'regressor_type': 'Lasso', 'reg_alpha': 0.2610831409139577, 'aci_step_size': 0.16541564199432912, 'oob_split_ratio': 0.7484443624810089}. Best is trial 14 with value: 0.007971290538447036.\n",
      "[I 2026-07-02 16:30:49,351] Trial 59 finished with value: 0.011064623264694234 and parameters: {'reservoir_size': 13, 'spectral_radius': 0.9913981652736719, 'ar_lags': 11, 'foundation_window': 23, 'regressor_type': 'ElasticNet', 'reg_alpha': 37.723329414923704, 'aci_step_size': 0.15579625400382352, 'oob_split_ratio': 0.7424481981158837}. Best is trial 14 with value: 0.007971290538447036.\n",
      "[I 2026-07-02 16:30:49,449] Trial 60 finished with value: 0.014614941854468192 and parameters: {'reservoir_size': 44, 'spectral_radius': 1.224676320957731, 'ar_lags': 8, 'foundation_window': 21, 'regressor_type': 'ElasticNet', 'reg_alpha': 24.288276434545534, 'aci_step_size': 0.14308386742867613, 'oob_split_ratio': 0.7916781862598059}. Best is trial 14 with value: 0.007971290538447036.\n",
      "[I 2026-07-02 16:30:49,532] Trial 61 finished with value: 0.007972075343551802 and parameters: {'reservoir_size': 83, 'spectral_radius': 0.8707835866768684, 'ar_lags': 7, 'foundation_window': 24, 'regressor_type': 'ElasticNet', 'reg_alpha': 1.2384568862110465, 'aci_step_size': 0.16088599402938558, 'oob_split_ratio': 0.7569731454576171}. Best is trial 14 with value: 0.007971290538447036.\n",
      "[I 2026-07-02 16:30:49,638] Trial 62 finished with value: 0.00797530910740536 and parameters: {'reservoir_size': 91, 'spectral_radius': 0.8481265658049474, 'ar_lags': 5, 'foundation_window': 24, 'regressor_type': 'ElasticNet', 'reg_alpha': 0.8237928886353115, 'aci_step_size': 0.18319745303605015, 'oob_split_ratio': 0.6090905526038778}. Best is trial 14 with value: 0.007971290538447036.\n",
      "[I 2026-07-02 16:30:49,718] Trial 63 finished with value: 0.01106439149059847 and parameters: {'reservoir_size': 81, 'spectral_radius': 0.8036639251637653, 'ar_lags': 7, 'foundation_window': 23, 'regressor_type': 'ElasticNet', 'reg_alpha': 1.7783903495270998, 'aci_step_size': 0.15014991318357707, 'oob_split_ratio': 0.7542927437661755}. Best is trial 14 with value: 0.007971290538447036.\n",
      "[I 2026-07-02 16:30:49,950] Trial 64 finished with value: 0.015211465005865073 and parameters: {'reservoir_size': 108, 'spectral_radius': 0.8904100361183823, 'ar_lags': 6, 'foundation_window': 22, 'regressor_type': 'ElasticNet', 'reg_alpha': 0.6129762533072518, 'aci_step_size': 0.15734657681630973, 'oob_split_ratio': 0.7301927314787073}. Best is trial 14 with value: 0.007971290538447036.\n",
      "[I 2026-07-02 16:30:50,050] Trial 65 finished with value: 0.007972360275768335 and parameters: {'reservoir_size': 60, 'spectral_radius': 0.7859491610616783, 'ar_lags': 9, 'foundation_window': 24, 'regressor_type': 'ElasticNet', 'reg_alpha': 2.6529580333541163, 'aci_step_size': 0.19149969399978595, 'oob_split_ratio': 0.7721126062268269}. Best is trial 14 with value: 0.007971290538447036.\n",
      "[I 2026-07-02 16:30:50,171] Trial 66 finished with value: 0.011064785952975463 and parameters: {'reservoir_size': 76, 'spectral_radius': 0.7356995097419672, 'ar_lags': 7, 'foundation_window': 23, 'regressor_type': 'ElasticNet', 'reg_alpha': 49.80566356602799, 'aci_step_size': 0.17711031835893726, 'oob_split_ratio': 0.763396177458975}. Best is trial 14 with value: 0.007971290538447036.\n",
      "[I 2026-07-02 16:30:50,341] Trial 67 finished with value: 0.05960835485752242 and parameters: {'reservoir_size': 101, 'spectral_radius': 0.8921288516569109, 'ar_lags': 5, 'foundation_window': 12, 'regressor_type': 'Ridge', 'reg_alpha': 10.704919333964448, 'aci_step_size': 0.16870819387406816, 'oob_split_ratio': 0.7519662346759776}. Best is trial 14 with value: 0.007971290538447036.\n",
      "[I 2026-07-02 16:30:50,449] Trial 68 finished with value: 0.007975026210144688 and parameters: {'reservoir_size': 68, 'spectral_radius': 1.4866651460047122, 'ar_lags': 4, 'foundation_window': 24, 'regressor_type': 'ElasticNet', 'reg_alpha': 1.43298970903334, 'aci_step_size': 0.13925147590903758, 'oob_split_ratio': 0.7146750519409043}. Best is trial 14 with value: 0.007971290538447036.\n",
      "[I 2026-07-02 16:30:50,525] Trial 69 finished with value: 0.014641241813436985 and parameters: {'reservoir_size': 87, 'spectral_radius': 0.8319917031701775, 'ar_lags': 6, 'foundation_window': 21, 'regressor_type': 'ElasticNet', 'reg_alpha': 35.64271211407912, 'aci_step_size': 0.14794983003603943, 'oob_split_ratio': 0.7401298784044602}. Best is trial 14 with value: 0.007971290538447036.\n",
      "[I 2026-07-02 16:30:50,620] Trial 70 finished with value: 0.013404087633347278 and parameters: {'reservoir_size': 97, 'spectral_radius': 0.967905589367576, 'ar_lags': 8, 'foundation_window': 22, 'regressor_type': 'Lasso', 'reg_alpha': 7.128316347586582, 'aci_step_size': 0.1280230531528143, 'oob_split_ratio': 0.7846849425776484}. Best is trial 14 with value: 0.007971290538447036.\n",
      "[I 2026-07-02 16:30:50,726] Trial 71 finished with value: 0.007972075343551802 and parameters: {'reservoir_size': 83, 'spectral_radius': 0.8729063416416579, 'ar_lags': 7, 'foundation_window': 24, 'regressor_type': 'ElasticNet', 'reg_alpha': 1.2226603081378238, 'aci_step_size': 0.16082030826853358, 'oob_split_ratio': 0.758659720954796}. Best is trial 14 with value: 0.007971290538447036.\n",
      "[I 2026-07-02 16:30:50,831] Trial 72 finished with value: 0.011065046351481233 and parameters: {'reservoir_size': 82, 'spectral_radius': 0.8128930093024024, 'ar_lags': 6, 'foundation_window': 23, 'regressor_type': 'ElasticNet', 'reg_alpha': 1.2049808224527543, 'aci_step_size': 0.16243941268152678, 'oob_split_ratio': 0.7579657527118443}. Best is trial 14 with value: 0.007971290538447036.\n",
      "[I 2026-07-02 16:30:50,973] Trial 73 finished with value: 0.007973087026223648 and parameters: {'reservoir_size': 93, 'spectral_radius': 0.7587716649359063, 'ar_lags': 7, 'foundation_window': 24, 'regressor_type': 'ElasticNet', 'reg_alpha': 26.697272694388452, 'aci_step_size': 0.1530413921611567, 'oob_split_ratio': 0.7697342391520703}. Best is trial 14 with value: 0.007971290538447036.\n",
      "[I 2026-07-02 16:30:51,164] Trial 74 finished with value: 0.011065342754238448 and parameters: {'reservoir_size': 117, 'spectral_radius': 0.8634189877944538, 'ar_lags': 5, 'foundation_window': 23, 'regressor_type': 'ElasticNet', 'reg_alpha': 4.32811660456178, 'aci_step_size': 0.17344136194715715, 'oob_split_ratio': 0.7489865867558542}. Best is trial 14 with value: 0.007971290538447036.\n",
      "[I 2026-07-02 16:30:51,265] Trial 75 finished with value: 0.007971607880975428 and parameters: {'reservoir_size': 71, 'spectral_radius': 0.8921506095448576, 'ar_lags': 8, 'foundation_window': 24, 'regressor_type': 'ElasticNet', 'reg_alpha': 0.9135144447068715, 'aci_step_size': 0.16733619812731138, 'oob_split_ratio': 0.7759228130467305}. Best is trial 14 with value: 0.007971290538447036.\n",
      "[I 2026-07-02 16:30:51,337] Trial 76 finished with value: 0.01628577163602041 and parameters: {'reservoir_size': 70, 'spectral_radius': 0.9125966390303392, 'ar_lags': 8, 'foundation_window': 22, 'regressor_type': 'ElasticNet', 'reg_alpha': 0.5303399348229515, 'aci_step_size': 0.16864913112227145, 'oob_split_ratio': 0.7290941041860296}. Best is trial 14 with value: 0.007971290538447036.\n",
      "[I 2026-07-02 16:30:51,412] Trial 77 finished with value: 0.007973156902322304 and parameters: {'reservoir_size': 55, 'spectral_radius': 1.0126349124857401, 'ar_lags': 9, 'foundation_window': 24, 'regressor_type': 'ElasticNet', 'reg_alpha': 0.8212904515007615, 'aci_step_size': 0.1854502696197249, 'oob_split_ratio': 0.7779347285985594}. Best is trial 14 with value: 0.007971290538447036.\n",
      "[I 2026-07-02 16:30:51,635] Trial 78 finished with value: 0.013407089548966473 and parameters: {'reservoir_size': 200, 'spectral_radius': 0.9478263692325789, 'ar_lags': 8, 'foundation_window': 22, 'regressor_type': 'ElasticNet', 'reg_alpha': 1.6627619765194896, 'aci_step_size': 0.1795207861933608, 'oob_split_ratio': 0.7657949561277658}. Best is trial 14 with value: 0.007971290538447036.\n",
      "[I 2026-07-02 16:30:51,786] Trial 79 finished with value: 0.011067357094944547 and parameters: {'reservoir_size': 182, 'spectral_radius': 1.1000276713440886, 'ar_lags': 5, 'foundation_window': 23, 'regressor_type': 'ElasticNet', 'reg_alpha': 2.2693886070911997, 'aci_step_size': 0.13335431650689142, 'oob_split_ratio': 0.7388787677041136}. Best is trial 14 with value: 0.007971290538447036.\n",
      "[I 2026-07-02 16:30:51,900] Trial 80 finished with value: 0.06611330826898289 and parameters: {'reservoir_size': 78, 'spectral_radius': 0.670620291184147, 'ar_lags': 8, 'foundation_window': 21, 'regressor_type': 'Ridge', 'reg_alpha': 0.96904483947215, 'aci_step_size': 0.14365107048520206, 'oob_split_ratio': 0.7737548875069243}. Best is trial 14 with value: 0.007971290538447036.\n",
      "[I 2026-07-02 16:30:52,007] Trial 81 finished with value: 0.007972075343551802 and parameters: {'reservoir_size': 87, 'spectral_radius': 0.8446572769466207, 'ar_lags': 7, 'foundation_window': 24, 'regressor_type': 'ElasticNet', 'reg_alpha': 1.2690496687640187, 'aci_step_size': 0.16202169175850553, 'oob_split_ratio': 0.7585168977443187}. Best is trial 14 with value: 0.007971290538447036.\n",
      "[I 2026-07-02 16:30:52,101] Trial 82 finished with value: 0.007974534039733605 and parameters: {'reservoir_size': 62, 'spectral_radius': 0.8879033859723718, 'ar_lags': 7, 'foundation_window': 24, 'regressor_type': 'ElasticNet', 'reg_alpha': 0.7670578777310397, 'aci_step_size': 0.15954476909597254, 'oob_split_ratio': 0.7462524910132436}. Best is trial 14 with value: 0.007971290538447036.\n",
      "[I 2026-07-02 16:30:52,181] Trial 83 finished with value: 0.011065010566970207 and parameters: {'reservoir_size': 76, 'spectral_radius': 0.8029781956012755, 'ar_lags': 6, 'foundation_window': 23, 'regressor_type': 'ElasticNet', 'reg_alpha': 0.6291021659911541, 'aci_step_size': 0.11951612234738505, 'oob_split_ratio': 0.764057626310263}. Best is trial 14 with value: 0.007971290538447036.\n",
      "[I 2026-07-02 16:30:52,288] Trial 84 finished with value: 0.007973730776644676 and parameters: {'reservoir_size': 101, 'spectral_radius': 0.7665826577169162, 'ar_lags': 9, 'foundation_window': 24, 'regressor_type': 'ElasticNet', 'reg_alpha': 1.9550264818267422, 'aci_step_size': 0.15485513047056526, 'oob_split_ratio': 0.7935676813764603}. Best is trial 14 with value: 0.007971290538447036.\n",
      "[I 2026-07-02 16:30:52,386] Trial 85 finished with value: 0.011061937474388335 and parameters: {'reservoir_size': 90, 'spectral_radius': 0.9192098344578874, 'ar_lags': 7, 'foundation_window': 23, 'regressor_type': 'ElasticNet', 'reg_alpha': 34.0696967936875, 'aci_step_size': 0.17042146856467963, 'oob_split_ratio': 0.7331365971180477}. Best is trial 14 with value: 0.007971290538447036.\n",
      "[I 2026-07-02 16:30:52,484] Trial 86 finished with value: 0.013407195793434258 and parameters: {'reservoir_size': 71, 'spectral_radius': 0.7136286198851619, 'ar_lags': 6, 'foundation_window': 22, 'regressor_type': 'ElasticNet', 'reg_alpha': 1.498207677855918, 'aci_step_size': 0.1486147508180457, 'oob_split_ratio': 0.7539847012005563}. Best is trial 14 with value: 0.007971290538447036.\n",
      "[I 2026-07-02 16:30:52,586] Trial 87 finished with value: 0.00797264295099304 and parameters: {'reservoir_size': 83, 'spectral_radius': 0.8346574602942313, 'ar_lags': 8, 'foundation_window': 24, 'regressor_type': 'ElasticNet', 'reg_alpha': 3.08766786447363, 'aci_step_size': 0.1664710229509227, 'oob_split_ratio': 0.7854064333344667}. Best is trial 14 with value: 0.007971290538447036.\n",
      "[I 2026-07-02 16:30:52,690] Trial 88 finished with value: 0.01106332769299176 and parameters: {'reservoir_size': 110, 'spectral_radius': 0.7858665676570022, 'ar_lags': 5, 'foundation_window': 23, 'regressor_type': 'Lasso', 'reg_alpha': 42.9487761294903, 'aci_step_size': 0.19425609156603582, 'oob_split_ratio': 0.7444494954449801}. Best is trial 14 with value: 0.007971290538447036.\n",
      "[I 2026-07-02 16:30:52,875] Trial 89 finished with value: 0.007973194503979394 and parameters: {'reservoir_size': 152, 'spectral_radius': 1.4309482890268557, 'ar_lags': 6, 'foundation_window': 24, 'regressor_type': 'ElasticNet', 'reg_alpha': 20.872586209698007, 'aci_step_size': 0.18833781472213137, 'oob_split_ratio': 0.8025932796154278}. Best is trial 14 with value: 0.007971290538447036.\n",
      "[I 2026-07-02 16:30:52,968] Trial 90 finished with value: 0.01106497056334102 and parameters: {'reservoir_size': 50, 'spectral_radius': 0.8721041973063081, 'ar_lags': 8, 'foundation_window': 23, 'regressor_type': 'ElasticNet', 'reg_alpha': 1.1413070568286963, 'aci_step_size': 0.17356598596207168, 'oob_split_ratio': 0.7790697298329715}. Best is trial 14 with value: 0.007971290538447036.\n",
      "[I 2026-07-02 16:30:53,071] Trial 91 finished with value: 0.007972075343551802 and parameters: {'reservoir_size': 84, 'spectral_radius': 0.8827394757617677, 'ar_lags': 7, 'foundation_window': 24, 'regressor_type': 'ElasticNet', 'reg_alpha': 1.2851513232895668, 'aci_step_size': 0.161470710405388, 'oob_split_ratio': 0.7592586410162462}. Best is trial 14 with value: 0.007971290538447036.\n",
      "[I 2026-07-02 16:30:53,170] Trial 92 finished with value: 0.04043599176130698 and parameters: {'reservoir_size': 78, 'spectral_radius': 0.8547377263363247, 'ar_lags': 7, 'foundation_window': 5, 'regressor_type': 'ElasticNet', 'reg_alpha': 1.7905815084220686, 'aci_step_size': 0.15706322507737303, 'oob_split_ratio': 0.7556114737238813}. Best is trial 14 with value: 0.007971290538447036.\n",
      "[I 2026-07-02 16:30:53,325] Trial 93 finished with value: 0.007972273937014393 and parameters: {'reservoir_size': 93, 'spectral_radius': 0.9078456467264043, 'ar_lags': 7, 'foundation_window': 24, 'regressor_type': 'ElasticNet', 'reg_alpha': 0.9086088651059054, 'aci_step_size': 0.18034683842268878, 'oob_split_ratio': 0.7622381867370255}. Best is trial 14 with value: 0.007971290538447036.\n",
      "[I 2026-07-02 16:30:53,426] Trial 94 finished with value: 0.013407195793434258 and parameters: {'reservoir_size': 68, 'spectral_radius': 0.940900351808663, 'ar_lags': 6, 'foundation_window': 22, 'regressor_type': 'ElasticNet', 'reg_alpha': 1.2927827070814923, 'aci_step_size': 0.15139297408506264, 'oob_split_ratio': 0.7484286425178354}. Best is trial 14 with value: 0.007971290538447036.\n",
      "[I 2026-07-02 16:30:53,527] Trial 95 finished with value: 0.00797334343471393 and parameters: {'reservoir_size': 87, 'spectral_radius': 0.810213965246152, 'ar_lags': 8, 'foundation_window': 24, 'regressor_type': 'ElasticNet', 'reg_alpha': 1.0834587180368382, 'aci_step_size': 0.16389192628273738, 'oob_split_ratio': 0.7391251887288451}. Best is trial 14 with value: 0.007971290538447036.\n",
      "[I 2026-07-02 16:30:53,602] Trial 96 finished with value: 0.011052109916011764 and parameters: {'reservoir_size': 74, 'spectral_radius': 0.8681932127812295, 'ar_lags': 5, 'foundation_window': 23, 'regressor_type': 'ElasticNet', 'reg_alpha': 0.7170308761229968, 'aci_step_size': 0.17530586680826704, 'oob_split_ratio': 0.7249970062745272}. Best is trial 14 with value: 0.007971290538447036.\n",
      "[I 2026-07-02 16:30:53,700] Trial 97 finished with value: 0.011066345560906873 and parameters: {'reservoir_size': 57, 'spectral_radius': 0.825202976009311, 'ar_lags': 4, 'foundation_window': 23, 'regressor_type': 'ElasticNet', 'reg_alpha': 2.134908008749051, 'aci_step_size': 0.14069826457445106, 'oob_split_ratio': 0.7736663065614527}. Best is trial 14 with value: 0.007971290538447036.\n",
      "[I 2026-07-02 16:30:53,908] Trial 98 finished with value: 0.00818813858171595 and parameters: {'reservoir_size': 104, 'spectral_radius': 0.9671760506150373, 'ar_lags': 9, 'foundation_window': 24, 'regressor_type': 'ElasticNet', 'reg_alpha': 2.8459604528540092, 'aci_step_size': 0.1600925087292629, 'oob_split_ratio': 0.6332499627344719}. Best is trial 14 with value: 0.007971290538447036.\n",
      "[I 2026-07-02 16:30:54,036] Trial 99 finished with value: 0.06009580251394143 and parameters: {'reservoir_size': 97, 'spectral_radius': 0.7561955578170193, 'ar_lags': 7, 'foundation_window': 23, 'regressor_type': 'Ridge', 'reg_alpha': 1.5354503651864895, 'aci_step_size': 0.16704531635113704, 'oob_split_ratio': 0.7673137840745758}. Best is trial 14 with value: 0.007971290538447036.\n",
      "[I 2026-07-02 16:30:54,141] Trial 100 finished with value: 0.014643138554515303 and parameters: {'reservoir_size': 80, 'spectral_radius': 0.7885422379432689, 'ar_lags': 10, 'foundation_window': 21, 'regressor_type': 'ElasticNet', 'reg_alpha': 3.907250082020501, 'aci_step_size': 0.15478755881867634, 'oob_split_ratio': 0.7529827361279967}. Best is trial 14 with value: 0.007971290538447036.\n",
      "[I 2026-07-02 16:30:54,248] Trial 101 finished with value: 0.007972075343551802 and parameters: {'reservoir_size': 84, 'spectral_radius': 0.842596042200359, 'ar_lags': 7, 'foundation_window': 24, 'regressor_type': 'ElasticNet', 'reg_alpha': 1.3324872654617141, 'aci_step_size': 0.14733642929772253, 'oob_split_ratio': 0.7578356952153409}. Best is trial 14 with value: 0.007971290538447036.\n",
      "[I 2026-07-02 16:30:54,353] Trial 102 finished with value: 0.007972075343551802 and parameters: {'reservoir_size': 89, 'spectral_radius': 0.8484985378039618, 'ar_lags': 7, 'foundation_window': 24, 'regressor_type': 'ElasticNet', 'reg_alpha': 0.940327653693817, 'aci_step_size': 0.1606749736500775, 'oob_split_ratio': 0.7604857090474665}. Best is trial 14 with value: 0.007971290538447036.\n",
      "[I 2026-07-02 16:30:54,452] Trial 103 finished with value: 0.007974534039733605 and parameters: {'reservoir_size': 73, 'spectral_radius': 0.8955571072564359, 'ar_lags': 7, 'foundation_window': 24, 'regressor_type': 'ElasticNet', 'reg_alpha': 26.291685114142414, 'aci_step_size': 0.16432180859284246, 'oob_split_ratio': 0.7447533432974387}. Best is trial 14 with value: 0.007971290538447036.\n",
      "[I 2026-07-02 16:30:54,533] Trial 104 finished with value: 0.014476758478317496 and parameters: {'reservoir_size': 65, 'spectral_radius': 0.7296946308740053, 'ar_lags': 6, 'foundation_window': 22, 'regressor_type': 'ElasticNet', 'reg_alpha': 0.5169998637003702, 'aci_step_size': 0.1706175493765936, 'oob_split_ratio': 0.7351798189058459}. Best is trial 14 with value: 0.007971290538447036.\n",
      "[I 2026-07-02 16:30:54,699] Trial 105 finished with value: 0.01106439149059847 and parameters: {'reservoir_size': 135, 'spectral_radius': 0.8190100916156934, 'ar_lags': 7, 'foundation_window': 23, 'regressor_type': 'ElasticNet', 'reg_alpha': 1.1920041850381393, 'aci_step_size': 0.18093923558544958, 'oob_split_ratio': 0.7495713761168689}. Best is trial 14 with value: 0.007971290538447036.\n",
      "[I 2026-07-02 16:30:54,811] Trial 106 finished with value: 0.007974787514788327 and parameters: {'reservoir_size': 95, 'spectral_radius': 0.9218600605266917, 'ar_lags': 5, 'foundation_window': 24, 'regressor_type': 'ElasticNet', 'reg_alpha': 1.919243181700988, 'aci_step_size': 0.1582524841692398, 'oob_split_ratio': 0.7692688486325325}. Best is trial 14 with value: 0.007971290538447036.\n",
      "[I 2026-07-02 16:30:54,942] Trial 107 finished with value: 0.01106497056334102 and parameters: {'reservoir_size': 101, 'spectral_radius': 0.8685721057804658, 'ar_lags': 8, 'foundation_window': 23, 'regressor_type': 'Lasso', 'reg_alpha': 33.25190124032873, 'aci_step_size': 0.1519610060845874, 'oob_split_ratio': 0.776228811002278}. Best is trial 14 with value: 0.007971290538447036.\n",
      "[I 2026-07-02 16:30:55,048] Trial 108 finished with value: 0.007973850378754985 and parameters: {'reservoir_size': 86, 'spectral_radius': 0.8379616885007347, 'ar_lags': 4, 'foundation_window': 24, 'regressor_type': 'ElasticNet', 'reg_alpha': 1.0565949172524445, 'aci_step_size': 0.1772861014034061, 'oob_split_ratio': 0.7572843570030647}. Best is trial 14 with value: 0.007971290538447036.\n",
      "[I 2026-07-02 16:30:55,166] Trial 109 finished with value: 0.013403475467902277 and parameters: {'reservoir_size': 114, 'spectral_radius': 0.7990561329336764, 'ar_lags': 6, 'foundation_window': 22, 'regressor_type': 'ElasticNet', 'reg_alpha': 44.2960259922405, 'aci_step_size': 0.1323008294013807, 'oob_split_ratio': 0.6024246673876477}. Best is trial 14 with value: 0.007971290538447036.\n",
