      "[I 2026-07-02 14:59:13,893] Trial 157 finished with value: 0.025815870343110683 and parameters: {'foundation_window': 3, 'ar_lags': 2, 'ema_spans': (3, 6, 12), 'conv_scales': (2, 4, 8), 'use_calendar': False, 'ridge_alpha': 75.16952637962679, 'shrinkage_max': 2.517416048977096, 'oob_split_ratio': 0.5585534973339219}. Best is trial 156 with value: 0.02580772552258814.\n",
      "[I 2026-07-02 14:59:14,064] Trial 158 finished with value: 0.027890067397345633 and parameters: {'foundation_window': 3, 'ar_lags': 2, 'ema_spans': (3, 6, 12), 'conv_scales': (2, 3, 4), 'use_calendar': False, 'ridge_alpha': 72.34433471315123, 'shrinkage_max': 2.4864939938553343, 'oob_split_ratio': 0.5583756520887418}. Best is trial 156 with value: 0.02580772552258814.\n",
      "[I 2026-07-02 14:59:14,245] Trial 159 finished with value: 0.04220932704343405 and parameters: {'foundation_window': 4, 'ar_lags': 2, 'ema_spans': (3, 6, 12), 'conv_scales': (2, 4, 8), 'use_calendar': False, 'ridge_alpha': 78.73653813591656, 'shrinkage_max': 2.514860953968746, 'oob_split_ratio': 0.5646564320715352}. Best is trial 156 with value: 0.02580772552258814.\n",
      "[I 2026-07-02 14:59:14,426] Trial 160 finished with value: 0.029244310319511357 and parameters: {'foundation_window': 2, 'ar_lags': 2, 'ema_spans': (3, 6, 12), 'conv_scales': (2, 4, 8), 'use_calendar': False, 'ridge_alpha': 97.67490557477214, 'shrinkage_max': 2.3967604142258603, 'oob_split_ratio': 0.5719180111850309}. Best is trial 156 with value: 0.02580772552258814.\n",
      "[I 2026-07-02 14:59:14,599] Trial 161 finished with value: 0.02582841510145094 and parameters: {'foundation_window': 3, 'ar_lags': 2, 'ema_spans': (3, 6, 12), 'conv_scales': (2, 4, 8), 'use_calendar': False, 'ridge_alpha': 61.48461503528834, 'shrinkage_max': 2.55647759085587, 'oob_split_ratio': 0.5577842856561017}. Best is trial 156 with value: 0.02580772552258814.\n",
      "[I 2026-07-02 14:59:14,774] Trial 162 finished with value: 0.026078788966734295 and parameters: {'foundation_window': 3, 'ar_lags': 2, 'ema_spans': (3, 6, 12), 'conv_scales': (2, 4, 8), 'use_calendar': False, 'ridge_alpha': 64.31130796162141, 'shrinkage_max': 2.6001198870312288, 'oob_split_ratio': 0.5506628415879026}. Best is trial 156 with value: 0.02580772552258814.\n",
      "[I 2026-07-02 14:59:14,968] Trial 163 finished with value: 0.025838952615326524 and parameters: {'foundation_window': 3, 'ar_lags': 2, 'ema_spans': (3, 6, 12), 'conv_scales': (2, 4, 8), 'use_calendar': False, 'ridge_alpha': 66.54818849119586, 'shrinkage_max': 2.5541398654782763, 'oob_split_ratio': 0.5529375270933566}. Best is trial 156 with value: 0.02580772552258814.\n",
      "[I 2026-07-02 14:59:15,140] Trial 164 finished with value: 0.0264338666718289 and parameters: {'foundation_window': 3, 'ar_lags': 2, 'ema_spans': (3, 6, 12), 'conv_scales': (2, 4, 8), 'use_calendar': False, 'ridge_alpha': 64.87548874430455, 'shrinkage_max': 2.5468318606996396, 'oob_split_ratio': 0.5504355231359607}. Best is trial 156 with value: 0.02580772552258814.\n",
      "[I 2026-07-02 14:59:15,319] Trial 165 finished with value: 0.02585296053239532 and parameters: {'foundation_window': 3, 'ar_lags': 2, 'ema_spans': (3, 6, 12), 'conv_scales': (2, 4, 8), 'use_calendar': False, 'ridge_alpha': 55.58800171619941, 'shrinkage_max': 2.658807986883853, 'oob_split_ratio': 0.5660529701641662}. Best is trial 156 with value: 0.02580772552258814.\n",
      "[I 2026-07-02 14:59:15,465] Trial 166 finished with value: 0.027796839937448203 and parameters: {'foundation_window': 3, 'ar_lags': 2, 'ema_spans': (3, 6, 12), 'conv_scales': (3, 6), 'use_calendar': False, 'ridge_alpha': 51.228767521404464, 'shrinkage_max': 2.673833320303047, 'oob_split_ratio': 0.5665571119575276}. Best is trial 156 with value: 0.02580772552258814.\n",
      "[I 2026-07-02 14:59:15,630] Trial 167 finished with value: 0.02580089279815653 and parameters: {'foundation_window': 3, 'ar_lags': 2, 'ema_spans': (3, 6, 12), 'conv_scales': (2, 4, 8), 'use_calendar': False, 'ridge_alpha': 59.191468195465816, 'shrinkage_max': 2.41746586529249, 'oob_split_ratio': 0.5602124234380548}. Best is trial 167 with value: 0.02580089279815653.\n",
      "[I 2026-07-02 14:59:15,802] Trial 168 finished with value: 0.025821689938008475 and parameters: {'foundation_window': 3, 'ar_lags': 2, 'ema_spans': (3, 6, 12), 'conv_scales': (2, 4, 8), 'use_calendar': False, 'ridge_alpha': 80.2572284224054, 'shrinkage_max': 2.339209050177342, 'oob_split_ratio': 0.5765064537721406}. Best is trial 167 with value: 0.02580089279815653.\n",
      "[I 2026-07-02 14:59:15,975] Trial 169 finished with value: 0.026515123841036117 and parameters: {'foundation_window': 3, 'ar_lags': 2, 'ema_spans': (3, 6, 12), 'conv_scales': (3, 6, 12), 'use_calendar': False, 'ridge_alpha': 96.10925854688188, 'shrinkage_max': 2.2978388844262523, 'oob_split_ratio': 0.5599641539162714}. Best is trial 167 with value: 0.02580089279815653.\n",
      "[I 2026-07-02 14:59:16,143] Trial 170 finished with value: 0.050564555844219476 and parameters: {'foundation_window': 4, 'ar_lags': 2, 'ema_spans': (3, 6, 12), 'conv_scales': (2, 4, 8), 'use_calendar': False, 'ridge_alpha': 75.15875821395716, 'shrinkage_max': 2.4037552136211993, 'oob_split_ratio': 0.5890189792543225}. Best is trial 167 with value: 0.02580089279815653.\n",
      "[I 2026-07-02 14:59:16,313] Trial 171 finished with value: 0.02582255641647295 and parameters: {'foundation_window': 3, 'ar_lags': 2, 'ema_spans': (3, 6, 12), 'conv_scales': (2, 4, 8), 'use_calendar': False, 'ridge_alpha': 58.76062848945678, 'shrinkage_max': 2.32910084107172, 'oob_split_ratio': 0.5756227146269463}. Best is trial 167 with value: 0.02580089279815653.\n",
      "[I 2026-07-02 14:59:16,476] Trial 172 finished with value: 0.025844304651167885 and parameters: {'foundation_window': 3, 'ar_lags': 2, 'ema_spans': (3, 6, 12), 'conv_scales': (2, 4, 8), 'use_calendar': False, 'ridge_alpha': 65.85583056162963, 'shrinkage_max': 2.293194516046808, 'oob_split_ratio': 0.5679330931247762}. Best is trial 167 with value: 0.02580089279815653.\n",
      "[I 2026-07-02 14:59:16,637] Trial 173 finished with value: 0.025827962742791918 and parameters: {'foundation_window': 3, 'ar_lags': 2, 'ema_spans': (3, 6, 12), 'conv_scales': (2, 4, 8), 'use_calendar': False, 'ridge_alpha': 78.93992934128556, 'shrinkage_max': 2.2973375148338637, 'oob_split_ratio': 0.568455229027442}. Best is trial 167 with value: 0.02580089279815653.\n",
      "[I 2026-07-02 14:59:16,798] Trial 174 finished with value: 0.025839452591273866 and parameters: {'foundation_window': 3, 'ar_lags': 2, 'ema_spans': (3, 6, 12), 'conv_scales': (2, 4, 8), 'use_calendar': False, 'ridge_alpha': 99.85866991387128, 'shrinkage_max': 2.2926813998142874, 'oob_split_ratio': 0.5686696209995498}. Best is trial 167 with value: 0.02580089279815653.\n",
      "[I 2026-07-02 14:59:16,959] Trial 175 finished with value: 0.02578611359440366 and parameters: {'foundation_window': 3, 'ar_lags': 2, 'ema_spans': (3, 6, 12), 'conv_scales': (2, 4, 8), 'use_calendar': False, 'ridge_alpha': 80.12131389259095, 'shrinkage_max': 2.2862228582725095, 'oob_split_ratio': 0.5694281674689501}. Best is trial 175 with value: 0.02578611359440366.\n",
      "[I 2026-07-02 14:59:17,123] Trial 176 finished with value: 0.025827766484282574 and parameters: {'foundation_window': 3, 'ar_lags': 2, 'ema_spans': (3, 6, 12), 'conv_scales': (2, 4, 8), 'use_calendar': False, 'ridge_alpha': 83.05178420988757, 'shrinkage_max': 2.1634863793537806, 'oob_split_ratio': 0.5711741609740418}. Best is trial 175 with value: 0.02578611359440366.\n",
      "[I 2026-07-02 14:59:17,286] Trial 177 finished with value: 0.030775438933472076 and parameters: {'foundation_window': 3, 'ar_lags': 2, 'ema_spans': (2, 4, 8), 'conv_scales': (2, 4, 8), 'use_calendar': False, 'ridge_alpha': 75.07320215963544, 'shrinkage_max': 2.4622366875956305, 'oob_split_ratio': 0.5567220386542152}. Best is trial 175 with value: 0.02578611359440366.\n",
      "[I 2026-07-02 14:59:17,453] Trial 178 finished with value: 0.029122686154703956 and parameters: {'foundation_window': 2, 'ar_lags': 2, 'ema_spans': (3, 6, 12), 'conv_scales': (2, 4, 8), 'use_calendar': False, 'ridge_alpha': 85.0735657414629, 'shrinkage_max': 2.2149194491636592, 'oob_split_ratio': 0.571858536888036}. Best is trial 175 with value: 0.02578611359440366.\n",
      "[I 2026-07-02 14:59:17,619] Trial 179 finished with value: 0.02580955670838893 and parameters: {'foundation_window': 3, 'ar_lags': 2, 'ema_spans': (3, 6, 12), 'conv_scales': (2, 4, 8), 'use_calendar': False, 'ridge_alpha': 81.61054336835461, 'shrinkage_max': 2.2170699266896166, 'oob_split_ratio': 0.5625350538612355}. Best is trial 175 with value: 0.02578611359440366.\n",
      "[I 2026-07-02 14:59:17,786] Trial 180 finished with value: 0.041709622249297994 and parameters: {'foundation_window': 4, 'ar_lags': 2, 'ema_spans': (3, 6, 12), 'conv_scales': (2, 4, 8), 'use_calendar': False, 'ridge_alpha': 84.15936201958596, 'shrinkage_max': 2.1372867927257597, 'oob_split_ratio': 0.5758374915221127}. Best is trial 175 with value: 0.02578611359440366.\n",
      "[I 2026-07-02 14:59:17,952] Trial 181 finished with value: 0.025802809948460556 and parameters: {'foundation_window': 3, 'ar_lags': 2, 'ema_spans': (3, 6, 12), 'conv_scales': (2, 4, 8), 'use_calendar': False, 'ridge_alpha': 73.79783714039891, 'shrinkage_max': 2.3425424417321277, 'oob_split_ratio': 0.5612295764499949}. Best is trial 175 with value: 0.02578611359440366.\n",
      "[I 2026-07-02 14:59:18,122] Trial 182 finished with value: 0.02581746290850769 and parameters: {'foundation_window': 3, 'ar_lags': 2, 'ema_spans': (3, 6, 12), 'conv_scales': (2, 4, 8), 'use_calendar': False, 'ridge_alpha': 78.44365480773084, 'shrinkage_max': 2.3362759246750437, 'oob_split_ratio': 0.5633945619463426}. Best is trial 175 with value: 0.02578611359440366.\n",
      "[I 2026-07-02 14:59:18,291] Trial 183 finished with value: 0.025811041860458475 and parameters: {'foundation_window': 3, 'ar_lags': 2, 'ema_spans': (3, 6, 12), 'conv_scales': (2, 4, 8), 'use_calendar': False, 'ridge_alpha': 79.26690697792935, 'shrinkage_max': 2.3700558784119274, 'oob_split_ratio': 0.5610909177695628}. Best is trial 175 with value: 0.02578611359440366.\n",
      "[I 2026-07-02 14:59:18,452] Trial 184 finished with value: 0.02582562615276548 and parameters: {'foundation_window': 3, 'ar_lags': 2, 'ema_spans': (3, 6, 12), 'conv_scales': (2, 4, 8), 'use_calendar': False, 'ridge_alpha': 82.08170023351892, 'shrinkage_max': 2.342170403809985, 'oob_split_ratio': 0.5649204161816014}. Best is trial 175 with value: 0.02578611359440366.\n",
      "[I 2026-07-02 14:59:18,621] Trial 185 finished with value: 0.025819107391731672 and parameters: {'foundation_window': 3, 'ar_lags': 2, 'ema_spans': (3, 6, 12), 'conv_scales': (2, 4, 8), 'use_calendar': False, 'ridge_alpha': 97.80626823348716, 'shrinkage_max': 2.3575109882218284, 'oob_split_ratio': 0.564873485809421}. Best is trial 175 with value: 0.02578611359440366.\n",
      "[I 2026-07-02 14:59:18,770] Trial 186 finished with value: 0.027691542719703584 and parameters: {'foundation_window': 3, 'ar_lags': 2, 'ema_spans': (3, 6, 12), 'conv_scales': (2, 3), 'use_calendar': False, 'ridge_alpha': 98.17063480021339, 'shrinkage_max': 2.3609120574162077, 'oob_split_ratio': 0.5634669949715934}. Best is trial 175 with value: 0.02578611359440366.\n",
      "[I 2026-07-02 14:59:18,935] Trial 187 finished with value: 0.025800347879435043 and parameters: {'foundation_window': 3, 'ar_lags': 2, 'ema_spans': (3, 6, 12), 'conv_scales': (2, 4, 8), 'use_calendar': False, 'ridge_alpha': 81.33889500309203, 'shrinkage_max': 2.2467131112370486, 'oob_split_ratio': 0.5689751205202028}. Best is trial 175 with value: 0.02578611359440366.\n",
      "[I 2026-07-02 14:59:19,099] Trial 188 finished with value: 0.025797276576685457 and parameters: {'foundation_window': 3, 'ar_lags': 2, 'ema_spans': (3, 6, 12), 'conv_scales': (2, 4, 8), 'use_calendar': False, 'ridge_alpha': 78.11852599235051, 'shrinkage_max': 2.2246056704820303, 'oob_split_ratio': 0.5708249134197021}. Best is trial 175 with value: 0.02578611359440366.\n",
      "[I 2026-07-02 14:59:19,266] Trial 189 finished with value: 0.029209756543497584 and parameters: {'foundation_window': 2, 'ar_lags': 2, 'ema_spans': (3, 6, 12), 'conv_scales': (2, 4, 8), 'use_calendar': False, 'ridge_alpha': 97.33227229285235, 'shrinkage_max': 2.3521108254581278, 'oob_split_ratio': 0.5651344262068279}. Best is trial 175 with value: 0.02578611359440366.\n",
      "[I 2026-07-02 14:59:19,425] Trial 190 finished with value: 0.026718856638597216 and parameters: {'foundation_window': 3, 'ar_lags': 2, 'ema_spans': (3, 6), 'conv_scales': (2, 4, 8), 'use_calendar': False, 'ridge_alpha': 77.41354526327137, 'shrinkage_max': 2.2167542430318536, 'oob_split_ratio': 0.5769149001324421}. Best is trial 175 with value: 0.02578611359440366.\n",
      "[I 2026-07-02 14:59:19,599] Trial 191 finished with value: 0.025795293864289387 and parameters: {'foundation_window': 3, 'ar_lags': 2, 'ema_spans': (3, 6, 12), 'conv_scales': (2, 4, 8), 'use_calendar': False, 'ridge_alpha': 78.19403033961578, 'shrinkage_max': 2.2328757515226396, 'oob_split_ratio': 0.5714310782875044}. Best is trial 175 with value: 0.02578611359440366.\n",
      "[I 2026-07-02 14:59:19,767] Trial 192 finished with value: 0.025805938189558477 and parameters: {'foundation_window': 3, 'ar_lags': 2, 'ema_spans': (3, 6, 12), 'conv_scales': (2, 4, 8), 'use_calendar': False, 'ridge_alpha': 98.79348262009755, 'shrinkage_max': 2.2458933154864176, 'oob_split_ratio': 0.5703246792011752}. Best is trial 175 with value: 0.02578611359440366.\n",
      "[I 2026-07-02 14:59:19,938] Trial 193 finished with value: 0.041862563587114494 and parameters: {'foundation_window': 3, 'ar_lags': 2, 'ema_spans': (3, 6, 12), 'conv_scales': (2, 4, 8), 'use_calendar': False, 'ridge_alpha': 74.88463084600896, 'shrinkage_max': 2.239903575485314, 'oob_split_ratio': 0.5820976534609016}. Best is trial 175 with value: 0.02578611359440366.\n",
      "[I 2026-07-02 14:59:20,114] Trial 194 finished with value: 0.025821115351145767 and parameters: {'foundation_window': 3, 'ar_lags': 2, 'ema_spans': (3, 6, 12), 'conv_scales': (2, 4, 8), 'use_calendar': False, 'ridge_alpha': 50.89661079128017, 'shrinkage_max': 2.0958525713044827, 'oob_split_ratio': 0.5709581880688763}. Best is trial 175 with value: 0.02578611359440366.\n",
      "[I 2026-07-02 14:59:20,287] Trial 195 finished with value: 0.02580566006641691 and parameters: {'foundation_window': 3, 'ar_lags': 2, 'ema_spans': (3, 6, 12), 'conv_scales': (2, 4, 8), 'use_calendar': False, 'ridge_alpha': 99.0405915602372, 'shrinkage_max': 2.099637438903636, 'oob_split_ratio': 0.5710232278397579}. Best is trial 175 with value: 0.02578611359440366.\n",
      "[I 2026-07-02 14:59:20,472] Trial 196 finished with value: 0.025901462392339026 and parameters: {'foundation_window': 3, 'ar_lags': 2, 'ema_spans': (3, 6, 12), 'conv_scales': (2, 4, 8), 'use_calendar': False, 'ridge_alpha': 99.51880391908796, 'shrinkage_max': 2.0331946474901295, 'oob_split_ratio': 0.5706552016781955}. Best is trial 175 with value: 0.02578611359440366.\n",
      "[I 2026-07-02 14:59:20,646] Trial 197 finished with value: 0.04829620228869249 and parameters: {'foundation_window': 3, 'ar_lags': 2, 'ema_spans': (3, 6, 12), 'conv_scales': (2, 4, 8), 'use_calendar': False, 'ridge_alpha': 48.59931484954306, 'shrinkage_max': 2.031011558867843, 'oob_split_ratio': 0.5798610073746081}. Best is trial 175 with value: 0.02578611359440366.\n",
      "[I 2026-07-02 14:59:20,820] Trial 198 finished with value: 0.025802286270728655 and parameters: {'foundation_window': 3, 'ar_lags': 2, 'ema_spans': (3, 6, 12), 'conv_scales': (2, 4, 8), 'use_calendar': False, 'ridge_alpha': 98.60314090999219, 'shrinkage_max': 2.1071199281129926, 'oob_split_ratio': 0.5704357699635367}. Best is trial 175 with value: 0.02578611359440366.\n",
      "[I 2026-07-02 14:59:20,994] Trial 199 finished with value: 0.028776184623209095 and parameters: {'foundation_window': 3, 'ar_lags': 2, 'ema_spans': (3, 6, 12), 'conv_scales': (2, 3, 4), 'use_calendar': False, 'ridge_alpha': 50.09630535878454, 'shrinkage_max': 2.085303395409087, 'oob_split_ratio': 0.5688530812202891}. Best is trial 175 with value: 0.02578611359440366.\n",
      "[I 2026-07-02 14:59:21,158] Trial 200 finished with value: 0.04540876515382267 and parameters: {'foundation_window': 4, 'ar_lags': 2, 'ema_spans': (2, 4), 'conv_scales': (2, 4, 8), 'use_calendar': False, 'ridge_alpha': 97.29974464775086, 'shrinkage_max': 2.438549099617326, 'oob_split_ratio': 0.5558932537459365}. Best is trial 175 with value: 0.02578611359440366.\n",
      "[I 2026-07-02 14:59:21,334] Trial 201 finished with value: 0.04162532014573461 and parameters: {'foundation_window': 3, 'ar_lags': 2, 'ema_spans': (3, 6, 12), 'conv_scales': (2, 4, 8), 'use_calendar': False, 'ridge_alpha': 70.11619454042004, 'shrinkage_max': 1.97277467902427, 'oob_split_ratio': 0.5879034834919801}. Best is trial 175 with value: 0.02578611359440366.\n",
      "[I 2026-07-02 14:59:21,519] Trial 202 finished with value: 0.025807691933427995 and parameters: {'foundation_window': 3, 'ar_lags': 2, 'ema_spans': (3, 6, 12), 'conv_scales': (2, 4, 8), 'use_calendar': False, 'ridge_alpha': 99.00521352209746, 'shrinkage_max': 2.2418602350934687, 'oob_split_ratio': 0.5716044570247275}. Best is trial 175 with value: 0.02578611359440366.\n",
      "[I 2026-07-02 14:59:21,707] Trial 203 finished with value: 0.025800313071647166 and parameters: {'foundation_window': 3, 'ar_lags': 2, 'ema_spans': (3, 6, 12), 'conv_scales': (2, 4, 8), 'use_calendar': False, 'ridge_alpha': 97.37170885124075, 'shrinkage_max': 2.2517425232804493, 'oob_split_ratio': 0.5715071243319583}. Best is trial 175 with value: 0.02578611359440366.\n",
      "[I 2026-07-02 14:59:21,877] Trial 204 finished with value: 0.025817550801521108 and parameters: {'foundation_window': 3, 'ar_lags': 2, 'ema_spans': (3, 6, 12), 'conv_scales': (2, 4, 8), 'use_calendar': False, 'ridge_alpha': 69.85179391999556, 'shrinkage_max': 2.247708627847243, 'oob_split_ratio': 0.5630467494660789}. Best is trial 175 with value: 0.02578611359440366.\n",
      "[I 2026-07-02 14:59:22,038] Trial 205 finished with value: 0.025800358565175374 and parameters: {'foundation_window': 3, 'ar_lags': 2, 'ema_spans': (3, 6, 12), 'conv_scales': (2, 4, 8), 'use_calendar': False, 'ridge_alpha': 97.80772994265418, 'shrinkage_max': 2.2562836093467697, 'oob_split_ratio': 0.5639660257045934}. Best is trial 175 with value: 0.02578611359440366.\n",
      "[I 2026-07-02 14:59:22,203] Trial 206 finished with value: 0.025810483719359317 and parameters: {'foundation_window': 3, 'ar_lags': 2, 'ema_spans': (3, 6, 12), 'conv_scales': (2, 4, 8), 'use_calendar': False, 'ridge_alpha': 67.61903436202381, 'shrinkage_max': 2.2530169704968532, 'oob_split_ratio': 0.5578414663084116}. Best is trial 175 with value: 0.02578611359440366.\n",
      "[I 2026-07-02 14:59:22,358] Trial 207 finished with value: 0.026970560467784666 and parameters: {'foundation_window': 3, 'ar_lags': 2, 'ema_spans': (3, 6, 12), 'conv_scales': (3, 6), 'use_calendar': False, 'ridge_alpha': 96.32083738574828, 'shrinkage_max': 2.1921987704565864, 'oob_split_ratio': 0.5566473701656639}. Best is trial 175 with value: 0.02578611359440366.\n",
      "[I 2026-07-02 14:59:22,529] Trial 208 finished with value: 0.03126351162248136 and parameters: {'foundation_window': 3, 'ar_lags': 2, 'ema_spans': (2, 4, 8), 'conv_scales': (2, 4, 8), 'use_calendar': False, 'ridge_alpha': 65.40079441229024, 'shrinkage_max': 2.2457206980482396, 'oob_split_ratio': 0.5603844142354051}. Best is trial 175 with value: 0.02578611359440366.\n",
      "[I 2026-07-02 14:59:22,697] Trial 209 finished with value: 0.02582724586505382 and parameters: {'foundation_window': 3, 'ar_lags': 2, 'ema_spans': (3, 6, 12), 'conv_scales': (2, 4, 8), 'use_calendar': False, 'ridge_alpha': 79.3891142417371, 'shrinkage_max': 2.1279866411988166, 'oob_split_ratio': 0.5670612906308445}. Best is trial 175 with value: 0.02578611359440366.\n",
      "[I 2026-07-02 14:59:22,875] Trial 210 finished with value: 0.026991231903333468 and parameters: {'foundation_window': 3, 'ar_lags': 2, 'ema_spans': (3, 6, 12), 'conv_scales': (3, 6, 12), 'use_calendar': False, 'ridge_alpha': 56.8894178407857, 'shrinkage_max': 2.4203442239613056, 'oob_split_ratio': 0.5551594213963548}. Best is trial 175 with value: 0.02578611359440366.\n",
      "[I 2026-07-02 14:59:23,068] Trial 211 finished with value: 0.0258132682142698 and parameters: {'foundation_window': 3, 'ar_lags': 2, 'ema_spans': (3, 6, 12), 'conv_scales': (2, 4, 8), 'use_calendar': False, 'ridge_alpha': 69.50361704472257, 'shrinkage_max': 2.2605095952774636, 'oob_split_ratio': 0.562904124934741}. Best is trial 175 with value: 0.02578611359440366.\n",
      "[I 2026-07-02 14:59:23,238] Trial 212 finished with value: 0.025810379287876117 and parameters: {'foundation_window': 3, 'ar_lags': 2, 'ema_spans': (3, 6, 12), 'conv_scales': (2, 4, 8), 'use_calendar': False, 'ridge_alpha': 68.53108559313219, 'shrinkage_max': 2.261993236526189, 'oob_split_ratio': 0.5621536323632333}. Best is trial 175 with value: 0.02578611359440366.\n",
      "[I 2026-07-02 14:59:23,411] Trial 213 finished with value: 0.025801776712661706 and parameters: {'foundation_window': 3, 'ar_lags': 2, 'ema_spans': (3, 6, 12), 'conv_scales': (2, 4, 8), 'use_calendar': False, 'ridge_alpha': 98.97191563676036, 'shrinkage_max': 2.2674708024719954, 'oob_split_ratio': 0.5723880645956282}. Best is trial 175 with value: 0.02578611359440366.\n",
