      "[I 2026-07-02 16:32:24,993] Trial 215 finished with value: 0.012667530408137428 and parameters: {'foundation_window': 4, 'ar_lags': 4, 'ema_spans': (2, 4, 8), 'conv_scales': (2, 4, 8), 'use_calendar': True, 'ridge_alpha': 0.2573664231255571, 'shrinkage_max': 0.30775624834591825, 'oob_split_ratio': 0.6280649901438716}. Best is trial 144 with value: 0.009471602415253667.\n",
      "[I 2026-07-02 16:32:25,304] Trial 216 finished with value: 0.020386004554180225 and parameters: {'foundation_window': 4, 'ar_lags': 4, 'ema_spans': (2, 4, 8), 'conv_scales': (2, 4, 8), 'use_calendar': True, 'ridge_alpha': 0.1872527638468328, 'shrinkage_max': 0.45269712331965317, 'oob_split_ratio': 0.6350537035913237}. Best is trial 144 with value: 0.009471602415253667.\n",
      "[I 2026-07-02 16:32:25,616] Trial 217 finished with value: 0.011162991145328498 and parameters: {'foundation_window': 4, 'ar_lags': 4, 'ema_spans': (2, 4, 8), 'conv_scales': (2, 4, 8), 'use_calendar': True, 'ridge_alpha': 0.4179435417864577, 'shrinkage_max': 0.363506958543002, 'oob_split_ratio': 0.6482230870261446}. Best is trial 144 with value: 0.009471602415253667.\n",
      "[I 2026-07-02 16:32:25,930] Trial 218 finished with value: 0.012851899016193375 and parameters: {'foundation_window': 4, 'ar_lags': 4, 'ema_spans': (2, 4, 8), 'conv_scales': (2, 4, 8), 'use_calendar': True, 'ridge_alpha': 0.29280754156259114, 'shrinkage_max': 0.3012688064564759, 'oob_split_ratio': 0.6397529207456659}. Best is trial 144 with value: 0.009471602415253667.\n",
      "[I 2026-07-02 16:32:26,243] Trial 219 finished with value: 0.012339386837234546 and parameters: {'foundation_window': 4, 'ar_lags': 4, 'ema_spans': (2, 4, 8), 'conv_scales': (2, 4, 8), 'use_calendar': True, 'ridge_alpha': 0.22862711801878427, 'shrinkage_max': 0.4013496332391526, 'oob_split_ratio': 0.6449767859147065}. Best is trial 144 with value: 0.009471602415253667.\n",
      "[I 2026-07-02 16:32:26,560] Trial 220 finished with value: 0.010191610056683434 and parameters: {'foundation_window': 4, 'ar_lags': 4, 'ema_spans': (2, 4, 8), 'conv_scales': (2, 4, 8), 'use_calendar': True, 'ridge_alpha': 0.4047129201204292, 'shrinkage_max': 0.3000677037453688, 'oob_split_ratio': 0.6489481492242363}. Best is trial 144 with value: 0.009471602415253667.\n",
      "[I 2026-07-02 16:32:26,887] Trial 221 finished with value: 0.010232077894382437 and parameters: {'foundation_window': 4, 'ar_lags': 4, 'ema_spans': (2, 4, 8), 'conv_scales': (2, 4, 8), 'use_calendar': True, 'ridge_alpha': 0.40981382768322044, 'shrinkage_max': 0.30215161499955584, 'oob_split_ratio': 0.6496943916366452}. Best is trial 144 with value: 0.009471602415253667.\n",
      "[I 2026-07-02 16:32:27,208] Trial 222 finished with value: 0.01015615639300054 and parameters: {'foundation_window': 4, 'ar_lags': 4, 'ema_spans': (2, 4, 8), 'conv_scales': (2, 4, 8), 'use_calendar': True, 'ridge_alpha': 0.41136969632880377, 'shrinkage_max': 0.29664912693960177, 'oob_split_ratio': 0.6512705549530227}. Best is trial 144 with value: 0.009471602415253667.\n",
      "[I 2026-07-02 16:32:27,522] Trial 223 finished with value: 0.011004787762868834 and parameters: {'foundation_window': 4, 'ar_lags': 4, 'ema_spans': (2, 4, 8), 'conv_scales': (2, 4, 8), 'use_calendar': True, 'ridge_alpha': 0.41529459797077267, 'shrinkage_max': 0.3557943669808095, 'oob_split_ratio': 0.6542809833885298}. Best is trial 144 with value: 0.009471602415253667.\n",
      "[I 2026-07-02 16:32:27,839] Trial 224 finished with value: 0.012306342130490387 and parameters: {'foundation_window': 4, 'ar_lags': 4, 'ema_spans': (2, 4, 8), 'conv_scales': (2, 4, 8), 'use_calendar': True, 'ridge_alpha': 0.4105331083579289, 'shrinkage_max': 0.2971902590019622, 'oob_split_ratio': 0.641605310254364}. Best is trial 144 with value: 0.009471602415253667.\n",
      "[I 2026-07-02 16:32:28,148] Trial 225 finished with value: 0.01075734335688776 and parameters: {'foundation_window': 4, 'ar_lags': 4, 'ema_spans': (2, 4, 8), 'conv_scales': (2, 4, 8), 'use_calendar': True, 'ridge_alpha': 0.336703625906862, 'shrinkage_max': 0.3435152748151633, 'oob_split_ratio': 0.6499081097692381}. Best is trial 144 with value: 0.009471602415253667.\n",
      "[I 2026-07-02 16:32:28,459] Trial 226 finished with value: 0.01017223833106016 and parameters: {'foundation_window': 4, 'ar_lags': 4, 'ema_spans': (2, 4, 8), 'conv_scales': (2, 4, 8), 'use_calendar': True, 'ridge_alpha': 0.25079824696391906, 'shrinkage_max': 0.3030982751012307, 'oob_split_ratio': 0.6554113008833725}. Best is trial 144 with value: 0.009471602415253667.\n",
      "[I 2026-07-02 16:32:28,776] Trial 227 finished with value: 0.012760010074980338 and parameters: {'foundation_window': 4, 'ar_lags': 4, 'ema_spans': (2, 4, 8), 'conv_scales': (2, 4, 8), 'use_calendar': True, 'ridge_alpha': 0.24816764946253356, 'shrinkage_max': 0.4209783192389268, 'oob_split_ratio': 0.644281790146458}. Best is trial 144 with value: 0.009471602415253667.\n",
      "[I 2026-07-02 16:32:29,083] Trial 228 finished with value: 0.012390664215102288 and parameters: {'foundation_window': 4, 'ar_lags': 4, 'ema_spans': (3, 6), 'conv_scales': (2, 4, 8), 'use_calendar': True, 'ridge_alpha': 0.15352600772255587, 'shrinkage_max': 0.35774652969252363, 'oob_split_ratio': 0.6493644134836655}. Best is trial 144 with value: 0.009471602415253667.\n",
      "[I 2026-07-02 16:32:29,393] Trial 229 finished with value: 0.01312893640127547 and parameters: {'foundation_window': 4, 'ar_lags': 4, 'ema_spans': (2, 4, 8), 'conv_scales': (2, 4, 8), 'use_calendar': True, 'ridge_alpha': 0.2134098582626486, 'shrinkage_max': 0.29593003970180337, 'oob_split_ratio': 0.6372008791137931}. Best is trial 144 with value: 0.009471602415253667.\n",
      "[I 2026-07-02 16:32:29,708] Trial 230 finished with value: 0.017172337440309514 and parameters: {'foundation_window': 3, 'ar_lags': 4, 'ema_spans': (2, 4, 8), 'conv_scales': (2, 4, 8), 'use_calendar': True, 'ridge_alpha': 0.28470509016331425, 'shrinkage_max': 0.25226587822909585, 'oob_split_ratio': 0.6557662876155392}. Best is trial 144 with value: 0.009471602415253667.\n",
      "[I 2026-07-02 16:32:30,029] Trial 231 finished with value: 0.010163941941446607 and parameters: {'foundation_window': 4, 'ar_lags': 4, 'ema_spans': (2, 4, 8), 'conv_scales': (2, 4, 8), 'use_calendar': True, 'ridge_alpha': 0.3905462981300975, 'shrinkage_max': 0.29770283592942404, 'oob_split_ratio': 0.6544961010952738}. Best is trial 144 with value: 0.009471602415253667.\n",
      "[I 2026-07-02 16:32:30,377] Trial 232 finished with value: 0.010185071501750314 and parameters: {'foundation_window': 4, 'ar_lags': 4, 'ema_spans': (2, 4, 8), 'conv_scales': (2, 4, 8), 'use_calendar': True, 'ridge_alpha': 0.45359659987493167, 'shrinkage_max': 0.2979403962585807, 'oob_split_ratio': 0.6492239444647107}. Best is trial 144 with value: 0.009471602415253667.\n",
      "[I 2026-07-02 16:32:30,700] Trial 233 finished with value: 0.010352985031498787 and parameters: {'foundation_window': 4, 'ar_lags': 4, 'ema_spans': (2, 4, 8), 'conv_scales': (2, 4, 8), 'use_calendar': True, 'ridge_alpha': 0.46534198804446536, 'shrinkage_max': 0.25060627410962083, 'oob_split_ratio': 0.6596058062796538}. Best is trial 144 with value: 0.009471602415253667.\n",
      "[I 2026-07-02 16:32:31,022] Trial 234 finished with value: 0.011066191682347508 and parameters: {'foundation_window': 4, 'ar_lags': 4, 'ema_spans': (2, 4, 8), 'conv_scales': (2, 4, 8), 'use_calendar': True, 'ridge_alpha': 0.44102571652016964, 'shrinkage_max': 0.35915271064176457, 'oob_split_ratio': 0.6505197095279207}. Best is trial 144 with value: 0.009471602415253667.\n",
      "[I 2026-07-02 16:32:31,342] Trial 235 finished with value: 0.010290573213915357 and parameters: {'foundation_window': 4, 'ar_lags': 4, 'ema_spans': (2, 4, 8), 'conv_scales': (2, 4, 8), 'use_calendar': True, 'ridge_alpha': 0.3494166706286376, 'shrinkage_max': 0.30792111798769944, 'oob_split_ratio': 0.6536573991874303}. Best is trial 144 with value: 0.009471602415253667.\n",
      "[I 2026-07-02 16:32:31,657] Trial 236 finished with value: 0.011748643268227861 and parameters: {'foundation_window': 4, 'ar_lags': 4, 'ema_spans': (2, 4, 8), 'conv_scales': (2, 4, 8), 'use_calendar': True, 'ridge_alpha': 0.5281103972091767, 'shrinkage_max': 0.3936930810062734, 'oob_split_ratio': 0.6481527314112943}. Best is trial 144 with value: 0.009471602415253667.\n",
      "[I 2026-07-02 16:32:31,972] Trial 237 finished with value: 0.010815133671278766 and parameters: {'foundation_window': 4, 'ar_lags': 4, 'ema_spans': (2, 4, 8), 'conv_scales': (2, 4, 8), 'use_calendar': True, 'ridge_alpha': 0.2637047174921388, 'shrinkage_max': 0.3017623891589659, 'oob_split_ratio': 0.6595344426558998}. Best is trial 144 with value: 0.009471602415253667.\n",
      "[I 2026-07-02 16:32:32,285] Trial 238 finished with value: 0.01079053686569653 and parameters: {'foundation_window': 4, 'ar_lags': 4, 'ema_spans': (2, 4, 8), 'conv_scales': (2, 4, 8), 'use_calendar': True, 'ridge_alpha': 0.41593892558648793, 'shrinkage_max': 0.34407415109726647, 'oob_split_ratio': 0.653349795450217}. Best is trial 144 with value: 0.009471602415253667.\n",
      "[I 2026-07-02 16:32:32,597] Trial 239 finished with value: 0.010089662908066873 and parameters: {'foundation_window': 4, 'ar_lags': 4, 'ema_spans': (2, 4, 8), 'conv_scales': (2, 4, 8), 'use_calendar': True, 'ridge_alpha': 0.3199484932292418, 'shrinkage_max': 0.25125155823927564, 'oob_split_ratio': 0.648015549044987}. Best is trial 144 with value: 0.009471602415253667.\n",
      "[I 2026-07-02 16:32:32,910] Trial 240 finished with value: 0.015229722960032008 and parameters: {'foundation_window': 5, 'ar_lags': 4, 'ema_spans': (2, 4, 8), 'conv_scales': (2, 4, 8), 'use_calendar': True, 'ridge_alpha': 0.19336870213297172, 'shrinkage_max': 0.2553069212166329, 'oob_split_ratio': 0.6402739645707827}. Best is trial 144 with value: 0.009471602415253667.\n",
      "[I 2026-07-02 16:32:33,220] Trial 241 finished with value: 0.010141791555323429 and parameters: {'foundation_window': 4, 'ar_lags': 4, 'ema_spans': (2, 4, 8), 'conv_scales': (2, 4, 8), 'use_calendar': True, 'ridge_alpha': 0.3512763700108983, 'shrinkage_max': 0.2972213783676025, 'oob_split_ratio': 0.6487142632839079}. Best is trial 144 with value: 0.009471602415253667.\n",
      "[I 2026-07-02 16:32:33,531] Trial 242 finished with value: 0.011687760466389785 and parameters: {'foundation_window': 4, 'ar_lags': 4, 'ema_spans': (2, 4, 8), 'conv_scales': (2, 4, 8), 'use_calendar': True, 'ridge_alpha': 0.03632789219339412, 'shrinkage_max': 0.2978334239120692, 'oob_split_ratio': 0.646081535839565}. Best is trial 144 with value: 0.009471602415253667.\n",
      "[I 2026-07-02 16:32:33,846] Trial 243 finished with value: 0.012001116275117615 and parameters: {'foundation_window': 4, 'ar_lags': 4, 'ema_spans': (2, 4, 8), 'conv_scales': (2, 4, 8), 'use_calendar': True, 'ridge_alpha': 0.31584393322239207, 'shrinkage_max': 0.34720383235079966, 'oob_split_ratio': 0.6571949906072466}. Best is trial 144 with value: 0.009471602415253667.\n",
      "[I 2026-07-02 16:32:34,158] Trial 244 finished with value: 0.00997027828376011 and parameters: {'foundation_window': 4, 'ar_lags': 4, 'ema_spans': (2, 4, 8), 'conv_scales': (2, 4, 8), 'use_calendar': True, 'ridge_alpha': 0.2482216458529725, 'shrinkage_max': 0.25561395897266287, 'oob_split_ratio': 0.6515810915375095}. Best is trial 144 with value: 0.009471602415253667.\n",
      "[I 2026-07-02 16:32:34,467] Trial 245 finished with value: 0.009919027528563879 and parameters: {'foundation_window': 4, 'ar_lags': 4, 'ema_spans': (2, 4, 8), 'conv_scales': (2, 4, 8), 'use_calendar': True, 'ridge_alpha': 0.25447001946557, 'shrinkage_max': 0.26336501443268934, 'oob_split_ratio': 0.6541261824633974}. Best is trial 144 with value: 0.009471602415253667.\n",
      "[I 2026-07-02 16:32:34,784] Trial 246 finished with value: 0.010081665871768111 and parameters: {'foundation_window': 4, 'ar_lags': 4, 'ema_spans': (2, 4, 8), 'conv_scales': (2, 4, 8), 'use_calendar': True, 'ridge_alpha': 0.21712752092224713, 'shrinkage_max': 0.2504648475366826, 'oob_split_ratio': 0.66058272707083}. Best is trial 144 with value: 0.009471602415253667.\n",
      "[I 2026-07-02 16:32:35,095] Trial 247 finished with value: 0.010036505091077945 and parameters: {'foundation_window': 4, 'ar_lags': 4, 'ema_spans': (2, 4, 8), 'conv_scales': (2, 4, 8), 'use_calendar': True, 'ridge_alpha': 0.17081847703357367, 'shrinkage_max': 0.2500200155551731, 'oob_split_ratio': 0.6602724528276938}. Best is trial 144 with value: 0.009471602415253667.\n",
      "[I 2026-07-02 16:32:35,408] Trial 248 finished with value: 0.01003852343669605 and parameters: {'foundation_window': 4, 'ar_lags': 4, 'ema_spans': (2, 4, 8), 'conv_scales': (2, 4, 8), 'use_calendar': True, 'ridge_alpha': 0.15797013029965096, 'shrinkage_max': 0.25144240885867875, 'oob_split_ratio': 0.6618952637941377}. Best is trial 144 with value: 0.009471602415253667.\n",
      "[I 2026-07-02 16:32:35,722] Trial 249 finished with value: 0.010091470904456256 and parameters: {'foundation_window': 4, 'ar_lags': 4, 'ema_spans': (2, 4, 8), 'conv_scales': (2, 4, 8), 'use_calendar': True, 'ridge_alpha': 0.1872972414234897, 'shrinkage_max': 0.25406374647049634, 'oob_split_ratio': 0.6584846277957749}. Best is trial 144 with value: 0.009471602415253667.\n",
      "[I 2026-07-02 16:32:36,041] Trial 250 finished with value: 0.011718162814001017 and parameters: {'foundation_window': 4, 'ar_lags': 4, 'ema_spans': (2, 4, 8), 'conv_scales': (2, 4, 8), 'use_calendar': False, 'ridge_alpha': 0.13968834345668155, 'shrinkage_max': 0.25037089881177454, 'oob_split_ratio': 0.6600035809749003}. Best is trial 144 with value: 0.009471602415253667.\n",
      "[I 2026-07-02 16:32:36,355] Trial 251 finished with value: 0.015453694904554413 and parameters: {'foundation_window': 4, 'ar_lags': 4, 'ema_spans': (2, 4, 8), 'conv_scales': (3, 6, 12), 'use_calendar': True, 'ridge_alpha': 0.17510027754807475, 'shrinkage_max': 0.3670149582207468, 'oob_split_ratio': 0.6588993536997897}. Best is trial 144 with value: 0.009471602415253667.\n",
      "[I 2026-07-02 16:32:36,671] Trial 252 finished with value: 0.010621063700631055 and parameters: {'foundation_window': 4, 'ar_lags': 4, 'ema_spans': (2, 4, 8), 'conv_scales': (2, 4, 8), 'use_calendar': True, 'ridge_alpha': 0.11363422424590335, 'shrinkage_max': 0.25091889655965216, 'oob_split_ratio': 0.6636563706602268}. Best is trial 144 with value: 0.009471602415253667.\n",
      "[I 2026-07-02 16:32:36,993] Trial 253 finished with value: 0.012396621053821742 and parameters: {'foundation_window': 4, 'ar_lags': 4, 'ema_spans': (2, 4, 8), 'conv_scales': (2, 4, 8), 'use_calendar': True, 'ridge_alpha': 0.15805501375868025, 'shrinkage_max': 0.3538162097716086, 'oob_split_ratio': 0.6593907585718344}. Best is trial 144 with value: 0.009471602415253667.\n",
      "[I 2026-07-02 16:32:37,306] Trial 254 finished with value: 0.01432502731097536 and parameters: {'foundation_window': 4, 'ar_lags': 4, 'ema_spans': (2, 4, 8), 'conv_scales': (2, 4, 8), 'use_calendar': True, 'ridge_alpha': 0.22577446353797975, 'shrinkage_max': 0.4043410277170465, 'oob_split_ratio': 0.6705800712238772}. Best is trial 144 with value: 0.009471602415253667.\n",
      "[I 2026-07-02 16:32:37,615] Trial 255 finished with value: 0.013956871924132523 and parameters: {'foundation_window': 4, 'ar_lags': 4, 'ema_spans': (3, 6), 'conv_scales': (2, 4, 8), 'use_calendar': True, 'ridge_alpha': 0.18443802467910625, 'shrinkage_max': 0.34326426046161296, 'oob_split_ratio': 0.664313378343624}. Best is trial 144 with value: 0.009471602415253667.\n",
      "[I 2026-07-02 16:32:37,930] Trial 256 finished with value: 0.009970401408441881 and parameters: {'foundation_window': 4, 'ar_lags': 4, 'ema_spans': (2, 4, 8), 'conv_scales': (2, 4, 8), 'use_calendar': True, 'ridge_alpha': 0.23020687798720402, 'shrinkage_max': 0.25079917783593336, 'oob_split_ratio': 0.6549142120677656}. Best is trial 144 with value: 0.009471602415253667.\n",
      "[I 2026-07-02 16:32:38,241] Trial 257 finished with value: 0.016375806792176647 and parameters: {'foundation_window': 3, 'ar_lags': 4, 'ema_spans': (2, 4, 8), 'conv_scales': (2, 4, 8), 'use_calendar': True, 'ridge_alpha': 0.22684469031708787, 'shrinkage_max': 0.25830361565154714, 'oob_split_ratio': 0.6564218817231602}. Best is trial 144 with value: 0.009471602415253667.\n",
      "[I 2026-07-02 16:32:38,550] Trial 258 finished with value: 0.01332402920999174 and parameters: {'foundation_window': 5, 'ar_lags': 4, 'ema_spans': (2, 4, 8), 'conv_scales': (2, 4, 8), 'use_calendar': True, 'ridge_alpha': 0.143656178175598, 'shrinkage_max': 0.25331834623155536, 'oob_split_ratio': 0.6609791903007507}. Best is trial 144 with value: 0.009471602415253667.\n",
      "[I 2026-07-02 16:32:38,865] Trial 259 finished with value: 0.009897630463799848 and parameters: {'foundation_window': 4, 'ar_lags': 4, 'ema_spans': (2, 4, 8), 'conv_scales': (2, 4, 8), 'use_calendar': True, 'ridge_alpha': 0.19500414920319648, 'shrinkage_max': 0.2508159551161213, 'oob_split_ratio': 0.6544999774740744}. Best is trial 144 with value: 0.009471602415253667.\n",
      "[I 2026-07-02 16:32:39,186] Trial 260 finished with value: 0.010947516604989474 and parameters: {'foundation_window': 4, 'ar_lags': 4, 'ema_spans': (2, 4, 8), 'conv_scales': (2, 4, 8), 'use_calendar': True, 'ridge_alpha': 0.18363227154206116, 'shrinkage_max': 0.34372209446372515, 'oob_split_ratio': 0.6548623796644829}. Best is trial 144 with value: 0.009471602415253667.\n",
      "[I 2026-07-02 16:32:39,497] Trial 261 finished with value: 0.012560824287204236 and parameters: {'foundation_window': 4, 'ar_lags': 4, 'ema_spans': (2, 4, 8), 'conv_scales': (2, 4, 8), 'use_calendar': True, 'ridge_alpha': 0.2331790408177568, 'shrinkage_max': 0.3328445914748501, 'oob_split_ratio': 0.6630058809960536}. Best is trial 144 with value: 0.009471602415253667.\n",
      "[I 2026-07-02 16:32:39,818] Trial 262 finished with value: 0.012867753260124707 and parameters: {'foundation_window': 4, 'ar_lags': 4, 'ema_spans': (2, 4, 8), 'conv_scales': (2, 4, 8), 'use_calendar': True, 'ridge_alpha': 0.10518128776345398, 'shrinkage_max': 0.41509919570209647, 'oob_split_ratio': 0.654621645716176}. Best is trial 144 with value: 0.009471602415253667.\n",
      "[I 2026-07-02 16:32:40,148] Trial 263 finished with value: 0.01453412012504962 and parameters: {'foundation_window': 3, 'ar_lags': 4, 'ema_spans': (2, 4, 8), 'conv_scales': (2, 4, 8), 'use_calendar': True, 'ridge_alpha': 0.16427069450883502, 'shrinkage_max': 0.3007738759279782, 'oob_split_ratio': 0.661309290051414}. Best is trial 144 with value: 0.009471602415253667.\n",
      "[I 2026-07-02 16:32:40,473] Trial 264 finished with value: 0.012652302696071612 and parameters: {'foundation_window': 4, 'ar_lags': 4, 'ema_spans': (2, 4), 'conv_scales': (2, 4, 8), 'use_calendar': True, 'ridge_alpha': 0.2503945983842769, 'shrinkage_max': 0.2516757856399965, 'oob_split_ratio': 0.7796502679143416}. Best is trial 144 with value: 0.009471602415253667.\n",
      "[I 2026-07-02 16:32:40,791] Trial 265 finished with value: 0.011771096466765683 and parameters: {'foundation_window': 4, 'ar_lags': 4, 'ema_spans': (2, 4, 8), 'conv_scales': (2, 4, 8), 'use_calendar': True, 'ridge_alpha': 0.1340874361477894, 'shrinkage_max': 0.37331122906734543, 'oob_split_ratio': 0.6552552162485017}. Best is trial 144 with value: 0.009471602415253667.\n",
      "[I 2026-07-02 16:32:41,112] Trial 266 finished with value: 0.011771201412603946 and parameters: {'foundation_window': 4, 'ar_lags': 4, 'ema_spans': (2, 4, 8), 'conv_scales': (2, 4, 8), 'use_calendar': True, 'ridge_alpha': 0.20384574715863438, 'shrinkage_max': 0.3026258455033205, 'oob_split_ratio': 0.666293277459281}. Best is trial 144 with value: 0.009471602415253667.\n",
      "[I 2026-07-02 16:32:41,422] Trial 267 finished with value: 0.014716132133088639 and parameters: {'foundation_window': 4, 'ar_lags': 4, 'ema_spans': (2, 4, 8), 'conv_scales': (2, 4, 8), 'use_calendar': False, 'ridge_alpha': 0.25595217159187483, 'shrinkage_max': 0.4681880011174515, 'oob_split_ratio': 0.652624197258425}. Best is trial 144 with value: 0.009471602415253667.\n",
      "[I 2026-07-02 16:32:41,737] Trial 268 finished with value: 0.015801971672263708 and parameters: {'foundation_window': 5, 'ar_lags': 4, 'ema_spans': (2, 4, 8), 'conv_scales': (2, 4, 8), 'use_calendar': True, 'ridge_alpha': 0.20122229173812065, 'shrinkage_max': 0.33429628103976045, 'oob_split_ratio': 0.6701593833852144}. Best is trial 144 with value: 0.009471602415253667.\n",
      "[I 2026-07-02 16:32:42,056] Trial 269 finished with value: 0.012858795967459391 and parameters: {'foundation_window': 4, 'ar_lags': 4, 'ema_spans': (2, 3, 5, 8), 'conv_scales': (2, 4, 8), 'use_calendar': True, 'ridge_alpha': 0.26427723702566247, 'shrinkage_max': 0.39077402449501775, 'oob_split_ratio': 0.658787241642929}. Best is trial 144 with value: 0.009471602415253667.\n",
      "[I 2026-07-02 16:32:42,372] Trial 270 finished with value: 0.012334235925689184 and parameters: {'foundation_window': 4, 'ar_lags': 4, 'ema_spans': (2, 4, 8), 'conv_scales': (2, 4, 8), 'use_calendar': True, 'ridge_alpha': 31.81343764745917, 'shrinkage_max': 0.2962023964018288, 'oob_split_ratio': 0.6523340087991408}. Best is trial 144 with value: 0.009471602415253667.\n",
      "[I 2026-07-02 16:32:42,693] Trial 271 finished with value: 0.01186673704336188 and parameters: {'foundation_window': 4, 'ar_lags': 4, 'ema_spans': (2, 4, 8), 'conv_scales': (3, 6, 12), 'use_calendar': True, 'ridge_alpha': 0.16052505831105918, 'shrinkage_max': 0.2506898478942633, 'oob_split_ratio': 0.6620532567869271}. Best is trial 144 with value: 0.009471602415253667.\n",
