      "[I 2026-07-02 16:31:25,745] Trial 199 finished with value: 11.532938027045372 and parameters: {'target_miscoverage': 0.1482310025564284, 'aci_step_size': 0.027771644544331477, 'interval_scale': 0.5871004245051232}. Best is trial 167 with value: 9.823734728783883.\n"
     ]
    },
    {
     "name": "stdout",
     "output_type": "stream",
     "text": [
      "S3-Forecaster best point parameters:\n",
      "{'reservoir_size': 28, 'spectral_radius': 1.1705887837833915, 'ar_lags': 6, 'foundation_window': 13, 'regressor_type': 'ElasticNet', 'reg_alpha': 2.567251046404731, 'aci_step_size': 0.18944330583467753, 'oob_split_ratio': 0.7313554635552422}\n",
      "S3-Forecaster best UQ parameters:\n",
      "{'target_miscoverage': 0.13892342376377637, 'aci_step_size': 0.07562469723274942, 'interval_scale': 0.5000910276308896}\n",
      "S3-Forecaster test metrics on modelling scale:\n"
     ]
    },
    {
     "data": {
      "text/html": [
       "<div>\n",
       "<style scoped>\n",
       "    .dataframe tbody tr th:only-of-type {\n",
       "        vertical-align: middle;\n",
       "    }\n",
       "\n",
       "    .dataframe tbody tr th {\n",
       "        vertical-align: top;\n",
       "    }\n",
       "\n",
       "    .dataframe thead th {\n",
       "        text-align: right;\n",
       "    }\n",
       "</style>\n",
       "<table border=\"1\" class=\"dataframe\">\n",
       "  <thead>\n",
       "    <tr style=\"text-align: right;\">\n",
       "      <th></th>\n",
       "      <th>mae</th>\n",
       "      <th>mse</th>\n",
       "      <th>rmse</th>\n",
       "      <th>r2</th>\n",
       "      <th>mape_percent</th>\n",
       "      <th>mape</th>\n",
       "      <th>smape_percent</th>\n",
       "      <th>smape</th>\n",
       "      <th>ecp</th>\n",
       "      <th>coverage_error</th>\n",
       "      <th>iw</th>\n",
       "      <th>mean_width</th>\n",
       "      <th>mis</th>\n",
       "      <th>interval_score</th>\n",
       "      <th>msis</th>\n",
       "      <th>scale</th>\n",
       "      <th>elapsed_seconds</th>\n",
       "      <th>trainable_params</th>\n",
       "    </tr>\n",
       "  </thead>\n",
       "  <tbody>\n",
       "    <tr>\n",
       "      <th>0</th>\n",
       "      <td>0.06639</td>\n",
       "      <td>0.006765</td>\n",
       "      <td>0.082253</td>\n",
       "      <td>0.963558</td>\n",
       "      <td>0.825873</td>\n",
       "      <td>0.008259</td>\n",
       "      <td>0.821149</td>\n",
       "      <td>0.008211</td>\n",
       "      <td>1.0</td>\n",
       "      <td>0.1</td>\n",
       "      <td>0.806415</td>\n",
       "      <td>0.806415</td>\n",
       "      <td>0.806415</td>\n",
       "      <td>0.806415</td>\n",
       "      <td>10.151697</td>\n",
       "      <td>0.079436</td>\n",
       "      <td>0.076018</td>\n",
       "      <td>842</td>\n",
       "    </tr>\n",
       "  </tbody>\n",
       "</table>\n",
       "</div>"
      ],
      "text/plain": [
       "       mae       mse      rmse        r2  mape_percent      mape  \\\n",
       "0  0.06639  0.006765  0.082253  0.963558      0.825873  0.008259   \n",
       "\n",
       "   smape_percent     smape  ecp  coverage_error        iw  mean_width  \\\n",
       "0       0.821149  0.008211  1.0             0.1  0.806415    0.806415   \n",
       "\n",
       "        mis  interval_score       msis     scale  elapsed_seconds  \\\n",
       "0  0.806415        0.806415  10.151697  0.079436         0.076018   \n",
       "\n",
       "   trainable_params  \n",
       "0               842  "
      ]
     },
     "metadata": {},
     "output_type": "display_data"
    }
   ],
   "source": [
    "s3_result = run_s3_experiment(\n",
    "    train_series,\n",
    "    test_series,\n",
    "    point_trials=S3_POINT_TRIALS,\n",
    "    uq_trials=S3_UQ_TRIALS,\n",
    "    val_size=VAL_SIZE,\n",
    "    seed=SEED,\n",
    ")\n",
    "\n",
    "print(\"S3-Forecaster best point parameters:\")\n",
    "print(s3_result[\"best_point_params\"])\n",
    "print(\"S3-Forecaster best UQ parameters:\")\n",
    "print(s3_result[\"best_uq_params\"])\n",
    "print(\"S3-Forecaster test metrics on modelling scale:\")\n",
    "display(pd.DataFrame([s3_result[\"metrics\"]]))"
   ]
  },
  {
   "cell_type": "markdown",
   "id": "1ae441b2",
   "metadata": {
    "papermill": {
     "duration": 0.039284,
     "end_time": "2026-07-02T16:31:25.957561+00:00",
     "exception": false,
     "start_time": "2026-07-02T16:31:25.918277+00:00",
     "status": "completed"
    },
    "tags": []
   },
   "source": [
    "## 7. S3-FastSketch optimization and final test"
   ]
  },
  {
   "cell_type": "code",
   "execution_count": 9,
   "id": "4e16ac40",
   "metadata": {
    "execution": {
     "iopub.execute_input": "2026-07-02T16:31:26.032451Z",
     "iopub.status.busy": "2026-07-02T16:31:26.032103Z",
     "iopub.status.idle": "2026-07-02T16:33:40.479228Z",
     "shell.execute_reply": "2026-07-02T16:33:40.478277Z"
    },
    "papermill": {
     "duration": 134.487164,
     "end_time": "2026-07-02T16:33:40.481032+00:00",
     "exception": false,
     "start_time": "2026-07-02T16:31:25.993868+00:00",
     "status": "completed"
    },
    "tags": []
   },
   "outputs": [
    {
     "name": "stderr",
     "output_type": "stream",
     "text": [
      "[I 2026-07-02 16:31:26,036] A new study created in memory with name: no-name-28cf0242-5fbd-4de6-8d9e-794c07694656\n",
      "[I 2026-07-02 16:31:26,342] Trial 0 finished with value: 0.05036071927068044 and parameters: {'foundation_window': 6, 'ar_lags': 6, 'ema_spans': (2, 4), 'conv_scales': (2, 4, 8), 'use_calendar': False, 'ridge_alpha': 0.008111941985431923, 'shrinkage_max': 0.754362402096943, 'oob_split_ratio': 0.6260605607398845}. Best is trial 0 with value: 0.05036071927068044.\n",
      "[I 2026-07-02 16:31:26,642] Trial 1 finished with value: 0.023147613533616582 and parameters: {'foundation_window': 7, 'ar_lags': 3, 'ema_spans': (2, 4, 8), 'conv_scales': (2, 3, 4), 'use_calendar': True, 'ridge_alpha': 0.007122305833333868, 'shrinkage_max': 0.42889188070951867, 'oob_split_ratio': 0.7872213843133333}. Best is trial 1 with value: 0.023147613533616582.\n",
      "[I 2026-07-02 16:31:26,878] Trial 2 finished with value: 0.053887168359841676 and parameters: {'foundation_window': 12, 'ar_lags': 5, 'ema_spans': (3, 6), 'conv_scales': (3, 6), 'use_calendar': True, 'ridge_alpha': 0.5414413211338525, 'shrinkage_max': 0.7583497526951993, 'oob_split_ratio': 0.7923961569411397}. Best is trial 1 with value: 0.023147613533616582.\n",
      "[I 2026-07-02 16:31:27,172] Trial 3 finished with value: 0.06969679041454138 and parameters: {'foundation_window': 10, 'ar_lags': 6, 'ema_spans': (3, 6), 'conv_scales': (2, 4, 8), 'use_calendar': False, 'ridge_alpha': 0.5169879442298543, 'shrinkage_max': 0.6375416186805973, 'oob_split_ratio': 0.75054924518851}. Best is trial 1 with value: 0.023147613533616582.\n",
      "[I 2026-07-02 16:31:27,469] Trial 4 finished with value: 0.03737445969799531 and parameters: {'foundation_window': 2, 'ar_lags': 6, 'ema_spans': (3, 6, 12), 'conv_scales': (2, 3, 4), 'use_calendar': False, 'ridge_alpha': 0.04513257622008944, 'shrinkage_max': 0.42478546328656497, 'oob_split_ratio': 0.6277455804289156}. Best is trial 1 with value: 0.023147613533616582.\n",
      "[I 2026-07-02 16:31:27,706] Trial 5 finished with value: 0.018806010233827122 and parameters: {'foundation_window': 5, 'ar_lags': 5, 'ema_spans': (2, 4, 8), 'conv_scales': (3, 6), 'use_calendar': False, 'ridge_alpha': 0.003463037026119184, 'shrinkage_max': 0.3364302606385192, 'oob_split_ratio': 0.7091026028159452}. Best is trial 5 with value: 0.018806010233827122.\n",
      "[I 2026-07-02 16:31:27,999] Trial 6 finished with value: 0.030484336650777447 and parameters: {'foundation_window': 5, 'ar_lags': 4, 'ema_spans': (2, 4), 'conv_scales': (3, 6, 12), 'use_calendar': True, 'ridge_alpha': 10.431827200054899, 'shrinkage_max': 0.7630676619365986, 'oob_split_ratio': 0.7731397496224945}. Best is trial 5 with value: 0.018806010233827122.\n",
      "[I 2026-07-02 16:31:28,290] Trial 7 finished with value: 0.06454668993294603 and parameters: {'foundation_window': 7, 'ar_lags': 5, 'ema_spans': (2, 4), 'conv_scales': (2, 3, 4), 'use_calendar': False, 'ridge_alpha': 0.0487613652796118, 'shrinkage_max': 2.8430016857594276, 'oob_split_ratio': 0.6308007330051888}. Best is trial 5 with value: 0.018806010233827122.\n",
      "[I 2026-07-02 16:31:28,591] Trial 8 finished with value: 0.10059562827458142 and parameters: {'foundation_window': 7, 'ar_lags': 5, 'ema_spans': (2, 4, 8), 'conv_scales': (3, 6, 12), 'use_calendar': True, 'ridge_alpha': 34.77998816092338, 'shrinkage_max': 0.9087951993341742, 'oob_split_ratio': 0.5862237180228058}. Best is trial 5 with value: 0.018806010233827122.\n",
      "[I 2026-07-02 16:31:28,824] Trial 9 finished with value: 0.02413493709693489 and parameters: {'foundation_window': 7, 'ar_lags': 6, 'ema_spans': (3, 6), 'conv_scales': (3, 6), 'use_calendar': False, 'ridge_alpha': 0.008562341633595545, 'shrinkage_max': 0.36213163927560077, 'oob_split_ratio': 0.6977232357970605}. Best is trial 5 with value: 0.018806010233827122.\n",
      "[I 2026-07-02 16:31:29,069] Trial 10 finished with value: 0.015308752288762823 and parameters: {'foundation_window': 2, 'ar_lags': 1, 'ema_spans': (2, 3, 5, 8), 'conv_scales': (2, 3), 'use_calendar': False, 'ridge_alpha': 0.0015618020905061984, 'shrinkage_max': 1.754986535579859, 'oob_split_ratio': 0.7060208817930914}. Best is trial 10 with value: 0.015308752288762823.\n",
      "[I 2026-07-02 16:31:29,318] Trial 11 finished with value: 0.01573718055705917 and parameters: {'foundation_window': 2, 'ar_lags': 1, 'ema_spans': (2, 3, 5, 8), 'conv_scales': (2, 3), 'use_calendar': False, 'ridge_alpha': 0.0014245717643263183, 'shrinkage_max': 1.5752149065741565, 'oob_split_ratio': 0.7061778291974972}. Best is trial 10 with value: 0.015308752288762823.\n",
      "[I 2026-07-02 16:31:29,568] Trial 12 finished with value: 0.022015087177357503 and parameters: {'foundation_window': 2, 'ar_lags': 1, 'ema_spans': (2, 3, 5, 8), 'conv_scales': (2, 3), 'use_calendar': False, 'ridge_alpha': 0.0010884156502424375, 'shrinkage_max': 1.7578679089642608, 'oob_split_ratio': 0.6986061980592664}. Best is trial 10 with value: 0.015308752288762823.\n",
      "[I 2026-07-02 16:31:29,816] Trial 13 finished with value: 0.03436725222261529 and parameters: {'foundation_window': 3, 'ar_lags': 1, 'ema_spans': (2, 3, 5, 8), 'conv_scales': (2, 3), 'use_calendar': False, 'ridge_alpha': 0.0010204485815603302, 'shrinkage_max': 1.5645825534887527, 'oob_split_ratio': 0.7337038201681608}. Best is trial 10 with value: 0.015308752288762823.\n",
      "[I 2026-07-02 16:31:30,067] Trial 14 finished with value: 0.028687564615403355 and parameters: {'foundation_window': 4, 'ar_lags': 2, 'ema_spans': (2, 3, 5, 8), 'conv_scales': (2, 3), 'use_calendar': False, 'ridge_alpha': 0.04186811180469848, 'shrinkage_max': 1.8454911996429355, 'oob_split_ratio': 0.6713775646783414}. Best is trial 10 with value: 0.015308752288762823.\n",
      "[I 2026-07-02 16:31:30,348] Trial 15 finished with value: 0.029219393042374305 and parameters: {'foundation_window': 3, 'ar_lags': 2, 'ema_spans': (2, 3, 5, 8), 'conv_scales': (2, 3), 'use_calendar': False, 'ridge_alpha': 0.0028235481296059036, 'shrinkage_max': 2.3401083025624456, 'oob_split_ratio': 0.6665197779914791}. Best is trial 10 with value: 0.015308752288762823.\n",
      "[I 2026-07-02 16:31:30,600] Trial 16 finished with value: 0.02889901717617803 and parameters: {'foundation_window': 2, 'ar_lags': 2, 'ema_spans': (2, 3, 5, 8), 'conv_scales': (2, 3), 'use_calendar': False, 'ridge_alpha': 0.022187613144396247, 'shrinkage_max': 1.3481442622305488, 'oob_split_ratio': 0.7372320429683136}. Best is trial 10 with value: 0.015308752288762823.\n",
      "[I 2026-07-02 16:31:30,844] Trial 17 finished with value: 0.032435611061720084 and parameters: {'foundation_window': 4, 'ar_lags': 1, 'ema_spans': (3, 6, 12), 'conv_scales': (2, 3), 'use_calendar': False, 'ridge_alpha': 0.19683936068218272, 'shrinkage_max': 2.266672670521139, 'oob_split_ratio': 0.6642665093150361}. Best is trial 10 with value: 0.015308752288762823.\n",
      "[I 2026-07-02 16:31:31,093] Trial 18 finished with value: 0.017706226445521892 and parameters: {'foundation_window': 3, 'ar_lags': 3, 'ema_spans': (2, 3, 5, 8), 'conv_scales': (2, 3), 'use_calendar': True, 'ridge_alpha': 0.0022336235947985348, 'shrinkage_max': 1.1652664478819619, 'oob_split_ratio': 0.7178092418376381}. Best is trial 10 with value: 0.015308752288762823.\n",
      "[I 2026-07-02 16:31:31,335] Trial 19 finished with value: 0.050468913904489675 and parameters: {'foundation_window': 4, 'ar_lags': 1, 'ema_spans': (2, 3, 5, 8), 'conv_scales': (2, 3), 'use_calendar': False, 'ridge_alpha': 0.012255313642997997, 'shrinkage_max': 2.0454328405911895, 'oob_split_ratio': 0.5725435132368569}. Best is trial 10 with value: 0.015308752288762823.\n",
      "[I 2026-07-02 16:31:31,648] Trial 20 finished with value: 0.01808621030860439 and parameters: {'foundation_window': 2, 'ar_lags': 2, 'ema_spans': (2, 3, 5, 8), 'conv_scales': (3, 6, 12), 'use_calendar': False, 'ridge_alpha': 0.15119431965021815, 'shrinkage_max': 2.6468427993240207, 'oob_split_ratio': 0.7575036756920479}. Best is trial 10 with value: 0.015308752288762823.\n",
      "[I 2026-07-02 16:31:31,897] Trial 21 finished with value: 0.013062089843873569 and parameters: {'foundation_window': 3, 'ar_lags': 3, 'ema_spans': (2, 3, 5, 8), 'conv_scales': (2, 3), 'use_calendar': True, 'ridge_alpha': 0.0023979796864061075, 'shrinkage_max': 1.3188795299163925, 'oob_split_ratio': 0.7134750648233021}. Best is trial 21 with value: 0.013062089843873569.\n",
      "[I 2026-07-02 16:31:32,153] Trial 22 finished with value: 0.03370927118199144 and parameters: {'foundation_window': 3, 'ar_lags': 3, 'ema_spans': (2, 3, 5, 8), 'conv_scales': (2, 3), 'use_calendar': True, 'ridge_alpha': 0.0028146261906894787, 'shrinkage_max': 1.2619486130049433, 'oob_split_ratio': 0.6810114843146098}. Best is trial 21 with value: 0.013062089843873569.\n",
      "[I 2026-07-02 16:31:32,404] Trial 23 finished with value: 0.021245765399642482 and parameters: {'foundation_window': 5, 'ar_lags': 4, 'ema_spans': (2, 3, 5, 8), 'conv_scales': (2, 3), 'use_calendar': True, 'ridge_alpha': 0.0011949021002395047, 'shrinkage_max': 1.5896131444697563, 'oob_split_ratio': 0.7286172190270322}. Best is trial 21 with value: 0.013062089843873569.\n",
      "[I 2026-07-02 16:31:32,650] Trial 24 finished with value: 0.022835396279579007 and parameters: {'foundation_window': 2, 'ar_lags': 1, 'ema_spans': (2, 3, 5, 8), 'conv_scales': (2, 3), 'use_calendar': True, 'ridge_alpha': 0.004626486621764674, 'shrinkage_max': 1.0656442053927626, 'oob_split_ratio': 0.6898214885815162}. Best is trial 21 with value: 0.013062089843873569.\n",
      "[I 2026-07-02 16:31:32,955] Trial 25 finished with value: 0.03242430443197739 and parameters: {'foundation_window': 4, 'ar_lags': 2, 'ema_spans': (3, 6, 12), 'conv_scales': (2, 4, 8), 'use_calendar': True, 'ridge_alpha': 0.016502512029630417, 'shrinkage_max': 1.466377368641992, 'oob_split_ratio': 0.6534965521006755}. Best is trial 21 with value: 0.013062089843873569.\n",
      "[I 2026-07-02 16:31:33,198] Trial 26 finished with value: 0.014276248837133848 and parameters: {'foundation_window': 3, 'ar_lags': 3, 'ema_spans': (2, 3, 5, 8), 'conv_scales': (2, 3), 'use_calendar': True, 'ridge_alpha': 0.001946600685561215, 'shrinkage_max': 1.9303109085107326, 'oob_split_ratio': 0.7119087090831259}. Best is trial 21 with value: 0.013062089843873569.\n",
      "[I 2026-07-02 16:31:33,444] Trial 27 finished with value: 0.05356187918089616 and parameters: {'foundation_window': 9, 'ar_lags': 4, 'ema_spans': (2, 3, 5, 8), 'conv_scales': (2, 3), 'use_calendar': True, 'ridge_alpha': 0.004925720618604769, 'shrinkage_max': 2.058940243019088, 'oob_split_ratio': 0.761011376209082}. Best is trial 21 with value: 0.013062089843873569.\n",
      "[I 2026-07-02 16:31:33,691] Trial 28 finished with value: 0.018392841256739314 and parameters: {'foundation_window': 3, 'ar_lags': 3, 'ema_spans': (2, 3, 5, 8), 'conv_scales': (2, 3), 'use_calendar': True, 'ridge_alpha': 0.02258593289324509, 'shrinkage_max': 1.8241141183465106, 'oob_split_ratio': 0.6500132555854148}. Best is trial 21 with value: 0.013062089843873569.\n",
      "[I 2026-07-02 16:31:33,991] Trial 29 finished with value: 0.03849528639947099 and parameters: {'foundation_window': 6, 'ar_lags': 4, 'ema_spans': (2, 4), 'conv_scales': (2, 4, 8), 'use_calendar': True, 'ridge_alpha': 0.008205723226810624, 'shrinkage_max': 2.3281171050788023, 'oob_split_ratio': 0.7217261955516499}. Best is trial 21 with value: 0.013062089843873569.\n",
      "[I 2026-07-02 16:31:34,294] Trial 30 finished with value: 0.03759428279872678 and parameters: {'foundation_window': 6, 'ar_lags': 3, 'ema_spans': (3, 6), 'conv_scales': (2, 3, 4), 'use_calendar': True, 'ridge_alpha': 0.0021802666746313032, 'shrinkage_max': 1.9868545708140493, 'oob_split_ratio': 0.594378518118062}. Best is trial 21 with value: 0.013062089843873569.\n",
      "[I 2026-07-02 16:31:34,541] Trial 31 finished with value: 0.03325602596516766 and parameters: {'foundation_window': 3, 'ar_lags': 2, 'ema_spans': (2, 3, 5, 8), 'conv_scales': (2, 3), 'use_calendar': True, 'ridge_alpha': 0.0018389013770280837, 'shrinkage_max': 1.6794610966948182, 'oob_split_ratio': 0.7122817471432639}. Best is trial 21 with value: 0.013062089843873569.\n",
      "[I 2026-07-02 16:31:34,786] Trial 32 finished with value: 0.025475098818430308 and parameters: {'foundation_window': 2, 'ar_lags': 1, 'ema_spans': (2, 3, 5, 8), 'conv_scales': (2, 3), 'use_calendar': False, 'ridge_alpha': 0.004760234983901809, 'shrinkage_max': 1.4167585397281566, 'oob_split_ratio': 0.7467041938738517}. Best is trial 21 with value: 0.013062089843873569.\n",
      "[I 2026-07-02 16:31:35,027] Trial 33 finished with value: 0.03151220893122138 and parameters: {'foundation_window': 4, 'ar_lags': 3, 'ema_spans': (2, 4, 8), 'conv_scales': (2, 3), 'use_calendar': True, 'ridge_alpha': 0.0014932173318444885, 'shrinkage_max': 2.170780283742038, 'oob_split_ratio': 0.6871728524095907}. Best is trial 21 with value: 0.013062089843873569.\n",
      "[I 2026-07-02 16:31:35,271] Trial 34 finished with value: 0.0411394431167054 and parameters: {'foundation_window': 3, 'ar_lags': 2, 'ema_spans': (2, 3, 5, 8), 'conv_scales': (3, 6), 'use_calendar': False, 'ridge_alpha': 0.007307704070985974, 'shrinkage_max': 2.4800468165875786, 'oob_split_ratio': 0.7051647538353563}. Best is trial 21 with value: 0.013062089843873569.\n",
      "[I 2026-07-02 16:31:35,579] Trial 35 finished with value: 0.09268456603807779 and parameters: {'foundation_window': 12, 'ar_lags': 3, 'ema_spans': (3, 6, 12), 'conv_scales': (2, 4, 8), 'use_calendar': True, 'ridge_alpha': 3.690365302868621, 'shrinkage_max': 1.064012400572564, 'oob_split_ratio': 0.7778711391275652}. Best is trial 21 with value: 0.013062089843873569.\n",
      "[I 2026-07-02 16:31:35,831] Trial 36 finished with value: 0.025337459591487213 and parameters: {'foundation_window': 2, 'ar_lags': 1, 'ema_spans': (2, 3, 5, 8), 'conv_scales': (2, 3), 'use_calendar': False, 'ridge_alpha': 0.003854761980380038, 'shrinkage_max': 1.8478888860508662, 'oob_split_ratio': 0.7423998948350984}. Best is trial 21 with value: 0.013062089843873569.\n",
      "[I 2026-07-02 16:31:36,130] Trial 37 finished with value: 0.030360496751719854 and parameters: {'foundation_window': 5, 'ar_lags': 4, 'ema_spans': (3, 6), 'conv_scales': (2, 3, 4), 'use_calendar': True, 'ridge_alpha': 0.011286687669221201, 'shrinkage_max': 1.6055957896400879, 'oob_split_ratio': 0.7234650776165414}. Best is trial 21 with value: 0.013062089843873569.\n",
      "[I 2026-07-02 16:31:36,429] Trial 38 finished with value: 0.030562265800341465 and parameters: {'foundation_window': 4, 'ar_lags': 2, 'ema_spans': (2, 4), 'conv_scales': (3, 6, 12), 'use_calendar': False, 'ridge_alpha': 0.0010311926441527633, 'shrinkage_max': 0.6305926530988565, 'oob_split_ratio': 0.7056440784564935}. Best is trial 21 with value: 0.013062089843873569.\n",
      "[I 2026-07-02 16:31:36,673] Trial 39 finished with value: 0.07043301715746113 and parameters: {'foundation_window': 10, 'ar_lags': 3, 'ema_spans': (2, 4, 8), 'conv_scales': (3, 6), 'use_calendar': True, 'ridge_alpha': 0.002244899449524386, 'shrinkage_max': 1.9614303950623777, 'oob_split_ratio': 0.7991469634788707}. Best is trial 21 with value: 0.013062089843873569.\n",
      "[I 2026-07-02 16:31:36,942] Trial 40 finished with value: 0.02774233126722429 and parameters: {'foundation_window': 2, 'ar_lags': 1, 'ema_spans': (2, 3, 5, 8), 'conv_scales': (2, 3), 'use_calendar': False, 'ridge_alpha': 0.032260213058993056, 'shrinkage_max': 1.2272885795147825, 'oob_split_ratio': 0.6435127007805762}. Best is trial 21 with value: 0.013062089843873569.\n",
      "[I 2026-07-02 16:31:37,198] Trial 41 finished with value: 0.017490865463020252 and parameters: {'foundation_window': 3, 'ar_lags': 3, 'ema_spans': (2, 3, 5, 8), 'conv_scales': (2, 3), 'use_calendar': True, 'ridge_alpha': 0.0020172316984745247, 'shrinkage_max': 1.1524141923275661, 'oob_split_ratio': 0.7158150867579416}. Best is trial 21 with value: 0.013062089843873569.\n",
      "[I 2026-07-02 16:31:37,452] Trial 42 finished with value: 0.02585192712662994 and parameters: {'foundation_window': 3, 'ar_lags': 3, 'ema_spans': (2, 3, 5, 8), 'conv_scales': (2, 3), 'use_calendar': True, 'ridge_alpha': 0.005300124771815217, 'shrinkage_max': 0.9309876801359296, 'oob_split_ratio': 0.6799372661028493}. Best is trial 21 with value: 0.013062089843873569.\n",
