      "[I 2026-07-02 14:58:18,728] Trial 165 finished with value: 0.033283047700810635 and parameters: {'reservoir_size': 31, 'spectral_radius': 1.3551705790401443, 'ar_lags': 2, 'foundation_window': 7, 'regressor_type': 'ElasticNet', 'reg_alpha': 0.21050479203489295, 'aci_step_size': 0.13789828999683348, 'oob_split_ratio': 0.6359310758939299}. Best is trial 25 with value: 0.030603792302848206.\n",
      "[I 2026-07-02 14:58:18,798] Trial 166 finished with value: 0.03291645046054551 and parameters: {'reservoir_size': 43, 'spectral_radius': 1.282731426660619, 'ar_lags': 2, 'foundation_window': 4, 'regressor_type': 'ElasticNet', 'reg_alpha': 0.5111494366884821, 'aci_step_size': 0.19574446498780143, 'oob_split_ratio': 0.6505092403818242}. Best is trial 25 with value: 0.030603792302848206.\n",
      "[I 2026-07-02 14:58:18,935] Trial 167 finished with value: 0.03173162813123632 and parameters: {'reservoir_size': 16, 'spectral_radius': 1.2618315133527072, 'ar_lags': 2, 'foundation_window': 8, 'regressor_type': 'ElasticNet', 'reg_alpha': 1.1274829380118887, 'aci_step_size': 0.16218302745906368, 'oob_split_ratio': 0.6453661943267505}. Best is trial 25 with value: 0.030603792302848206.\n",
      "[I 2026-07-02 14:58:19,052] Trial 168 finished with value: 0.03433564978022054 and parameters: {'reservoir_size': 35, 'spectral_radius': 1.0338866775681983, 'ar_lags': 2, 'foundation_window': 9, 'regressor_type': 'ElasticNet', 'reg_alpha': 0.37050721604703957, 'aci_step_size': 0.15271786695738407, 'oob_split_ratio': 0.6254803790326859}. Best is trial 25 with value: 0.030603792302848206.\n",
      "[I 2026-07-02 14:58:19,143] Trial 169 finished with value: 0.03327992867754969 and parameters: {'reservoir_size': 58, 'spectral_radius': 1.3820459005503842, 'ar_lags': 2, 'foundation_window': 8, 'regressor_type': 'ElasticNet', 'reg_alpha': 0.2663164744023446, 'aci_step_size': 0.13387395066107663, 'oob_split_ratio': 0.6389363978978754}. Best is trial 25 with value: 0.030603792302848206.\n",
      "[I 2026-07-02 14:58:19,237] Trial 170 finished with value: 0.03959806427489119 and parameters: {'reservoir_size': 39, 'spectral_radius': 1.2319267995253285, 'ar_lags': 2, 'foundation_window': 9, 'regressor_type': 'Ridge', 'reg_alpha': 0.33882172339739164, 'aci_step_size': 0.17152607847579926, 'oob_split_ratio': 0.6625508885614538}. Best is trial 25 with value: 0.030603792302848206.\n",
      "[I 2026-07-02 14:58:19,321] Trial 171 finished with value: 0.03173162813123632 and parameters: {'reservoir_size': 73, 'spectral_radius': 0.8386346891499502, 'ar_lags': 2, 'foundation_window': 8, 'regressor_type': 'ElasticNet', 'reg_alpha': 0.675471327458581, 'aci_step_size': 0.14547718677332153, 'oob_split_ratio': 0.6488623152545335}. Best is trial 25 with value: 0.030603792302848206.\n",
      "[I 2026-07-02 14:58:19,426] Trial 172 finished with value: 0.03173162813123632 and parameters: {'reservoir_size': 63, 'spectral_radius': 1.3588014539681412, 'ar_lags': 2, 'foundation_window': 8, 'regressor_type': 'ElasticNet', 'reg_alpha': 0.5827626349047027, 'aci_step_size': 0.15163346580428572, 'oob_split_ratio': 0.6541974211675682}. Best is trial 25 with value: 0.030603792302848206.\n",
      "[I 2026-07-02 14:58:19,534] Trial 173 finished with value: 0.03173162813123632 and parameters: {'reservoir_size': 68, 'spectral_radius': 1.4136965665179817, 'ar_lags': 2, 'foundation_window': 8, 'regressor_type': 'ElasticNet', 'reg_alpha': 0.4469848790967945, 'aci_step_size': 0.15815733090068732, 'oob_split_ratio': 0.6462002394921086}. Best is trial 25 with value: 0.030603792302848206.\n",
      "[I 2026-07-02 14:58:19,644] Trial 174 finished with value: 0.03173162813123632 and parameters: {'reservoir_size': 52, 'spectral_radius': 1.2998239328458894, 'ar_lags': 2, 'foundation_window': 8, 'regressor_type': 'ElasticNet', 'reg_alpha': 1.508089940050696, 'aci_step_size': 0.14180645184432691, 'oob_split_ratio': 0.6334182202488815}. Best is trial 25 with value: 0.030603792302848206.\n",
      "[I 2026-07-02 14:58:19,733] Trial 175 finished with value: 0.03362018279788542 and parameters: {'reservoir_size': 22, 'spectral_radius': 1.4394558790402634, 'ar_lags': 2, 'foundation_window': 8, 'regressor_type': 'ElasticNet', 'reg_alpha': 0.8202950252486151, 'aci_step_size': 0.12228311954089899, 'oob_split_ratio': 0.6583192490421249}. Best is trial 25 with value: 0.030603792302848206.\n",
      "[I 2026-07-02 14:58:19,822] Trial 176 finished with value: 0.03173162813123632 and parameters: {'reservoir_size': 66, 'spectral_radius': 1.3247220020827215, 'ar_lags': 2, 'foundation_window': 8, 'regressor_type': 'ElasticNet', 'reg_alpha': 0.5043465445635207, 'aci_step_size': 0.11792741216043225, 'oob_split_ratio': 0.6405894983145951}. Best is trial 25 with value: 0.030603792302848206.\n",
      "[I 2026-07-02 14:58:19,930] Trial 177 finished with value: 0.03173162813123632 and parameters: {'reservoir_size': 45, 'spectral_radius': 1.3525728876606162, 'ar_lags': 2, 'foundation_window': 8, 'regressor_type': 'ElasticNet', 'reg_alpha': 0.6867881363215065, 'aci_step_size': 0.166066108146123, 'oob_split_ratio': 0.6519209917823079}. Best is trial 25 with value: 0.030603792302848206.\n",
      "[I 2026-07-02 14:58:20,072] Trial 178 finished with value: 0.035225905168755886 and parameters: {'reservoir_size': 76, 'spectral_radius': 1.468954552002844, 'ar_lags': 4, 'foundation_window': 9, 'regressor_type': 'ElasticNet', 'reg_alpha': 0.2415696712828186, 'aci_step_size': 0.19150577376103997, 'oob_split_ratio': 0.6473045191560933}. Best is trial 25 with value: 0.030603792302848206.\n",
      "[I 2026-07-02 14:58:20,155] Trial 179 finished with value: 0.03362018279788542 and parameters: {'reservoir_size': 33, 'spectral_radius': 1.3891580134294907, 'ar_lags': 2, 'foundation_window': 8, 'regressor_type': 'ElasticNet', 'reg_alpha': 0.4113112510252786, 'aci_step_size': 0.1496900367353494, 'oob_split_ratio': 0.6659590760133963}. Best is trial 25 with value: 0.030603792302848206.\n",
      "[I 2026-07-02 14:58:20,227] Trial 180 finished with value: 0.03370015535437848 and parameters: {'reservoir_size': 28, 'spectral_radius': 1.1782783395909946, 'ar_lags': 2, 'foundation_window': 9, 'regressor_type': 'ElasticNet', 'reg_alpha': 0.5702891809742107, 'aci_step_size': 0.1823904001991531, 'oob_split_ratio': 0.6719096702379913}. Best is trial 25 with value: 0.030603792302848206.\n",
      "[I 2026-07-02 14:58:20,329] Trial 181 finished with value: 0.03173162813123632 and parameters: {'reservoir_size': 59, 'spectral_radius': 1.4751136891062302, 'ar_lags': 2, 'foundation_window': 8, 'regressor_type': 'ElasticNet', 'reg_alpha': 0.6822803205958808, 'aci_step_size': 0.1754874225424185, 'oob_split_ratio': 0.6394368232733276}. Best is trial 25 with value: 0.030603792302848206.\n",
      "[I 2026-07-02 14:58:20,441] Trial 182 finished with value: 0.03173162813123632 and parameters: {'reservoir_size': 60, 'spectral_radius': 1.4534772966226264, 'ar_lags': 2, 'foundation_window': 8, 'regressor_type': 'ElasticNet', 'reg_alpha': 0.616154582670363, 'aci_step_size': 0.17024546058600987, 'oob_split_ratio': 0.64295413377923}. Best is trial 25 with value: 0.030603792302848206.\n",
      "[I 2026-07-02 14:58:20,560] Trial 183 finished with value: 0.03310175599427346 and parameters: {'reservoir_size': 55, 'spectral_radius': 1.4255581159247066, 'ar_lags': 2, 'foundation_window': 8, 'regressor_type': 'ElasticNet', 'reg_alpha': 0.19447541713886365, 'aci_step_size': 0.11383444604913635, 'oob_split_ratio': 0.6341068084176659}. Best is trial 25 with value: 0.030603792302848206.\n",
      "[I 2026-07-02 14:58:20,676] Trial 184 finished with value: 0.03209042763115015 and parameters: {'reservoir_size': 49, 'spectral_radius': 1.2482460556296753, 'ar_lags': 2, 'foundation_window': 8, 'regressor_type': 'ElasticNet', 'reg_alpha': 0.29569898675340467, 'aci_step_size': 0.16232793661257522, 'oob_split_ratio': 0.6533872230425335}. Best is trial 25 with value: 0.030603792302848206.\n",
      "[I 2026-07-02 14:58:20,762] Trial 185 finished with value: 0.03173162813123632 and parameters: {'reservoir_size': 64, 'spectral_radius': 1.2737894578077205, 'ar_lags': 2, 'foundation_window': 8, 'regressor_type': 'ElasticNet', 'reg_alpha': 0.7520786593536704, 'aci_step_size': 0.15578730790519463, 'oob_split_ratio': 0.6381892797579897}. Best is trial 25 with value: 0.030603792302848206.\n",
      "[I 2026-07-02 14:58:20,853] Trial 186 finished with value: 0.03362018279788542 and parameters: {'reservoir_size': 20, 'spectral_radius': 1.4784099282761571, 'ar_lags': 2, 'foundation_window': 8, 'regressor_type': 'ElasticNet', 'reg_alpha': 0.9137599008438971, 'aci_step_size': 0.1725601704742975, 'oob_split_ratio': 0.8017576526716425}. Best is trial 25 with value: 0.030603792302848206.\n",
      "[I 2026-07-02 14:58:20,927] Trial 187 finished with value: 0.03468157031752848 and parameters: {'reservoir_size': 81, 'spectral_radius': 0.8804944807646572, 'ar_lags': 2, 'foundation_window': 8, 'regressor_type': 'ElasticNet', 'reg_alpha': 0.3658097553104987, 'aci_step_size': 0.14469869049102255, 'oob_split_ratio': 0.630868549615051}. Best is trial 25 with value: 0.030603792302848206.\n",
      "[I 2026-07-02 14:58:21,002] Trial 188 finished with value: 0.032628131996981606 and parameters: {'reservoir_size': 53, 'spectral_radius': 1.4103364078434917, 'ar_lags': 2, 'foundation_window': 7, 'regressor_type': 'Lasso', 'reg_alpha': 0.46054150095350604, 'aci_step_size': 0.18815750304493759, 'oob_split_ratio': 0.6489498556264923}. Best is trial 25 with value: 0.030603792302848206.\n",
      "[I 2026-07-02 14:58:21,074] Trial 189 finished with value: 0.03267338899975907 and parameters: {'reservoir_size': 69, 'spectral_radius': 1.3364116416116816, 'ar_lags': 2, 'foundation_window': 9, 'regressor_type': 'Ridge', 'reg_alpha': 0.5129455907599572, 'aci_step_size': 0.13905031643736393, 'oob_split_ratio': 0.6607119392772621}. Best is trial 25 with value: 0.030603792302848206.\n",
      "[I 2026-07-02 14:58:21,171] Trial 190 finished with value: 0.03173162813123632 and parameters: {'reservoir_size': 25, 'spectral_radius': 1.369110136172373, 'ar_lags': 2, 'foundation_window': 8, 'regressor_type': 'ElasticNet', 'reg_alpha': 2.001310268397831, 'aci_step_size': 0.18402690954699258, 'oob_split_ratio': 0.6431856615850785}. Best is trial 25 with value: 0.030603792302848206.\n",
      "[I 2026-07-02 14:58:21,284] Trial 191 finished with value: 0.03173162813123632 and parameters: {'reservoir_size': 45, 'spectral_radius': 1.2063963632981596, 'ar_lags': 2, 'foundation_window': 8, 'regressor_type': 'ElasticNet', 'reg_alpha': 0.580394105225348, 'aci_step_size': 0.13549082274125107, 'oob_split_ratio': 0.6537728075131004}. Best is trial 25 with value: 0.030603792302848206.\n",
      "[I 2026-07-02 14:58:21,399] Trial 192 finished with value: 0.03173162813123632 and parameters: {'reservoir_size': 37, 'spectral_radius': 1.203102552841775, 'ar_lags': 2, 'foundation_window': 8, 'regressor_type': 'ElasticNet', 'reg_alpha': 0.6353308106456644, 'aci_step_size': 0.13355771529398489, 'oob_split_ratio': 0.6572309165576903}. Best is trial 25 with value: 0.030603792302848206.\n",
      "[I 2026-07-02 14:58:21,520] Trial 193 finished with value: 0.03173162813123632 and parameters: {'reservoir_size': 48, 'spectral_radius': 1.1875140080941244, 'ar_lags': 2, 'foundation_window': 8, 'regressor_type': 'ElasticNet', 'reg_alpha': 0.3788651034954429, 'aci_step_size': 0.127796908089258, 'oob_split_ratio': 0.6501799539111454}. Best is trial 25 with value: 0.030603792302848206.\n",
      "[I 2026-07-02 14:58:21,624] Trial 194 finished with value: 0.03173162813123632 and parameters: {'reservoir_size': 42, 'spectral_radius': 1.1470600544772096, 'ar_lags': 2, 'foundation_window': 8, 'regressor_type': 'ElasticNet', 'reg_alpha': 0.5358816599479348, 'aci_step_size': 0.14554092913054253, 'oob_split_ratio': 0.6440512803300532}. Best is trial 25 with value: 0.030603792302848206.\n",
      "[I 2026-07-02 14:58:21,719] Trial 195 finished with value: 0.034069631154610945 and parameters: {'reservoir_size': 89, 'spectral_radius': 1.2227184665077644, 'ar_lags': 2, 'foundation_window': 8, 'regressor_type': 'ElasticNet', 'reg_alpha': 0.2212612100253422, 'aci_step_size': 0.13044786116456206, 'oob_split_ratio': 0.6381655274051337}. Best is trial 25 with value: 0.030603792302848206.\n",
      "[I 2026-07-02 14:58:21,796] Trial 196 finished with value: 0.03223178562808165 and parameters: {'reservoir_size': 31, 'spectral_radius': 1.436636094295882, 'ar_lags': 2, 'foundation_window': 9, 'regressor_type': 'ElasticNet', 'reg_alpha': 0.3090959311125587, 'aci_step_size': 0.17934268044573531, 'oob_split_ratio': 0.6526329283634651}. Best is trial 25 with value: 0.030603792302848206.\n",
      "[I 2026-07-02 14:58:21,881] Trial 197 finished with value: 0.033149782991759164 and parameters: {'reservoir_size': 57, 'spectral_radius': 1.3018461741090568, 'ar_lags': 2, 'foundation_window': 8, 'regressor_type': 'ElasticNet', 'reg_alpha': 0.26802881753007995, 'aci_step_size': 0.13812691560344825, 'oob_split_ratio': 0.6463338497016985}. Best is trial 25 with value: 0.030603792302848206.\n",
      "[I 2026-07-02 14:58:21,952] Trial 198 finished with value: 0.03468157031752848 and parameters: {'reservoir_size': 62, 'spectral_radius': 1.4627319437485653, 'ar_lags': 2, 'foundation_window': 8, 'regressor_type': 'ElasticNet', 'reg_alpha': 2.480027688867865, 'aci_step_size': 0.19678261316872994, 'oob_split_ratio': 0.6258302304152666}. Best is trial 25 with value: 0.030603792302848206.\n",
      "[I 2026-07-02 14:58:22,029] Trial 199 finished with value: 0.033726622673748465 and parameters: {'reservoir_size': 40, 'spectral_radius': 1.248238907387657, 'ar_lags': 2, 'foundation_window': 9, 'regressor_type': 'ElasticNet', 'reg_alpha': 0.4072075150918791, 'aci_step_size': 0.15150375751446393, 'oob_split_ratio': 0.661841950297742}. Best is trial 25 with value: 0.030603792302848206.\n",
      "[I 2026-07-02 14:58:22,136] Trial 200 finished with value: 0.03173162813123632 and parameters: {'reservoir_size': 1, 'spectral_radius': 1.269043220306514, 'ar_lags': 2, 'foundation_window': 8, 'regressor_type': 'ElasticNet', 'reg_alpha': 0.33398900775785706, 'aci_step_size': 0.1093332695372754, 'oob_split_ratio': 0.6407945949023514}. Best is trial 25 with value: 0.030603792302848206.\n",
      "[I 2026-07-02 14:58:22,243] Trial 201 finished with value: 0.03173162813123632 and parameters: {'reservoir_size': 42, 'spectral_radius': 1.3541930809965201, 'ar_lags': 2, 'foundation_window': 8, 'regressor_type': 'ElasticNet', 'reg_alpha': 0.4478727383695192, 'aci_step_size': 0.14760049899372854, 'oob_split_ratio': 0.6495666865954788}. Best is trial 25 with value: 0.030603792302848206.\n",
      "[I 2026-07-02 14:58:22,352] Trial 202 finished with value: 0.03173162813123632 and parameters: {'reservoir_size': 46, 'spectral_radius': 1.3194238495785464, 'ar_lags': 2, 'foundation_window': 8, 'regressor_type': 'ElasticNet', 'reg_alpha': 0.4838411008870164, 'aci_step_size': 0.15312309023374818, 'oob_split_ratio': 0.654615940878233}. Best is trial 25 with value: 0.030603792302848206.\n",
      "[I 2026-07-02 14:58:22,464] Trial 203 finished with value: 0.03173162813123632 and parameters: {'reservoir_size': 36, 'spectral_radius': 1.396749410046347, 'ar_lags': 2, 'foundation_window': 8, 'regressor_type': 'ElasticNet', 'reg_alpha': 0.4164106582720676, 'aci_step_size': 0.14576961794620463, 'oob_split_ratio': 0.634435220381007}. Best is trial 25 with value: 0.030603792302848206.\n",
      "[I 2026-07-02 14:58:22,578] Trial 204 finished with value: 0.03173162813123632 and parameters: {'reservoir_size': 52, 'spectral_radius': 1.3721700016689085, 'ar_lags': 2, 'foundation_window': 8, 'regressor_type': 'ElasticNet', 'reg_alpha': 0.6498795712075547, 'aci_step_size': 0.14074167828499376, 'oob_split_ratio': 0.6496644291498503}. Best is trial 25 with value: 0.030603792302848206.\n",
      "[I 2026-07-02 14:58:22,687] Trial 205 finished with value: 0.03173162813123632 and parameters: {'reservoir_size': 31, 'spectral_radius': 1.3419337544020289, 'ar_lags': 2, 'foundation_window': 8, 'regressor_type': 'ElasticNet', 'reg_alpha': 0.7302334615354317, 'aci_step_size': 0.19256557142687222, 'oob_split_ratio': 0.6575851859000202}. Best is trial 25 with value: 0.030603792302848206.\n",
      "[I 2026-07-02 14:58:22,810] Trial 206 finished with value: 0.03173162813123632 and parameters: {'reservoir_size': 48, 'spectral_radius': 1.229193202179653, 'ar_lags': 2, 'foundation_window': 8, 'regressor_type': 'ElasticNet', 'reg_alpha': 0.5315357953576612, 'aci_step_size': 0.14279013712456243, 'oob_split_ratio': 0.6445802487079537}. Best is trial 25 with value: 0.030603792302848206.\n",
      "[I 2026-07-02 14:58:22,910] Trial 207 finished with value: 0.03291645046054551 and parameters: {'reservoir_size': 43, 'spectral_radius': 1.4336488226402833, 'ar_lags': 2, 'foundation_window': 4, 'regressor_type': 'ElasticNet', 'reg_alpha': 0.35220774454872716, 'aci_step_size': 0.15696015606385194, 'oob_split_ratio': 0.6396569884713798}. Best is trial 25 with value: 0.030603792302848206.\n",
      "[I 2026-07-02 14:58:23,041] Trial 208 finished with value: 0.033438877485357586 and parameters: {'reservoir_size': 25, 'spectral_radius': 1.1628037337433526, 'ar_lags': 2, 'foundation_window': 5, 'regressor_type': 'Ridge', 'reg_alpha': 0.24650975138334308, 'aci_step_size': 0.12314346139222089, 'oob_split_ratio': 0.6514337594819022}. Best is trial 25 with value: 0.030603792302848206.\n",
      "[I 2026-07-02 14:58:23,149] Trial 209 finished with value: 0.03173162813123632 and parameters: {'reservoir_size': 57, 'spectral_radius': 1.2949282624660998, 'ar_lags': 2, 'foundation_window': 8, 'regressor_type': 'ElasticNet', 'reg_alpha': 0.448086837655931, 'aci_step_size': 0.13638652821557487, 'oob_split_ratio': 0.6457434310534373}. Best is trial 25 with value: 0.030603792302848206.\n",
      "[I 2026-07-02 14:58:23,260] Trial 210 finished with value: 0.03435139139465681 and parameters: {'reservoir_size': 51, 'spectral_radius': 1.403645826884362, 'ar_lags': 2, 'foundation_window': 9, 'regressor_type': 'ElasticNet', 'reg_alpha': 0.1819909245191415, 'aci_step_size': 0.14887805672157892, 'oob_split_ratio': 0.6301289979354049}. Best is trial 25 with value: 0.030603792302848206.\n",
      "[I 2026-07-02 14:58:23,386] Trial 211 finished with value: 0.03173162813123632 and parameters: {'reservoir_size': 74, 'spectral_radius': 1.3639513509759351, 'ar_lags': 2, 'foundation_window': 8, 'regressor_type': 'ElasticNet', 'reg_alpha': 1.5886177663423775, 'aci_step_size': 0.16128480277351662, 'oob_split_ratio': 0.6422844375663881}. Best is trial 25 with value: 0.030603792302848206.\n",
      "[I 2026-07-02 14:58:23,529] Trial 212 finished with value: 0.03217426294663132 and parameters: {'reservoir_size': 70, 'spectral_radius': 1.3321870152768063, 'ar_lags': 2, 'foundation_window': 6, 'regressor_type': 'ElasticNet', 'reg_alpha': 1.756557699057223, 'aci_step_size': 0.16787938985308642, 'oob_split_ratio': 0.6365921034713244}. Best is trial 25 with value: 0.030603792302848206.\n",
      "[I 2026-07-02 14:58:23,642] Trial 213 finished with value: 0.03173162813123632 and parameters: {'reservoir_size': 77, 'spectral_radius': 1.3830348773707555, 'ar_lags': 2, 'foundation_window': 8, 'regressor_type': 'ElasticNet', 'reg_alpha': 1.4104059197892274, 'aci_step_size': 0.1583723025174391, 'oob_split_ratio': 0.6571177224734407}. Best is trial 25 with value: 0.030603792302848206.\n",
      "[I 2026-07-02 14:58:23,755] Trial 214 finished with value: 0.03173162813123632 and parameters: {'reservoir_size': 34, 'spectral_radius': 1.417562506704088, 'ar_lags': 2, 'foundation_window': 8, 'regressor_type': 'ElasticNet', 'reg_alpha': 2.10343018981724, 'aci_step_size': 0.15356631542590077, 'oob_split_ratio': 0.6469889292444448}. Best is trial 25 with value: 0.030603792302848206.\n",
      "[I 2026-07-02 14:58:23,851] Trial 215 finished with value: 0.03362018279788542 and parameters: {'reservoir_size': 67, 'spectral_radius': 1.3753420399949063, 'ar_lags': 2, 'foundation_window': 8, 'regressor_type': 'ElasticNet', 'reg_alpha': 1.7205470433096972, 'aci_step_size': 0.1650958406741676, 'oob_split_ratio': 0.6642578857324568}. Best is trial 25 with value: 0.030603792302848206.\n",
      "[I 2026-07-02 14:58:23,927] Trial 216 finished with value: 0.034557462028994776 and parameters: {'reservoir_size': 40, 'spectral_radius': 1.4510502072893114, 'ar_lags': 2, 'foundation_window': 8, 'regressor_type': 'ElasticNet', 'reg_alpha': 0.301147205990457, 'aci_step_size': 0.15848053760623904, 'oob_split_ratio': 0.6420699480572493}. Best is trial 25 with value: 0.030603792302848206.\n",
      "[I 2026-07-02 14:58:24,043] Trial 217 finished with value: 0.03173162813123632 and parameters: {'reservoir_size': 62, 'spectral_radius': 1.1951404140508866, 'ar_lags': 2, 'foundation_window': 8, 'regressor_type': 'ElasticNet', 'reg_alpha': 0.5701832886029508, 'aci_step_size': 0.14969263662643184, 'oob_split_ratio': 0.6528856610718076}. Best is trial 25 with value: 0.030603792302848206.\n",
      "[I 2026-07-02 14:58:24,145] Trial 218 finished with value: 0.03173162813123632 and parameters: {'reservoir_size': 27, 'spectral_radius': 1.3457704239238018, 'ar_lags': 2, 'foundation_window': 8, 'regressor_type': 'ElasticNet', 'reg_alpha': 1.0053674650258348, 'aci_step_size': 0.1439981160818527, 'oob_split_ratio': 0.6343811698488597}. Best is trial 25 with value: 0.030603792302848206.\n",
      "[I 2026-07-02 14:58:24,247] Trial 219 finished with value: 0.03173162813123632 and parameters: {'reservoir_size': 16, 'spectral_radius': 1.31213577662426, 'ar_lags': 2, 'foundation_window': 8, 'regressor_type': 'ElasticNet', 'reg_alpha': 1.1691360869233862, 'aci_step_size': 0.15446734664515988, 'oob_split_ratio': 0.6477595676759841}. Best is trial 25 with value: 0.030603792302848206.\n",
