      "[I 2026-07-02 16:32:54,802] Trial 31 finished with value: 0.007086904377935788 and parameters: {'foundation_window': 8, 'ar_lags': 2, 'ema_spans': (2, 3, 5, 8), 'conv_scales': (2, 4, 8), 'use_calendar': True, 'ridge_alpha': 0.032903397715322476, 'shrinkage_max': 1.5248978473156434, 'oob_split_ratio': 0.7340546589240182}. Best is trial 25 with value: 0.006927674811006591.\n",
      "[I 2026-07-02 16:32:54,947] Trial 32 finished with value: 0.006783830178416005 and parameters: {'foundation_window': 8, 'ar_lags': 2, 'ema_spans': (2, 3, 5, 8), 'conv_scales': (2, 4, 8), 'use_calendar': True, 'ridge_alpha': 0.0066007879427957585, 'shrinkage_max': 1.4428203521647553, 'oob_split_ratio': 0.7735944108479981}. Best is trial 32 with value: 0.006783830178416005.\n",
      "[I 2026-07-02 16:32:55,094] Trial 33 finished with value: 0.009399004819676805 and parameters: {'foundation_window': 6, 'ar_lags': 1, 'ema_spans': (2, 3, 5, 8), 'conv_scales': (2, 4, 8), 'use_calendar': True, 'ridge_alpha': 0.0033734648244232368, 'shrinkage_max': 1.5283910371820746, 'oob_split_ratio': 0.7742416275957525}. Best is trial 32 with value: 0.006783830178416005.\n",
      "[I 2026-07-02 16:32:55,240] Trial 34 finished with value: 0.0067581930995577804 and parameters: {'foundation_window': 8, 'ar_lags': 2, 'ema_spans': (2, 3, 5, 8), 'conv_scales': (2, 4, 8), 'use_calendar': True, 'ridge_alpha': 0.0062548124752015025, 'shrinkage_max': 0.9822822227189397, 'oob_split_ratio': 0.7766288890689893}. Best is trial 34 with value: 0.0067581930995577804.\n",
      "[I 2026-07-02 16:32:55,386] Trial 35 finished with value: 0.009022861678092244 and parameters: {'foundation_window': 2, 'ar_lags': 1, 'ema_spans': (2, 3, 5, 8), 'conv_scales': (2, 4, 8), 'use_calendar': True, 'ridge_alpha': 0.0010648608905881696, 'shrinkage_max': 0.9616816204083011, 'oob_split_ratio': 0.7960678012152008}. Best is trial 34 with value: 0.0067581930995577804.\n",
      "[I 2026-07-02 16:32:55,525] Trial 36 finished with value: 0.009971060304708882 and parameters: {'foundation_window': 8, 'ar_lags': 2, 'ema_spans': (2, 3, 5, 8), 'conv_scales': (2, 4, 8), 'use_calendar': False, 'ridge_alpha': 0.00665682803662748, 'shrinkage_max': 1.0930517473349248, 'oob_split_ratio': 0.77426261066471}. Best is trial 34 with value: 0.0067581930995577804.\n",
      "[I 2026-07-02 16:32:55,670] Trial 37 finished with value: 0.012627685554576657 and parameters: {'foundation_window': 4, 'ar_lags': 2, 'ema_spans': (2, 3, 5, 8), 'conv_scales': (2, 4, 8), 'use_calendar': True, 'ridge_alpha': 0.002998433037186121, 'shrinkage_max': 0.6477461858218755, 'oob_split_ratio': 0.7601907453139608}. Best is trial 34 with value: 0.0067581930995577804.\n",
      "[I 2026-07-02 16:32:55,814] Trial 38 finished with value: 0.0097055069463558 and parameters: {'foundation_window': 7, 'ar_lags': 1, 'ema_spans': (2, 3, 5, 8), 'conv_scales': (2, 4, 8), 'use_calendar': False, 'ridge_alpha': 0.008324439824864622, 'shrinkage_max': 1.783473519386999, 'oob_split_ratio': 0.7866871799237058}. Best is trial 34 with value: 0.0067581930995577804.\n",
      "[I 2026-07-02 16:32:55,957] Trial 39 finished with value: 0.008074695207305551 and parameters: {'foundation_window': 9, 'ar_lags': 2, 'ema_spans': (2, 4, 8), 'conv_scales': (2, 4, 8), 'use_calendar': True, 'ridge_alpha': 0.05512802322589243, 'shrinkage_max': 0.8762548079753236, 'oob_split_ratio': 0.7450982770444022}. Best is trial 34 with value: 0.0067581930995577804.\n",
      "[I 2026-07-02 16:32:56,105] Trial 40 finished with value: 0.00886744002267145 and parameters: {'foundation_window': 6, 'ar_lags': 1, 'ema_spans': (2, 3, 5, 8), 'conv_scales': (2, 4, 8), 'use_calendar': True, 'ridge_alpha': 0.0019070528198696925, 'shrinkage_max': 0.5419788105808323, 'oob_split_ratio': 0.6983141337370945}. Best is trial 34 with value: 0.0067581930995577804.\n",
      "[I 2026-07-02 16:32:56,248] Trial 41 finished with value: 0.007162341555030985 and parameters: {'foundation_window': 8, 'ar_lags': 2, 'ema_spans': (2, 3, 5, 8), 'conv_scales': (2, 4, 8), 'use_calendar': True, 'ridge_alpha': 0.03570886762359217, 'shrinkage_max': 1.41691073466572, 'oob_split_ratio': 0.7589913176786003}. Best is trial 34 with value: 0.0067581930995577804.\n",
      "[I 2026-07-02 16:32:56,392] Trial 42 finished with value: 0.006825225061183008 and parameters: {'foundation_window': 8, 'ar_lags': 2, 'ema_spans': (2, 3, 5, 8), 'conv_scales': (2, 4, 8), 'use_calendar': True, 'ridge_alpha': 0.011799076911402468, 'shrinkage_max': 1.4196680037368978, 'oob_split_ratio': 0.7876860975204912}. Best is trial 34 with value: 0.0067581930995577804.\n",
      "[I 2026-07-02 16:32:56,533] Trial 43 finished with value: 0.010567896538507838 and parameters: {'foundation_window': 7, 'ar_lags': 3, 'ema_spans': (2, 3, 5, 8), 'conv_scales': (2, 4, 8), 'use_calendar': True, 'ridge_alpha': 0.005484129296728293, 'shrinkage_max': 1.641462290564752, 'oob_split_ratio': 0.7871117453552534}. Best is trial 34 with value: 0.0067581930995577804.\n",
      "[I 2026-07-02 16:32:56,673] Trial 44 finished with value: 0.006788124491245193 and parameters: {'foundation_window': 9, 'ar_lags': 2, 'ema_spans': (2, 3, 5, 8), 'conv_scales': (2, 4, 8), 'use_calendar': True, 'ridge_alpha': 0.011159696003676873, 'shrinkage_max': 1.0923003197403087, 'oob_split_ratio': 0.7814917577293178}. Best is trial 34 with value: 0.0067581930995577804.\n",
      "[I 2026-07-02 16:32:56,805] Trial 45 finished with value: 0.0075819563296856685 and parameters: {'foundation_window': 9, 'ar_lags': 2, 'ema_spans': (3, 6), 'conv_scales': (3, 6, 12), 'use_calendar': False, 'ridge_alpha': 0.013414308953444936, 'shrinkage_max': 1.0206168450889481, 'oob_split_ratio': 0.7976040048118828}. Best is trial 34 with value: 0.0067581930995577804.\n",
      "[I 2026-07-02 16:32:56,937] Trial 46 finished with value: 0.007827653404974148 and parameters: {'foundation_window': 9, 'ar_lags': 3, 'ema_spans': (2, 3, 5, 8), 'conv_scales': (3, 6), 'use_calendar': True, 'ridge_alpha': 0.003985885448793313, 'shrinkage_max': 0.8151064167202138, 'oob_split_ratio': 0.7753446280479177}. Best is trial 34 with value: 0.0067581930995577804.\n",
      "[I 2026-07-02 16:32:57,076] Trial 47 finished with value: 0.008168581915359607 and parameters: {'foundation_window': 11, 'ar_lags': 1, 'ema_spans': (2, 4, 8), 'conv_scales': (2, 4, 8), 'use_calendar': True, 'ridge_alpha': 0.00193174117947311, 'shrinkage_max': 0.6963077479740085, 'oob_split_ratio': 0.783248804478045}. Best is trial 34 with value: 0.0067581930995577804.\n",
      "[I 2026-07-02 16:32:57,217] Trial 48 finished with value: 0.007598804602109673 and parameters: {'foundation_window': 10, 'ar_lags': 2, 'ema_spans': (2, 3, 5, 8), 'conv_scales': (2, 4, 8), 'use_calendar': True, 'ridge_alpha': 0.011441124519156543, 'shrinkage_max': 1.3735911954571294, 'oob_split_ratio': 0.7644524641702422}. Best is trial 34 with value: 0.0067581930995577804.\n",
      "[I 2026-07-02 16:32:57,352] Trial 49 finished with value: 0.012503963857486311 and parameters: {'foundation_window': 7, 'ar_lags': 3, 'ema_spans': (3, 6), 'conv_scales': (2, 4, 8), 'use_calendar': False, 'ridge_alpha': 0.24961596833488636, 'shrinkage_max': 1.120134230035023, 'oob_split_ratio': 0.5704298408153026}. Best is trial 34 with value: 0.0067581930995577804.\n",
      "[I 2026-07-02 16:32:57,484] Trial 50 finished with value: 0.008390021247225552 and parameters: {'foundation_window': 7, 'ar_lags': 2, 'ema_spans': (2, 3, 5, 8), 'conv_scales': (3, 6), 'use_calendar': True, 'ridge_alpha': 0.08038907325967704, 'shrinkage_max': 0.2722304149039796, 'oob_split_ratio': 0.7812528754337047}. Best is trial 34 with value: 0.0067581930995577804.\n",
      "[I 2026-07-02 16:32:57,630] Trial 51 finished with value: 0.006975389080634279 and parameters: {'foundation_window': 8, 'ar_lags': 2, 'ema_spans': (2, 3, 5, 8), 'conv_scales': (2, 4, 8), 'use_calendar': True, 'ridge_alpha': 0.005288166221244222, 'shrinkage_max': 1.4907864909709352, 'oob_split_ratio': 0.7663695803084134}. Best is trial 34 with value: 0.0067581930995577804.\n",
      "[I 2026-07-02 16:32:57,775] Trial 52 finished with value: 0.007966292232882847 and parameters: {'foundation_window': 9, 'ar_lags': 2, 'ema_spans': (2, 3, 5, 8), 'conv_scales': (2, 4, 8), 'use_calendar': True, 'ridge_alpha': 0.005026548352327851, 'shrinkage_max': 0.5216756161509114, 'oob_split_ratio': 0.7682476132692695}. Best is trial 34 with value: 0.0067581930995577804.\n",
      "[I 2026-07-02 16:32:57,919] Trial 53 finished with value: 0.007267153745117564 and parameters: {'foundation_window': 8, 'ar_lags': 2, 'ema_spans': (2, 3, 5, 8), 'conv_scales': (2, 4, 8), 'use_calendar': True, 'ridge_alpha': 0.0021949064011311087, 'shrinkage_max': 1.869416445753836, 'oob_split_ratio': 0.7509721348174937}. Best is trial 34 with value: 0.0067581930995577804.\n",
      "[I 2026-07-02 16:32:58,061] Trial 54 finished with value: 0.009232011847736015 and parameters: {'foundation_window': 10, 'ar_lags': 3, 'ema_spans': (2, 3, 5, 8), 'conv_scales': (2, 4, 8), 'use_calendar': True, 'ridge_alpha': 0.008853808400011447, 'shrinkage_max': 1.2194886223483934, 'oob_split_ratio': 0.795771659332953}. Best is trial 34 with value: 0.0067581930995577804.\n",
      "[I 2026-07-02 16:32:58,199] Trial 55 finished with value: 0.008474224549829006 and parameters: {'foundation_window': 9, 'ar_lags': 1, 'ema_spans': (2, 4, 8), 'conv_scales': (3, 6, 12), 'use_calendar': True, 'ridge_alpha': 0.00974123029136461, 'shrinkage_max': 1.0311734996286452, 'oob_split_ratio': 0.6041512217362823}. Best is trial 34 with value: 0.0067581930995577804.\n",
      "[I 2026-07-02 16:32:58,331] Trial 56 finished with value: 0.0073684132624418875 and parameters: {'foundation_window': 8, 'ar_lags': 2, 'ema_spans': (2, 4), 'conv_scales': (2, 3, 4), 'use_calendar': True, 'ridge_alpha': 0.728411886321837, 'shrinkage_max': 1.3443528609736621, 'oob_split_ratio': 0.7475944789231852}. Best is trial 34 with value: 0.0067581930995577804.\n",
      "[I 2026-07-02 16:32:58,475] Trial 57 finished with value: 0.008819641515393122 and parameters: {'foundation_window': 7, 'ar_lags': 2, 'ema_spans': (2, 3, 5, 8), 'conv_scales': (2, 4, 8), 'use_calendar': True, 'ridge_alpha': 0.00522742876249313, 'shrinkage_max': 0.8678857060787011, 'oob_split_ratio': 0.7673302416836181}. Best is trial 34 with value: 0.0067581930995577804.\n",
      "[I 2026-07-02 16:32:58,616] Trial 58 finished with value: 0.007342704907339643 and parameters: {'foundation_window': 10, 'ar_lags': 3, 'ema_spans': (2, 3, 5, 8), 'conv_scales': (2, 4, 8), 'use_calendar': True, 'ridge_alpha': 0.022999572003771104, 'shrinkage_max': 1.4664027864671327, 'oob_split_ratio': 0.7891565497671233}. Best is trial 34 with value: 0.0067581930995577804.\n",
      "[I 2026-07-02 16:32:58,756] Trial 59 finished with value: 0.00953718582833508 and parameters: {'foundation_window': 6, 'ar_lags': 1, 'ema_spans': (2, 3, 5, 8), 'conv_scales': (2, 4, 8), 'use_calendar': True, 'ridge_alpha': 0.002829286296240458, 'shrinkage_max': 1.6397090666008065, 'oob_split_ratio': 0.7998831163956275}. Best is trial 34 with value: 0.0067581930995577804.\n",
      "[I 2026-07-02 16:32:58,894] Trial 60 finished with value: 0.008921924383537496 and parameters: {'foundation_window': 7, 'ar_lags': 2, 'ema_spans': (3, 6), 'conv_scales': (2, 4, 8), 'use_calendar': True, 'ridge_alpha': 0.06434398786858364, 'shrinkage_max': 2.0438523003324893, 'oob_split_ratio': 0.779917181928298}. Best is trial 34 with value: 0.0067581930995577804.\n",
      "[I 2026-07-02 16:32:59,043] Trial 61 finished with value: 0.0072723652542222616 and parameters: {'foundation_window': 8, 'ar_lags': 2, 'ema_spans': (2, 3, 5, 8), 'conv_scales': (2, 4, 8), 'use_calendar': True, 'ridge_alpha': 0.017294906152162597, 'shrinkage_max': 1.5167875387917595, 'oob_split_ratio': 0.7004250462477343}. Best is trial 34 with value: 0.0067581930995577804.\n",
      "[I 2026-07-02 16:32:59,188] Trial 62 finished with value: 0.007293956854741937 and parameters: {'foundation_window': 8, 'ar_lags': 2, 'ema_spans': (2, 3, 5, 8), 'conv_scales': (2, 4, 8), 'use_calendar': True, 'ridge_alpha': 0.03976166921898743, 'shrinkage_max': 1.7513642548660826, 'oob_split_ratio': 0.7581561142314189}. Best is trial 34 with value: 0.0067581930995577804.\n",
      "[I 2026-07-02 16:32:59,331] Trial 63 finished with value: 0.006696767576372958 and parameters: {'foundation_window': 9, 'ar_lags': 2, 'ema_spans': (2, 3, 5, 8), 'conv_scales': (2, 4, 8), 'use_calendar': True, 'ridge_alpha': 0.0922374140397089, 'shrinkage_max': 1.6065241728120794, 'oob_split_ratio': 0.7695761071416884}. Best is trial 63 with value: 0.006696767576372958.\n",
      "[I 2026-07-02 16:32:59,475] Trial 64 finished with value: 0.007694505998174221 and parameters: {'foundation_window': 9, 'ar_lags': 2, 'ema_spans': (2, 3, 5, 8), 'conv_scales': (2, 3, 4), 'use_calendar': True, 'ridge_alpha': 0.256745054357268, 'shrinkage_max': 1.1603247581252198, 'oob_split_ratio': 0.7416277249859113}. Best is trial 63 with value: 0.006696767576372958.\n",
      "[I 2026-07-02 16:32:59,603] Trial 65 finished with value: 0.019874777547013552 and parameters: {'foundation_window': 9, 'ar_lags': 2, 'ema_spans': (2, 4), 'conv_scales': (3, 6), 'use_calendar': True, 'ridge_alpha': 0.4340541478152973, 'shrinkage_max': 2.4029010430686437, 'oob_split_ratio': 0.7203164124345921}. Best is trial 63 with value: 0.006696767576372958.\n",
      "[I 2026-07-02 16:32:59,747] Trial 66 finished with value: 0.0063932651022736734 and parameters: {'foundation_window': 10, 'ar_lags': 6, 'ema_spans': (2, 3, 5, 8), 'conv_scales': (2, 4, 8), 'use_calendar': True, 'ridge_alpha': 0.006072173884843789, 'shrinkage_max': 1.614759565182517, 'oob_split_ratio': 0.7695013546619496}. Best is trial 66 with value: 0.0063932651022736734.\n",
      "[I 2026-07-02 16:32:59,894] Trial 67 finished with value: 0.009319887318099252 and parameters: {'foundation_window': 11, 'ar_lags': 6, 'ema_spans': (2, 3, 5, 8), 'conv_scales': (3, 6, 12), 'use_calendar': True, 'ridge_alpha': 0.0902761128220818, 'shrinkage_max': 1.9288457095968272, 'oob_split_ratio': 0.7786518681710639}. Best is trial 66 with value: 0.0063932651022736734.\n",
      "[I 2026-07-02 16:33:00,046] Trial 68 finished with value: 0.008583463979845189 and parameters: {'foundation_window': 12, 'ar_lags': 5, 'ema_spans': (2, 3, 5, 8), 'conv_scales': (2, 4, 8), 'use_calendar': False, 'ridge_alpha': 0.8581483133701646, 'shrinkage_max': 2.12766286285616, 'oob_split_ratio': 0.7541602680179295}. Best is trial 66 with value: 0.0063932651022736734.\n",
      "[I 2026-07-02 16:33:00,219] Trial 69 finished with value: 0.007626071589313596 and parameters: {'foundation_window': 10, 'ar_lags': 4, 'ema_spans': (2, 3, 5, 8), 'conv_scales': (2, 4, 8), 'use_calendar': True, 'ridge_alpha': 0.19504750027373846, 'shrinkage_max': 1.6076440772528797, 'oob_split_ratio': 0.6198334720947818}. Best is trial 66 with value: 0.0063932651022736734.\n",
      "[I 2026-07-02 16:33:00,364] Trial 70 finished with value: 0.006131238982864626 and parameters: {'foundation_window': 10, 'ar_lags': 6, 'ema_spans': (2, 3, 5, 8), 'conv_scales': (2, 4, 8), 'use_calendar': True, 'ridge_alpha': 0.018752562716612384, 'shrinkage_max': 1.717732183486995, 'oob_split_ratio': 0.771412584172905}. Best is trial 70 with value: 0.006131238982864626.\n",
      "[I 2026-07-02 16:33:00,509] Trial 71 finished with value: 0.0063632252036071825 and parameters: {'foundation_window': 10, 'ar_lags': 6, 'ema_spans': (2, 3, 5, 8), 'conv_scales': (2, 4, 8), 'use_calendar': True, 'ridge_alpha': 0.019396692319851715, 'shrinkage_max': 1.7459178922268945, 'oob_split_ratio': 0.7713490638420524}. Best is trial 70 with value: 0.006131238982864626.\n",
      "[I 2026-07-02 16:33:00,651] Trial 72 finished with value: 0.018338400799248256 and parameters: {'foundation_window': 11, 'ar_lags': 6, 'ema_spans': (2, 3, 5, 8), 'conv_scales': (2, 4, 8), 'use_calendar': True, 'ridge_alpha': 0.02172657437964278, 'shrinkage_max': 1.7853255075877204, 'oob_split_ratio': 0.770041746238207}. Best is trial 70 with value: 0.006131238982864626.\n",
      "[I 2026-07-02 16:33:00,794] Trial 73 finished with value: 0.0063603873038027845 and parameters: {'foundation_window': 10, 'ar_lags': 6, 'ema_spans': (2, 3, 5, 8), 'conv_scales': (2, 4, 8), 'use_calendar': True, 'ridge_alpha': 0.012459016880297803, 'shrinkage_max': 1.702700306948195, 'oob_split_ratio': 0.7912101278581717}. Best is trial 70 with value: 0.006131238982864626.\n",
      "[I 2026-07-02 16:33:00,942] Trial 74 finished with value: 0.0063247051738954466 and parameters: {'foundation_window': 10, 'ar_lags': 6, 'ema_spans': (2, 3, 5, 8), 'conv_scales': (2, 4, 8), 'use_calendar': True, 'ridge_alpha': 0.007647896643973177, 'shrinkage_max': 1.7157496301995305, 'oob_split_ratio': 0.7915381544940271}. Best is trial 70 with value: 0.006131238982864626.\n",
      "[I 2026-07-02 16:33:01,091] Trial 75 finished with value: 0.006325174216605163 and parameters: {'foundation_window': 10, 'ar_lags': 6, 'ema_spans': (2, 3, 5, 8), 'conv_scales': (2, 4, 8), 'use_calendar': True, 'ridge_alpha': 0.007115499736095555, 'shrinkage_max': 1.7112531864036173, 'oob_split_ratio': 0.7910558413262327}. Best is trial 70 with value: 0.006131238982864626.\n",
      "[I 2026-07-02 16:33:01,233] Trial 76 finished with value: 0.006328282458309437 and parameters: {'foundation_window': 10, 'ar_lags': 6, 'ema_spans': (2, 4, 8), 'conv_scales': (2, 4, 8), 'use_calendar': True, 'ridge_alpha': 0.003940799478438274, 'shrinkage_max': 1.719228446288866, 'oob_split_ratio': 0.7908133720118549}. Best is trial 70 with value: 0.006131238982864626.\n",
      "[I 2026-07-02 16:33:01,380] Trial 77 finished with value: 0.009785598910133439 and parameters: {'foundation_window': 11, 'ar_lags': 6, 'ema_spans': (2, 4, 8), 'conv_scales': (2, 3, 4), 'use_calendar': True, 'ridge_alpha': 0.017530987721369184, 'shrinkage_max': 1.714783129498593, 'oob_split_ratio': 0.7921321649117722}. Best is trial 70 with value: 0.006131238982864626.\n",
      "[I 2026-07-02 16:33:01,519] Trial 78 finished with value: 0.006500153885560374 and parameters: {'foundation_window': 10, 'ar_lags': 6, 'ema_spans': (2, 4, 8), 'conv_scales': (2, 4, 8), 'use_calendar': True, 'ridge_alpha': 0.0015686178843387882, 'shrinkage_max': 1.8152384144420215, 'oob_split_ratio': 0.7923902620922123}. Best is trial 70 with value: 0.006131238982864626.\n",
      "[I 2026-07-02 16:33:01,658] Trial 79 finished with value: 0.03620463356848034 and parameters: {'foundation_window': 11, 'ar_lags': 6, 'ema_spans': (2, 4, 8), 'conv_scales': (2, 4, 8), 'use_calendar': True, 'ridge_alpha': 0.003760147248046752, 'shrinkage_max': 1.8024271763059658, 'oob_split_ratio': 0.7911366826670672}. Best is trial 70 with value: 0.006131238982864626.\n",
      "[I 2026-07-02 16:33:01,797] Trial 80 finished with value: 0.006475474929915358 and parameters: {'foundation_window': 10, 'ar_lags': 6, 'ema_spans': (2, 4, 8), 'conv_scales': (2, 4, 8), 'use_calendar': True, 'ridge_alpha': 0.0017431812376217121, 'shrinkage_max': 1.8625941758846636, 'oob_split_ratio': 0.7999748134262011}. Best is trial 70 with value: 0.006131238982864626.\n",
      "[I 2026-07-02 16:33:01,939] Trial 81 finished with value: 0.006471578217493698 and parameters: {'foundation_window': 10, 'ar_lags': 6, 'ema_spans': (2, 4, 8), 'conv_scales': (2, 4, 8), 'use_calendar': True, 'ridge_alpha': 0.0014383766281002948, 'shrinkage_max': 1.8667668947849463, 'oob_split_ratio': 0.7922660749118469}. Best is trial 70 with value: 0.006131238982864626.\n",
      "[I 2026-07-02 16:33:02,078] Trial 82 finished with value: 0.006416176949305918 and parameters: {'foundation_window': 10, 'ar_lags': 6, 'ema_spans': (2, 4, 8), 'conv_scales': (2, 4, 8), 'use_calendar': True, 'ridge_alpha': 0.0015262010927017476, 'shrinkage_max': 1.9690652501518056, 'oob_split_ratio': 0.7999580115034135}. Best is trial 70 with value: 0.006131238982864626.\n",
      "[I 2026-07-02 16:33:02,218] Trial 83 finished with value: 0.0068687512269288604 and parameters: {'foundation_window': 10, 'ar_lags': 5, 'ema_spans': (2, 4, 8), 'conv_scales': (2, 4, 8), 'use_calendar': True, 'ridge_alpha': 0.0010998825267347315, 'shrinkage_max': 1.9575750444963713, 'oob_split_ratio': 0.7849134426715841}. Best is trial 70 with value: 0.006131238982864626.\n",
      "[I 2026-07-02 16:33:02,360] Trial 84 finished with value: 0.07631229086095868 and parameters: {'foundation_window': 11, 'ar_lags': 6, 'ema_spans': (2, 4, 8), 'conv_scales': (2, 4, 8), 'use_calendar': True, 'ridge_alpha': 0.002427698311098187, 'shrinkage_max': 1.691627504504532, 'oob_split_ratio': 0.7925443478252752}. Best is trial 70 with value: 0.006131238982864626.\n",
      "[I 2026-07-02 16:33:02,501] Trial 85 finished with value: 0.007012597157063355 and parameters: {'foundation_window': 10, 'ar_lags': 5, 'ema_spans': (2, 4, 8), 'conv_scales': (2, 4, 8), 'use_calendar': True, 'ridge_alpha': 0.003934901824047208, 'shrinkage_max': 2.0345986332652157, 'oob_split_ratio': 0.7614583043173142}. Best is trial 70 with value: 0.006131238982864626.\n",
      "[I 2026-07-02 16:33:02,641] Trial 86 finished with value: 0.009537942785213705 and parameters: {'foundation_window': 11, 'ar_lags': 6, 'ema_spans': (2, 4, 8), 'conv_scales': (2, 4, 8), 'use_calendar': False, 'ridge_alpha': 0.0013582501791657797, 'shrinkage_max': 1.7192410886311271, 'oob_split_ratio': 0.7831921210725616}. Best is trial 70 with value: 0.006131238982864626.\n",
      "[I 2026-07-02 16:33:02,769] Trial 87 finished with value: 0.006907261016567774 and parameters: {'foundation_window': 10, 'ar_lags': 6, 'ema_spans': (2, 4, 8), 'conv_scales': (3, 6), 'use_calendar': True, 'ridge_alpha': 0.00297914195286039, 'shrinkage_max': 1.5741210700504544, 'oob_split_ratio': 0.7765662532727248}. Best is trial 70 with value: 0.006131238982864626.\n",
