      "[I 2026-07-02 16:32:35,390] Trial 60 finished with value: inf and parameters: {'reservoir_size': 148, 'spectral_radius': 1.4973866872621227, 'ar_lags': 2, 'foundation_window': 5, 'regressor_type': 'Ridge', 'reg_alpha': 0.13219052803195774, 'aci_step_size': 0.1389808131192379, 'oob_split_ratio': 0.6220367734616377}. Best is trial 0 with value: inf.\n",
      "[I 2026-07-02 16:32:35,429] Trial 61 finished with value: inf and parameters: {'reservoir_size': 54, 'spectral_radius': 0.799758991787695, 'ar_lags': 4, 'foundation_window': 4, 'regressor_type': 'ElasticNet', 'reg_alpha': 23.71818995916454, 'aci_step_size': 0.046165410470553496, 'oob_split_ratio': 0.7917213468750663}. Best is trial 0 with value: inf.\n",
      "[I 2026-07-02 16:32:35,481] Trial 62 finished with value: inf and parameters: {'reservoir_size': 135, 'spectral_radius': 0.7662003184605961, 'ar_lags': 4, 'foundation_window': 4, 'regressor_type': 'ElasticNet', 'reg_alpha': 38.89379706965835, 'aci_step_size': 0.025510944337285006, 'oob_split_ratio': 0.6513431220426456}. Best is trial 0 with value: inf.\n",
      "[I 2026-07-02 16:32:35,530] Trial 63 finished with value: inf and parameters: {'reservoir_size': 119, 'spectral_radius': 0.6993636320782983, 'ar_lags': 4, 'foundation_window': 3, 'regressor_type': 'ElasticNet', 'reg_alpha': 17.8645977434073, 'aci_step_size': 0.03897907045897067, 'oob_split_ratio': 0.7553965917627297}. Best is trial 0 with value: inf.\n",
      "[I 2026-07-02 16:32:35,575] Trial 64 finished with value: inf and parameters: {'reservoir_size': 98, 'spectral_radius': 1.0035369986493485, 'ar_lags': 4, 'foundation_window': 4, 'regressor_type': 'ElasticNet', 'reg_alpha': 13.963563395060753, 'aci_step_size': 0.06696167034218453, 'oob_split_ratio': 0.8267732754332713}. Best is trial 0 with value: inf.\n",
      "[I 2026-07-02 16:32:35,620] Trial 65 finished with value: inf and parameters: {'reservoir_size': 83, 'spectral_radius': 0.5475328658226322, 'ar_lags': 3, 'foundation_window': 5, 'regressor_type': 'Lasso', 'reg_alpha': 1.893784389439561, 'aci_step_size': 0.16012039767669048, 'oob_split_ratio': 0.8124435591714207}. Best is trial 0 with value: inf.\n",
      "[I 2026-07-02 16:32:35,657] Trial 66 finished with value: inf and parameters: {'reservoir_size': 42, 'spectral_radius': 0.6366105711088146, 'ar_lags': 4, 'foundation_window': 6, 'regressor_type': 'Ridge', 'reg_alpha': 8.886052355721203, 'aci_step_size': 0.02256758686803275, 'oob_split_ratio': 0.6390627801340915}. Best is trial 0 with value: inf.\n",
      "[I 2026-07-02 16:32:35,694] Trial 67 finished with value: inf and parameters: {'reservoir_size': 68, 'spectral_radius': 0.7364628329739221, 'ar_lags': 4, 'foundation_window': 3, 'regressor_type': 'ElasticNet', 'reg_alpha': 2.8737754473499786, 'aci_step_size': 0.15110179861930287, 'oob_split_ratio': 0.7069177313985492}. Best is trial 0 with value: inf.\n",
      "[I 2026-07-02 16:32:35,721] Trial 68 finished with value: inf and parameters: {'reservoir_size': 7, 'spectral_radius': 0.6053980272928008, 'ar_lags': 2, 'foundation_window': 6, 'regressor_type': 'ElasticNet', 'reg_alpha': 0.20083173956602088, 'aci_step_size': 0.07886218165964257, 'oob_split_ratio': 0.6015320243167991}. Best is trial 0 with value: inf.\n",
      "[I 2026-07-02 16:32:35,748] Trial 69 finished with value: inf and parameters: {'reservoir_size': 16, 'spectral_radius': 0.6772408426007119, 'ar_lags': 3, 'foundation_window': 5, 'regressor_type': 'Ridge', 'reg_alpha': 7.454426468164267, 'aci_step_size': 0.13421005212515474, 'oob_split_ratio': 0.7726080820064896}. Best is trial 0 with value: inf.\n",
      "[I 2026-07-02 16:32:35,774] Trial 70 finished with value: inf and parameters: {'reservoir_size': 27, 'spectral_radius': 1.4030870291168636, 'ar_lags': 2, 'foundation_window': 4, 'regressor_type': 'Lasso', 'reg_alpha': 10.918158635802838, 'aci_step_size': 0.10112991994591514, 'oob_split_ratio': 0.6953571090107414}. Best is trial 0 with value: inf.\n",
      "[I 2026-07-02 16:32:35,824] Trial 71 finished with value: inf and parameters: {'reservoir_size': 152, 'spectral_radius': 0.6959684638746855, 'ar_lags': 2, 'foundation_window': 6, 'regressor_type': 'Lasso', 'reg_alpha': 0.12719168672949815, 'aci_step_size': 0.08535050518121484, 'oob_split_ratio': 0.6281377028261508}. Best is trial 0 with value: inf.\n",
      "[I 2026-07-02 16:32:35,873] Trial 72 finished with value: inf and parameters: {'reservoir_size': 124, 'spectral_radius': 0.8429138250678114, 'ar_lags': 2, 'foundation_window': 6, 'regressor_type': 'Lasso', 'reg_alpha': 0.24532366446258824, 'aci_step_size': 0.12194280712574494, 'oob_split_ratio': 0.8375398174786665}. Best is trial 0 with value: inf.\n",
      "[I 2026-07-02 16:32:35,948] Trial 73 finished with value: inf and parameters: {'reservoir_size': 188, 'spectral_radius': 0.5854844566886364, 'ar_lags': 2, 'foundation_window': 6, 'regressor_type': 'Lasso', 'reg_alpha': 0.38971408137999575, 'aci_step_size': 0.05677619231286995, 'oob_split_ratio': 0.6759640288431862}. Best is trial 0 with value: inf.\n",
      "[I 2026-07-02 16:32:36,012] Trial 74 finished with value: inf and parameters: {'reservoir_size': 160, 'spectral_radius': 0.9054949556275185, 'ar_lags': 2, 'foundation_window': 6, 'regressor_type': 'Lasso', 'reg_alpha': 4.3684137788123705, 'aci_step_size': 0.11057435594607735, 'oob_split_ratio': 0.6132256754067995}. Best is trial 0 with value: inf.\n",
      "[I 2026-07-02 16:32:36,071] Trial 75 finished with value: inf and parameters: {'reservoir_size': 140, 'spectral_radius': 1.2876587734016236, 'ar_lags': 2, 'foundation_window': 6, 'regressor_type': 'Ridge', 'reg_alpha': 2.2005986901386962, 'aci_step_size': 0.06367753917064715, 'oob_split_ratio': 0.6615338823812811}. Best is trial 0 with value: inf.\n",
      "[I 2026-07-02 16:32:36,122] Trial 76 finished with value: inf and parameters: {'reservoir_size': 109, 'spectral_radius': 0.621325280007677, 'ar_lags': 2, 'foundation_window': 5, 'regressor_type': 'ElasticNet', 'reg_alpha': 22.90892851770155, 'aci_step_size': 0.14126726251755295, 'oob_split_ratio': 0.6240255877647404}. Best is trial 0 with value: inf.\n",
      "[I 2026-07-02 16:32:36,198] Trial 77 finished with value: inf and parameters: {'reservoir_size': 173, 'spectral_radius': 0.7432935086321537, 'ar_lags': 4, 'foundation_window': 3, 'regressor_type': 'Lasso', 'reg_alpha': 0.3220866949657416, 'aci_step_size': 0.11678013548098468, 'oob_split_ratio': 0.808167853640051}. Best is trial 0 with value: inf.\n",
      "[I 2026-07-02 16:32:36,243] Trial 78 finished with value: inf and parameters: {'reservoir_size': 91, 'spectral_radius': 0.7765569870712925, 'ar_lags': 2, 'foundation_window': 6, 'regressor_type': 'ElasticNet', 'reg_alpha': 0.7304775168836048, 'aci_step_size': 0.01814957959665908, 'oob_split_ratio': 0.632424568943788}. Best is trial 0 with value: inf.\n",
      "[I 2026-07-02 16:32:36,299] Trial 79 finished with value: inf and parameters: {'reservoir_size': 131, 'spectral_radius': 1.131629642258715, 'ar_lags': 4, 'foundation_window': 6, 'regressor_type': 'Ridge', 'reg_alpha': 1.3916540977283736, 'aci_step_size': 0.0354130993905927, 'oob_split_ratio': 0.6831345499519704}. Best is trial 0 with value: inf.\n",
      "[I 2026-07-02 16:32:36,349] Trial 80 finished with value: inf and parameters: {'reservoir_size': 117, 'spectral_radius': 0.6785311231138437, 'ar_lags': 2, 'foundation_window': 4, 'regressor_type': 'ElasticNet', 'reg_alpha': 14.478247152826576, 'aci_step_size': 0.09562469096466408, 'oob_split_ratio': 0.6442121814755918}. Best is trial 0 with value: inf.\n",
      "[I 2026-07-02 16:32:36,424] Trial 81 finished with value: inf and parameters: {'reservoir_size': 186, 'spectral_radius': 1.2262418282823178, 'ar_lags': 2, 'foundation_window': 3, 'regressor_type': 'Lasso', 'reg_alpha': 3.591883313949345, 'aci_step_size': 0.1739401235687077, 'oob_split_ratio': 0.7277031430773289}. Best is trial 0 with value: inf.\n",
      "[I 2026-07-02 16:32:36,500] Trial 82 finished with value: inf and parameters: {'reservoir_size': 198, 'spectral_radius': 1.1852643838999797, 'ar_lags': 2, 'foundation_window': 3, 'regressor_type': 'Lasso', 'reg_alpha': 5.565484262316429, 'aci_step_size': 0.19028324901910804, 'oob_split_ratio': 0.7108539610177477}. Best is trial 0 with value: inf.\n",
      "[I 2026-07-02 16:32:36,573] Trial 83 finished with value: inf and parameters: {'reservoir_size': 177, 'spectral_radius': 1.0286536757023748, 'ar_lags': 2, 'foundation_window': 3, 'regressor_type': 'Lasso', 'reg_alpha': 6.742337710829662, 'aci_step_size': 0.10201242738097857, 'oob_split_ratio': 0.7578702210369648}. Best is trial 0 with value: inf.\n",
      "[I 2026-07-02 16:32:36,642] Trial 84 finished with value: inf and parameters: {'reservoir_size': 167, 'spectral_radius': 1.366487570249629, 'ar_lags': 2, 'foundation_window': 3, 'regressor_type': 'Lasso', 'reg_alpha': 5.159518506458415, 'aci_step_size': 0.12816328327439996, 'oob_split_ratio': 0.7168661692250178}. Best is trial 0 with value: inf.\n",
      "[I 2026-07-02 16:32:36,717] Trial 85 finished with value: inf and parameters: {'reservoir_size': 193, 'spectral_radius': 1.1206985861253793, 'ar_lags': 2, 'foundation_window': 4, 'regressor_type': 'Lasso', 'reg_alpha': 2.9121454741538946, 'aci_step_size': 0.16871459707856826, 'oob_split_ratio': 0.6632448071034835}. Best is trial 0 with value: inf.\n",
      "[I 2026-07-02 16:32:36,756] Trial 86 finished with value: inf and parameters: {'reservoir_size': 59, 'spectral_radius': 1.4565653796770122, 'ar_lags': 4, 'foundation_window': 6, 'regressor_type': 'Ridge', 'reg_alpha': 2.001353479568778, 'aci_step_size': 0.08928678119397666, 'oob_split_ratio': 0.7470716770105843}. Best is trial 0 with value: inf.\n",
      "[I 2026-07-02 16:32:36,820] Trial 87 finished with value: inf and parameters: {'reservoir_size': 162, 'spectral_radius': 1.4343856121831564, 'ar_lags': 2, 'foundation_window': 3, 'regressor_type': 'ElasticNet', 'reg_alpha': 0.20974462482921727, 'aci_step_size': 0.1084524710064175, 'oob_split_ratio': 0.702707707399041}. Best is trial 0 with value: inf.\n",
      "[I 2026-07-02 16:32:36,856] Trial 88 finished with value: inf and parameters: {'reservoir_size': 35, 'spectral_radius': 1.059296383311445, 'ar_lags': 3, 'foundation_window': 5, 'regressor_type': 'Lasso', 'reg_alpha': 20.347074193464405, 'aci_step_size': 0.07642502333958331, 'oob_split_ratio': 0.7360211553260934}. Best is trial 0 with value: inf.\n",
      "[I 2026-07-02 16:32:36,912] Trial 89 finished with value: inf and parameters: {'reservoir_size': 146, 'spectral_radius': 0.7154468399534002, 'ar_lags': 4, 'foundation_window': 6, 'regressor_type': 'ElasticNet', 'reg_alpha': 1.548343913905797, 'aci_step_size': 0.012445220947824416, 'oob_split_ratio': 0.6513740835450802}. Best is trial 0 with value: inf.\n",
      "[I 2026-07-02 16:32:36,962] Trial 90 finished with value: inf and parameters: {'reservoir_size': 123, 'spectral_radius': 0.9654461778372238, 'ar_lags': 2, 'foundation_window': 3, 'regressor_type': 'Ridge', 'reg_alpha': 0.1650372458713038, 'aci_step_size': 0.11617871413645289, 'oob_split_ratio': 0.6899007225362829}. Best is trial 0 with value: inf.\n",
      "[I 2026-07-02 16:32:37,000] Trial 91 finished with value: inf and parameters: {'reservoir_size': 47, 'spectral_radius': 1.2781451920034161, 'ar_lags': 4, 'foundation_window': 5, 'regressor_type': 'Ridge', 'reg_alpha': 0.12046228856929357, 'aci_step_size': 0.018654773915771493, 'oob_split_ratio': 0.6057819973258199}. Best is trial 0 with value: inf.\n",
      "[I 2026-07-02 16:32:37,037] Trial 92 finished with value: inf and parameters: {'reservoir_size': 14, 'spectral_radius': 1.2145214572759002, 'ar_lags': 4, 'foundation_window': 4, 'regressor_type': 'Ridge', 'reg_alpha': 28.926324527457233, 'aci_step_size': 0.0298514120695998, 'oob_split_ratio': 0.6287532691235932}. Best is trial 0 with value: inf.\n",
      "[I 2026-07-02 16:32:37,074] Trial 93 finished with value: inf and parameters: {'reservoir_size': 22, 'spectral_radius': 1.136607350921288, 'ar_lags': 4, 'foundation_window': 4, 'regressor_type': 'Ridge', 'reg_alpha': 3.75340024382716, 'aci_step_size': 0.04098779572156382, 'oob_split_ratio': 0.6396340761190328}. Best is trial 0 with value: inf.\n",
      "[I 2026-07-02 16:32:37,100] Trial 94 finished with value: inf and parameters: {'reservoir_size': 5, 'spectral_radius': 1.3064258174950105, 'ar_lags': 4, 'foundation_window': 5, 'regressor_type': 'Ridge', 'reg_alpha': 1.0456006070436843, 'aci_step_size': 0.1827974386159653, 'oob_split_ratio': 0.6155624604757721}. Best is trial 0 with value: inf.\n",
      "[I 2026-07-02 16:32:37,140] Trial 95 finished with value: inf and parameters: {'reservoir_size': 101, 'spectral_radius': 1.182099596797859, 'ar_lags': 4, 'foundation_window': 6, 'regressor_type': 'ElasticNet', 'reg_alpha': 2.7284784288405475, 'aci_step_size': 0.13256386924767813, 'oob_split_ratio': 0.7192757133709572}. Best is trial 0 with value: inf.\n",
      "[I 2026-07-02 16:32:37,182] Trial 96 finished with value: inf and parameters: {'reservoir_size': 71, 'spectral_radius': 1.2581673362171792, 'ar_lags': 4, 'foundation_window': 6, 'regressor_type': 'Ridge', 'reg_alpha': 1.5610205789474207, 'aci_step_size': 0.015129942172324037, 'oob_split_ratio': 0.7977400717954037}. Best is trial 0 with value: inf.\n",
      "[I 2026-07-02 16:32:37,221] Trial 97 finished with value: inf and parameters: {'reservoir_size': 22, 'spectral_radius': 1.3426802789300751, 'ar_lags': 4, 'foundation_window': 4, 'regressor_type': 'ElasticNet', 'reg_alpha': 0.4755915582720311, 'aci_step_size': 0.02426795658479278, 'oob_split_ratio': 0.646968967137856}. Best is trial 0 with value: inf.\n",
      "[I 2026-07-02 16:32:37,280] Trial 98 finished with value: inf and parameters: {'reservoir_size': 153, 'spectral_radius': 1.3791497471199659, 'ar_lags': 3, 'foundation_window': 5, 'regressor_type': 'Lasso', 'reg_alpha': 40.14491126439433, 'aci_step_size': 0.19802028352100728, 'oob_split_ratio': 0.6234358073771026}. Best is trial 0 with value: inf.\n",
      "[I 2026-07-02 16:32:37,354] Trial 99 finished with value: inf and parameters: {'reservoir_size': 180, 'spectral_radius': 0.5232215066003538, 'ar_lags': 2, 'foundation_window': 6, 'regressor_type': 'ElasticNet', 'reg_alpha': 3.1280314471875434, 'aci_step_size': 0.12323202934362178, 'oob_split_ratio': 0.6759100022841573}. Best is trial 0 with value: inf.\n",
      "[I 2026-07-02 16:32:37,398] Trial 100 finished with value: inf and parameters: {'reservoir_size': 80, 'spectral_radius': 1.475197426246126, 'ar_lags': 4, 'foundation_window': 3, 'regressor_type': 'Ridge', 'reg_alpha': 2.1554852316362147, 'aci_step_size': 0.15225984011709706, 'oob_split_ratio': 0.7709045835431999}. Best is trial 0 with value: inf.\n",
      "[I 2026-07-02 16:32:37,446] Trial 101 finished with value: inf and parameters: {'reservoir_size': 94, 'spectral_radius': 0.562612698035344, 'ar_lags': 3, 'foundation_window': 5, 'regressor_type': 'Ridge', 'reg_alpha': 0.17292735515847768, 'aci_step_size': 0.1813440780057296, 'oob_split_ratio': 0.8483738647000824}. Best is trial 0 with value: inf.\n",
      "[I 2026-07-02 16:32:37,484] Trial 102 finished with value: inf and parameters: {'reservoir_size': 59, 'spectral_radius': 0.6440388904150376, 'ar_lags': 2, 'foundation_window': 5, 'regressor_type': 'Ridge', 'reg_alpha': 20.240409195821126, 'aci_step_size': 0.19244207994569495, 'oob_split_ratio': 0.7819307603366326}. Best is trial 0 with value: inf.\n",
      "[I 2026-07-02 16:32:37,520] Trial 103 finished with value: inf and parameters: {'reservoir_size': 32, 'spectral_radius': 1.1061870184491782, 'ar_lags': 3, 'foundation_window': 5, 'regressor_type': 'Ridge', 'reg_alpha': 27.74987149835841, 'aci_step_size': 0.01005868293911578, 'oob_split_ratio': 0.8397693625732762}. Best is trial 0 with value: inf.\n",
      "[I 2026-07-02 16:32:37,559] Trial 104 finished with value: inf and parameters: {'reservoir_size': 42, 'spectral_radius': 0.8318291988973805, 'ar_lags': 4, 'foundation_window': 5, 'regressor_type': 'Ridge', 'reg_alpha': 31.524578031939107, 'aci_step_size': 0.16706678927763696, 'oob_split_ratio': 0.8203801429303302}. Best is trial 0 with value: inf.\n",
      "[I 2026-07-02 16:32:37,586] Trial 105 finished with value: inf and parameters: {'reservoir_size': 53, 'spectral_radius': 1.4177399891801166, 'ar_lags': 2, 'foundation_window': 6, 'regressor_type': 'Lasso', 'reg_alpha': 9.450849713133664, 'aci_step_size': 0.029125863527021068, 'oob_split_ratio': 0.608670408314638}. Best is trial 0 with value: inf.\n",
      "[I 2026-07-02 16:32:37,626] Trial 106 finished with value: inf and parameters: {'reservoir_size': 105, 'spectral_radius': 0.6660953668478974, 'ar_lags': 4, 'foundation_window': 6, 'regressor_type': 'ElasticNet', 'reg_alpha': 2.471633119225362, 'aci_step_size': 0.08399936203258784, 'oob_split_ratio': 0.8327338657766614}. Best is trial 0 with value: inf.\n",
      "[I 2026-07-02 16:32:37,663] Trial 107 finished with value: inf and parameters: {'reservoir_size': 1, 'spectral_radius': 0.889231233393868, 'ar_lags': 2, 'foundation_window': 5, 'regressor_type': 'Ridge', 'reg_alpha': 14.125577673533403, 'aci_step_size': 0.15758768484613664, 'oob_split_ratio': 0.6679436959947487}. Best is trial 0 with value: inf.\n",
      "[I 2026-07-02 16:32:37,710] Trial 108 finished with value: inf and parameters: {'reservoir_size': 87, 'spectral_radius': 0.5041070690819471, 'ar_lags': 4, 'foundation_window': 5, 'regressor_type': 'ElasticNet', 'reg_alpha': 0.22983386091100552, 'aci_step_size': 0.02150842627694184, 'oob_split_ratio': 0.818730596703104}. Best is trial 0 with value: inf.\n",
      "[I 2026-07-02 16:32:37,749] Trial 109 finished with value: inf and parameters: {'reservoir_size': 74, 'spectral_radius': 1.1551661433609826, 'ar_lags': 2, 'foundation_window': 6, 'regressor_type': 'Lasso', 'reg_alpha': 16.801194853541123, 'aci_step_size': 0.14250397930555683, 'oob_split_ratio': 0.6315589080916538}. Best is trial 0 with value: inf.\n",
      "[I 2026-07-02 16:32:37,779] Trial 110 finished with value: inf and parameters: {'reservoir_size': 10, 'spectral_radius': 0.6162591970529294, 'ar_lags': 4, 'foundation_window': 4, 'regressor_type': 'Ridge', 'reg_alpha': 0.27754613954496193, 'aci_step_size': 0.18707161837847666, 'oob_split_ratio': 0.658115880548591}. Best is trial 0 with value: inf.\n",
      "[I 2026-07-02 16:32:37,807] Trial 111 finished with value: inf and parameters: {'reservoir_size': 64, 'spectral_radius': 1.4758342530262853, 'ar_lags': 3, 'foundation_window': 3, 'regressor_type': 'Lasso', 'reg_alpha': 45.114836808581764, 'aci_step_size': 0.07100003036060275, 'oob_split_ratio': 0.779265940129688}. Best is trial 0 with value: inf.\n",
      "[I 2026-07-02 16:32:37,838] Trial 112 finished with value: inf and parameters: {'reservoir_size': 80, 'spectral_radius': 1.489147298984871, 'ar_lags': 3, 'foundation_window': 3, 'regressor_type': 'Lasso', 'reg_alpha': 45.4555958247607, 'aci_step_size': 0.09124394282182861, 'oob_split_ratio': 0.7909917137687908}. Best is trial 0 with value: inf.\n",
      "[I 2026-07-02 16:32:37,868] Trial 113 finished with value: inf and parameters: {'reservoir_size': 63, 'spectral_radius': 0.5864853651839543, 'ar_lags': 2, 'foundation_window': 3, 'regressor_type': 'Lasso', 'reg_alpha': 36.869644368176395, 'aci_step_size': 0.17464945162007361, 'oob_split_ratio': 0.732986772245786}. Best is trial 0 with value: inf.\n",
      "[I 2026-07-02 16:32:37,897] Trial 114 finished with value: inf and parameters: {'reservoir_size': 17, 'spectral_radius': 1.440802236495044, 'ar_lags': 2, 'foundation_window': 3, 'regressor_type': 'Lasso', 'reg_alpha': 1.7262081323050986, 'aci_step_size': 0.07607161021865823, 'oob_split_ratio': 0.6205683327741623}. Best is trial 0 with value: inf.\n",
      "[I 2026-07-02 16:32:37,960] Trial 115 finished with value: inf and parameters: {'reservoir_size': 171, 'spectral_radius': 1.4995027913740697, 'ar_lags': 4, 'foundation_window': 3, 'regressor_type': 'ElasticNet', 'reg_alpha': 0.14128155860105024, 'aci_step_size': 0.0654765949493975, 'oob_split_ratio': 0.8044282492252475}. Best is trial 0 with value: inf.\n",
      "[I 2026-07-02 16:32:38,003] Trial 116 finished with value: inf and parameters: {'reservoir_size': 68, 'spectral_radius': 1.2114888970370827, 'ar_lags': 3, 'foundation_window': 3, 'regressor_type': 'Lasso', 'reg_alpha': 33.19626828570319, 'aci_step_size': 0.1940809303265203, 'oob_split_ratio': 0.7469596473476803}. Best is trial 0 with value: inf.\n",
      "[I 2026-07-02 16:32:38,042] Trial 117 finished with value: inf and parameters: {'reservoir_size': 26, 'spectral_radius': 0.6831452353879791, 'ar_lags': 2, 'foundation_window': 6, 'regressor_type': 'ElasticNet', 'reg_alpha': 23.962426876053446, 'aci_step_size': 0.11949941282061716, 'oob_split_ratio': 0.6985911223029868}. Best is trial 0 with value: inf.\n",
      "[I 2026-07-02 16:32:38,073] Trial 118 finished with value: inf and parameters: {'reservoir_size': 47, 'spectral_radius': 1.4067730426561782, 'ar_lags': 4, 'foundation_window': 4, 'regressor_type': 'Lasso', 'reg_alpha': 0.10322555798878383, 'aci_step_size': 0.11309248610514967, 'oob_split_ratio': 0.796177310999491}. Best is trial 0 with value: inf.\n",
      "[I 2026-07-02 16:32:38,118] Trial 119 finished with value: inf and parameters: {'reservoir_size': 136, 'spectral_radius': 0.7864995113498212, 'ar_lags': 2, 'foundation_window': 6, 'regressor_type': 'Ridge', 'reg_alpha': 10.436333013825935, 'aci_step_size': 0.09821361333607087, 'oob_split_ratio': 0.7604227060711914}. Best is trial 0 with value: inf.\n",
