      "[I 2026-07-02 16:31:52,527] Trial 100 finished with value: 0.010705309664253468 and parameters: {'foundation_window': 4, 'ar_lags': 4, 'ema_spans': (3, 6, 12), 'conv_scales': (3, 6), 'use_calendar': True, 'ridge_alpha': 1.5070259176248488, 'shrinkage_max': 0.3024998929018646, 'oob_split_ratio': 0.6496515735157421}. Best is trial 88 with value: 0.009965176216112735.\n",
      "[I 2026-07-02 16:31:52,773] Trial 101 finished with value: 0.012957497952407207 and parameters: {'foundation_window': 4, 'ar_lags': 4, 'ema_spans': (3, 6, 12), 'conv_scales': (3, 6), 'use_calendar': True, 'ridge_alpha': 2.4235528700522155, 'shrinkage_max': 0.42791144402531334, 'oob_split_ratio': 0.6457536971354506}. Best is trial 88 with value: 0.009965176216112735.\n",
      "[I 2026-07-02 16:31:53,013] Trial 102 finished with value: 0.017119681787232808 and parameters: {'foundation_window': 4, 'ar_lags': 4, 'ema_spans': (3, 6, 12), 'conv_scales': (3, 6), 'use_calendar': True, 'ridge_alpha': 0.06330945602496903, 'shrinkage_max': 0.32055632093101877, 'oob_split_ratio': 0.6124562269500667}. Best is trial 88 with value: 0.009965176216112735.\n",
      "[I 2026-07-02 16:31:53,257] Trial 103 finished with value: 0.014166756824624748 and parameters: {'foundation_window': 5, 'ar_lags': 4, 'ema_spans': (3, 6, 12), 'conv_scales': (3, 6), 'use_calendar': True, 'ridge_alpha': 5.074714434843652, 'shrinkage_max': 0.2505462033905015, 'oob_split_ratio': 0.6503718006364172}. Best is trial 88 with value: 0.009965176216112735.\n",
      "[I 2026-07-02 16:31:53,503] Trial 104 finished with value: 0.0160069141894837 and parameters: {'foundation_window': 4, 'ar_lags': 4, 'ema_spans': (3, 6, 12), 'conv_scales': (3, 6), 'use_calendar': True, 'ridge_alpha': 1.5099048311202834, 'shrinkage_max': 0.5320021262967791, 'oob_split_ratio': 0.6687554254134225}. Best is trial 88 with value: 0.009965176216112735.\n",
      "[I 2026-07-02 16:31:53,747] Trial 105 finished with value: 0.012992426906984393 and parameters: {'foundation_window': 4, 'ar_lags': 4, 'ema_spans': (3, 6, 12), 'conv_scales': (3, 6), 'use_calendar': True, 'ridge_alpha': 0.4020308933493926, 'shrinkage_max': 0.4397774103176981, 'oob_split_ratio': 0.6567728588375166}. Best is trial 88 with value: 0.009965176216112735.\n",
      "[I 2026-07-02 16:31:53,993] Trial 106 finished with value: 0.016785064800366834 and parameters: {'foundation_window': 5, 'ar_lags': 5, 'ema_spans': (3, 6, 12), 'conv_scales': (3, 6), 'use_calendar': True, 'ridge_alpha': 0.8308012697291002, 'shrinkage_max': 0.3837114455984656, 'oob_split_ratio': 0.6751141873947025}. Best is trial 88 with value: 0.009965176216112735.\n",
      "[I 2026-07-02 16:31:54,304] Trial 107 finished with value: 0.012837170691516632 and parameters: {'foundation_window': 4, 'ar_lags': 4, 'ema_spans': (3, 6, 12), 'conv_scales': (2, 4, 8), 'use_calendar': True, 'ridge_alpha': 0.034705750533467555, 'shrinkage_max': 0.31031887600287167, 'oob_split_ratio': 0.6636412922268498}. Best is trial 88 with value: 0.009965176216112735.\n",
      "[I 2026-07-02 16:31:54,550] Trial 108 finished with value: 0.019557201074074788 and parameters: {'foundation_window': 4, 'ar_lags': 4, 'ema_spans': (3, 6, 12), 'conv_scales': (3, 6), 'use_calendar': True, 'ridge_alpha': 0.14908661120235162, 'shrinkage_max': 0.605988569297551, 'oob_split_ratio': 0.6837326363724028}. Best is trial 88 with value: 0.009965176216112735.\n",
      "[I 2026-07-02 16:31:54,863] Trial 109 finished with value: 0.023364678823603727 and parameters: {'foundation_window': 5, 'ar_lags': 5, 'ema_spans': (2, 4, 8), 'conv_scales': (3, 6, 12), 'use_calendar': True, 'ridge_alpha': 0.20002978432004972, 'shrinkage_max': 0.31819338165768113, 'oob_split_ratio': 0.5524246673876477}. Best is trial 88 with value: 0.009965176216112735.\n",
      "[I 2026-07-02 16:31:55,110] Trial 110 finished with value: 0.023114447258233427 and parameters: {'foundation_window': 4, 'ar_lags': 4, 'ema_spans': (3, 6, 12), 'conv_scales': (3, 6), 'use_calendar': True, 'ridge_alpha': 0.07360609787920722, 'shrinkage_max': 0.44963201902268946, 'oob_split_ratio': 0.6376502277038106}. Best is trial 88 with value: 0.009965176216112735.\n",
      "[I 2026-07-02 16:31:55,353] Trial 111 finished with value: 0.0123846469101079 and parameters: {'foundation_window': 4, 'ar_lags': 4, 'ema_spans': (3, 6, 12), 'conv_scales': (2, 3), 'use_calendar': True, 'ridge_alpha': 1.119244673273478, 'shrinkage_max': 0.3856925927213447, 'oob_split_ratio': 0.6489950050241406}. Best is trial 88 with value: 0.009965176216112735.\n",
      "[I 2026-07-02 16:31:55,601] Trial 112 finished with value: 0.012242733010323185 and parameters: {'foundation_window': 4, 'ar_lags': 5, 'ema_spans': (3, 6, 12), 'conv_scales': (2, 3), 'use_calendar': True, 'ridge_alpha': 0.2684895474904118, 'shrinkage_max': 0.37395847893373835, 'oob_split_ratio': 0.6817544413513469}. Best is trial 88 with value: 0.009965176216112735.\n",
      "[I 2026-07-02 16:31:55,846] Trial 113 finished with value: 0.019867766765244373 and parameters: {'foundation_window': 5, 'ar_lags': 5, 'ema_spans': (3, 6, 12), 'conv_scales': (2, 3), 'use_calendar': True, 'ridge_alpha': 0.2196945792503568, 'shrinkage_max': 0.5387596261596841, 'oob_split_ratio': 0.661491165384594}. Best is trial 88 with value: 0.009965176216112735.\n",
      "[I 2026-07-02 16:31:56,158] Trial 114 finished with value: 0.012120043350897135 and parameters: {'foundation_window': 4, 'ar_lags': 5, 'ema_spans': (3, 6, 12), 'conv_scales': (2, 3, 4), 'use_calendar': True, 'ridge_alpha': 0.12372928998459432, 'shrinkage_max': 0.2936615670045541, 'oob_split_ratio': 0.6817565743948375}. Best is trial 88 with value: 0.009965176216112735.\n",
      "[I 2026-07-02 16:31:56,467] Trial 115 finished with value: 0.012261905793882935 and parameters: {'foundation_window': 4, 'ar_lags': 5, 'ema_spans': (3, 6, 12), 'conv_scales': (2, 3, 4), 'use_calendar': True, 'ridge_alpha': 0.11862251040888826, 'shrinkage_max': 0.2984273513390915, 'oob_split_ratio': 0.6799858757038038}. Best is trial 88 with value: 0.009965176216112735.\n",
      "[I 2026-07-02 16:31:56,781] Trial 116 finished with value: 0.01599481867305801 and parameters: {'foundation_window': 5, 'ar_lags': 5, 'ema_spans': (3, 6, 12), 'conv_scales': (2, 3, 4), 'use_calendar': True, 'ridge_alpha': 2.171537647553573, 'shrinkage_max': 0.3592793813120508, 'oob_split_ratio': 0.6748223298445707}. Best is trial 88 with value: 0.009965176216112735.\n",
      "[I 2026-07-02 16:31:57,090] Trial 117 finished with value: 0.013148984539028888 and parameters: {'foundation_window': 4, 'ar_lags': 6, 'ema_spans': (3, 6, 12), 'conv_scales': (2, 3, 4), 'use_calendar': True, 'ridge_alpha': 0.044972142367397695, 'shrinkage_max': 0.2545299291491806, 'oob_split_ratio': 0.7001023254093993}. Best is trial 88 with value: 0.009965176216112735.\n",
      "[I 2026-07-02 16:31:57,399] Trial 118 finished with value: 0.01621626267653482 and parameters: {'foundation_window': 4, 'ar_lags': 5, 'ema_spans': (3, 6, 12), 'conv_scales': (2, 3, 4), 'use_calendar': True, 'ridge_alpha': 0.24310308172145537, 'shrinkage_max': 0.4649865243078452, 'oob_split_ratio': 0.6832228318708217}. Best is trial 88 with value: 0.009965176216112735.\n",
      "[I 2026-07-02 16:31:57,710] Trial 119 finished with value: 0.01583181064062591 and parameters: {'foundation_window': 5, 'ar_lags': 5, 'ema_spans': (3, 6, 12), 'conv_scales': (2, 4, 8), 'use_calendar': True, 'ridge_alpha': 1.3242466920959757, 'shrinkage_max': 0.31248035153167264, 'oob_split_ratio': 0.6674021145535206}. Best is trial 88 with value: 0.009965176216112735.\n",
      "[I 2026-07-02 16:31:58,016] Trial 120 finished with value: 0.01988460622183428 and parameters: {'foundation_window': 4, 'ar_lags': 5, 'ema_spans': (3, 6, 12), 'conv_scales': (2, 3, 4), 'use_calendar': True, 'ridge_alpha': 0.8234597326760906, 'shrinkage_max': 0.4980149443429714, 'oob_split_ratio': 0.6398181642276531}. Best is trial 88 with value: 0.009965176216112735.\n",
      "[I 2026-07-02 16:31:58,256] Trial 121 finished with value: 0.012422421740778544 and parameters: {'foundation_window': 4, 'ar_lags': 4, 'ema_spans': (3, 6, 12), 'conv_scales': (2, 3), 'use_calendar': True, 'ridge_alpha': 3.2946223273053366, 'shrinkage_max': 0.4077118537384081, 'oob_split_ratio': 0.656657910972369}. Best is trial 88 with value: 0.009965176216112735.\n",
      "[I 2026-07-02 16:31:58,499] Trial 122 finished with value: 0.018990963973773492 and parameters: {'foundation_window': 4, 'ar_lags': 4, 'ema_spans': (3, 6), 'conv_scales': (2, 3), 'use_calendar': True, 'ridge_alpha': 0.5168268681851493, 'shrinkage_max': 0.36347294067766706, 'oob_split_ratio': 0.6305938610677593}. Best is trial 88 with value: 0.009965176216112735.\n",
      "[I 2026-07-02 16:31:58,737] Trial 123 finished with value: 0.011517619025505159 and parameters: {'foundation_window': 4, 'ar_lags': 4, 'ema_spans': (2, 4), 'conv_scales': (2, 3), 'use_calendar': True, 'ridge_alpha': 0.3743122589472257, 'shrinkage_max': 0.2514148573863041, 'oob_split_ratio': 0.671052874406836}. Best is trial 88 with value: 0.009965176216112735.\n",
      "[I 2026-07-02 16:31:58,978] Trial 124 finished with value: 0.012509797388866218 and parameters: {'foundation_window': 3, 'ar_lags': 4, 'ema_spans': (2, 4), 'conv_scales': (2, 3), 'use_calendar': True, 'ridge_alpha': 0.07724290439529481, 'shrinkage_max': 0.2798717003379027, 'oob_split_ratio': 0.6715716367411235}. Best is trial 88 with value: 0.009965176216112735.\n",
      "[I 2026-07-02 16:31:59,224] Trial 125 finished with value: 0.014429212558141703 and parameters: {'foundation_window': 4, 'ar_lags': 4, 'ema_spans': (2, 4), 'conv_scales': (3, 6), 'use_calendar': True, 'ridge_alpha': 0.11793250578388881, 'shrinkage_max': 0.3520527127356598, 'oob_split_ratio': 0.6883063450492753}. Best is trial 88 with value: 0.009965176216112735.\n",
      "[I 2026-07-02 16:31:59,469] Trial 126 finished with value: 0.01614382168357421 and parameters: {'foundation_window': 5, 'ar_lags': 5, 'ema_spans': (2, 4), 'conv_scales': (2, 3), 'use_calendar': True, 'ridge_alpha': 0.168592757992389, 'shrinkage_max': 0.306760158042984, 'oob_split_ratio': 0.6789688574410728}. Best is trial 88 with value: 0.009965176216112735.\n",
      "[I 2026-07-02 16:31:59,707] Trial 127 finished with value: 0.01292139505084712 and parameters: {'foundation_window': 3, 'ar_lags': 4, 'ema_spans': (2, 4), 'conv_scales': (2, 3), 'use_calendar': True, 'ridge_alpha': 0.35121400232238204, 'shrinkage_max': 0.2518749469894544, 'oob_split_ratio': 0.6707134856086105}. Best is trial 88 with value: 0.009965176216112735.\n",
      "[I 2026-07-02 16:31:59,960] Trial 128 finished with value: 0.01193974422965186 and parameters: {'foundation_window': 4, 'ar_lags': 5, 'ema_spans': (2, 4, 8), 'conv_scales': (3, 6), 'use_calendar': True, 'ridge_alpha': 0.8087823345192874, 'shrinkage_max': 0.4338786285911549, 'oob_split_ratio': 0.6518687912053461}. Best is trial 88 with value: 0.009965176216112735.\n",
      "[I 2026-07-02 16:32:00,241] Trial 129 finished with value: 0.012458989344105166 and parameters: {'foundation_window': 4, 'ar_lags': 4, 'ema_spans': (2, 4, 8), 'conv_scales': (3, 6), 'use_calendar': True, 'ridge_alpha': 0.7199029169993936, 'shrinkage_max': 0.4522222398984028, 'oob_split_ratio': 0.6502817184200532}. Best is trial 88 with value: 0.009965176216112735.\n",
      "[I 2026-07-02 16:32:00,492] Trial 130 finished with value: 0.013902199106079018 and parameters: {'foundation_window': 3, 'ar_lags': 4, 'ema_spans': (2, 4, 8), 'conv_scales': (3, 6), 'use_calendar': True, 'ridge_alpha': 1.0064170197387217, 'shrinkage_max': 0.6607038718944462, 'oob_split_ratio': 0.6452936678569653}. Best is trial 88 with value: 0.009965176216112735.\n",
      "[I 2026-07-02 16:32:00,751] Trial 131 finished with value: 0.012664108321704738 and parameters: {'foundation_window': 4, 'ar_lags': 5, 'ema_spans': (2, 4, 8), 'conv_scales': (3, 6), 'use_calendar': True, 'ridge_alpha': 0.4693749078764243, 'shrinkage_max': 0.42136339083302576, 'oob_split_ratio': 0.6651641450696006}. Best is trial 88 with value: 0.009965176216112735.\n",
      "[I 2026-07-02 16:32:01,001] Trial 132 finished with value: 0.010618199285263493 and parameters: {'foundation_window': 4, 'ar_lags': 5, 'ema_spans': (2, 4, 8), 'conv_scales': (3, 6), 'use_calendar': True, 'ridge_alpha': 0.12419715096804508, 'shrinkage_max': 0.3428723156269378, 'oob_split_ratio': 0.6584273709932451}. Best is trial 88 with value: 0.009965176216112735.\n",
      "[I 2026-07-02 16:32:01,251] Trial 133 finished with value: 0.01109245045654799 and parameters: {'foundation_window': 4, 'ar_lags': 6, 'ema_spans': (2, 4, 8), 'conv_scales': (3, 6), 'use_calendar': True, 'ridge_alpha': 1.923017909665005, 'shrinkage_max': 0.3224628219947353, 'oob_split_ratio': 0.6567780896145345}. Best is trial 88 with value: 0.009965176216112735.\n",
      "[I 2026-07-02 16:32:01,497] Trial 134 finished with value: 0.01383501713832124 and parameters: {'foundation_window': 4, 'ar_lags': 6, 'ema_spans': (2, 4, 8), 'conv_scales': (3, 6), 'use_calendar': True, 'ridge_alpha': 1.475830644420307, 'shrinkage_max': 0.5230177406664067, 'oob_split_ratio': 0.6552164231719896}. Best is trial 88 with value: 0.009965176216112735.\n",
      "[I 2026-07-02 16:32:01,753] Trial 135 finished with value: 0.012802732563813335 and parameters: {'foundation_window': 4, 'ar_lags': 6, 'ema_spans': (2, 4, 8), 'conv_scales': (3, 6), 'use_calendar': True, 'ridge_alpha': 4.440559312361894, 'shrinkage_max': 0.32437533944763924, 'oob_split_ratio': 0.6351437267179103}. Best is trial 88 with value: 0.009965176216112735.\n",
      "[I 2026-07-02 16:32:02,002] Trial 136 finished with value: 0.015758156384238196 and parameters: {'foundation_window': 5, 'ar_lags': 6, 'ema_spans': (2, 4, 8), 'conv_scales': (3, 6), 'use_calendar': True, 'ridge_alpha': 2.016009092296813, 'shrinkage_max': 0.41466643052911023, 'oob_split_ratio': 0.6515240683335624}. Best is trial 88 with value: 0.009965176216112735.\n",
      "[I 2026-07-02 16:32:02,249] Trial 137 finished with value: 0.01562244284659548 and parameters: {'foundation_window': 3, 'ar_lags': 4, 'ema_spans': (2, 4, 8), 'conv_scales': (3, 6), 'use_calendar': True, 'ridge_alpha': 1.2762712347845893, 'shrinkage_max': 0.25795007682329146, 'oob_split_ratio': 0.6578784388385811}. Best is trial 88 with value: 0.009965176216112735.\n",
      "[I 2026-07-02 16:32:02,504] Trial 138 finished with value: 0.010904431036101234 and parameters: {'foundation_window': 4, 'ar_lags': 4, 'ema_spans': (2, 4, 8), 'conv_scales': (3, 6), 'use_calendar': True, 'ridge_alpha': 0.8934139840207174, 'shrinkage_max': 0.3427926048592197, 'oob_split_ratio': 0.6431229297595215}. Best is trial 88 with value: 0.009965176216112735.\n",
      "[I 2026-07-02 16:32:02,753] Trial 139 finished with value: 0.01260933022491472 and parameters: {'foundation_window': 4, 'ar_lags': 4, 'ema_spans': (2, 4, 8), 'conv_scales': (3, 6), 'use_calendar': True, 'ridge_alpha': 3.263592979510013, 'shrinkage_max': 0.349895258398745, 'oob_split_ratio': 0.6415866362850747}. Best is trial 88 with value: 0.009965176216112735.\n",
      "[I 2026-07-02 16:32:03,008] Trial 140 finished with value: 0.02056495205527877 and parameters: {'foundation_window': 5, 'ar_lags': 4, 'ema_spans': (2, 4, 8), 'conv_scales': (3, 6), 'use_calendar': True, 'ridge_alpha': 0.026674892131716924, 'shrinkage_max': 0.48734869515316814, 'oob_split_ratio': 0.6605269180144604}. Best is trial 88 with value: 0.009965176216112735.\n",
      "[I 2026-07-02 16:32:03,263] Trial 141 finished with value: 0.010727305813189996 and parameters: {'foundation_window': 4, 'ar_lags': 4, 'ema_spans': (2, 4, 8), 'conv_scales': (3, 6), 'use_calendar': True, 'ridge_alpha': 0.6430025001534379, 'shrinkage_max': 0.32780702906830894, 'oob_split_ratio': 0.6480894403928248}. Best is trial 88 with value: 0.009965176216112735.\n",
      "[I 2026-07-02 16:32:03,516] Trial 142 finished with value: 0.010796511405003031 and parameters: {'foundation_window': 4, 'ar_lags': 4, 'ema_spans': (2, 4, 8), 'conv_scales': (3, 6), 'use_calendar': True, 'ridge_alpha': 0.990519794999532, 'shrinkage_max': 0.2530646451744481, 'oob_split_ratio': 0.6458855987888338}. Best is trial 88 with value: 0.009965176216112735.\n",
      "[I 2026-07-02 16:32:03,764] Trial 143 finished with value: 0.014308130959141921 and parameters: {'foundation_window': 4, 'ar_lags': 4, 'ema_spans': (2, 4, 8), 'conv_scales': (3, 6), 'use_calendar': True, 'ridge_alpha': 1.7146291635808315, 'shrinkage_max': 0.3529151222618614, 'oob_split_ratio': 0.6316957326168662}. Best is trial 88 with value: 0.009965176216112735.\n",
      "[I 2026-07-02 16:32:04,014] Trial 144 finished with value: 0.009471602415253667 and parameters: {'foundation_window': 4, 'ar_lags': 4, 'ema_spans': (2, 4, 8), 'conv_scales': (3, 6), 'use_calendar': True, 'ridge_alpha': 0.054244387218088816, 'shrinkage_max': 0.3180924468616432, 'oob_split_ratio': 0.6470448025925963}. Best is trial 144 with value: 0.009471602415253667.\n",
      "[I 2026-07-02 16:32:04,260] Trial 145 finished with value: 0.011211162999248138 and parameters: {'foundation_window': 4, 'ar_lags': 4, 'ema_spans': (2, 4, 8), 'conv_scales': (3, 6), 'use_calendar': True, 'ridge_alpha': 0.9906718498442877, 'shrinkage_max': 0.39158156975148506, 'oob_split_ratio': 0.6453254643531908}. Best is trial 144 with value: 0.009471602415253667.\n",
      "[I 2026-07-02 16:32:04,508] Trial 146 finished with value: 0.014503513845803296 and parameters: {'foundation_window': 3, 'ar_lags': 4, 'ema_spans': (2, 4, 8), 'conv_scales': (3, 6), 'use_calendar': True, 'ridge_alpha': 0.6355818908144161, 'shrinkage_max': 0.2971579881345022, 'oob_split_ratio': 0.6409513110414944}. Best is trial 144 with value: 0.009471602415253667.\n",
      "[I 2026-07-02 16:32:04,752] Trial 147 finished with value: 0.011339318996675715 and parameters: {'foundation_window': 4, 'ar_lags': 4, 'ema_spans': (2, 4, 8), 'conv_scales': (3, 6), 'use_calendar': True, 'ridge_alpha': 2.6746870029385903, 'shrinkage_max': 0.34169408365528153, 'oob_split_ratio': 0.6476071240785783}. Best is trial 144 with value: 0.009471602415253667.\n",
      "[I 2026-07-02 16:32:04,998] Trial 148 finished with value: 0.02085160072489302 and parameters: {'foundation_window': 5, 'ar_lags': 4, 'ema_spans': (2, 4, 8), 'conv_scales': (3, 6), 'use_calendar': True, 'ridge_alpha': 0.04947934943196162, 'shrinkage_max': 0.5504371419538256, 'oob_split_ratio': 0.6554965320114369}. Best is trial 144 with value: 0.009471602415253667.\n",
      "[I 2026-07-02 16:32:05,243] Trial 149 finished with value: 0.014638336062066944 and parameters: {'foundation_window': 3, 'ar_lags': 4, 'ema_spans': (2, 4, 8), 'conv_scales': (3, 6), 'use_calendar': True, 'ridge_alpha': 1.2553364178603206, 'shrinkage_max': 0.2502408584330745, 'oob_split_ratio': 0.6278393592817216}. Best is trial 144 with value: 0.009471602415253667.\n",
      "[I 2026-07-02 16:32:05,485] Trial 150 finished with value: 0.015853135695747655 and parameters: {'foundation_window': 4, 'ar_lags': 4, 'ema_spans': (2, 4, 8), 'conv_scales': (3, 6), 'use_calendar': True, 'ridge_alpha': 2.0855267176578294, 'shrinkage_max': 0.4693363321601147, 'oob_split_ratio': 0.637144547512665}. Best is trial 144 with value: 0.009471602415253667.\n",
      "[I 2026-07-02 16:32:05,734] Trial 151 finished with value: 0.011146619383192948 and parameters: {'foundation_window': 4, 'ar_lags': 4, 'ema_spans': (2, 4, 8), 'conv_scales': (3, 6), 'use_calendar': True, 'ridge_alpha': 0.9647715317578153, 'shrinkage_max': 0.38152767900637563, 'oob_split_ratio': 0.6487891737716742}. Best is trial 144 with value: 0.009471602415253667.\n",
      "[I 2026-07-02 16:32:05,985] Trial 152 finished with value: 0.011092497796107678 and parameters: {'foundation_window': 4, 'ar_lags': 4, 'ema_spans': (2, 4, 8), 'conv_scales': (3, 6), 'use_calendar': True, 'ridge_alpha': 0.6136182103617789, 'shrinkage_max': 0.39031430546190743, 'oob_split_ratio': 0.6464821441028332}. Best is trial 144 with value: 0.009471602415253667.\n",
      "[I 2026-07-02 16:32:06,228] Trial 153 finished with value: 0.010870558244852798 and parameters: {'foundation_window': 4, 'ar_lags': 4, 'ema_spans': (2, 4, 8), 'conv_scales': (3, 6), 'use_calendar': True, 'ridge_alpha': 0.5425103710171373, 'shrinkage_max': 0.30500941604211335, 'oob_split_ratio': 0.6617500614871827}. Best is trial 144 with value: 0.009471602415253667.\n",
      "[I 2026-07-02 16:32:06,473] Trial 154 finished with value: 0.010749847434176821 and parameters: {'foundation_window': 4, 'ar_lags': 4, 'ema_spans': (2, 4, 8), 'conv_scales': (3, 6), 'use_calendar': True, 'ridge_alpha': 0.7315432056054416, 'shrinkage_max': 0.31649989481768626, 'oob_split_ratio': 0.6636379920287602}. Best is trial 144 with value: 0.009471602415253667.\n",
      "[I 2026-07-02 16:32:06,728] Trial 155 finished with value: 0.010778560432749334 and parameters: {'foundation_window': 4, 'ar_lags': 4, 'ema_spans': (2, 4, 8), 'conv_scales': (3, 6), 'use_calendar': True, 'ridge_alpha': 0.7538451342804656, 'shrinkage_max': 0.32029641963998584, 'oob_split_ratio': 0.6644900965867271}. Best is trial 144 with value: 0.009471602415253667.\n",
      "[I 2026-07-02 16:32:07,049] Trial 156 finished with value: 0.011735977769520166 and parameters: {'foundation_window': 4, 'ar_lags': 4, 'ema_spans': (2, 4, 8), 'conv_scales': (3, 6, 12), 'use_calendar': True, 'ridge_alpha': 0.5069226434587574, 'shrinkage_max': 0.2507403217492145, 'oob_split_ratio': 0.6648917454592845}. Best is trial 144 with value: 0.009471602415253667.\n",
      "[I 2026-07-02 16:32:07,292] Trial 157 finished with value: 0.01309340810965177 and parameters: {'foundation_window': 4, 'ar_lags': 4, 'ema_spans': (2, 4, 8), 'conv_scales': (3, 6), 'use_calendar': True, 'ridge_alpha': 0.6855489415495706, 'shrinkage_max': 0.43508781217163295, 'oob_split_ratio': 0.6616673316339302}. Best is trial 144 with value: 0.009471602415253667.\n",
