      "[I 2026-07-02 16:33:25,771] Trial 259 finished with value: 0.006055795713868623 and parameters: {'foundation_window': 10, 'ar_lags': 6, 'ema_spans': (2, 4, 8), 'conv_scales': (2, 3), 'use_calendar': True, 'ridge_alpha': 0.0013379487080580406, 'shrinkage_max': 2.4200377096889976, 'oob_split_ratio': 0.7887302675625736}. Best is trial 224 with value: 0.005701662740632905.\n",
      "[I 2026-07-02 16:33:25,911] Trial 260 finished with value: 0.006898308416961626 and parameters: {'foundation_window': 10, 'ar_lags': 6, 'ema_spans': (2, 4, 8), 'conv_scales': (3, 6), 'use_calendar': True, 'ridge_alpha': 0.0016289750222593965, 'shrinkage_max': 2.311223759209278, 'oob_split_ratio': 0.7817665576968982}. Best is trial 224 with value: 0.005701662740632905.\n",
      "[I 2026-07-02 16:33:26,049] Trial 261 finished with value: 0.008090233829495181 and parameters: {'foundation_window': 9, 'ar_lags': 6, 'ema_spans': (2, 4, 8), 'conv_scales': (2, 3), 'use_calendar': True, 'ridge_alpha': 0.0012783538995606771, 'shrinkage_max': 2.370722468041487, 'oob_split_ratio': 0.7888665083842148}. Best is trial 224 with value: 0.005701662740632905.\n",
      "[I 2026-07-02 16:33:26,187] Trial 262 finished with value: 0.005740198232373535 and parameters: {'foundation_window': 10, 'ar_lags': 6, 'ema_spans': (2, 4, 8), 'conv_scales': (2, 3), 'use_calendar': True, 'ridge_alpha': 0.0018960379183742813, 'shrinkage_max': 2.2515365126569, 'oob_split_ratio': 0.7768832278389497}. Best is trial 224 with value: 0.005701662740632905.\n",
      "[I 2026-07-02 16:33:26,323] Trial 263 finished with value: 0.01079318289238785 and parameters: {'foundation_window': 10, 'ar_lags': 6, 'ema_spans': (2, 4, 8), 'conv_scales': (2, 3), 'use_calendar': True, 'ridge_alpha': 67.32159163245436, 'shrinkage_max': 2.3102184720997094, 'oob_split_ratio': 0.7829013695227433}. Best is trial 224 with value: 0.005701662740632905.\n",
      "[I 2026-07-02 16:33:26,455] Trial 264 finished with value: 0.0057253879554315735 and parameters: {'foundation_window': 10, 'ar_lags': 6, 'ema_spans': (2, 4, 8), 'conv_scales': (2, 3), 'use_calendar': True, 'ridge_alpha': 0.0013149460511901296, 'shrinkage_max': 2.234474752925317, 'oob_split_ratio': 0.7710998521368918}. Best is trial 224 with value: 0.005701662740632905.\n",
      "[I 2026-07-02 16:33:26,587] Trial 265 finished with value: 0.007365311808752458 and parameters: {'foundation_window': 10, 'ar_lags': 6, 'ema_spans': (2, 4, 8), 'conv_scales': (2, 3), 'use_calendar': True, 'ridge_alpha': 0.001464078242068013, 'shrinkage_max': 2.2446411312677137, 'oob_split_ratio': 0.6585811294446262}. Best is trial 224 with value: 0.005701662740632905.\n",
      "[I 2026-07-02 16:33:26,723] Trial 266 finished with value: 0.005747440533398998 and parameters: {'foundation_window': 10, 'ar_lags': 6, 'ema_spans': (2, 4, 8), 'conv_scales': (2, 3), 'use_calendar': True, 'ridge_alpha': 0.0026005736196558858, 'shrinkage_max': 2.290938160426389, 'oob_split_ratio': 0.7698021148013254}. Best is trial 224 with value: 0.005701662740632905.\n",
      "[I 2026-07-02 16:33:26,856] Trial 267 finished with value: 0.007049998676309161 and parameters: {'foundation_window': 10, 'ar_lags': 6, 'ema_spans': (2, 4, 8), 'conv_scales': (2, 3), 'use_calendar': True, 'ridge_alpha': 0.0013057390844723165, 'shrinkage_max': 2.1197133482329664, 'oob_split_ratio': 0.7611736791441075}. Best is trial 224 with value: 0.005701662740632905.\n",
      "[I 2026-07-02 16:33:26,988] Trial 268 finished with value: 0.0060891367289768565 and parameters: {'foundation_window': 10, 'ar_lags': 6, 'ema_spans': (2, 4, 8), 'conv_scales': (2, 3), 'use_calendar': True, 'ridge_alpha': 0.0021361695836819533, 'shrinkage_max': 2.378758227352666, 'oob_split_ratio': 0.7711157460460963}. Best is trial 224 with value: 0.005701662740632905.\n",
      "[I 2026-07-02 16:33:27,135] Trial 269 finished with value: 0.01386860348264962 and parameters: {'foundation_window': 11, 'ar_lags': 6, 'ema_spans': (2, 4, 8), 'conv_scales': (3, 6, 12), 'use_calendar': False, 'ridge_alpha': 0.0016496649957602435, 'shrinkage_max': 2.245115914167081, 'oob_split_ratio': 0.7785052591451145}. Best is trial 224 with value: 0.005701662740632905.\n",
      "[I 2026-07-02 16:33:27,268] Trial 270 finished with value: 0.008090233829495181 and parameters: {'foundation_window': 9, 'ar_lags': 6, 'ema_spans': (2, 4, 8), 'conv_scales': (2, 3), 'use_calendar': True, 'ridge_alpha': 0.001322412210993288, 'shrinkage_max': 2.2970167851996246, 'oob_split_ratio': 0.7746116352714594}. Best is trial 224 with value: 0.005701662740632905.\n",
      "[I 2026-07-02 16:33:27,403] Trial 271 finished with value: 0.0057426437652371804 and parameters: {'foundation_window': 10, 'ar_lags': 6, 'ema_spans': (2, 4, 8), 'conv_scales': (2, 3), 'use_calendar': True, 'ridge_alpha': 0.0016941166552940673, 'shrinkage_max': 2.2319219344156696, 'oob_split_ratio': 0.7832897411080934}. Best is trial 224 with value: 0.005701662740632905.\n",
      "[I 2026-07-02 16:33:27,539] Trial 272 finished with value: 0.007049460324450426 and parameters: {'foundation_window': 10, 'ar_lags': 6, 'ema_spans': (2, 4, 8), 'conv_scales': (2, 3), 'use_calendar': True, 'ridge_alpha': 0.001240781784949835, 'shrinkage_max': 2.1114387832393686, 'oob_split_ratio': 0.7668970676891302}. Best is trial 224 with value: 0.005701662740632905.\n",
      "[I 2026-07-02 16:33:27,675] Trial 273 finished with value: 0.006110727223019366 and parameters: {'foundation_window': 10, 'ar_lags': 6, 'ema_spans': (2, 4, 8), 'conv_scales': (2, 3), 'use_calendar': True, 'ridge_alpha': 0.0021810690276718, 'shrinkage_max': 2.3341955843698505, 'oob_split_ratio': 0.7795833235548726}. Best is trial 224 with value: 0.005701662740632905.\n",
      "[I 2026-07-02 16:33:27,814] Trial 274 finished with value: 0.006116929798297604 and parameters: {'foundation_window': 10, 'ar_lags': 6, 'ema_spans': (2, 4, 8), 'conv_scales': (2, 3), 'use_calendar': True, 'ridge_alpha': 0.00127246026969349, 'shrinkage_max': 2.2770023392546617, 'oob_split_ratio': 0.7881085025666134}. Best is trial 224 with value: 0.005701662740632905.\n",
      "[I 2026-07-02 16:33:27,953] Trial 275 finished with value: 0.0057927635368375556 and parameters: {'foundation_window': 10, 'ar_lags': 6, 'ema_spans': (2, 4, 8), 'conv_scales': (2, 3), 'use_calendar': True, 'ridge_alpha': 0.002938281104291762, 'shrinkage_max': 2.231486227513057, 'oob_split_ratio': 0.7733774587831137}. Best is trial 224 with value: 0.005701662740632905.\n",
      "[I 2026-07-02 16:33:28,092] Trial 276 finished with value: 0.0060589050301404004 and parameters: {'foundation_window': 10, 'ar_lags': 6, 'ema_spans': (2, 4, 8), 'conv_scales': (2, 3), 'use_calendar': True, 'ridge_alpha': 0.001705963829119619, 'shrinkage_max': 2.4460820618189936, 'oob_split_ratio': 0.7827668345453007}. Best is trial 224 with value: 0.005701662740632905.\n",
      "[I 2026-07-02 16:33:28,224] Trial 277 finished with value: 0.013753314882205827 and parameters: {'foundation_window': 2, 'ar_lags': 6, 'ema_spans': (2, 4), 'conv_scales': (2, 3), 'use_calendar': True, 'ridge_alpha': 0.0015421596887611247, 'shrinkage_max': 2.127034650617291, 'oob_split_ratio': 0.7887205928273873}. Best is trial 224 with value: 0.005701662740632905.\n",
      "[I 2026-07-02 16:33:28,362] Trial 278 finished with value: 0.00981630368235954 and parameters: {'foundation_window': 11, 'ar_lags': 6, 'ema_spans': (2, 4, 8), 'conv_scales': (2, 3), 'use_calendar': True, 'ridge_alpha': 0.001250677515178718, 'shrinkage_max': 2.366562039672623, 'oob_split_ratio': 0.7789463440288054}. Best is trial 224 with value: 0.005701662740632905.\n",
      "[I 2026-07-02 16:33:28,497] Trial 279 finished with value: 0.005763894435494251 and parameters: {'foundation_window': 10, 'ar_lags': 6, 'ema_spans': (2, 4, 8), 'conv_scales': (2, 3), 'use_calendar': True, 'ridge_alpha': 0.0021631870368840015, 'shrinkage_max': 2.2275689008617943, 'oob_split_ratio': 0.7847282175572585}. Best is trial 224 with value: 0.005701662740632905.\n",
      "[I 2026-07-02 16:33:28,639] Trial 280 finished with value: 0.0065654043964928485 and parameters: {'foundation_window': 10, 'ar_lags': 6, 'ema_spans': (2, 4, 8), 'conv_scales': (2, 3, 4), 'use_calendar': True, 'ridge_alpha': 0.0012166209826608909, 'shrinkage_max': 2.292339869391878, 'oob_split_ratio': 0.7640989255678489}. Best is trial 224 with value: 0.005701662740632905.\n",
      "[I 2026-07-02 16:33:28,774] Trial 281 finished with value: 0.007755945903002975 and parameters: {'foundation_window': 9, 'ar_lags': 6, 'ema_spans': (2, 4, 8), 'conv_scales': (2, 3), 'use_calendar': True, 'ridge_alpha': 0.0018073355351184677, 'shrinkage_max': 2.2288778982282977, 'oob_split_ratio': 0.6334995355530713}. Best is trial 224 with value: 0.005701662740632905.\n",
      "[I 2026-07-02 16:33:28,908] Trial 282 finished with value: 0.009356465988655653 and parameters: {'foundation_window': 10, 'ar_lags': 6, 'ema_spans': (3, 6), 'conv_scales': (2, 3), 'use_calendar': True, 'ridge_alpha': 0.0015059889131159318, 'shrinkage_max': 2.1430373995732195, 'oob_split_ratio': 0.7755613157813313}. Best is trial 224 with value: 0.005701662740632905.\n",
      "[I 2026-07-02 16:33:29,042] Trial 283 finished with value: 0.006079451921399497 and parameters: {'foundation_window': 10, 'ar_lags': 6, 'ema_spans': (2, 4, 8), 'conv_scales': (2, 3), 'use_calendar': True, 'ridge_alpha': 0.0012359374314390137, 'shrinkage_max': 2.334783009657744, 'oob_split_ratio': 0.7903081666210011}. Best is trial 224 with value: 0.005701662740632905.\n",
      "[I 2026-07-02 16:33:29,177] Trial 284 finished with value: 0.00609938721159171 and parameters: {'foundation_window': 10, 'ar_lags': 6, 'ema_spans': (2, 4, 8), 'conv_scales': (2, 3), 'use_calendar': True, 'ridge_alpha': 0.002682365751985587, 'shrinkage_max': 2.3936579585581272, 'oob_split_ratio': 0.7846191563183699}. Best is trial 224 with value: 0.005701662740632905.\n",
      "[I 2026-07-02 16:33:29,322] Trial 285 finished with value: 0.007793293919269399 and parameters: {'foundation_window': 11, 'ar_lags': 6, 'ema_spans': (2, 4, 8), 'conv_scales': (3, 6), 'use_calendar': True, 'ridge_alpha': 0.0018061815292218905, 'shrinkage_max': 2.286653188385586, 'oob_split_ratio': 0.7710626206057123}. Best is trial 224 with value: 0.005701662740632905.\n",
      "[I 2026-07-02 16:33:29,462] Trial 286 finished with value: 0.0078746982226894 and parameters: {'foundation_window': 10, 'ar_lags': 6, 'ema_spans': (3, 6, 12), 'conv_scales': (2, 3), 'use_calendar': True, 'ridge_alpha': 0.0012491031237405754, 'shrinkage_max': 2.2104941960630624, 'oob_split_ratio': 0.5941624737447967}. Best is trial 224 with value: 0.005701662740632905.\n",
      "[I 2026-07-02 16:33:29,603] Trial 287 finished with value: 0.007139262850474591 and parameters: {'foundation_window': 10, 'ar_lags': 6, 'ema_spans': (2, 4, 8), 'conv_scales': (2, 3), 'use_calendar': False, 'ridge_alpha': 0.0016027064821509825, 'shrinkage_max': 2.1338724758949312, 'oob_split_ratio': 0.7791890732810609}. Best is trial 224 with value: 0.005701662740632905.\n",
      "[I 2026-07-02 16:33:29,750] Trial 288 finished with value: 0.006105453056152266 and parameters: {'foundation_window': 10, 'ar_lags': 6, 'ema_spans': (2, 4, 8), 'conv_scales': (2, 3), 'use_calendar': True, 'ridge_alpha': 0.0010106282597481429, 'shrinkage_max': 2.281601223217516, 'oob_split_ratio': 0.7896255797137102}. Best is trial 224 with value: 0.005701662740632905.\n",
      "[I 2026-07-02 16:33:29,890] Trial 289 finished with value: 0.006115433397045946 and parameters: {'foundation_window': 10, 'ar_lags': 6, 'ema_spans': (2, 4, 8), 'conv_scales': (2, 3), 'use_calendar': True, 'ridge_alpha': 0.0023715078192935654, 'shrinkage_max': 2.3363971840256554, 'oob_split_ratio': 0.7814006625203874}. Best is trial 224 with value: 0.005701662740632905.\n",
      "[I 2026-07-02 16:33:30,038] Trial 290 finished with value: 0.009236018505790384 and parameters: {'foundation_window': 9, 'ar_lags': 6, 'ema_spans': (2, 4, 8), 'conv_scales': (2, 3), 'use_calendar': True, 'ridge_alpha': 0.0014575253082855222, 'shrinkage_max': 2.2314111953750584, 'oob_split_ratio': 0.7861199192648475}. Best is trial 224 with value: 0.005701662740632905.\n",
      "[I 2026-07-02 16:33:30,207] Trial 291 finished with value: 0.005729962646804729 and parameters: {'foundation_window': 10, 'ar_lags': 6, 'ema_spans': (2, 4, 8), 'conv_scales': (2, 3), 'use_calendar': True, 'ridge_alpha': 0.0012561068247012247, 'shrinkage_max': 2.2219837685995483, 'oob_split_ratio': 0.7768970286139529}. Best is trial 224 with value: 0.005701662740632905.\n",
      "[I 2026-07-02 16:33:30,352] Trial 292 finished with value: 0.005727721594407534 and parameters: {'foundation_window': 10, 'ar_lags': 6, 'ema_spans': (2, 4, 8), 'conv_scales': (2, 3), 'use_calendar': True, 'ridge_alpha': 0.0019345709700564272, 'shrinkage_max': 2.276897655295695, 'oob_split_ratio': 0.7712367929557393}. Best is trial 224 with value: 0.005701662740632905.\n",
      "[I 2026-07-02 16:33:30,487] Trial 293 finished with value: 0.0070609175888219945 and parameters: {'foundation_window': 10, 'ar_lags': 6, 'ema_spans': (2, 4, 8), 'conv_scales': (2, 3), 'use_calendar': True, 'ridge_alpha': 0.0020782592185740844, 'shrinkage_max': 2.4108868556253746, 'oob_split_ratio': 0.7683958679797391}. Best is trial 224 with value: 0.005701662740632905.\n",
      "[I 2026-07-02 16:33:30,626] Trial 294 finished with value: 0.009375341717015222 and parameters: {'foundation_window': 11, 'ar_lags': 6, 'ema_spans': (2, 4, 8), 'conv_scales': (2, 3), 'use_calendar': True, 'ridge_alpha': 0.0019378758529356077, 'shrinkage_max': 2.2891399919927777, 'oob_split_ratio': 0.7905769285809401}. Best is trial 224 with value: 0.005701662740632905.\n",
      "[I 2026-07-02 16:33:30,758] Trial 295 finished with value: 0.007490390054374793 and parameters: {'foundation_window': 10, 'ar_lags': 6, 'ema_spans': (2, 4, 8), 'conv_scales': (2, 3), 'use_calendar': True, 'ridge_alpha': 0.0030505964871006667, 'shrinkage_max': 2.337987280475104, 'oob_split_ratio': 0.7055202140842216}. Best is trial 224 with value: 0.005701662740632905.\n",
      "[I 2026-07-02 16:33:30,916] Trial 296 finished with value: 0.010081537238018448 and parameters: {'foundation_window': 9, 'ar_lags': 6, 'ema_spans': (2, 4, 8), 'conv_scales': (3, 6, 12), 'use_calendar': True, 'ridge_alpha': 0.0016137903535131863, 'shrinkage_max': 2.4881102606014274, 'oob_split_ratio': 0.7737809202419791}. Best is trial 224 with value: 0.005701662740632905.\n",
      "[I 2026-07-02 16:33:31,055] Trial 297 finished with value: 0.005778032397487421 and parameters: {'foundation_window': 10, 'ar_lags': 6, 'ema_spans': (2, 4, 8), 'conv_scales': (2, 3), 'use_calendar': True, 'ridge_alpha': 0.0014788034604639524, 'shrinkage_max': 2.155548208240374, 'oob_split_ratio': 0.7848211082442683}. Best is trial 224 with value: 0.005701662740632905.\n",
      "[I 2026-07-02 16:33:31,190] Trial 298 finished with value: 0.007061147354838108 and parameters: {'foundation_window': 10, 'ar_lags': 6, 'ema_spans': (2, 4, 8), 'conv_scales': (2, 3), 'use_calendar': True, 'ridge_alpha': 0.0024381198285545963, 'shrinkage_max': 2.2844184639386835, 'oob_split_ratio': 0.7648224163096301}. Best is trial 224 with value: 0.005701662740632905.\n",
      "[I 2026-07-02 16:33:31,327] Trial 299 finished with value: 0.005824455107537843 and parameters: {'foundation_window': 10, 'ar_lags': 6, 'ema_spans': (2, 4, 8), 'conv_scales': (2, 3), 'use_calendar': True, 'ridge_alpha': 0.001859273353395968, 'shrinkage_max': 2.0998136055181575, 'oob_split_ratio': 0.7720551741741556}. Best is trial 224 with value: 0.005701662740632905.\n",
      "[I 2026-07-02 16:33:31,330] A new study created in memory with name: no-name-892e807b-0cc9-45b5-a317-40cb2b50467e\n",
      "[I 2026-07-02 16:33:31,448] Trial 0 finished with value: 16.783001541884975 and parameters: {'aci_target': 0.08116262258099886, 'aci_step_size': 0.1667521176194013, 'interval_scale': 4.242013644282549, 'interval_power': 0.7483231052462957, 'min_width_factor': 0.23402796066365478}. Best is trial 0 with value: 16.783001541884975.\n",
      "[I 2026-07-02 16:33:31,562] Trial 1 finished with value: 22.678779568026744 and parameters: {'aci_target': 0.039638958863878505, 'aci_step_size': 0.006194745024628934, 'interval_scale': 5.827941999313553, 'interval_power': 0.751393764679011, 'min_width_factor': 1.0621088666940683}. Best is trial 0 with value: 16.783001541884975.\n",
      "[I 2026-07-02 16:33:31,676] Trial 2 finished with value: 8.770881725780635 and parameters: {'aci_target': 0.013911053916202464, 'aci_step_size': 0.17898794163735265, 'interval_scale': 5.380668161216503, 'interval_power': 0.2654238883478452, 'min_width_factor': 0.2727374508106509}. Best is trial 2 with value: 8.770881725780635.\n",
      "[I 2026-07-02 16:33:31,789] Trial 3 finished with value: 6.7547882969086475 and parameters: {'aci_target': 0.044846856872152424, 'aci_step_size': 0.015359756451337138, 'interval_scale': 2.5973229202817874, 'interval_power': 0.5399312733026447, 'min_width_factor': 0.43684371029706287}. Best is trial 3 with value: 6.7547882969086475.\n",
      "[I 2026-07-02 16:33:31,904] Trial 4 finished with value: 2.7140729556916154 and parameters: {'aci_target': 0.1262520499972521, 'aci_step_size': 0.008364645453054504, 'interval_scale': 1.497594903821026, 'interval_power': 0.45795230411711463, 'min_width_factor': 0.6841049763255539}. Best is trial 4 with value: 2.7140729556916154.\n",
      "[I 2026-07-02 16:33:32,020] Trial 5 finished with value: 7.174204920629204 and parameters: {'aci_target': 0.1591834326646726, 'aci_step_size': 0.010443820094525779, 'interval_scale': 2.533430745147415, 'interval_power': 0.7405182110775531, 'min_width_factor': 0.06967561907999659}. Best is trial 4 with value: 2.7140729556916154.\n",
      "[I 2026-07-02 16:33:32,134] Trial 6 finished with value: 7.00807130564408 and parameters: {'aci_target': 0.1254335218612733, 'aci_step_size': 0.009379072229909205, 'interval_scale': 0.8748551837921115, 'interval_power': 1.1861069215666666, 'min_width_factor': 1.448448049611839}. Best is trial 4 with value: 2.7140729556916154.\n",
      "[I 2026-07-02 16:33:32,246] Trial 7 finished with value: 3.3977220018387424 and parameters: {'aci_target': 0.16359549614212762, 'aci_step_size': 0.015380821666156693, 'interval_scale': 0.9450852868317626, 'interval_power': 0.8552912831401961, 'min_width_factor': 0.660228740609402}. Best is trial 4 with value: 2.7140729556916154.\n",
      "[I 2026-07-02 16:33:32,364] Trial 8 finished with value: 7.221782929930232 and parameters: {'aci_target': 0.03318726462050798, 'aci_step_size': 0.031065126086242026, 'interval_scale': 0.813605078655861, 'interval_power': 1.1366505025984777, 'min_width_factor': 0.3881699724000254}. Best is trial 4 with value: 2.7140729556916154.\n",
      "[I 2026-07-02 16:33:32,477] Trial 9 finished with value: 7.016883767661268 and parameters: {'aci_target': 0.13587923402725657, 'aci_step_size': 0.015788826347222458, 'interval_scale': 2.56865706988151, 'interval_power': 0.6833878491790996, 'min_width_factor': 0.27728168328829056}. Best is trial 4 with value: 2.7140729556916154.\n",
      "[I 2026-07-02 16:33:32,599] Trial 10 finished with value: 1.696839272044211 and parameters: {'aci_target': 0.19304533013217717, 'aci_step_size': 0.06610156725777806, 'interval_scale': 1.4936103712207425, 'interval_power': 0.022452344518524514, 'min_width_factor': 0.8484196360221048}. Best is trial 10 with value: 1.696839272044211.\n",
      "[I 2026-07-02 16:33:32,721] Trial 11 finished with value: 1.655145302433952 and parameters: {'aci_target': 0.1827625076874392, 'aci_step_size': 0.05707013708764262, 'interval_scale': 1.546408828028792, 'interval_power': 0.08106665007792413, 'min_width_factor': 0.8275726512169777}. Best is trial 11 with value: 1.655145302433952.\n",
      "[I 2026-07-02 16:33:32,845] Trial 12 finished with value: 1.9665324613633908 and parameters: {'aci_target': 0.19896598297512252, 'aci_step_size': 0.06544185131336373, 'interval_scale': 1.47546089367298, 'interval_power': 0.04180216636043358, 'min_width_factor': 0.9832662306816944}. Best is trial 11 with value: 1.655145302433952.\n",
      "[I 2026-07-02 16:33:32,964] Trial 13 finished with value: 1.937569322109726 and parameters: {'aci_target': 0.19330142170606437, 'aci_step_size': 0.0649236149153824, 'interval_scale': 1.4611864202550429, 'interval_power': 0.005394413552805646, 'min_width_factor': 0.9687846610548617}. Best is trial 11 with value: 1.655145302433952.\n",
      "[I 2026-07-02 16:33:33,087] Trial 14 finished with value: 2.2251615566470173 and parameters: {'aci_target': 0.16847955312589014, 'aci_step_size': 0.06362810741252044, 'interval_scale': 1.940910280492689, 'interval_power': 0.23344876241599138, 'min_width_factor': 0.6931244209878435}. Best is trial 11 with value: 1.655145302433952.\n",
      "[I 2026-07-02 16:33:33,209] Trial 15 finished with value: 2.3950481561243757 and parameters: {'aci_target': 0.17867811308251025, 'aci_step_size': 0.03734684374471413, 'interval_scale': 1.1673643567029786, 'interval_power': 0.19651163198571683, 'min_width_factor': 1.1975240780621847}. Best is trial 11 with value: 1.655145302433952.\n",
      "[I 2026-07-02 16:33:33,330] Trial 16 finished with value: 5.716054354382469 and parameters: {'aci_target': 0.1444469951935046, 'aci_step_size': 0.10156398732429636, 'interval_scale': 3.385345244120619, 'interval_power': 0.376029110163768, 'min_width_factor': 0.8486014859877232}. Best is trial 11 with value: 1.655145302433952.\n",
      "[I 2026-07-02 16:33:33,462] Trial 17 finished with value: 2.638841780179531 and parameters: {'aci_target': 0.09965960713693903, 'aci_step_size': 0.03747789537634222, 'interval_scale': 1.9085377176718001, 'interval_power': 0.11999662196852864, 'min_width_factor': 1.3194208900897684}. Best is trial 11 with value: 1.655145302433952.\n",
