{
 "cells": [
  {
   "cell_type": "markdown",
   "id": "e6b3d297",
   "metadata": {
    "papermill": {
     "duration": 0.009589,
     "end_time": "2026-07-02T14:56:44.094306+00:00",
     "exception": false,
     "start_time": "2026-07-02T14:56:44.084717+00:00",
     "status": "completed"
    },
    "tags": []
   },
   "source": [
    "# S3-Forecaster and S3-FastSketch on M3 Monthly\n",
    "\n",
    "This Kaggle notebook reproduces the complete experimental pipeline used in the M4 notebook for **M3 Monthly**. It includes data loading, preprocessing, point and uncertainty optimization for both proposed methods, fixed-parameter baselines on CPU, consolidated metrics, ablation studies, shock/non-shock evaluation, data-efficiency analysis, multi-prior robustness, forecast figures, residual diagnostics, and reproducible exports.\n",
    "\n",
    "Baseline hyperparameters are taken from the corresponding original dataset notebook and are not re-optimized here.\n"
   ]
  },
  {
   "cell_type": "markdown",
   "id": "d618afa7",
   "metadata": {
    "papermill": {
     "duration": 0.007855,
     "end_time": "2026-07-02T14:56:44.110637+00:00",
     "exception": false,
     "start_time": "2026-07-02T14:56:44.102782+00:00",
     "status": "completed"
    },
    "tags": []
   },
   "source": [
    "## 1. Clone and install the private repository\n",
    "\n",
    "Create a Kaggle secret named **`GITHUB_TOKEN`** containing a fine-grained GitHub token with read access to `AlejoPatigno/S3Forecaster-S3FastSketch`. The token is never printed, and the authenticated remote URL is removed immediately after cloning."
   ]
  },
  {
   "cell_type": "code",
   "execution_count": 1,
   "id": "c0f2fe27",
   "metadata": {
    "execution": {
     "iopub.execute_input": "2026-07-02T14:56:44.128919Z",
     "iopub.status.busy": "2026-07-02T14:56:44.128571Z",
     "iopub.status.idle": "2026-07-02T14:56:58.775102Z",
     "shell.execute_reply": "2026-07-02T14:56:58.774019Z"
    },
    "papermill": {
     "duration": 14.658598,
     "end_time": "2026-07-02T14:56:58.777255+00:00",
     "exception": false,
     "start_time": "2026-07-02T14:56:44.118657+00:00",
     "status": "completed"
    },
    "tags": []
   },
   "outputs": [
    {
     "name": "stdout",
     "output_type": "stream",
     "text": [
      "Repository installed from: /kaggle/working/S3Forecaster-S3FastSketch\n"
     ]
    }
   ],
   "source": [
    "from pathlib import Path\n",
    "import os\n",
    "import shutil\n",
    "import subprocess\n",
    "import sys\n",
    "\n",
    "REPO_OWNER = \"AlejoPatigno\"\n",
    "REPO_NAME = \"S3Forecaster-S3FastSketch\"\n",
    "REPO_DIR = Path(\"/kaggle/working\") / REPO_NAME\n",
    "CLEAN_REPO_URL = f\"https://github.com/{REPO_OWNER}/{REPO_NAME}.git\"\n",
    "\n",
    "\n",
    "def _run(command, *, token=None, cwd=None):\n",
    "    completed = subprocess.run(\n",
    "        command,\n",
    "        cwd=cwd,\n",
    "        text=True,\n",
    "        capture_output=True,\n",
    "        env={**os.environ, \"GIT_TERMINAL_PROMPT\": \"0\"},\n",
    "    )\n",
    "    if completed.returncode != 0:\n",
    "        stderr = completed.stderr\n",
    "        stdout = completed.stdout\n",
    "        if token:\n",
    "            stderr = stderr.replace(token, \"***\")\n",
    "            stdout = stdout.replace(token, \"***\")\n",
    "        raise RuntimeError(\n",
    "            f\"Command failed: {' '.join(map(str, command))}\\n\"\n",
    "            f\"STDOUT:\\n{stdout}\\nSTDERR:\\n{stderr}\"\n",
    "        )\n",
    "    return completed\n",
    "\n",
    "\n",
    "try:\n",
    "    from kaggle_secrets import UserSecretsClient\n",
    "    github_token = UserSecretsClient().get_secret(\"GITHUB_TOKEN\")\n",
    "except Exception:\n",
    "    github_token = None\n",
    "\n",
    "if REPO_DIR.exists():\n",
    "    shutil.rmtree(REPO_DIR)\n",
    "\n",
    "if github_token:\n",
    "    authenticated_url = (\n",
    "        f\"https://x-access-token:{github_token}@github.com/\"\n",
    "        f\"{REPO_OWNER}/{REPO_NAME}.git\"\n",
    "    )\n",
    "    _run([\"git\", \"clone\", \"--depth\", \"1\", authenticated_url, str(REPO_DIR)], token=github_token)\n",
    "else:\n",
    "    # This succeeds only when the repository is public.\n",
    "    _run([\"git\", \"clone\", \"--depth\", \"1\", CLEAN_REPO_URL, str(REPO_DIR)])\n",
    "\n",
    "# Remove the credential-bearing remote from the local git configuration.\n",
    "_run([\"git\", \"-C\", str(REPO_DIR), \"remote\", \"set-url\", \"origin\", CLEAN_REPO_URL])\n",
    "\n",
    "required_paths = [\n",
    "    REPO_DIR / \"pyproject.toml\",\n",
    "    REPO_DIR / \"s3paper\" / \"__init__.py\",\n",
    "    REPO_DIR / \"s3paper\" / \"metrics.py\",\n",
    "    REPO_DIR / \"s3paper\" / \"s3_forecaster_experiment.py\",\n",
    "    REPO_DIR / \"s3paper\" / \"s3_fastsketch_experiment.py\",\n",
    "    REPO_DIR / \"s3paper\" / \"baselines.py\",\n",
    "]\n",
    "missing = [str(path.relative_to(REPO_DIR)) for path in required_paths if not path.exists()]\n",
    "if missing:\n",
    "    raise FileNotFoundError(\n",
    "        \"The repository was cloned, but the modular s3paper package is incomplete. \"\n",
    "        f\"Missing files: {missing}\"\n",
    "    )\n",
    "\n",
    "_run([sys.executable, \"-m\", \"pip\", \"install\", \"-q\", \"-e\", str(REPO_DIR)])\n",
    "print(f\"Repository installed from: {REPO_DIR}\")"
   ]
  },
  {
   "cell_type": "code",
   "execution_count": 2,
   "id": "8c31dd2d",
   "metadata": {
    "execution": {
     "iopub.execute_input": "2026-07-02T14:56:58.796309Z",
     "iopub.status.busy": "2026-07-02T14:56:58.795955Z",
     "iopub.status.idle": "2026-07-02T14:57:31.786119Z",
     "shell.execute_reply": "2026-07-02T14:57:31.784911Z"
    },
    "papermill": {
     "duration": 33.010208,
     "end_time": "2026-07-02T14:57:31.796695+00:00",
     "exception": false,
     "start_time": "2026-07-02T14:56:58.786487+00:00",
     "status": "completed"
    },
    "tags": []
   },
   "outputs": [
    {
     "name": "stdout",
     "output_type": "stream",
     "text": [
      "Repository found at: /kaggle/working/S3Forecaster-S3FastSketch\n",
      "Obtaining file:///kaggle/working/S3Forecaster-S3FastSketch\n",
      "  Installing build dependencies: started\n",
      "  Installing build dependencies: finished with status 'done'\n",
      "  Checking if build backend supports build_editable: started\n",
      "  Checking if build backend supports build_editable: finished with status 'done'\n",
      "  Getting requirements to build editable: started\n",
      "  Getting requirements to build editable: finished with status 'done'\n",
      "  Preparing editable metadata (pyproject.toml): started\n",
      "  Preparing editable metadata (pyproject.toml): finished with status 'done'\n",
      "Requirement already satisfied: numpy>=1.24 in /usr/local/lib/python3.12/dist-packages (from s3forecaster-s3fastsketch==0.1.0) (2.0.2)\n",
      "Requirement already satisfied: pandas>=2.0 in /usr/local/lib/python3.12/dist-packages (from s3forecaster-s3fastsketch==0.1.0) (2.3.3)\n",
      "Requirement already satisfied: scipy>=1.10 in /usr/local/lib/python3.12/dist-packages (from s3forecaster-s3fastsketch==0.1.0) (1.16.3)\n",
      "Requirement already satisfied: scikit-learn>=1.3 in /usr/local/lib/python3.12/dist-packages (from s3forecaster-s3fastsketch==0.1.0) (1.6.1)\n",
      "Requirement already satisfied: statsmodels>=0.14 in /usr/local/lib/python3.12/dist-packages (from s3forecaster-s3fastsketch==0.1.0) (0.14.6)\n",
      "Requirement already satisfied: optuna>=3.5 in /usr/local/lib/python3.12/dist-packages (from s3forecaster-s3fastsketch==0.1.0) (4.9.0)\n",
      "Requirement already satisfied: matplotlib>=3.7 in /usr/local/lib/python3.12/dist-packages (from s3forecaster-s3fastsketch==0.1.0) (3.10.0)\n",
      "Requirement already satisfied: contourpy>=1.0.1 in /usr/local/lib/python3.12/dist-packages (from matplotlib>=3.7->s3forecaster-s3fastsketch==0.1.0) (1.3.3)\n",
      "Requirement already satisfied: cycler>=0.10 in /usr/local/lib/python3.12/dist-packages (from matplotlib>=3.7->s3forecaster-s3fastsketch==0.1.0) (0.12.1)\n",
      "Requirement already satisfied: fonttools>=4.22.0 in /usr/local/lib/python3.12/dist-packages (from matplotlib>=3.7->s3forecaster-s3fastsketch==0.1.0) (4.62.1)\n",
      "Requirement already satisfied: kiwisolver>=1.3.1 in /usr/local/lib/python3.12/dist-packages (from matplotlib>=3.7->s3forecaster-s3fastsketch==0.1.0) (1.5.0)\n",
      "Requirement already satisfied: packaging>=20.0 in /usr/local/lib/python3.12/dist-packages (from matplotlib>=3.7->s3forecaster-s3fastsketch==0.1.0) (26.1)\n",
      "Requirement already satisfied: pillow>=8 in /usr/local/lib/python3.12/dist-packages (from matplotlib>=3.7->s3forecaster-s3fastsketch==0.1.0) (11.3.0)\n",
      "Requirement already satisfied: pyparsing>=2.3.1 in /usr/local/lib/python3.12/dist-packages (from matplotlib>=3.7->s3forecaster-s3fastsketch==0.1.0) (3.3.2)\n",
      "Requirement already satisfied: python-dateutil>=2.7 in /usr/local/lib/python3.12/dist-packages (from matplotlib>=3.7->s3forecaster-s3fastsketch==0.1.0) (2.9.0.post0)\n",
      "Requirement already satisfied: alembic>=1.5.0 in /usr/local/lib/python3.12/dist-packages (from optuna>=3.5->s3forecaster-s3fastsketch==0.1.0) (1.18.4)\n",
      "Requirement already satisfied: colorlog in /usr/local/lib/python3.12/dist-packages (from optuna>=3.5->s3forecaster-s3fastsketch==0.1.0) (6.10.1)\n",
      "Requirement already satisfied: sqlalchemy>=1.4.2 in /usr/local/lib/python3.12/dist-packages (from optuna>=3.5->s3forecaster-s3fastsketch==0.1.0) (2.0.49)\n",
      "Requirement already satisfied: tqdm in /usr/local/lib/python3.12/dist-packages (from optuna>=3.5->s3forecaster-s3fastsketch==0.1.0) (4.67.3)\n",
      "Requirement already satisfied: PyYAML in /usr/local/lib/python3.12/dist-packages (from optuna>=3.5->s3forecaster-s3fastsketch==0.1.0) (6.0.3)\n",
      "Requirement already satisfied: pytz>=2020.1 in /usr/local/lib/python3.12/dist-packages (from pandas>=2.0->s3forecaster-s3fastsketch==0.1.0) (2025.2)\n",
      "Requirement already satisfied: tzdata>=2022.7 in /usr/local/lib/python3.12/dist-packages (from pandas>=2.0->s3forecaster-s3fastsketch==0.1.0) (2026.1)\n",
      "Requirement already satisfied: joblib>=1.2.0 in /usr/local/lib/python3.12/dist-packages (from scikit-learn>=1.3->s3forecaster-s3fastsketch==0.1.0) (1.5.3)\n",
      "Requirement already satisfied: threadpoolctl>=3.1.0 in /usr/local/lib/python3.12/dist-packages (from scikit-learn>=1.3->s3forecaster-s3fastsketch==0.1.0) (3.6.0)\n",
      "Requirement already satisfied: patsy>=0.5.6 in /usr/local/lib/python3.12/dist-packages (from statsmodels>=0.14->s3forecaster-s3fastsketch==0.1.0) (1.0.2)\n",
      "Requirement already satisfied: Mako in /usr/local/lib/python3.12/dist-packages (from alembic>=1.5.0->optuna>=3.5->s3forecaster-s3fastsketch==0.1.0) (1.3.11)\n",
      "Requirement already satisfied: typing-extensions>=4.12 in /usr/local/lib/python3.12/dist-packages (from alembic>=1.5.0->optuna>=3.5->s3forecaster-s3fastsketch==0.1.0) (4.15.0)\n",
      "Requirement already satisfied: six>=1.5 in /usr/local/lib/python3.12/dist-packages (from python-dateutil>=2.7->matplotlib>=3.7->s3forecaster-s3fastsketch==0.1.0) (1.17.0)\n",
      "Requirement already satisfied: greenlet>=1 in /usr/local/lib/python3.12/dist-packages (from sqlalchemy>=1.4.2->optuna>=3.5->s3forecaster-s3fastsketch==0.1.0) (3.4.0)\n",
      "Requirement already satisfied: MarkupSafe>=0.9.2 in /usr/local/lib/python3.12/dist-packages (from Mako->alembic>=1.5.0->optuna>=3.5->s3forecaster-s3fastsketch==0.1.0) (3.0.3)\n",
      "Building wheels for collected packages: s3forecaster-s3fastsketch\n",
      "  Building editable for s3forecaster-s3fastsketch (pyproject.toml): started\n",
      "  Building editable for s3forecaster-s3fastsketch (pyproject.toml): finished with status 'done'\n",
      "  Created wheel for s3forecaster-s3fastsketch: filename=s3forecaster_s3fastsketch-0.1.0-0.editable-py3-none-any.whl size=3038 sha256=146cd284235717ac39c0fcb11b0308a56f04a3b180dc5519073ef98f3902257f\n",
      "  Stored in directory: /tmp/pip-ephem-wheel-cache-vyikntyf/wheels/19/d3/2c/efbc2252ef060622fd0513936439e580d709ac89ae9bba4cf8\n",
      "Successfully built s3forecaster-s3fastsketch\n",
      "Installing collected packages: s3forecaster-s3fastsketch\n",
      "  Attempting uninstall: s3forecaster-s3fastsketch\n",
      "    Found existing installation: s3forecaster-s3fastsketch 0.1.0\n",
      "    Uninstalling s3forecaster-s3fastsketch-0.1.0:\n",
      "      Successfully uninstalled s3forecaster-s3fastsketch-0.1.0\n",
      "Successfully installed s3forecaster-s3fastsketch-0.1.0\n",
      "s3paper imported successfully.\n"
     ]
    }
   ],
   "source": [
    "# Run this cell immediately after cloning the repository\n",
    "\n",
    "import os\n",
    "import sys\n",
    "import subprocess\n",
    "import importlib\n",
    "from pathlib import Path\n",
    "\n",
    "# Locate the cloned repository\n",
    "possible_paths = [\n",
    "    Path(\"/kaggle/working/S3Forecaster-S3FastSketch\"),\n",
    "    Path.cwd() / \"S3Forecaster-S3FastSketch\",\n",
    "]\n",
    "\n",
    "REPO_DIR = next((path.resolve() for path in possible_paths if path.exists()), None)\n",
    "\n",
    "if REPO_DIR is None:\n",
    "    raise FileNotFoundError(\n",
    "        \"The repository folder 'S3Forecaster-S3FastSketch' was not found.\"\n",
    "    )\n",
    "\n",
    "print(f\"Repository found at: {REPO_DIR}\")\n",
    "\n",
    "# Move into the repository\n",
    "os.chdir(REPO_DIR)\n",
    "\n",
    "# Install the repository as an editable Python package\n",
    "subprocess.check_call(\n",
    "    [\n",
    "        sys.executable,\n",
    "        \"-m\",\n",
    "        \"pip\",\n",
    "        \"install\",\n",
    "        \"-e\",\n",
    "        str(REPO_DIR),\n",
    "    ]\n",
    ")\n",
    "\n",
    "# Make the repository immediately visible to the current kernel\n",
    "repo_path = str(REPO_DIR)\n",
    "if repo_path not in sys.path:\n",
    "    sys.path.insert(0, repo_path)\n",
    "\n",
    "importlib.invalidate_caches()\n",
    "\n",
    "# Verify that the package exists\n",
    "package_dir = REPO_DIR / \"s3paper\"\n",
    "\n",
    "if not package_dir.exists():\n",
    "    raise FileNotFoundError(\n",
    "        f\"The folder {package_dir} does not exist. \"\n",
    "        \"Check that the repository contains the s3paper package.\"\n",
    "    )\n",
    "\n",
    "# Imports\n",
    "from s3paper.data import apply_log_if_positive, inverse_transform\n",
    "from s3paper.metrics import evaluate_forecast, paper_metric_row\n",
    "from s3paper.residual_analysis import (\n",
    "    analyze_forecast_residuals,\n",
    "    plot_residual_diagnostics,\n",
    ")\n",
    "\n",
    "print(\"s3paper imported successfully.\")"
   ]
  },
  {
   "cell_type": "markdown",
   "id": "8df7cefe",
   "metadata": {
    "papermill": {
     "duration": 0.009063,
     "end_time": "2026-07-02T14:57:31.814420+00:00",
     "exception": false,
     "start_time": "2026-07-02T14:57:31.805357+00:00",
     "status": "completed"
    },
    "tags": []
   },
   "source": [
    "## 2. Imports, reproducibility, and experiment configuration"
   ]
  },
  {
   "cell_type": "code",
   "execution_count": 3,
   "id": "01b9a906",
   "metadata": {
    "execution": {
     "iopub.execute_input": "2026-07-02T14:57:31.834837Z",
     "iopub.status.busy": "2026-07-02T14:57:31.834259Z",
     "iopub.status.idle": "2026-07-02T14:57:54.518978Z",
     "shell.execute_reply": "2026-07-02T14:57:54.517620Z"
    },
    "papermill": {
     "duration": 22.698294,
     "end_time": "2026-07-02T14:57:54.521434+00:00",
     "exception": false,
     "start_time": "2026-07-02T14:57:31.823140+00:00",
     "status": "completed"
    },
    "tags": []
   },
   "outputs": [
    {
     "name": "stderr",
     "output_type": "stream",
     "text": [
      "2026-07-02 14:57:50.944578: E external/local_xla/xla/stream_executor/cuda/cuda_platform.cc:51] failed call to cuInit: INTERNAL: CUDA error: Failed call to cuInit: UNKNOWN ERROR (303)\n"
     ]
    },
    {
     "name": "stdout",
     "output_type": "stream",
     "text": [
      "{'dataset': 'M3 Monthly', 'series_id': None, 'series_position': 2, 'run_mode': 'paper', 'device': 'cpu', 's3_trials': (300, 200), 'fastsketch_trials': (300, 200), 'output_dir': '/kaggle/working/m3_s3_results'}\n"
     ]
    }
   ],
   "source": [
    "# Force every deep-learning baseline, including ARKAN, to use CPU.\n",
    "# Run this cell before importing TensorFlow, PyTorch, pykan, or s3paper.\n",
    "import os\n",
    "os.environ[\"CUDA_VISIBLE_DEVICES\"] = \"-1\"\n",
    "os.environ[\"TF_CPP_MIN_LOG_LEVEL\"] = \"2\"\n",
    "os.environ[\"JAX_PLATFORM_NAME\"] = \"cpu\"\n",
    "os.environ[\"OMP_NUM_THREADS\"] = \"4\"\n",
    "os.environ[\"MKL_NUM_THREADS\"] = \"4\"\n",
    "os.environ[\"OPENBLAS_NUM_THREADS\"] = \"4\"\n",
    "os.environ[\"NUMEXPR_NUM_THREADS\"] = \"4\"\n",
    "\n",
    "import inspect\n",
    "import json\n",
    "import math\n",
    "import subprocess\n",
    "import sys\n",
    "import time\n",
    "import warnings\n",
    "from dataclasses import asdict\n",
    "from pathlib import Path\n",
    "\n",
    "import matplotlib.pyplot as plt\n",
    "import numpy as np\n",
    "import pandas as pd\n",
    "from IPython.display import display\n",
    "\n",
    "try:\n",
    "    import tensorflow as tf\n",
    "    try:\n",
    "        tf.config.set_visible_devices([], \"GPU\")\n",
    "    except RuntimeError:\n",
    "        pass\n",
    "except ImportError:\n",
    "    tf = None\n",
    "\n",
    "import torch\n",
    "try:\n",
    "    torch.set_num_threads(max(1, min(4, os.cpu_count() or 1)))\n",
    "except RuntimeError:\n",
    "    pass\n",
    "try:\n",
    "    torch.set_num_interop_threads(max(1, min(2, os.cpu_count() or 1)))\n",
    "except RuntimeError:\n",
    "    pass\n",
    "torch.cuda.is_available = lambda: False\n",
    "\n",
    "from s3paper.data import apply_log_if_positive, inverse_transform\n",
    "from s3paper.metrics import evaluate_forecast, paper_metric_row\n",
    "from s3paper.residual_analysis import (\n",
    "    analyze_forecast_residuals,\n",
    "    plot_residual_diagnostics,\n",
    ")\n",
    "from s3paper.s3_forecaster_experiment import run_s3_experiment\n",
    "from s3paper.s3_fastsketch_experiment import run_fastsketch_experiment\n",
    "from s3paper.baselines import build_baseline, fit_predict_baseline\n",
    "from s3paper.utils import (\n",
    "    count_trainable_parameters,\n",
    "    ensure_series,\n",
    "    parse_forecast_output,\n",
    "    set_global_seed,\n",
    ")\n",
    "\n",
    "warnings.filterwarnings(\"ignore\")\n",
    "SEED = 42\n",
    "set_global_seed(SEED)\n",
    "\n",
    "DATASET_NAME = \"M3 Monthly\"\n",
    "DATASET_SLUG = \"m3\"\n",
    "SERIES_ID = None\n",
    "SERIES_POSITION = 2\n",
    "SEASONAL_PERIOD = 12\n",
    "ALPHA = 0.10\n",
    "VAL_SIZE = 12\n",
    "APPLY_LOG_IF_POSITIVE = True\n",
    "BASELINE_CALIBRATION_RATIO = 0.20\n",
    "BASELINE_ACI_STEP_SIZE = 0.05\n",
    "\n",
    "RUN_MODE = \"paper\"\n",
    "if RUN_MODE == \"paper\":\n",
    "    S3_POINT_TRIALS = 300\n",
    "    S3_UQ_TRIALS = 200\n",
    "    FASTSKETCH_POINT_TRIALS = 300\n",
    "    FASTSKETCH_UQ_TRIALS = 200\n",
    "else:\n",
    "    S3_POINT_TRIALS = 10\n",
    "    S3_UQ_TRIALS = 10\n",
    "    FASTSKETCH_POINT_TRIALS = 10\n",
    "    FASTSKETCH_UQ_TRIALS = 10\n",
    "\n",
    "RUN_NEURAL_BASELINES = True\n",
    "RUN_ARKAN = True\n",
    "\n",
    "OUTPUT_DIR = Path(\n",
    "    f\"/kaggle/working/{DATASET_SLUG}_s3_results\"\n",
    ")\n",
    "OUTPUT_DIR.mkdir(parents=True, exist_ok=True)\n",
    "\n",
    "print({\n",
    "    \"dataset\": DATASET_NAME,\n",
    "    \"series_id\": SERIES_ID,\n",
    "    \"series_position\": SERIES_POSITION,\n",
    "    \"run_mode\": RUN_MODE,\n",
    "    \"device\": \"cpu\",\n",
    "    \"s3_trials\": (S3_POINT_TRIALS, S3_UQ_TRIALS),\n",
    "    \"fastsketch_trials\": (\n",
    "        FASTSKETCH_POINT_TRIALS,\n",
    "        FASTSKETCH_UQ_TRIALS,\n",
    "    ),\n",
    "    \"output_dir\": str(OUTPUT_DIR),\n",
    "})\n"
   ]
  },
  {
   "cell_type": "markdown",
   "id": "88c8f0c0",
   "metadata": {
    "papermill": {
     "duration": 0.009469,
     "end_time": "2026-07-02T14:57:54.540282+00:00",
     "exception": false,
     "start_time": "2026-07-02T14:57:54.530813+00:00",
     "status": "completed"
    },
    "tags": []
   },
   "source": [
    "### Optional dependency for ARKAN"
   ]
  },
  {
   "cell_type": "code",
   "execution_count": 4,
   "id": "e8ee0309",
   "metadata": {
    "execution": {
     "iopub.execute_input": "2026-07-02T14:57:54.560789Z",
     "iopub.status.busy": "2026-07-02T14:57:54.560164Z",
     "iopub.status.idle": "2026-07-02T14:57:58.978870Z",
     "shell.execute_reply": "2026-07-02T14:57:58.977487Z"
    },
    "papermill": {
     "duration": 4.431401,
     "end_time": "2026-07-02T14:57:58.981247+00:00",
     "exception": false,
     "start_time": "2026-07-02T14:57:54.549846+00:00",
     "status": "completed"
    },
    "tags": []
   },
   "outputs": [
    {
     "name": "stdout",
     "output_type": "stream",
     "text": [
      "   ━━━━━━━━━━━━━━━━━━━━━━━━━━━━━━━━━━━━━━━━ 78.1/78.1 kB 3.0 MB/s eta 0:00:00\n",
      "Optional ARKAN dependency installed.\n"
     ]
    }
   ],
   "source": [
    "if RUN_ARKAN:\n",
    "    subprocess.run(\n",
    "        [sys.executable, \"-m\", \"pip\", \"install\", \"-q\", \"pykan\"],\n",
    "        check=True,\n",
    "    )\n",
    "    print(\"Optional ARKAN dependency installed.\")"
   ]
  },
  {
   "cell_type": "markdown",
   "id": "fe93b52b",
   "metadata": {
    "papermill":