      "[I 2026-07-02 16:31:06,515] Trial 218 finished with value: 0.00790160815872853 and parameters: {'reservoir_size': 36, 'spectral_radius': 1.1224946599009655, 'ar_lags': 6, 'foundation_window': 24, 'regressor_type': 'ElasticNet', 'reg_alpha': 1.8631424214550696, 'aci_step_size': 0.18272980297051414, 'oob_split_ratio': 0.7326472523491129}. Best is trial 135 with value: 0.00790160815872853.\n",
      "[I 2026-07-02 16:31:06,631] Trial 219 finished with value: 0.00790160815872853 and parameters: {'reservoir_size': 36, 'spectral_radius': 1.1008648285883167, 'ar_lags': 6, 'foundation_window': 24, 'regressor_type': 'ElasticNet', 'reg_alpha': 2.1617243061302767, 'aci_step_size': 0.18214604668019724, 'oob_split_ratio': 0.7338514395878654}. Best is trial 135 with value: 0.00790160815872853.\n",
      "[I 2026-07-02 16:31:06,733] Trial 220 finished with value: 0.011063761900980537 and parameters: {'reservoir_size': 24, 'spectral_radius': 1.112690920683296, 'ar_lags': 6, 'foundation_window': 23, 'regressor_type': 'ElasticNet', 'reg_alpha': 1.8663526324010085, 'aci_step_size': 0.1815652493070853, 'oob_split_ratio': 0.7329078894274536}. Best is trial 135 with value: 0.00790160815872853.\n",
      "[I 2026-07-02 16:31:06,835] Trial 221 finished with value: 0.007969244797811276 and parameters: {'reservoir_size': 35, 'spectral_radius': 1.1339492972984655, 'ar_lags': 6, 'foundation_window': 24, 'regressor_type': 'ElasticNet', 'reg_alpha': 2.176389070116233, 'aci_step_size': 0.18320024358275455, 'oob_split_ratio': 0.7375651417688169}. Best is trial 135 with value: 0.00790160815872853.\n",
      "[I 2026-07-02 16:31:06,907] Trial 222 finished with value: 0.006335398441639262 and parameters: {'reservoir_size': 28, 'spectral_radius': 1.1705887837833915, 'ar_lags': 6, 'foundation_window': 13, 'regressor_type': 'ElasticNet', 'reg_alpha': 2.567251046404731, 'aci_step_size': 0.18944330583467753, 'oob_split_ratio': 0.7313554635552422}. Best is trial 222 with value: 0.006335398441639262.\n",
      "[I 2026-07-02 16:31:06,975] Trial 223 finished with value: 0.009368710739529676 and parameters: {'reservoir_size': 27, 'spectral_radius': 1.1773153450482075, 'ar_lags': 6, 'foundation_window': 12, 'regressor_type': 'ElasticNet', 'reg_alpha': 2.5613677682381115, 'aci_step_size': 0.1973985701450483, 'oob_split_ratio': 0.7304674847467596}. Best is trial 222 with value: 0.006335398441639262.\n",
      "[I 2026-07-02 16:31:07,042] Trial 224 finished with value: 0.013474416854738111 and parameters: {'reservoir_size': 29, 'spectral_radius': 1.153658857493917, 'ar_lags': 6, 'foundation_window': 17, 'regressor_type': 'ElasticNet', 'reg_alpha': 1.9244844323837818, 'aci_step_size': 0.19030515635516343, 'oob_split_ratio': 0.7334458280330474}. Best is trial 222 with value: 0.006335398441639262.\n",
      "[I 2026-07-02 16:31:07,122] Trial 225 finished with value: 0.055603026555292145 and parameters: {'reservoir_size': 23, 'spectral_radius': 1.1999979503849203, 'ar_lags': 6, 'foundation_window': 3, 'regressor_type': 'ElasticNet', 'reg_alpha': 2.627864925216001, 'aci_step_size': 0.18312979684305203, 'oob_split_ratio': 0.7404867970163496}. Best is trial 222 with value: 0.006335398441639262.\n",
      "[I 2026-07-02 16:31:07,231] Trial 226 finished with value: 0.012494749218451957 and parameters: {'reservoir_size': 35, 'spectral_radius': 1.1819180743816098, 'ar_lags': 6, 'foundation_window': 15, 'regressor_type': 'ElasticNet', 'reg_alpha': 1.7239198911440934, 'aci_step_size': 0.19127036560140678, 'oob_split_ratio': 0.7223825535424808}. Best is trial 222 with value: 0.006335398441639262.\n",
      "[I 2026-07-02 16:31:07,329] Trial 227 finished with value: 0.013596325886479209 and parameters: {'reservoir_size': 30, 'spectral_radius': 1.2181338032350149, 'ar_lags': 6, 'foundation_window': 18, 'regressor_type': 'ElasticNet', 'reg_alpha': 3.412664881868661, 'aci_step_size': 0.19450173696032325, 'oob_split_ratio': 0.7348959250127483}. Best is trial 222 with value: 0.006335398441639262.\n",
      "[I 2026-07-02 16:31:07,424] Trial 228 finished with value: 0.009330772635760777 and parameters: {'reservoir_size': 37, 'spectral_radius': 1.158208807410681, 'ar_lags': 6, 'foundation_window': 24, 'regressor_type': 'ElasticNet', 'reg_alpha': 1.1190951716076116, 'aci_step_size': 0.1851138534437451, 'oob_split_ratio': 0.7176293457263249}. Best is trial 222 with value: 0.006335398441639262.\n",
      "[I 2026-07-02 16:31:07,528] Trial 229 finished with value: 0.07675641886064931 and parameters: {'reservoir_size': 17, 'spectral_radius': 1.1955648546708737, 'ar_lags': 6, 'foundation_window': 10, 'regressor_type': 'Ridge', 'reg_alpha': 2.06559254047654, 'aci_step_size': 0.19950554856323363, 'oob_split_ratio': 0.7298689460293997}. Best is trial 222 with value: 0.006335398441639262.\n",
      "[I 2026-07-02 16:31:07,637] Trial 230 finished with value: 0.007962433042425053 and parameters: {'reservoir_size': 47, 'spectral_radius': 1.233244914296943, 'ar_lags': 6, 'foundation_window': 24, 'regressor_type': 'ElasticNet', 'reg_alpha': 1.6344484877213463, 'aci_step_size': 0.18806867806335828, 'oob_split_ratio': 0.7232382740821113}. Best is trial 222 with value: 0.006335398441639262.\n",
      "[I 2026-07-02 16:31:07,750] Trial 231 finished with value: 0.007962433042425053 and parameters: {'reservoir_size': 34, 'spectral_radius': 1.1217540216118744, 'ar_lags': 6, 'foundation_window': 24, 'regressor_type': 'ElasticNet', 'reg_alpha': 2.350750969461201, 'aci_step_size': 0.18824647340733952, 'oob_split_ratio': 0.7273470793969197}. Best is trial 222 with value: 0.006335398441639262.\n",
      "[I 2026-07-02 16:31:07,846] Trial 232 finished with value: 0.006335398441639262 and parameters: {'reservoir_size': 38, 'spectral_radius': 1.1075437303320546, 'ar_lags': 6, 'foundation_window': 13, 'regressor_type': 'ElasticNet', 'reg_alpha': 2.174553712200092, 'aci_step_size': 0.1810847889027293, 'oob_split_ratio': 0.7310628909891741}. Best is trial 222 with value: 0.006335398441639262.\n",
      "[I 2026-07-02 16:31:07,915] Trial 233 finished with value: 0.018471754950479712 and parameters: {'reservoir_size': 29, 'spectral_radius': 1.0784696165067484, 'ar_lags': 6, 'foundation_window': 11, 'regressor_type': 'ElasticNet', 'reg_alpha': 1.9137056575718716, 'aci_step_size': 0.1806634808437265, 'oob_split_ratio': 0.7336809787409548}. Best is trial 222 with value: 0.006335398441639262.\n",
      "[I 2026-07-02 16:31:07,991] Trial 234 finished with value: 0.0075771296857683156 and parameters: {'reservoir_size': 39, 'spectral_radius': 1.071353221905835, 'ar_lags': 6, 'foundation_window': 14, 'regressor_type': 'ElasticNet', 'reg_alpha': 2.6578973747070394, 'aci_step_size': 0.18165397378649883, 'oob_split_ratio': 0.7393205413075006}. Best is trial 222 with value: 0.006335398441639262.\n",
      "[I 2026-07-02 16:31:08,096] Trial 235 finished with value: 0.0075771296857683156 and parameters: {'reservoir_size': 39, 'spectral_radius': 1.1728703044858186, 'ar_lags': 6, 'foundation_window': 14, 'regressor_type': 'ElasticNet', 'reg_alpha': 2.630031346743484, 'aci_step_size': 0.1812823148940271, 'oob_split_ratio': 0.7383770975566426}. Best is trial 222 with value: 0.006335398441639262.\n",
      "[I 2026-07-02 16:31:08,200] Trial 236 finished with value: 0.0075771296857683156 and parameters: {'reservoir_size': 39, 'spectral_radius': 1.0765962836677472, 'ar_lags': 6, 'foundation_window': 14, 'regressor_type': 'ElasticNet', 'reg_alpha': 2.7428007794759623, 'aci_step_size': 0.17701659799268052, 'oob_split_ratio': 0.741447888219632}. Best is trial 222 with value: 0.006335398441639262.\n",
      "[I 2026-07-02 16:31:08,299] Trial 237 finished with value: 0.0075771296857683156 and parameters: {'reservoir_size': 42, 'spectral_radius': 1.0976967928654173, 'ar_lags': 6, 'foundation_window': 14, 'regressor_type': 'ElasticNet', 'reg_alpha': 2.836023688498007, 'aci_step_size': 0.17563665624684624, 'oob_split_ratio': 0.7385298017463391}. Best is trial 222 with value: 0.006335398441639262.\n",
      "[I 2026-07-02 16:31:08,405] Trial 238 finished with value: 0.007574055918952618 and parameters: {'reservoir_size': 43, 'spectral_radius': 1.0967616411966021, 'ar_lags': 6, 'foundation_window': 14, 'regressor_type': 'ElasticNet', 'reg_alpha': 2.8735842719027627, 'aci_step_size': 0.17564038433732918, 'oob_split_ratio': 0.7422840366055254}. Best is trial 222 with value: 0.006335398441639262.\n",
      "[I 2026-07-02 16:31:08,512] Trial 239 finished with value: 0.0075771296857683156 and parameters: {'reservoir_size': 49, 'spectral_radius': 1.0778592587285734, 'ar_lags': 6, 'foundation_window': 14, 'regressor_type': 'ElasticNet', 'reg_alpha': 2.924856712709501, 'aci_step_size': 0.17486818562051878, 'oob_split_ratio': 0.7413777740915692}. Best is trial 222 with value: 0.006335398441639262.\n",
      "[I 2026-07-02 16:31:08,616] Trial 240 finished with value: 0.007574055918952618 and parameters: {'reservoir_size': 49, 'spectral_radius': 1.0728877027052035, 'ar_lags': 6, 'foundation_window': 14, 'regressor_type': 'ElasticNet', 'reg_alpha': 3.1935829628121803, 'aci_step_size': 0.17647322123545633, 'oob_split_ratio': 0.7446732605579445}. Best is trial 222 with value: 0.006335398441639262.\n",
      "[I 2026-07-02 16:31:08,722] Trial 241 finished with value: 0.007574055918952618 and parameters: {'reservoir_size': 51, 'spectral_radius': 1.078660608122014, 'ar_lags': 6, 'foundation_window': 14, 'regressor_type': 'ElasticNet', 'reg_alpha': 3.491559513761858, 'aci_step_size': 0.17516936568741193, 'oob_split_ratio': 0.7452525931674592}. Best is trial 222 with value: 0.006335398441639262.\n",
      "[I 2026-07-02 16:31:08,828] Trial 242 finished with value: 0.007574055918952618 and parameters: {'reservoir_size': 47, 'spectral_radius': 1.0757166584438502, 'ar_lags': 6, 'foundation_window': 14, 'regressor_type': 'ElasticNet', 'reg_alpha': 4.14579823988609, 'aci_step_size': 0.174321740955165, 'oob_split_ratio': 0.746167586048332}. Best is trial 222 with value: 0.006335398441639262.\n",
      "[I 2026-07-02 16:31:08,931] Trial 243 finished with value: 0.007574055918952618 and parameters: {'reservoir_size': 44, 'spectral_radius': 1.088094328527341, 'ar_lags': 6, 'foundation_window': 14, 'regressor_type': 'ElasticNet', 'reg_alpha': 3.501692271187846, 'aci_step_size': 0.1747837166540245, 'oob_split_ratio': 0.7439486300938958}. Best is trial 222 with value: 0.006335398441639262.\n",
      "[I 2026-07-02 16:31:09,039] Trial 244 finished with value: 0.007574055918952618 and parameters: {'reservoir_size': 52, 'spectral_radius': 1.0703452230342596, 'ar_lags': 6, 'foundation_window': 14, 'regressor_type': 'ElasticNet', 'reg_alpha': 4.250671441083463, 'aci_step_size': 0.17482236183693964, 'oob_split_ratio': 0.7435437778665227}. Best is trial 222 with value: 0.006335398441639262.\n",
      "[I 2026-07-02 16:31:09,142] Trial 245 finished with value: 0.007574055918952618 and parameters: {'reservoir_size': 50, 'spectral_radius': 1.0748141390399266, 'ar_lags': 6, 'foundation_window': 14, 'regressor_type': 'ElasticNet', 'reg_alpha': 4.050461365206955, 'aci_step_size': 0.17520684425273947, 'oob_split_ratio': 0.7443033419260681}. Best is trial 222 with value: 0.006335398441639262.\n",
      "[I 2026-07-02 16:31:09,252] Trial 246 finished with value: 0.007574055918952618 and parameters: {'reservoir_size': 51, 'spectral_radius': 1.0814198746920907, 'ar_lags': 6, 'foundation_window': 14, 'regressor_type': 'ElasticNet', 'reg_alpha': 4.497934564981539, 'aci_step_size': 0.17455470340172394, 'oob_split_ratio': 0.7476908425483553}. Best is trial 222 with value: 0.006335398441639262.\n",
      "[I 2026-07-02 16:31:09,355] Trial 247 finished with value: 0.007574055918952618 and parameters: {'reservoir_size': 48, 'spectral_radius': 1.0728215099153549, 'ar_lags': 6, 'foundation_window': 14, 'regressor_type': 'ElasticNet', 'reg_alpha': 4.921743251257945, 'aci_step_size': 0.17416462252733528, 'oob_split_ratio': 0.7433145734980386}. Best is trial 222 with value: 0.006335398441639262.\n",
      "[I 2026-07-02 16:31:09,460] Trial 248 finished with value: 0.007574055918952618 and parameters: {'reservoir_size': 50, 'spectral_radius': 1.072896944966231, 'ar_lags': 6, 'foundation_window': 14, 'regressor_type': 'Lasso', 'reg_alpha': 4.961247746487474, 'aci_step_size': 0.17299515347752378, 'oob_split_ratio': 0.7448198487699123}. Best is trial 222 with value: 0.006335398441639262.\n",
      "[I 2026-07-02 16:31:09,565] Trial 249 finished with value: 0.007574055918952618 and parameters: {'reservoir_size': 49, 'spectral_radius': 1.079724079200065, 'ar_lags': 6, 'foundation_window': 14, 'regressor_type': 'Lasso', 'reg_alpha': 4.902468109758578, 'aci_step_size': 0.17630043938259674, 'oob_split_ratio': 0.7455379376152781}. Best is trial 222 with value: 0.006335398441639262.\n",
      "[I 2026-07-02 16:31:09,675] Trial 250 finished with value: 0.007574055918952618 and parameters: {'reservoir_size': 50, 'spectral_radius': 1.0711299054568066, 'ar_lags': 6, 'foundation_window': 14, 'regressor_type': 'Lasso', 'reg_alpha': 5.02817199869196, 'aci_step_size': 0.17338341524637196, 'oob_split_ratio': 0.7455520826130722}. Best is trial 222 with value: 0.006335398441639262.\n",
      "[I 2026-07-02 16:31:09,789] Trial 251 finished with value: 0.007573141511191222 and parameters: {'reservoir_size': 52, 'spectral_radius': 1.0713567268523367, 'ar_lags': 5, 'foundation_window': 14, 'regressor_type': 'Lasso', 'reg_alpha': 5.534981751714461, 'aci_step_size': 0.17440062577560958, 'oob_split_ratio': 0.745238066933828}. Best is trial 222 with value: 0.006335398441639262.\n",
      "[I 2026-07-02 16:31:09,897] Trial 252 finished with value: 0.007573141511191222 and parameters: {'reservoir_size': 54, 'spectral_radius': 1.0776772151133864, 'ar_lags': 5, 'foundation_window': 14, 'regressor_type': 'Lasso', 'reg_alpha': 5.88451534463073, 'aci_step_size': 0.17467391733682083, 'oob_split_ratio': 0.7457930938114036}. Best is trial 222 with value: 0.006335398441639262.\n",
      "[I 2026-07-02 16:31:10,011] Trial 253 finished with value: 0.007573141511191222 and parameters: {'reservoir_size': 46, 'spectral_radius': 1.068481483688653, 'ar_lags': 5, 'foundation_window': 14, 'regressor_type': 'Lasso', 'reg_alpha': 5.527112626742534, 'aci_step_size': 0.1737404384826074, 'oob_split_ratio': 0.7468242032584885}. Best is trial 222 with value: 0.006335398441639262.\n",
      "[I 2026-07-02 16:31:10,122] Trial 254 finished with value: 0.007573141511191222 and parameters: {'reservoir_size': 53, 'spectral_radius': 1.0714232538393913, 'ar_lags': 5, 'foundation_window': 14, 'regressor_type': 'Lasso', 'reg_alpha': 5.627140160055513, 'aci_step_size': 0.1742082581765653, 'oob_split_ratio': 0.7452168437399941}. Best is trial 222 with value: 0.006335398441639262.\n",
      "[I 2026-07-02 16:31:10,285] Trial 255 finished with value: 0.007573141511191222 and parameters: {'reservoir_size': 52, 'spectral_radius': 1.0672604626867823, 'ar_lags': 5, 'foundation_window': 14, 'regressor_type': 'Lasso', 'reg_alpha': 5.922818376576886, 'aci_step_size': 0.17431962627213116, 'oob_split_ratio': 0.7457503894208151}. Best is trial 222 with value: 0.006335398441639262.\n",
      "[I 2026-07-02 16:31:10,395] Trial 256 finished with value: 0.007573141511191222 and parameters: {'reservoir_size': 51, 'spectral_radius': 1.0732309516691378, 'ar_lags': 5, 'foundation_window': 14, 'regressor_type': 'Lasso', 'reg_alpha': 5.930608914023531, 'aci_step_size': 0.17438450778069342, 'oob_split_ratio': 0.7447966481273892}. Best is trial 222 with value: 0.006335398441639262.\n",
      "[I 2026-07-02 16:31:10,503] Trial 257 finished with value: 0.007573141511191222 and parameters: {'reservoir_size': 54, 'spectral_radius': 1.0722614898110574, 'ar_lags': 5, 'foundation_window': 14, 'regressor_type': 'Lasso', 'reg_alpha': 5.835286489330942, 'aci_step_size': 0.17470487629060288, 'oob_split_ratio': 0.7452873789884665}. Best is trial 222 with value: 0.006335398441639262.\n",
      "[I 2026-07-02 16:31:10,609] Trial 258 finished with value: 0.007573141511191222 and parameters: {'reservoir_size': 53, 'spectral_radius': 1.0605763999574, 'ar_lags': 5, 'foundation_window': 14, 'regressor_type': 'Lasso', 'reg_alpha': 6.051295747054085, 'aci_step_size': 0.17498269138062245, 'oob_split_ratio': 0.7460958926535783}. Best is trial 222 with value: 0.006335398441639262.\n",
      "[I 2026-07-02 16:31:10,718] Trial 259 finished with value: 0.007573141511191222 and parameters: {'reservoir_size': 54, 'spectral_radius': 1.0579518824485432, 'ar_lags': 5, 'foundation_window': 14, 'regressor_type': 'Lasso', 'reg_alpha': 5.848605217348385, 'aci_step_size': 0.17378913634000948, 'oob_split_ratio': 0.7452664335965943}. Best is trial 222 with value: 0.006335398441639262.\n",
      "[I 2026-07-02 16:31:10,823] Trial 260 finished with value: 0.006485727304024777 and parameters: {'reservoir_size': 53, 'spectral_radius': 1.0384594475809343, 'ar_lags': 5, 'foundation_window': 13, 'regressor_type': 'Lasso', 'reg_alpha': 5.854406188779951, 'aci_step_size': 0.17338530828021606, 'oob_split_ratio': 0.7475604004595741}. Best is trial 222 with value: 0.006335398441639262.\n",
      "[I 2026-07-02 16:31:10,932] Trial 261 finished with value: 0.006485727304024777 and parameters: {'reservoir_size': 54, 'spectral_radius': 1.041077141111646, 'ar_lags': 5, 'foundation_window': 13, 'regressor_type': 'Lasso', 'reg_alpha': 5.916400302735941, 'aci_step_size': 0.17231389217015916, 'oob_split_ratio': 0.7468419009310898}. Best is trial 222 with value: 0.006335398441639262.\n",
      "[I 2026-07-02 16:31:11,039] Trial 262 finished with value: 0.006485727304024777 and parameters: {'reservoir_size': 53, 'spectral_radius': 1.042245887083578, 'ar_lags': 5, 'foundation_window': 13, 'regressor_type': 'Lasso', 'reg_alpha': 5.99119448501948, 'aci_step_size': 0.17308647647569847, 'oob_split_ratio': 0.7460023452839686}. Best is trial 222 with value: 0.006335398441639262.\n",
      "[I 2026-07-02 16:31:11,146] Trial 263 finished with value: 0.006485727304024777 and parameters: {'reservoir_size': 53, 'spectral_radius': 1.0381018682093464, 'ar_lags': 5, 'foundation_window': 13, 'regressor_type': 'Lasso', 'reg_alpha': 5.925050265994161, 'aci_step_size': 0.1723785737335605, 'oob_split_ratio': 0.7469440696557534}. Best is trial 222 with value: 0.006335398441639262.\n",
      "[I 2026-07-02 16:31:11,248] Trial 264 finished with value: 0.006485727304024777 and parameters: {'reservoir_size': 54, 'spectral_radius': 1.039210447509563, 'ar_lags': 5, 'foundation_window': 13, 'regressor_type': 'Lasso', 'reg_alpha': 6.0775000281072895, 'aci_step_size': 0.17000953718674303, 'oob_split_ratio': 0.7462332985720671}. Best is trial 222 with value: 0.006335398441639262.\n",
      "[I 2026-07-02 16:31:11,354] Trial 265 finished with value: 0.006348687155378514 and parameters: {'reservoir_size': 55, 'spectral_radius': 1.0372700605102594, 'ar_lags': 5, 'foundation_window': 13, 'regressor_type': 'Lasso', 'reg_alpha': 5.9802797658312485, 'aci_step_size': 0.16941610661220782, 'oob_split_ratio': 0.7483669468640447}. Best is trial 222 with value: 0.006335398441639262.\n",
      "[I 2026-07-02 16:31:11,456] Trial 266 finished with value: 0.006348687155378514 and parameters: {'reservoir_size': 55, 'spectral_radius': 1.034113566099994, 'ar_lags': 5, 'foundation_window': 13, 'regressor_type': 'Lasso', 'reg_alpha': 6.10761479676909, 'aci_step_size': 0.16889544906849005, 'oob_split_ratio': 0.7488457138894412}. Best is trial 222 with value: 0.006335398441639262.\n",
      "[I 2026-07-02 16:31:11,559] Trial 267 finished with value: 0.006348687155378514 and parameters: {'reservoir_size': 55, 'spectral_radius': 1.0375801062759438, 'ar_lags': 5, 'foundation_window': 13, 'regressor_type': 'Lasso', 'reg_alpha': 6.040441416185326, 'aci_step_size': 0.16862003591698907, 'oob_split_ratio': 0.7498018084415906}. Best is trial 222 with value: 0.006335398441639262.\n",
      "[I 2026-07-02 16:31:11,670] Trial 268 finished with value: 0.006348687155378514 and parameters: {'reservoir_size': 55, 'spectral_radius': 1.0367342633610146, 'ar_lags': 5, 'foundation_window': 13, 'regressor_type': 'Lasso', 'reg_alpha': 5.897628107669397, 'aci_step_size': 0.16778314092554328, 'oob_split_ratio': 0.7493286449872104}. Best is trial 222 with value: 0.006335398441639262.\n",
      "[I 2026-07-02 16:31:11,779] Trial 269 finished with value: 0.006348687155378514 and parameters: {'reservoir_size': 56, 'spectral_radius': 1.0373460847690088, 'ar_lags': 5, 'foundation_window': 13, 'regressor_type': 'Lasso', 'reg_alpha': 5.751319334314945, 'aci_step_size': 0.16842665838528756, 'oob_split_ratio': 0.7483816963455048}. Best is trial 222 with value: 0.006335398441639262.\n",
      "[I 2026-07-02 16:31:11,884] Trial 270 finished with value: 0.006348687155378514 and parameters: {'reservoir_size': 56, 'spectral_radius': 1.0310174193485668, 'ar_lags': 5, 'foundation_window': 13, 'regressor_type': 'Lasso', 'reg_alpha': 6.413490758711342, 'aci_step_size': 0.16848817125027535, 'oob_split_ratio': 0.7494612184539327}. Best is trial 222 with value: 0.006335398441639262.\n",
      "[I 2026-07-02 16:31:11,989] Trial 271 finished with value: 0.006348687155378514 and parameters: {'reservoir_size': 56, 'spectral_radius': 1.0331646832052588, 'ar_lags': 5, 'foundation_window': 13, 'regressor_type': 'Lasso', 'reg_alpha': 6.027722132647023, 'aci_step_size': 0.16893537367332478, 'oob_split_ratio': 0.7504330528165573}. Best is trial 222 with value: 0.006335398441639262.\n",
      "[I 2026-07-02 16:31:12,094] Trial 272 finished with value: 0.006348687155378514 and parameters: {'reservoir_size': 57, 'spectral_radius': 1.0292145905856986, 'ar_lags': 5, 'foundation_window': 13, 'regressor_type': 'Lasso', 'reg_alpha': 6.079509512000799, 'aci_step_size': 0.16770516824961187, 'oob_split_ratio': 0.7513210130383942}. Best is trial 222 with value: 0.006335398441639262.\n",
