      "[I 2026-07-02 14:59:53,563] Trial 95 finished with value: 2.4483039768517867 and parameters: {'aci_target': 0.0939324010113089, 'aci_step_size': 0.07420704556301302, 'interval_scale': 0.9733188594247778, 'interval_power': 0.38622037957448, 'min_width_factor': 0.6729065572618599}. Best is trial 87 with value: 2.0106447596252064.\n",
      "[I 2026-07-02 14:59:53,719] Trial 96 finished with value: 2.0432241151882797 and parameters: {'aci_target': 0.1050840117945038, 'aci_step_size': 0.08949838856746097, 'interval_scale': 0.9041587314847744, 'interval_power': 0.29851985002535697, 'min_width_factor': 0.64017067438616}. Best is trial 87 with value: 2.0106447596252064.\n",
      "[I 2026-07-02 14:59:53,873] Trial 97 finished with value: 2.0373084455177835 and parameters: {'aci_target': 0.11978584456648536, 'aci_step_size': 0.08794425605439149, 'interval_scale': 0.9362678960834243, 'interval_power': 0.3038443351859325, 'min_width_factor': 0.6417644968866583}. Best is trial 87 with value: 2.0106447596252064.\n",
      "[I 2026-07-02 14:59:54,031] Trial 98 finished with value: 2.6876472903551183 and parameters: {'aci_target': 0.11253840190618458, 'aci_step_size': 0.06330043968856085, 'interval_scale': 0.7514374879199586, 'interval_power': 0.3025821142789382, 'min_width_factor': 0.4871878065192993}. Best is trial 87 with value: 2.0106447596252064.\n",
      "[I 2026-07-02 14:59:54,188] Trial 99 finished with value: 2.5496839607203317 and parameters: {'aci_target': 0.1212910011504032, 'aci_step_size': 0.08558223693440077, 'interval_scale': 0.9404875388193792, 'interval_power': 0.5041078072654188, 'min_width_factor': 0.5634794367442588}. Best is trial 87 with value: 2.0106447596252064.\n",
      "[I 2026-07-02 14:59:54,345] Trial 100 finished with value: 2.1208516591617044 and parameters: {'aci_target': 0.1057381392340586, 'aci_step_size': 0.07757820766515135, 'interval_scale': 0.8990699875568393, 'interval_power': 0.40954016073478205, 'min_width_factor': 0.6550160561913133}. Best is trial 87 with value: 2.0106447596252064.\n",
      "[I 2026-07-02 14:59:54,502] Trial 101 finished with value: 2.4804134554994643 and parameters: {'aci_target': 0.12087259873175057, 'aci_step_size': 0.10034683038772516, 'interval_scale': 0.8426088809004479, 'interval_power': 0.3422887663454823, 'min_width_factor': 0.6261957742436145}. Best is trial 87 with value: 2.0106447596252064.\n",
      "[I 2026-07-02 14:59:54,660] Trial 102 finished with value: 2.061896220076405 and parameters: {'aci_target': 0.10628814829442543, 'aci_step_size': 0.0910720206463873, 'interval_scale': 1.0571876414155423, 'interval_power': 0.30955762330627234, 'min_width_factor': 0.721230166787576}. Best is trial 87 with value: 2.0106447596252064.\n",
      "[I 2026-07-02 14:59:54,813] Trial 103 finished with value: 2.03357568519851 and parameters: {'aci_target': 0.1312227153983382, 'aci_step_size': 0.11683655562636465, 'interval_scale': 1.0557826537302475, 'interval_power': 0.3137281820739555, 'min_width_factor': 0.7032379975657906}. Best is trial 87 with value: 2.0106447596252064.\n",
      "[I 2026-07-02 14:59:54,995] Trial 104 finished with value: 2.7809208702156787 and parameters: {'aci_target': 0.13006805121690987, 'aci_step_size': 0.11207033811229128, 'interval_scale': 0.8300728518630593, 'interval_power': 0.26145062898104404, 'min_width_factor': 0.5983761415434699}. Best is trial 87 with value: 2.0106447596252064.\n",
      "[I 2026-07-02 14:59:55,151] Trial 105 finished with value: 2.0958058297119533 and parameters: {'aci_target': 0.09565763254783168, 'aci_step_size': 0.1618253004576099, 'interval_scale': 0.9575190003583756, 'interval_power': 0.38195933178190905, 'min_width_factor': 0.7069822178145718}. Best is trial 87 with value: 2.0106447596252064.\n",
      "[I 2026-07-02 14:59:55,307] Trial 106 finished with value: 2.5851244878422093 and parameters: {'aci_target': 0.12267994484493823, 'aci_step_size': 0.14248610219290792, 'interval_scale': 0.9015093109137549, 'interval_power': 0.2851862272861827, 'min_width_factor': 0.5364250522665425}. Best is trial 87 with value: 2.0106447596252064.\n",
      "[I 2026-07-02 14:59:55,458] Trial 107 finished with value: 1.9632681240811112 and parameters: {'aci_target': 0.13431672301149197, 'aci_step_size': 0.06701287619394204, 'interval_scale': 0.7829017357758952, 'interval_power': 0.4291279712826153, 'min_width_factor': 0.6684427225624936}. Best is trial 107 with value: 1.9632681240811112.\n",
      "[I 2026-07-02 14:59:55,612] Trial 108 finished with value: 1.9589926296665565 and parameters: {'aci_target': 0.13371820746500188, 'aci_step_size': 0.06860789389599223, 'interval_scale': 0.782082093242445, 'interval_power': 0.46708851329919754, 'min_width_factor': 0.46389491079181805}. Best is trial 108 with value: 1.9589926296665565.\n",
      "[I 2026-07-02 14:59:55,763] Trial 109 finished with value: 1.9192833218143537 and parameters: {'aci_target': 0.13244116321997415, 'aci_step_size': 0.06593011759550453, 'interval_scale': 0.7783120915833678, 'interval_power': 0.4578378484310168, 'min_width_factor': 0.43868605120714826}. Best is trial 109 with value: 1.9192833218143537.\n",
      "[I 2026-07-02 14:59:55,921] Trial 110 finished with value: 2.607178783903213 and parameters: {'aci_target': 0.13189832315847405, 'aci_step_size': 0.06746058986946274, 'interval_scale': 0.8530063049679959, 'interval_power': 0.5721745467718993, 'min_width_factor': 0.4606863955956807}. Best is trial 109 with value: 1.9192833218143537.\n",
      "[I 2026-07-02 14:59:56,079] Trial 111 finished with value: 1.9167405456721092 and parameters: {'aci_target': 0.12663045476326165, 'aci_step_size': 0.08541770705822549, 'interval_scale': 0.7533326271579859, 'interval_power': 0.4249613111033031, 'min_width_factor': 0.4233708664847526}. Best is trial 111 with value: 1.9167405456721092.\n",
      "[I 2026-07-02 14:59:56,234] Trial 112 finished with value: 1.9353936596788934 and parameters: {'aci_target': 0.133099410154306, 'aci_step_size': 0.05294667271577169, 'interval_scale': 0.7564121200717926, 'interval_power': 0.474029265653624, 'min_width_factor': 0.3463878567992778}. Best is trial 111 with value: 1.9167405456721092.\n",
      "[I 2026-07-02 14:59:56,393] Trial 113 finished with value: 1.9183642999363832 and parameters: {'aci_target': 0.13670871064236387, 'aci_step_size': 0.06627622081727699, 'interval_scale': 0.7505479470962433, 'interval_power': 0.4811408306417161, 'min_width_factor': 0.3376762042488272}. Best is trial 111 with value: 1.9167405456721092.\n",
      "[I 2026-07-02 14:59:56,548] Trial 114 finished with value: 2.141752638509335 and parameters: {'aci_target': 0.1338107742110963, 'aci_step_size': 0.053536380377916144, 'interval_scale': 0.7560623134318882, 'interval_power': 0.5287561178157378, 'min_width_factor': 0.3527015873739531}. Best is trial 111 with value: 1.9167405456721092.\n",
      "[I 2026-07-02 14:59:56,702] Trial 115 finished with value: 1.9730765721110108 and parameters: {'aci_target': 0.1367355821659321, 'aci_step_size': 0.05191104217800415, 'interval_scale': 0.7796503372918238, 'interval_power': 0.4704011005306749, 'min_width_factor': 0.2629310817647686}. Best is trial 111 with value: 1.9167405456721092.\n",
      "[I 2026-07-02 14:59:56,860] Trial 116 finished with value: 1.9118535775800192 and parameters: {'aci_target': 0.12686644999618246, 'aci_step_size': 0.053428532011705665, 'interval_scale': 0.7578562974856201, 'interval_power': 0.4621615863532978, 'min_width_factor': 0.2613627901444818}. Best is trial 116 with value: 1.9118535775800192.\n",
      "[I 2026-07-02 14:59:57,014] Trial 117 finished with value: 1.9006105229526433 and parameters: {'aci_target': 0.13912911229841554, 'aci_step_size': 0.05147655209473558, 'interval_scale': 0.7522901213952435, 'interval_power': 0.4710421831957277, 'min_width_factor': 0.21800787974167252}. Best is trial 117 with value: 1.9006105229526433.\n",
      "[I 2026-07-02 14:59:57,166] Trial 118 finished with value: 1.906261203058843 and parameters: {'aci_target': 0.13682764700144748, 'aci_step_size': 0.05312108657702135, 'interval_scale': 0.7546429794636355, 'interval_power': 0.4699397441530552, 'min_width_factor': 0.2551845576743576}. Best is trial 117 with value: 1.9006105229526433.\n",
      "[I 2026-07-02 14:59:57,326] Trial 119 finished with value: 2.4628458719340824 and parameters: {'aci_target': 0.13841186023240662, 'aci_step_size': 0.04216241693095409, 'interval_scale': 0.7538872545015753, 'interval_power': 0.6024682735006174, 'min_width_factor': 0.24341604730022595}. Best is trial 117 with value: 1.9006105229526433.\n",
      "[I 2026-07-02 14:59:57,485] Trial 120 finished with value: 2.0870762653090837 and parameters: {'aci_target': 0.145265786279372, 'aci_step_size': 0.05269129287607462, 'interval_scale': 0.8287791722905733, 'interval_power': 0.4742486385766898, 'min_width_factor': 0.2980002698528841}. Best is trial 117 with value: 1.9006105229526433.\n",
      "[I 2026-07-02 14:59:57,639] Trial 121 finished with value: 1.9319537951433692 and parameters: {'aci_target': 0.12455608304322427, 'aci_step_size': 0.050426296471305435, 'interval_scale': 0.7745490580063421, 'interval_power': 0.45352928601368486, 'min_width_factor': 0.1718403072151248}. Best is trial 117 with value: 1.9006105229526433.\n",
      "[I 2026-07-02 14:59:57,795] Trial 122 finished with value: 1.934281839883263 and parameters: {'aci_target': 0.12537009821497397, 'aci_step_size': 0.047564056917744436, 'interval_scale': 0.7738924923460061, 'interval_power': 0.454312200294619, 'min_width_factor': 0.1918299543820107}. Best is trial 117 with value: 1.9006105229526433.\n",
      "[I 2026-07-02 14:59:57,954] Trial 123 finished with value: 1.886555356368174 and parameters: {'aci_target': 0.12522310838108838, 'aci_step_size': 0.04592784922015696, 'interval_scale': 0.7500188526217141, 'interval_power': 0.4507073678726892, 'min_width_factor': 0.1556734252361997}. Best is trial 123 with value: 1.886555356368174.\n",
      "[I 2026-07-02 14:59:58,107] Trial 124 finished with value: 1.9144974898952811 and parameters: {'aci_target': 0.12532755292849826, 'aci_step_size': 0.04682122491714901, 'interval_scale': 0.77571079493798, 'interval_power': 0.44728740250439925, 'min_width_factor': 0.1783753095067994}. Best is trial 123 with value: 1.886555356368174.\n",
      "[I 2026-07-02 14:59:58,264] Trial 125 finished with value: 2.094458108642161 and parameters: {'aci_target': 0.12619941350225555, 'aci_step_size': 0.04665099757359927, 'interval_scale': 0.7524316924377297, 'interval_power': 0.5119280940577956, 'min_width_factor': 0.1567165891526861}. Best is trial 123 with value: 1.886555356368174.\n",
      "[I 2026-07-02 14:59:58,425] Trial 126 finished with value: 2.0035680650879617 and parameters: {'aci_target': 0.1258167075642195, 'aci_step_size': 0.04425245140444897, 'interval_scale': 0.823614599805438, 'interval_power': 0.43906421172103477, 'min_width_factor': 0.14128405790485787}. Best is trial 123 with value: 1.886555356368174.\n",
      "[I 2026-07-02 14:59:58,580] Trial 127 finished with value: 2.289983684668077 and parameters: {'aci_target': 0.1407174699260074, 'aci_step_size': 0.059779340587468754, 'interval_scale': 0.7779940245653788, 'interval_power': 0.5563945987200936, 'min_width_factor': 0.19946106720517837}. Best is trial 123 with value: 1.886555356368174.\n",
      "[I 2026-07-02 14:59:58,736] Trial 128 finished with value: 1.8813328122329105 and parameters: {'aci_target': 0.1341394273928773, 'aci_step_size': 0.048861228722392756, 'interval_scale': 0.750546108003836, 'interval_power': 0.45690573606507223, 'min_width_factor': 0.31232271349411916}. Best is trial 128 with value: 1.8813328122329105.\n",
      "[I 2026-07-02 14:59:58,891] Trial 129 finished with value: 2.150831392572382 and parameters: {'aci_target': 0.14575714053935096, 'aci_step_size': 0.04906555436801595, 'interval_scale': 0.828360290123042, 'interval_power': 0.4893225058536311, 'min_width_factor': 0.30976267062821977}. Best is trial 128 with value: 1.8813328122329105.\n",
      "[I 2026-07-02 14:59:59,049] Trial 130 finished with value: 1.8910114613759448 and parameters: {'aci_target': 0.11711272770692051, 'aci_step_size': 0.038349984337785734, 'interval_scale': 0.751236319251876, 'interval_power': 0.4501311214066855, 'min_width_factor': 0.09436150315461225}. Best is trial 128 with value: 1.8813328122329105.\n",
      "[I 2026-07-02 14:59:59,205] Trial 131 finished with value: 1.905389415297915 and parameters: {'aci_target': 0.12904628606859603, 'aci_step_size': 0.03872727014491209, 'interval_scale': 0.7584019867217322, 'interval_power': 0.456669467690291, 'min_width_factor': 0.09812006968286888}. Best is trial 128 with value: 1.8813328122329105.\n",
      "[I 2026-07-02 14:59:59,365] Trial 132 finished with value: 2.1462229500672665 and parameters: {'aci_target': 0.11621557124544399, 'aci_step_size': 0.03879348193488108, 'interval_scale': 0.7504149252361745, 'interval_power': 0.5176745716295877, 'min_width_factor': 0.08889178468443745}. Best is trial 128 with value: 1.8813328122329105.\n",
      "[I 2026-07-02 14:59:59,530] Trial 133 finished with value: 2.0608463477211645 and parameters: {'aci_target': 0.12831885033571017, 'aci_step_size': 0.0346592885012021, 'interval_scale': 0.8182241651854815, 'interval_power': 0.45623311386519483, 'min_width_factor': 0.20268787896588145}. Best is trial 128 with value: 1.8813328122329105.\n",
      "[I 2026-07-02 14:59:59,697] Trial 134 finished with value: 20.378443725083546 and parameters: {'aci_target': 0.12411589323045635, 'aci_step_size': 0.04233332038495351, 'interval_scale': 6.252770675750075, 'interval_power': 0.5921866234234574, 'min_width_factor': 0.07638924457439676}. Best is trial 128 with value: 1.8813328122329105.\n",
      "[I 2026-07-02 14:59:59,852] Trial 135 finished with value: 2.4790569059077088 and parameters: {'aci_target': 0.11843478767554272, 'aci_step_size': 0.05595802232914273, 'interval_scale': 0.8306287305432278, 'interval_power': 0.5460294599572609, 'min_width_factor': 0.1211429293074327}. Best is trial 128 with value: 1.8813328122329105.\n",
      "[I 2026-07-02 15:00:00,025] Trial 136 finished with value: 1.9002657989191332 and parameters: {'aci_target': 0.1287472389927436, 'aci_step_size': 0.04746247544629267, 'interval_scale': 0.7524303014482567, 'interval_power': 0.4377746465555328, 'min_width_factor': 0.3412605148355697}. Best is trial 128 with value: 1.8813328122329105.\n",
      "[I 2026-07-02 15:00:00,188] Trial 137 finished with value: 1.9136394151059988 and parameters: {'aci_target': 0.12874313836145082, 'aci_step_size': 0.04790676319975558, 'interval_scale': 0.7994829276224017, 'interval_power': 0.4194509271417324, 'min_width_factor': 0.17703246428488323}. Best is trial 128 with value: 1.8813328122329105.\n",
      "[I 2026-07-02 15:00:00,351] Trial 138 finished with value: 1.9753032998076232 and parameters: {'aci_target': 0.14074529217652224, 'aci_step_size': 0.037604128306225164, 'interval_scale': 0.8523176161124603, 'interval_power': 0.42030841065411223, 'min_width_factor': 0.024356859860732993}. Best is trial 128 with value: 1.8813328122329105.\n",
      "[I 2026-07-02 15:00:00,518] Trial 139 finished with value: 2.8491128800345233 and parameters: {'aci_target': 0.12775283193968442, 'aci_step_size': 0.045259880816672746, 'interval_scale': 0.8094616033419367, 'interval_power': 0.6354170739907486, 'min_width_factor': 0.40404531614867545}. Best is trial 128 with value: 1.8813328122329105.\n",
      "[I 2026-07-02 15:00:00,679] Trial 140 finished with value: 2.0068178304871918 and parameters: {'aci_target': 0.13551620116612262, 'aci_step_size': 0.03177114399758302, 'interval_scale': 0.8883949995553253, 'interval_power': 0.40097197538616003, 'min_width_factor': 0.3108052445712549}. Best is trial 128 with value: 1.8813328122329105.\n",
      "[I 2026-07-02 15:00:00,856] Trial 141 finished with value: 1.9418031783445953 and parameters: {'aci_target': 0.12407654004263889, 'aci_step_size': 0.04722420899265618, 'interval_scale': 0.7864297284027151, 'interval_power': 0.4467967792266779, 'min_width_factor': 0.1885200406710389}. Best is trial 128 with value: 1.8813328122329105.\n",
      "[I 2026-07-02 15:00:01,024] Trial 142 finished with value: 2.1807085659554093 and parameters: {'aci_target': 0.12920472597821672, 'aci_step_size': 0.03971230018671127, 'interval_scale': 0.791474016008916, 'interval_power': 0.5062458692492308, 'min_width_factor': 0.23377300263427733}. Best is trial 128 with value: 1.8813328122329105.\n",
      "[I 2026-07-02 15:00:01,187] Trial 143 finished with value: 1.9068644754488067 and parameters: {'aci_target': 0.11443690435540371, 'aci_step_size': 0.050948577667404585, 'interval_scale': 0.7534142738283246, 'interval_power': 0.4296729139236824, 'min_width_factor': 0.1677764707762944}. Best is trial 128 with value: 1.8813328122329105.\n",
      "[I 2026-07-02 15:00:01,351] Trial 144 finished with value: 1.9122323382443385 and parameters: {'aci_target': 0.11408155078543503, 'aci_step_size': 0.04306716467491002, 'interval_scale': 0.750991500914012, 'interval_power': 0.4242684884676543, 'min_width_factor': 0.15509643781074237}. Best is trial 128 with value: 1.8813328122329105.\n",
      "[I 2026-07-02 15:00:01,519] Trial 145 finished with value: 1.9090375332050116 and parameters: {'aci_target': 0.1180183589034005, 'aci_step_size': 0.04367068027398475, 'interval_scale': 0.7523538842305973, 'interval_power': 0.4277341360239203, 'min_width_factor': 0.10480994803913488}. Best is trial 128 with value: 1.8813328122329105.\n",
      "[I 2026-07-02 15:00:01,682] Trial 146 finished with value: 2.003041503426378 and parameters: {'aci_target': 0.12017828231709497, 'aci_step_size': 0.041583794641932764, 'interval_scale': 0.8452793579979563, 'interval_power': 0.420474925855745, 'min_width_factor': 0.12193654762766386}. Best is trial 128 with value: 1.8813328122329105.\n",
      "[I 2026-07-02 15:00:01,849] Trial 147 finished with value: 1.935853356076746 and parameters: {'aci_target': 0.11508194255797766, 'aci_step_size': 0.036928643720482164, 'interval_scale': 0.8185459576702139, 'interval_power': 0.3941666804117133, 'min_width_factor': 0.09974814331490299}. Best is trial 128 with value: 1.8813328122329105.\n",
      "[I 2026-07-02 15:00:02,008] Trial 148 finished with value: 2.4033974381606376 and parameters: {'aci_target': 0.11583524864552092, 'aci_step_size': 0.028959489763648302, 'interval_scale': 0.8684564763475346, 'interval_power': 0.4975651941816218, 'min_width_factor': 0.049667471089001894}. Best is trial 128 with value: 1.8813328122329105.\n",
      "[I 2026-07-02 15:00:02,171] Trial 149 finished with value: 1.9120961140987642 and parameters: {'aci_target': 0.10968435327320221, 'aci_step_size': 0.04405680051183277, 'interval_scale': 0.7512168146857912, 'interval_power': 0.42394265637100403, 'min_width_factor': 0.23245250168105624}. Best is trial 128 with value: 1.8813328122329105.\n",
      "[I 2026-07-02 15:00:02,339] Trial 150 finished with value: 1.9125584269658409 and parameters: {'aci_target': 0.11840849749518724, 'aci_step_size': 0.044550126359823264, 'interval_scale': 0.7500007315641876, 'interval_power': 0.42455149897886235, 'min_width_factor': 0.2214666920857703}. Best is trial 128 with value: 1.8813328122329105.\n",
      "[I 2026-07-02 15:00:02,506] Trial 151 finished with value: 1.942276290476152 and parameters: {'aci_target': 0.11235865528048841, 'aci_step_size': 0.04382283544228809, 'interval_scale': 0.8038230267707218, 'interval_power': 0.3886191614753357, 'min_width_factor': 0.23203119580030349}. Best is trial 128 with value: 1.8813328122329105.\n",
      "[I 2026-07-02 15:00:02,669] Trial 152 finished with value: 1.9134982198642803 and parameters: {'aci_target': 0.12088882922465675, 'aci_step_size': 0.035230711442474257, 'interval_scale': 0.753341947828012, 'interval_power': 0.42308038802461817, 'min_width_factor': 0.2700504272647062}. Best is trial 128 with value: 1.8813328122329105.\n",
      "[I 2026-07-02 15:00:02,829] Trial 153 finished with value: 2.0928665435408695 and parameters: {'aci_target': 0.1093179672872869, 'aci_step_size': 0.03445152067682823, 'interval_scale': 0.821123677492398, 'interval_power': 0.43201172367514046, 'min_width_factor': 0.2740586990201437}. Best is trial 128 with value: 1.8813328122329105.\n",
      "[I 2026-07-02 15:00:02,987] Trial 154 finished with value: 2.159935062758542 and parameters: {'aci_target': 0.11979973512728453, 'aci_step_size': 0.040403523021201745, 'interval_scale': 0.7508572764614222, 'interval_power': 0.5233685212723063, 'min_width_factor': 0.12163696275999955}. Best is trial 128 with value: 1.8813328122329105.\n",
      "[I 2026-07-02 15:00:03,146] Trial 155 finished with value: 2.1493092941827 and parameters: {'aci_target': 0.11352181297190929, 'aci_step_size': 0.04525944914682433, 'interval_scale': 0.9137174115637587, 'interval_power': 0.4130933265198659, 'min_width_factor': 0.22363444655055065}. Best is trial 128 with value: 1.8813328122329105.\n",
      "[I 2026-07-02 15:00:03,307] Trial 156 finished with value: 2.265056088389657 and parameters: {'aci_target': 0.11958989987716134, 'aci_step_size': 0.05080688190126244, 'interval_scale': 0.8470541005820563, 'interval_power': 0.48733188812260086, 'min_width_factor': 0.15636483823688963}. Best is trial 128 with value: 1.8813328122329105.\n",
      "[I 2026-07-02 15:00:03,474] Trial 157 finished with value: 1.9728318310088504 and parameters: {'aci_target': 0.10878688672216189, 'aci_step_size': 0.05693124533116589, 'interval_scale': 0.8028783050388212, 'interval_power': 0.4359427657282154, 'min_width_factor': 0.2712958447141162}. Best is trial 128 with value: 1.8813328122329105.\n",
