      "[I 2026-07-02 16:33:30,051] Trial 159 finished with value: 6.993451626064962 and parameters: {'aci_target': 0.1940315627116469, 'aci_step_size': 0.006510883125797666, 'interval_scale': 0.7501486285443049, 'interval_power': 0.027471683161745638, 'min_width_factor': 0.7063720104159689}. Best is trial 64 with value: 6.722420918001139.\n",
      "[I 2026-07-02 16:33:30,330] Trial 160 finished with value: 7.841252609987273 and parameters: {'aci_target': 0.19991190340036558, 'aci_step_size': 0.005001202451928726, 'interval_scale': 0.8155230387297953, 'interval_power': 0.05629174576688521, 'min_width_factor': 0.7234345661554046}. Best is trial 64 with value: 6.722420918001139.\n",
      "[I 2026-07-02 16:33:30,585] Trial 161 finished with value: 7.280218950845938 and parameters: {'aci_target': 0.19376510656958842, 'aci_step_size': 0.006329317026297423, 'interval_scale': 0.779636354817711, 'interval_power': 0.02847153136589761, 'min_width_factor': 0.6728093498677683}. Best is trial 64 with value: 6.722420918001139.\n",
      "[I 2026-07-02 16:33:30,840] Trial 162 finished with value: 7.307666116776157 and parameters: {'aci_target': 0.189084573181327, 'aci_step_size': 0.00584187015056338, 'interval_scale': 0.7827810379721979, 'interval_power': 0.023328392480434473, 'min_width_factor': 0.582622440220229}. Best is trial 64 with value: 6.722420918001139.\n",
      "[I 2026-07-02 16:33:31,082] Trial 163 finished with value: 6.722962211095778 and parameters: {'aci_target': 0.19625492988852386, 'aci_step_size': 0.0084675820419432, 'interval_scale': 0.7532662290329554, 'interval_power': 0.0004827763052543426, 'min_width_factor': 0.695610893204937}. Best is trial 64 with value: 6.722420918001139.\n",
      "[I 2026-07-02 16:33:31,327] Trial 164 finished with value: 7.353002156642281 and parameters: {'aci_target': 0.19310491998268145, 'aci_step_size': 0.008512252446080736, 'interval_scale': 0.7528619431612261, 'interval_power': 0.049618168709211034, 'min_width_factor': 0.689187755968443}. Best is trial 64 with value: 6.722420918001139.\n",
      "[I 2026-07-02 16:33:31,573] Trial 165 finished with value: 6.738326131705768 and parameters: {'aci_target': 0.18727922934919786, 'aci_step_size': 0.007857901690598103, 'interval_scale': 0.750379239038247, 'interval_power': 0.0006696359763684462, 'min_width_factor': 0.7624601287382492}. Best is trial 64 with value: 6.722420918001139.\n",
      "[I 2026-07-02 16:33:31,819] Trial 166 finished with value: 7.556335173232692 and parameters: {'aci_target': 0.18856361265815147, 'aci_step_size': 0.007740463709001974, 'interval_scale': 0.8424312140902587, 'interval_power': 0.0019379493773851715, 'min_width_factor': 0.7721410654040202}. Best is trial 64 with value: 6.722420918001139.\n",
      "[I 2026-07-02 16:33:32,059] Trial 167 finished with value: 7.6681914460210665 and parameters: {'aci_target': 0.18498506016694424, 'aci_step_size': 0.008459012399956969, 'interval_scale': 0.7510763632374928, 'interval_power': 0.07327144383310655, 'min_width_factor': 0.7031168116967438}. Best is trial 64 with value: 6.722420918001139.\n",
      "[I 2026-07-02 16:33:32,303] Trial 168 finished with value: 7.8842763463054935 and parameters: {'aci_target': 0.1915229693886285, 'aci_step_size': 0.010036101981879531, 'interval_scale': 0.8829509617324154, 'interval_power': 0.0005367149925752808, 'min_width_factor': 0.6574145831403747}. Best is trial 64 with value: 6.722420918001139.\n",
      "[I 2026-07-02 16:33:32,545] Trial 169 finished with value: 7.944997967160138 and parameters: {'aci_target': 0.18756879114548322, 'aci_step_size': 0.007835944735097876, 'interval_scale': 0.8227367735761602, 'interval_power': 0.044428979882847316, 'min_width_factor': 0.7165051585694485}. Best is trial 64 with value: 6.722420918001139.\n",
      "[I 2026-07-02 16:33:32,792] Trial 170 finished with value: 11.993406214908386 and parameters: {'aci_target': 0.02844297828785243, 'aci_step_size': 0.00741460156093698, 'interval_scale': 0.8247828285743989, 'interval_power': 0.08054721003494239, 'min_width_factor': 0.623199580419136}. Best is trial 64 with value: 6.722420918001139.\n",
      "[I 2026-07-02 16:33:33,034] Trial 171 finished with value: 7.299234399158133 and parameters: {'aci_target': 0.1961829810725718, 'aci_step_size': 0.006932843852710965, 'interval_scale': 0.7860052204731894, 'interval_power': 0.027164403589832745, 'min_width_factor': 0.7499980221686554}. Best is trial 64 with value: 6.722420918001139.\n",
      "[I 2026-07-02 16:33:33,278] Trial 172 finished with value: 6.7181030471805645 and parameters: {'aci_target': 0.19176000672673, 'aci_step_size': 0.006508211591617808, 'interval_scale': 0.7506496384046828, 'interval_power': 5.675722723025691e-05, 'min_width_factor': 0.6852458737519903}. Best is trial 172 with value: 6.7181030471805645.\n",
      "[I 2026-07-02 16:33:33,522] Trial 173 finished with value: 6.823804966175099 and parameters: {'aci_target': 0.19180797486451825, 'aci_step_size': 0.008747860134386864, 'interval_scale': 0.7529462967598188, 'interval_power': 0.00297709322424423, 'min_width_factor': 0.6820412895405883}. Best is trial 172 with value: 6.7181030471805645.\n",
      "[I 2026-07-02 16:33:33,770] Trial 174 finished with value: 7.2405215311484215 and parameters: {'aci_target': 0.1919679963372905, 'aci_step_size': 0.006526104197955266, 'interval_scale': 0.8092552274259429, 'interval_power': 0.00012048429819211566, 'min_width_factor': 0.6754459884730386}. Best is trial 172 with value: 6.7181030471805645.\n",
      "[I 2026-07-02 16:33:34,010] Trial 175 finished with value: 7.338604923141814 and parameters: {'aci_target': 0.19497766118286458, 'aci_step_size': 0.007266231946599148, 'interval_scale': 0.7501020156150711, 'interval_power': 0.0557742045634084, 'min_width_factor': 0.7152703048767327}. Best is trial 172 with value: 6.7181030471805645.\n",
      "[I 2026-07-02 16:33:34,256] Trial 176 finished with value: 7.804509490282672 and parameters: {'aci_target': 0.19062914696535924, 'aci_step_size': 0.00793845966382009, 'interval_scale': 0.8645209208589076, 'interval_power': 0.0007247571093284052, 'min_width_factor': 0.7715189242229684}. Best is trial 172 with value: 6.7181030471805645.\n",
      "[I 2026-07-02 16:33:34,498] Trial 177 finished with value: 7.485987318331557 and parameters: {'aci_target': 0.1877155879524185, 'aci_step_size': 0.009057249247465803, 'interval_scale': 0.8002152973151131, 'interval_power': 0.024054784728851576, 'min_width_factor': 0.6483282125580222}. Best is trial 172 with value: 6.7181030471805645.\n",
      "[I 2026-07-02 16:33:34,744] Trial 178 finished with value: 21.051135711068834 and parameters: {'aci_target': 0.19580242975198764, 'aci_step_size': 0.005669298686938273, 'interval_scale': 0.8394894923970645, 'interval_power': 0.5796940881477366, 'min_width_factor': 0.6894331338091021}. Best is trial 172 with value: 6.7181030471805645.\n",
      "[I 2026-07-02 16:33:34,988] Trial 179 finished with value: 7.619628587521594 and parameters: {'aci_target': 0.1856088035430039, 'aci_step_size': 0.0063472888818717575, 'interval_scale': 0.7791409221387201, 'interval_power': 0.051450408438491, 'min_width_factor': 0.8141009137998972}. Best is trial 172 with value: 6.7181030471805645.\n",
      "[I 2026-07-02 16:33:35,233] Trial 180 finished with value: 8.273614998891341 and parameters: {'aci_target': 0.19977745645859393, 'aci_step_size': 0.007067689678232275, 'interval_scale': 0.8955210593071158, 'interval_power': 0.028724445641087174, 'min_width_factor': 0.5893788976346411}. Best is trial 172 with value: 6.7181030471805645.\n",
      "[I 2026-07-02 16:33:35,480] Trial 181 finished with value: 6.8884749927082956 and parameters: {'aci_target': 0.18307361745749157, 'aci_step_size': 0.008888516435436112, 'interval_scale': 0.7604174719574058, 'interval_power': 0.00016809612240834806, 'min_width_factor': 0.6180757684020135}. Best is trial 172 with value: 6.7181030471805645.\n",
      "[I 2026-07-02 16:33:35,727] Trial 182 finished with value: 6.9648407123933005 and parameters: {'aci_target': 0.1896536438945778, 'aci_step_size': 0.009796514353264832, 'interval_scale': 0.7511006932337563, 'interval_power': 0.0206246673801849, 'min_width_factor': 0.6456056827209329}. Best is trial 172 with value: 6.7181030471805645.\n",
      "[I 2026-07-02 16:33:35,974] Trial 183 finished with value: 7.1485039967451165 and parameters: {'aci_target': 0.18113549014866562, 'aci_step_size': 0.011229743020242213, 'interval_scale': 0.7546755126961807, 'interval_power': 0.02261730687352355, 'min_width_factor': 0.6438501732236791}. Best is trial 172 with value: 6.7181030471805645.\n",
      "[I 2026-07-02 16:33:36,223] Trial 184 finished with value: 7.666688804658252 and parameters: {'aci_target': 0.18584633150998303, 'aci_step_size': 0.01121892634481839, 'interval_scale': 0.781568535031687, 'interval_power': 0.04789993795375795, 'min_width_factor': 0.6383747191986903}. Best is trial 172 with value: 6.7181030471805645.\n",
      "[I 2026-07-02 16:33:36,476] Trial 185 finished with value: 9.527011890215501 and parameters: {'aci_target': 0.05848811044908255, 'aci_step_size': 0.012281054281768204, 'interval_scale': 0.7529258169895334, 'interval_power': 0.0015625615299157385, 'min_width_factor': 0.6075466847012416}. Best is trial 172 with value: 6.7181030471805645.\n",
      "[I 2026-07-02 16:33:36,734] Trial 186 finished with value: 8.376428427594874 and parameters: {'aci_target': 0.1928456996057371, 'aci_step_size': 0.009693934400504834, 'interval_scale': 0.8279825693912582, 'interval_power': 0.06797032173630743, 'min_width_factor': 0.662886076725977}. Best is trial 172 with value: 6.7181030471805645.\n",
      "[I 2026-07-02 16:33:36,992] Trial 187 finished with value: 7.068128730922761 and parameters: {'aci_target': 0.1820759110726855, 'aci_step_size': 0.008907178382361677, 'interval_scale': 0.7508202686360462, 'interval_power': 0.022260143861335655, 'min_width_factor': 0.6398006472104284}. Best is trial 172 with value: 6.7181030471805645.\n",
      "[I 2026-07-02 16:33:37,242] Trial 188 finished with value: 8.514006963019318 and parameters: {'aci_target': 0.18927057075493808, 'aci_step_size': 0.009030371424363179, 'interval_scale': 0.811311590940124, 'interval_power': 0.09406829543558885, 'min_width_factor': 0.5822616601792614}. Best is trial 172 with value: 6.7181030471805645.\n",
      "[I 2026-07-02 16:33:37,485] Trial 189 finished with value: 8.165560866476225 and parameters: {'aci_target': 0.1930212359078381, 'aci_step_size': 0.008098327196300981, 'interval_scale': 0.8570550830610817, 'interval_power': 0.03567727736226815, 'min_width_factor': 0.6871159245511167}. Best is trial 172 with value: 6.7181030471805645.\n",
      "[I 2026-07-02 16:33:37,734] Trial 190 finished with value: 9.899708502418568 and parameters: {'aci_target': 0.08806772429566692, 'aci_step_size': 0.008615683572407435, 'interval_scale': 0.7922290003080488, 'interval_power': 0.0005870278942335314, 'min_width_factor': 0.607372508974437}. Best is trial 172 with value: 6.7181030471805645.\n",
      "[I 2026-07-02 16:33:37,978] Trial 191 finished with value: 7.122785187362259 and parameters: {'aci_target': 0.18218913983426213, 'aci_step_size': 0.010894234772386558, 'interval_scale': 0.7523380794236809, 'interval_power': 0.02367592532327143, 'min_width_factor': 0.6454467489979521}. Best is trial 172 with value: 6.7181030471805645.\n",
      "[I 2026-07-02 16:33:38,224] Trial 192 finished with value: 7.1355666506047655 and parameters: {'aci_target': 0.18248815532288182, 'aci_step_size': 0.01065086141123976, 'interval_scale': 0.7520120231825849, 'interval_power': 0.02553712495664999, 'min_width_factor': 0.6447545658624988}. Best is trial 172 with value: 6.7181030471805645.\n",
      "[I 2026-07-02 16:33:38,467] Trial 193 finished with value: 7.587146881585197 and parameters: {'aci_target': 0.1960307652275809, 'aci_step_size': 0.005362548136073683, 'interval_scale': 0.7893004685547579, 'interval_power': 0.050555990929523315, 'min_width_factor': 0.6763967269405204}. Best is trial 172 with value: 6.7181030471805645.\n",
      "[I 2026-07-02 16:33:38,715] Trial 194 finished with value: 7.716628091868838 and parameters: {'aci_target': 0.18763353628869042, 'aci_step_size': 0.009765075649282189, 'interval_scale': 0.8200280436705615, 'interval_power': 0.026447905804241355, 'min_width_factor': 0.6194425859962824}. Best is trial 172 with value: 6.7181030471805645.\n",
      "[I 2026-07-02 16:33:38,957] Trial 195 finished with value: 7.843277005110592 and parameters: {'aci_target': 0.18416542017624127, 'aci_step_size': 0.007289390610234469, 'interval_scale': 0.7792490120817365, 'interval_power': 0.06532448444519039, 'min_width_factor': 0.7190365443630343}. Best is trial 172 with value: 6.7181030471805645.\n",
      "[I 2026-07-02 16:33:39,211] Trial 196 finished with value: 7.482048142075411 and parameters: {'aci_target': 0.1967240122105691, 'aci_step_size': 0.006601729393772106, 'interval_scale': 0.8151526541235157, 'interval_power': 0.021588799160817736, 'min_width_factor': 0.5756599574772474}. Best is trial 172 with value: 6.7181030471805645.\n",
      "[I 2026-07-02 16:33:39,465] Trial 197 finished with value: 7.744163528141222 and parameters: {'aci_target': 0.19043984536745662, 'aci_step_size': 0.0075507149939271, 'interval_scale': 0.8578200678850089, 'interval_power': 0.0011542189255446785, 'min_width_factor': 0.5437796126993528}. Best is trial 172 with value: 6.7181030471805645.\n",
      "[I 2026-07-02 16:33:39,715] Trial 198 finished with value: 7.168453155630408 and parameters: {'aci_target': 0.19968483356988928, 'aci_step_size': 0.008978122228043183, 'interval_scale': 0.7508409694171166, 'interval_power': 0.04462552277189697, 'min_width_factor': 0.6551754548238604}. Best is trial 172 with value: 6.7181030471805645.\n",
