      "[I 2026-07-02 16:31:37,712] Trial 43 finished with value: 0.02610042038843806 and parameters: {'foundation_window': 2, 'ar_lags': 5, 'ema_spans': (2, 3, 5, 8), 'conv_scales': (2, 3), 'use_calendar': True, 'ridge_alpha': 0.0021266858551062433, 'shrinkage_max': 1.363975333315446, 'oob_split_ratio': 0.6976450118920551}. Best is trial 21 with value: 0.013062089843873569.\n",
      "[I 2026-07-02 16:31:37,961] Trial 44 finished with value: 0.032548660655564894 and parameters: {'foundation_window': 3, 'ar_lags': 4, 'ema_spans': (2, 3, 5, 8), 'conv_scales': (2, 3), 'use_calendar': True, 'ridge_alpha': 0.0031429250412002845, 'shrinkage_max': 1.5074395603128599, 'oob_split_ratio': 0.7304281319660038}. Best is trial 21 with value: 0.013062089843873569.\n",
      "[I 2026-07-02 16:31:38,266] Trial 45 finished with value: 0.026966854672753643 and parameters: {'foundation_window': 5, 'ar_lags': 3, 'ema_spans': (2, 4), 'conv_scales': (3, 6, 12), 'use_calendar': True, 'ridge_alpha': 0.001423095399060063, 'shrinkage_max': 1.744910824573305, 'oob_split_ratio': 0.7139836343780095}. Best is trial 21 with value: 0.013062089843873569.\n",
      "[I 2026-07-02 16:31:38,568] Trial 46 finished with value: 0.026573079631093902 and parameters: {'foundation_window': 4, 'ar_lags': 2, 'ema_spans': (3, 6), 'conv_scales': (2, 3, 4), 'use_calendar': False, 'ridge_alpha': 72.91983199921091, 'shrinkage_max': 1.1029350549324846, 'oob_split_ratio': 0.6941143588420257}. Best is trial 21 with value: 0.013062089843873569.\n",
      "[I 2026-07-02 16:31:38,819] Trial 47 finished with value: 0.054916177713793306 and parameters: {'foundation_window': 2, 'ar_lags': 4, 'ema_spans': (2, 4, 8), 'conv_scales': (2, 3), 'use_calendar': False, 'ridge_alpha': 0.09409928767796047, 'shrinkage_max': 0.7764616261253433, 'oob_split_ratio': 0.7659809646891211}. Best is trial 21 with value: 0.013062089843873569.\n",
      "[I 2026-07-02 16:31:39,063] Trial 48 finished with value: 0.027168535327266586 and parameters: {'foundation_window': 3, 'ar_lags': 2, 'ema_spans': (2, 3, 5, 8), 'conv_scales': (3, 6), 'use_calendar': True, 'ridge_alpha': 0.007470152490083197, 'shrinkage_max': 1.3269115912507283, 'oob_split_ratio': 0.7474607524062332}. Best is trial 21 with value: 0.013062089843873569.\n",
      "[I 2026-07-02 16:31:39,318] Trial 49 finished with value: 0.0198593629453704 and parameters: {'foundation_window': 4, 'ar_lags': 5, 'ema_spans': (3, 6, 12), 'conv_scales': (2, 3), 'use_calendar': False, 'ridge_alpha': 0.014602706868311922, 'shrinkage_max': 0.5944113828831142, 'oob_split_ratio': 0.6794020055226726}. Best is trial 21 with value: 0.013062089843873569.\n",
      "[I 2026-07-02 16:31:39,637] Trial 50 finished with value: 0.031809464099429786 and parameters: {'foundation_window': 2, 'ar_lags': 1, 'ema_spans': (2, 3, 5, 8), 'conv_scales': (2, 4, 8), 'use_calendar': True, 'ridge_alpha': 0.0033385282966957833, 'shrinkage_max': 0.9605270021825904, 'oob_split_ratio': 0.7063881532712359}. Best is trial 21 with value: 0.013062089843873569.\n",
      "[I 2026-07-02 16:31:39,889] Trial 51 finished with value: 0.013885642262772451 and parameters: {'foundation_window': 3, 'ar_lags': 3, 'ema_spans': (2, 3, 5, 8), 'conv_scales': (2, 3), 'use_calendar': True, 'ridge_alpha': 0.001738049995772508, 'shrinkage_max': 1.2005212650348616, 'oob_split_ratio': 0.712338845560514}. Best is trial 21 with value: 0.013062089843873569.\n",
      "[I 2026-07-02 16:31:40,151] Trial 52 finished with value: 0.031808427071754096 and parameters: {'foundation_window': 3, 'ar_lags': 3, 'ema_spans': (2, 3, 5, 8), 'conv_scales': (2, 3), 'use_calendar': True, 'ridge_alpha': 0.001665657653498896, 'shrinkage_max': 1.235474498930806, 'oob_split_ratio': 0.7222302842156726}. Best is trial 21 with value: 0.013062089843873569.\n",
      "[I 2026-07-02 16:31:40,430] Trial 53 finished with value: 0.02799872776998627 and parameters: {'foundation_window': 3, 'ar_lags': 3, 'ema_spans': (2, 3, 5, 8), 'conv_scales': (2, 3), 'use_calendar': True, 'ridge_alpha': 0.001098414058382574, 'shrinkage_max': 1.692428403919774, 'oob_split_ratio': 0.7336150390110769}. Best is trial 21 with value: 0.013062089843873569.\n",
      "[I 2026-07-02 16:31:40,681] Trial 54 finished with value: 0.02470698413936223 and parameters: {'foundation_window': 2, 'ar_lags': 3, 'ema_spans': (2, 3, 5, 8), 'conv_scales': (2, 3), 'use_calendar': True, 'ridge_alpha': 0.003252395785897743, 'shrinkage_max': 1.4714970308192528, 'oob_split_ratio': 0.7140533524034803}. Best is trial 21 with value: 0.013062089843873569.\n",
      "[I 2026-07-02 16:31:40,936] Trial 55 finished with value: 0.02682938195515641 and parameters: {'foundation_window': 4, 'ar_lags': 6, 'ema_spans': (2, 3, 5, 8), 'conv_scales': (2, 3), 'use_calendar': False, 'ridge_alpha': 0.005647612053325294, 'shrinkage_max': 0.8457655218666419, 'oob_split_ratio': 0.699592149305717}. Best is trial 21 with value: 0.013062089843873569.\n",
      "[I 2026-07-02 16:31:41,187] Trial 56 finished with value: 0.020053904612505367 and parameters: {'foundation_window': 3, 'ar_lags': 4, 'ema_spans': (2, 3, 5, 8), 'conv_scales': (2, 3), 'use_calendar': True, 'ridge_alpha': 0.0018793469026625609, 'shrinkage_max': 1.8918895507380413, 'oob_split_ratio': 0.6853692415657594}. Best is trial 21 with value: 0.013062089843873569.\n",
      "[I 2026-07-02 16:31:41,440] Trial 57 finished with value: 0.017775125142943445 and parameters: {'foundation_window': 2, 'ar_lags': 2, 'ema_spans': (2, 3, 5, 8), 'conv_scales': (2, 3), 'use_calendar': True, 'ridge_alpha': 2.6847904837205996, 'shrinkage_max': 2.967312423372671, 'oob_split_ratio': 0.6712479700148748}. Best is trial 21 with value: 0.013062089843873569.\n",
      "[I 2026-07-02 16:31:41,750] Trial 58 finished with value: 0.043734797860638525 and parameters: {'foundation_window': 4, 'ar_lags': 1, 'ema_spans': (2, 3, 5, 8), 'conv_scales': (3, 6, 12), 'use_calendar': False, 'ridge_alpha': 0.009868222176553662, 'shrinkage_max': 1.5935980125346654, 'oob_split_ratio': 0.7536430716857747}. Best is trial 21 with value: 0.013062089843873569.\n",
      "[I 2026-07-02 16:31:41,999] Trial 59 finished with value: 0.05517397899535437 and parameters: {'foundation_window': 8, 'ar_lags': 3, 'ema_spans': (2, 3, 5, 8), 'conv_scales': (2, 3), 'use_calendar': True, 'ridge_alpha': 0.001499652967508068, 'shrinkage_max': 2.1254819529979514, 'oob_split_ratio': 0.7393904003472649}. Best is trial 21 with value: 0.013062089843873569.\n",
      "[I 2026-07-02 16:31:42,241] Trial 60 finished with value: 0.018201195242999412 and parameters: {'foundation_window': 3, 'ar_lags': 5, 'ema_spans': (2, 4), 'conv_scales': (2, 3), 'use_calendar': False, 'ridge_alpha': 0.002768485078507565, 'shrinkage_max': 1.1307897306793795, 'oob_split_ratio': 0.7247074855457325}. Best is trial 21 with value: 0.013062089843873569.\n",
      "[I 2026-07-02 16:31:42,492] Trial 61 finished with value: 0.017514125656183332 and parameters: {'foundation_window': 3, 'ar_lags': 3, 'ema_spans': (2, 3, 5, 8), 'conv_scales': (2, 3), 'use_calendar': True, 'ridge_alpha': 0.0010207882119350371, 'shrinkage_max': 1.1572165149254905, 'oob_split_ratio': 0.7173091172758188}. Best is trial 21 with value: 0.013062089843873569.\n",
      "[I 2026-07-02 16:31:42,746] Trial 62 finished with value: 0.029238670650161877 and parameters: {'foundation_window': 2, 'ar_lags': 3, 'ema_spans': (2, 3, 5, 8), 'conv_scales': (2, 3), 'use_calendar': True, 'ridge_alpha': 0.0010313732096816223, 'shrinkage_max': 1.320781502991979, 'oob_split_ratio': 0.7026568621758027}. Best is trial 21 with value: 0.013062089843873569.\n",
      "[I 2026-07-02 16:31:42,997] Trial 63 finished with value: 0.017897888574493353 and parameters: {'foundation_window': 3, 'ar_lags': 3, 'ema_spans': (2, 3, 5, 8), 'conv_scales': (2, 3), 'use_calendar': True, 'ridge_alpha': 0.0024874393415494295, 'shrinkage_max': 1.0184832286512915, 'oob_split_ratio': 0.7157901393870385}. Best is trial 21 with value: 0.013062089843873569.\n",
      "[I 2026-07-02 16:31:43,246] Trial 64 finished with value: 0.01898103064922294 and parameters: {'foundation_window': 2, 'ar_lags': 4, 'ema_spans': (2, 3, 5, 8), 'conv_scales': (2, 3), 'use_calendar': True, 'ridge_alpha': 0.004576815567065824, 'shrinkage_max': 1.1968739117467668, 'oob_split_ratio': 0.7354596906108996}. Best is trial 21 with value: 0.013062089843873569.\n",
      "[I 2026-07-02 16:31:43,501] Trial 65 finished with value: 0.04071406698866325 and parameters: {'foundation_window': 5, 'ar_lags': 2, 'ema_spans': (2, 3, 5, 8), 'conv_scales': (2, 3), 'use_calendar': True, 'ridge_alpha': 0.0017759117852131194, 'shrinkage_max': 1.4153767133614428, 'oob_split_ratio': 0.6903167182778994}. Best is trial 21 with value: 0.013062089843873569.\n",
      "[I 2026-07-02 16:31:43,811] Trial 66 finished with value: 0.061673688206855364 and parameters: {'foundation_window': 11, 'ar_lags': 3, 'ema_spans': (3, 6, 12), 'conv_scales': (2, 3, 4), 'use_calendar': True, 'ridge_alpha': 0.0036876505858886963, 'shrinkage_max': 1.5449305191164184, 'oob_split_ratio': 0.7113267973854092}. Best is trial 21 with value: 0.013062089843873569.\n",
      "[I 2026-07-02 16:31:44,052] Trial 67 finished with value: 0.03316474973840387 and parameters: {'foundation_window': 3, 'ar_lags': 2, 'ema_spans': (3, 6), 'conv_scales': (2, 3), 'use_calendar': True, 'ridge_alpha': 0.006240558949476957, 'shrinkage_max': 1.6948825179532747, 'oob_split_ratio': 0.7280642048891018}. Best is trial 21 with value: 0.013062089843873569.\n",
      "[I 2026-07-02 16:31:44,365] Trial 68 finished with value: 0.0595855640496268 and parameters: {'foundation_window': 4, 'ar_lags': 3, 'ema_spans': (2, 3, 5, 8), 'conv_scales': (2, 4, 8), 'use_calendar': False, 'ridge_alpha': 0.0014317585750712532, 'shrinkage_max': 1.286507788132831, 'oob_split_ratio': 0.6597756982951118}. Best is trial 21 with value: 0.013062089843873569.\n",
      "[I 2026-07-02 16:31:44,609] Trial 69 finished with value: 0.03183258348985965 and parameters: {'foundation_window': 2, 'ar_lags': 1, 'ema_spans': (2, 4, 8), 'conv_scales': (3, 6), 'use_calendar': True, 'ridge_alpha': 0.0023754580892656175, 'shrinkage_max': 0.8454245068908102, 'oob_split_ratio': 0.6762718326069055}. Best is trial 21 with value: 0.013062089843873569.\n",
      "[I 2026-07-02 16:31:44,864] Trial 70 finished with value: 0.012731663504917173 and parameters: {'foundation_window': 3, 'ar_lags': 3, 'ema_spans': (2, 3, 5, 8), 'conv_scales': (2, 3), 'use_calendar': True, 'ridge_alpha': 0.018840686385944067, 'shrinkage_max': 0.5137049711139166, 'oob_split_ratio': 0.6953374893868108}. Best is trial 70 with value: 0.012731663504917173.\n",
      "[I 2026-07-02 16:31:45,116] Trial 71 finished with value: 0.013497442288166074 and parameters: {'foundation_window': 3, 'ar_lags': 3, 'ema_spans': (2, 3, 5, 8), 'conv_scales': (2, 3), 'use_calendar': True, 'ridge_alpha': 0.5131282172563436, 'shrinkage_max': 0.2993819426533265, 'oob_split_ratio': 0.6953344871517871}. Best is trial 70 with value: 0.012731663504917173.\n",
      "[I 2026-07-02 16:31:45,366] Trial 72 finished with value: 0.012318797502315943 and parameters: {'foundation_window': 3, 'ar_lags': 3, 'ema_spans': (2, 3, 5, 8), 'conv_scales': (2, 3), 'use_calendar': True, 'ridge_alpha': 0.2840414714093079, 'shrinkage_max': 0.38957553697951, 'oob_split_ratio': 0.6917494897705546}. Best is trial 72 with value: 0.012318797502315943.\n",
      "[I 2026-07-02 16:31:45,616] Trial 73 finished with value: 0.01040007308244127 and parameters: {'foundation_window': 4, 'ar_lags': 4, 'ema_spans': (2, 3, 5, 8), 'conv_scales': (2, 3), 'use_calendar': True, 'ridge_alpha': 1.029992196181584, 'shrinkage_max': 0.27122281856976194, 'oob_split_ratio': 0.6936958895393409}. Best is trial 73 with value: 0.01040007308244127.\n",
      "[I 2026-07-02 16:31:45,870] Trial 74 finished with value: 0.01007115435177849 and parameters: {'foundation_window': 4, 'ar_lags': 4, 'ema_spans': (2, 3, 5, 8), 'conv_scales': (2, 3), 'use_calendar': True, 'ridge_alpha': 0.6426912276173037, 'shrinkage_max': 0.28247204721579483, 'oob_split_ratio': 0.6938247702118112}. Best is trial 74 with value: 0.01007115435177849.\n",
      "[I 2026-07-02 16:31:46,127] Trial 75 finished with value: 0.01016323717251334 and parameters: {'foundation_window': 4, 'ar_lags': 4, 'ema_spans': (2, 3, 5, 8), 'conv_scales': (2, 3), 'use_calendar': True, 'ridge_alpha': 0.6581032343831383, 'shrinkage_max': 0.25239953946586446, 'oob_split_ratio': 0.6929722566872858}. Best is trial 74 with value: 0.01007115435177849.\n",
      "[I 2026-07-02 16:31:46,377] Trial 76 finished with value: 0.014485051921578737 and parameters: {'foundation_window': 5, 'ar_lags': 4, 'ema_spans': (2, 3, 5, 8), 'conv_scales': (2, 3), 'use_calendar': True, 'ridge_alpha': 0.5917645871676251, 'shrinkage_max': 0.26681233718400993, 'oob_split_ratio': 0.6706603499736445}. Best is trial 74 with value: 0.01007115435177849.\n",
      "[I 2026-07-02 16:31:46,624] Trial 77 finished with value: 0.013819817386430509 and parameters: {'foundation_window': 4, 'ar_lags': 4, 'ema_spans': (2, 3, 5, 8), 'conv_scales': (2, 3), 'use_calendar': True, 'ridge_alpha': 0.641710769208651, 'shrinkage_max': 0.48996863668956475, 'oob_split_ratio': 0.6936952503926973}. Best is trial 74 with value: 0.01007115435177849.\n",
      "[I 2026-07-02 16:31:46,892] Trial 78 finished with value: 0.019588674386435592 and parameters: {'foundation_window': 5, 'ar_lags': 4, 'ema_spans': (2, 3, 5, 8), 'conv_scales': (2, 3), 'use_calendar': True, 'ridge_alpha': 0.638728666271126, 'shrinkage_max': 0.47344291211546013, 'oob_split_ratio': 0.6927501831059987}. Best is trial 74 with value: 0.01007115435177849.\n",
      "[I 2026-07-02 16:31:47,144] Trial 79 finished with value: 0.014245049685647946 and parameters: {'foundation_window': 4, 'ar_lags': 4, 'ema_spans': (2, 3, 5, 8), 'conv_scales': (2, 3), 'use_calendar': True, 'ridge_alpha': 1.0213842713222308, 'shrinkage_max': 0.49439091634752186, 'oob_split_ratio': 0.6866903915012345}. Best is trial 74 with value: 0.01007115435177849.\n",
      "[I 2026-07-02 16:31:47,393] Trial 80 finished with value: 0.012260996886203803 and parameters: {'foundation_window': 4, 'ar_lags': 4, 'ema_spans': (2, 3, 5, 8), 'conv_scales': (2, 3), 'use_calendar': True, 'ridge_alpha': 0.36970330214542746, 'shrinkage_max': 0.39634931403109286, 'oob_split_ratio': 0.6622572519942179}. Best is trial 74 with value: 0.01007115435177849.\n",
      "[I 2026-07-02 16:31:47,644] Trial 81 finished with value: 0.01847273608655533 and parameters: {'foundation_window': 6, 'ar_lags': 4, 'ema_spans': (2, 3, 5, 8), 'conv_scales': (2, 3), 'use_calendar': True, 'ridge_alpha': 0.309176015791571, 'shrinkage_max': 0.3534341596709111, 'oob_split_ratio': 0.6584289520836138}. Best is trial 74 with value: 0.01007115435177849.\n",
      "[I 2026-07-02 16:31:47,900] Trial 82 finished with value: 0.01081558496133153 and parameters: {'foundation_window': 4, 'ar_lags': 4, 'ema_spans': (2, 3, 5, 8), 'conv_scales': (2, 3), 'use_calendar': True, 'ridge_alpha': 1.2592871137943302, 'shrinkage_max': 0.26036822609771526, 'oob_split_ratio': 0.6751936630536001}. Best is trial 74 with value: 0.01007115435177849.\n",
      "[I 2026-07-02 16:31:48,153] Trial 83 finished with value: 0.010722411893247472 and parameters: {'foundation_window': 4, 'ar_lags': 4, 'ema_spans': (2, 3, 5, 8), 'conv_scales': (2, 3), 'use_calendar': True, 'ridge_alpha': 1.3009335940508744, 'shrinkage_max': 0.2751163099569065, 'oob_split_ratio': 0.6644357730533973}. Best is trial 74 with value: 0.01007115435177849.\n",
      "[I 2026-07-02 16:31:48,403] Trial 84 finished with value: 0.01753608953032793 and parameters: {'foundation_window': 5, 'ar_lags': 5, 'ema_spans': (2, 3, 5, 8), 'conv_scales': (2, 3), 'use_calendar': True, 'ridge_alpha': 1.658731883919075, 'shrinkage_max': 0.4144886736663672, 'oob_split_ratio': 0.6625957577244433}. Best is trial 74 with value: 0.01007115435177849.\n",
      "[I 2026-07-02 16:31:48,714] Trial 85 finished with value: 0.028223850396145958 and parameters: {'foundation_window': 4, 'ar_lags': 4, 'ema_spans': (2, 4), 'conv_scales': (3, 6, 12), 'use_calendar': True, 'ridge_alpha': 1.1244782988247761, 'shrinkage_max': 0.569475803524125, 'oob_split_ratio': 0.6339829624986538}. Best is trial 74 with value: 0.01007115435177849.\n",
      "[I 2026-07-02 16:31:49,032] Trial 86 finished with value: 0.027842377752184358 and parameters: {'foundation_window': 5, 'ar_lags': 4, 'ema_spans': (3, 6), 'conv_scales': (2, 3, 4), 'use_calendar': True, 'ridge_alpha': 8.400441739406565, 'shrinkage_max': 0.704198586956406, 'oob_split_ratio': 0.6461274295745585}. Best is trial 74 with value: 0.01007115435177849.\n",
      "[I 2026-07-02 16:31:49,282] Trial 87 finished with value: 0.014701951044351486 and parameters: {'foundation_window': 4, 'ar_lags': 4, 'ema_spans': (2, 3, 5, 8), 'conv_scales': (2, 3), 'use_calendar': True, 'ridge_alpha': 0.2923312333870413, 'shrinkage_max': 0.3865412659648766, 'oob_split_ratio': 0.6378223408372756}. Best is trial 74 with value: 0.01007115435177849.\n",
      "[I 2026-07-02 16:31:49,532] Trial 88 finished with value: 0.009965176216112735 and parameters: {'foundation_window': 4, 'ar_lags': 4, 'ema_spans': (3, 6, 12), 'conv_scales': (2, 3), 'use_calendar': True, 'ridge_alpha': 0.09591218376067918, 'shrinkage_max': 0.2600203289003085, 'oob_split_ratio': 0.6532473583489062}. Best is trial 88 with value: 0.009965176216112735.\n",
      "[I 2026-07-02 16:31:49,780] Trial 89 finished with value: 0.010990056485397618 and parameters: {'foundation_window': 4, 'ar_lags': 4, 'ema_spans': (3, 6, 12), 'conv_scales': (3, 6), 'use_calendar': True, 'ridge_alpha': 0.13466196173974398, 'shrinkage_max': 0.3175951562859733, 'oob_split_ratio': 0.6561078686944737}. Best is trial 88 with value: 0.009965176216112735.\n",
      "[I 2026-07-02 16:31:50,034] Trial 90 finished with value: 0.01144232598028456 and parameters: {'foundation_window': 4, 'ar_lags': 5, 'ema_spans': (3, 6, 12), 'conv_scales': (3, 6), 'use_calendar': True, 'ridge_alpha': 0.06935177979782861, 'shrinkage_max': 0.30893031887133315, 'oob_split_ratio': 0.6519483285932717}. Best is trial 88 with value: 0.009965176216112735.\n",
      "[I 2026-07-02 16:31:50,302] Trial 91 finished with value: 0.010369190211564077 and parameters: {'foundation_window': 4, 'ar_lags': 5, 'ema_spans': (3, 6, 12), 'conv_scales': (3, 6), 'use_calendar': True, 'ridge_alpha': 0.10139459312900388, 'shrinkage_max': 0.2548324601520013, 'oob_split_ratio': 0.6529782687061936}. Best is trial 88 with value: 0.009965176216112735.\n",
      "[I 2026-07-02 16:31:50,555] Trial 92 finished with value: 0.019160698876893374 and parameters: {'foundation_window': 4, 'ar_lags': 5, 'ema_spans': (3, 6, 12), 'conv_scales': (3, 6), 'use_calendar': True, 'ridge_alpha': 0.09413096056431423, 'shrinkage_max': 0.3104826388909907, 'oob_split_ratio': 0.6223551525763797}. Best is trial 88 with value: 0.009965176216112735.\n",
      "[I 2026-07-02 16:31:50,804] Trial 93 finished with value: 0.017424678407817574 and parameters: {'foundation_window': 5, 'ar_lags': 5, 'ema_spans': (3, 6, 12), 'conv_scales': (3, 6), 'use_calendar': True, 'ridge_alpha': 0.10122245605129473, 'shrinkage_max': 0.2591799704508162, 'oob_split_ratio': 0.6253154332608919}. Best is trial 88 with value: 0.009965176216112735.\n",
      "[I 2026-07-02 16:31:51,054] Trial 94 finished with value: 0.019540694854999492 and parameters: {'foundation_window': 4, 'ar_lags': 5, 'ema_spans': (3, 6, 12), 'conv_scales': (3, 6), 'use_calendar': True, 'ridge_alpha': 0.14642125722101657, 'shrinkage_max': 0.34548707991958877, 'oob_split_ratio': 0.6175388333402922}. Best is trial 88 with value: 0.009965176216112735.\n",
      "[I 2026-07-02 16:31:51,297] Trial 95 finished with value: 0.013411790213918197 and parameters: {'foundation_window': 4, 'ar_lags': 4, 'ema_spans': (3, 6, 12), 'conv_scales': (3, 6), 'use_calendar': True, 'ridge_alpha': 0.42603334625826866, 'shrinkage_max': 0.4435429930168582, 'oob_split_ratio': 0.653085110107119}. Best is trial 88 with value: 0.009965176216112735.\n",
      "[I 2026-07-02 16:31:51,542] Trial 96 finished with value: 0.014663520624377825 and parameters: {'foundation_window': 5, 'ar_lags': 6, 'ema_spans': (3, 6, 12), 'conv_scales': (3, 6), 'use_calendar': True, 'ridge_alpha': 0.058442297503289276, 'shrinkage_max': 0.2538559912769543, 'oob_split_ratio': 0.6663997981089393}. Best is trial 88 with value: 0.009965176216112735.\n",
      "[I 2026-07-02 16:31:51,792] Trial 97 finished with value: 0.023422824972131873 and parameters: {'foundation_window': 4, 'ar_lags': 4, 'ema_spans': (3, 6, 12), 'conv_scales': (3, 6), 'use_calendar': True, 'ridge_alpha': 0.19256884434696553, 'shrinkage_max': 0.5685770184394653, 'oob_split_ratio': 0.6420469773421051}. Best is trial 88 with value: 0.009965176216112735.\n",
      "[I 2026-07-02 16:31:52,036] Trial 98 finished with value: 0.016993246435556077 and parameters: {'foundation_window': 4, 'ar_lags': 5, 'ema_spans': (3, 6, 12), 'conv_scales': (3, 6), 'use_calendar': True, 'ridge_alpha': 0.8552988217884392, 'shrinkage_max': 0.679448250085692, 'oob_split_ratio': 0.6545925749947832}. Best is trial 88 with value: 0.009965176216112735.\n",
      "[I 2026-07-02 16:31:52,281] Trial 99 finished with value: 0.019130175148973787 and parameters: {'foundation_window': 6, 'ar_lags': 4, 'ema_spans': (3, 6, 12), 'conv_scales': (3, 6), 'use_calendar': True, 'ridge_alpha': 1.7326397459403495, 'shrinkage_max': 0.348186253023974, 'oob_split_ratio': 0.676083275240513}. Best is trial 88 with value: 0.009965176216112735.\n",
