      "[I 2026-07-02 14:59:33,674] Trial 271 finished with value: 0.041132813148194045 and parameters: {'foundation_window': 3, 'ar_lags': 2, 'ema_spans': (3, 6, 12), 'conv_scales': (2, 4, 8), 'use_calendar': True, 'ridge_alpha': 49.989995999079255, 'shrinkage_max': 2.28342935165832, 'oob_split_ratio': 0.5885931189490791}. Best is trial 231 with value: 0.02578553895630763.\n",
      "[I 2026-07-02 14:59:33,844] Trial 272 finished with value: 0.025685744626864185 and parameters: {'foundation_window': 3, 'ar_lags': 5, 'ema_spans': (3, 6, 12), 'conv_scales': (2, 4, 8), 'use_calendar': True, 'ridge_alpha': 66.48727255246669, 'shrinkage_max': 2.3492696383814287, 'oob_split_ratio': 0.5662085015917682}. Best is trial 272 with value: 0.025685744626864185.\n",
      "[I 2026-07-02 14:59:34,014] Trial 273 finished with value: 0.025621803512239822 and parameters: {'foundation_window': 3, 'ar_lags': 5, 'ema_spans': (3, 6, 12), 'conv_scales': (2, 4, 8), 'use_calendar': True, 'ridge_alpha': 38.56313457311009, 'shrinkage_max': 2.4463262674306856, 'oob_split_ratio': 0.5650067175146166}. Best is trial 273 with value: 0.025621803512239822.\n",
      "[I 2026-07-02 14:59:34,184] Trial 274 finished with value: 0.03166140523785619 and parameters: {'foundation_window': 10, 'ar_lags': 6, 'ema_spans': (3, 6, 12), 'conv_scales': (2, 4, 8), 'use_calendar': True, 'ridge_alpha': 31.120808265516736, 'shrinkage_max': 2.445741922201648, 'oob_split_ratio': 0.5662249920997495}. Best is trial 273 with value: 0.025621803512239822.\n",
      "[I 2026-07-02 14:59:34,367] Trial 275 finished with value: 0.02703102772925013 and parameters: {'foundation_window': 3, 'ar_lags': 5, 'ema_spans': (2, 4, 8), 'conv_scales': (2, 3, 4), 'use_calendar': True, 'ridge_alpha': 40.08442288523764, 'shrinkage_max': 2.372747741166041, 'oob_split_ratio': 0.5715499685976998}. Best is trial 273 with value: 0.025621803512239822.\n",
      "[I 2026-07-02 14:59:34,544] Trial 276 finished with value: 0.025726881317430433 and parameters: {'foundation_window': 3, 'ar_lags': 5, 'ema_spans': (3, 6, 12), 'conv_scales': (2, 4, 8), 'use_calendar': True, 'ridge_alpha': 44.926731644758114, 'shrinkage_max': 2.3371041840755016, 'oob_split_ratio': 0.5640338645141326}. Best is trial 273 with value: 0.025621803512239822.\n",
      "[I 2026-07-02 14:59:34,719] Trial 277 finished with value: 0.025636038932342054 and parameters: {'foundation_window': 3, 'ar_lags': 5, 'ema_spans': (3, 6, 12), 'conv_scales': (2, 4, 8), 'use_calendar': True, 'ridge_alpha': 30.950270311000608, 'shrinkage_max': 2.339131391307171, 'oob_split_ratio': 0.5530815956534256}. Best is trial 273 with value: 0.025621803512239822.\n",
      "[I 2026-07-02 14:59:34,912] Trial 278 finished with value: 0.03311467562167418 and parameters: {'foundation_window': 4, 'ar_lags': 5, 'ema_spans': (3, 6, 12), 'conv_scales': (2, 4, 8), 'use_calendar': True, 'ridge_alpha': 32.1669455399343, 'shrinkage_max': 2.3625046318650513, 'oob_split_ratio': 0.5523157069481662}. Best is trial 273 with value: 0.025621803512239822.\n",
      "[I 2026-07-02 14:59:35,066] Trial 279 finished with value: 0.02709496739567624 and parameters: {'foundation_window': 3, 'ar_lags': 5, 'ema_spans': (3, 6, 12), 'conv_scales': (3, 6), 'use_calendar': True, 'ridge_alpha': 24.001548225789815, 'shrinkage_max': 2.4326641248222196, 'oob_split_ratio': 0.5549430755783243}. Best is trial 273 with value: 0.025621803512239822.\n",
      "[I 2026-07-02 14:59:35,232] Trial 280 finished with value: 0.025502609382119734 and parameters: {'foundation_window': 3, 'ar_lags': 5, 'ema_spans': (3, 6, 12), 'conv_scales': (2, 4, 8), 'use_calendar': True, 'ridge_alpha': 26.96372585893565, 'shrinkage_max': 2.3007805385136475, 'oob_split_ratio': 0.5598892224751532}. Best is trial 280 with value: 0.025502609382119734.\n",
      "[I 2026-07-02 14:59:35,410] Trial 281 finished with value: 0.025557380199225113 and parameters: {'foundation_window': 3, 'ar_lags': 5, 'ema_spans': (3, 6, 12), 'conv_scales': (2, 4, 8), 'use_calendar': True, 'ridge_alpha': 26.025712859988822, 'shrinkage_max': 2.343259462403398, 'oob_split_ratio': 0.558973879271004}. Best is trial 280 with value: 0.025502609382119734.\n",
      "[I 2026-07-02 14:59:35,579] Trial 282 finished with value: 0.025517204568898458 and parameters: {'foundation_window': 3, 'ar_lags': 5, 'ema_spans': (3, 6, 12), 'conv_scales': (2, 4, 8), 'use_calendar': True, 'ridge_alpha': 27.21664495575325, 'shrinkage_max': 2.321092414136117, 'oob_split_ratio': 0.5546837960263994}. Best is trial 280 with value: 0.025502609382119734.\n",
      "[I 2026-07-02 14:59:35,752] Trial 283 finished with value: 0.02810052800502442 and parameters: {'foundation_window': 2, 'ar_lags': 5, 'ema_spans': (3, 6, 12), 'conv_scales': (2, 4, 8), 'use_calendar': True, 'ridge_alpha': 26.59294088412842, 'shrinkage_max': 2.329851541645928, 'oob_split_ratio': 0.5502206199155352}. Best is trial 280 with value: 0.025502609382119734.\n",
      "[I 2026-07-02 14:59:35,926] Trial 284 finished with value: 0.027808331781441625 and parameters: {'foundation_window': 3, 'ar_lags': 5, 'ema_spans': (3, 6, 12), 'conv_scales': (3, 6, 12), 'use_calendar': True, 'ridge_alpha': 21.168449062824113, 'shrinkage_max': 2.414547919995102, 'oob_split_ratio': 0.5558529997963917}. Best is trial 280 with value: 0.025502609382119734.\n",
      "[I 2026-07-02 14:59:36,096] Trial 285 finished with value: 0.02554200893866659 and parameters: {'foundation_window': 3, 'ar_lags': 5, 'ema_spans': (3, 6, 12), 'conv_scales': (2, 4, 8), 'use_calendar': True, 'ridge_alpha': 28.14155844109746, 'shrinkage_max': 2.3646211151344194, 'oob_split_ratio': 0.5583126397361041}. Best is trial 280 with value: 0.025502609382119734.\n",
      "[I 2026-07-02 14:59:36,272] Trial 286 finished with value: 0.025656102116917975 and parameters: {'foundation_window': 3, 'ar_lags': 5, 'ema_spans': (3, 6), 'conv_scales': (2, 4, 8), 'use_calendar': True, 'ridge_alpha': 26.505018084373084, 'shrinkage_max': 2.4760239303472216, 'oob_split_ratio': 0.5554976203301818}. Best is trial 280 with value: 0.025502609382119734.\n",
      "[I 2026-07-02 14:59:36,436] Trial 287 finished with value: 0.025669393922345674 and parameters: {'foundation_window': 3, 'ar_lags': 5, 'ema_spans': (3, 6), 'conv_scales': (2, 4, 8), 'use_calendar': True, 'ridge_alpha': 25.35467138874455, 'shrinkage_max': 2.468443014354882, 'oob_split_ratio': 0.5550963983248557}. Best is trial 280 with value: 0.025502609382119734.\n",
      "[I 2026-07-02 14:59:36,602] Trial 288 finished with value: 0.02562568700834668 and parameters: {'foundation_window': 3, 'ar_lags': 5, 'ema_spans': (3, 6), 'conv_scales': (2, 4, 8), 'use_calendar': True, 'ridge_alpha': 27.35728839732754, 'shrinkage_max': 2.4593838036143807, 'oob_split_ratio': 0.5536835778988745}. Best is trial 280 with value: 0.025502609382119734.\n",
      "[I 2026-07-02 14:59:36,765] Trial 289 finished with value: 0.04130445367535694 and parameters: {'foundation_window': 4, 'ar_lags': 5, 'ema_spans': (3, 6), 'conv_scales': (2, 4, 8), 'use_calendar': True, 'ridge_alpha': 24.030863949376666, 'shrinkage_max': 2.490745024233345, 'oob_split_ratio': 0.5501609910673906}. Best is trial 280 with value: 0.025502609382119734.\n",
      "[I 2026-07-02 14:59:36,928] Trial 290 finished with value: 0.025531083950515333 and parameters: {'foundation_window': 3, 'ar_lags': 5, 'ema_spans': (3, 6), 'conv_scales': (2, 4, 8), 'use_calendar': True, 'ridge_alpha': 16.56728395810634, 'shrinkage_max': 2.4563202391515992, 'oob_split_ratio': 0.5540282422724949}. Best is trial 280 with value: 0.025502609382119734.\n",
      "[I 2026-07-02 14:59:37,094] Trial 291 finished with value: 0.025583945396135288 and parameters: {'foundation_window': 3, 'ar_lags': 5, 'ema_spans': (3, 6), 'conv_scales': (2, 4, 8), 'use_calendar': True, 'ridge_alpha': 17.90321209536786, 'shrinkage_max': 2.4398325789118007, 'oob_split_ratio': 0.5537846624775897}. Best is trial 280 with value: 0.025502609382119734.\n",
      "[I 2026-07-02 14:59:37,259] Trial 292 finished with value: 0.031339837750974514 and parameters: {'foundation_window': 2, 'ar_lags': 5, 'ema_spans': (3, 6), 'conv_scales': (2, 4, 8), 'use_calendar': True, 'ridge_alpha': 16.11727494772211, 'shrinkage_max': 2.464152624653306, 'oob_split_ratio': 0.5537515290045213}. Best is trial 280 with value: 0.025502609382119734.\n",
      "[I 2026-07-02 14:59:37,411] Trial 293 finished with value: 0.03079876189944919 and parameters: {'foundation_window': 3, 'ar_lags': 5, 'ema_spans': (3, 6), 'conv_scales': (2, 3), 'use_calendar': True, 'ridge_alpha': 20.15695317363066, 'shrinkage_max': 1.659352725389629, 'oob_split_ratio': 0.5546080273601482}. Best is trial 280 with value: 0.025502609382119734.\n",
      "[I 2026-07-02 14:59:37,585] Trial 294 finished with value: 0.027421422349818207 and parameters: {'foundation_window': 3, 'ar_lags': 5, 'ema_spans': (3, 6), 'conv_scales': (2, 4, 8), 'use_calendar': True, 'ridge_alpha': 11.877387093537152, 'shrinkage_max': 2.4465677224326026, 'oob_split_ratio': 0.5505921122980801}. Best is trial 280 with value: 0.025502609382119734.\n",
      "[I 2026-07-02 14:59:37,755] Trial 295 finished with value: 0.030969912045034968 and parameters: {'foundation_window': 4, 'ar_lags': 5, 'ema_spans': (3, 6), 'conv_scales': (2, 4, 8), 'use_calendar': True, 'ridge_alpha': 25.379755266204974, 'shrinkage_max': 2.479006643317514, 'oob_split_ratio': 0.5568114848888435}. Best is trial 280 with value: 0.025502609382119734.\n",
      "[I 2026-07-02 14:59:37,924] Trial 296 finished with value: 0.025561812136157793 and parameters: {'foundation_window': 3, 'ar_lags': 5, 'ema_spans': (3, 6), 'conv_scales': (2, 4, 8), 'use_calendar': True, 'ridge_alpha': 17.080858968417463, 'shrinkage_max': 2.4021087086288135, 'oob_split_ratio': 0.5562295417100265}. Best is trial 280 with value: 0.025502609382119734.\n",
      "[I 2026-07-02 14:59:38,092] Trial 297 finished with value: 0.02554056412184692 and parameters: {'foundation_window': 3, 'ar_lags': 5, 'ema_spans': (3, 6), 'conv_scales': (2, 4, 8), 'use_calendar': True, 'ridge_alpha': 18.3609446444369, 'shrinkage_max': 2.4023659606143646, 'oob_split_ratio': 0.5545538277972676}. Best is trial 280 with value: 0.025502609382119734.\n",
      "[I 2026-07-02 14:59:38,262] Trial 298 finished with value: 0.02742807851496984 and parameters: {'foundation_window': 3, 'ar_lags': 5, 'ema_spans': (3, 6), 'conv_scales': (2, 4, 8), 'use_calendar': True, 'ridge_alpha': 15.054100192412834, 'shrinkage_max': 2.393207606513447, 'oob_split_ratio': 0.5503049388312695}. Best is trial 280 with value: 0.025502609382119734.\n",
      "[I 2026-07-02 14:59:38,440] Trial 299 finished with value: 0.02556285890521907 and parameters: {'foundation_window': 3, 'ar_lags': 5, 'ema_spans': (3, 6), 'conv_scales': (2, 4, 8), 'use_calendar': True, 'ridge_alpha': 20.00852274123775, 'shrinkage_max': 2.458162560244437, 'oob_split_ratio': 0.5545673612086949}. Best is trial 280 with value: 0.025502609382119734.\n",
      "[I 2026-07-02 14:59:38,444] A new study created in memory with name: no-name-fe8dfd89-c4fe-48fd-8d47-f75e484f49b6\n",
      "[I 2026-07-02 14:59:38,604] Trial 0 finished with value: 18.666740949900674 and parameters: {'aci_target': 0.08116262258099886, 'aci_step_size': 0.1667521176194013, 'interval_scale': 4.242013644282549, 'interval_power': 0.7483231052462957, 'min_width_factor': 0.23402796066365478}. Best is trial 0 with value: 18.666740949900674.\n",
      "[I 2026-07-02 14:59:38,756] Trial 1 finished with value: 52.05280312118839 and parameters: {'aci_target': 0.039638958863878505, 'aci_step_size': 0.006194745024628934, 'interval_scale': 5.827941999313553, 'interval_power': 0.751393764679011, 'min_width_factor': 1.0621088666940683}. Best is trial 0 with value: 18.666740949900674.\n",
      "[I 2026-07-02 14:59:38,904] Trial 2 finished with value: 19.15199359559538 and parameters: {'aci_target': 0.013911053916202464, 'aci_step_size': 0.17898794163735265, 'interval_scale': 5.380668161216503, 'interval_power': 0.2654238883478452, 'min_width_factor': 0.2727374508106509}. Best is trial 0 with value: 18.666740949900674.\n",
      "[I 2026-07-02 14:59:39,057] Trial 3 finished with value: 15.119658572561772 and parameters: {'aci_target': 0.044846856872152424, 'aci_step_size': 0.015359756451337138, 'interval_scale': 2.5973229202817874, 'interval_power': 0.5399312733026447, 'min_width_factor': 0.43684371029706287}. Best is trial 3 with value: 15.119658572561772.\n",
      "[I 2026-07-02 14:59:39,204] Trial 4 finished with value: 3.867201919712595 and parameters: {'aci_target': 0.1262520499972521, 'aci_step_size': 0.008364645453054504, 'interval_scale': 1.497594903821026, 'interval_power': 0.45795230411711463, 'min_width_factor': 0.6841049763255539}. Best is trial 4 with value: 3.867201919712595.\n",
      "[I 2026-07-02 14:59:39,363] Trial 5 finished with value: 10.868787409363451 and parameters: {'aci_target': 0.1591834326646726, 'aci_step_size': 0.010443820094525779, 'interval_scale': 2.533430745147415, 'interval_power': 0.7405182110775531, 'min_width_factor': 0.06967561907999659}. Best is trial 4 with value: 3.867201919712595.\n",
      "[I 2026-07-02 14:59:39,515] Trial 6 finished with value: 9.765816896079622 and parameters: {'aci_target': 0.1254335218612733, 'aci_step_size': 0.009379072229909205, 'interval_scale': 0.8748551837921115, 'interval_power': 1.1861069215666666, 'min_width_factor': 1.448448049611839}. Best is trial 4 with value: 3.867201919712595.\n",
      "[I 2026-07-02 14:59:39,670] Trial 7 finished with value: 5.066461026957382 and parameters: {'aci_target': 0.16359549614212762, 'aci_step_size': 0.015380821666156693, 'interval_scale': 0.9450852868317626, 'interval_power': 0.8552912831401961, 'min_width_factor': 0.660228740609402}. Best is trial 4 with value: 3.867201919712595.\n",
      "[I 2026-07-02 14:59:39,819] Trial 8 finished with value: 17.89426499592166 and parameters: {'aci_target': 0.03318726462050798, 'aci_step_size': 0.031065126086242026, 'interval_scale': 0.813605078655861, 'interval_power': 1.1366505025984777, 'min_width_factor': 0.3881699724000254}. Best is trial 4 with value: 3.867201919712595.\n",
      "[I 2026-07-02 14:59:39,969] Trial 9 finished with value: 10.022533213455807 and parameters: {'aci_target': 0.13587923402725657, 'aci_step_size': 0.015788826347222458, 'interval_scale': 2.56865706988151, 'interval_power': 0.6833878491790996, 'min_width_factor': 0.27728168328829056}. Best is trial 4 with value: 3.867201919712595.\n",
      "[I 2026-07-02 14:59:40,130] Trial 10 finished with value: 2.7432580958960817 and parameters: {'aci_target': 0.19304533013217717, 'aci_step_size': 0.06610156725777806, 'interval_scale': 1.4936103712207425, 'interval_power': 0.022452344518524514, 'min_width_factor': 0.8484196360221048}. Best is trial 10 with value: 2.7432580958960817.\n",
      "[I 2026-07-02 14:59:40,290] Trial 11 finished with value: 2.225822499377296 and parameters: {'aci_target': 0.1827625076874392, 'aci_step_size': 0.05707013708764262, 'interval_scale': 1.546408828028792, 'interval_power': 0.08106665007792413, 'min_width_factor': 0.8275726512169777}. Best is trial 11 with value: 2.225822499377296.\n",
      "[I 2026-07-02 14:59:40,450] Trial 12 finished with value: 2.323583575523015 and parameters: {'aci_target': 0.19896598297512252, 'aci_step_size': 0.06544185131336373, 'interval_scale': 1.47546089367298, 'interval_power': 0.04180216636043358, 'min_width_factor': 0.9832662306816944}. Best is trial 11 with value: 2.225822499377296.\n",
      "[I 2026-07-02 14:59:40,608] Trial 13 finished with value: 2.3776954828550174 and parameters: {'aci_target': 0.194328303699887, 'aci_step_size': 0.06582029124335134, 'interval_scale': 1.497383156366008, 'interval_power': 0.006327410343672832, 'min_width_factor': 1.1456019526777026}. Best is trial 11 with value: 2.225822499377296.\n",
      "[I 2026-07-02 14:59:40,785] Trial 14 finished with value: 2.8379239263417935 and parameters: {'aci_target': 0.16723585255256165, 'aci_step_size': 0.06362810741252044, 'interval_scale': 1.871352118248488, 'interval_power': 0.21714152541468953, 'min_width_factor': 1.0517438930906398}. Best is trial 11 with value: 2.225822499377296.\n",
      "[I 2026-07-02 14:59:40,945] Trial 15 finished with value: 2.585763873446552 and parameters: {'aci_target': 0.19902956909195563, 'aci_step_size': 0.03526767421469482, 'interval_scale': 1.1764682378372147, 'interval_power': 0.21400487309701038, 'min_width_factor': 1.2928819367232762}. Best is trial 11 with value: 2.225822499377296.\n",
      "[I 2026-07-02 14:59:41,105] Trial 16 finished with value: 3.2003262269662085 and parameters: {'aci_target': 0.17410898274785402, 'aci_step_size': 0.10987572291647552, 'interval_scale': 2.0406426600643335, 'interval_power': 0.35912948685198665, 'min_width_factor': 0.8308500532647699}. Best is trial 11 with value: 2.225822499377296.\n",
      "[I 2026-07-02 14:59:41,263] Trial 17 finished with value: 2.2285566033979496 and parameters: {'aci_target': 0.09816203648457428, 'aci_step_size': 0.03747789537634222, 'interval_scale': 1.2226233119816927, 'interval_power': 0.10995559621006235, 'min_width_factor': 0.900380691409425}. Best is trial 11 with value: 2.225822499377296.\n",
      "[I 2026-07-02 14:59:41,435] Trial 18 finished with value: 6.054044200847741 and parameters: {'aci_target': 0.09245287961979848, 'aci_step_size': 0.03276719413772926, 'interval_scale': 3.3574399423511943, 'interval_power': 0.15091128960573102, 'min_width_factor': 0.5645268418826149}. Best is trial 11 with value: 2.225822499377296.\n",
      "[I 2026-07-02 14:59:41,601] Trial 19 finished with value: 2.9755751615526016 and parameters: {'aci_target': 0.09086199822912752, 'aci_step_size': 0.0440090683730095, 'interval_scale': 1.1226785936772143, 'interval_power': 0.3674813130480031, 'min_width_factor': 0.8165395199716492}. Best is trial 11 with value: 2.225822499377296.\n",
      "[I 2026-07-02 14:59:41,760] Trial 20 finished with value: 2.594646118375294 and parameters: {'aci_target': 0.06811431448520847, 'aci_step_size': 0.02226799448437559, 'interval_scale': 1.2038435476699156, 'interval_power': 0.1230240932134676, 'min_width_factor': 1.264433823674863}. Best is trial 11 with value: 2.225822499377296.\n",
      "[I 2026-07-02 14:59:41,922] Trial 21 finished with value: 2.247441492696434 and parameters: {'aci_target': 0.1506478765212548, 'aci_step_size': 0.10339411338432498, 'interval_scale': 1.659479807982206, 'interval_power': 0.0886745881002164, 'min_width_factor': 0.9214355395417057}. Best is trial 11 with value: 2.225822499377296.\n",
      "[I 2026-07-02 14:59:42,089] Trial 22 finished with value: 3.3951101396134273 and parameters: {'aci_target': 0.14380338984365418, 'aci_step_size': 0.09871631368821124, 'interval_scale': 1.8442338327136427, 'interval_power': 0.3234577139528989, 'min_width_factor': 0.9774353758998358}. Best is trial 11 with value: 2.225822499377296.\n",
      "[I 2026-07-02 14:59:42,241] Trial 23 finished with value: 3.022311726416565 and parameters: {'aci_target': 0.1142914167434208, 'aci_step_size': 0.1028684139841808, 'interval_scale': 2.15740786118721, 'interval_power': 0.13968431552226626, 'min_width_factor': 0.7357752307014543}. Best is trial 11 with value: 2.225822499377296.\n",
      "[I 2026-07-02 14:59:42,402] Trial 24 finished with value: 2.2979235113034457 and parameters: {'aci_target': 0.10721024101376453, 'aci_step_size': 0.04486617290742111, 'interval_scale': 1.1011702986435983, 'interval_power': 0.10105747687458988, 'min_width_factor': 0.9062860380229854}. Best is trial 11 with value: 2.225822499377296.\n",
      "[I 2026-07-02 14:59:42,559] Trial 25 finished with value: 7.121734058803555 and parameters: {'aci_target': 0.151089408546011, 'aci_step_size': 0.13191095825604104, 'interval_scale': 3.355815148627945, 'interval_power': 0.46212260712551295, 'min_width_factor': 0.563469760453341}. Best is trial 11 with value: 2.225822499377296.\n",
      "[I 2026-07-02 14:59:42,711] Trial 26 finished with value: 2.80211088981391 and parameters: {'aci_target': 0.17762675764891972, 'aci_step_size': 0.05009232280845431, 'interval_scale': 1.6977528793601897, 'interval_power': 0.2517045261536035, 'min_width_factor': 1.183995412790515}. Best is trial 11 with value: 2.225822499377296.\n",
      "[I 2026-07-02 14:59:42,870] Trial 27 finished with value: 3.12903867266967 and parameters: {'aci_target': 0.06175535224049043, 'aci_step_size': 0.02299123671092927, 'interval_scale': 1.2909162060693302, 'interval_power': 0.16245918296979714, 'min_width_factor': 0.5883296432989995}. Best is trial 11 with value: 2.225822499377296.\n",
      "[I 2026-07-02 14:59:43,024] Trial 28 finished with value: 8.145394168983662 and parameters: {'aci_target': 0.17797477108427484, 'aci_step_size': 0.0855676374468843, 'interval_scale': 7.928838532958431, 'interval_power': 0.06993696757430072, 'min_width_factor': 0.7691776652142039}. Best is trial 11 with value: 2.225822499377296.\n",
      "[I 2026-07-02 14:59:43,179] Trial 29 finished with value: 2.306873053033156 and parameters: {'aci_target': 0.10872795714701168, 'aci_step_size': 0.14953814067475735, 'interval_scale': 0.7709175734460078, 'interval_power': 0.31787276127941194, 'min_width_factor': 0.9331346632121164}. Best is trial 11 with value: 2.225822499377296.\n",
      "[I 2026-07-02 14:59:43,340] Trial 30 finished with value: 2.8488867642437907 and parameters: {'aci_target': 0.14906421912874732, 'aci_step_size': 0.026245734445487053, 'interval_scale': 1.010533419510359, 'interval_power': 0.0004361381171538864, 'min_width_factor': 1.4244433821218956}. Best is trial 11 with value: 2.225822499377296.\n",
