      "[I 2026-07-02 15:00:10,251] Trial 199 finished with value: 2.4145728292958637 and parameters: {'aci_target': 0.1313265203198084, 'aci_step_size': 0.05464539076871919, 'interval_scale': 0.7925455996501731, 'interval_power': 0.37315222127653097, 'min_width_factor': 0.09648467462808602}. Best is trial 128 with value: 1.8813328122329105.\n"
     ]
    },
    {
     "name": "stdout",
     "output_type": "stream",
     "text": [
      "S3-FastSketch best point parameters:\n",
      "{'foundation_window': 3, 'ar_lags': 5, 'ema_spans': (3, 6, 12), 'conv_scales': (2, 4, 8), 'use_calendar': True, 'ridge_alpha': 26.96372585893565, 'shrinkage_max': 2.3007805385136475, 'oob_split_ratio': 0.5598892224751532}\n",
      "S3-FastSketch best UQ parameters:\n",
      "{'aci_target': 0.1341394273928773, 'aci_step_size': 0.048861228722392756, 'interval_scale': 0.750546108003836, 'interval_power': 0.45690573606507223, 'min_width_factor': 0.31232271349411916}\n",
      "S3-FastSketch test metrics on modelling scale:\n"
     ]
    },
    {
     "data": {
      "text/html": [
       "<div>\n",
       "<style scoped>\n",
       "    .dataframe tbody tr th:only-of-type {\n",
       "        vertical-align: middle;\n",
       "    }\n",
       "\n",
       "    .dataframe tbody tr th {\n",
       "        vertical-align: top;\n",
       "    }\n",
       "\n",
       "    .dataframe thead th {\n",
       "        text-align: right;\n",
       "    }\n",
       "</style>\n",
       "<table border=\"1\" class=\"dataframe\">\n",
       "  <thead>\n",
       "    <tr style=\"text-align: right;\">\n",
       "      <th></th>\n",
       "      <th>mae</th>\n",
       "      <th>mse</th>\n",
       "      <th>rmse</th>\n",
       "      <th>r2</th>\n",
       "      <th>mape_percent</th>\n",
       "      <th>mape</th>\n",
       "      <th>smape_percent</th>\n",
       "      <th>smape</th>\n",
       "      <th>ecp</th>\n",
       "      <th>coverage_error</th>\n",
       "      <th>iw</th>\n",
       "      <th>mean_width</th>\n",
       "      <th>mis</th>\n",
       "      <th>interval_score</th>\n",
       "      <th>msis</th>\n",
       "      <th>scale</th>\n",
       "      <th>elapsed_seconds</th>\n",
       "      <th>trainable_params</th>\n",
       "    </tr>\n",
       "  </thead>\n",
       "  <tbody>\n",
       "    <tr>\n",
       "      <th>0</th>\n",
       "      <td>0.555102</td>\n",
       "      <td>0.422258</td>\n",
       "      <td>0.649814</td>\n",
       "      <td>-1.913721</td>\n",
       "      <td>6.693136</td>\n",
       "      <td>0.066931</td>\n",
       "      <td>6.389642</td>\n",
       "      <td>0.063896</td>\n",
       "      <td>0.555556</td>\n",
       "      <td>0.344444</td>\n",
       "      <td>0.957157</td>\n",
       "      <td>0.957157</td>\n",
       "      <td>4.138376</td>\n",
       "      <td>4.138376</td>\n",
       "      <td>7.186153</td>\n",
       "      <td>0.575882</td>\n",
       "      <td>0.24066</td>\n",
       "      <td>32</td>\n",
       "    </tr>\n",
       "  </tbody>\n",
       "</table>\n",
       "</div>"
      ],
      "text/plain": [
       "        mae       mse      rmse        r2  mape_percent      mape  \\\n",
       "0  0.555102  0.422258  0.649814 -1.913721      6.693136  0.066931   \n",
       "\n",
       "   smape_percent     smape       ecp  coverage_error        iw  mean_width  \\\n",
       "0       6.389642  0.063896  0.555556        0.344444  0.957157    0.957157   \n",
       "\n",
       "        mis  interval_score      msis     scale  elapsed_seconds  \\\n",
       "0  4.138376        4.138376  7.186153  0.575882          0.24066   \n",
       "\n",
       "   trainable_params  \n",
       "0                32  "
      ]
     },
     "metadata": {},
     "output_type": "display_data"
    }
   ],
   "source": [
    "fastsketch_result = run_fastsketch_experiment(\n",
    "    train_series,\n",
    "    test_series,\n",
    "    point_trials=FASTSKETCH_POINT_TRIALS,\n",
    "    uq_trials=FASTSKETCH_UQ_TRIALS,\n",
    "    val_size=VAL_SIZE,\n",
    "    seed=SEED,\n",
    ")\n",
    "\n",
    "print(\"S3-FastSketch best point parameters:\")\n",
    "print(fastsketch_result[\"best_point_params\"])\n",
    "print(\"S3-FastSketch best UQ parameters:\")\n",
    "print(fastsketch_result[\"best_uq_params\"])\n",
    "print(\"S3-FastSketch test metrics on modelling scale:\")\n",
    "display(pd.DataFrame([fastsketch_result[\"metrics\"]]))"
   ]
  },
  {
   "cell_type": "markdown",
   "id": "3ee0d463",
   "metadata": {
    "papermill": {
     "duration": 0.064298,
     "end_time": "2026-07-02T15:00:10.641362+00:00",
     "exception": false,
     "start_time": "2026-07-02T15:00:10.577064+00:00",
     "status": "completed"
    },
    "tags": []
   },
   "source": [
    "## 8. Baselines with fixed parameters and a common ACI wrapper\n",
    "\n",
    "Each baseline is fitted twice:\n",
    "\n",
    "1. on a chronological training core to obtain calibration residuals;\n",
    "2. on the complete training series to produce the final test forecast.\n",
    "\n",
    "The interval for test step `t` is formed before observing `y_t`. After scoring that step, the ACI state is updated for the next one. Thus, the procedure is sequential and does not use future test observations."
   ]
  },
  {
   "cell_type": "code",
   "execution_count": 10,
   "id": "f7fcaae7",
   "metadata": {
    "execution": {
     "iopub.execute_input": "2026-07-02T15:00:10.775901Z",
     "iopub.status.busy": "2026-07-02T15:00:10.775566Z",
     "iopub.status.idle": "2026-07-02T15:00:10.794131Z",
     "shell.execute_reply": "2026-07-02T15:00:10.793174Z"
    },
    "papermill": {
     "duration": 0.090369,
     "end_time": "2026-07-02T15:00:10.796349+00:00",
     "exception": false,
     "start_time": "2026-07-02T15:00:10.705980+00:00",
     "status": "completed"
    },
    "tags": []
   },
   "outputs": [],
   "source": [
    "def finite_sample_conformal_quantile(scores, alpha):\n",
    "    scores = np.asarray(scores, dtype=float).reshape(-1)\n",
    "    scores = scores[np.isfinite(scores)]\n",
    "    if len(scores) == 0:\n",
    "        raise ValueError(\"No finite calibration scores were produced.\")\n",
    "    level = min(1.0, math.ceil((len(scores) + 1) * (1.0 - alpha)) / len(scores))\n",
    "    try:\n",
    "        return float(np.quantile(scores, level, method=\"higher\"))\n",
    "    except TypeError:\n",
    "        return float(np.quantile(scores, level, interpolation=\"higher\"))\n",
    "\n",
    "\n",
    "def adaptive_conformal_path(y_true, y_pred, calibration_scores, alpha=0.10, step_size=0.05):\n",
    "    y_true = np.asarray(y_true, dtype=float).reshape(-1)\n",
    "    y_pred = np.asarray(y_pred, dtype=float).reshape(-1)\n",
    "    buffer = list(np.asarray(calibration_scores, dtype=float).reshape(-1))\n",
    "    alpha_t = float(alpha)\n",
    "    lower, upper, alpha_path = [], [], []\n",
    "\n",
    "    for observed, predicted in zip(y_true, y_pred):\n",
    "        q = finite_sample_conformal_quantile(buffer, alpha_t)\n",
    "        lo = float(predicted - q)\n",
    "        up = float(predicted + q)\n",
    "        lower.append(lo)\n",
    "        upper.append(up)\n",
    "        alpha_path.append(alpha_t)\n",
    "\n",
    "        miss = float(observed < lo or observed > up)\n",
    "        alpha_t = float(np.clip(alpha_t + step_size * (alpha - miss), 0.01, 0.50))\n",
    "        buffer.append(abs(float(observed - predicted)))\n",
    "\n",
    "    return np.asarray(lower), np.asarray(upper), np.asarray(alpha_path)\n",
    "\n",
    "\n",
    "def evaluate_fixed_baseline_with_aci(\n",
    "    model_name,\n",
    "    params,\n",
    "    train,\n",
    "    test,\n",
    "    *,\n",
    "    calibration_ratio=0.20,\n",
    "    alpha=0.10,\n",
    "    aci_step_size=0.05,\n",
    "    seasonal_period=12,\n",
    "):\n",
    "    train = ensure_series(train, name=\"train\")\n",
    "    test = ensure_series(test, name=\"test\")\n",
    "\n",
    "    split = int(np.floor((1.0 - calibration_ratio) * len(train)))\n",
    "    split = max(split, seasonal_period + 5)\n",
    "    split = min(split, len(train) - 2)\n",
    "    train_core = train.iloc[:split]\n",
    "    calibration = train.iloc[split:]\n",
    "\n",
    "    _, calibration_forecast = fit_predict_baseline(\n",
    "        model_name,\n",
    "        train_core,\n",
    "        len(calibration),\n",
    "        params,\n",
    "    )\n",
    "    calibration_output = parse_forecast_output(calibration_forecast)\n",
    "    if len(calibration_output.pred) != len(calibration):\n",
    "        raise ValueError(\n",
    "            f\"{model_name} returned {len(calibration_output.pred)} calibration values; \"\n",
    "            f\"expected {len(calibration)}.\"\n",
    "        )\n",
    "    calibration_scores = np.abs(calibration.to_numpy() - calibration_output.pred)\n",
    "\n",
    "    start = time.perf_counter()\n",
    "    model, test_forecast = fit_predict_baseline(model_name, train, len(test), params)\n",
    "    elapsed = time.perf_counter() - start\n",
    "    test_output = parse_forecast_output(test_forecast)\n",
    "\n",
    "    if test_output.has_interval:\n",
    "        lower, upper = test_output.lower, test_output.upper\n",
    "        interval_source = \"native\"\n",
    "        alpha_path = np.full(len(test), alpha)\n",
    "    else:\n",
    "        lower, upper, alpha_path = adaptive_conformal_path(\n",
    "            test,\n",
    "            test_output.pred,\n",
    "            calibration_scores,\n",
    "            alpha=alpha,\n",
    "            step_size=aci_step_size,\n",
    "        )\n",
    "        interval_source = \"external_aci\"\n",
    "\n",
    "    forecast = pd.DataFrame(\n",
    "        {\n",
    "            \"pred\": test_output.pred,\n",
    "            \"lower\": lower,\n",
    "            \"upper\": upper,\n",
    "            \"aci_alpha\": alpha_path,\n",
    "        },\n",
    "        index=test.index,\n",
    "    )\n",
    "\n",
    "    metrics = evaluate_forecast(\n",
    "        test,\n",
    "        forecast[\"pred\"],\n",
    "        y_train=train,\n",
    "        lower=forecast[\"lower\"],\n",
    "        upper=forecast[\"upper\"],\n",
    "        alpha=alpha,\n",
    "        seasonal_period=seasonal_period,\n",
    "        elapsed_seconds=elapsed,\n",
    "        trainable_params=count_trainable_parameters(model),\n",
    "    )\n",
    "\n",
    "    return {\n",
    "        \"model\": model,\n",
    "        \"forecast\": forecast,\n",
    "        \"metrics\": metrics,\n",
    "        \"interval_source\": interval_source,\n",
    "        \"calibration_size\": len(calibration),\n",
    "    }"
   ]
  },
  {
   "cell_type": "code",
   "execution_count": 11,
   "id": "0c738684",
   "metadata": {
    "execution": {
     "iopub.execute_input": "2026-07-02T15:00:10.932053Z",
     "iopub.status.busy": "2026-07-02T15:00:10.931712Z",
     "iopub.status.idle": "2026-07-02T15:00:26.323331Z",
     "shell.execute_reply": "2026-07-02T15:00:26.320736Z"
    },
    "papermill": {
     "duration": 15.4603,
     "end_time": "2026-07-02T15:00:26.326384+00:00",
     "exception": false,
     "start_time": "2026-07-02T15:00:10.866084+00:00",
     "status": "completed"
    },
    "tags": []
   },
   "outputs": [
    {
     "name": "stdout",
     "output_type": "stream",
     "text": [
      "\n",
      "Evaluating CNN with fixed original parameters...\n",
      "FAILED: ValueError: Only 0 direct windows are available.\n",
      "\n",
      "Evaluating LSTM with fixed original parameters...\n",
      "FAILED: ValueError: Only 0 direct windows are available.\n",
      "\n",
      "Evaluating Gaussian Process with fixed original parameters...\n",
      "{'mae': 0.4129622757628509, 'mse': 0.23809426282884072, 'rmse': 0.4879490371225675, 'r2': -0.6429295558840058, 'mape_percent': 4.8164642545927085, 'mape': 0.04816464254592709, 'smape_percent': 4.924190983320413, 'smape': 0.04924190983320413, 'ecp': 1.0, 'coverage_error': 0.09999999999999998, 'iw': 1.943664429559342, 'mean_width': 1.943664429559342, 'mis': 1.943664429559342, 'interval_score': 1.943664429559342, 'msis': 3.375109405907623, 'scale': 0.5758819036079982, 'elapsed_seconds': 1.18800490000001, 'trainable_params': 396}\n",
      "\n",
      "Evaluating Kernel Ridge with fixed original parameters...\n",
      "FAILED: ValueError: Only 0 direct windows are available.\n",
      "\n",
      "Evaluating AR with fixed original parameters...\n",
      "{'mae': 0.7378418798976255, 'mse': 0.7507008210186065, 'rmse': 0.8664299285104402, 'r2': -4.180085197451723, 'mape_percent': 8.836998897201005, 'mape': 0.08836998897201004, 'smape_percent': 8.323755667898967, 'smape': 0.08323755667898967, 'ecp': 0.8888888888888888, 'coverage_error': 0.011111111111111183, 'iw': 2.362126076537425, 'mean_width': 2.362126076537425, 'mis': 3.6810958861185856, 'interval_score': 3.6810958861185856, 'msis': 6.392102031780984, 'scale': 0.5758819036079982, 'elapsed_seconds': 0.008385717000010118, 'trainable_params': 2}\n",
      "\n",
      "Evaluating ARIMA with fixed original parameters...\n",
      "{'mae': 0.5276659785194254, 'mse': 0.4174968872208012, 'rmse': 0.6461399904206527, 'r2': -1.8808672974943246, 'mape_percent': 6.390451806870627, 'mape': 0.06390451806870627, 'smape_percent': 6.088200087660752, 'smape': 0.06088200087660752, 'ecp': 0.9444444444444444, 'coverage_error': 0.0444444444444444, 'iw': 2.385735806037154, 'mean_width': 2.385735806037154, 'mis': 3.295973409879986, 'interval_score': 3.295973409879986, 'msis': 5.723349508345637, 'scale': 0.5758819036079982, 'elapsed_seconds': 0.4526840739999898, 'trainable_params': 7}\n",
      "\n",
      "Evaluating ARKAN with fixed original parameters...\n",
      "{'mae': 0.3265384788744963, 'mse': 0.16517168770390495, 'rmse': 0.40641319824029454, 'r2': -0.13973954810941946, 'mape_percent': 3.8829505629780576, 'mape': 0.038829505629780575, 'smape_percent': 3.8811072442071444, 'smape': 0.038811072442071444, 'ecp': 0.9444444444444444, 'coverage_error': 0.0444444444444444, 'iw': 1.9545189769783855, 'mean_width': 1.9545189769783855, 'mis': 1.975811453330303, 'interval_score': 1.975811453330303, 'msis': 3.4309316562154635, 'scale': 0.5758819036079982, 'elapsed_seconds': 1.7454163170000356, 'trainable_params': 199975}\n",
      "\n",
      "Evaluating EasyTSF (NLinear) with fixed original parameters...\n",
      "{'mae': 0.36321556630920215, 'mse': 0.24399393842055378, 'rmse': 0.4939574257165832, 'r2': -0.6836392785148309, 'mape_percent': 4.450636688114988, 'mape': 0.04450636688114988, 'smape_percent': 4.269396628463347, 'smape': 0.04269396628463346, 'ecp': 0.9444444444444444, 'coverage_error': 0.0444444444444444, 'iw': 2.322546053627291, 'mean_width': 2.322546053627291, 'mis': 3.1177015814067435, 'interval_score': 3.1177015814067435, 'msis': 5.413786336875343, 'scale': 0.5758819036079982, 'elapsed_seconds': 0.882460970000011, 'trainable_params': 5}\n",
      "\n",
      "Evaluating ETS with fixed original parameters...\n",
      "{'mae': 0.2584445387309472, 'mse': 0.1423661197786169, 'rmse': 0.3773143514082348, 'r2': 0.01762645112975847, 'mape_percent': 3.1503752387677055, 'mape': 0.03150375238767705, 'smape_percent': 3.0777923729490486, 'smape': 0.030777923729490484, 'ecp': 0.9444444444444444, 'coverage_error': 0.0444444444444444, 'iw': 2.168896716512288, 'mean_width': 2.168896716512288, 'mis': 2.4347647293574104, 'interval_score': 2.4347647293574104, 'msis': 4.227888937129635, 'scale': 0.5758819036079982, 'elapsed_seconds': 0.18126025000003665, 'trainable_params': 18}\n",
      "\n",
      "Baseline failures were retained for audit:\n"
     ]
    },
    {
     "data": {
      "text/html": [
       "<div>\n",
       "<style scoped>\n",
       "    .dataframe tbody tr th:only-of-type {\n",
       "        vertical-align: middle;\n",
       "    }\n",
       "\n",
       "    .dataframe tbody tr th {\n",
       "        vertical-align: top;\n",
       "    }\n",
       "\n",
       "    .dataframe thead th {\n",
       "        text-align: right;\n",
       "    }\n",
       "</style>\n",
       "<table border=\"1\" class=\"dataframe\">\n",
       "  <thead>\n",
       "    <tr style=\"text-align: right;\">\n",
       "      <th></th>\n",
       "      <th>model</th>\n",
       "      <th>exception_type</th>\n",
       "      <th>error</th>\n",
       "    </tr>\n",
       "  </thead>\n",
       "  <tbody>\n",
       "    <tr>\n",
       "      <th>0</th>\n",
       "      <td>CNN</td>\n",
       "      <td>ValueError</td>\n",
       "      <td>Only 0 direct windows are available.</td>\n",
       "    </tr>\n",
       "    <tr>\n",
       "      <th>1</th>\n",
       "      <td>LSTM</td>\n",
       "      <td>ValueError</td>\n",
       "      <td>Only 0 direct windows are available.</td>\n",
       "    </tr>\n",
       "    <tr>\n",
       "      <th>2</th>\n",
       "      <td>Kernel Ridge</td>\n",
       "      <td>ValueError</td>\n",
       "      <td>Only 0 direct windows are available.</td>\n",
       "    </tr>\n",
       "  </tbody>\n",
       "</table>\n",
       "</div>"
      ],
      "text/plain": [
       "          model exception_type                                 error\n",
       "0           CNN     ValueError  Only 0 direct windows are available.\n",
       "1          LSTM     ValueError  Only 0 direct windows are available.\n",
       "2  Kernel Ridge     ValueError  Only 0 direct windows are available."
      ]
     },
     "metadata": {},
     "output_type": "display_data"
    }
   ],
   "source": [
    "baseline_results = {}\n",
    "baseline_failures = []\n",
    "\n",
    "for baseline_name in BASELINE_ORDER:\n",
    "    display_name = BASELINE_DISPLAY_NAMES.get(baseline_name, baseline_name)\n",
    "    print(f\"\\nEvaluating {display_name} with fixed original parameters...\")\n",
    "    try:\n",
    "        result = evaluate_fixed_baseline_with_aci(\n",
    "            baseline_name,\n",
    "            BASELINE_PARAMS[baseline_name],\n",
    "            train_series,\n",
    "            test_series,\n",
    "            calibration_ratio=BASELINE_CALIBRATION_RATIO,\n",
    "            alpha=ALPHA,\n",
    "            aci_step_size=BASELINE_ACI_STEP_SIZE,\n",
    "            seasonal_period=SEASONAL_PERIOD,\n",
    "        )\n",
    "        baseline_results[display_name] = result\n",
    "        print(result[\"metrics\"])\n",
    "    except Exception as exc:\n",
    "        baseline_failures.append(\n",
    "            {\n",
    "                \"model\": display_name,\n",
    "                \"exception_type\": type(exc).__name__,\n",
    "                \"error\": str(exc),\n",
    "            }\n",
    "        )\n",
    "        print(f\"FAILED: {type(exc).__name__}: {exc}\")\n",
    "\n",
    "if baseline_failures:\n",
    "    print(\"\\nBaseline failures were retained for audit:\")\n",
    "    display(pd.DataFrame(baseline_failures))"
   ]
  },
  {
   "cell_type": "markdown",
   "id": "94c171ce",
   "metadata": {
    "papermill": {
     "duration": 0.064275,
     "end_time": "2026-07-02T15:00:26.480395+00:00",
     "exception": false,
     "start_time": "2026-07-02T15:00:26.416120+00:00",
     "status": "completed"
    },
    "tags": []
   },
   "source": [
    "## 9. Consolidated results on modelling and original scales"
   ]
  },
  {
   "cell_type": "code",
   "execution_count": 12,
   "id": "47dd9a3e",
   "metadata": {
    "execution": {
     "iopub.execute_input": "2026-07-02T15:00:26.611471Z",
     "iopub.status.busy": "2026-07-02T15:00:26.610685Z",
     "iopub.status.idle": "2026-07-02T15:00:26.687440Z",
     "shell.execute_reply": "2026-07-02T15:00:26.686528Z"
    },
    "papermill": {
     "duration": 0.144523,
     "end_time": "2026-07-02T15:00:26.689518+00:00",
     "exception": false,
     "start_time": "2026-07-02T15:00:26.544995+00:00",
     "status": "completed"
    },
    "tags": []
   },
   "outputs": [
    {
     "name": "stdout",
     "output_type": "stream",
     "text": [
      "Results on modelling scale:\n"
     ]
    },
    {
     "data": {
      "text/html": [
       "<div>\n",
       "<style scoped>\n",
       "    .dataframe tbody tr th:only-of-type {\n",
       "        vertical-align: middle;\n",
       "    }\n",
       "\n",
       "    .dataframe tbody tr th {\n",
       "        vertical-align: top;\n",
       "    }\n",
       "\n",
       "    .dataframe thead th {\n",
       "        text-align: right;\n",
       "    }\n",
       "</style>\n",
       "<table border=\"1\" class=\"dataframe\">\n",
       "  <thead>\n",
       "    <tr style=\"text-align: right;\">\n",
       "      <th></th>\n",
       "      <th>Model</th>\n",
       "      <th>MAE</th>\n",
       "      <th>MSE</th>\n",
       "      <th>RMSE</th>\n",
       "      <th>R^2</th>\n",
       "      <th>MAPE (%)</th>\n",
       "      <th>sMAPE (%)</th>\n",
       "      <th>Time (s)</th>\n",
       "      <th>trainable_params</th>\n",
       "      <th>ECP</th>\n",
       "      <th>IW</th>\n",
       "      <th>MIS</th>\n",
       "      <th>MSIS</th>\n",
       "    </tr>\n",
       "  </thead>\n",
       "  <tbody>\n",
       "    <tr>\n",
       "      <th>0</th>\n",
       "      <td>ETS</td>\n",
       "      <td>0.258445</td>\n",
       "      <td>0.142366</td>\n",
       "      <td>0.377314</td>\n",
       "      <td>0.017626</td>\n",
       "      <td>3.150375</td>\n",
       "      <td>3.077792</td>\n",
       "      <td>0.181260</td>\n",
       "      <td>18</td>\n",
       "      <td>0.944444</td>\n",
       "      <td>2.168897</td>\n",
       "      <td>2.434765</td>\n",
       "      <td>4.227889</td>\n",
       "    </tr>\n",
       "    <tr>\n",
       "      <th>1</th>\n",
       "      <td>S3-Forecaster</td>\n",
       "      <t