      "[I 2026-07-02 16:33:41,421] Trial 81 finished with value: 1.587304310965061 and parameters: {'aci_target': 0.19898582176224408, 'aci_step_size': 0.008908811755225458, 'interval_scale': 2.075790934355536, 'interval_power': 0.10207020975547054, 'min_width_factor': 0.5513942757094342}. Best is trial 65 with value: 1.204287235687569.\n",
      "[I 2026-07-02 16:33:41,547] Trial 82 finished with value: 1.2937535736848484 and parameters: {'aci_target': 0.18834460472050718, 'aci_step_size': 0.00505479288190242, 'interval_scale': 1.4601461357730308, 'interval_power': 0.15109869505407886, 'min_width_factor': 0.5106634744676648}. Best is trial 65 with value: 1.204287235687569.\n",
      "[I 2026-07-02 16:33:41,667] Trial 83 finished with value: 1.3186725798581949 and parameters: {'aci_target': 0.1939257469099134, 'aci_step_size': 0.010036266202999725, 'interval_scale': 1.0761100510285748, 'interval_power': 0.0023348182842215792, 'min_width_factor': 0.6593362899290978}. Best is trial 65 with value: 1.204287235687569.\n",
      "[I 2026-07-02 16:33:41,790] Trial 84 finished with value: 1.2962710843118674 and parameters: {'aci_target': 0.18137458570595266, 'aci_step_size': 0.007662718090369002, 'interval_scale': 1.230927764504705, 'interval_power': 0.1887825407608119, 'min_width_factor': 0.5668142856212981}. Best is trial 65 with value: 1.204287235687569.\n",
      "[I 2026-07-02 16:33:41,916] Trial 85 finished with value: 1.6939192185830225 and parameters: {'aci_target': 0.18726744921917596, 'aci_step_size': 0.012462219439553418, 'interval_scale': 1.126926951594984, 'interval_power': 0.04204045938772312, 'min_width_factor': 0.4821039965257885}. Best is trial 65 with value: 1.204287235687569.\n",
      "[I 2026-07-02 16:33:42,041] Trial 86 finished with value: 2.4411073128666745 and parameters: {'aci_target': 0.17561307356053632, 'aci_step_size': 0.01875046646603352, 'interval_scale': 2.99900132339148, 'interval_power': 0.08607766194869067, 'min_width_factor': 0.36292672229286516}. Best is trial 65 with value: 1.204287235687569.\n",
      "[I 2026-07-02 16:33:42,162] Trial 87 finished with value: 1.310809097631888 and parameters: {'aci_target': 0.1936406218592234, 'aci_step_size': 0.007132192400013808, 'interval_scale': 1.2863269074496804, 'interval_power': 0.1342232377529007, 'min_width_factor': 0.655404548815945}. Best is trial 65 with value: 1.204287235687569.\n",
      "[I 2026-07-02 16:33:42,285] Trial 88 finished with value: 4.348595769537667 and parameters: {'aci_target': 0.010810473233398926, 'aci_step_size': 0.005596935677722145, 'interval_scale': 1.3871418007660898, 'interval_power': 0.6142477065920898, 'min_width_factor': 0.5914025013851005}. Best is trial 65 with value: 1.204287235687569.\n",
      "[I 2026-07-02 16:33:42,406] Trial 89 finished with value: 2.933073203160416 and parameters: {'aci_target': 0.18392370607561506, 'aci_step_size': 0.0113325127458324, 'interval_scale': 1.0356454278245744, 'interval_power': 0.2398552325016439, 'min_width_factor': 1.466536601580211}. Best is trial 65 with value: 1.204287235687569.\n",
      "[I 2026-07-02 16:33:42,534] Trial 90 finished with value: 1.2796209355204655 and parameters: {'aci_target': 0.19960716139646487, 'aci_step_size': 0.00966526148038832, 'interval_scale': 1.6503533826542658, 'interval_power': 0.10935743269395493, 'min_width_factor': 0.46168060751827983}. Best is trial 65 with value: 1.204287235687569.\n",
      "[I 2026-07-02 16:33:42,655] Trial 91 finished with value: 1.2750293152723604 and parameters: {'aci_target': 0.17162435806948564, 'aci_step_size': 0.014916025545894319, 'interval_scale': 1.142430126354369, 'interval_power': 0.16018699298822908, 'min_width_factor': 0.5134152220662069}. Best is trial 65 with value: 1.204287235687569.\n",
      "[I 2026-07-02 16:33:42,783] Trial 92 finished with value: 1.2222463122527258 and parameters: {'aci_target': 0.1900181598097786, 'aci_step_size': 0.011270479237769764, 'interval_scale': 1.3188457631529653, 'interval_power': 0.06749488456738958, 'min_width_factor': 0.5715562770049862}. Best is trial 65 with value: 1.204287235687569.\n",
      "[I 2026-07-02 16:33:42,907] Trial 93 finished with value: 1.2145048835481251 and parameters: {'aci_target': 0.19080398598785414, 'aci_step_size': 0.01147635689701953, 'interval_scale': 1.3328338331173566, 'interval_power': 0.06979460066089949, 'min_width_factor': 0.4126777931327091}. Best is trial 65 with value: 1.204287235687569.\n",
      "[I 2026-07-02 16:33:43,034] Trial 94 finished with value: 1.214081980472491 and parameters: {'aci_target': 0.1899515483618024, 'aci_step_size': 0.011686156492963342, 'interval_scale': 1.3317449680370899, 'interval_power': 0.06831457804535165, 'min_width_factor': 0.4231529974707585}. Best is trial 65 with value: 1.204287235687569.\n",
      "[I 2026-07-02 16:33:43,160] Trial 95 finished with value: 1.660888599216716 and parameters: {'aci_target': 0.19027718134997557, 'aci_step_size': 0.011154838096948342, 'interval_scale': 1.316954430836822, 'interval_power': 0.06631502872194411, 'min_width_factor': 0.38811777613238085}. Best is trial 65 with value: 1.204287235687569.\n",
      "[I 2026-07-02 16:33:43,285] Trial 96 finished with value: 1.2207243497788027 and parameters: {'aci_target': 0.16671086354700526, 'aci_step_size': 0.014686239520421529, 'interval_scale': 1.4856811533913465, 'interval_power': 0.01925148967412591, 'min_width_factor': 0.4383501104716166}. Best is trial 65 with value: 1.204287235687569.\n",
      "[I 2026-07-02 16:33:43,410] Trial 97 finished with value: 1.7301972427973373 and parameters: {'aci_target': 0.1776410120016594, 'aci_step_size': 0.01825585552383736, 'interval_scale': 1.202730941810707, 'interval_power': 0.03743098846701149, 'min_width_factor': 0.4334868996263971}. Best is trial 65 with value: 1.204287235687569.\n",
      "[I 2026-07-02 16:33:43,536] Trial 98 finished with value: 1.6544646156067688 and parameters: {'aci_target': 0.16504313307526192, 'aci_step_size': 0.011838031317200948, 'interval_scale': 1.3407497471843182, 'interval_power': 0.02614100068039866, 'min_width_factor': 0.40842459952408544}. Best is trial 65 with value: 1.204287235687569.\n",
      "[I 2026-07-02 16:33:43,659] Trial 99 finished with value: 1.2232071453724762 and parameters: {'aci_target': 0.19501844987051042, 'aci_step_size': 0.014073710836456145, 'interval_scale': 1.4536515303048365, 'interval_power': 0.06019068066260683, 'min_width_factor': 0.2844408217973373}. Best is trial 65 with value: 1.204287235687569.\n",
      "[I 2026-07-02 16:33:43,786] Trial 100 finished with value: 4.439973462659958 and parameters: {'aci_target': 0.19492234258822752, 'aci_step_size': 0.014259811567924193, 'interval_scale': 1.4661502509462931, 'interval_power': 0.8289139932751524, 'min_width_factor': 0.28576822166636756}. Best is trial 65 with value: 1.204287235687569.\n",
      "[I 2026-07-02 16:33:43,914] Trial 101 finished with value: 1.2328745478570604 and parameters: {'aci_target': 0.18149788425068242, 'aci_step_size': 0.01720359316267096, 'interval_scale': 1.4096567034764866, 'interval_power': 0.07028696039854225, 'min_width_factor': 0.3361584543761258}. Best is trial 65 with value: 1.204287235687569.\n",
      "[I 2026-07-02 16:33:44,042] Trial 102 finished with value: 1.6865138821177914 and parameters: {'aci_target': 0.18148750721624526, 'aci_step_size': 0.016272417860401657, 'interval_scale': 1.4034380280703482, 'interval_power': 0.004225322087534053, 'min_width_factor': 0.3629399372533102}. Best is trial 65 with value: 1.204287235687569.\n",
      "[I 2026-07-02 16:33:44,167] Trial 103 finished with value: 1.6691427430542336 and parameters: {'aci_target': 0.1835987225837722, 'aci_step_size': 0.009267222013102228, 'interval_scale': 1.3060406832369156, 'interval_power': 0.061260367629490525, 'min_width_factor': 0.484672320648903}. Best is trial 65 with value: 1.204287235687569.\n",
      "[I 2026-07-02 16:33:44,291] Trial 104 finished with value: 1.3556019403254038 and parameters: {'aci_target': 0.17344512262281409, 'aci_step_size': 0.016981824797045138, 'interval_scale': 1.8272040149461137, 'interval_power': 0.028835228827542216, 'min_width_factor': 0.336273140744388}. Best is trial 65 with value: 1.204287235687569.\n",
      "[I 2026-07-02 16:33:44,415] Trial 105 finished with value: 1.3012377975415437 and parameters: {'aci_target': 0.16848223507086854, 'aci_step_size': 0.013781303140860051, 'interval_scale': 1.4519500027457684, 'interval_power': 0.1332223894885254, 'min_width_factor': 0.3941337877853125}. Best is trial 65 with value: 1.204287235687569.\n",
      "[I 2026-07-02 16:33:44,542] Trial 106 finished with value: 1.259195154923221 and parameters: {'aci_target': 0.19174680938699484, 'aci_step_size': 0.02352381970779654, 'interval_scale': 1.669446891944714, 'interval_power': 0.06348896299849219, 'min_width_factor': 0.4384032460800068}. Best is trial 65 with value: 1.204287235687569.\n",
      "[I 2026-07-02 16:33:44,669] Trial 107 finished with value: 1.226821122027505 and parameters: {'aci_target': 0.19586521340915689, 'aci_step_size': 0.011102345782572047, 'interval_scale': 1.2143634846882534, 'interval_power': 0.12632626555925536, 'min_width_factor': 0.32811072024997034}. Best is trial 65 with value: 1.204287235687569.\n",
      "[I 2026-07-02 16:33:44,792] Trial 108 finished with value: 1.2723134666833678 and parameters: {'aci_target': 0.1796201653690523, 'aci_step_size': 0.011061106633467833, 'interval_scale': 1.1665002716217094, 'interval_power': 0.18969597354285855, 'min_width_factor': 0.27911763463982975}. Best is trial 65 with value: 1.204287235687569.\n",
      "[I 2026-07-02 16:33:44,917] Trial 109 finished with value: 1.2396220678910381 and parameters: {'aci_target': 0.1947691145079272, 'aci_step_size': 0.012116052124725978, 'interval_scale': 1.2865572638659073, 'interval_power': 0.12657779256317087, 'min_width_factor': 0.3388709094832028}. Best is trial 65 with value: 1.204287235687569.\n",
      "[I 2026-07-02 16:33:45,045] Trial 110 finished with value: 9.196220188689605 and parameters: {'aci_target': 0.18470535995653642, 'aci_step_size': 0.014961529058517865, 'interval_scale': 1.2391442398582708, 'interval_power': 1.2419535858252957, 'min_width_factor': 1.2756787201920896}. Best is trial 65 with value: 1.204287235687569.\n",
      "[I 2026-07-02 16:33:45,166] Trial 111 finished with value: 1.2175580983457512 and parameters: {'aci_target': 0.19709180753929806, 'aci_step_size': 0.008384155951436803, 'interval_scale': 1.4979073380888726, 'interval_power': 0.029467739735256036, 'min_width_factor': 0.5574916352840653}. Best is trial 65 with value: 1.204287235687569.\n",
      "[I 2026-07-02 16:33:45,290] Trial 112 finished with value: 1.2179227474558434 and parameters: {'aci_target': 0.19577808638486668, 'aci_step_size': 0.008924189261975538, 'interval_scale': 1.3588209487376948, 'interval_power': 0.0255267661367961, 'min_width_factor': 0.5585855826143427}. Best is trial 65 with value: 1.204287235687569.\n",
      "[I 2026-07-02 16:33:45,416] Trial 113 finished with value: 1.2220234790682498 and parameters: {'aci_target': 0.19079045145740695, 'aci_step_size': 0.008420579198829254, 'interval_scale': 1.3442282394222669, 'interval_power': 0.01528830448502286, 'min_width_factor': 0.5708877774515617}. Best is trial 65 with value: 1.204287235687569.\n",
      "[I 2026-07-02 16:33:45,542] Trial 114 finished with value: 4.813751146127661 and parameters: {'aci_target': 0.19006875283250496, 'aci_step_size': 0.008636360089075784, 'interval_scale': 7.252577870418196, 'interval_power': 0.0011202059367853012, 'min_width_factor': 0.577843067453719}. Best is trial 65 with value: 1.204287235687569.\n",
      "[I 2026-07-02 16:33:45,668] Trial 115 finished with value: 1.214899958019759 and parameters: {'aci_target': 0.19163177036179102, 'aci_step_size': 0.008268434929556012, 'interval_scale': 1.351076641857911, 'interval_power': 0.02236930212107498, 'min_width_factor': 0.5495172143060881}. Best is trial 65 with value: 1.204287235687569.\n",
      "[I 2026-07-02 16:33:45,794] Trial 116 finished with value: 1.2154120915829518 and parameters: {'aci_target': 0.190364902293451, 'aci_step_size': 0.006905231824205899, 'interval_scale': 1.3593947800052077, 'interval_power': 0.02663793164735597, 'min_width_factor': 0.5510536149956693}. Best is trial 65 with value: 1.204287235687569.\n",
      "[I 2026-07-02 16:33:45,921] Trial 117 finished with value: 1.214523999261206 and parameters: {'aci_target': 0.19977483586196196, 'aci_step_size': 0.006619308743961307, 'interval_scale': 1.3555492174012054, 'interval_power': 0.026664304011740955, 'min_width_factor': 0.5483893380304258}. Best is trial 65 with value: 1.204287235687569.\n",
      "[I 2026-07-02 16:33:46,051] Trial 118 finished with value: 1.7189359595609972 and parameters: {'aci_target': 0.18622744453960424, 'aci_step_size': 0.006626217706854513, 'interval_scale': 1.158443648784222, 'interval_power': 0.03920232579851776, 'min_width_factor': 0.46334144079230233}. Best is trial 65 with value: 1.204287235687569.\n",
      "[I 2026-07-02 16:33:46,185] Trial 119 finished with value: 1.6597233885988718 and parameters: {'aci_target': 0.19673288509929154, 'aci_step_size': 0.005704163760061019, 'interval_scale': 1.4882875443013868, 'interval_power': 0.027721523509026597, 'min_width_factor': 0.49695500887978167}. Best is trial 65 with value: 1.204287235687569.\n",
      "[I 2026-07-02 16:33:46,312] Trial 120 finished with value: 1.3757305463407126 and parameters: {'aci_target': 0.19957849234246638, 'aci_step_size': 0.007096157810010893, 'interval_scale': 1.040711530612391, 'interval_power': 0.10485570383596665, 'min_width_factor': 0.6878652731703546}. Best is trial 65 with value: 1.204287235687569.\n",
      "[I 2026-07-02 16:33:46,439] Trial 121 finished with value: 1.2138543196885374 and parameters: {'aci_target': 0.19312383441860573, 'aci_step_size': 0.008227090884848924, 'interval_scale': 1.3551808566165533, 'interval_power': 0.0245270772200899, 'min_width_factor': 0.5463802993124247}. Best is trial 65 with value: 1.204287235687569.\n",
      "[I 2026-07-02 16:33:46,566] Trial 122 finished with value: 1.2111139454467097 and parameters: {'aci_target': 0.19285099863820968, 'aci_step_size': 0.008136619693176536, 'interval_scale': 1.2443774505947538, 'interval_power': 0.03701537322072076, 'min_width_factor': 0.5381591765869433}. Best is trial 65 with value: 1.204287235687569.\n",
      "[I 2026-07-02 16:33:46,689] Trial 123 finished with value: 1.2161677823043535 and parameters: {'aci_target': 0.19241498397494058, 'aci_step_size': 0.008013066217370884, 'interval_scale': 1.2511852713124616, 'interval_power': 0.09033600911096443, 'min_width_factor': 0.5533206871598715}. Best is trial 65 with value: 1.204287235687569.\n",
      "[I 2026-07-02 16:33:46,813] Trial 124 finished with value: 1.2165711858922974 and parameters: {'aci_target': 0.19233593742959185, 'aci_step_size': 0.008102901945764726, 'interval_scale': 1.3711401353428265, 'interval_power': 0.08310441180392159, 'min_width_factor': 0.5545308979237007}. Best is trial 65 with value: 1.204287235687569.\n",
      "[I 2026-07-02 16:33:46,935] Trial 125 finished with value: 1.276132502284191 and parameters: {'aci_target': 0.18668783584379178, 'aci_step_size': 0.008037192306399418, 'interval_scale': 1.1219547666818728, 'interval_power': 0.16015416820377332, 'min_width_factor': 0.6380662511420966}. Best is trial 65 with value: 1.204287235687569.\n",
      "[I 2026-07-02 16:33:47,061] Trial 126 finished with value: 1.2110336766218852 and parameters: {'aci_target': 0.191515545419045, 'aci_step_size': 0.006697606727228918, 'interval_scale': 1.23387202607422, 'interval_power': 0.07926453982993244, 'min_width_factor': 0.5379183701124697}. Best is trial 65 with value: 1.204287235687569.\n",
      "[I 2026-07-02 16:33:47,186] Trial 127 finished with value: 1.2102965380118709 and parameters: {'aci_target': 0.19219133564187052, 'aci_step_size': 0.00575081340445368, 'interval_scale': 1.2384861030153238, 'interval_power': 0.09186022767095059, 'min_width_factor': 0.5357069542824232}. Best is trial 65 with value: 1.204287235687569.\n",
      "[I 2026-07-02 16:33:47,311] Trial 128 finished with value: 1.2117586092726513 and parameters: {'aci_target': 0.17902575569109044, 'aci_step_size': 0.005852615875902284, 'interval_scale': 1.2079926675995918, 'interval_power': 0.10786993956684253, 'min_width_factor': 0.5239321897495404}. Best is trial 65 with value: 1.204287235687569.\n",
      "[I 2026-07-02 16:33:47,436] Trial 129 finished with value: 1.6653084836701726 and parameters: {'aci_target': 0.17729094669781234, 'aci_step_size': 0.005936329961866449, 'interval_scale': 1.0630853544250345, 'interval_power': 0.11299323946126306, 'min_width_factor': 0.5035620477104248}. Best is trial 65 with value: 1.204287235687569.\n",
      "[I 2026-07-02 16:33:47,562] Trial 130 finished with value: 1.2496075655487122 and parameters: {'aci_target': 0.1838365447379492, 'aci_step_size': 0.006750435170342012, 'interval_scale': 1.190226891219194, 'interval_power': 0.1539214291990978, 'min_width_factor': 0.5236786242959308}. Best is trial 65 with value: 1.204287235687569.\n",
      "[I 2026-07-02 16:33:47,689] Trial 131 finished with value: 1.2313392317365068 and parameters: {'aci_target': 0.1884151693099094, 'aci_step_size': 0.005395026756118845, 'interval_scale': 1.2640202308367297, 'interval_power': 0.08722049333208035, 'min_width_factor': 0.5988350354563292}. Best is trial 65 with value: 1.204287235687569.\n",
      "[I 2026-07-02 16:33:47,813] Trial 132 finished with value: 1.2523086122352127 and parameters: {'aci_target': 0.19141385373550113, 'aci_step_size': 0.006106502275109716, 'interval_scale': 1.2252237279121643, 'interval_power': 0.13963067301690943, 'min_width_factor': 0.4644900716242359}. Best is trial 65 with value: 1.204287235687569.\n",
      "[I 2026-07-02 16:33:47,942] Trial 133 finished with value: 1.2097886209927915 and parameters: {'aci_target': 0.18037255184666298, 'aci_step_size': 0.006867305762320517, 'interval_scale': 1.1525269614372091, 'interval_power': 0.05441959454585938, 'min_width_factor': 0.5341832032251839}. Best is trial 65 with value: 1.204287235687569.\n",
      "[I 2026-07-02 16:33:48,071] Trial 134 finished with value: 1.6854584462968027 and parameters: {'aci_target': 0.18059413329966603, 'aci_step_size': 0.006638435101442765, 'interval_scale': 0.9923325055967119, 'interval_power': 0.04868620677423725, 'min_width_factor': 0.4884495757404506}. Best is trial 65 with value: 1.204287235687569.\n",
      "[I 2026-07-02 16:33:48,197] Trial 135 finished with value: 1.2086301556294303 and parameters: {'aci_target': 0.17489243883528213, 'aci_step_size': 0.009705663023977153, 'interval_scale': 1.1411671413123896, 'interval_power': 0.10814818224721101, 'min_width_factor': 0.5307078071351004}. Best is trial 65 with value: 1.204287235687569.\n",
      "[I 2026-07-02 16:33:48,325] Trial 136 finished with value: 1.6880937105911098 and parameters: {'aci_target': 0.17428852784454257, 'aci_step_size': 0.00952855163221896, 'interval_scale': 1.0974872235437951, 'interval_power': 0.113049004970012, 'min_width_factor': 0.41944654525913255}. Best is trial 65 with value: 1.204287235687569.\n",
      "[I 2026-07-02 16:33:48,451] Trial 137 finished with value: 1.3214779891411055 and parameters: {'aci_target': 0.17648912454421276, 'aci_step_size': 0.005019344973990236, 'interval_scale': 1.141767749502508, 'interval_power': 0.21294939880057406, 'min_width_factor': 0.5210140357173018}. Best is trial 65 with value: 1.204287235687569.\n",
      "[I 2026-07-02 16:33:48,579] Trial 138 finished with value: 1.228944355156331 and parameters: {'aci_target': 0.1861944572200645, 'aci_step_size': 0.005868865056078829, 'interval_scale': 1.0668791479292876, 'interval_power': 0.07100003975210892, 'min_width_factor': 0.5916504057158035}. Best is trial 65 with value: 1.204287235687569.\n",
      "[I 2026-07-02 16:33:48,703] Trial 139 finished with value: 1.2941818165931258 and parameters: {'aci_target': 0.17863344404080111, 'aci_step_size': 0.010140698667609901, 'interval_scale': 1.173010050497927, 'interval_power': 0.17987389993028613, 'min_width_factor': 0.6470909082965599}. Best is trial 65 with value: 1.204287235687569.\n",
      "[I 2026-07-02 16:33:48,830] Trial 140 finished with value: 1.7033235310641315 and parameters: {'aci_target': 0.19948748965596574, 'aci_step_size': 0.00636844309871448, 'interval_scale': 0.9526767961975166, 'interval_power': 0.05239236153432064, 'min_width_factor': 0.47505076216495623}. Best is trial 65 with value: 1.204287235687569.\n",
      "[I 2026-07-02 16:33:48,955] Trial 141 finished with value: 1.2108274681119227 and parameters: {'aci_target': 0.18308970383703596, 'aci_step_size': 0.007180347007876437, 'interval_scale': 1.2934398102269273, 'interval_power': 0.0005783746808570404, 'min_width_factor': 0.5372997445825768}. Best is trial 65 with value: 1.204287235687569.\n",
      "[I 2026-07-02 16:33:49,081] Trial 142 finished with value: 1.2099265625096203 and parameters: {'aci_target': 0.1833907331007109, 'aci_step_size': 0.009299067201990847, 'interval_scale': 1.2916061644336982, 'interval_power': 0.08183137980261918, 'min_width_factor': 0.5278453621035428}. Best is trial 65 with value: 1.204287235687569.\n",
      "[I 2026-07-02 16:33:49,210] Trial 143 finished with value: 1.2340591482911456 and parameters: {'aci_target': 0.18261167448738896, 'aci_step_size': 0.007489089313816877, 'interval_scale': 1.2906124513487356, 'interval_power': 0.09935532299915327, 'min_width_factor': 0.5169046436966849}. Best is trial 65 with value: 1.204287235687569.\n",
