      "[I 2026-07-02 16:31:01,079] Trial 164 finished with value: 0.007970663241079281 and parameters: {'reservoir_size': 33, 'spectral_radius': 1.168893761399344, 'ar_lags': 7, 'foundation_window': 24, 'regressor_type': 'ElasticNet', 'reg_alpha': 1.9970053034837447, 'aci_step_size': 0.19659841646423645, 'oob_split_ratio': 0.691024582324288}. Best is trial 135 with value: 0.00790160815872853.\n",
      "[I 2026-07-02 16:31:01,186] Trial 165 finished with value: 0.007964157178278114 and parameters: {'reservoir_size': 21, 'spectral_radius': 1.2125780329097804, 'ar_lags': 7, 'foundation_window': 24, 'regressor_type': 'ElasticNet', 'reg_alpha': 1.7950364525819031, 'aci_step_size': 0.19395738453805367, 'oob_split_ratio': 0.7194714876993699}. Best is trial 135 with value: 0.00790160815872853.\n",
      "[I 2026-07-02 16:31:01,286] Trial 166 finished with value: 0.011056191200941744 and parameters: {'reservoir_size': 21, 'spectral_radius': 1.2082342327923665, 'ar_lags': 7, 'foundation_window': 23, 'regressor_type': 'ElasticNet', 'reg_alpha': 1.7759130095142717, 'aci_step_size': 0.18899429770462692, 'oob_split_ratio': 0.7195399490934796}. Best is trial 135 with value: 0.00790160815872853.\n",
      "[I 2026-07-02 16:31:01,394] Trial 167 finished with value: 0.008822527753232988 and parameters: {'reservoir_size': 19, 'spectral_radius': 1.167926839202891, 'ar_lags': 7, 'foundation_window': 24, 'regressor_type': 'ElasticNet', 'reg_alpha': 2.1382494214578727, 'aci_step_size': 0.190318555689704, 'oob_split_ratio': 0.7117897159724588}. Best is trial 135 with value: 0.00790160815872853.\n",
      "[I 2026-07-02 16:31:01,497] Trial 168 finished with value: 0.011059607402380767 and parameters: {'reservoir_size': 32, 'spectral_radius': 1.2497557536207962, 'ar_lags': 7, 'foundation_window': 23, 'regressor_type': 'Lasso', 'reg_alpha': 1.6556248159641505, 'aci_step_size': 0.19171191231092233, 'oob_split_ratio': 0.722745073484559}. Best is trial 135 with value: 0.00790160815872853.\n",
      "[I 2026-07-02 16:31:01,591] Trial 169 finished with value: 0.007974994265035172 and parameters: {'reservoir_size': 41, 'spectral_radius': 1.3153571675704472, 'ar_lags': 7, 'foundation_window': 24, 'regressor_type': 'ElasticNet', 'reg_alpha': 1.9656549907337868, 'aci_step_size': 0.19859136319918272, 'oob_split_ratio': 0.7051750770566857}. Best is trial 135 with value: 0.00790160815872853.\n",
      "[I 2026-07-02 16:31:01,671] Trial 170 finished with value: 0.011056191200941744 and parameters: {'reservoir_size': 14, 'spectral_radius': 1.1649963303698825, 'ar_lags': 7, 'foundation_window': 23, 'regressor_type': 'ElasticNet', 'reg_alpha': 2.3836582303535034, 'aci_step_size': 0.19575988429245328, 'oob_split_ratio': 0.7188694725667014}. Best is trial 135 with value: 0.00790160815872853.\n",
      "[I 2026-07-02 16:31:01,780] Trial 171 finished with value: 0.007908904730549629 and parameters: {'reservoir_size': 30, 'spectral_radius': 1.1394569341821907, 'ar_lags': 7, 'foundation_window': 24, 'regressor_type': 'ElasticNet', 'reg_alpha': 2.863081313540492, 'aci_step_size': 0.1845176870694794, 'oob_split_ratio': 0.7252365848318663}. Best is trial 135 with value: 0.00790160815872853.\n",
      "[I 2026-07-02 16:31:01,887] Trial 172 finished with value: 0.007908904730549629 and parameters: {'reservoir_size': 26, 'spectral_radius': 1.1948864742129917, 'ar_lags': 7, 'foundation_window': 24, 'regressor_type': 'ElasticNet', 'reg_alpha': 2.2042112118656076, 'aci_step_size': 0.1842781654191694, 'oob_split_ratio': 0.7272249864292789}. Best is trial 135 with value: 0.00790160815872853.\n",
      "[I 2026-07-02 16:31:01,996] Trial 173 finished with value: 0.007908904730549629 and parameters: {'reservoir_size': 37, 'spectral_radius': 1.1936154718660947, 'ar_lags': 7, 'foundation_window': 24, 'regressor_type': 'ElasticNet', 'reg_alpha': 1.6547148268244982, 'aci_step_size': 0.18452971507165167, 'oob_split_ratio': 0.7276161642866825}. Best is trial 135 with value: 0.00790160815872853.\n",
      "[I 2026-07-02 16:31:02,102] Trial 174 finished with value: 0.007908904730549629 and parameters: {'reservoir_size': 36, 'spectral_radius': 1.1951965227259862, 'ar_lags': 7, 'foundation_window': 24, 'regressor_type': 'ElasticNet', 'reg_alpha': 1.7725313105835179, 'aci_step_size': 0.1920282928971433, 'oob_split_ratio': 0.7269623520981401}. Best is trial 135 with value: 0.00790160815872853.\n",
      "[I 2026-07-02 16:31:02,207] Trial 175 finished with value: 0.007908904730549629 and parameters: {'reservoir_size': 28, 'spectral_radius': 1.1930850660526806, 'ar_lags': 7, 'foundation_window': 24, 'regressor_type': 'ElasticNet', 'reg_alpha': 1.6396453806119486, 'aci_step_size': 0.18756208973101696, 'oob_split_ratio': 0.7258586951893075}. Best is trial 135 with value: 0.00790160815872853.\n",
      "[I 2026-07-02 16:31:02,307] Trial 176 finished with value: 0.011059607402380767 and parameters: {'reservoir_size': 29, 'spectral_radius': 1.2022445538413353, 'ar_lags': 7, 'foundation_window': 23, 'regressor_type': 'ElasticNet', 'reg_alpha': 1.5748818408144134, 'aci_step_size': 0.18497294806627845, 'oob_split_ratio': 0.7270286055463665}. Best is trial 135 with value: 0.00790160815872853.\n",
      "[I 2026-07-02 16:31:02,411] Trial 177 finished with value: 0.007908904730549629 and parameters: {'reservoir_size': 25, 'spectral_radius': 1.1456382158979395, 'ar_lags': 7, 'foundation_window': 24, 'regressor_type': 'ElasticNet', 'reg_alpha': 2.2322879502717345, 'aci_step_size': 0.19102917900298377, 'oob_split_ratio': 0.7242242914392196}. Best is trial 135 with value: 0.00790160815872853.\n",
      "[I 2026-07-02 16:31:02,516] Trial 178 finished with value: 0.007908904730549629 and parameters: {'reservoir_size': 36, 'spectral_radius': 1.1258989000182, 'ar_lags': 7, 'foundation_window': 24, 'regressor_type': 'ElasticNet', 'reg_alpha': 2.21429157209383, 'aci_step_size': 0.18851750362992947, 'oob_split_ratio': 0.7262034214602069}. Best is trial 135 with value: 0.00790160815872853.\n",
      "[I 2026-07-02 16:31:02,616] Trial 179 finished with value: 0.011062779750000662 and parameters: {'reservoir_size': 37, 'spectral_radius': 1.1309334474717334, 'ar_lags': 8, 'foundation_window': 23, 'regressor_type': 'ElasticNet', 'reg_alpha': 2.2527731660477937, 'aci_step_size': 0.1886483919755421, 'oob_split_ratio': 0.72739156528796}. Best is trial 135 with value: 0.00790160815872853.\n",
      "[I 2026-07-02 16:31:02,717] Trial 180 finished with value: 0.011059607402380767 and parameters: {'reservoir_size': 26, 'spectral_radius': 1.1209124690195196, 'ar_lags': 7, 'foundation_window': 23, 'regressor_type': 'ElasticNet', 'reg_alpha': 2.819106869490932, 'aci_step_size': 0.18384400102767443, 'oob_split_ratio': 0.7242623181052734}. Best is trial 135 with value: 0.00790160815872853.\n",
      "[I 2026-07-02 16:31:02,827] Trial 181 finished with value: 0.008822527753232988 and parameters: {'reservoir_size': 32, 'spectral_radius': 1.1837144145884801, 'ar_lags': 7, 'foundation_window': 24, 'regressor_type': 'ElasticNet', 'reg_alpha': 2.1632571281498016, 'aci_step_size': 0.19117612941457807, 'oob_split_ratio': 0.7151551911202754}. Best is trial 135 with value: 0.00790160815872853.\n",
      "[I 2026-07-02 16:31:02,928] Trial 182 finished with value: 0.007948784014064283 and parameters: {'reservoir_size': 45, 'spectral_radius': 1.2363559246983504, 'ar_lags': 7, 'foundation_window': 24, 'regressor_type': 'ElasticNet', 'reg_alpha': 1.5721255369386051, 'aci_step_size': 0.18706805587143518, 'oob_split_ratio': 0.7300046546525526}. Best is trial 135 with value: 0.00790160815872853.\n",
      "[I 2026-07-02 16:31:03,028] Trial 183 finished with value: 0.007948784014064283 and parameters: {'reservoir_size': 41, 'spectral_radius': 1.2373697209419634, 'ar_lags': 7, 'foundation_window': 24, 'regressor_type': 'ElasticNet', 'reg_alpha': 1.532305132866407, 'aci_step_size': 0.18689875138166817, 'oob_split_ratio': 0.7301966541669809}. Best is trial 135 with value: 0.00790160815872853.\n",
      "[I 2026-07-02 16:31:03,125] Trial 184 finished with value: 0.007948784014064283 and parameters: {'reservoir_size': 44, 'spectral_radius': 1.2710012987905623, 'ar_lags': 7, 'foundation_window': 24, 'regressor_type': 'ElasticNet', 'reg_alpha': 1.5207888880599203, 'aci_step_size': 0.18642570135839726, 'oob_split_ratio': 0.7305897428615765}. Best is trial 135 with value: 0.00790160815872853.\n",
      "[I 2026-07-02 16:31:03,222] Trial 185 finished with value: 0.011061937474388335 and parameters: {'reservoir_size': 45, 'spectral_radius': 1.2344843251637165, 'ar_lags': 7, 'foundation_window': 23, 'regressor_type': 'ElasticNet', 'reg_alpha': 1.5209176269740123, 'aci_step_size': 0.18234341729814563, 'oob_split_ratio': 0.7306654970889908}. Best is trial 135 with value: 0.00790160815872853.\n",
      "[I 2026-07-02 16:31:03,328] Trial 186 finished with value: 0.007908904730549629 and parameters: {'reservoir_size': 42, 'spectral_radius': 1.2667411271175153, 'ar_lags': 7, 'foundation_window': 24, 'regressor_type': 'ElasticNet', 'reg_alpha': 1.591042903215264, 'aci_step_size': 0.186621438540381, 'oob_split_ratio': 0.726257672932846}. Best is trial 135 with value: 0.00790160815872853.\n",
      "[I 2026-07-02 16:31:03,433] Trial 187 finished with value: 0.007908904730549629 and parameters: {'reservoir_size': 41, 'spectral_radius': 1.257371472131624, 'ar_lags': 7, 'foundation_window': 24, 'regressor_type': 'ElasticNet', 'reg_alpha': 1.4899686286590197, 'aci_step_size': 0.18606781161483327, 'oob_split_ratio': 0.7274581363614886}. Best is trial 135 with value: 0.00790160815872853.\n",
      "[I 2026-07-02 16:31:03,528] Trial 188 finished with value: 0.011066019668312409 and parameters: {'reservoir_size': 41, 'spectral_radius': 1.2652327689532517, 'ar_lags': 8, 'foundation_window': 23, 'regressor_type': 'ElasticNet', 'reg_alpha': 1.503837535478296, 'aci_step_size': 0.18610300236402555, 'oob_split_ratio': 0.732088975581702}. Best is trial 135 with value: 0.00790160815872853.\n",
      "[I 2026-07-02 16:31:03,617] Trial 189 finished with value: 0.00790160815872853 and parameters: {'reservoir_size': 43, 'spectral_radius': 1.2349079539914232, 'ar_lags': 6, 'foundation_window': 24, 'regressor_type': 'ElasticNet', 'reg_alpha': 1.4411107065212634, 'aci_step_size': 0.18765302411898402, 'oob_split_ratio': 0.7285085567418563}. Best is trial 135 with value: 0.00790160815872853.\n",
      "[I 2026-07-02 16:31:03,733] Trial 190 finished with value: 0.05167253451536168 and parameters: {'reservoir_size': 40, 'spectral_radius': 1.2418433902351889, 'ar_lags': 6, 'foundation_window': 24, 'regressor_type': 'Ridge', 'reg_alpha': 1.7106227751995913, 'aci_step_size': 0.17962669268720483, 'oob_split_ratio': 0.7261492333216982}. Best is trial 135 with value: 0.00790160815872853.\n",
      "[I 2026-07-02 16:31:03,842] Trial 191 finished with value: 0.00790160815872853 and parameters: {'reservoir_size': 46, 'spectral_radius': 1.2935946427044014, 'ar_lags': 6, 'foundation_window': 24, 'regressor_type': 'ElasticNet', 'reg_alpha': 1.7011162449518578, 'aci_step_size': 0.18708565443761466, 'oob_split_ratio': 0.7300869232629412}. Best is trial 135 with value: 0.00790160815872853.\n",
      "[I 2026-07-02 16:31:03,953] Trial 192 finished with value: 0.00790160815872853 and parameters: {'reservoir_size': 49, 'spectral_radius': 1.288431088835919, 'ar_lags': 6, 'foundation_window': 24, 'regressor_type': 'ElasticNet', 'reg_alpha': 1.4145209188932641, 'aci_step_size': 0.18211056885098828, 'oob_split_ratio': 0.7347638768444846}. Best is trial 135 with value: 0.00790160815872853.\n",
      "[I 2026-07-02 16:31:04,056] Trial 193 finished with value: 0.007969244797811276 and parameters: {'reservoir_size': 48, 'spectral_radius': 1.2902696176333837, 'ar_lags': 6, 'foundation_window': 24, 'regressor_type': 'ElasticNet', 'reg_alpha': 2.61582930397676, 'aci_step_size': 0.18125276509091026, 'oob_split_ratio': 0.7363636391188556}. Best is trial 135 with value: 0.00790160815872853.\n",
      "[I 2026-07-02 16:31:04,125] Trial 194 finished with value: 0.011067197082345886 and parameters: {'reservoir_size': 36, 'spectral_radius': 1.075439199619788, 'ar_lags': 6, 'foundation_window': 23, 'regressor_type': 'ElasticNet', 'reg_alpha': 3.1781718536262957, 'aci_step_size': 0.17871876205104945, 'oob_split_ratio': 0.7352808464170052}. Best is trial 135 with value: 0.00790160815872853.\n",
      "[I 2026-07-02 16:31:04,209] Trial 195 finished with value: 0.007962433042425053 and parameters: {'reservoir_size': 26, 'spectral_radius': 1.259016588833628, 'ar_lags': 6, 'foundation_window': 24, 'regressor_type': 'ElasticNet', 'reg_alpha': 1.4461916761248603, 'aci_step_size': 0.1834427902285204, 'oob_split_ratio': 0.726150229613127}. Best is trial 135 with value: 0.00790160815872853.\n",
      "[I 2026-07-02 16:31:04,309] Trial 196 finished with value: 0.011056612609180942 and parameters: {'reservoir_size': 46, 'spectral_radius': 1.2187746686049872, 'ar_lags': 6, 'foundation_window': 23, 'regressor_type': 'ElasticNet', 'reg_alpha': 1.7185179771563952, 'aci_step_size': 0.18827931520302033, 'oob_split_ratio': 0.7269633979014919}. Best is trial 135 with value: 0.00790160815872853.\n",
      "[I 2026-07-02 16:31:04,421] Trial 197 finished with value: 0.00790160815872853 and parameters: {'reservoir_size': 50, 'spectral_radius': 1.292282475507714, 'ar_lags': 6, 'foundation_window': 24, 'regressor_type': 'ElasticNet', 'reg_alpha': 2.4003838559762993, 'aci_step_size': 0.19225988374802236, 'oob_split_ratio': 0.733211652817392}. Best is trial 135 with value: 0.00790160815872853.\n",
      "[I 2026-07-02 16:31:04,521] Trial 198 finished with value: 0.007969244797811276 and parameters: {'reservoir_size': 50, 'spectral_radius': 1.2963826015076743, 'ar_lags': 6, 'foundation_window': 24, 'regressor_type': 'ElasticNet', 'reg_alpha': 2.4238866429466706, 'aci_step_size': 0.1925436286228111, 'oob_split_ratio': 0.736114994015109}. Best is trial 135 with value: 0.00790160815872853.\n",
      "[I 2026-07-02 16:31:04,613] Trial 199 finished with value: 0.01138038540163897 and parameters: {'reservoir_size': 23, 'spectral_radius': 1.1430761657340354, 'ar_lags': 6, 'foundation_window': 23, 'regressor_type': 'ElasticNet', 'reg_alpha': 2.935015822994163, 'aci_step_size': 0.1998775562891312, 'oob_split_ratio': 0.7130258404635342}. Best is trial 135 with value: 0.00790160815872853.\n",
      "[I 2026-07-02 16:31:04,722] Trial 200 finished with value: 0.007962433042425053 and parameters: {'reservoir_size': 14, 'spectral_radius': 1.3554440401665817, 'ar_lags': 6, 'foundation_window': 24, 'regressor_type': 'Lasso', 'reg_alpha': 2.2568755197614507, 'aci_step_size': 0.17794511306361524, 'oob_split_ratio': 0.7241569011800445}. Best is trial 135 with value: 0.00790160815872853.\n",
      "[I 2026-07-02 16:31:04,834] Trial 201 finished with value: 0.00790160815872853 and parameters: {'reservoir_size': 37, 'spectral_radius': 1.1885517208446752, 'ar_lags': 6, 'foundation_window': 24, 'regressor_type': 'ElasticNet', 'reg_alpha': 1.3306107594862853, 'aci_step_size': 0.18793029037791611, 'oob_split_ratio': 0.7314809393216204}. Best is trial 135 with value: 0.00790160815872853.\n",
      "[I 2026-07-02 16:31:04,943] Trial 202 finished with value: 0.00790160815872853 and parameters: {'reservoir_size': 35, 'spectral_radius': 1.1862733280797753, 'ar_lags': 6, 'foundation_window': 24, 'regressor_type': 'ElasticNet', 'reg_alpha': 1.3705197132131925, 'aci_step_size': 0.1824345363425539, 'oob_split_ratio': 0.7329455272720734}. Best is trial 135 with value: 0.00790160815872853.\n",
      "[I 2026-07-02 16:31:05,043] Trial 203 finished with value: 0.007969244797811276 and parameters: {'reservoir_size': 36, 'spectral_radius': 1.19438073100267, 'ar_lags': 6, 'foundation_window': 24, 'regressor_type': 'ElasticNet', 'reg_alpha': 1.381595851735127, 'aci_step_size': 0.18325951508973953, 'oob_split_ratio': 0.7389097839507773}. Best is trial 135 with value: 0.00790160815872853.\n",
      "[I 2026-07-02 16:31:05,121] Trial 204 finished with value: 0.011056612609180942 and parameters: {'reservoir_size': 28, 'spectral_radius': 1.1839197615288606, 'ar_lags': 6, 'foundation_window': 23, 'regressor_type': 'ElasticNet', 'reg_alpha': 1.3352116777423222, 'aci_step_size': 0.19171407403317484, 'oob_split_ratio': 0.726412716146623}. Best is trial 135 with value: 0.00790160815872853.\n",
      "[I 2026-07-02 16:31:05,231] Trial 205 finished with value: 0.00790160815872853 and parameters: {'reservoir_size': 38, 'spectral_radius': 1.2236525787125834, 'ar_lags': 6, 'foundation_window': 24, 'regressor_type': 'ElasticNet', 'reg_alpha': 1.7316937247119228, 'aci_step_size': 0.18843752552991924, 'oob_split_ratio': 0.7338189870827244}. Best is trial 135 with value: 0.00790160815872853.\n",
      "[I 2026-07-02 16:31:05,332] Trial 206 finished with value: 0.007969244797811276 and parameters: {'reservoir_size': 39, 'spectral_radius': 1.100984585035939, 'ar_lags': 6, 'foundation_window': 24, 'regressor_type': 'ElasticNet', 'reg_alpha': 1.1429023327730732, 'aci_step_size': 0.18823327951163588, 'oob_split_ratio': 0.7371806321754594}. Best is trial 135 with value: 0.00790160815872853.\n",
      "[I 2026-07-02 16:31:05,414] Trial 207 finished with value: 0.036727738213778345 and parameters: {'reservoir_size': 34, 'spectral_radius': 1.220023733036369, 'ar_lags': 6, 'foundation_window': 6, 'regressor_type': 'ElasticNet', 'reg_alpha': 1.6647895252405907, 'aci_step_size': 0.195371221708833, 'oob_split_ratio': 0.7235287608572695}. Best is trial 135 with value: 0.00790160815872853.\n",
      "[I 2026-07-02 16:31:05,523] Trial 208 finished with value: 0.011233764808348104 and parameters: {'reservoir_size': 43, 'spectral_radius': 1.3411381113342973, 'ar_lags': 6, 'foundation_window': 23, 'regressor_type': 'ElasticNet', 'reg_alpha': 1.2625798138458995, 'aci_step_size': 0.1836919003745804, 'oob_split_ratio': 0.7156847237885445}. Best is trial 135 with value: 0.00790160815872853.\n",
      "[I 2026-07-02 16:31:05,637] Trial 209 finished with value: 0.00790160815872853 and parameters: {'reservoir_size': 30, 'spectral_radius': 1.2564723869325083, 'ar_lags': 6, 'foundation_window': 24, 'regressor_type': 'ElasticNet', 'reg_alpha': 1.777637438217899, 'aci_step_size': 0.1900906639777419, 'oob_split_ratio': 0.729648207491515}. Best is trial 135 with value: 0.00790160815872853.\n",
      "[I 2026-07-02 16:31:05,745] Trial 210 finished with value: 0.007962433042425053 and parameters: {'reservoir_size': 18, 'spectral_radius': 1.2607250619352692, 'ar_lags': 6, 'foundation_window': 24, 'regressor_type': 'ElasticNet', 'reg_alpha': 1.6947534825176414, 'aci_step_size': 0.19188057511543105, 'oob_split_ratio': 0.7283105449477909}. Best is trial 135 with value: 0.00790160815872853.\n",
      "[I 2026-07-02 16:31:05,859] Trial 211 finished with value: 0.00790160815872853 and parameters: {'reservoir_size': 29, 'spectral_radius': 1.1999326597186237, 'ar_lags': 6, 'foundation_window': 24, 'regressor_type': 'ElasticNet', 'reg_alpha': 1.4051888167917335, 'aci_step_size': 0.18906738320341485, 'oob_split_ratio': 0.7326099016489723}. Best is trial 135 with value: 0.00790160815872853.\n",
      "[I 2026-07-02 16:31:05,965] Trial 212 finished with value: 0.007962433042425053 and parameters: {'reservoir_size': 29, 'spectral_radius': 1.2020225643733213, 'ar_lags': 6, 'foundation_window': 24, 'regressor_type': 'ElasticNet', 'reg_alpha': 1.378989890357847, 'aci_step_size': 0.18896136057549218, 'oob_split_ratio': 0.7245222048023154}. Best is trial 135 with value: 0.00790160815872853.\n",
      "[I 2026-07-02 16:31:06,062] Trial 213 finished with value: 0.007969244797811276 and parameters: {'reservoir_size': 25, 'spectral_radius': 1.2204547415024969, 'ar_lags': 6, 'foundation_window': 24, 'regressor_type': 'ElasticNet', 'reg_alpha': 1.4143589321468237, 'aci_step_size': 0.1960307637463233, 'oob_split_ratio': 0.7408057042127953}. Best is trial 135 with value: 0.00790160815872853.\n",
      "[I 2026-07-02 16:31:06,140] Trial 214 finished with value: 0.011063761900980537 and parameters: {'reservoir_size': 38, 'spectral_radius': 1.1833803733180503, 'ar_lags': 6, 'foundation_window': 23, 'regressor_type': 'ElasticNet', 'reg_alpha': 1.7869370645560718, 'aci_step_size': 0.18760647674458034, 'oob_split_ratio': 0.7313644783313952}. Best is trial 135 with value: 0.00790160815872853.\n",
      "[I 2026-07-02 16:31:06,254] Trial 215 finished with value: 0.00790160815872853 and parameters: {'reservoir_size': 30, 'spectral_radius': 1.154708753857766, 'ar_lags': 6, 'foundation_window': 24, 'regressor_type': 'ElasticNet', 'reg_alpha': 1.109169260275629, 'aci_step_size': 0.1902172307684647, 'oob_split_ratio': 0.7345510240502094}. Best is trial 135 with value: 0.00790160815872853.\n",
      "[I 2026-07-02 16:31:06,357] Trial 216 finished with value: 0.007969244797811276 and parameters: {'reservoir_size': 32, 'spectral_radius': 1.14531534687053, 'ar_lags': 6, 'foundation_window': 24, 'regressor_type': 'ElasticNet', 'reg_alpha': 1.2304045421245628, 'aci_step_size': 0.19229511542115196, 'oob_split_ratio': 0.7358805018404262}. Best is trial 135 with value: 0.00790160815872853.\n",
      "[I 2026-07-02 16:31:06,427] Trial 217 finished with value: 0.011067197082345886 and parameters: {'reservoir_size': 31, 'spectral_radius': 1.1580733389112645, 'ar_lags': 6, 'foundation_window': 23, 'regressor_type': 'ElasticNet', 'reg_alpha': 1.0720770140180336, 'aci_step_size': 0.19290285763139065, 'oob_split_ratio': 0.7406453830868542}. Best is trial 135 with value: 0.00790160815872853.\n",
