      "[I 2026-07-02 14:58:41,929] Trial 123 finished with value: 2.3539494356774915 and parameters: {'target_miscoverage': 0.18573480899626904, 'aci_step_size': 0.011066721854878746, 'interval_scale': 0.5875491727914146}. Best is trial 112 with value: 2.003704646213716.\n",
      "[I 2026-07-02 14:58:42,001] Trial 124 finished with value: 2.2405369765272503 and parameters: {'target_miscoverage': 0.1908959848885847, 'aci_step_size': 0.010116069425088232, 'interval_scale': 0.5594172787960531}. Best is trial 112 with value: 2.003704646213716.\n",
      "[I 2026-07-02 14:58:42,089] Trial 125 finished with value: 2.1216927835468247 and parameters: {'target_miscoverage': 0.18659897355488206, 'aci_step_size': 0.023071441410807986, 'interval_scale': 0.5296054788965604}. Best is trial 112 with value: 2.003704646213716.\n",
      "[I 2026-07-02 14:58:42,158] Trial 126 finished with value: 2.471942784951548 and parameters: {'target_miscoverage': 0.19546057581908852, 'aci_step_size': 0.012750620520736862, 'interval_scale': 0.6173665348277495}. Best is trial 112 with value: 2.003704646213716.\n",
      "[I 2026-07-02 14:58:42,226] Trial 127 finished with value: 2.007551276075996 and parameters: {'target_miscoverage': 0.17878584372022316, 'aci_step_size': 0.018098407073712488, 'interval_scale': 0.5008755023653468}. Best is trial 112 with value: 2.003704646213716.\n",
      "[I 2026-07-02 14:58:42,297] Trial 128 finished with value: 2.3262295087656666 and parameters: {'target_miscoverage': 0.1785009147484259, 'aci_step_size': 0.011103188191275705, 'interval_scale': 0.5803742884982386}. Best is trial 112 with value: 2.003704646213716.\n",
      "[I 2026-07-02 14:58:42,376] Trial 129 finished with value: 2.1232100893494827 and parameters: {'target_miscoverage': 0.1907348918822081, 'aci_step_size': 0.007154643867245496, 'interval_scale': 0.5301178933776486}. Best is trial 112 with value: 2.003704646213716.\n",
      "[I 2026-07-02 14:58:42,457] Trial 130 finished with value: 2.2536749727782444 and parameters: {'target_miscoverage': 0.16989383312783748, 'aci_step_size': 0.017643394888957956, 'interval_scale': 0.561977800972598}. Best is trial 112 with value: 2.003704646213716.\n",
      "[I 2026-07-02 14:58:42,528] Trial 131 finished with value: 2.043225873610122 and parameters: {'target_miscoverage': 0.17927056032812907, 'aci_step_size': 0.015757758973622953, 'interval_scale': 0.5097912208409527}. Best is trial 112 with value: 2.003704646213716.\n",
      "[I 2026-07-02 14:58:42,599] Trial 132 finished with value: 2.0099661280785353 and parameters: {'target_miscoverage': 0.1860894823967289, 'aci_step_size': 0.014731693433359673, 'interval_scale': 0.501701291298878}. Best is trial 112 with value: 2.003704646213716.\n",
      "[I 2026-07-02 14:58:42,689] Trial 133 finished with value: 2.006387521184954 and parameters: {'target_miscoverage': 0.19379012035308932, 'aci_step_size': 0.014467232637123547, 'interval_scale': 0.5010432735169419}. Best is trial 112 with value: 2.003704646213716.\n",
      "[I 2026-07-02 14:58:42,763] Trial 134 finished with value: 2.1401146679197587 and parameters: {'target_miscoverage': 0.19548168982539932, 'aci_step_size': 0.014186981220622943, 'interval_scale': 0.5344933088328847}. Best is trial 112 with value: 2.003704646213716.\n",
      "[I 2026-07-02 14:58:42,840] Trial 135 finished with value: 2.388007434466142 and parameters: {'target_miscoverage': 0.17476017189349546, 'aci_step_size': 0.013260552046766145, 'interval_scale': 0.5956515709349673}. Best is trial 112 with value: 2.003704646213716.\n",
      "[I 2026-07-02 14:58:42,918] Trial 136 finished with value: 2.2017748461286404 and parameters: {'target_miscoverage': 0.18671949169968302, 'aci_step_size': 0.019948088070873456, 'interval_scale': 0.5495991685757734}. Best is trial 112 with value: 2.003704646213716.\n",
      "[I 2026-07-02 14:58:42,988] Trial 137 finished with value: 2.5466269431830844 and parameters: {'target_miscoverage': 0.16499185579455616, 'aci_step_size': 0.017645380666396038, 'interval_scale': 0.6348389516839272}. Best is trial 112 with value: 2.003704646213716.\n",
      "[I 2026-07-02 14:58:43,069] Trial 138 finished with value: 2.249550592419455 and parameters: {'target_miscoverage': 0.18530231706416295, 'aci_step_size': 0.014873364134755119, 'interval_scale': 0.561476266795553}. Best is trial 112 with value: 2.003704646213716.\n",
      "[I 2026-07-02 14:58:43,149] Trial 139 finished with value: 2.009586580403526 and parameters: {'target_miscoverage': 0.1926910350703939, 'aci_step_size': 0.016214694503554773, 'interval_scale': 0.5018085154330003}. Best is trial 112 with value: 2.003704646213716.\n",
      "[I 2026-07-02 14:58:43,221] Trial 140 finished with value: 2.1285690599712153 and parameters: {'target_miscoverage': 0.19334929040494458, 'aci_step_size': 0.01653676622874726, 'interval_scale': 0.5315406534981414}. Best is trial 112 with value: 2.003704646213716.\n",
      "[I 2026-07-02 14:58:43,292] Trial 141 finished with value: 2.0101622604555547 and parameters: {'target_miscoverage': 0.18011816377747777, 'aci_step_size': 0.021971034699861475, 'interval_scale': 0.5015676539374141}. Best is trial 112 with value: 2.003704646213716.\n",
      "[I 2026-07-02 14:58:43,365] Trial 142 finished with value: 2.1278040645893967 and parameters: {'target_miscoverage': 0.19976184522424997, 'aci_step_size': 0.024690888461478787, 'interval_scale': 0.5315575229304673}. Best is trial 112 with value: 2.003704646213716.\n",
      "[I 2026-07-02 14:58:43,438] Trial 143 finished with value: 2.38478353799403 and parameters: {'target_miscoverage': 0.18146973443806938, 'aci_step_size': 0.01935631313844124, 'interval_scale': 0.5950906752517378}. Best is trial 112 with value: 2.003704646213716.\n",
      "[I 2026-07-02 14:58:43,512] Trial 144 finished with value: 2.0080849050941323 and parameters: {'target_miscoverage': 0.17306980768954988, 'aci_step_size': 0.02098640178358636, 'interval_scale': 0.5008341866023531}. Best is trial 112 with value: 2.003704646213716.\n",
      "[I 2026-07-02 14:58:43,581] Trial 145 finished with value: 2.246917599807367 and parameters: {'target_miscoverage': 0.17394292842910491, 'aci_step_size': 0.018166563637494852, 'interval_scale': 0.560430987345468}. Best is trial 112 with value: 2.003704646213716.\n",
      "[I 2026-07-02 14:58:43,651] Trial 146 finished with value: 2.0084283042410283 and parameters: {'target_miscoverage': 0.15428329963309587, 'aci_step_size': 0.020407787592826805, 'interval_scale': 0.5003472244232599}. Best is trial 112 with value: 2.003704646213716.\n",
      "[I 2026-07-02 14:58:43,729] Trial 147 finished with value: 2.1416238319867875 and parameters: {'target_miscoverage': 0.149337978514886, 'aci_step_size': 0.029323930683179542, 'interval_scale': 0.5333688993345306}. Best is trial 112 with value: 2.003704646213716.\n",
      "[I 2026-07-02 14:58:43,801] Trial 148 finished with value: 2.3501147546380894 and parameters: {'target_miscoverage': 0.15483932235588252, 'aci_step_size': 0.02160839217433598, 'interval_scale': 0.5854892486678619}. Best is trial 112 with value: 2.003704646213716.\n",
      "[I 2026-07-02 14:58:43,872] Trial 149 finished with value: 2.2179856238676243 and parameters: {'target_miscoverage': 0.1590703389250867, 'aci_step_size': 0.020440381220140066, 'interval_scale': 0.55271392782237}. Best is trial 112 with value: 2.003704646213716.\n",
      "[I 2026-07-02 14:58:43,948] Trial 150 finished with value: 2.493173143124363 and parameters: {'target_miscoverage': 0.13701226389120616, 'aci_step_size': 0.026273978836574927, 'interval_scale': 0.620456645440724}. Best is trial 112 with value: 2.003704646213716.\n",
      "[I 2026-07-02 14:58:44,022] Trial 151 finished with value: 2.008285835450611 and parameters: {'target_miscoverage': 0.16788119440072152, 'aci_step_size': 0.01698514999237605, 'interval_scale': 0.500726032797765}. Best is trial 112 with value: 2.003704646213716.\n",
      "[I 2026-07-02 14:58:44,096] Trial 152 finished with value: 2.011211018680643 and parameters: {'target_miscoverage': 0.16175453962144554, 'aci_step_size': 0.016890557457421334, 'interval_scale': 0.5012683450485296}. Best is trial 112 with value: 2.003704646213716.\n",
      "[I 2026-07-02 14:58:44,166] Trial 153 finished with value: 6.225931892469241 and parameters: {'target_miscoverage': 0.16804165366251322, 'aci_step_size': 0.0191359739573487, 'interval_scale': 1.552327156449443}. Best is trial 112 with value: 2.003704646213716.\n",
      "[I 2026-07-02 14:58:44,241] Trial 154 finished with value: 2.1213352994360113 and parameters: {'target_miscoverage': 0.14639830683930743, 'aci_step_size': 0.023226929068749368, 'interval_scale': 0.528221608435072}. Best is trial 112 with value: 2.003704646213716.\n",
      "[I 2026-07-02 14:58:44,318] Trial 155 finished with value: 2.1304331067236486 and parameters: {'target_miscoverage': 0.1539906870806371, 'aci_step_size': 0.00541237709953001, 'interval_scale': 0.5307320708086566}. Best is trial 112 with value: 2.003704646213716.\n",
      "[I 2026-07-02 14:58:44,397] Trial 156 finished with value: 2.2853178809810974 and parameters: {'target_miscoverage': 0.17195831649339052, 'aci_step_size': 0.016390536181454553, 'interval_scale': 0.5699399597000362}. Best is trial 112 with value: 2.003704646213716.\n",
      "[I 2026-07-02 14:58:44,468] Trial 157 finished with value: 2.117537468346107 and parameters: {'target_miscoverage': 0.17675822739498248, 'aci_step_size': 0.012722529139534857, 'interval_scale': 0.5282513187156755}. Best is trial 112 with value: 2.003704646213716.\n",
      "[I 2026-07-02 14:58:44,540] Trial 158 finished with value: 2.018436906359193 and parameters: {'target_miscoverage': 0.16404959316611842, 'aci_step_size': 0.01382412279680089, 'interval_scale': 0.5031395988469485}. Best is trial 112 with value: 2.003704646213716.\n",
      "[I 2026-07-02 14:58:44,620] Trial 159 finished with value: 2.2555546505060273 and parameters: {'target_miscoverage': 0.1696564544936694, 'aci_step_size': 0.017770700163906427, 'interval_scale': 0.562438387039997}. Best is trial 112 with value: 2.003704646213716.\n",
      "[I 2026-07-02 14:58:44,689] Trial 160 finished with value: 2.4160787292357093 and parameters: {'target_miscoverage': 0.14066251571701308, 'aci_step_size': 0.005740979896858518, 'interval_scale': 0.6014041943631501}. Best is trial 112 with value: 2.003704646213716.\n",
      "[I 2026-07-02 14:58:44,758] Trial 161 finished with value: 2.032480042970687 and parameters: {'target_miscoverage': 0.19393621065035876, 'aci_step_size': 0.020116950840648407, 'interval_scale': 0.5075637271925955}. Best is trial 112 with value: 2.003704646213716.\n",
      "[I 2026-07-02 14:58:44,833] Trial 162 finished with value: 2.0166039579704758 and parameters: {'target_miscoverage': 0.19004378053553692, 'aci_step_size': 0.015117558682690473, 'interval_scale': 0.5034795160328508}. Best is trial 112 with value: 2.003704646213716.\n",
      "[I 2026-07-02 14:58:44,931] Trial 163 finished with value: 2.168180973934776 and parameters: {'target_miscoverage': 0.18331138465363447, 'aci_step_size': 0.01511490725843135, 'interval_scale': 0.5411011533195731}. Best is trial 112 with value: 2.003704646213716.\n",
      "[I 2026-07-02 14:58:45,035] Trial 164 finished with value: 17.669281117435226 and parameters: {'target_miscoverage': 0.17745452417849736, 'aci_step_size': 0.0160451572745652, 'interval_scale': 4.408052846530312}. Best is trial 112 with value: 2.003704646213716.\n",
      "[I 2026-07-02 14:58:45,116] Trial 165 finished with value: 2.188289132084018 and parameters: {'target_miscoverage': 0.19746637774089537, 'aci_step_size': 0.011968552463621003, 'interval_scale': 0.5465910480360233}. Best is trial 112 with value: 2.003704646213716.\n",
      "[I 2026-07-02 14:58:45,191] Trial 166 finished with value: 2.3092966801571 and parameters: {'target_miscoverage': 0.18758066317893962, 'aci_step_size': 0.014282018710549271, 'interval_scale': 0.5764686513812713}. Best is trial 112 with value: 2.003704646213716.\n",
      "[I 2026-07-02 14:58:45,267] Trial 167 finished with value: 2.0052366931024572 and parameters: {'target_miscoverage': 0.17200236066616584, 'aci_step_size': 0.018629042180599808, 'interval_scale': 0.5000912983407249}. Best is trial 112 with value: 2.003704646213716.\n",
      "[I 2026-07-02 14:58:45,346] Trial 168 finished with value: 2.119968320936926 and parameters: {'target_miscoverage': 0.16764340642884945, 'aci_step_size': 0.022083498698067645, 'interval_scale': 0.5285641798361885}. Best is trial 112 with value: 2.003704646213716.\n",
      "[I 2026-07-02 14:58:45,423] Trial 169 finished with value: 2.006938106865451 and parameters: {'target_miscoverage': 0.17412615453845243, 'aci_step_size': 0.01781216661112709, 'interval_scale': 0.5005803771942611}. Best is trial 112 with value: 2.003704646213716.\n",
      "[I 2026-07-02 14:58:45,501] Trial 170 finished with value: 2.266171887125861 and parameters: {'target_miscoverage': 0.1729221150385367, 'aci_step_size': 0.018461926506599162, 'interval_scale': 0.5651982839863648}. Best is trial 112 with value: 2.003704646213716.\n",
      "[I 2026-07-02 14:58:45,578] Trial 171 finished with value: 2.1115044338726463 and parameters: {'target_miscoverage': 0.1797688945040763, 'aci_step_size': 0.01689809480041492, 'interval_scale': 0.526842933841769}. Best is trial 112 with value: 2.003704646213716.\n",
      "[I 2026-07-02 14:58:45,653] Trial 172 finished with value: 2.0062450985632254 and parameters: {'target_miscoverage': 0.17157117002367336, 'aci_step_size': 0.02031257687482454, 'interval_scale': 0.500329645966202}. Best is trial 112 with value: 2.003704646213716.\n",
      "[I 2026-07-02 14:58:45,723] Trial 173 finished with value: 2.012666911430576 and parameters: {'target_miscoverage': 0.1654408888779137, 'aci_step_size': 0.02101708287121302, 'interval_scale': 0.5017438026829864}. Best is trial 112 with value: 2.003704646213716.\n",
      "[I 2026-07-02 14:58:45,795] Trial 174 finished with value: 2.208266055888719 and parameters: {'target_miscoverage': 0.15898556048884654, 'aci_step_size': 0.02376484145878555, 'interval_scale': 0.550289007401131}. Best is trial 112 with value: 2.003704646213716.\n",
      "[I 2026-07-02 14:58:45,870] Trial 175 finished with value: 2.1328679397195294 and parameters: {'target_miscoverage': 0.17190071345099253, 'aci_step_size': 0.019574142075830248, 'interval_scale': 0.5319183000490852}. Best is trial 112 with value: 2.003704646213716.\n",
      "[I 2026-07-02 14:58:45,945] Trial 176 finished with value: 2.2848758844033967 and parameters: {'target_miscoverage': 0.17591043999464812, 'aci_step_size': 0.01791537732325755, 'interval_scale': 0.5699669410646957}. Best is trial 112 with value: 2.003704646213716.\n",
      "[I 2026-07-02 14:58:46,018] Trial 177 finished with value: 2.1354113330210747 and parameters: {'target_miscoverage': 0.16915896343887535, 'aci_step_size': 0.025314152531613995, 'interval_scale': 0.5324636739816252}. Best is trial 112 with value: 2.003704646213716.\n",
      "[I 2026-07-02 14:58:46,094] Trial 178 finished with value: 2.3761432238543607 and parameters: {'target_miscoverage': 0.16136102565553695, 'aci_step_size': 0.006195156905849705, 'interval_scale': 0.5922087927329029}. Best is trial 112 with value: 2.003704646213716.\n",
      "[I 2026-07-02 14:58:46,168] Trial 179 finished with value: 2.007854280443935 and parameters: {'target_miscoverage': 0.17538722110459246, 'aci_step_size': 0.020634359449224177, 'interval_scale': 0.5008473716680256}. Best is trial 112 with value: 2.003704646213716.\n",
      "[I 2026-07-02 14:58:46,244] Trial 180 finished with value: 2.13063443492808 and parameters: {'target_miscoverage': 0.17527604187578485, 'aci_step_size': 0.02052852651721783, 'interval_scale': 0.531470554810383}. Best is trial 112 with value: 2.003704646213716.\n",
      "[I 2026-07-02 14:58:46,319] Trial 181 finished with value: 2.017546805333969 and parameters: {'target_miscoverage': 0.1801187115861697, 'aci_step_size': 0.01912174246784181, 'interval_scale': 0.5034102328708556}. Best is trial 112 with value: 2.003704646213716.\n",
      "[I 2026-07-02 14:58:46,390] Trial 182 finished with value: 2.016475006639121 and parameters: {'target_miscoverage': 0.17221133783430995, 'aci_step_size': 0.022773692088727916, 'interval_scale': 0.5029004528354221}. Best is trial 112 with value: 2.003704646213716.\n",
      "[I 2026-07-02 14:58:46,465] Trial 183 finished with value: 2.2077098487867297 and parameters: {'target_miscoverage': 0.177937962854811, 'aci_step_size': 0.01783199355611039, 'interval_scale': 0.5507857563654411}. Best is trial 112 with value: 2.003704646213716.\n",
      "[I 2026-07-02 14:58:46,537] Trial 184 finished with value: 2.013445077949082 and parameters: {'target_miscoverage': 0.1682144995106028, 'aci_step_size': 0.021197457879178358, 'interval_scale': 0.5020225769202794}. Best is trial 112 with value: 2.003704646213716.\n",
      "[I 2026-07-02 14:58:46,609] Trial 185 finished with value: 2.139543449873525 and parameters: {'target_miscoverage': 0.18314329366987933, 'aci_step_size': 0.013054424645987951, 'interval_scale': 0.5339487710693239}. Best is trial 112 with value: 2.003704646213716.\n",
      "[I 2026-07-02 14:58:46,684] Trial 186 finished with value: 2.006123473397356 and parameters: {'target_miscoverage': 0.16571344882843136, 'aci_step_size': 0.027618645524844096, 'interval_scale': 0.5001208692434367}. Best is trial 112 with value: 2.003704646213716.\n",
      "[I 2026-07-02 14:58:46,752] Trial 187 finished with value: 2.3220450969774564 and parameters: {'target_miscoverage': 0.1641665201410757, 'aci_step_size': 0.02964158923807893, 'interval_scale': 0.5788247094332717}. Best is trial 112 with value: 2.003704646213716.\n",
      "[I 2026-07-02 14:58:46,824] Trial 188 finished with value: 2.127715730255973 and parameters: {'target_miscoverage': 0.15359604781729305, 'aci_step_size': 0.027417797875962702, 'interval_scale': 0.5300423921854919}. Best is trial 112 with value: 2.003704646213716.\n",
      "[I 2026-07-02 14:58:46,895] Trial 189 finished with value: 2.240726442679799 and parameters: {'target_miscoverage': 0.15841501732114346, 'aci_step_size': 0.02404066188939454, 'interval_scale': 0.5583585860128178}. Best is trial 112 with value: 2.003704646213716.\n",
      "[I 2026-07-02 14:58:46,965] Trial 190 finished with value: 2.0132496104948436 and parameters: {'target_miscoverage': 0.16792007504542086, 'aci_step_size': 0.03436128234328242, 'interval_scale': 0.5019648396694607}. Best is trial 112 with value: 2.003704646213716.\n",
      "[I 2026-07-02 14:58:47,039] Trial 191 finished with value: 2.0959159176121522 and parameters: {'target_miscoverage': 0.17360993694580387, 'aci_step_size': 0.018965457314124263, 'interval_scale': 0.5227572205576451}. Best is trial 112 with value: 2.003704646213716.\n",
      "[I 2026-07-02 14:58:47,118] Trial 192 finished with value: 2.2127079716593023 and parameters: {'target_miscoverage': 0.17640596470753325, 'aci_step_size': 0.015831370917823454, 'interval_scale': 0.55198117330708}. Best is trial 112 with value: 2.003704646213716.\n",
      "[I 2026-07-02 14:58:47,191] Trial 193 finished with value: 2.0967177575442837 and parameters: {'target_miscoverage': 0.17045788534592382, 'aci_step_size': 0.01718902597295622, 'interval_scale': 0.5228568137631144}. Best is trial 112 with value: 2.003704646213716.\n",
      "[I 2026-07-02 14:58:47,268] Trial 194 finished with value: 2.005579556485925 and parameters: {'target_miscoverage': 0.18110699591432006, 'aci_step_size': 0.0199447460505144, 'interval_scale': 0.5004543547632185}. Best is trial 112 with value: 2.003704646213716.\n",
      "[I 2026-07-02 14:58:47,352] Trial 195 finished with value: 2.4295806820211303 and parameters: {'target_miscoverage': 0.16318845607500165, 'aci_step_size': 0.02007955668265192, 'interval_scale': 0.6055944372880024}. Best is trial 112 with value: 2.003704646213716.\n",
      "[I 2026-07-02 14:58:47,432] Trial 196 finished with value: 2.2090334688310453 and parameters: {'target_miscoverage': 0.17944980460919757, 'aci_step_size': 0.021752792576231743, 'interval_scale': 0.5511667529041434}. Best is trial 112 with value: 2.003704646213716.\n",
      "[I 2026-07-02 14:58:47,507] Trial 197 finished with value: 2.107007697512459 and parameters: {'target_miscoverage': 0.17309932743994502, 'aci_step_size': 0.01901729830026603, 'interval_scale': 0.5255073534554837}. Best is trial 112 with value: 2.003704646213716.\n",
      "[I 2026-07-02 14:58:47,585] Trial 198 finished with value: 2.0128257946827435 and parameters: {'target_miscoverage': 0.16597320779857194, 'aci_step_size': 0.017553120857280877, 'interval_scale': 0.5017996756817796}. Best is trial 112 with value: 2.003704646213716.\n",
