      "[I 2026-07-02 16:32:59,325] Trial 32 finished with value: 14.028955601782338 and parameters: {'aci_target': 0.1782513076567505, 'aci_step_size': 0.1923739643422132, 'interval_scale': 1.3414126258906938, 'interval_power': 0.019332942287644393, 'min_width_factor': 0.7796371759833771}. Best is trial 13 with value: 12.85411352118769.\n",
      "[I 2026-07-02 16:32:59,563] Trial 33 finished with value: 18.380306498029586 and parameters: {'aci_target': 0.19248818147504884, 'aci_step_size': 0.08708989025576337, 'interval_scale': 1.6721609890928442, 'interval_power': 0.08377477334835484, 'min_width_factor': 1.0822127350002986}. Best is trial 13 with value: 12.85411352118769.\n",
      "[I 2026-07-02 16:32:59,804] Trial 34 finished with value: 42.9950696897184 and parameters: {'aci_target': 0.11464992012577493, 'aci_step_size': 0.04860859599901863, 'interval_scale': 2.20638324184857, 'interval_power': 0.3136743552810802, 'min_width_factor': 0.9681621772173103}. Best is trial 13 with value: 12.85411352118769.\n",
      "[I 2026-07-02 16:33:00,049] Trial 35 finished with value: 18.158344573858265 and parameters: {'aci_target': 0.07527500614909487, 'aci_step_size': 0.0639086253366863, 'interval_scale': 1.0495147682296648, 'interval_power': 0.18756585574555643, 'min_width_factor': 0.47609537856636525}. Best is trial 13 with value: 12.85411352118769.\n",
      "[I 2026-07-02 16:33:00,318] Trial 36 finished with value: 27.474593240458645 and parameters: {'aci_target': 0.1506405849313217, 'aci_step_size': 0.14445927695185545, 'interval_scale': 1.4213195208922358, 'interval_power': 0.2477650287004318, 'min_width_factor': 0.122280574523977}. Best is trial 13 with value: 12.85411352118769.\n",
      "[I 2026-07-02 16:33:00,558] Trial 37 finished with value: 23.5105071432989 and parameters: {'aci_target': 0.16937772268008416, 'aci_step_size': 0.005172965039398948, 'interval_scale': 2.3024619639704715, 'interval_power': 0.06457943755207478, 'min_width_factor': 0.7378408727608137}. Best is trial 13 with value: 12.85411352118769.\n",
      "[I 2026-07-02 16:33:00,799] Trial 38 finished with value: 62.788559866172974 and parameters: {'aci_target': 0.12665868698273075, 'aci_step_size': 0.08439385931524439, 'interval_scale': 2.972582569276131, 'interval_power': 0.30125314180404017, 'min_width_factor': 1.1903394762678732}. Best is trial 13 with value: 12.85411352118769.\n",
      "[I 2026-07-02 16:33:01,038] Trial 39 finished with value: 26.935534346273606 and parameters: {'aci_target': 0.0557844759281709, 'aci_step_size': 0.12395232750046273, 'interval_scale': 1.6833846489186342, 'interval_power': 0.16653526861959422, 'min_width_factor': 0.3600278853917919}. Best is trial 13 with value: 12.85411352118769.\n",
      "[I 2026-07-02 16:33:01,282] Trial 40 finished with value: 8.274345655205309 and parameters: {'aci_target': 0.18928254666148298, 'aci_step_size': 0.03906139061914536, 'interval_scale': 0.9121622696015057, 'interval_power': 0.006582461773940427, 'min_width_factor': 0.5845798009300381}. Best is trial 40 with value: 8.274345655205309.\n",
      "[I 2026-07-02 16:33:01,524] Trial 41 finished with value: 8.490304951878691 and parameters: {'aci_target': 0.1880550398579448, 'aci_step_size': 0.02062548801570054, 'interval_scale': 0.8771248234011274, 'interval_power': 0.049058309745298415, 'min_width_factor': 0.5731295664935796}. Best is trial 40 with value: 8.274345655205309.\n",
      "[I 2026-07-02 16:33:01,768] Trial 42 finished with value: 8.856299526190115 and parameters: {'aci_target': 0.18914240934154006, 'aci_step_size': 0.022608143827382198, 'interval_scale': 0.8716586496824185, 'interval_power': 0.07909028944656782, 'min_width_factor': 0.5699667975419104}. Best is trial 40 with value: 8.274345655205309.\n",
      "[I 2026-07-02 16:33:02,010] Trial 43 finished with value: 9.484853830799912 and parameters: {'aci_target': 0.1898429703564454, 'aci_step_size': 0.011643662335209422, 'interval_scale': 0.8798446979997879, 'interval_power': 0.10721945805555722, 'min_width_factor': 0.3221144065168907}. Best is trial 40 with value: 8.274345655205309.\n",
      "[I 2026-07-02 16:33:02,251] Trial 44 finished with value: 53.31260650420522 and parameters: {'aci_target': 0.1865339884217157, 'aci_step_size': 0.011848759148990267, 'interval_scale': 0.875182163228028, 'interval_power': 1.0171729319652418, 'min_width_factor': 0.21295709053488188}. Best is trial 40 with value: 8.274345655205309.\n",
      "[I 2026-07-02 16:33:02,488] Trial 45 finished with value: 11.198785495546408 and parameters: {'aci_target': 0.16188891153756158, 'aci_step_size': 0.022455480104893937, 'interval_scale': 0.9063025063786617, 'interval_power': 0.12483823485773947, 'min_width_factor': 0.3341156403049556}. Best is trial 40 with value: 8.274345655205309.\n",
      "[I 2026-07-02 16:33:02,728] Trial 46 finished with value: 10.73645330712209 and parameters: {'aci_target': 0.16255270985893697, 'aci_step_size': 0.019307242303570095, 'interval_scale': 0.8850131185577743, 'interval_power': 0.12691112085603984, 'min_width_factor': 0.3428575234280053}. Best is trial 40 with value: 8.274345655205309.\n",
      "[I 2026-07-02 16:33:02,977] Trial 47 finished with value: 11.206306960531338 and parameters: {'aci_target': 0.17771609462736532, 'aci_step_size': 0.018072914994559132, 'interval_scale': 0.7685922709455915, 'interval_power': 0.27050532548023315, 'min_width_factor': 0.4116515488683408}. Best is trial 40 with value: 8.274345655205309.\n",
      "[I 2026-07-02 16:33:03,213] Trial 48 finished with value: 15.403951827852211 and parameters: {'aci_target': 0.15523625247589645, 'aci_step_size': 0.007207581140734966, 'interval_scale': 0.8296105135818996, 'interval_power': 0.38181706718620995, 'min_width_factor': 0.19252056792630157}. Best is trial 40 with value: 8.274345655205309.\n",
      "[I 2026-07-02 16:33:03,446] Trial 49 finished with value: 12.532372198592393 and parameters: {'aci_target': 0.16558249193974445, 'aci_step_size': 0.012229962898090658, 'interval_scale': 0.965533945886052, 'interval_power': 0.19127247120955843, 'min_width_factor': 0.29300261195798166}. Best is trial 40 with value: 8.274345655205309.\n",
      "[I 2026-07-02 16:33:03,684] Trial 50 finished with value: 41.59832019175811 and parameters: {'aci_target': 0.014443631833736953, 'aci_step_size': 0.019065015770805164, 'interval_scale': 1.1029051960089775, 'interval_power': 0.6054119367977471, 'min_width_factor': 0.023040849185265555}. Best is trial 40 with value: 8.274345655205309.\n",
      "[I 2026-07-02 16:33:03,923] Trial 51 finished with value: 11.003986192802248 and parameters: {'aci_target': 0.1610045345246592, 'aci_step_size': 0.022132320484518266, 'interval_scale': 0.9007274892481519, 'interval_power': 0.11581149577347366, 'min_width_factor': 0.355053858562932}. Best is trial 40 with value: 8.274345655205309.\n",
      "[I 2026-07-02 16:33:04,160] Trial 52 finished with value: 9.646508264124753 and parameters: {'aci_target': 0.18974153300459942, 'aci_step_size': 0.013332421093408308, 'interval_scale': 0.9029363327696143, 'interval_power': 0.10002698252038938, 'min_width_factor': 0.47636178544472096}. Best is trial 40 with value: 8.274345655205309.\n",
      "[I 2026-07-02 16:33:04,398] Trial 53 finished with value: 9.99801020986391 and parameters: {'aci_target': 0.19106812961046948, 'aci_step_size': 0.013348262744265661, 'interval_scale': 0.9806177661395252, 'interval_power': 0.07446980917480021, 'min_width_factor': 0.4702011604787596}. Best is trial 40 with value: 8.274345655205309.\n",
      "[I 2026-07-02 16:33:04,636] Trial 54 finished with value: 9.648615688127148 and parameters: {'aci_target': 0.19120122707995246, 'aci_step_size': 0.01283299218659507, 'interval_scale': 0.9709149183819002, 'interval_power': 0.06023779813796418, 'min_width_factor': 0.4727513452171596}. Best is trial 40 with value: 8.274345655205309.\n",
      "[I 2026-07-02 16:33:04,873] Trial 55 finished with value: 9.816755227438476 and parameters: {'aci_target': 0.17981683295051523, 'aci_step_size': 0.00924478820592445, 'interval_scale': 0.7603871700630812, 'interval_power': 0.20335898243888786, 'min_width_factor': 0.684097181877926}. Best is trial 40 with value: 8.274345655205309.\n",
      "[I 2026-07-02 16:33:05,111] Trial 56 finished with value: 11.26865126197696 and parameters: {'aci_target': 0.18899686458726508, 'aci_step_size': 0.014470486300518922, 'interval_scale': 1.1231686783812664, 'interval_power': 0.06152429228999554, 'min_width_factor': 0.5443288673686371}. Best is trial 40 with value: 8.274345655205309.\n",
      "[I 2026-07-02 16:33:05,351] Trial 57 finished with value: 8.105297458915794 and parameters: {'aci_target': 0.17251547805133982, 'aci_step_size': 0.03032689931842238, 'interval_scale': 0.8388033354524493, 'interval_power': 0.004827361210892833, 'min_width_factor': 0.6312667954205485}. Best is trial 57 with value: 8.105297458915794.\n",
      "[I 2026-07-02 16:33:05,589] Trial 58 finished with value: 10.304428670467418 and parameters: {'aci_target': 0.17219850716517826, 'aci_step_size': 0.03180631028455304, 'interval_scale': 0.8255976614200077, 'interval_power': 0.1507203081169048, 'min_width_factor': 0.6395975681320996}. Best is trial 57 with value: 8.105297458915794.\n",
      "[I 2026-07-02 16:33:05,829] Trial 59 finished with value: 40.29130884213592 and parameters: {'aci_target': 0.1820941463025898, 'aci_step_size': 0.027722001105675558, 'interval_scale': 0.8437133877043301, 'interval_power': 0.893226598375094, 'min_width_factor': 0.5600920668734712}. Best is trial 57 with value: 8.105297458915794.\n",
      "[I 2026-07-02 16:33:06,074] Trial 60 finished with value: 10.58047864932221 and parameters: {'aci_target': 0.17529778146482677, 'aci_step_size': 0.0384605322071469, 'interval_scale': 1.0857841689303505, 'interval_power': 0.007693130386953359, 'min_width_factor': 0.7179587033356847}. Best is trial 57 with value: 8.105297458915794.\n",
      "[I 2026-07-02 16:33:06,316] Trial 61 finished with value: 9.242322692085928 and parameters: {'aci_target': 0.1995877199444434, 'aci_step_size': 0.010806230025606848, 'interval_scale': 0.9589866442842581, 'interval_power': 0.0467689320255663, 'min_width_factor': 0.443934491064199}. Best is trial 57 with value: 8.105297458915794.\n",
      "[I 2026-07-02 16:33:06,559] Trial 62 finished with value: 13.01028904641888 and parameters: {'aci_target': 0.1995662019576825, 'aci_step_size': 0.010580930619991399, 'interval_scale': 1.2285001976733565, 'interval_power': 0.10247547230834511, 'min_width_factor': 0.4292747568119449}. Best is trial 57 with value: 8.105297458915794.\n",
      "[I 2026-07-02 16:33:06,809] Trial 63 finished with value: 8.41861575829716 and parameters: {'aci_target': 0.19476279841935867, 'aci_step_size': 0.0072077285492341495, 'interval_scale': 0.938521521762553, 'interval_power': 0.00396764881727428, 'min_width_factor': 0.5243801597447233}. Best is trial 57 with value: 8.105297458915794.\n",
      "[I 2026-07-02 16:33:07,048] Trial 64 finished with value: 6.722420918001139 and parameters: {'aci_target': 0.1947250728484746, 'aci_step_size': 0.007465923667743886, 'interval_scale': 0.7517078624419573, 'interval_power': 0.0015594598255395387, 'min_width_factor': 0.6330275185164517}. Best is trial 64 with value: 6.722420918001139.\n",
      "[I 2026-07-02 16:33:07,285] Trial 65 finished with value: 6.840019436828809 and parameters: {'aci_target': 0.196239218130475, 'aci_step_size': 0.007322341550099723, 'interval_scale': 0.7658708696847071, 'interval_power': 0.0031433518470791928, 'min_width_factor': 0.6416614296932576}. Best is trial 64 with value: 6.722420918001139.\n",
      "[I 2026-07-02 16:33:07,520] Trial 66 finished with value: 7.13531026238423 and parameters: {'aci_target': 0.18323431816476612, 'aci_step_size': 0.007391182276479333, 'interval_scale': 0.785908470865077, 'interval_power': 0.0031826559317053174, 'min_width_factor': 0.6094854774403877}. Best is trial 64 with value: 6.722420918001139.\n",
      "[I 2026-07-02 16:33:07,764] Trial 67 finished with value: 6.947882284527187 and parameters: {'aci_target': 0.18214982988370979, 'aci_step_size': 0.006633942870305921, 'interval_scale': 0.7528998885461744, 'interval_power': 0.012815728858891226, 'min_width_factor': 0.8084570277511698}. Best is trial 64 with value: 6.722420918001139.\n",
      "[I 2026-07-02 16:33:08,001] Trial 68 finished with value: 6.911608666650975 and parameters: {'aci_target': 0.18328485228410102, 'aci_step_size': 0.007224098116862708, 'interval_scale': 0.7608500457495252, 'interval_power': 0.0037266178615834016, 'min_width_factor': 0.8037983094996584}. Best is trial 64 with value: 6.722420918001139.\n",
      "[I 2026-07-02 16:33:08,237] Trial 69 finished with value: 7.223489791707357 and parameters: {'aci_target': 0.1694419025634403, 'aci_step_size': 0.005612138418391576, 'interval_scale': 0.751116501043504, 'interval_power': 0.028531761907595904, 'min_width_factor': 0.8054977744649077}. Best is trial 64 with value: 6.722420918001139.\n",
      "[I 2026-07-02 16:33:08,476] Trial 70 finished with value: 77.36256930331446 and parameters: {'aci_target': 0.16927410723340441, 'aci_step_size': 0.0050844382457430806, 'interval_scale': 0.7887159632162822, 'interval_power': 1.2428774083767713, 'min_width_factor': 0.8024652694655898}. Best is trial 64 with value: 6.722420918001139.\n",
      "[I 2026-07-02 16:33:08,722] Trial 71 finished with value: 6.807122847911786 and parameters: {'aci_target': 0.1820692493948003, 'aci_step_size': 0.006141139998265633, 'interval_scale': 0.7538987217622928, 'interval_power': 0.00021329828782751768, 'min_width_factor': 0.9184173776467912}. Best is trial 64 with value: 6.722420918001139.\n",
      "[I 2026-07-02 16:33:08,963] Trial 72 finished with value: 7.370950022073551 and parameters: {'aci_target': 0.18148567886670833, 'aci_step_size': 0.005962953605205618, 'interval_scale': 0.7654593873147099, 'interval_power': 0.03834235224585009, 'min_width_factor': 0.8746837872242442}. Best is trial 64 with value: 6.722420918001139.\n",
      "[I 2026-07-02 16:33:09,205] Trial 73 finished with value: 7.293234927225481 and parameters: {'aci_target': 0.18302640221084776, 'aci_step_size': 0.006178449939508768, 'interval_scale': 0.7579649611392697, 'interval_power': 0.03890110055296369, 'min_width_factor': 0.8425181072007469}. Best is trial 64 with value: 6.722420918001139.\n",
      "[I 2026-07-02 16:33:09,450] Trial 74 finished with value: 8.93425811350478 and parameters: {'aci_target': 0.1833638677823588, 'aci_step_size': 0.00765493463055405, 'interval_scale': 0.7559553655136788, 'interval_power': 0.15758050856101533, 'min_width_factor': 0.9318433097798093}. Best is trial 64 with value: 6.722420918001139.\n",
      "[I 2026-07-02 16:33:09,689] Trial 75 finished with value: 8.136110523058582 and parameters: {'aci_target': 0.15537446072943212, 'aci_step_size': 0.006173610402842351, 'interval_scale': 0.8109499975436124, 'interval_power': 0.03627253554647717, 'min_width_factor': 0.8245673247845359}. Best is trial 64 with value: 6.722420918001139.\n",
      "[I 2026-07-02 16:33:09,935] Trial 76 finished with value: 7.3344287331567175 and parameters: {'aci_target': 0.17679148176206966, 'aci_step_size': 0.00940152034880841, 'interval_scale': 0.7511812207229507, 'interval_power': 0.038705581892915605, 'min_width_factor': 0.7039495374502205}. Best is trial 64 with value: 6.722420918001139.\n",
      "[I 2026-07-02 16:33:10,203] Trial 77 finished with value: 10.837296822301354 and parameters: {'aci_target': 0.16670385600643617, 'aci_step_size': 0.007907364549171427, 'interval_scale': 0.8030529700334917, 'interval_power': 0.22377368118468516, 'min_width_factor': 0.7733682957836896}. Best is trial 64 with value: 6.722420918001139.\n",
      "[I 2026-07-02 16:33:10,445] Trial 78 finished with value: 10.473133360354316 and parameters: {'aci_target': 0.18405004373256822, 'aci_step_size': 0.006905585016451075, 'interval_scale': 1.0121540184782025, 'interval_power': 0.08183906404971342, 'min_width_factor': 1.0236475097985087}. Best is trial 64 with value: 6.722420918001139.\n",
      "[I 2026-07-02 16:33:10,682] Trial 79 finished with value: 9.667694553754355 and parameters: {'aci_target': 0.176132215473538, 'aci_step_size': 0.005566714666295849, 'interval_scale': 0.8145125475086242, 'interval_power': 0.15659881138762133, 'min_width_factor': 0.9173598000473216}. Best is trial 64 with value: 6.722420918001139.\n",
      "[I 2026-07-02 16:33:10,920] Trial 80 finished with value: 43.38909159232996 and parameters: {'aci_target': 0.19517705260576754, 'aci_step_size': 0.008815235781854702, 'interval_scale': 4.837652313132442, 'interval_power': 0.001183038096125956, 'min_width_factor': 0.8903940886489287}. Best is trial 64 with value: 6.722420918001139.\n",
      "[I 2026-07-02 16:33:11,156] Trial 81 finished with value: 7.457382605081684 and parameters: {'aci_target': 0.17807466781703826, 'aci_step_size': 0.006464242315160314, 'interval_scale': 0.7508263626802808, 'interval_power': 0.05337866799054946, 'min_width_factor': 0.7059698744963124}. Best is trial 64 with value: 6.722420918001139.\n",
      "[I 2026-07-02 16:33:11,397] Trial 82 finished with value: 7.797809879006048 and parameters: {'aci_target': 0.1701659950288566, 'aci_step_size': 0.008241215395873342, 'interval_scale': 0.8069214330799186, 'interval_power': 0.0332647988940717, 'min_width_factor': 0.6564977604956862}. Best is trial 64 with value: 6.722420918001139.\n",
      "[I 2026-07-02 16:33:11,631] Trial 83 finished with value: 9.214826841565543 and parameters: {'aci_target': 0.19560932232849662, 'aci_step_size': 0.005709378321415127, 'interval_scale': 0.8297324711785758, 'interval_power': 0.13367709807924705, 'min_width_factor': 0.8311833439269534}. Best is trial 64 with value: 6.722420918001139.\n",
      "[I 2026-07-02 16:33:11,873] Trial 84 finished with value: 7.960904084452525 and parameters: {'aci_target': 0.18387166986943315, 'aci_step_size': 0.00954707421343064, 'interval_scale': 0.7544900577832153, 'interval_power': 0.09053209071490216, 'min_width_factor': 0.6851842907091453}. Best is trial 64 with value: 6.722420918001139.\n",
      "[I 2026-07-02 16:33:12,111] Trial 85 finished with value: 9.9749520804268 and parameters: {'aci_target': 0.1769310602733853, 'aci_step_size': 0.006411765998785404, 'interval_scale': 1.0441140062368466, 'interval_power': 0.02947325383658245, 'min_width_factor': 0.7427322555511928}. Best is trial 64 with value: 6.722420918001139.\n",
      "[I 2026-07-02 16:33:12,348] Trial 86 finished with value: 9.344482901897646 and parameters: {'aci_target': 0.15796647395476668, 'aci_step_size': 0.009803275155000226, 'interval_scale': 0.9302265173098085, 'interval_power': 0.03194119710263674, 'min_width_factor': 0.7982670332914645}. Best is trial 64 with value: 6.722420918001139.\n",
      "[I 2026-07-02 16:33:12,587] Trial 87 finished with value: 9.199074167230947 and parameters: {'aci_target': 0.1660477577265648, 'aci_step_size': 0.0067602387789448505, 'interval_scale': 0.851470129627794, 'interval_power': 0.09676870459785436, 'min_width_factor': 0.6115557295599648}. Best is trial 64 with value: 6.722420918001139.\n",
      "[I 2026-07-02 16:33:12,828] Trial 88 finished with value: 8.635698095470131 and parameters: {'aci_target': 0.14986578241664078, 'aci_step_size': 0.008476175616455871, 'interval_scale': 0.7893502391700857, 'interval_power': 0.06730224838064487, 'min_width_factor': 0.7729812814571625}. Best is trial 64 with value: 6.722420918001139.\n",
      "[I 2026-07-02 16:33:13,068] Trial 89 finished with value: 9.884372289227992 and parameters: {'aci_target': 0.17263775493237543, 'aci_step_size': 0.005581195328754537, 'interval_scale': 0.8707531377381266, 'interval_power': 0.1282553335225709, 'min_width_factor': 1.019955770506704}. Best is trial 64 with value: 6.722420918001139.\n",
      "[I 2026-07-02 16:33:13,308] Trial 90 finished with value: 9.640082447079644 and parameters: {'aci_target': 0.1859973241929575, 'aci_step_size': 0.007376054518483717, 'interval_scale': 0.7990953231182383, 'interval_power': 0.17236720134543443, 'min_width_factor': 0.8517846269083033}. Best is trial 64 with value: 6.722420918001139.\n",
      "[I 2026-07-02 16:33:13,546] Trial 91 finished with value: 7.367761192920913 and parameters: {'aci_target': 0.18217610011905652, 'aci_step_size': 0.0061616199713601565, 'interval_scale': 0.7647930670019834, 'interval_power': 0.038945302266805495, 'min_width_factor': 0.9092255811035926}. Best is trial 64 with value: 6.722420918001139.\n",
      "[I 2026-07-02 16:33:13,792] Trial 92 finished with value: 7.248104421401809 and parameters: {'aci_target': 0.18012246756784842, 'aci_step_size': 0.007741545967826619, 'interval_scale': 0.7533965196748105, 'interval_power': 0.03474157785744742, 'min_width_factor': 0.9040497316256111}. Best is trial 64 with value: 6.722420918001139.\n",
      "[I 2026-07-02 16:33:14,033] Trial 93 finished with value: 9.561038103647324 and parameters: {'aci_target': 0.17821510713422936, 'aci_step_size': 0.007875345448866847, 'interval_scale': 0.9262085251962106, 'interval_power': 0.07457426791293928, 'min_width_factor': 0.7271490229573895}. Best is trial 64 with value: 6.722420918001139.\n",
      "[I 2026-07-02 16:33:14,276] Trial 94 finished with value: 8.108662770041619 and parameters: {'aci_target': 0.19504818837147467, 'aci_step_size': 0.008691272404956847, 'interval_scale': 0.8621784645436127, 'interval_power': 0.02960048157335743, 'min_width_factor': 0.9576115990970555}. Best is trial 64 with value: 6.722420918001139.\n",
      "[I 2026-07-02 16:33:14,515] Trial 95 finished with value: 8.785150475019002 and parameters: {'aci_target': 0.1926233410299682, 'aci_step_size': 0.0052344867679429, 'interval_scale': 0.9844208377488615, 'interval_power': 0.0022594161777701113, 'min_width_factor': 0.6655519786283619}. Best is trial 64 with value: 6.722420918001139.\n",
