      "[I 2026-07-02 16:31:21,437] Trial 121 finished with value: 10.369016845101203 and parameters: {'target_miscoverage': 0.14701877337842645, 'aci_step_size': 0.03156613584303523, 'interval_scale': 0.5278493803733114}. Best is trial 112 with value: 9.825177002860368.\n",
      "[I 2026-07-02 16:31:21,493] Trial 122 finished with value: 9.868199353468343 and parameters: {'target_miscoverage': 0.10473742963626749, 'aci_step_size': 0.048608348516291415, 'interval_scale': 0.502354561858918}. Best is trial 112 with value: 9.825177002860368.\n",
      "[I 2026-07-02 16:31:21,546] Trial 123 finished with value: 11.004189257642185 and parameters: {'target_miscoverage': 0.10398290189201984, 'aci_step_size': 0.04710056529827815, 'interval_scale': 0.560183725027053}. Best is trial 112 with value: 9.825177002860368.\n",
      "[I 2026-07-02 16:31:21,603] Trial 124 finished with value: 12.268815385720215 and parameters: {'target_miscoverage': 0.09626686673379373, 'aci_step_size': 0.04501994115266317, 'interval_scale': 0.6215574778733521}. Best is trial 112 with value: 9.825177002860368.\n",
      "[I 2026-07-02 16:31:21,661] Trial 125 finished with value: 10.404563481599018 and parameters: {'target_miscoverage': 0.10034651859285161, 'aci_step_size': 0.06685135634623586, 'interval_scale': 0.5296589318794968}. Best is trial 112 with value: 9.825177002860368.\n",
      "[I 2026-07-02 16:31:21,716] Trial 126 finished with value: 9.894542456070036 and parameters: {'target_miscoverage': 0.10984054111272086, 'aci_step_size': 0.03488423154201569, 'interval_scale': 0.5036580177859803}. Best is trial 112 with value: 9.825177002860368.\n",
      "[I 2026-07-02 16:31:21,770] Trial 127 finished with value: 118.31243936550949 and parameters: {'target_miscoverage': 0.10540457006514359, 'aci_step_size': 0.056389645639674996, 'interval_scale': 6.022861062188722}. Best is trial 112 with value: 9.825177002860368.\n",
      "[I 2026-07-02 16:31:21,825] Trial 128 finished with value: 11.683137094382587 and parameters: {'target_miscoverage': 0.09898537101053317, 'aci_step_size': 0.05027017917319985, 'interval_scale': 0.5947465191938436}. Best is trial 112 with value: 9.825177002860368.\n",
      "[I 2026-07-02 16:31:21,878] Trial 129 finished with value: 13.148934359598224 and parameters: {'target_miscoverage': 0.0819293788164745, 'aci_step_size': 0.04231608756585763, 'interval_scale': 0.6559852509226348}. Best is trial 112 with value: 9.825177002860368.\n",
      "[I 2026-07-02 16:31:21,932] Trial 130 finished with value: 11.044558840588412 and parameters: {'target_miscoverage': 0.11561965285788889, 'aci_step_size': 0.029633453847329842, 'interval_scale': 0.562218350096577}. Best is trial 112 with value: 9.825177002860368.\n",
      "[I 2026-07-02 16:31:21,987] Trial 131 finished with value: 10.014284288029275 and parameters: {'target_miscoverage': 0.14095141534055317, 'aci_step_size': 0.07691963317676766, 'interval_scale': 0.5097912208409527}. Best is trial 112 with value: 9.825177002860368.\n",
      "[I 2026-07-02 16:31:22,040] Trial 132 finished with value: 9.855210123455501 and parameters: {'target_miscoverage': 0.0929802373569648, 'aci_step_size': 0.08542794251718437, 'interval_scale': 0.5016933268434658}. Best is trial 112 with value: 9.825177002860368.\n",
      "[I 2026-07-02 16:31:22,097] Trial 133 finished with value: 9.842440575487071 and parameters: {'target_miscoverage': 0.09192519768582641, 'aci_step_size': 0.06582363998350993, 'interval_scale': 0.5010432750513354}. Best is trial 112 with value: 9.825177002860368.\n",
      "[I 2026-07-02 16:31:22,155] Trial 134 finished with value: 10.86988219594303 and parameters: {'target_miscoverage': 0.093927575861826, 'aci_step_size': 0.06454848689039766, 'interval_scale': 0.5533466352280182}. Best is trial 112 with value: 9.825177002860368.\n",
      "[I 2026-07-02 16:31:22,211] Trial 135 finished with value: 10.520652923797808 and parameters: {'target_miscoverage': 0.09194423076248012, 'aci_step_size': 0.08778454294605635, 'interval_scale': 0.535568628145587}. Best is trial 112 with value: 9.825177002860368.\n",
      "[I 2026-07-02 16:31:22,265] Trial 136 finished with value: 11.847161644364133 and parameters: {'target_miscoverage': 0.08942843726596711, 'aci_step_size': 0.07146869548041225, 'interval_scale': 0.6030964195139186}. Best is trial 112 with value: 9.825177002860368.\n",
      "[I 2026-07-02 16:31:22,320] Trial 137 finished with value: 11.017828112638124 and parameters: {'target_miscoverage': 0.09759611440465171, 'aci_step_size': 0.05646995161526492, 'interval_scale': 0.5608780301155831}. Best is trial 112 with value: 9.825177002860368.\n",
      "[I 2026-07-02 16:31:22,377] Trial 138 finished with value: 10.895160983518908 and parameters: {'target_miscoverage': 0.08485603498394687, 'aci_step_size': 0.006613228906173272, 'interval_scale': 0.5383318090018787}. Best is trial 112 with value: 9.825177002860368.\n",
      "[I 2026-07-02 16:31:22,432] Trial 139 finished with value: 10.00330695674273 and parameters: {'target_miscoverage': 0.07808420832045601, 'aci_step_size': 0.06218958699745606, 'interval_scale': 0.5018068238856187}. Best is trial 112 with value: 9.825177002860368.\n",
      "[I 2026-07-02 16:31:22,489] Trial 140 finished with value: 11.690475037146854 and parameters: {'target_miscoverage': 0.12643638565445847, 'aci_step_size': 0.09569598166430306, 'interval_scale': 0.595120067494249}. Best is trial 112 with value: 9.825177002860368.\n",
      "[I 2026-07-02 16:31:22,542] Trial 141 finished with value: 9.85242870108491 and parameters: {'target_miscoverage': 0.10336565140199767, 'aci_step_size': 0.05240562692590124, 'interval_scale': 0.5015517346272689}. Best is trial 112 with value: 9.825177002860368.\n",
      "[I 2026-07-02 16:31:22,599] Trial 142 finished with value: 10.406490118160432 and parameters: {'target_miscoverage': 0.10267991758735155, 'aci_step_size': 0.05335476813208488, 'interval_scale': 0.5297570100223264}. Best is trial 112 with value: 9.825177002860368.\n",
      "[I 2026-07-02 16:31:22,657] Trial 143 finished with value: 10.31995921579736 and parameters: {'target_miscoverage': 0.11083477793158737, 'aci_step_size': 0.06593358974370726, 'interval_scale': 0.525352032783135}. Best is trial 112 with value: 9.825177002860368.\n",
      "[I 2026-07-02 16:31:22,712] Trial 144 finished with value: 9.83828648865149 and parameters: {'target_miscoverage': 0.09741494409668183, 'aci_step_size': 0.05860305606546839, 'interval_scale': 0.5008318054207103}. Best is trial 112 with value: 9.825177002860368.\n",
      "[I 2026-07-02 16:31:22,768] Trial 145 finished with value: 11.2413888818551 and parameters: {'target_miscoverage': 0.11956344949612938, 'aci_step_size': 0.05877689521291801, 'interval_scale': 0.5722587053782283}. Best is trial 112 with value: 9.825177002860368.\n",
      "[I 2026-07-02 16:31:22,823] Trial 146 finished with value: 9.828754609686666 and parameters: {'target_miscoverage': 0.09860385549692509, 'aci_step_size': 0.051732022046109875, 'interval_scale': 0.5003465717210703}. Best is trial 112 with value: 9.825177002860368.\n",
      "[I 2026-07-02 16:31:22,880] Trial 147 finished with value: 10.685475045958922 and parameters: {'target_miscoverage': 0.1138526168991863, 'aci_step_size': 0.039300160512142523, 'interval_scale': 0.5439591299987738}. Best is trial 112 with value: 9.825177002860368.\n",
      "[I 2026-07-02 16:31:22,934] Trial 148 finished with value: 11.494338919785616 and parameters: {'target_miscoverage': 0.09727363828509988, 'aci_step_size': 0.050000638926779084, 'interval_scale': 0.5851354826833085}. Best is trial 112 with value: 9.825177002860368.\n",
      "[I 2026-07-02 16:31:22,989] Trial 149 finished with value: 12.134176864782006 and parameters: {'target_miscoverage': 0.15142401293458665, 'aci_step_size': 0.04465561389577647, 'interval_scale': 0.6177073328260722}. Best is trial 112 with value: 9.825177002860368.\n",
      "[I 2026-07-02 16:31:23,043] Trial 150 finished with value: 11.02153258903718 and parameters: {'target_miscoverage': 0.10218584204283325, 'aci_step_size': 0.06966153372767976, 'interval_scale': 0.5610666116948281}. Best is trial 112 with value: 9.825177002860368.\n",
      "[I 2026-07-02 16:31:23,098] Trial 151 finished with value: 9.920485227965576 and parameters: {'target_miscoverage': 0.08786405614516628, 'aci_step_size': 0.05277752654209435, 'interval_scale': 0.5007252636436372}. Best is trial 112 with value: 9.825177002860368.\n",
      "[I 2026-07-02 16:31:23,154] Trial 152 finished with value: 10.461995832964599 and parameters: {'target_miscoverage': 0.10778504222334247, 'aci_step_size': 0.05813175593764382, 'interval_scale': 0.5325826064703069}. Best is trial 112 with value: 9.825177002860368.\n",
      "[I 2026-07-02 16:31:23,210] Trial 153 finished with value: 10.279913668582884 and parameters: {'target_miscoverage': 0.14625167753344498, 'aci_step_size': 0.061265861286249286, 'interval_scale': 0.5233134579033283}. Best is trial 112 with value: 9.825177002860368.\n",
      "[I 2026-07-02 16:31:23,265] Trial 154 finished with value: 9.857958548745414 and parameters: {'target_miscoverage': 0.09882499770737813, 'aci_step_size': 0.04653200368197335, 'interval_scale': 0.5013353801113585}. Best is trial 112 with value: 9.825177002860368.\n",
      "[I 2026-07-02 16:31:23,322] Trial 155 finished with value: 10.850791941772952 and parameters: {'target_miscoverage': 0.10528964179091106, 'aci_step_size': 0.05562543294346354, 'interval_scale': 0.5523748190003696}. Best is trial 112 with value: 9.825177002860368.\n",
      "[I 2026-07-02 16:31:23,378] Trial 156 finished with value: 10.394339264785945 and parameters: {'target_miscoverage': 0.09455881152423554, 'aci_step_size': 0.050133444699407566, 'interval_scale': 0.5276169877316691}. Best is trial 112 with value: 9.825177002860368.\n",
      "[I 2026-07-02 16:31:23,434] Trial 157 finished with value: 11.050120241912154 and parameters: {'target_miscoverage': 0.10051320289474219, 'aci_step_size': 0.0633201718522788, 'interval_scale': 0.5625219063560093}. Best is trial 112 with value: 9.825177002860368.\n",
      "[I 2026-07-02 16:31:23,488] Trial 158 finished with value: 11.791072656572435 and parameters: {'target_miscoverage': 0.09015981699875716, 'aci_step_size': 0.04232559009001238, 'interval_scale': 0.5925453230471324}. Best is trial 112 with value: 9.825177002860368.\n",
      "[I 2026-07-02 16:31:23,542] Trial 159 finished with value: 9.855490753694975 and parameters: {'target_miscoverage': 0.14259809427875197, 'aci_step_size': 0.073613518729953, 'interval_scale': 0.5017076127259107}. Best is trial 112 with value: 9.825177002860368.\n",
      "[I 2026-07-02 16:31:23,597] Trial 160 finished with value: 12.752036199676063 and parameters: {'target_miscoverage': 0.10987655817406441, 'aci_step_size': 0.05253753612850583, 'interval_scale': 0.6491603309215507}. Best is trial 112 with value: 9.825177002860368.\n",
      "[I 2026-07-02 16:31:23,652] Trial 161 finished with value: 10.693016923990728 and parameters: {'target_miscoverage': 0.09368842477745863, 'aci_step_size': 0.07941981176364063, 'interval_scale': 0.5443430599031626}. Best is trial 112 with value: 9.825177002860368.\n",
      "[I 2026-07-02 16:31:23,708] Trial 162 finished with value: 10.022350568061256 and parameters: {'target_miscoverage': 0.08085764162385914, 'aci_step_size': 0.058604514646284134, 'interval_scale': 0.5035038338681141}. Best is trial 112 with value: 9.825177002860368.\n",
      "[I 2026-07-02 16:31:23,761] Trial 163 finished with value: 10.410214248813656 and parameters: {'target_miscoverage': 0.09725456601439096, 'aci_step_size': 0.06706319258753737, 'interval_scale': 0.5299465921290105}. Best is trial 112 with value: 9.825177002860368.\n",
      "[I 2026-07-02 16:31:23,814] Trial 164 finished with value: 10.082853179769566 and parameters: {'target_miscoverage': 0.0860547009473297, 'aci_step_size': 0.0366015084910984, 'interval_scale': 0.5032604537511668}. Best is trial 112 with value: 9.825177002860368.\n",
      "[I 2026-07-02 16:31:23,869] Trial 165 finished with value: 11.271032623846292 and parameters: {'target_miscoverage': 0.09233707382816583, 'aci_step_size': 0.08611020457829326, 'interval_scale': 0.5737677617406324}. Best is trial 112 with value: 9.825177002860368.\n",
      "[I 2026-07-02 16:31:23,922] Trial 166 finished with value: 10.348210604970244 and parameters: {'target_miscoverage': 0.10294074944084598, 'aci_step_size': 0.11516204204502155, 'interval_scale': 0.5267902094682906}. Best is trial 112 with value: 9.825177002860368.\n",
      "[I 2026-07-02 16:31:23,976] Trial 167 finished with value: 9.823734728783883 and parameters: {'target_miscoverage': 0.13892342376377637, 'aci_step_size': 0.07562469723274942, 'interval_scale': 0.5000910276308896}. Best is trial 167 with value: 9.823734728783883.\n",
      "[I 2026-07-02 16:31:24,032] Trial 168 finished with value: 10.879983762260464 and parameters: {'target_miscoverage': 0.13324493635793816, 'aci_step_size': 0.07503417544342962, 'interval_scale': 0.5538608696650438}. Best is trial 167 with value: 9.823734728783883.\n",
      "[I 2026-07-02 16:31:24,086] Trial 169 finished with value: 11.793628453186212 and parameters: {'target_miscoverage': 0.13875301458510458, 'aci_step_size': 0.04776979164268378, 'interval_scale': 0.6003712371543246}. Best is trial 167 with value: 9.823734728783883.\n",
      "[I 2026-07-02 16:31:24,140] Trial 170 finished with value: 10.40469487477465 and parameters: {'target_miscoverage': 0.1481323791680261, 'aci_step_size': 0.061381556862012555, 'interval_scale': 0.5296656206362297}. Best is trial 167 with value: 9.823734728783883.\n",
      "[I 2026-07-02 16:31:24,195] Trial 171 finished with value: 9.917961021841492 and parameters: {'target_miscoverage': 0.13046447935451133, 'aci_step_size': 0.09334842548752735, 'interval_scale': 0.5048877495542893}. Best is trial 167 with value: 9.823734728783883.\n",
      "[I 2026-07-02 16:31:24,248] Trial 172 finished with value: 9.828440288505517 and parameters: {'target_miscoverage': 0.12482752616680409, 'aci_step_size': 0.08173129488950302, 'interval_scale': 0.5003305707599045}. Best is trial 167 with value: 9.823734728783883.\n",
      "[I 2026-07-02 16:31:24,303] Trial 173 finished with value: 10.89629573315193 and parameters: {'target_miscoverage': 0.12450707097322851, 'aci_step_size': 0.07017774348872036, 'interval_scale': 0.5546912534746936}. Best is trial 167 with value: 9.823734728783883.\n",
      "[I 2026-07-02 16:31:24,358] Trial 174 finished with value: 10.384333851493176 and parameters: {'target_miscoverage': 0.13665108681599106, 'aci_step_size': 0.10089781895105339, 'interval_scale': 0.5286291141254766}. Best is trial 167 with value: 9.823734728783883.\n",
      "[I 2026-07-02 16:31:24,415] Trial 175 finished with value: 11.311796576340765 and parameters: {'target_miscoverage': 0.14463070236869013, 'aci_step_size': 0.07876006052479807, 'interval_scale': 0.5758429080603433}. Best is trial 167 with value: 9.823734728783883.\n",
      "[I 2026-07-02 16:31:24,469] Trial 176 finished with value: 10.477697047585364 and parameters: {'target_miscoverage': 0.1566822522988419, 'aci_step_size': 0.05515263707288194, 'interval_scale': 0.5333818988778932}. Best is trial 167 with value: 9.823734728783883.\n",
      "[I 2026-07-02 16:31:24,523] Trial 177 finished with value: 9.905909980658 and parameters: {'target_miscoverage': 0.11742164556700316, 'aci_step_size': 0.06539998059378233, 'interval_scale': 0.5042742743536458}. Best is trial 167 with value: 9.823734728783883.\n",
      "[I 2026-07-02 16:31:24,578] Trial 178 finished with value: 10.906252150828319 and parameters: {'target_miscoverage': 0.10839542998321004, 'aci_step_size': 0.043298269298055456, 'interval_scale': 0.5551980989142289}. Best is trial 167 with value: 9.823734728783883.\n",
      "[I 2026-07-02 16:31:24,632] Trial 179 finished with value: 9.83872234509394 and parameters: {'target_miscoverage': 0.1407118211515509, 'aci_step_size': 0.05175762925508259, 'interval_scale': 0.5008539933056938}. Best is trial 167 with value: 9.823734728783883.\n",
      "[I 2026-07-02 16:31:24,689] Trial 180 finished with value: 12.18131061781166 and parameters: {'target_miscoverage': 0.12855560853680092, 'aci_step_size': 0.0505971445635978, 'interval_scale': 0.6201067427896509}. Best is trial 167 with value: 9.823734728783883.\n",
      "[I 2026-07-02 16:31:24,745] Trial 181 finished with value: 10.343540955890884 and parameters: {'target_miscoverage': 0.14056415259562458, 'aci_step_size': 0.0543282327821702, 'interval_scale': 0.5265524944164336}. Best is trial 167 with value: 9.823734728783883.\n",
      "[I 2026-07-02 16:31:24,800] Trial 182 finished with value: 9.878853624769375 and parameters: {'target_miscoverage': 0.15190854542096935, 'aci_step_size': 0.05827760191136472, 'interval_scale': 0.5028969325207593}. Best is trial 167 with value: 9.823734728783883.\n",
      "[I 2026-07-02 16:31:24,855] Trial 183 finished with value: 9.850776433514914 and parameters: {'target_miscoverage': 0.1316543568669142, 'aci_step_size': 0.046088773185445665, 'interval_scale': 0.5014676236236856}. Best is trial 167 with value: 9.823734728783883.\n",
      "[I 2026-07-02 16:31:24,909] Trial 184 finished with value: 10.802915151634176 and parameters: {'target_miscoverage': 0.13415434608671606, 'aci_step_size': 0.040235102770493754, 'interval_scale': 0.5499375836880412}. Best is trial 167 with value: 9.823734728783883.\n",
      "[I 2026-07-02 16:31:24,962] Trial 185 finished with value: 11.321406248694084 and parameters: {'target_miscoverage': 0.1257508754020559, 'aci_step_size': 0.04670262330485639, 'interval_scale': 0.5763321019341426}. Best is trial 167 with value: 9.823734728783883.\n",
      "[I 2026-07-02 16:31:25,017] Trial 186 finished with value: 9.82431315454105 and parameters: {'target_miscoverage': 0.13782749904210462, 'aci_step_size': 0.03349911990225743, 'interval_scale': 0.5001204732026111}. Best is trial 167 with value: 9.823734728783883.\n",
      "[I 2026-07-02 16:31:25,071] Trial 187 finished with value: 10.497858161143231 and parameters: {'target_miscoverage': 0.13173692999047126, 'aci_step_size': 0.025429444699426124, 'interval_scale': 0.5344082287053379}. Best is trial 167 with value: 9.823734728783883.\n",
      "[I 2026-07-02 16:31:25,128] Trial 188 finished with value: 10.41565769971481 and parameters: {'target_miscoverage': 0.13765766083484046, 'aci_step_size': 0.03332024435130767, 'interval_scale': 0.5302236986501204}. Best is trial 167 with value: 9.823734728783883.\n",
      "[I 2026-07-02 16:31:25,183] Trial 189 finished with value: 9.84035187447208 and parameters: {'target_miscoverage': 0.14108112613871227, 'aci_step_size': 0.028519891269890157, 'interval_scale': 0.5009369467896485}. Best is trial 167 with value: 9.823734728783883.\n",
      "[I 2026-07-02 16:31:25,239] Trial 190 finished with value: 11.222306763988016 and parameters: {'target_miscoverage': 0.14360715185081047, 'aci_step_size': 0.02948583350208695, 'interval_scale': 0.5712873033405197}. Best is trial 167 with value: 9.823734728783883.\n",
      "[I 2026-07-02 16:31:25,298] Trial 191 finished with value: 10.265941516850182 and parameters: {'target_miscoverage': 0.14039920946434958, 'aci_step_size': 0.034946719589069586, 'interval_scale': 0.5226021858743669}. Best is trial 167 with value: 9.823734728783883.\n",
      "[I 2026-07-02 16:31:25,355] Trial 192 finished with value: 9.903010244717263 and parameters: {'target_miscoverage': 0.1460385867212972, 'aci_step_size': 0.044113674369983, 'interval_scale': 0.504126659218827}. Best is trial 167 with value: 9.823734728783883.\n",
      "[I 2026-07-02 16:31:25,411] Trial 193 finished with value: 10.757533838141164 and parameters: {'target_miscoverage': 0.13639182144285297, 'aci_step_size': 0.037591782516112116, 'interval_scale': 0.5476273841227731}. Best is trial 167 with value: 9.823734728783883.\n",
      "[I 2026-07-02 16:31:25,465] Trial 194 finished with value: 9.83087188842726 and parameters: {'target_miscoverage': 0.14953396382334475, 'aci_step_size': 0.02086396335378944, 'interval_scale': 0.5004543547720582}. Best is trial 167 with value: 9.823734728783883.\n",
      "[I 2026-07-02 16:31:25,520] Trial 195 finished with value: 47.07477758851728 and parameters: {'target_miscoverage': 0.14922091886626482, 'aci_step_size': 0.0234760247145414, 'interval_scale': 2.3964077359031166}. Best is trial 167 with value: 9.823734728783883.\n",
      "[I 2026-07-02 16:31:25,578] Trial 196 finished with value: 10.38267503195009 and parameters: {'target_miscoverage': 0.16282926823135657, 'aci_step_size': 0.016002006209492818, 'interval_scale': 0.5285446695769932}. Best is trial 167 with value: 9.823734728783883.\n",
      "[I 2026-07-02 16:31:25,634] Trial 197 finished with value: 10.927538917994365 and parameters: {'target_miscoverage': 0.15341697702109247, 'aci_step_size': 0.031052501712258738, 'interval_scale': 0.5562817317240335}. Best is trial 167 with value: 9.823734728783883.\n",
      "[I 2026-07-02 16:31:25,691] Trial 198 finished with value: 9.857299228679468 and parameters: {'target_miscoverage': 0.14239319059305253, 'aci_step_size': 0.015042393280022971, 'interval_scale': 0.5017996756819784}. Best is trial 167 with value: 9.823734728783883.\n",
