      "[I 2026-07-02 16:31:12,205] Trial 273 finished with value: 0.006348687155378514 and parameters: {'reservoir_size': 56, 'spectral_radius': 1.0356779003206689, 'ar_lags': 5, 'foundation_window': 13, 'regressor_type': 'Lasso', 'reg_alpha': 6.053195871337427, 'aci_step_size': 0.16748335810722875, 'oob_split_ratio': 0.7509978572381383}. Best is trial 222 with value: 0.006335398441639262.\n",
      "[I 2026-07-02 16:31:12,310] Trial 274 finished with value: 0.006348687155378514 and parameters: {'reservoir_size': 56, 'spectral_radius': 1.033180869015969, 'ar_lags': 5, 'foundation_window': 13, 'regressor_type': 'Lasso', 'reg_alpha': 6.2039686305446535, 'aci_step_size': 0.16769346926682555, 'oob_split_ratio': 0.7504481787212038}. Best is trial 222 with value: 0.006335398441639262.\n",
      "[I 2026-07-02 16:31:12,413] Trial 275 finished with value: 0.006348687155378514 and parameters: {'reservoir_size': 58, 'spectral_radius': 1.0324803478784061, 'ar_lags': 5, 'foundation_window': 13, 'regressor_type': 'Lasso', 'reg_alpha': 6.866518206278683, 'aci_step_size': 0.1675681178867337, 'oob_split_ratio': 0.7502465416952596}. Best is trial 222 with value: 0.006335398441639262.\n",
      "[I 2026-07-02 16:31:12,519] Trial 276 finished with value: 0.006348687155378514 and parameters: {'reservoir_size': 58, 'spectral_radius': 1.0329776485959048, 'ar_lags': 5, 'foundation_window': 13, 'regressor_type': 'Lasso', 'reg_alpha': 7.149578898143985, 'aci_step_size': 0.16675487215986443, 'oob_split_ratio': 0.7528084954776586}. Best is trial 222 with value: 0.006335398441639262.\n",
      "[I 2026-07-02 16:31:12,629] Trial 277 finished with value: 0.006348687155378514 and parameters: {'reservoir_size': 58, 'spectral_radius': 1.0287948111708125, 'ar_lags': 5, 'foundation_window': 13, 'regressor_type': 'Lasso', 'reg_alpha': 7.4508903156488335, 'aci_step_size': 0.16604729811057894, 'oob_split_ratio': 0.7524138082840439}. Best is trial 222 with value: 0.006335398441639262.\n",
      "[I 2026-07-02 16:31:12,739] Trial 278 finished with value: 0.006348687155378514 and parameters: {'reservoir_size': 58, 'spectral_radius': 1.0309944263715631, 'ar_lags': 5, 'foundation_window': 13, 'regressor_type': 'Lasso', 'reg_alpha': 7.369649983883406, 'aci_step_size': 0.16744233649192475, 'oob_split_ratio': 0.7540906938425193}. Best is trial 222 with value: 0.006335398441639262.\n",
      "[I 2026-07-02 16:31:12,847] Trial 279 finished with value: 0.006348687155378514 and parameters: {'reservoir_size': 59, 'spectral_radius': 1.0308767382434105, 'ar_lags': 5, 'foundation_window': 13, 'regressor_type': 'Lasso', 'reg_alpha': 7.587405482940668, 'aci_step_size': 0.16670472735410302, 'oob_split_ratio': 0.753240812944859}. Best is trial 222 with value: 0.006335398441639262.\n",
      "[I 2026-07-02 16:31:12,955] Trial 280 finished with value: 0.006348687155378514 and parameters: {'reservoir_size': 59, 'spectral_radius': 1.033328962391206, 'ar_lags': 5, 'foundation_window': 13, 'regressor_type': 'Lasso', 'reg_alpha': 7.7079232074576165, 'aci_step_size': 0.1670260542329782, 'oob_split_ratio': 0.7546281885417213}. Best is trial 222 with value: 0.006335398441639262.\n",
      "[I 2026-07-02 16:31:13,063] Trial 281 finished with value: 0.006348687155378514 and parameters: {'reservoir_size': 60, 'spectral_radius': 1.0202650421053614, 'ar_lags': 5, 'foundation_window': 13, 'regressor_type': 'Lasso', 'reg_alpha': 7.7762543369748025, 'aci_step_size': 0.16720407632040057, 'oob_split_ratio': 0.7535828148791786}. Best is trial 222 with value: 0.006335398441639262.\n",
      "[I 2026-07-02 16:31:13,169] Trial 282 finished with value: 0.006342791055112623 and parameters: {'reservoir_size': 60, 'spectral_radius': 1.0333019844241653, 'ar_lags': 5, 'foundation_window': 13, 'regressor_type': 'Lasso', 'reg_alpha': 7.456960697657452, 'aci_step_size': 0.16671934265886404, 'oob_split_ratio': 0.7551796416890257}. Best is trial 222 with value: 0.006335398441639262.\n",
      "[I 2026-07-02 16:31:13,247] Trial 283 finished with value: 0.006348687155378514 and parameters: {'reservoir_size': 60, 'spectral_radius': 1.0320128879826578, 'ar_lags': 5, 'foundation_window': 13, 'regressor_type': 'Lasso', 'reg_alpha': 7.867765657542427, 'aci_step_size': 0.16743746754315642, 'oob_split_ratio': 0.7542509076377606}. Best is trial 222 with value: 0.006335398441639262.\n",
      "[I 2026-07-02 16:31:13,353] Trial 284 finished with value: 0.006348687155378514 and parameters: {'reservoir_size': 61, 'spectral_radius': 1.0269236842616387, 'ar_lags': 5, 'foundation_window': 13, 'regressor_type': 'Lasso', 'reg_alpha': 8.199043842667788, 'aci_step_size': 0.16577389040462231, 'oob_split_ratio': 0.7547182433619}. Best is trial 222 with value: 0.006335398441639262.\n",
      "[I 2026-07-02 16:31:13,462] Trial 285 finished with value: 0.009352533958675581 and parameters: {'reservoir_size': 62, 'spectral_radius': 1.0185552296788771, 'ar_lags': 5, 'foundation_window': 12, 'regressor_type': 'Lasso', 'reg_alpha': 7.9822298918094505, 'aci_step_size': 0.16670864157899082, 'oob_split_ratio': 0.7555716511001542}. Best is trial 222 with value: 0.006335398441639262.\n",
      "[I 2026-07-02 16:31:13,537] Trial 286 finished with value: 0.006345908069572484 and parameters: {'reservoir_size': 59, 'spectral_radius': 0.9970799100675296, 'ar_lags': 5, 'foundation_window': 13, 'regressor_type': 'Lasso', 'reg_alpha': 7.315865721363876, 'aci_step_size': 0.16492152975173544, 'oob_split_ratio': 0.7636491389765878}. Best is trial 222 with value: 0.006335398441639262.\n",
      "[I 2026-07-02 16:31:13,612] Trial 287 finished with value: 0.009352533958675581 and parameters: {'reservoir_size': 58, 'spectral_radius': 0.9961010716137948, 'ar_lags': 5, 'foundation_window': 12, 'regressor_type': 'Lasso', 'reg_alpha': 9.949315848082405, 'aci_step_size': 0.16452835436602678, 'oob_split_ratio': 0.7583944490143908}. Best is trial 222 with value: 0.006335398441639262.\n",
      "[I 2026-07-02 16:31:13,690] Trial 288 finished with value: 0.006342791055112623 and parameters: {'reservoir_size': 61, 'spectral_radius': 1.0127778938050125, 'ar_lags': 5, 'foundation_window': 13, 'regressor_type': 'Lasso', 'reg_alpha': 7.226066879444454, 'aci_step_size': 0.1664477113149549, 'oob_split_ratio': 0.7607015598832352}. Best is trial 222 with value: 0.006335398441639262.\n",
      "[I 2026-07-02 16:31:13,781] Trial 289 finished with value: 0.006343909905847457 and parameters: {'reservoir_size': 61, 'spectral_radius': 1.0119827364548302, 'ar_lags': 4, 'foundation_window': 13, 'regressor_type': 'Lasso', 'reg_alpha': 7.228380541542523, 'aci_step_size': 0.16622996795419046, 'oob_split_ratio': 0.7653990415265218}. Best is trial 222 with value: 0.006335398441639262.\n",
      "[I 2026-07-02 16:31:13,893] Trial 290 finished with value: 0.006349366300430037 and parameters: {'reservoir_size': 61, 'spectral_radius': 1.0185198337702406, 'ar_lags': 4, 'foundation_window': 13, 'regressor_type': 'Lasso', 'reg_alpha': 7.902972604322946, 'aci_step_size': 0.16601829710829427, 'oob_split_ratio': 0.7608109146210265}. Best is trial 222 with value: 0.006335398441639262.\n",
      "[I 2026-07-02 16:31:14,004] Trial 291 finished with value: 0.006343909905847457 and parameters: {'reservoir_size': 64, 'spectral_radius': 1.0013756761551564, 'ar_lags': 4, 'foundation_window': 13, 'regressor_type': 'Lasso', 'reg_alpha': 7.090049137539624, 'aci_step_size': 0.16255512907867062, 'oob_split_ratio': 0.7633965800247245}. Best is trial 222 with value: 0.006335398441639262.\n",
      "[I 2026-07-02 16:31:14,115] Trial 292 finished with value: 0.009365999188056452 and parameters: {'reservoir_size': 65, 'spectral_radius': 1.0015950311930382, 'ar_lags': 4, 'foundation_window': 12, 'regressor_type': 'Lasso', 'reg_alpha': 7.162461978173652, 'aci_step_size': 0.1622829086846714, 'oob_split_ratio': 0.7642632051391286}. Best is trial 222 with value: 0.006335398441639262.\n",
      "[I 2026-07-02 16:31:14,222] Trial 293 finished with value: 0.006343909905847457 and parameters: {'reservoir_size': 59, 'spectral_radius': 1.006868476783725, 'ar_lags': 4, 'foundation_window': 13, 'regressor_type': 'Lasso', 'reg_alpha': 7.323010034819614, 'aci_step_size': 0.16768347887405924, 'oob_split_ratio': 0.7626297288957333}. Best is trial 222 with value: 0.006335398441639262.\n",
      "[I 2026-07-02 16:31:14,332] Trial 294 finished with value: 0.009365999188056452 and parameters: {'reservoir_size': 65, 'spectral_radius': 0.9819711638822531, 'ar_lags': 4, 'foundation_window': 12, 'regressor_type': 'Lasso', 'reg_alpha': 6.826925468850343, 'aci_step_size': 0.16176286082261618, 'oob_split_ratio': 0.765559643769734}. Best is trial 222 with value: 0.006335398441639262.\n",
      "[I 2026-07-02 16:31:14,439] Trial 295 finished with value: 0.006338554363770121 and parameters: {'reservoir_size': 58, 'spectral_radius': 1.0048860946309655, 'ar_lags': 3, 'foundation_window': 13, 'regressor_type': 'Lasso', 'reg_alpha': 9.224654801485299, 'aci_step_size': 0.1672446904112866, 'oob_split_ratio': 0.7617293119773594}. Best is trial 222 with value: 0.006335398441639262.\n",
      "[I 2026-07-02 16:31:14,548] Trial 296 finished with value: 0.006338554363770121 and parameters: {'reservoir_size': 57, 'spectral_radius': 1.0015691188191969, 'ar_lags': 3, 'foundation_window': 13, 'regressor_type': 'Lasso', 'reg_alpha': 11.557423776359625, 'aci_step_size': 0.159603769063089, 'oob_split_ratio': 0.7631099169555221}. Best is trial 222 with value: 0.006335398441639262.\n",
      "[I 2026-07-02 16:31:14,656] Trial 297 finished with value: 0.009366483422000539 and parameters: {'reservoir_size': 57, 'spectral_radius': 0.9944937261104936, 'ar_lags': 3, 'foundation_window': 12, 'regressor_type': 'Lasso', 'reg_alpha': 11.080791642418871, 'aci_step_size': 0.1588421396588716, 'oob_split_ratio': 0.7622424760204242}. Best is trial 222 with value: 0.006335398441639262.\n",
      "[I 2026-07-02 16:31:14,769] Trial 298 finished with value: 0.006338554363770121 and parameters: {'reservoir_size': 64, 'spectral_radius': 1.0060163486780012, 'ar_lags': 3, 'foundation_window': 13, 'regressor_type': 'Lasso', 'reg_alpha': 9.49369816769806, 'aci_step_size': 0.1632507633415541, 'oob_split_ratio': 0.7675865483425038}. Best is trial 222 with value: 0.006335398441639262.\n",
      "[I 2026-07-02 16:31:14,876] Trial 299 finished with value: 0.006339610337178919 and parameters: {'reservoir_size': 65, 'spectral_radius': 1.0056699948526169, 'ar_lags': 3, 'foundation_window': 13, 'regressor_type': 'Lasso', 'reg_alpha': 9.212294111582267, 'aci_step_size': 0.16247075229800542, 'oob_split_ratio': 0.7701673998507342}. Best is trial 222 with value: 0.006335398441639262.\n",
      "[I 2026-07-02 16:31:14,880] A new study created in memory with name: no-name-3d8a180c-2adf-4af0-87a1-c740e6b30fa5\n",
      "[I 2026-07-02 16:31:14,942] Trial 0 finished with value: 74.74912285314956 and parameters: {'target_miscoverage': 0.08116262258099886, 'aci_step_size': 0.1667521176194013, 'interval_scale': 3.805209189203926}. Best is trial 0 with value: 74.74912285314956.\n",
      "[I 2026-07-02 16:31:14,997] Trial 1 finished with value: 15.378152801077006 and parameters: {'target_miscoverage': 0.12374511199743694, 'aci_step_size': 0.00889039845957559, 'interval_scale': 0.7705594012729585}. Best is trial 1 with value: 15.378152801077006.\n",
      "[I 2026-07-02 16:31:15,043] Trial 2 finished with value: 53.57574406425819 and parameters: {'target_miscoverage': 0.021035886311957897, 'aci_step_size': 0.12207764786954153, 'interval_scale': 2.6471868808879733}. Best is trial 1 with value: 15.378152801077006.\n",
      "[I 2026-07-02 16:31:15,092] Trial 3 finished with value: 145.8182014419285 and parameters: {'target_miscoverage': 0.14453378978124864, 'aci_step_size': 0.005394455304087533, 'interval_scale': 7.3596614801167854}. Best is trial 1 with value: 15.378152801077006.\n",
      "[I 2026-07-02 16:31:15,140] Trial 4 finished with value: 16.260602921814787 and parameters: {'target_miscoverage': 0.16816410175208013, 'aci_step_size': 0.010943342660062645, 'interval_scale': 0.8277688526305597}. Best is trial 1 with value: 15.378152801077006.\n",
      "[I 2026-07-02 16:31:15,190] Trial 5 finished with value: 43.353415605118116 and parameters: {'target_miscoverage': 0.044846856872152424, 'aci_step_size': 0.015359756451337138, 'interval_scale': 2.142099844547283}. Best is trial 1 with value: 15.378152801077006.\n",
      "[I 2026-07-02 16:31:15,237] Trial 6 finished with value: 55.05911485161886 and parameters: {'target_miscoverage': 0.092069553542002, 'aci_step_size': 0.014639847680621753, 'interval_scale': 2.727183127344505}. Best is trial 1 with value: 15.378152801077006.\n",
      "[I 2026-07-02 16:31:15,285] Trial 7 finished with value: 27.94455706022473 and parameters: {'target_miscoverage': 0.036503833523887946, 'aci_step_size': 0.014689372953975089, 'interval_scale': 1.3807454499059875}. Best is trial 1 with value: 15.378152801077006.\n",
      "[I 2026-07-02 16:31:15,335] Trial 8 finished with value: 17.085541961309634 and parameters: {'target_miscoverage': 0.09665329700123683, 'aci_step_size': 0.09054594344647797, 'interval_scale': 0.869763534223623}. Best is trial 1 with value: 15.378152801077006.\n",
      "[I 2026-07-02 16:31:15,383] Trial 9 finished with value: 11.171961706499708 and parameters: {'target_miscoverage': 0.1077045432985862, 'aci_step_size': 0.04446862319918233, 'interval_scale': 0.5687244174086067}. Best is trial 9 with value: 11.171961706499708.\n",
      "[I 2026-07-02 16:31:15,436] Trial 10 finished with value: 10.029642340871574 and parameters: {'target_miscoverage': 0.19154740460445246, 'aci_step_size': 0.03929005796689084, 'interval_scale': 0.5105730441126768}. Best is trial 10 with value: 10.029642340871574.\n",
      "[I 2026-07-02 16:31:15,486] Trial 11 finished with value: 10.794219326181683 and parameters: {'target_miscoverage': 0.18713516496323956, 'aci_step_size': 0.04164679387089521, 'interval_scale': 0.5494949104745805}. Best is trial 10 with value: 10.029642340871574.\n",
      "[I 2026-07-02 16:31:15,540] Trial 12 finished with value: 10.33809801483868 and parameters: {'target_miscoverage': 0.19722181661010438, 'aci_step_size': 0.03655064031002041, 'interval_scale': 0.5262754138561289}. Best is trial 10 with value: 10.029642340871574.\n",
      "[I 2026-07-02 16:31:15,592] Trial 13 finished with value: 9.949886427978592 and parameters: {'target_miscoverage': 0.1995610392805547, 'aci_step_size': 0.033442781834192976, 'interval_scale': 0.5065129572359066}. Best is trial 13 with value: 9.949886427978592.\n",
      "[I 2026-07-02 16:31:15,646] Trial 14 finished with value: 25.387966741092598 and parameters: {'target_miscoverage': 0.1633687433016793, 'aci_step_size': 0.024821887863753774, 'interval_scale': 1.292410140075646}. Best is trial 13 with value: 9.949886427978592.\n",
      "[I 2026-07-02 16:31:15,704] Trial 15 finished with value: 21.94485014400283 and parameters: {'target_miscoverage': 0.17429270875510758, 'aci_step_size': 0.0637112095197321, 'interval_scale': 1.1171334490149}. Best is trial 13 with value: 9.949886427978592.\n",
      "[I 2026-07-02 16:31:15,758] Trial 16 finished with value: 13.646221154718829 and parameters: {'target_miscoverage': 0.14434025459521416, 'aci_step_size': 0.02249181048276558, 'interval_scale': 0.6946800731988959}. Best is trial 13 with value: 9.949886427978592.\n",
      "[I 2026-07-02 16:31:15,811] Trial 17 finished with value: 20.611795096243203 and parameters: {'target_miscoverage': 0.19985745661237553, 'aci_step_size': 0.027635949623882185, 'interval_scale': 1.0492724076424627}. Best is trial 13 with value: 9.949886427978592.\n",
      "[I 2026-07-02 16:31:15,867] Trial 18 finished with value: 9.906926478244753 and parameters: {'target_miscoverage': 0.1465578732355906, 'aci_step_size': 0.06324739923042118, 'interval_scale': 0.5043260205949032}. Best is trial 18 with value: 9.906926478244753.\n",
      "[I 2026-07-02 16:31:15,923] Trial 19 finished with value: 34.82816128135132 and parameters: {'target_miscoverage': 0.1452757824205482, 'aci_step_size': 0.10049275820640989, 'interval_scale': 1.772976515373303}. Best is trial 18 with value: 9.906926478244753.\n",
      "[I 2026-07-02 16:31:15,977] Trial 20 finished with value: 13.546027209506903 and parameters: {'target_miscoverage': 0.12557866245633992, 'aci_step_size': 0.06086620436311455, 'interval_scale': 0.6895795595545208}. Best is trial 18 with value: 9.906926478244753.\n",
      "[I 2026-07-02 16:31:16,032] Trial 21 finished with value: 10.23216998947455 and parameters: {'target_miscoverage': 0.1808242527763391, 'aci_step_size': 0.06332205057347083, 'interval_scale': 0.5208829988011358}. Best is trial 18 with value: 9.906926478244753.\n",
      "[I 2026-07-02 16:31:16,086] Trial 22 finished with value: 13.844796602562337 and parameters: {'target_miscoverage': 0.1631525722396782, 'aci_step_size': 0.03342840888521296, 'interval_scale': 0.7047888355499912}. Best is trial 18 with value: 9.906926478244753.\n",
      "[I 2026-07-02 16:31:16,143] Trial 23 finished with value: 10.057031224751102 and parameters: {'target_miscoverage': 0.15169277059537092, 'aci_step_size': 0.052107369196267156, 'interval_scale': 0.5119673137470161}. Best is trial 18 with value: 9.906926478244753.\n",
      "[I 2026-07-02 16:31:16,197] Trial 24 finished with value: 17.85129652260871 and parameters: {'target_miscoverage': 0.18740232876384627, 'aci_step_size': 0.07535500659857076, 'interval_scale': 0.9087453475378822}. Best is trial 18 with value: 9.906926478244753.\n",
      "[I 2026-07-02 16:31:16,252] Trial 25 finished with value: 12.55410053654278 and parameters: {'target_miscoverage': 0.1320583587676628, 'aci_step_size': 0.019930224010235552, 'interval_scale': 0.6390841377106145}. Best is trial 18 with value: 9.906926478244753.\n",
      "[I 2026-07-02 16:31:16,305] Trial 26 finished with value: 12.612204152285104 and parameters: {'target_miscoverage': 0.18455491465931273, 'aci_step_size': 0.03082064846327151, 'interval_scale': 0.6420419839586556}. Best is trial 18 with value: 9.906926478244753.\n",
      "[I 2026-07-02 16:31:16,360] Trial 27 finished with value: 20.26085288642865 and parameters: {'target_miscoverage': 0.15836431318866978, 'aci_step_size': 0.19170227408309054, 'interval_scale': 1.0314072020843656}. Best is trial 18 with value: 9.906926478244753.\n",
      "[I 2026-07-02 16:31:16,413] Trial 28 finished with value: 10.100769902277296 and parameters: {'target_miscoverage': 0.07077578898340864, 'aci_step_size': 0.048242526502759495, 'interval_scale': 0.5004764830771539}. Best is trial 18 with value: 9.906926478244753.\n",
      "[I 2026-07-02 16:31:16,466] Trial 29 finished with value: 115.12895117591779 and parameters: {'target_miscoverage': 0.197240408538527, 'aci_step_size': 0.11106085445515095, 'interval_scale': 5.860801126037487}. Best is trial 18 with value: 9.906926478244753.\n",
      "[I 2026-07-02 16:31:16,522] Trial 30 finished with value: 12.250200500208898 and parameters: {'target_miscoverage': 0.17554151395587186, 'aci_step_size': 0.1433896967354468, 'interval_scale': 0.6236136797260018}. Best is trial 18 with value: 9.906926478244753.\n",
      "[I 2026-07-02 16:31:16,575] Trial 31 finished with value: 9.952642010997874 and parameters: {'target_miscoverage': 0.15418169020580644, 'aci_step_size': 0.049447857887775476, 'interval_scale': 0.5066532340593426}. Best is trial 18 with value: 9.906926478244753.\n",
      "[I 2026-07-02 16:31:16,629] Trial 32 finished with value: 15.196785553563206 and parameters: {'target_miscoverage': 0.13359681498344875, 'aci_step_size': 0.07786402335823818, 'interval_scale': 0.773613733876022}. Best is trial 18 with value: 9.906926478244753.\n",
      "[I 2026-07-02 16:31:16,685] Trial 33 finished with value: 12.094005103095478 and parameters: {'target_miscoverage': 0.11369758967302442, 'aci_step_size': 0.03727865073714831, 'interval_scale': 0.6156623328195863}. Best is trial 18 with value: 9.906926478244753.\n",
      "[I 2026-07-02 16:31:16,742] Trial 34 finished with value: 15.380936482839463 and parameters: {'target_miscoverage': 0.15508194566468267, 'aci_step_size': 0.018914711240314023, 'interval_scale': 0.782988195825312}. Best is trial 18 with value: 9.906926478244753.\n",
      "[I 2026-07-02 16:31:16,794] Trial 35 finished with value: 18.39858840504673 and parameters: {'target_miscoverage': 0.1713323366722848, 'aci_step_size': 0.050595261892449964, 'interval_scale': 0.9366060094743667}. Best is trial 18 with value: 9.906926478244753.\n",
      "[I 2026-07-02 16:31:16,850] Trial 36 finished with value: 15.131204544551304 and parameters: {'target_miscoverage': 0.1429968445680887, 'aci_step_size': 0.006973234125244636, 'interval_scale': 0.764673933396441}. Best is trial 18 with value: 9.906926478244753.\n",
      "[I 2026-07-02 16:31:16,907] Trial 37 finished with value: 11.62394301099807 and parameters: {'target_miscoverage': 0.1863592231123489, 'aci_step_size': 0.028737072071393584, 'interval_scale': 0.5917331611580606}. Best is trial 18 with value: 9.906926478244753.\n",
      "[I 2026-07-02 16:31:16,963] Trial 38 finished with value: 10.030850198428954 and parameters: {'target_miscoverage': 0.06719579373180076, 'aci_step_size': 0.0800067747177392, 'interval_scale': 0.503833668593463}. Best is trial 18 with value: 9.906926478244753.\n",
      "[I 2026-07-02 16:31:17,015] Trial 39 finished with value: 14.412797201271262 and parameters: {'target_miscoverage': 0.1341268130701348, 'aci_step_size': 0.14322040746144077, 'interval_scale': 0.733703705312915}. Best is trial 18 with value: 9.906926478244753.\n",
      "[I 2026-07-02 16:31:17,069] Trial 40 finished with value: 12.033911896981266 and parameters: {'target_miscoverage': 0.1210661056600169, 'aci_step_size': 0.06082602810922757, 'interval_scale': 0.612603203676887}. Best is trial 18 with value: 9.906926478244753.\n",
