      "[I 2026-07-02 16:33:39,969] Trial 199 finished with value: 8.094538006142635 and parameters: {'aci_target': 0.18043084383992647, 'aci_step_size': 0.006113076216048298, 'interval_scale': 0.7882062257084211, 'interval_power': 0.07531796869798384, 'min_width_factor': 0.6818244352283918}. Best is trial 172 with value: 6.7181030471805645.\n"
     ]
    },
    {
     "name": "stdout",
     "output_type": "stream",
     "text": [
      "S3-FastSketch best point parameters:\n",
      "{'foundation_window': 4, 'ar_lags': 4, 'ema_spans': (2, 4, 8), 'conv_scales': (3, 6), 'use_calendar': True, 'ridge_alpha': 0.054244387218088816, 'shrinkage_max': 0.3180924468616432, 'oob_split_ratio': 0.6470448025925963}\n",
      "S3-FastSketch best UQ parameters:\n",
      "{'aci_target': 0.19176000672673, 'aci_step_size': 0.006508211591617808, 'interval_scale': 0.7506496384046828, 'interval_power': 5.675722723025691e-05, 'min_width_factor': 0.6852458737519903}\n",
      "S3-FastSketch test metrics on modelling scale:\n"
     ]
    },
    {
     "data": {
      "text/html": [
       "<div>\n",
       "<style scoped>\n",
       "    .dataframe tbody tr th:only-of-type {\n",
       "        vertical-align: middle;\n",
       "    }\n",
       "\n",
       "    .dataframe tbody tr th {\n",
       "        vertical-align: top;\n",
       "    }\n",
       "\n",
       "    .dataframe thead th {\n",
       "        text-align: right;\n",
       "    }\n",
       "</style>\n",
       "<table border=\"1\" class=\"dataframe\">\n",
       "  <thead>\n",
       "    <tr style=\"text-align: right;\">\n",
       "      <th></th>\n",
       "      <th>mae</th>\n",
       "      <th>mse</th>\n",
       "      <th>rmse</th>\n",
       "      <th>r2</th>\n",
       "      <th>mape_percent</th>\n",
       "      <th>mape</th>\n",
       "      <th>smape_percent</th>\n",
       "      <th>smape</th>\n",
       "      <th>ecp</th>\n",
       "      <th>coverage_error</th>\n",
       "      <th>iw</th>\n",
       "      <th>mean_width</th>\n",
       "      <th>mis</th>\n",
       "      <th>interval_score</th>\n",
       "      <th>msis</th>\n",
       "      <th>scale</th>\n",
       "      <th>elapsed_seconds</th>\n",
       "      <th>trainable_params</th>\n",
       "    </tr>\n",
       "  </thead>\n",
       "  <tbody>\n",
       "    <tr>\n",
       "      <th>0</th>\n",
       "      <td>0.153111</td>\n",
       "      <td>0.034356</td>\n",
       "      <td>0.185354</td>\n",
       "      <td>0.814943</td>\n",
       "      <td>1.890507</td>\n",
       "      <td>0.018905</td>\n",
       "      <td>1.917</td>\n",
       "      <td>0.01917</td>\n",
       "      <td>0.708333</td>\n",
       "      <td>0.191667</td>\n",
       "      <td>0.463193</td>\n",
       "      <td>0.463193</td>\n",
       "      <td>0.777754</td>\n",
       "      <td>0.777754</td>\n",
       "      <td>9.790895</td>\n",
       "      <td>0.079436</td>\n",
       "      <td>0.488564</td>\n",
       "      <td>27</td>\n",
       "    </tr>\n",
       "  </tbody>\n",
       "</table>\n",
       "</div>"
      ],
      "text/plain": [
       "        mae       mse      rmse        r2  mape_percent      mape  \\\n",
       "0  0.153111  0.034356  0.185354  0.814943      1.890507  0.018905   \n",
       "\n",
       "   smape_percent    smape       ecp  coverage_error        iw  mean_width  \\\n",
       "0          1.917  0.01917  0.708333        0.191667  0.463193    0.463193   \n",
       "\n",
       "        mis  interval_score      msis     scale  elapsed_seconds  \\\n",
       "0  0.777754        0.777754  9.790895  0.079436         0.488564   \n",
       "\n",
       "   trainable_params  \n",
       "0                27  "
      ]
     },
     "metadata": {},
     "output_type": "display_data"
    }
   ],
   "source": [
    "fastsketch_result = run_fastsketch_experiment(\n",
    "    train_series,\n",
    "    test_series,\n",
    "    point_trials=FASTSKETCH_POINT_TRIALS,\n",
    "    uq_trials=FASTSKETCH_UQ_TRIALS,\n",
    "    val_size=VAL_SIZE,\n",
    "    seed=SEED,\n",
    ")\n",
    "\n",
    "print(\"S3-FastSketch best point parameters:\")\n",
    "print(fastsketch_result[\"best_point_params\"])\n",
    "print(\"S3-FastSketch best UQ parameters:\")\n",
    "print(fastsketch_result[\"best_uq_params\"])\n",
    "print(\"S3-FastSketch test metrics on modelling scale:\")\n",
    "display(pd.DataFrame([fastsketch_result[\"metrics\"]]))"
   ]
  },
  {
   "cell_type": "markdown",
   "id": "88d16e8f",
   "metadata": {
    "papermill": {
     "duration": 0.061626,
     "end_time": "2026-07-02T16:33:40.609241+00:00",
     "exception": false,
     "start_time": "2026-07-02T16:33:40.547615+00:00",
     "status": "completed"
    },
    "tags": []
   },
   "source": [
    "## 8. Baselines with fixed parameters and a common ACI wrapper\n",
    "\n",
    "Each baseline is fitted twice:\n",
    "\n",
    "1. on a chronological training core to obtain calibration residuals;\n",
    "2. on the complete training series to produce the final test forecast.\n",
    "\n",
    "The interval for test step `t` is formed before observing `y_t`. After scoring that step, the ACI state is updated for the next one. Thus, the procedure is sequential and does not use future test observations."
   ]
  },
  {
   "cell_type": "code",
   "execution_count": 10,
   "id": "b6f3e3ee",
   "metadata": {
    "execution": {
     "iopub.execute_input": "2026-07-02T16:33:40.737196Z",
     "iopub.status.busy": "2026-07-02T16:33:40.736852Z",
     "iopub.status.idle": "2026-07-02T16:33:40.754547Z",
     "shell.execute_reply": "2026-07-02T16:33:40.753379Z"
    },
    "papermill": {
     "duration": 0.086362,
     "end_time": "2026-07-02T16:33:40.756619+00:00",
     "exception": false,
     "start_time": "2026-07-02T16:33:40.670257+00:00",
     "status": "completed"
    },
    "tags": []
   },
   "outputs": [],
   "source": [
    "def finite_sample_conformal_quantile(scores, alpha):\n",
    "    scores = np.asarray(scores, dtype=float).reshape(-1)\n",
    "    scores = scores[np.isfinite(scores)]\n",
    "    if len(scores) == 0:\n",
    "        raise ValueError(\"No finite calibration scores were produced.\")\n",
    "    level = min(1.0, math.ceil((len(scores) + 1) * (1.0 - alpha)) / len(scores))\n",
    "    try:\n",
    "        return float(np.quantile(scores, level, method=\"higher\"))\n",
    "    except TypeError:\n",
    "        return float(np.quantile(scores, level, interpolation=\"higher\"))\n",
    "\n",
    "\n",
    "def adaptive_conformal_path(y_true, y_pred, calibration_scores, alpha=0.10, step_size=0.05):\n",
    "    y_true = np.asarray(y_true, dtype=float).reshape(-1)\n",
    "    y_pred = np.asarray(y_pred, dtype=float).reshape(-1)\n",
    "    buffer = list(np.asarray(calibration_scores, dtype=float).reshape(-1))\n",
    "    alpha_t = float(alpha)\n",
    "    lower, upper, alpha_path = [], [], []\n",
    "\n",
    "    for observed, predicted in zip(y_true, y_pred):\n",
    "        q = finite_sample_conformal_quantile(buffer, alpha_t)\n",
    "        lo = float(predicted - q)\n",
    "        up = float(predicted + q)\n",
    "        lower.append(lo)\n",
    "        upper.append(up)\n",
    "        alpha_path.append(alpha_t)\n",
    "\n",
    "        miss = float(observed < lo or observed > up)\n",
    "        alpha_t = float(np.clip(alpha_t + step_size * (alpha - miss), 0.01, 0.50))\n",
    "        buffer.append(abs(float(observed - predicted)))\n",
    "\n",
    "    return np.asarray(lower), np.asarray(upper), np.asarray(alpha_path)\n",
    "\n",
    "\n",
    "def evaluate_fixed_baseline_with_aci(\n",
    "    model_name,\n",
    "    params,\n",
    "    train,\n",
    "    test,\n",
    "    *,\n",
    "    calibration_ratio=0.20,\n",
    "    alpha=0.10,\n",
    "    aci_step_size=0.05,\n",
    "    seasonal_period=12,\n",
    "):\n",
    "    train = ensure_series(train, name=\"train\")\n",
    "    test = ensure_series(test, name=\"test\")\n",
    "\n",
    "    split = int(np.floor((1.0 - calibration_ratio) * len(train)))\n",
    "    split = max(split, seasonal_period + 5)\n",
    "    split = min(split, len(train) - 2)\n",
    "    train_core = train.iloc[:split]\n",
    "    calibration = train.iloc[split:]\n",
    "\n",
    "    _, calibration_forecast = fit_predict_baseline(\n",
    "        model_name,\n",
    "        train_core,\n",
    "        len(calibration),\n",
    "        params,\n",
    "    )\n",
    "    calibration_output = parse_forecast_output(calibration_forecast)\n",
    "    if len(calibration_output.pred) != len(calibration):\n",
    "        raise ValueError(\n",
    "            f\"{model_name} returned {len(calibration_output.pred)} calibration values; \"\n",
    "            f\"expected {len(calibration)}.\"\n",
    "        )\n",
    "    calibration_scores = np.abs(calibration.to_numpy() - calibration_output.pred)\n",
    "\n",
    "    start = time.perf_counter()\n",
    "    model, test_forecast = fit_predict_baseline(model_name, train, len(test), params)\n",
    "    elapsed = time.perf_counter() - start\n",
    "    test_output = parse_forecast_output(test_forecast)\n",
    "\n",
    "    if test_output.has_interval:\n",
    "        lower, upper = test_output.lower, test_output.upper\n",
    "        interval_source = \"native\"\n",
    "        alpha_path = np.full(len(test), alpha)\n",
    "    else:\n",
    "        lower, upper, alpha_path = adaptive_conformal_path(\n",
    "            test,\n",
    "            test_output.pred,\n",
    "            calibration_scores,\n",
    "            alpha=alpha,\n",
    "            step_size=aci_step_size,\n",
    "        )\n",
    "        interval_source = \"external_aci\"\n",
    "\n",
    "    forecast = pd.DataFrame(\n",
    "        {\n",
    "            \"pred\": test_output.pred,\n",
    "            \"lower\": lower,\n",
    "            \"upper\": upper,\n",
    "            \"aci_alpha\": alpha_path,\n",
    "        },\n",
    "        index=test.index,\n",
    "    )\n",
    "\n",
    "    metrics = evaluate_forecast(\n",
    "        test,\n",
    "        forecast[\"pred\"],\n",
    "        y_train=train,\n",
    "        lower=forecast[\"lower\"],\n",
    "        upper=forecast[\"upper\"],\n",
    "        alpha=alpha,\n",
    "        seasonal_period=seasonal_period,\n",
    "        elapsed_seconds=elapsed,\n",
    "        trainable_params=count_trainable_parameters(model),\n",
    "    )\n",
    "\n",
    "    return {\n",
    "        \"model\": model,\n",
    "        \"forecast\": forecast,\n",
    "        \"metrics\": metrics,\n",
    "        \"interval_source\": interval_source,\n",
    "        \"calibration_size\": len(calibration),\n",
    "    }"
   ]
  },
  {
   "cell_type": "code",
   "execution_count": 11,
   "id": "6ebfcd19",
   "metadata": {
    "execution": {
     "iopub.execute_input": "2026-07-02T16:33:40.883049Z",
     "iopub.status.busy": "2026-07-02T16:33:40.882361Z",
     "iopub.status.idle": "2026-07-02T16:34:56.727410Z",
     "shell.execute_reply": "2026-07-02T16:34:56.726477Z"
    },
    "papermill": {
     "duration": 75.911568,
     "end_time": "2026-07-02T16:34:56.730023+00:00",
     "exception": false,
     "start_time": "2026-07-02T16:33:40.818455+00:00",
     "status": "completed"
    },
    "tags": []
   },
   "outputs": [
    {
     "name": "stdout",
     "output_type": "stream",
     "text": [
      "\n",
      "Evaluating CNN with fixed original parameters...\n",
      "{'mae': 0.12706242337668952, 'mse': 0.02730554319072488, 'rmse': 0.16524389002539513, 'r2': 0.8529207501764642, 'mape_percent': 1.545368776732164, 'mape': 0.01545368776732164, 'smape_percent': 1.5550285381813898, 'smape': 0.015550285381813897, 'ecp': 0.9166666666666666, 'coverage_error': 0.016666666666666607, 'iw': 0.6913152336086239, 'mean_width': 0.6913152336086239, 'mis': 0.7870685709590188, 'interval_score': 0.7870685709590188, 'msis': 9.908157236844541, 'scale': 0.07943642315568229, 'elapsed_seconds': 11.847499598000013, 'trainable_params': 2192}\n",
      "\n",
      "Evaluating LSTM with fixed original parameters...\n",
      "{'mae': 0.11383043698044508, 'mse': 0.019856250975835123, 'rmse': 0.14091221017298367, 'r2': 0.8930458010875355, 'mape_percent': 1.4096451545563278, 'mape': 0.014096451545563278, 'smape_percent': 1.4240560327272431, 'smape': 0.01424056032727243, 'ecp': 0.875, 'coverage_error': 0.025000000000000022, 'iw': 0.495395641396345, 'mean_width': 0.495395641396345, 'mis': 0.6119290682912157, 'interval_score': 0.6119290682912157, 'msis': 7.703381446215619, 'scale': 0.07943642315568229, 'elapsed_seconds': 11.737432669999976, 'trainable_params': 28312}\n",
      "\n",
      "Evaluating Gaussian Process with fixed original parameters...\n",
      "{'mae': 0.09385978298462516, 'mse': 0.013288781643308522, 'rmse': 0.11527697794142819, 'r2': 0.928420979523656, 'mape_percent': 1.1658499195783425, 'mape': 0.011658499195783425, 'smape_percent': 1.1759243148669114, 'smape': 0.011759243148669114, 'ecp': 1.0, 'coverage_error': 0.09999999999999998, 'iw': 0.8237381418627169, 'mean_width': 0.8237381418627169, 'mis': 0.8237381418627169, 'interval_score': 0.8237381418627169, 'msis': 10.369778863888747, 'scale': 0.07943642315568229, 'elapsed_seconds': 4.314868402000002, 'trainable_params': 3000}\n",
      "\n",
      "Evaluating Kernel Ridge with fixed original parameters...\n",
      "{'mae': 0.12403684670051207, 'mse': 0.021833945580190358, 'rmse': 0.14776314012699635, 'r2': 0.8823930982001809, 'mape_percent': 1.5374986139404405, 'mape': 0.015374986139404405, 'smape_percent': 1.5542084556679825, 'smape': 0.015542084556679825, 'ecp': 0.75, 'coverage_error': 0.15000000000000002, 'iw': 0.34494684313335594, 'mean_width': 0.34494684313335594, 'mis': 0.526351632469114, 'interval_score': 0.526351632469114, 'msis': 6.62607418057522, 'scale': 0.07943642315568229, 'elapsed_seconds': 0.005578324999987672, 'trainable_params': 2376}\n",
      "\n",
      "Evaluating AR with fixed original parameters...\n",
      "{'mae': 0.09413630397163804, 'mse': 0.013186157888614677, 'rmse': 0.11483099707228304, 'r2': 0.928973754641478, 'mape_percent': 1.1698765935654756, 'mape': 0.011698765935654757, 'smape_percent': 1.179916837756164, 'smape': 0.01179916837756164, 'ecp': 0.9166666666666666, 'coverage_error': 0.016666666666666607, 'iw': 0.4345660262789412, 'mean_width': 0.4345660262789412, 'mis': 0.4779611852250665, 'interval_score': 0.4779611852250665, 'msis': 6.016902149387333, 'scale': 0.07943642315568229, 'elapsed_seconds': 0.012789607000058822, 'trainable_params': 28}\n",
      "\n",
      "Evaluating ARIMA with fixed original parameters...\n",
      "{'mae': 0.13399922527078742, 'mse': 0.025123063348671915, 'rmse': 0.15850256574791435, 'r2': 0.8646765133078556, 'mape_percent': 1.69084760818444, 'mape': 0.016908476081844398, 'smape_percent': 1.687632156942549, 'smape': 0.01687632156942549, 'ecp': 0.9583333333333334, 'coverage_error': 0.05833333333333335, 'iw': 0.6655392186650456, 'mean_width': 0.6655392186650456, 'mis': 0.6655437886263735, 'interval_score': 0.6655437886263735, 'msis': 8.378320198556995, 'scale': 0.07943642315568229, 'elapsed_seconds': 1.2206927510000014, 'trainable_params': 13}\n",
      "\n",
      "Evaluating ARKAN with fixed original parameters...\n",
      "{'mae': 0.07225386151494088, 'mse': 0.008980026139014477, 'rmse': 0.09476299984178677, 'r2': 0.9516297662091325, 'mape_percent': 0.8938146680267519, 'mape': 0.008938146680267519, 'smape_percent': 0.8923404198453235, 'smape': 0.008923404198453236, 'ecp': 1.0, 'coverage_error': 0.09999999999999998, 'iw': 0.6233638485141766, 'mean_width': 0.6233638485141766, 'mis': 0.6233638485141766, 'interval_score': 0.6233638485141766, 'msis': 7.847330276849025, 'scale': 0.07943642315568229, 'elapsed_seconds': 2.5843603130000474, 'trainable_params': 219483}\n",
      "\n",
      "Evaluating EasyTSF (NLinear) with fixed original parameters...\n",
      "{'mae': 0.05549372455920273, 'mse': 0.0047178858086938886, 'rmse': 0.06868686780377956, 'r2': 0.9745874637743333, 'mape_percent': 0.6856693329581981, 'mape': 0.006856693329581981, 'smape_percent': 0.6856192739980462, 'smape': 0.006856192739980462, 'ecp': 1.0, 'coverage_error': 0.09999999999999998, 'iw': 0.41640237265853025, 'mean_width': 0.41640237265853025, 'mis': 0.41640237265853025, 'interval_score': 0.41640237265853025, 'msis': 5.241957733198161, 'scale': 0.07943642315568229, 'elapsed_seconds': 1.42817482199996, 'trainable_params': 20}\n",
      "\n",
      "Evaluating ETS with fixed original parameters...\n",
      "{'mae': 0.07301885684779201, 'mse': 0.00911059097381209, 'rmse': 0.09544941578559865, 'r2': 0.9509264885698182, 'mape_percent': 0.9211752173073363, 'mape': 0.009211752173073363, 'smape_percent': 0.9281898903506329, 'smape': 0.009281898903506329, 'ecp': 0.7916666666666666, 'coverage_error': 0.10833333333333339, 'iw': 0.3013629186741243, 'mean_width': 0.3013629186741243, 'mis': 0.3779238043490314, 'interval_score': 0.3779238043490314, 'msis': 4.757563210120414, 'scale': 0.07943642315568229, 'elapsed_seconds': 0.14994747399998687, 'trainable_params': 18}\n"
     ]
    }
   ],
   "source": [
    "baseline_results = {}\n",
    "baseline_failures = []\n",
    "\n",
    "for baseline_name in BASELINE_ORDER:\n",
    "    display_name = BASELINE_DISPLAY_NAMES.get(baseline_name, baseline_name)\n",
    "    print(f\"\\nEvaluating {display_name} with fixed original parameters...\")\n",
    "    try:\n",
    "        result = evaluate_fixed_baseline_with_aci(\n",
    "            baseline_name,\n",
    "            BASELINE_PARAMS[baseline_name],\n",
    "            train_series,\n",
    "            test_series,\n",
    "            calibration_ratio=BASELINE_CALIBRATION_RATIO,\n",
    "            alpha=ALPHA,\n",
    "            aci_step_size=BASELINE_ACI_STEP_SIZE,\n",
    "            seasonal_period=SEASONAL_PERIOD,\n",
    "        )\n",
    "        baseline_results[display_name] = result\n",
    "        print(result[\"metrics\"])\n",
    "    except Exception as exc:\n",
    "        baseline_failures.append(\n",
    "            {\n",
    "                \"model\": display_name,\n",
    "                \"exception_type\": type(exc).__name__,\n",
    "                \"error\": str(exc),\n",
    "            }\n",
    "        )\n",
    "        print(f\"FAILED: {type(exc).__name__}: {exc}\")\n",
    "\n",
    "if baseline_failures:\n",
    "    print(\"\\nBaseline failures were retained for audit:\")\n",
    "    display(pd.DataFrame(baseline_failures))"
   ]
  },
  {
   "cell_type": "markdown",
   "id": "981aa3eb",
   "metadata": {
    "papermill": {
     "duration": 0.062384,
     "end_time": "2026-07-02T16:34:56.873829+00:00",
     "exception": false,
     "start_time": "2026-07-02T16:34:56.811445+00:00",
     "status": "completed"
    },
    "tags": []
   },
   "source": [
    "## 9. Consolidated results on modelling and original scales"
   ]
  },
  {
   "cell_type": "code",
   "execution_count": 12,
   "id": "30ca9fd3",
   "metadata": {
    "execution": {
     "iopub.execute_input": "2026-07-02T16:34:56.999843Z",
     "iopub.status.busy": "2026-07-02T16:34:56.999233Z",
     "iopub.status.idle": "2026-07-02T16:34:57.088458Z",
     "shell.execute_reply": "2026-07-02T16:34:57.087484Z"
    },
    "papermill": {
     "duration": 0.154205,
     "end_time": "2026-07-02T16:34:57.090318+00:00",
     "exception": false,
     "start_time": "2026-07-02T16:34:56.936113+00:00",
     "status": "completed"
    },
    "tags": []
   },
   "outputs": [
    {
     "name": "stdout",
     "output_type": "stream",
     "text": [
      "Results on modelling scale:\n"
     ]
    },
    {
     "data": {
      "text/html": [
       "<div>\n",
       "<style scoped>\n",
       "    .dataframe tbody tr th:only-of-type {\n",
       "        vertical-align: middle;\n",
       "    }\n",
       "\n",
       "    .dataframe tbody tr th {\n",
       "        vertical-align: top;\n",
       "    }\n",
       "\n",
       "    .dataframe thead th {\n",
       "        text-align: right;\n",
       "    }\n",
       "</style>\n",
       "<table border=\"1\" class=\"dataframe\">\n",
       "  <thead>\n",
       "    <tr style=\"text-align: right;\">\n",
       "      <th></th>\n",
       "      <th>Model</th>\n",
       "      <th>MAE</th>\n",
       "      <th>MSE</th>\n",
       "      <th>RMSE</th>\n",
       "      <th>R^2</th>\n",
       "      <th>MAPE (%)</th>\n",
       "      <th>sMAPE (%)</th>\n",
       "      <th>Time (s)</th>\n",
       "      <th>trainable_params</th>\n",
       "      <th>ECP</th>\n",
       "      <th>IW</th>\n",
       "      <th>MIS</th>\n",
       "      <th>MSIS</th>\n",
       "    </tr>\n",
       "  </thead>\n",
       "  <tbody>\n",
       "    <tr>\n",
       "      <th>0</th>\n",
       "      <td>EasyTSF (NLinear)</td>\n",
       "      <td>0.055494</td>\n",
       "      <td>0.004718</td>\n",
       "      <td>0.068687</td>\n",
       "      <td>0.974587</td>\n",
       "      <td>0.685669</td>\n",
       "      <td>0.685619</td>\n",
       "      <td>1.428175</td>\n",
       "      <td>20</td>\n",
       "      <td>1.000000</td>\n",
       "      <td>0.416402</td>\n",
       "      <td>0.416402</td>\n",
       "      <td>5.241958</td>\n",
       "    </tr>\n",
       "    <tr>\n",
       "      <th>1</th>\n",
       "      <td>S3-Forecaster</td>\n",
       "      <td>0.066390</td>\n",
       "      <td>0.006765</td>\n",
       "      <td>0.082253</td>\n",
       "      <td>0.963558</td>\n",
       "      <td>0.825873</td>\n",
       "      <td>0.821149</td>\n",
       "      <td>0.076018</td>\n",
       "      <td>842</td>\n",
       "      <td>1.000000</td>\n",
       "      <td>0.806415</td>\n",
       "      <td>0.806415</td>\n",
       "      <td>10.151697</td>\n",
       "    </tr>\n",
       