      "[I 2026-07-02 16:32:38,196] Trial 120 finished with value: inf and parameters: {'reservoir_size': 193, 'spectral_radius': 0.7104478754987517, 'ar_lags': 4, 'foundation_window': 3, 'regressor_type': 'ElasticNet', 'reg_alpha': 4.986466521318753, 'aci_step_size': 0.05919866169148136, 'oob_split_ratio': 0.8127815826071954}. Best is trial 0 with value: inf.\n",
      "[I 2026-07-02 16:32:38,234] Trial 121 finished with value: inf and parameters: {'reservoir_size': 6, 'spectral_radius': 1.4548315554715123, 'ar_lags': 4, 'foundation_window': 4, 'regressor_type': 'Lasso', 'reg_alpha': 12.54051216393493, 'aci_step_size': 0.08085595345566782, 'oob_split_ratio': 0.7659259969696972}. Best is trial 0 with value: inf.\n",
      "[I 2026-07-02 16:32:38,272] Trial 122 finished with value: inf and parameters: {'reservoir_size': 10, 'spectral_radius': 0.7503321499024934, 'ar_lags': 4, 'foundation_window': 4, 'regressor_type': 'Lasso', 'reg_alpha': 15.539092832697706, 'aci_step_size': 0.049802532828258035, 'oob_split_ratio': 0.7640476048372797}. Best is trial 0 with value: inf.\n",
      "[I 2026-07-02 16:32:38,302] Trial 123 finished with value: inf and parameters: {'reservoir_size': 39, 'spectral_radius': 1.4231902232915539, 'ar_lags': 4, 'foundation_window': 4, 'regressor_type': 'Lasso', 'reg_alpha': 3.4085422061650372, 'aci_step_size': 0.1485227272897648, 'oob_split_ratio': 0.7417006499066193}. Best is trial 0 with value: inf.\n",
      "[I 2026-07-02 16:32:38,332] Trial 124 finished with value: inf and parameters: {'reservoir_size': 75, 'spectral_radius': 1.242072215286595, 'ar_lags': 4, 'foundation_window': 4, 'regressor_type': 'Lasso', 'reg_alpha': 1.3140190411820925, 'aci_step_size': 0.12636873796599774, 'oob_split_ratio': 0.7526195233758282}. Best is trial 0 with value: inf.\n",
      "[I 2026-07-02 16:32:38,380] Trial 125 finished with value: inf and parameters: {'reservoir_size': 142, 'spectral_radius': 1.4706415027130828, 'ar_lags': 4, 'foundation_window': 5, 'regressor_type': 'Lasso', 'reg_alpha': 4.416828534970421, 'aci_step_size': 0.0873595017240724, 'oob_split_ratio': 0.7884388501334975}. Best is trial 0 with value: inf.\n",
      "[I 2026-07-02 16:32:38,434] Trial 126 finished with value: inf and parameters: {'reservoir_size': 114, 'spectral_radius': 1.0273761020500032, 'ar_lags': 2, 'foundation_window': 4, 'regressor_type': 'Ridge', 'reg_alpha': 7.635443766452734, 'aci_step_size': 0.09369627976177858, 'oob_split_ratio': 0.7765908143236611}. Best is trial 0 with value: inf.\n",
      "[I 2026-07-02 16:32:38,475] Trial 127 finished with value: inf and parameters: {'reservoir_size': 56, 'spectral_radius': 0.8163747173580984, 'ar_lags': 4, 'foundation_window': 6, 'regressor_type': 'ElasticNet', 'reg_alpha': 19.12768909909418, 'aci_step_size': 0.13731170446478524, 'oob_split_ratio': 0.7503042471522554}. Best is trial 0 with value: inf.\n",
      "[I 2026-07-02 16:32:38,513] Trial 128 finished with value: inf and parameters: {'reservoir_size': 18, 'spectral_radius': 0.9249773281302442, 'ar_lags': 3, 'foundation_window': 3, 'regressor_type': 'Lasso', 'reg_alpha': 26.550145640227342, 'aci_step_size': 0.10497560323266081, 'oob_split_ratio': 0.6369205872970487}. Best is trial 0 with value: inf.\n",
      "[I 2026-07-02 16:32:38,567] Trial 129 finished with value: inf and parameters: {'reservoir_size': 129, 'spectral_radius': 1.072503572504854, 'ar_lags': 2, 'foundation_window': 5, 'regressor_type': 'Ridge', 'reg_alpha': 0.7503974246752568, 'aci_step_size': 0.08129309738557876, 'oob_split_ratio': 0.6136818594421963}. Best is trial 0 with value: inf.\n",
      "[I 2026-07-02 16:32:38,605] Trial 130 finished with value: inf and parameters: {'reservoir_size': 31, 'spectral_radius': 1.382568797490309, 'ar_lags': 4, 'foundation_window': 6, 'regressor_type': 'ElasticNet', 'reg_alpha': 4.119413156449081, 'aci_step_size': 0.07434375159752972, 'oob_split_ratio': 0.7708472913554394}. Best is trial 0 with value: inf.\n",
      "[I 2026-07-02 16:32:38,653] Trial 131 finished with value: inf and parameters: {'reservoir_size': 104, 'spectral_radius': 1.3631531292917782, 'ar_lags': 3, 'foundation_window': 5, 'regressor_type': 'Ridge', 'reg_alpha': 0.1821415710661793, 'aci_step_size': 0.1346000451022046, 'oob_split_ratio': 0.6843490839099557}. Best is trial 0 with value: inf.\n",
      "[I 2026-07-02 16:32:38,706] Trial 132 finished with value: inf and parameters: {'reservoir_size': 121, 'spectral_radius': 1.326497871788502, 'ar_lags': 3, 'foundation_window': 5, 'regressor_type': 'Ridge', 'reg_alpha': 0.9234852296667722, 'aci_step_size': 0.16242014439784078, 'oob_split_ratio': 0.7649838595134306}. Best is trial 0 with value: inf.\n",
      "[I 2026-07-02 16:32:38,747] Trial 133 finished with value: inf and parameters: {'reservoir_size': 71, 'spectral_radius': 1.4386118236037098, 'ar_lags': 3, 'foundation_window': 5, 'regressor_type': 'Ridge', 'reg_alpha': 0.6010602155167551, 'aci_step_size': 0.17941943125741305, 'oob_split_ratio': 0.7150006257178514}. Best is trial 0 with value: inf.\n",
      "[I 2026-07-02 16:32:38,793] Trial 134 finished with value: inf and parameters: {'reservoir_size': 95, 'spectral_radius': 1.460699765166139, 'ar_lags': 3, 'foundation_window': 5, 'regressor_type': 'Ridge', 'reg_alpha': 0.38569070293805535, 'aci_step_size': 0.14458361014914198, 'oob_split_ratio': 0.6262994197118905}. Best is trial 0 with value: inf.\n",
      "[I 2026-07-02 16:32:38,838] Trial 135 finished with value: inf and parameters: {'reservoir_size': 87, 'spectral_radius': 1.2660867569775567, 'ar_lags': 3, 'foundation_window': 4, 'regressor_type': 'Ridge', 'reg_alpha': 0.4645498156108097, 'aci_step_size': 0.13006444498910452, 'oob_split_ratio': 0.6005485873542041}. Best is trial 0 with value: inf.\n",
      "[I 2026-07-02 16:32:38,892] Trial 136 finished with value: inf and parameters: {'reservoir_size': 126, 'spectral_radius': 1.310695488817968, 'ar_lags': 2, 'foundation_window': 5, 'regressor_type': 'Lasso', 'reg_alpha': 22.43112308440499, 'aci_step_size': 0.015235405249256642, 'oob_split_ratio': 0.7043959935572734}. Best is trial 0 with value: inf.\n",
      "[I 2026-07-02 16:32:38,945] Trial 137 finished with value: inf and parameters: {'reservoir_size': 113, 'spectral_radius': 0.6393341463091271, 'ar_lags': 4, 'foundation_window': 6, 'regressor_type': 'ElasticNet', 'reg_alpha': 0.299324165637413, 'aci_step_size': 0.0690812732942482, 'oob_split_ratio': 0.6940722158848477}. Best is trial 0 with value: inf.\n",
      "[I 2026-07-02 16:32:38,986] Trial 138 finished with value: inf and parameters: {'reservoir_size': 61, 'spectral_radius': 1.4814590261381866, 'ar_lags': 2, 'foundation_window': 3, 'regressor_type': 'Ridge', 'reg_alpha': 0.21290447389196623, 'aci_step_size': 0.02035692207979122, 'oob_split_ratio': 0.6736604845669075}. Best is trial 0 with value: inf.\n",
      "[I 2026-07-02 16:32:39,026] Trial 139 finished with value: inf and parameters: {'reservoir_size': 3, 'spectral_radius': 0.875275634225961, 'ar_lags': 4, 'foundation_window': 5, 'regressor_type': 'Lasso', 'reg_alpha': 6.268750476939008, 'aci_step_size': 0.12481936784668314, 'oob_split_ratio': 0.7248743350316286}. Best is trial 0 with value: inf.\n",
      "[I 2026-07-02 16:32:39,069] Trial 140 finished with value: inf and parameters: {'reservoir_size': 83, 'spectral_radius': 1.287617888100904, 'ar_lags': 2, 'foundation_window': 6, 'regressor_type': 'ElasticNet', 'reg_alpha': 0.35992433197656104, 'aci_step_size': 0.03969167974482915, 'oob_split_ratio': 0.6429719562301265}. Best is trial 0 with value: inf.\n",
      "[I 2026-07-02 16:32:39,098] Trial 141 finished with value: inf and parameters: {'reservoir_size': 24, 'spectral_radius': 1.4127254743873732, 'ar_lags': 4, 'foundation_window': 3, 'regressor_type': 'Lasso', 'reg_alpha': 1.208798747386027, 'aci_step_size': 0.10952864932414252, 'oob_split_ratio': 0.6803082683844393}. Best is trial 0 with value: inf.\n",
      "[I 2026-07-02 16:32:39,159] Trial 142 finished with value: inf and parameters: {'reservoir_size': 158, 'spectral_radius': 1.437992399938549, 'ar_lags': 4, 'foundation_window': 3, 'regressor_type': 'Lasso', 'reg_alpha': 1.0207680104680779, 'aci_step_size': 0.09770494163846036, 'oob_split_ratio': 0.7862420169557743}. Best is trial 0 with value: inf.\n",
      "[I 2026-07-02 16:32:39,200] Trial 143 finished with value: inf and parameters: {'reservoir_size': 51, 'spectral_radius': 1.3937523852882794, 'ar_lags': 4, 'foundation_window': 3, 'regressor_type': 'Lasso', 'reg_alpha': 2.27235090515442, 'aci_step_size': 0.08437782250943536, 'oob_split_ratio': 0.7595362036372749}. Best is trial 0 with value: inf.\n",
      "[I 2026-07-02 16:32:39,272] Trial 144 finished with value: inf and parameters: {'reservoir_size': 165, 'spectral_radius': 1.3519401432206735, 'ar_lags': 4, 'foundation_window': 3, 'regressor_type': 'Lasso', 'reg_alpha': 2.6372467941078273, 'aci_step_size': 0.10156300950467588, 'oob_split_ratio': 0.666203531123826}. Best is trial 0 with value: inf.\n",
      "[I 2026-07-02 16:32:39,346] Trial 145 finished with value: inf and parameters: {'reservoir_size': 183, 'spectral_radius': 0.7333587880399629, 'ar_lags': 4, 'foundation_window': 3, 'regressor_type': 'Ridge', 'reg_alpha': 0.5161096127696693, 'aci_step_size': 0.11556095366925431, 'oob_split_ratio': 0.7727305657600333}. Best is trial 0 with value: inf.\n",
      "[I 2026-07-02 16:32:39,391] Trial 146 finished with value: inf and parameters: {'reservoir_size': 38, 'spectral_radius': 1.4893551326080912, 'ar_lags': 4, 'foundation_window': 3, 'regressor_type': 'Lasso', 'reg_alpha': 0.8267367506979955, 'aci_step_size': 0.028168144688204187, 'oob_split_ratio': 0.6882429808971626}. Best is trial 0 with value: inf.\n",
      "[I 2026-07-02 16:32:39,433] Trial 147 finished with value: inf and parameters: {'reservoir_size': 20, 'spectral_radius': 0.5626260648094984, 'ar_lags': 3, 'foundation_window': 4, 'regressor_type': 'ElasticNet', 'reg_alpha': 1.6850618016433836, 'aci_step_size': 0.09085978381807515, 'oob_split_ratio': 0.8279183446278484}. Best is trial 0 with value: inf.\n",
      "[I 2026-07-02 16:32:39,479] Trial 148 finished with value: inf and parameters: {'reservoir_size': 133, 'spectral_radius': 0.5374280676823052, 'ar_lags': 2, 'foundation_window': 6, 'regressor_type': 'Ridge', 'reg_alpha': 1.9708632894687514, 'aci_step_size': 0.19959573628210459, 'oob_split_ratio': 0.6494251709417094}. Best is trial 0 with value: inf.\n",
      "[I 2026-07-02 16:32:39,517] Trial 149 finished with value: inf and parameters: {'reservoir_size': 12, 'spectral_radius': 1.196665784589532, 'ar_lags': 4, 'foundation_window': 5, 'regressor_type': 'Lasso', 'reg_alpha': 0.6618873773291236, 'aci_step_size': 0.07944037357644673, 'oob_split_ratio': 0.6564007106009709}. Best is trial 0 with value: inf.\n",
      "[I 2026-07-02 16:32:39,583] Trial 150 finished with value: inf and parameters: {'reservoir_size': 150, 'spectral_radius': 0.666535972918749, 'ar_lags': 2, 'foundation_window': 3, 'regressor_type': 'ElasticNet', 'reg_alpha': 1.4161483566666215, 'aci_step_size': 0.1889787989393689, 'oob_split_ratio': 0.608176777424048}. Best is trial 0 with value: inf.\n",
      "[I 2026-07-02 16:32:39,632] Trial 151 finished with value: inf and parameters: {'reservoir_size': 77, 'spectral_radius': 0.9666819190379892, 'ar_lags': 3, 'foundation_window': 4, 'regressor_type': 'Ridge', 'reg_alpha': 11.87176123571872, 'aci_step_size': 0.06330578329420221, 'oob_split_ratio': 0.8491778818365194}. Best is trial 0 with value: inf.\n",
      "[I 2026-07-02 16:32:39,674] Trial 152 finished with value: inf and parameters: {'reservoir_size': 68, 'spectral_radius': 1.0115448917777825, 'ar_lags': 3, 'foundation_window': 4, 'regressor_type': 'Ridge', 'reg_alpha': 12.894280119198582, 'aci_step_size': 0.03492605483168362, 'oob_split_ratio': 0.84273884817701}. Best is trial 0 with value: inf.\n",
      "[I 2026-07-02 16:32:39,712] Trial 153 finished with value: inf and parameters: {'reservoir_size': 92, 'spectral_radius': 1.0394183510843629, 'ar_lags': 3, 'foundation_window': 4, 'regressor_type': 'Ridge', 'reg_alpha': 9.716769759994602, 'aci_step_size': 0.1708297094300251, 'oob_split_ratio': 0.8428503089733916}. Best is trial 0 with value: inf.\n",
      "[I 2026-07-02 16:32:39,762] Trial 154 finished with value: inf and parameters: {'reservoir_size': 101, 'spectral_radius': 1.1661773090173098, 'ar_lags': 3, 'foundation_window': 4, 'regressor_type': 'Ridge', 'reg_alpha': 42.017352792076075, 'aci_step_size': 0.04994103964721634, 'oob_split_ratio': 0.6204188400336671}. Best is trial 0 with value: inf.\n",
      "[I 2026-07-02 16:32:39,814] Trial 155 finished with value: inf and parameters: {'reservoir_size': 88, 'spectral_radius': 1.4994905899440336, 'ar_lags': 4, 'foundation_window': 4, 'regressor_type': 'Ridge', 'reg_alpha': 6.490548736617836, 'aci_step_size': 0.04445472267938916, 'oob_split_ratio': 0.8376660533179615}. Best is trial 0 with value: inf.\n",
      "[I 2026-07-02 16:32:39,862] Trial 156 finished with value: inf and parameters: {'reservoir_size': 83, 'spectral_radius': 1.1033431841801922, 'ar_lags': 3, 'foundation_window': 6, 'regressor_type': 'Lasso', 'reg_alpha': 8.520428426807898, 'aci_step_size': 0.052954840466105595, 'oob_split_ratio': 0.8007858357498593}. Best is trial 0 with value: inf.\n",
      "[I 2026-07-02 16:32:39,906] Trial 157 finished with value: inf and parameters: {'reservoir_size': 109, 'spectral_radius': 1.4639646197157712, 'ar_lags': 2, 'foundation_window': 4, 'regressor_type': 'ElasticNet', 'reg_alpha': 17.496118952246164, 'aci_step_size': 0.12125879052915776, 'oob_split_ratio': 0.8287239329856709}. Best is trial 0 with value: inf.\n",
      "[I 2026-07-02 16:32:39,985] Trial 158 finished with value: inf and parameters: {'reservoir_size': 176, 'spectral_radius': 1.0878806560332013, 'ar_lags': 3, 'foundation_window': 5, 'regressor_type': 'Ridge', 'reg_alpha': 32.28497808407429, 'aci_step_size': 0.07605914322178195, 'oob_split_ratio': 0.83388327006698}. Best is trial 0 with value: inf.\n",
      "[I 2026-07-02 16:32:40,026] Trial 159 finished with value: inf and parameters: {'reservoir_size': 8, 'spectral_radius': 1.2386104505579443, 'ar_lags': 4, 'foundation_window': 6, 'regressor_type': 'Lasso', 'reg_alpha': 0.14334274678684494, 'aci_step_size': 0.01534093737432728, 'oob_split_ratio': 0.6314746096769046}. Best is trial 0 with value: inf.\n",
      "[I 2026-07-02 16:32:40,105] Trial 160 finished with value: inf and parameters: {'reservoir_size': 190, 'spectral_radius': 1.1333549993534815, 'ar_lags': 4, 'foundation_window': 4, 'regressor_type': 'Ridge', 'reg_alpha': 7.847120531960193, 'aci_step_size': 0.08728294743762245, 'oob_split_ratio': 0.8153147343330093}. Best is trial 0 with value: inf.\n",
      "[I 2026-07-02 16:32:40,166] Trial 161 finished with value: inf and parameters: {'reservoir_size': 1, 'spectral_radius': 1.3653991369995118, 'ar_lags': 4, 'foundation_window': 5, 'regressor_type': 'Lasso', 'reg_alpha': 15.012898748120213, 'aci_step_size': 0.15190937430451915, 'oob_split_ratio': 0.7313625236888388}. Best is trial 0 with value: inf.\n",
      "[I 2026-07-02 16:32:40,214] Trial 162 finished with value: inf and parameters: {'reservoir_size': 14, 'spectral_radius': 1.3347585061514786, 'ar_lags': 4, 'foundation_window': 5, 'regressor_type': 'Lasso', 'reg_alpha': 20.146838191946113, 'aci_step_size': 0.1570880796742405, 'oob_split_ratio': 0.7201699288969998}. Best is trial 0 with value: inf.\n",
      "[I 2026-07-02 16:32:40,249] Trial 163 finished with value: inf and parameters: {'reservoir_size': 6, 'spectral_radius': 0.6964717999601642, 'ar_lags': 4, 'foundation_window': 5, 'regressor_type': 'Lasso', 'reg_alpha': 3.092575004615137, 'aci_step_size': 0.1472333528747003, 'oob_split_ratio': 0.711822993652862}. Best is trial 0 with value: inf.\n",
      "[I 2026-07-02 16:32:40,279] Trial 164 finished with value: inf and parameters: {'reservoir_size': 74, 'spectral_radius': 1.3804243059590782, 'ar_lags': 4, 'foundation_window': 5, 'regressor_type': 'Lasso', 'reg_alpha': 3.6995431313515437, 'aci_step_size': 0.0946178299297657, 'oob_split_ratio': 0.7359982027083998}. Best is trial 0 with value: inf.\n",
      "[I 2026-07-02 16:32:40,311] Trial 165 finished with value: inf and parameters: {'reservoir_size': 81, 'spectral_radius': 1.425803566526586, 'ar_lags': 2, 'foundation_window': 5, 'regressor_type': 'Lasso', 'reg_alpha': 23.428324568580923, 'aci_step_size': 0.1385039142801613, 'oob_split_ratio': 0.755347820986521}. Best is trial 0 with value: inf.\n",
      "[I 2026-07-02 16:32:40,341] Trial 166 finished with value: inf and parameters: {'reservoir_size': 71, 'spectral_radius': 1.4045380932651572, 'ar_lags': 4, 'foundation_window': 3, 'regressor_type': 'ElasticNet', 'reg_alpha': 5.353325960845372, 'aci_step_size': 0.18408715174820534, 'oob_split_ratio': 0.7456150947361708}. Best is trial 0 with value: inf.\n",
      "[I 2026-07-02 16:32:40,369] Trial 167 finished with value: inf and parameters: {'reservoir_size': 30, 'spectral_radius': 1.4458866959744154, 'ar_lags': 4, 'foundation_window': 5, 'regressor_type': 'Lasso', 'reg_alpha': 28.101803826171448, 'aci_step_size': 0.02288923832412187, 'oob_split_ratio': 0.7070080400879025}. Best is trial 0 with value: inf.\n",
      "[I 2026-07-02 16:32:40,440] Trial 168 finished with value: inf and parameters: {'reservoir_size': 199, 'spectral_radius': 1.3042589520525607, 'ar_lags': 2, 'foundation_window': 6, 'regressor_type': 'Ridge', 'reg_alpha': 0.529281391334952, 'aci_step_size': 0.1608327417587344, 'oob_split_ratio': 0.776592091650748}. Best is trial 0 with value: inf.\n",
      "[I 2026-07-02 16:32:40,484] Trial 169 finished with value: inf and parameters: {'reservoir_size': 35, 'spectral_radius': 0.9795243000225973, 'ar_lags': 3, 'foundation_window': 3, 'regressor_type': 'ElasticNet', 'reg_alpha': 0.11450689414339484, 'aci_step_size': 0.10504677943119844, 'oob_split_ratio': 0.7229262252319567}. Best is trial 0 with value: inf.\n",
      "[I 2026-07-02 16:32:40,532] Trial 170 finished with value: inf and parameters: {'reservoir_size': 97, 'spectral_radius': 0.5951735048660092, 'ar_lags': 4, 'foundation_window': 5, 'regressor_type': 'Lasso', 'reg_alpha': 0.8162096320507778, 'aci_step_size': 0.010336851350006851, 'oob_split_ratio': 0.6787563717938633}. Best is trial 0 with value: inf.\n",
      "[I 2026-07-02 16:32:40,572] Trial 171 finished with value: inf and parameters: {'reservoir_size': 49, 'spectral_radius': 1.4539434972579037, 'ar_lags': 4, 'foundation_window': 3, 'regressor_type': 'Ridge', 'reg_alpha': 2.854640125791085, 'aci_step_size': 0.057540737140622064, 'oob_split_ratio': 0.671424556518566}. Best is trial 0 with value: inf.\n",
      "[I 2026-07-02 16:32:40,612] Trial 172 finished with value: inf and parameters: {'reservoir_size': 26, 'spectral_radius': 1.4750270424165692, 'ar_lags': 4, 'foundation_window': 3, 'regressor_type': 'Ridge', 'reg_alpha': 2.4242778011246027, 'aci_step_size': 0.07155048656024915, 'oob_split_ratio': 0.6614441354495434}. Best is trial 0 with value: inf.\n",
      "[I 2026-07-02 16:32:40,650] Trial 173 finished with value: inf and parameters: {'reservoir_size': 17, 'spectral_radius': 0.6289992870910533, 'ar_lags': 4, 'foundation_window': 3, 'regressor_type': 'Ridge', 'reg_alpha': 2.0028113087521557, 'aci_step_size': 0.08139604325186445, 'oob_split_ratio': 0.7000743011879232}. Best is trial 0 with value: inf.\n",
      "[I 2026-07-02 16:32:40,681] Trial 174 finished with value: inf and parameters: {'reservoir_size': 64, 'spectral_radius': 1.4223752536479826, 'ar_lags': 4, 'foundation_window': 3, 'regressor_type': 'Ridge', 'reg_alpha': 17.778848213243187, 'aci_step_size': 0.11242316586272316, 'oob_split_ratio': 0.6852947176646065}. Best is trial 0 with value: inf.\n",
      "[I 2026-07-02 16:32:40,711] Trial 175 finished with value: inf and parameters: {'reservoir_size': 57, 'spectral_radius': 1.3496173048056064, 'ar_lags': 2, 'foundation_window': 3, 'regressor_type': 'Ridge', 'reg_alpha': 4.170567635225466, 'aci_step_size': 0.06778802608068066, 'oob_split_ratio': 0.6731061750167449}. Best is trial 0 with value: inf.\n",
      "[I 2026-07-02 16:32:40,742] Trial 176 finished with value: inf and parameters: {'reservoir_size': 46, 'spectral_radius': 1.3953291145253046, 'ar_lags': 4, 'foundation_window': 4, 'regressor_type': 'ElasticNet', 'reg_alpha': 10.641974577313452, 'aci_step_size': 0.1660949983736843, 'oob_split_ratio': 0.6922359255912081}. Best is trial 0 with value: inf.\n",
      "[I 2026-07-02 16:32:40,791] Trial 177 finished with value: inf and parameters: {'reservoir_size': 144, 'spectral_radius': 0.7674873834908986, 'ar_lags': 4, 'foundation_window': 6, 'regressor_type': 'Lasso', 'reg_alpha': 3.2559624754064176, 'aci_step_size': 0.15392569527695157, 'oob_split_ratio': 0.76573715019959}. Best is trial 0 with value: inf.\n",
      "[I 2026-07-02 16:32:40,833] Trial 178 finished with value: inf and parameters: {'reservoir_size': 42, 'spectral_radius': 1.0578254913371956, 'ar_lags': 2, 'foundation_window': 3, 'regressor_type': 'Ridge', 'reg_alpha': 2.191513698990473, 'aci_step_size': 0.026205228871900663, 'oob_split_ratio': 0.616390409139467}. Best is trial 0 with value: inf.\n",
      "[I 2026-07-02 16:32:40,891] Trial 179 finished with value: inf and parameters: {'reservoir_size': 138, 'spectral_radius': 1.3711168437982075, 'ar_lags': 3, 'foundation_window': 6, 'regressor_type': 'Lasso', 'reg_alpha': 2.574781666464419, 'aci_step_size': 0.17800609577452053, 'oob_split_ratio': 0.8071371675831751}. Best is trial 0 with value: inf.\n",
